DROP TABLE IF EXISTS t1,t2,t3,t4;
CREATE TABLE t1(c1 YEAR NOT NULL,c2 YEAR, PRIMARY KEY(c1));
CREATE TABLE t2(c1 YEAR NOT NULL, c2 YEAR, UNIQUE INDEX idx(c1,c2));
CREATE TABLE t3(c1 YEAR(4) NOT NULL,c2 YEAR(4), PRIMARY KEY(c1));
CREATE TABLE t4(c1 YEAR(4), c2 YEAR(4), UNIQUE INDEX idx(c1,c2));
INSERT INTO t1 VALUES (1901,1901),(1970,1970),(1999,1999),(2000,2000),(2155,2155);
INSERT INTO t2 VALUES (1901,1901),(1970,1970),(1999,1999),(2000,2000),(2155,2155);
INSERT INTO t3 VALUES (1901,1901),(1970,1970),(1999,1999),(2000,2000),(2155,2155);
INSERT INTO t4 VALUES (1901,1901),(1970,1970),(1999,1999),(2000,2000),(2155,2155);
INSERT INTO t1 VALUES ('1902','1902'),('1971','1971'),('1998','1998'),('2001','2001'),('2154','2154');
INSERT INTO t2 VALUES ('1902','1902'),('1971','1971'),('1998','1998'),('2001','2001'),('2154','2154');
INSERT INTO t3 VALUES ('1902','1902'),('1971','1971'),('1998','1998'),('2001','2001'),('2154','2154');
INSERT INTO t4 VALUES ('1902','1902'),('1971','1971'),('1998','1998'),('2001','2001'),('2154','2154');
INSERT INTO t1 VALUES (04,04),(64,64),(69,69),(97,97);
INSERT INTO t2 VALUES (04,04),(64,64),(69,69),(97,97);
INSERT INTO t3 VALUES (04,04),(64,64),(69,69),(97,97);
INSERT INTO t4 VALUES (04,04),(64,64),(69,69),(97,97);
INSERT INTO t1 VALUES ('05','05'),('65','65'),('75','75'),('95','95');
INSERT INTO t2 VALUES ('05','05'),('65','65'),('75','75'),('95','95');
INSERT INTO t3 VALUES ('05','05'),('65','65'),('75','75'),('95','95');
INSERT INTO t4 VALUES ('05','05'),('65','65'),('75','75'),('95','95');
INSERT INTO t1 VALUES ('09',null),('61',null),('79',null),('96',null);
INSERT INTO t2 VALUES ('09',null),('61',null),('79',null),('96',null);
INSERT INTO t3 VALUES ('09',null),('61',null),('79',null),('96',null);
INSERT INTO t4 VALUES ('09',null),('61',null),('79',null),('96',null);
SELECT * FROM t1;
c1	c2
1901	1901
1902	1902
1970	1970
1971	1971
1975	1975
1979	NULL
1995	1995
1996	NULL
1997	1997
1998	1998
1999	1999
2000	2000
2001	2001
2004	2004
2005	2005
2009	NULL
2061	NULL
2064	2064
2065	2065
2069	2069
2154	2154
2155	2155
SELECT * FROM t2;
c1	c2
1901	1901
1902	1902
1970	1970
1971	1971
1975	1975
1979	NULL
1995	1995
1996	NULL
1997	1997
1998	1998
1999	1999
2000	2000
2001	2001
2004	2004
2005	2005
2009	NULL
2061	NULL
2064	2064
2065	2065
2069	2069
2154	2154
2155	2155
SELECT * FROM t3;
c1	c2
1901	1901
1902	1902
1970	1970
1971	1971
1975	1975
1979	NULL
1995	1995
1996	NULL
1997	1997
1998	1998
1999	1999
2000	2000
2001	2001
2004	2004
2005	2005
2009	NULL
2061	NULL
2064	2064
2065	2065
2069	2069
2154	2154
2155	2155
SELECT * FROM t4;
c1	c2
1901	1901
1902	1902
1970	1970
1971	1971
1975	1975
1979	NULL
1995	1995
1996	NULL
1997	1997
1998	1998
1999	1999
2000	2000
2001	2001
2004	2004
2005	2005
2009	NULL
2061	NULL
2064	2064
2065	2065
2069	2069
2154	2154
2155	2155
SELECT c1 FROM t1 WHERE c1='2005';
c1
2005
DELETE FROM t1 WHERE c1='2005';
SELECT c1 FROM t1;
c1
1901
1902
1970
1971
1975
1979
1995
1996
1997
1998
1999
2000
2001
2004
2009
2061
2064
2065
2069
2154
2155
SELECT c2 FROM t2 WHERE c2=null;
c2
DELETE FROM t2 WHERE c2=null LIMIT 2;
SELECT c2 FROM t2;
c2
1901
1902
1970
1971
1975
1995
1997
1998
1999
2000
2001
2004
2005
2064
2065
2069
2154
2155
NULL
NULL
NULL
NULL
SELECT c1 FROM t4 WHERE c1 < '55';
c1
1901
1902
1970
1971
1975
1979
1995
1996
1997
1998
1999
2000
2001
2004
2005
2009
DELETE FROM t4 WHERE c1 < '65' ORDER BY c1 LIMIT 5;
SELECT c1 FROM t4;
c1
1979
1995
1996
1997
1998
1999
2000
2001
2004
2005
2009
2061
2064
2065
2069
2154
2155
DELETE FROM t2 WHERE c1=2009 AND c2=null;
SELECT c2 FROM t2;
c2
1901
1902
1970
1971
1975
1995
1997
1998
1999
2000
2001
2004
2005
2064
2065
2069
2154
2155
NULL
NULL
NULL
NULL
DELETE FROM t1 WHERE c1=1979 OR c1=2154;
SELECT c2 FROM t1;
c2
1901
1902
1970
1971
1975
1995
1997
1998
1999
2000
2001
2004
2064
2065
2069
2155
NULL
NULL
NULL
DELETE FROM t4 WHERE c2 IN (01,54,65,69,null) LIMIT 2;
SELECT c1 FROM t4;
c1
1979
1995
1996
1997
1998
1999
2000
2001
2004
2005
2009
2061
2064
2065
2069
2154
2155
Before Delete
SELECT * FROM t3, t4;
c1	c2	c1	c2
1901	1901	1979	NULL
1901	1901	1995	1995
1901	1901	1996	NULL
1901	1901	1997	1997
1901	1901	1998	1998
1901	1901	1999	1999
1901	1901	2000	2000
1901	1901	2001	2001
1901	1901	2004	2004
1901	1901	2005	2005
1901	1901	2009	NULL
1901	1901	2061	NULL
1901	1901	2064	2064
1901	1901	2065	2065
1901	1901	2069	2069
1901	1901	2154	2154
1901	1901	2155	2155
1902	1902	1979	NULL
1902	1902	1995	1995
1902	1902	1996	NULL
1902	1902	1997	1997
1902	1902	1998	1998
1902	1902	1999	1999
1902	1902	2000	2000
1902	1902	2001	2001
1902	1902	2004	2004
1902	1902	2005	2005
1902	1902	2009	NULL
1902	1902	2061	NULL
1902	1902	2064	2064
1902	1902	2065	2065
1902	1902	2069	2069
1902	1902	2154	2154
1902	1902	2155	2155
1970	1970	1979	NULL
1970	1970	1995	1995
1970	1970	1996	NULL
1970	1970	1997	1997
1970	1970	1998	1998
1970	1970	1999	1999
1970	1970	2000	2000
1970	1970	2001	2001
1970	1970	2004	2004
1970	1970	2005	2005
1970	1970	2009	NULL
1970	1970	2061	NULL
1970	1970	2064	2064
1970	1970	2065	2065
1970	1970	2069	2069
1970	1970	2154	2154
1970	1970	2155	2155
1971	1971	1979	NULL
1971	1971	1995	1995
1971	1971	1996	NULL
1971	1971	1997	1997
1971	1971	1998	1998
1971	1971	1999	1999
1971	1971	2000	2000
1971	1971	2001	2001
1971	1971	2004	2004
1971	1971	2005	2005
1971	1971	2009	NULL
1971	1971	2061	NULL
1971	1971	2064	2064
1971	1971	2065	2065
1971	1971	2069	2069
1971	1971	2154	2154
1971	1971	2155	2155
1975	1975	1979	NULL
1975	1975	1995	1995
1975	1975	1996	NULL
1975	1975	1997	1997
1975	1975	1998	1998
1975	1975	1999	1999
1975	1975	2000	2000
1975	1975	2001	2001
1975	1975	2004	2004
1975	1975	2005	2005
1975	1975	2009	NULL
1975	1975	2061	NULL
1975	1975	2064	2064
1975	1975	2065	2065
1975	1975	2069	2069
1975	1975	2154	2154
1975	1975	2155	2155
1979	NULL	1979	NULL
1979	NULL	1995	1995
1979	NULL	1996	NULL
1979	NULL	1997	1997
1979	NULL	1998	1998
1979	NULL	1999	1999
1979	NULL	2000	2000
1979	NULL	2001	2001
1979	NULL	2004	2004
1979	NULL	2005	2005
1979	NULL	2009	NULL
1979	NULL	2061	NULL
1979	NULL	2064	2064
1979	NULL	2065	2065
1979	NULL	2069	2069
1979	NULL	2154	2154
1979	NULL	2155	2155
1995	1995	1979	NULL
1995	1995	1995	1995
1995	1995	1996	NULL
1995	1995	1997	1997
1995	1995	1998	1998
1995	1995	1999	1999
1995	1995	2000	2000
1995	1995	2001	2001
1995	1995	2004	2004
1995	1995	2005	2005
1995	1995	2009	NULL
1995	1995	2061	NULL
1995	1995	2064	2064
1995	1995	2065	2065
1995	1995	2069	2069
1995	1995	2154	2154
1995	1995	2155	2155
1996	NULL	1979	NULL
1996	NULL	1995	1995
1996	NULL	1996	NULL
1996	NULL	1997	1997
1996	NULL	1998	1998
1996	NULL	1999	1999
1996	NULL	2000	2000
1996	NULL	2001	2001
1996	NULL	2004	2004
1996	NULL	2005	2005
1996	NULL	2009	NULL
1996	NULL	2061	NULL
1996	NULL	2064	2064
1996	NULL	2065	2065
1996	NULL	2069	2069
1996	NULL	2154	2154
1996	NULL	2155	2155
1997	1997	1979	NULL
1997	1997	1995	1995
1997	1997	1996	NULL
1997	1997	1997	1997
1997	1997	1998	1998
1997	1997	1999	1999
1997	1997	2000	2000
1997	1997	2001	2001
1997	1997	2004	2004
1997	1997	2005	2005
1997	1997	2009	NULL
1997	1997	2061	NULL
1997	1997	2064	2064
1997	1997	2065	2065
1997	1997	2069	2069
1997	1997	2154	2154
1997	1997	2155	2155
1998	1998	1979	NULL
1998	1998	1995	1995
1998	1998	1996	NULL
1998	1998	1997	1997
1998	1998	1998	1998
1998	1998	1999	1999
1998	1998	2000	2000
1998	1998	2001	2001
1998	1998	2004	2004
1998	1998	2005	2005
1998	1998	2009	NULL
1998	1998	2061	NULL
1998	1998	2064	2064
1998	1998	2065	2065
1998	1998	2069	2069
1998	1998	2154	2154
1998	1998	2155	2155
1999	1999	1979	NULL
1999	1999	1995	1995
1999	1999	1996	NULL
1999	1999	1997	1997
1999	1999	1998	1998
1999	1999	1999	1999
1999	1999	2000	2000
1999	1999	2001	2001
1999	1999	2004	2004
1999	1999	2005	2005
1999	1999	2009	NULL
1999	1999	2061	NULL
1999	1999	2064	2064
1999	1999	2065	2065
1999	1999	2069	2069
1999	1999	2154	2154
1999	1999	2155	2155
2000	2000	1979	NULL
2000	2000	1995	1995
2000	2000	1996	NULL
2000	2000	1997	1997
2000	2000	1998	1998
2000	2000	1999	1999
2000	2000	2000	2000
2000	2000	2001	2001
2000	2000	2004	2004
2000	2000	2005	2005
2000	2000	2009	NULL
2000	2000	2061	NULL
2000	2000	2064	2064
2000	2000	2065	2065
2000	2000	2069	2069
2000	2000	2154	2154
2000	2000	2155	2155
2001	2001	1979	NULL
2001	2001	1995	1995
2001	2001	1996	NULL
2001	2001	1997	1997
2001	2001	1998	1998
2001	2001	1999	1999
2001	2001	2000	2000
2001	2001	2001	2001
2001	2001	2004	2004
2001	2001	2005	2005
2001	2001	2009	NULL
2001	2001	2061	NULL
2001	2001	2064	2064
2001	2001	2065	2065
2001	2001	2069	2069
2001	2001	2154	2154
2001	2001	2155	2155
2004	2004	1979	NULL
2004	2004	1995	1995
2004	2004	1996	NULL
2004	2004	1997	1997
2004	2004	1998	1998
2004	2004	1999	1999
2004	2004	2000	2000
2004	2004	2001	2001
2004	2004	2004	2004
2004	2004	2005	2005
2004	2004	2009	NULL
2004	2004	2061	NULL
2004	2004	2064	2064
2004	2004	2065	2065
2004	2004	2069	2069
2004	2004	2154	2154
2004	2004	2155	2155
2005	2005	1979	NULL
2005	2005	1995	1995
2005	2005	1996	NULL
2005	2005	1997	1997
2005	2005	1998	1998
2005	2005	1999	1999
2005	2005	2000	2000
2005	2005	2001	2001
2005	2005	2004	2004
2005	2005	2005	2005
2005	2005	2009	NULL
2005	2005	2061	NULL
2005	2005	2064	2064
2005	2005	2065	2065
2005	2005	2069	2069
2005	2005	2154	2154
2005	2005	2155	2155
2009	NULL	1979	NULL
2009	NULL	1995	1995
2009	NULL	1996	NULL
2009	NULL	1997	1997
2009	NULL	1998	1998
2009	NULL	1999	1999
2009	NULL	2000	2000
2009	NULL	2001	2001
2009	NULL	2004	2004
2009	NULL	2005	2005
2009	NULL	2009	NULL
2009	NULL	2061	NULL
2009	NULL	2064	2064
2009	NULL	2065	2065
2009	NULL	2069	2069
2009	NULL	2154	2154
2009	NULL	2155	2155
2061	NULL	1979	NULL
2061	NULL	1995	1995
2061	NULL	1996	NULL
2061	NULL	1997	1997
2061	NULL	1998	1998
2061	NULL	1999	1999
2061	NULL	2000	2000
2061	NULL	2001	2001
2061	NULL	2004	2004
2061	NULL	2005	2005
2061	NULL	2009	NULL
2061	NULL	2061	NULL
2061	NULL	2064	2064
2061	NULL	2065	2065
2061	NULL	2069	2069
2061	NULL	2154	2154
2061	NULL	2155	2155
2064	2064	1979	NULL
2064	2064	1995	1995
2064	2064	1996	NULL
2064	2064	1997	1997
2064	2064	1998	1998
2064	2064	1999	1999
2064	2064	2000	2000
2064	2064	2001	2001
2064	2064	2004	2004
2064	2064	2005	2005
2064	2064	2009	NULL
2064	2064	2061	NULL
2064	2064	2064	2064
2064	2064	2065	2065
2064	2064	2069	2069
2064	2064	2154	2154
2064	2064	2155	2155
2065	2065	1979	NULL
2065	2065	1995	1995
2065	2065	1996	NULL
2065	2065	1997	1997
2065	2065	1998	1998
2065	2065	1999	1999
2065	2065	2000	2000
2065	2065	2001	2001
2065	2065	2004	2004
2065	2065	2005	2005
2065	2065	2009	NULL
2065	2065	2061	NULL
2065	2065	2064	2064
2065	2065	2065	2065
2065	2065	2069	2069
2065	2065	2154	2154
2065	2065	2155	2155
2069	2069	1979	NULL
2069	2069	1995	1995
2069	2069	1996	NULL
2069	2069	1997	1997
2069	2069	1998	1998
2069	2069	1999	1999
2069	2069	2000	2000
2069	2069	2001	2001
2069	2069	2004	2004
2069	2069	2005	2005
2069	2069	2009	NULL
2069	2069	2061	NULL
2069	2069	2064	2064
2069	2069	2065	2065
2069	2069	2069	2069
2069	2069	2154	2154
2069	2069	2155	2155
2154	2154	1979	NULL
2154	2154	1995	1995
2154	2154	1996	NULL
2154	2154	1997	1997
2154	2154	1998	1998
2154	2154	1999	1999
2154	2154	2000	2000
2154	2154	2001	2001
2154	2154	2004	2004
2154	2154	2005	2005
2154	2154	2009	NULL
2154	2154	2061	NULL
2154	2154	2064	2064
2154	2154	2065	2065
2154	2154	2069	2069
2154	2154	2154	2154
2154	2154	2155	2155
2155	2155	1979	NULL
2155	2155	1995	1995
2155	2155	1996	NULL
2155	2155	1997	1997
2155	2155	1998	1998
2155	2155	1999	1999
2155	2155	2000	2000
2155	2155	2001	2001
2155	2155	2004	2004
2155	2155	2005	2005
2155	2155	2009	NULL
2155	2155	2061	NULL
2155	2155	2064	2064
2155	2155	2065	2065
2155	2155	2069	2069
2155	2155	2154	2154
2155	2155	2155	2155
DELETE t3,t4 FROM t3,t4 WHERE t3.c1=2061 AND t4.c2=2004;
After Delete
SELECT * FROM t3, t4;
c1	c2	c1	c2
1901	1901	1979	NULL
1901	1901	1995	1995
1901	1901	1996	NULL
1901	1901	1997	1997
1901	1901	1998	1998
1901	1901	1999	1999
1901	1901	2000	2000
1901	1901	2001	2001
1901	1901	2005	2005
1901	1901	2009	NULL
1901	1901	2061	NULL
1901	1901	2064	2064
1901	1901	2065	2065
1901	1901	2069	2069
1901	1901	2154	2154
1901	1901	2155	2155
1902	1902	1979	NULL
1902	1902	1995	1995
1902	1902	1996	NULL
1902	1902	1997	1997
1902	1902	1998	1998
1902	1902	1999	1999
1902	1902	2000	2000
1902	1902	2001	2001
1902	1902	2005	2005
1902	1902	2009	NULL
1902	1902	2061	NULL
1902	1902	2064	2064
1902	1902	2065	2065
1902	1902	2069	2069
1902	1902	2154	2154
1902	1902	2155	2155
1970	1970	1979	NULL
1970	1970	1995	1995
1970	1970	1996	NULL
1970	1970	1997	1997
1970	1970	1998	1998
1970	1970	1999	1999
1970	1970	2000	2000
1970	1970	2001	2001
1970	1970	2005	2005
1970	1970	2009	NULL
1970	1970	2061	NULL
1970	1970	2064	2064
1970	1970	2065	2065
1970	1970	2069	2069
1970	1970	2154	2154
1970	1970	2155	2155
1971	1971	1979	NULL
1971	1971	1995	1995
1971	1971	1996	NULL
1971	1971	1997	1997
1971	1971	1998	1998
1971	1971	1999	1999
1971	1971	2000	2000
1971	1971	2001	2001
1971	1971	2005	2005
1971	1971	2009	NULL
1971	1971	2061	NULL
1971	1971	2064	2064
1971	1971	2065	2065
1971	1971	2069	2069
1971	1971	2154	2154
1971	1971	2155	2155
1975	1975	1979	NULL
1975	1975	1995	1995
1975	1975	1996	NULL
1975	1975	1997	1997
1975	1975	1998	1998
1975	1975	1999	1999
1975	1975	2000	2000
1975	1975	2001	2001
1975	1975	2005	2005
1975	1975	2009	NULL
1975	1975	2061	NULL
1975	1975	2064	2064
1975	1975	2065	2065
1975	1975	2069	2069
1975	1975	2154	2154
1975	1975	2155	2155
1979	NULL	1979	NULL
1979	NULL	1995	1995
1979	NULL	1996	NULL
1979	NULL	1997	1997
1979	NULL	1998	1998
1979	NULL	1999	1999
1979	NULL	2000	2000
1979	NULL	2001	2001
1979	NULL	2005	2005
1979	NULL	2009	NULL
1979	NULL	2061	NULL
1979	NULL	2064	2064
1979	NULL	2065	2065
1979	NULL	2069	2069
1979	NULL	2154	2154
1979	NULL	2155	2155
1995	1995	1979	NULL
1995	1995	1995	1995
1995	1995	1996	NULL
1995	1995	1997	1997
1995	1995	1998	1998
1995	1995	1999	1999
1995	1995	2000	2000
1995	1995	2001	2001
1995	1995	2005	2005
1995	1995	2009	NULL
1995	1995	2061	NULL
1995	1995	2064	2064
1995	1995	2065	2065
1995	1995	2069	2069
1995	1995	2154	2154
1995	1995	2155	2155
1996	NULL	1979	NULL
1996	NULL	1995	1995
1996	NULL	1996	NULL
1996	NULL	1997	1997
1996	NULL	1998	1998
1996	NULL	1999	1999
1996	NULL	2000	2000
1996	NULL	2001	2001
1996	NULL	2005	2005
1996	NULL	2009	NULL
1996	NULL	2061	NULL
1996	NULL	2064	2064
1996	NULL	2065	2065
1996	NULL	2069	2069
1996	NULL	2154	2154
1996	NULL	2155	2155
1997	1997	1979	NULL
1997	1997	1995	1995
1997	1997	1996	NULL
1997	1997	1997	1997
1997	1997	1998	1998
1997	1997	1999	1999
1997	1997	2000	2000
1997	1997	2001	2001
1997	1997	2005	2005
1997	1997	2009	NULL
1997	1997	2061	NULL
1997	1997	2064	2064
1997	1997	2065	2065
1997	1997	2069	2069
1997	1997	2154	2154
1997	1997	2155	2155
1998	1998	1979	NULL
1998	1998	1995	1995
1998	1998	1996	NULL
1998	1998	1997	1997
1998	1998	1998	1998
1998	1998	1999	1999
1998	1998	2000	2000
1998	1998	2001	2001
1998	1998	2005	2005
1998	1998	2009	NULL
1998	1998	2061	NULL
1998	1998	2064	2064
1998	1998	2065	2065
1998	1998	2069	2069
1998	1998	2154	2154
1998	1998	2155	2155
1999	1999	1979	NULL
1999	1999	1995	1995
1999	1999	1996	NULL
1999	1999	1997	1997
1999	1999	1998	1998
1999	1999	1999	1999
1999	1999	2000	2000
1999	1999	2001	2001
1999	1999	2005	2005
1999	1999	2009	NULL
1999	1999	2061	NULL
1999	1999	2064	2064
1999	1999	2065	2065
1999	1999	2069	2069
1999	1999	2154	2154
1999	1999	2155	2155
2000	2000	1979	NULL
2000	2000	1995	1995
2000	2000	1996	NULL
2000	2000	1997	1997
2000	2000	1998	1998
2000	2000	1999	1999
2000	2000	2000	2000
2000	2000	2001	2001
2000	2000	2005	2005
2000	2000	2009	NULL
2000	2000	2061	NULL
2000	2000	2064	2064
2000	2000	2065	2065
2000	2000	2069	2069
2000	2000	2154	2154
2000	2000	2155	2155
2001	2001	1979	NULL
2001	2001	1995	1995
2001	2001	1996	NULL
2001	2001	1997	1997
2001	2001	1998	1998
2001	2001	1999	1999
2001	2001	2000	2000
2001	2001	2001	2001
2001	2001	2005	2005
2001	2001	2009	NULL
2001	2001	2061	NULL
2001	2001	2064	2064
2001	2001	2065	2065
2001	2001	2069	2069
2001	2001	2154	2154
2001	2001	2155	2155
2004	2004	1979	NULL
2004	2004	1995	1995
2004	2004	1996	NULL
2004	2004	1997	1997
2004	2004	1998	1998
2004	2004	1999	1999
2004	2004	2000	2000
2004	2004	2001	2001
2004	2004	2005	2005
2004	2004	2009	NULL
2004	2004	2061	NULL
2004	2004	2064	2064
2004	2004	2065	2065
2004	2004	2069	2069
2004	2004	2154	2154
2004	2004	2155	2155
2005	2005	1979	NULL
2005	2005	1995	1995
2005	2005	1996	NULL
2005	2005	1997	1997
2005	2005	1998	1998
2005	2005	1999	1999
2005	2005	2000	2000
2005	2005	2001	2001
2005	2005	2005	2005
2005	2005	2009	NULL
2005	2005	2061	NULL
2005	2005	2064	2064
2005	2005	2065	2065
2005	2005	2069	2069
2005	2005	2154	2154
2005	2005	2155	2155
2009	NULL	1979	NULL
2009	NULL	1995	1995
2009	NULL	1996	NULL
2009	NULL	1997	1997
2009	NULL	1998	1998
2009	NULL	1999	1999
2009	NULL	2000	2000
2009	NULL	2001	2001
2009	NULL	2005	2005
2009	NULL	2009	NULL
2009	NULL	2061	NULL
2009	NULL	2064	2064
2009	NULL	2065	2065
2009	NULL	2069	2069
2009	NULL	2154	2154
2009	NULL	2155	2155
2064	2064	1979	NULL
2064	2064	1995	1995
2064	2064	1996	NULL
2064	2064	1997	1997
2064	2064	1998	1998
2064	2064	1999	1999
2064	2064	2000	2000
2064	2064	2001	2001
2064	2064	2005	2005
2064	2064	2009	NULL
2064	2064	2061	NULL
2064	2064	2064	2064
2064	2064	2065	2065
2064	2064	2069	2069
2064	2064	2154	2154
2064	2064	2155	2155
2065	2065	1979	NULL
2065	2065	1995	1995
2065	2065	1996	NULL
2065	2065	1997	1997
2065	2065	1998	1998
2065	2065	1999	1999
2065	2065	2000	2000
2065	2065	2001	2001
2065	2065	2005	2005
2065	2065	2009	NULL
2065	2065	2061	NULL
2065	2065	2064	2064
2065	2065	2065	2065
2065	2065	2069	2069
2065	2065	2154	2154
2065	2065	2155	2155
2069	2069	1979	NULL
2069	2069	1995	1995
2069	2069	1996	NULL
2069	2069	1997	1997
2069	2069	1998	1998
2069	2069	1999	1999
2069	2069	2000	2000
2069	2069	2001	2001
2069	2069	2005	2005
2069	2069	2009	NULL
2069	2069	2061	NULL
2069	2069	2064	2064
2069	2069	2065	2065
2069	2069	2069	2069
2069	2069	2154	2154
2069	2069	2155	2155
2154	2154	1979	NULL
2154	2154	1995	1995
2154	2154	1996	NULL
2154	2154	1997	1997
2154	2154	1998	1998
2154	2154	1999	1999
2154	2154	2000	2000
2154	2154	2001	2001
2154	2154	2005	2005
2154	2154	2009	NULL
2154	2154	2061	NULL
2154	2154	2064	2064
2154	2154	2065	2065
2154	2154	2069	2069
2154	2154	2154	2154
2154	2154	2155	2155
2155	2155	1979	NULL
2155	2155	1995	1995
2155	2155	1996	NULL
2155	2155	1997	1997
2155	2155	1998	1998
2155	2155	1999	1999
2155	2155	2000	2000
2155	2155	2001	2001
2155	2155	2005	2005
2155	2155	2009	NULL
2155	2155	2061	NULL
2155	2155	2064	2064
2155	2155	2065	2065
2155	2155	2069	2069
2155	2155	2154	2154
2155	2155	2155	2155
DELETE FROM t1 WHERE c1=2064 AND c2=2064;
SELECT * FROM t1;
c1	c2
1901	1901
1902	1902
1970	1970
1971	1971
1975	1975
1995	1995
1996	NULL
1997	1997
1998	1998
1999	1999
2000	2000
2001	2001
2004	2004
2009	NULL
2061	NULL
2065	2065
2069	2069
2155	2155
DELETE FROM t1 WHERE c1 BETWEEN 2000 AND 2010 ORDER BY c1 LIMIT 2;
SELECT * FROM t1;
c1	c2
1901	1901
1902	1902
1970	1970
1971	1971
1975	1975
1995	1995
1996	NULL
1997	1997
1998	1998
1999	1999
2004	2004
2009	NULL
2061	NULL
2065	2065
2069	2069
2155	2155
DELETE FROM t1 WHERE c1 IN (2155,2009,1975) ORDER BY c1 LIMIT 2;
SELECT * FROM t1;
c1	c2
1901	1901
1902	1902
1970	1970
1971	1971
1995	1995
1996	NULL
1997	1997
1998	1998
1999	1999
2004	2004
2061	NULL
2065	2065
2069	2069
2155	2155
DELETE t1,t2 FROM t1,t2 WHERE t1.c1=t2.c1 AND t1.c2=t2.c2;
SELECT * FROM t1;
c1	c2
1996	NULL
2061	NULL
SELECT * FROM t2;
c1	c2
1975	1975
1979	NULL
1996	NULL
2000	2000
2001	2001
2005	2005
2009	NULL
2061	NULL
2064	2064
2154	2154
SELECT * FROM t3;
c1	c2
1901	1901
1902	1902
1970	1970
1971	1971
1975	1975
1979	NULL
1995	1995
1996	NULL
1997	1997
1998	1998
1999	1999
2000	2000
2001	2001
2004	2004
2005	2005
2009	NULL
2064	2064
2065	2065
2069	2069
2154	2154
2155	2155
SELECT * FROM t4;
c1	c2
1979	NULL
1995	1995
1996	NULL
1997	1997
1998	1998
1999	1999
2000	2000
2001	2001
2005	2005
2009	NULL
2061	NULL
2064	2064
2065	2065
2069	2069
2154	2154
2155	2155
DROP TABLE IF EXISTS t1,t2,t3,t4;
