DROP TABLE IF EXISTS t1;
Warnings:
Note	1051	Unknown table 'test.t1'
CREATE TABLE t1 (c1 INT NOT NULL AUTO_INCREMENT, c2 INT, PRIMARY KEY(c1));
INSERT INTO t1 (c2) VALUES (1), (1), (2), (3), (5), (8), (13), (21), (34), (55), (89), (144), (233), (377);
SELECT * FROM t1 ORDER BY c1;
c1	c2
1	1
2	1
3	2
4	3
5	5
6	8
7	13
8	21
9	34
10	55
11	89
12	144
13	233
14	377
DELETE FROM t1 WHERE c2 < 15;
INSERT INTO t1 (c2) VALUES (610);
INSERT INTO t1 VALUES (99, 987);
INSERT INTO t1 (c2) VALUES (1597);
SELECT * FROM t1 ORDER BY c1;
c1	c2
8	21
9	34
10	55
11	89
12	144
13	233
14	377
15	610
99	987
100	1597
DROP TABLE IF EXISTS t1;
DROP TABLE IF EXISTS t1;
Warnings:
Note	1051	Unknown table 'test.t1'
CREATE TABLE t1 (c1 INT NOT NULL AUTO_INCREMENT, c2 INT, PRIMARY KEY(c1));
INSERT INTO t1 (c2) VALUES (1), (1), (2), (3), (5), (8), (13), (21), (34), (55), (89), (144), (233), (377);
SELECT * FROM t1 ORDER BY c1;
c1	c2
1	1
2	1
3	2
4	3
5	5
6	8
7	13
8	21
9	34
10	55
11	89
12	144
13	233
14	377
DELETE FROM t1 WHERE c2 < 15;
INSERT INTO t1 VALUES (5, 987);
INSERT INTO t1 (c2) VALUES (1597);
SELECT * FROM t1 ORDER BY c1;
c1	c2
5	987
8	21
9	34
10	55
11	89
12	144
13	233
14	377
15	1597
DROP TABLE IF EXISTS t1;
DROP TABLE IF EXISTS t1;
Warnings:
Note	1051	Unknown table 'test.t1'
CREATE TABLE t1 (c1 INT NOT NULL AUTO_INCREMENT, c2 INT, PRIMARY KEY(c1));
INSERT INTO t1 (c2) VALUES (1), (1), (2), (3), (5), (8), (13), (21), (34), (55), (89), (144), (233), (377);
SELECT * FROM t1 ORDER BY c1;
c1	c2
1	1
2	1
3	2
4	3
5	5
6	8
7	13
8	21
9	34
10	55
11	89
12	144
13	233
14	377
DELETE FROM t1 WHERE c2 < 15;
set insert_id=5;
INSERT INTO t1 (c2) VALUES (100), (101), (102);
INSERT INTO t1 (c2) VALUES (200);
SELECT * FROM t1 ORDER BY c1;
c1	c2
5	100
6	101
7	102
8	21
9	34
10	55
11	89
12	144
13	233
14	377
15	200
DROP TABLE IF EXISTS t1;
DROP TABLE IF EXISTS t1;
Warnings:
Note	1051	Unknown table 'test.t1'
CREATE TABLE t1 (c1 INT NOT NULL AUTO_INCREMENT, c2 INT, PRIMARY KEY(c1));
INSERT INTO t1 (c2) VALUES (101), (102), (103);
SELECT * FROM t1 ORDER BY c1;
c1	c2
1	101
2	102
3	103
set insert_id=0;
INSERT INTO t1 (c2) VALUES (100);
SELECT * FROM t1 ORDER BY c1;
c1	c2
0	100
1	101
2	102
3	103
DROP TABLE IF EXISTS t1;
