DROP TABLE IF EXISTS t1;
Warnings:
Note	1051	Unknown table 'test.t1'
DROP TABLE IF EXISTS t2;
Warnings:
Note	1051	Unknown table 'test.t2'
CREATE TABLE t1 (c1 INT, PRIMARY KEY(c1));
CREATE TABLE t2 (c1 INT, c2 INT,
FOREIGN KEY(c2) REFERENCES t1(c1)
ON DELETE CASCADE
ON UPDATE CASCADE);
INSERT INTO t1 VALUES (1), (2), (3), (4), (5);
INSERT INTO t2 VALUES (1,1), (2,2), (3,3), (4,4), (5,5), (6,6);
SELECT * FROM t1 ORDER BY c1;
c1
1
2
3
4
5
SELECT * FROM t2 ORDER BY c1;
c1	c2
1	1
2	2
3	3
4	4
5	5
6	6
DELETE FROM t2 WHERE c2 = 1;
SELECT * FROM t1 ORDER BY c1;
c1
1
2
3
4
5
SELECT * FROM t2 ORDER BY c1;
c1	c2
2	2
3	3
4	4
5	5
6	6
UPDATE t2 SET c2 = 99
WHERE c1 = 2;
SELECT * FROM t1 ORDER BY c1;
c1
1
2
3
4
5
SELECT * FROM t2 ORDER BY c1;
c1	c2
2	99
3	3
4	4
5	5
6	6
DROP TABLE IF EXISTS t1;
DROP TABLE IF EXISTS t2;
