DROP TABLE IF EXISTS t1;
CREATE TABLE t1(c1 INT SIGNED NOT NULL );
INSERT INTO t1 VALUES
(-2147483648),
(0),
(0),
(0),
(0),
(1073741824 - 2),
(1073741824 - 1),
(1073741824),
(1073741824),
(1073741824 + 1),
(1073741824 + 2),
(2147483647);
SELECT * FROM t1 ORDER BY c1 ASC;
c1
-2147483648
0
0
0
0
1073741822
1073741823
1073741824
1073741824
1073741825
1073741826
2147483647
SELECT * FROM t1 ORDER BY c1 DESC;
c1
2147483647
1073741826
1073741825
1073741824
1073741824
1073741823
1073741822
0
0
0
0
-2147483648
SELECT * FROM t1 WHERE c1 >  1073741824 ORDER BY c1 ASC;
c1
1073741825
1073741826
2147483647
SELECT * FROM t1 WHERE c1 >= 1073741824 ORDER BY c1 ASC;
c1
1073741824
1073741824
1073741825
1073741826
2147483647
SELECT * FROM t1 WHERE c1 <  1073741824 ORDER BY c1 ASC;
c1
-2147483648
0
0
0
0
1073741822
1073741823
SELECT * FROM t1 WHERE c1 <= 1073741824 ORDER BY c1 ASC;
c1
-2147483648
0
0
0
0
1073741822
1073741823
1073741824
1073741824
SELECT * FROM t1 WHERE c1 =  1073741824 ORDER BY c1 ASC;
c1
1073741824
1073741824
SELECT * FROM t1 WHERE c1 >  1073741824 ORDER BY c1 DESC;
c1
2147483647
1073741826
1073741825
SELECT * FROM t1 WHERE c1 >= 1073741824 ORDER BY c1 DESC;
c1
2147483647
1073741826
1073741825
1073741824
1073741824
SELECT * FROM t1 WHERE c1 <  1073741824 ORDER BY c1 DESC;
c1
1073741823
1073741822
0
0
0
0
-2147483648
SELECT * FROM t1 WHERE c1 <= 1073741824 ORDER BY c1 DESC;
c1
1073741824
1073741824
1073741823
1073741822
0
0
0
0
-2147483648
SELECT * FROM t1 WHERE c1 =  1073741824 ORDER BY c1 DESC;
c1
1073741824
1073741824
UPDATE t1
SET c1 = 1073741824
WHERE c1 <= 0 + 0 AND c1 >= 0 - 0
ORDER BY c1 ASC
LIMIT 2;
SELECT * FROM t1 ORDER BY c1;
c1
-2147483648
0
0
1073741822
1073741823
1073741824
1073741824
1073741824
1073741824
1073741825
1073741826
2147483647
DELETE FROM t1
WHERE c1 <= 0 + 0 AND c1 >= 0 - 0
ORDER BY c1;
SELECT * FROM t1 ORDER BY c1;
c1
-2147483648
1073741822
1073741823
1073741824
1073741824
1073741824
1073741824
1073741825
1073741826
2147483647
DROP TABLE t1;
CREATE TABLE t1(c1 INT SIGNED NOT NULL, c2 INT SIGNED NOT NULL );
INSERT INTO t1 VALUES
(-2147483648, -2147483648),
(0, 0),
(0, 0),
(0, 0),
(0, 0),
(1073741824, 1073741824 - 2),
(1073741824, 1073741824 - 1),
(1073741824, 1073741824),
(1073741824, 1073741824),
(1073741824, 1073741824 + 1),
(1073741824, 1073741824 + 2),
(2147483647, 2147483647);
SELECT * FROM t1 WHERE c1 = 1073741824 AND c2 > 1073741824 ORDER BY c2 ASC;
c1	c2
1073741824	1073741825
1073741824	1073741826
SELECT * FROM t1 WHERE c1 = 1073741824 AND c2 >= 1073741824 ORDER BY c2 ASC;
c1	c2
1073741824	1073741824
1073741824	1073741824
1073741824	1073741825
1073741824	1073741826
SELECT * FROM t1 WHERE c1 = 1073741824 AND c2 < 1073741824 ORDER BY c2 ASC;
c1	c2
1073741824	1073741822
1073741824	1073741823
SELECT * FROM t1 WHERE c1 = 1073741824 AND c2 <= 1073741824 ORDER BY c2 ASC;
c1	c2
1073741824	1073741822
1073741824	1073741823
1073741824	1073741824
1073741824	1073741824
SELECT * FROM t1 WHERE c1 = 1073741824 AND c2 > 1073741824 ORDER BY c2 DESC;
c1	c2
1073741824	1073741826
1073741824	1073741825
SELECT * FROM t1 WHERE c1 = 1073741824 AND c2 >= 1073741824 ORDER BY c2 DESC;
c1	c2
1073741824	1073741826
1073741824	1073741825
1073741824	1073741824
1073741824	1073741824
SELECT * FROM t1 WHERE c1 = 1073741824 AND c2 < 1073741824 ORDER BY c2 DESC;
c1	c2
1073741824	1073741823
1073741824	1073741822
SELECT * FROM t1 WHERE c1 = 1073741824 AND c2 <= 1073741824 ORDER BY c2 DESC;
c1	c2
1073741824	1073741824
1073741824	1073741824
1073741824	1073741823
1073741824	1073741822
DROP TABLE t1;
DROP TABLE IF EXISTS t1;
CREATE TABLE t1(c1 INT SIGNED NULL);
INSERT INTO t1 VALUES
(-2147483648),
(0),
(1073741824),
(2147483647),
(NULL),
(NULL),
(NULL),
(NULL);
SELECT * FROM t1 WHERE c1 IS     NULL ORDER BY c1 ASC;
c1
NULL
NULL
NULL
NULL
SELECT * FROM t1 WHERE c1 IS NOT NULL ORDER BY c1 DESC;
c1
2147483647
1073741824
0
-2147483648
SELECT * FROM t1 WHERE c1 IS     NULL ORDER BY c1 ASC;
c1
NULL
NULL
NULL
NULL
SELECT * FROM t1 WHERE c1 IS NOT NULL ORDER BY c1 DESC;
c1
2147483647
1073741824
0
-2147483648
UPDATE t1
SET c1 = 0
WHERE c1 IS NULL;
SELECT * FROM t1 ORDER BY c1;
c1
-2147483648
0
0
0
0
0
1073741824
2147483647
UPDATE t1
SET c1 = 0
WHERE c1 IS NULL
LIMIT 2;
SELECT * FROM t1 ORDER BY c1;
c1
-2147483648
0
0
0
0
0
1073741824
2147483647
DELETE FROM t1
WHERE c1 IS NULL
ORDER BY c1;
SELECT * FROM t1 ORDER BY c1;
c1
-2147483648
0
0
0
0
0
1073741824
2147483647
DROP TABLE t1;
CREATE TABLE t1(c1 INT SIGNED NULL,
c2 INT SIGNED NULL );
INSERT INTO t1 VALUES
(-2147483648, -2147483648),
(0, 0),
(0, 0),
(0, 0),
(0, 0),
(1073741824, 1073741824 - 2),
(1073741824, 1073741824 - 1),
(1073741824, 1073741824),
(1073741824, 1073741824),
(1073741824, 1073741824 + 1),
(1073741824, 1073741824 + 2),
(1073741824, NULL),
(1073741824, NULL),
(2147483647, 2147483647);
SELECT * FROM t1 WHERE c1 = 1073741824 AND c2 > 1073741824 ORDER BY c2 ASC;
c1	c2
1073741824	1073741825
1073741824	1073741826
SELECT * FROM t1 WHERE c1 = 1073741824 AND c2 >= 1073741824 ORDER BY c2 ASC;
c1	c2
1073741824	1073741824
1073741824	1073741824
1073741824	1073741825
1073741824	1073741826
SELECT * FROM t1 WHERE c1 = 1073741824 AND c2 < 1073741824 ORDER BY c2 ASC;
c1	c2
1073741824	1073741822
1073741824	1073741823
SELECT * FROM t1 WHERE c1 = 1073741824 AND c2 <= 1073741824 ORDER BY c2 ASC;
c1	c2
1073741824	1073741822
1073741824	1073741823
1073741824	1073741824
1073741824	1073741824
SELECT * FROM t1 WHERE c1 = 1073741824 AND c2 is null ORDER BY c1 ASC;
c1	c2
1073741824	NULL
1073741824	NULL
SELECT * FROM t1 WHERE c1 = 1073741824 AND c2 is not null ORDER BY c2 ASC;
c1	c2
1073741824	1073741822
1073741824	1073741823
1073741824	1073741824
1073741824	1073741824
1073741824	1073741825
1073741824	1073741826
SELECT * FROM t1 WHERE c1 = 1073741824 AND c2 > 1073741824 ORDER BY c2 DESC;
c1	c2
1073741824	1073741826
1073741824	1073741825
SELECT * FROM t1 WHERE c1 = 1073741824 AND c2 >= 1073741824 ORDER BY c2 DESC;
c1	c2
1073741824	1073741826
1073741824	1073741825
1073741824	1073741824
1073741824	1073741824
SELECT * FROM t1 WHERE c1 = 1073741824 AND c2 < 1073741824 ORDER BY c2 DESC;
c1	c2
1073741824	1073741823
1073741824	1073741822
SELECT * FROM t1 WHERE c1 = 1073741824 AND c2 <= 1073741824 ORDER BY c2 DESC;
c1	c2
1073741824	1073741824
1073741824	1073741824
1073741824	1073741823
1073741824	1073741822
SELECT * FROM t1 WHERE c1 = 1073741824 AND c2 is null ORDER BY c1 DESC;
c1	c2
1073741824	NULL
1073741824	NULL
SELECT * FROM t1 WHERE c1 = 1073741824 AND c2 is not null ORDER BY c2 DESC;
c1	c2
1073741824	1073741826
1073741824	1073741825
1073741824	1073741824
1073741824	1073741824
1073741824	1073741823
1073741824	1073741822
DROP TABLE t1;
DROP TABLE IF EXISTS t1;
CREATE TABLE t1(c1 INT SIGNED NULL );
INSERT INTO t1 VALUES
(-2147483648),
(0),
(0),
(0),
(0),
(1073741824 - 2),
(1073741824 - 1),
(1073741824),
(1073741824),
(1073741824 + 1),
(1073741824 + 2),
(2147483647);
SELECT * FROM t1 ORDER BY c1 ASC;
c1
-2147483648
0
0
0
0
1073741822
1073741823
1073741824
1073741824
1073741825
1073741826
2147483647
SELECT * FROM t1 ORDER BY c1 DESC;
c1
2147483647
1073741826
1073741825
1073741824
1073741824
1073741823
1073741822
0
0
0
0
-2147483648
SELECT * FROM t1 WHERE c1 >  1073741824 ORDER BY c1 ASC;
c1
1073741825
1073741826
2147483647
SELECT * FROM t1 WHERE c1 >= 1073741824 ORDER BY c1 ASC;
c1
1073741824
1073741824
1073741825
1073741826
2147483647
SELECT * FROM t1 WHERE c1 <  1073741824 ORDER BY c1 ASC;
c1
-2147483648
0
0
0
0
1073741822
1073741823
SELECT * FROM t1 WHERE c1 <= 1073741824 ORDER BY c1 ASC;
c1
-2147483648
0
0
0
0
1073741822
1073741823
1073741824
1073741824
SELECT * FROM t1 WHERE c1 =  1073741824 ORDER BY c1 ASC;
c1
1073741824
1073741824
SELECT * FROM t1 WHERE c1 >  1073741824 ORDER BY c1 DESC;
c1
2147483647
1073741826
1073741825
SELECT * FROM t1 WHERE c1 >= 1073741824 ORDER BY c1 DESC;
c1
2147483647
1073741826
1073741825
1073741824
1073741824
SELECT * FROM t1 WHERE c1 <  1073741824 ORDER BY c1 DESC;
c1
1073741823
1073741822
0
0
0
0
-2147483648
SELECT * FROM t1 WHERE c1 <= 1073741824 ORDER BY c1 DESC;
c1
1073741824
1073741824
1073741823
1073741822
0
0
0
0
-2147483648
SELECT * FROM t1 WHERE c1 =  1073741824 ORDER BY c1 DESC;
c1
1073741824
1073741824
UPDATE t1
SET c1 = 1073741824
WHERE c1 <= 0 + 0 AND c1 >= 0 - 0
ORDER BY c1 ASC
LIMIT 2;
SELECT * FROM t1 ORDER BY c1;
c1
-2147483648
0
0
1073741822
1073741823
1073741824
1073741824
1073741824
1073741824
1073741825
1073741826
2147483647
DELETE FROM t1
WHERE c1 <= 0 + 0 AND c1 >= 0 - 0
ORDER BY c1;
SELECT * FROM t1 ORDER BY c1;
c1
-2147483648
1073741822
1073741823
1073741824
1073741824
1073741824
1073741824
1073741825
1073741826
2147483647
DROP TABLE t1;
CREATE TABLE t1(c1 INT SIGNED NULL, c2 INT SIGNED NULL );
INSERT INTO t1 VALUES
(-2147483648, -2147483648),
(0, 0),
(0, 0),
(0, 0),
(0, 0),
(1073741824, 1073741824 - 2),
(1073741824, 1073741824 - 1),
(1073741824, 1073741824),
(1073741824, 1073741824),
(1073741824, 1073741824 + 1),
(1073741824, 1073741824 + 2),
(2147483647, 2147483647);
SELECT * FROM t1 WHERE c1 = 1073741824 AND c2 > 1073741824 ORDER BY c2 ASC;
c1	c2
1073741824	1073741825
1073741824	1073741826
SELECT * FROM t1 WHERE c1 = 1073741824 AND c2 >= 1073741824 ORDER BY c2 ASC;
c1	c2
1073741824	1073741824
1073741824	1073741824
1073741824	1073741825
1073741824	1073741826
SELECT * FROM t1 WHERE c1 = 1073741824 AND c2 < 1073741824 ORDER BY c2 ASC;
c1	c2
1073741824	1073741822
1073741824	1073741823
SELECT * FROM t1 WHERE c1 = 1073741824 AND c2 <= 1073741824 ORDER BY c2 ASC;
c1	c2
1073741824	1073741822
1073741824	1073741823
1073741824	1073741824
1073741824	1073741824
SELECT * FROM t1 WHERE c1 = 1073741824 AND c2 > 1073741824 ORDER BY c2 DESC;
c1	c2
1073741824	1073741826
1073741824	1073741825
SELECT * FROM t1 WHERE c1 = 1073741824 AND c2 >= 1073741824 ORDER BY c2 DESC;
c1	c2
1073741824	1073741826
1073741824	1073741825
1073741824	1073741824
1073741824	1073741824
SELECT * FROM t1 WHERE c1 = 1073741824 AND c2 < 1073741824 ORDER BY c2 DESC;
c1	c2
1073741824	1073741823
1073741824	1073741822
SELECT * FROM t1 WHERE c1 = 1073741824 AND c2 <= 1073741824 ORDER BY c2 DESC;
c1	c2
1073741824	1073741824
1073741824	1073741824
1073741824	1073741823
1073741824	1073741822
DROP TABLE t1;
DROP TABLE IF EXISTS t1;
CREATE TABLE t1(c1 INT SIGNED NOT NULL , INDEX(c1));
INSERT INTO t1 VALUES
(-2147483648),
(0),
(0),
(0),
(0),
(1073741824 - 2),
(1073741824 - 1),
(1073741824),
(1073741824),
(1073741824 + 1),
(1073741824 + 2),
(2147483647);
SELECT * FROM t1 ORDER BY c1 ASC;
c1
-2147483648
0
0
0
0
1073741822
1073741823
1073741824
1073741824
1073741825
1073741826
2147483647
SELECT * FROM t1 ORDER BY c1 DESC;
c1
2147483647
1073741826
1073741825
1073741824
1073741824
1073741823
1073741822
0
0
0
0
-2147483648
SELECT * FROM t1 WHERE c1 >  1073741824 ORDER BY c1 ASC;
c1
1073741825
1073741826
2147483647
SELECT * FROM t1 WHERE c1 >= 1073741824 ORDER BY c1 ASC;
c1
1073741824
1073741824
1073741825
1073741826
2147483647
SELECT * FROM t1 WHERE c1 <  1073741824 ORDER BY c1 ASC;
c1
-2147483648
0
0
0
0
1073741822
1073741823
SELECT * FROM t1 WHERE c1 <= 1073741824 ORDER BY c1 ASC;
c1
-2147483648
0
0
0
0
1073741822
1073741823
1073741824
1073741824
SELECT * FROM t1 WHERE c1 =  1073741824 ORDER BY c1 ASC;
c1
1073741824
1073741824
SELECT * FROM t1 WHERE c1 >  1073741824 ORDER BY c1 DESC;
c1
2147483647
1073741826
1073741825
SELECT * FROM t1 WHERE c1 >= 1073741824 ORDER BY c1 DESC;
c1
2147483647
1073741826
1073741825
1073741824
1073741824
SELECT * FROM t1 WHERE c1 <  1073741824 ORDER BY c1 DESC;
c1
1073741823
1073741822
0
0
0
0
-2147483648
SELECT * FROM t1 WHERE c1 <= 1073741824 ORDER BY c1 DESC;
c1
1073741824
1073741824
1073741823
1073741822
0
0
0
0
-2147483648
SELECT * FROM t1 WHERE c1 =  1073741824 ORDER BY c1 DESC;
c1
1073741824
1073741824
UPDATE t1
SET c1 = 1073741824
WHERE c1 <= 0 + 0 AND c1 >= 0 - 0
ORDER BY c1 ASC
LIMIT 2;
SELECT * FROM t1 ORDER BY c1;
c1
-2147483648
0
0
1073741822
1073741823
1073741824
1073741824
1073741824
1073741824
1073741825
1073741826
2147483647
DELETE FROM t1
WHERE c1 <= 0 + 0 AND c1 >= 0 - 0
ORDER BY c1;
SELECT * FROM t1 ORDER BY c1;
c1
-2147483648
1073741822
1073741823
1073741824
1073741824
1073741824
1073741824
1073741825
1073741826
2147483647
DROP TABLE t1;
CREATE TABLE t1(c1 INT SIGNED NOT NULL, c2 INT SIGNED NOT NULL , INDEX(c1, c2));
INSERT INTO t1 VALUES
(-2147483648, -2147483648),
(0, 0),
(0, 0),
(0, 0),
(0, 0),
(1073741824, 1073741824 - 2),
(1073741824, 1073741824 - 1),
(1073741824, 1073741824),
(1073741824, 1073741824),
(1073741824, 1073741824 + 1),
(1073741824, 1073741824 + 2),
(2147483647, 2147483647);
SELECT * FROM t1 WHERE c1 = 1073741824 AND c2 > 1073741824 ORDER BY c2 ASC;
c1	c2
1073741824	1073741825
1073741824	1073741826
SELECT * FROM t1 WHERE c1 = 1073741824 AND c2 >= 1073741824 ORDER BY c2 ASC;
c1	c2
1073741824	1073741824
1073741824	1073741824
1073741824	1073741825
1073741824	1073741826
SELECT * FROM t1 WHERE c1 = 1073741824 AND c2 < 1073741824 ORDER BY c2 ASC;
c1	c2
1073741824	1073741822
1073741824	1073741823
SELECT * FROM t1 WHERE c1 = 1073741824 AND c2 <= 1073741824 ORDER BY c2 ASC;
c1	c2
1073741824	1073741822
1073741824	1073741823
1073741824	1073741824
1073741824	1073741824
SELECT * FROM t1 WHERE c1 = 1073741824 AND c2 > 1073741824 ORDER BY c2 DESC;
c1	c2
1073741824	1073741826
1073741824	1073741825
SELECT * FROM t1 WHERE c1 = 1073741824 AND c2 >= 1073741824 ORDER BY c2 DESC;
c1	c2
1073741824	1073741826
1073741824	1073741825
1073741824	1073741824
1073741824	1073741824
SELECT * FROM t1 WHERE c1 = 1073741824 AND c2 < 1073741824 ORDER BY c2 DESC;
c1	c2
1073741824	1073741823
1073741824	1073741822
SELECT * FROM t1 WHERE c1 = 1073741824 AND c2 <= 1073741824 ORDER BY c2 DESC;
c1	c2
1073741824	1073741824
1073741824	1073741824
1073741824	1073741823
1073741824	1073741822
DROP TABLE t1;
DROP TABLE IF EXISTS t1;
CREATE TABLE t1(c1 INT SIGNED NULL);
INSERT INTO t1 VALUES
(-2147483648),
(0),
(1073741824),
(2147483647),
(NULL),
(NULL),
(NULL),
(NULL);
SELECT * FROM t1 WHERE c1 IS     NULL ORDER BY c1 ASC;
c1
NULL
NULL
NULL
NULL
SELECT * FROM t1 WHERE c1 IS NOT NULL ORDER BY c1 DESC;
c1
2147483647
1073741824
0
-2147483648
SELECT * FROM t1 WHERE c1 IS     NULL ORDER BY c1 ASC;
c1
NULL
NULL
NULL
NULL
SELECT * FROM t1 WHERE c1 IS NOT NULL ORDER BY c1 DESC;
c1
2147483647
1073741824
0
-2147483648
UPDATE t1
SET c1 = 0
WHERE c1 IS NULL;
SELECT * FROM t1 ORDER BY c1;
c1
-2147483648
0
0
0
0
0
1073741824
2147483647
UPDATE t1
SET c1 = 0
WHERE c1 IS NULL
LIMIT 2;
SELECT * FROM t1 ORDER BY c1;
c1
-2147483648
0
0
0
0
0
1073741824
2147483647
DELETE FROM t1
WHERE c1 IS NULL
ORDER BY c1;
SELECT * FROM t1 ORDER BY c1;
c1
-2147483648
0
0
0
0
0
1073741824
2147483647
DROP TABLE t1;
CREATE TABLE t1(c1 INT SIGNED NULL,
c2 INT SIGNED NULL , INDEX(c1, c2));
INSERT INTO t1 VALUES
(-2147483648, -2147483648),
(0, 0),
(0, 0),
(0, 0),
(0, 0),
(1073741824, 1073741824 - 2),
(1073741824, 1073741824 - 1),
(1073741824, 1073741824),
(1073741824, 1073741824),
(1073741824, 1073741824 + 1),
(1073741824, 1073741824 + 2),
(1073741824, NULL),
(1073741824, NULL),
(2147483647, 2147483647);
SELECT * FROM t1 WHERE c1 = 1073741824 AND c2 > 1073741824 ORDER BY c2 ASC;
c1	c2
1073741824	1073741825
1073741824	1073741826
SELECT * FROM t1 WHERE c1 = 1073741824 AND c2 >= 1073741824 ORDER BY c2 ASC;
c1	c2
1073741824	1073741824
1073741824	1073741824
1073741824	1073741825
1073741824	1073741826
SELECT * FROM t1 WHERE c1 = 1073741824 AND c2 < 1073741824 ORDER BY c2 ASC;
c1	c2
1073741824	1073741822
1073741824	1073741823
SELECT * FROM t1 WHERE c1 = 1073741824 AND c2 <= 1073741824 ORDER BY c2 ASC;
c1	c2
1073741824	1073741822
1073741824	1073741823
1073741824	1073741824
1073741824	1073741824
SELECT * FROM t1 WHERE c1 = 1073741824 AND c2 is null ORDER BY c1 ASC;
c1	c2
1073741824	NULL
1073741824	NULL
SELECT * FROM t1 WHERE c1 = 1073741824 AND c2 is not null ORDER BY c2 ASC;
c1	c2
1073741824	1073741822
1073741824	1073741823
1073741824	1073741824
1073741824	1073741824
1073741824	1073741825
1073741824	1073741826
SELECT * FROM t1 WHERE c1 = 1073741824 AND c2 > 1073741824 ORDER BY c2 DESC;
c1	c2
1073741824	1073741826
1073741824	1073741825
SELECT * FROM t1 WHERE c1 = 1073741824 AND c2 >= 1073741824 ORDER BY c2 DESC;
c1	c2
1073741824	1073741826
1073741824	1073741825
1073741824	1073741824
1073741824	1073741824
SELECT * FROM t1 WHERE c1 = 1073741824 AND c2 < 1073741824 ORDER BY c2 DESC;
c1	c2
1073741824	1073741823
1073741824	1073741822
SELECT * FROM t1 WHERE c1 = 1073741824 AND c2 <= 1073741824 ORDER BY c2 DESC;
c1	c2
1073741824	1073741824
1073741824	1073741824
1073741824	1073741823
1073741824	1073741822
SELECT * FROM t1 WHERE c1 = 1073741824 AND c2 is null ORDER BY c1 DESC;
c1	c2
1073741824	NULL
1073741824	NULL
SELECT * FROM t1 WHERE c1 = 1073741824 AND c2 is not null ORDER BY c2 DESC;
c1	c2
1073741824	1073741826
1073741824	1073741825
1073741824	1073741824
1073741824	1073741824
1073741824	1073741823
1073741824	1073741822
DROP TABLE t1;
DROP TABLE IF EXISTS t1;
CREATE TABLE t1(c1 INT SIGNED NULL , INDEX(c1));
INSERT INTO t1 VALUES
(-2147483648),
(0),
(0),
(0),
(0),
(1073741824 - 2),
(1073741824 - 1),
(1073741824),
(1073741824),
(1073741824 + 1),
(1073741824 + 2),
(2147483647);
SELECT * FROM t1 ORDER BY c1 ASC;
c1
-2147483648
0
0
0
0
1073741822
1073741823
1073741824
1073741824
1073741825
1073741826
2147483647
SELECT * FROM t1 ORDER BY c1 DESC;
c1
2147483647
1073741826
1073741825
1073741824
1073741824
1073741823
1073741822
0
0
0
0
-2147483648
SELECT * FROM t1 WHERE c1 >  1073741824 ORDER BY c1 ASC;
c1
1073741825
1073741826
2147483647
SELECT * FROM t1 WHERE c1 >= 1073741824 ORDER BY c1 ASC;
c1
1073741824
1073741824
1073741825
1073741826
2147483647
SELECT * FROM t1 WHERE c1 <  1073741824 ORDER BY c1 ASC;
c1
-2147483648
0
0
0
0
1073741822
1073741823
SELECT * FROM t1 WHERE c1 <= 1073741824 ORDER BY c1 ASC;
c1
-2147483648
0
0
0
0
1073741822
1073741823
1073741824
1073741824
SELECT * FROM t1 WHERE c1 =  1073741824 ORDER BY c1 ASC;
c1
1073741824
1073741824
SELECT * FROM t1 WHERE c1 >  1073741824 ORDER BY c1 DESC;
c1
2147483647
1073741826
1073741825
SELECT * FROM t1 WHERE c1 >= 1073741824 ORDER BY c1 DESC;
c1
2147483647
1073741826
1073741825
1073741824
1073741824
SELECT * FROM t1 WHERE c1 <  1073741824 ORDER BY c1 DESC;
c1
1073741823
1073741822
0
0
0
0
-2147483648
SELECT * FROM t1 WHERE c1 <= 1073741824 ORDER BY c1 DESC;
c1
1073741824
1073741824
1073741823
1073741822
0
0
0
0
-2147483648
SELECT * FROM t1 WHERE c1 =  1073741824 ORDER BY c1 DESC;
c1
1073741824
1073741824
UPDATE t1
SET c1 = 1073741824
WHERE c1 <= 0 + 0 AND c1 >= 0 - 0
ORDER BY c1 ASC
LIMIT 2;
SELECT * FROM t1 ORDER BY c1;
c1
-2147483648
0
0
1073741822
1073741823
1073741824
1073741824
1073741824
1073741824
1073741825
1073741826
2147483647
DELETE FROM t1
WHERE c1 <= 0 + 0 AND c1 >= 0 - 0
ORDER BY c1;
SELECT * FROM t1 ORDER BY c1;
c1
-2147483648
1073741822
1073741823
1073741824
1073741824
1073741824
1073741824
1073741825
1073741826
2147483647
DROP TABLE t1;
CREATE TABLE t1(c1 INT SIGNED NULL, c2 INT SIGNED NULL , INDEX(c1, c2));
INSERT INTO t1 VALUES
(-2147483648, -2147483648),
(0, 0),
(0, 0),
(0, 0),
(0, 0),
(1073741824, 1073741824 - 2),
(1073741824, 1073741824 - 1),
(1073741824, 1073741824),
(1073741824, 1073741824),
(1073741824, 1073741824 + 1),
(1073741824, 1073741824 + 2),
(2147483647, 2147483647);
SELECT * FROM t1 WHERE c1 = 1073741824 AND c2 > 1073741824 ORDER BY c2 ASC;
c1	c2
1073741824	1073741825
1073741824	1073741826
SELECT * FROM t1 WHERE c1 = 1073741824 AND c2 >= 1073741824 ORDER BY c2 ASC;
c1	c2
1073741824	1073741824
1073741824	1073741824
1073741824	1073741825
1073741824	1073741826
SELECT * FROM t1 WHERE c1 = 1073741824 AND c2 < 1073741824 ORDER BY c2 ASC;
c1	c2
1073741824	1073741822
1073741824	1073741823
SELECT * FROM t1 WHERE c1 = 1073741824 AND c2 <= 1073741824 ORDER BY c2 ASC;
c1	c2
1073741824	1073741822
1073741824	1073741823
1073741824	1073741824
1073741824	1073741824
SELECT * FROM t1 WHERE c1 = 1073741824 AND c2 > 1073741824 ORDER BY c2 DESC;
c1	c2
1073741824	1073741826
1073741824	1073741825
SELECT * FROM t1 WHERE c1 = 1073741824 AND c2 >= 1073741824 ORDER BY c2 DESC;
c1	c2
1073741824	1073741826
1073741824	1073741825
1073741824	1073741824
1073741824	1073741824
SELECT * FROM t1 WHERE c1 = 1073741824 AND c2 < 1073741824 ORDER BY c2 DESC;
c1	c2
1073741824	1073741823
1073741824	1073741822
SELECT * FROM t1 WHERE c1 = 1073741824 AND c2 <= 1073741824 ORDER BY c2 DESC;
c1	c2
1073741824	1073741824
1073741824	1073741824
1073741824	1073741823
1073741824	1073741822
DROP TABLE t1;
DROP TABLE IF EXISTS t1;
CREATE TABLE t1(c1 INT UNSIGNED NOT NULL );
INSERT INTO t1 VALUES
(0),
(0),
(0),
(0),
(0),
(2147483648 - 2),
(2147483648 - 1),
(2147483648),
(2147483648),
(2147483648 + 1),
(2147483648 + 2),
(4294967295);
SELECT * FROM t1 ORDER BY c1 ASC;
c1
0
0
0
0
0
2147483646
2147483647
2147483648
2147483648
2147483649
2147483650
4294967295
SELECT * FROM t1 ORDER BY c1 DESC;
c1
4294967295
2147483650
2147483649
2147483648
2147483648
2147483647
2147483646
0
0
0
0
0
SELECT * FROM t1 WHERE c1 >  2147483648 ORDER BY c1 ASC;
c1
2147483649
2147483650
4294967295
SELECT * FROM t1 WHERE c1 >= 2147483648 ORDER BY c1 ASC;
c1
2147483648
2147483648
2147483649
2147483650
4294967295
SELECT * FROM t1 WHERE c1 <  2147483648 ORDER BY c1 ASC;
c1
0
0
0
0
0
2147483646
2147483647
SELECT * FROM t1 WHERE c1 <= 2147483648 ORDER BY c1 ASC;
c1
0
0
0
0
0
2147483646
2147483647
2147483648
2147483648
SELECT * FROM t1 WHERE c1 =  2147483648 ORDER BY c1 ASC;
c1
2147483648
2147483648
SELECT * FROM t1 WHERE c1 >  2147483648 ORDER BY c1 DESC;
c1
4294967295
2147483650
2147483649
SELECT * FROM t1 WHERE c1 >= 2147483648 ORDER BY c1 DESC;
c1
4294967295
2147483650
2147483649
2147483648
2147483648
SELECT * FROM t1 WHERE c1 <  2147483648 ORDER BY c1 DESC;
c1
2147483647
2147483646
0
0
0
0
0
SELECT * FROM t1 WHERE c1 <= 2147483648 ORDER BY c1 DESC;
c1
2147483648
2147483648
2147483647
2147483646
0
0
0
0
0
SELECT * FROM t1 WHERE c1 =  2147483648 ORDER BY c1 DESC;
c1
2147483648
2147483648
UPDATE t1
SET c1 = 2147483648
WHERE c1 <= 0 + 0 AND c1 >= 0 - 0
ORDER BY c1 ASC
LIMIT 2;
SELECT * FROM t1 ORDER BY c1;
c1
0
0
0
2147483646
2147483647
2147483648
2147483648
2147483648
2147483648
2147483649
2147483650
4294967295
DELETE FROM t1
WHERE c1 <= 0 + 0 AND c1 >= 0 - 0
ORDER BY c1;
SELECT * FROM t1 ORDER BY c1;
c1
2147483646
2147483647
2147483648
2147483648
2147483648
2147483648
2147483649
2147483650
4294967295
DROP TABLE t1;
CREATE TABLE t1(c1 INT UNSIGNED NOT NULL, c2 INT UNSIGNED NOT NULL , INDEX(c1, c2));
INSERT INTO t1 VALUES
(0, 0),
(0, 0),
(0, 0),
(0, 0),
(0, 0),
(2147483648, 2147483648 - 2),
(2147483648, 2147483648 - 1),
(2147483648, 2147483648),
(2147483648, 2147483648),
(2147483648, 2147483648 + 1),
(2147483648, 2147483648 + 2),
(4294967295, 4294967295);
SELECT * FROM t1 WHERE c1 = 2147483648 AND c2 > 2147483648 ORDER BY c2 ASC;
c1	c2
2147483648	2147483649
2147483648	2147483650
SELECT * FROM t1 WHERE c1 = 2147483648 AND c2 >= 2147483648 ORDER BY c2 ASC;
c1	c2
2147483648	2147483648
2147483648	2147483648
2147483648	2147483649
2147483648	2147483650
SELECT * FROM t1 WHERE c1 = 2147483648 AND c2 < 2147483648 ORDER BY c2 ASC;
c1	c2
2147483648	2147483646
2147483648	2147483647
SELECT * FROM t1 WHERE c1 = 2147483648 AND c2 <= 2147483648 ORDER BY c2 ASC;
c1	c2
2147483648	2147483646
2147483648	2147483647
2147483648	2147483648
2147483648	2147483648
SELECT * FROM t1 WHERE c1 = 2147483648 AND c2 > 2147483648 ORDER BY c2 DESC;
c1	c2
2147483648	2147483650
2147483648	2147483649
SELECT * FROM t1 WHERE c1 = 2147483648 AND c2 >= 2147483648 ORDER BY c2 DESC;
c1	c2
2147483648	2147483650
2147483648	2147483649
2147483648	2147483648
2147483648	2147483648
SELECT * FROM t1 WHERE c1 = 2147483648 AND c2 < 2147483648 ORDER BY c2 DESC;
c1	c2
2147483648	2147483647
2147483648	2147483646
SELECT * FROM t1 WHERE c1 = 2147483648 AND c2 <= 2147483648 ORDER BY c2 DESC;
c1	c2
2147483648	2147483648
2147483648	2147483648
2147483648	2147483647
2147483648	2147483646
DROP TABLE t1;
DROP TABLE IF EXISTS t1;
CREATE TABLE t1(c1 INT UNSIGNED NULL);
INSERT INTO t1 VALUES
(0),
(0),
(2147483648),
(4294967295),
(NULL),
(NULL),
(NULL),
(NULL);
SELECT * FROM t1 WHERE c1 IS     NULL ORDER BY c1 ASC;
c1
NULL
NULL
NULL
NULL
SELECT * FROM t1 WHERE c1 IS NOT NULL ORDER BY c1 DESC;
c1
4294967295
2147483648
0
0
SELECT * FROM t1 WHERE c1 IS     NULL ORDER BY c1 ASC;
c1
NULL
NULL
NULL
NULL
SELECT * FROM t1 WHERE c1 IS NOT NULL ORDER BY c1 DESC;
c1
4294967295
2147483648
0
0
UPDATE t1
SET c1 = 0
WHERE c1 IS NULL;
SELECT * FROM t1 ORDER BY c1;
c1
0
0
0
0
0
0
2147483648
4294967295
UPDATE t1
SET c1 = 0
WHERE c1 IS NULL
LIMIT 2;
SELECT * FROM t1 ORDER BY c1;
c1
0
0
0
0
0
0
2147483648
4294967295
DELETE FROM t1
WHERE c1 IS NULL
ORDER BY c1;
SELECT * FROM t1 ORDER BY c1;
c1
0
0
0
0
0
0
2147483648
4294967295
DROP TABLE t1;
CREATE TABLE t1(c1 INT UNSIGNED NULL,
c2 INT UNSIGNED NULL , INDEX(c1, c2));
INSERT INTO t1 VALUES
(0, 0),
(0, 0),
(0, 0),
(0, 0),
(0, 0),
(2147483648, 2147483648 - 2),
(2147483648, 2147483648 - 1),
(2147483648, 2147483648),
(2147483648, 2147483648),
(2147483648, 2147483648 + 1),
(2147483648, 2147483648 + 2),
(2147483648, NULL),
(2147483648, NULL),
(4294967295, 4294967295);
SELECT * FROM t1 WHERE c1 = 2147483648 AND c2 > 2147483648 ORDER BY c2 ASC;
c1	c2
2147483648	2147483649
2147483648	2147483650
SELECT * FROM t1 WHERE c1 = 2147483648 AND c2 >= 2147483648 ORDER BY c2 ASC;
c1	c2
2147483648	2147483648
2147483648	2147483648
2147483648	2147483649
2147483648	2147483650
SELECT * FROM t1 WHERE c1 = 2147483648 AND c2 < 2147483648 ORDER BY c2 ASC;
c1	c2
2147483648	2147483646
2147483648	2147483647
SELECT * FROM t1 WHERE c1 = 2147483648 AND c2 <= 2147483648 ORDER BY c2 ASC;
c1	c2
2147483648	2147483646
2147483648	2147483647
2147483648	2147483648
2147483648	2147483648
SELECT * FROM t1 WHERE c1 = 2147483648 AND c2 is null ORDER BY c1 ASC;
c1	c2
2147483648	NULL
2147483648	NULL
SELECT * FROM t1 WHERE c1 = 2147483648 AND c2 is not null ORDER BY c2 ASC;
c1	c2
2147483648	2147483646
2147483648	2147483647
2147483648	2147483648
2147483648	2147483648
2147483648	2147483649
2147483648	2147483650
SELECT * FROM t1 WHERE c1 = 2147483648 AND c2 > 2147483648 ORDER BY c2 DESC;
c1	c2
2147483648	2147483650
2147483648	2147483649
SELECT * FROM t1 WHERE c1 = 2147483648 AND c2 >= 2147483648 ORDER BY c2 DESC;
c1	c2
2147483648	2147483650
2147483648	2147483649
2147483648	2147483648
2147483648	2147483648
SELECT * FROM t1 WHERE c1 = 2147483648 AND c2 < 2147483648 ORDER BY c2 DESC;
c1	c2
2147483648	2147483647
2147483648	2147483646
SELECT * FROM t1 WHERE c1 = 2147483648 AND c2 <= 2147483648 ORDER BY c2 DESC;
c1	c2
2147483648	2147483648
2147483648	2147483648
2147483648	2147483647
2147483648	2147483646
SELECT * FROM t1 WHERE c1 = 2147483648 AND c2 is null ORDER BY c1 DESC;
c1	c2
2147483648	NULL
2147483648	NULL
SELECT * FROM t1 WHERE c1 = 2147483648 AND c2 is not null ORDER BY c2 DESC;
c1	c2
2147483648	2147483650
2147483648	2147483649
2147483648	2147483648
2147483648	2147483648
2147483648	2147483647
2147483648	2147483646
DROP TABLE t1;
DROP TABLE IF EXISTS t1;
CREATE TABLE t1(c1 INT UNSIGNED NULL );
INSERT INTO t1 VALUES
(0),
(0),
(0),
(0),
(0),
(2147483648 - 2),
(2147483648 - 1),
(2147483648),
(2147483648),
(2147483648 + 1),
(2147483648 + 2),
(4294967295);
SELECT * FROM t1 ORDER BY c1 ASC;
c1
0
0
0
0
0
2147483646
2147483647
2147483648
2147483648
2147483649
2147483650
4294967295
SELECT * FROM t1 ORDER BY c1 DESC;
c1
4294967295
2147483650
2147483649
2147483648
2147483648
2147483647
2147483646
0
0
0
0
0
SELECT * FROM t1 WHERE c1 >  2147483648 ORDER BY c1 ASC;
c1
2147483649
2147483650
4294967295
SELECT * FROM t1 WHERE c1 >= 2147483648 ORDER BY c1 ASC;
c1
2147483648
2147483648
2147483649
2147483650
4294967295
SELECT * FROM t1 WHERE c1 <  2147483648 ORDER BY c1 ASC;
c1
0
0
0
0
0
2147483646
2147483647
SELECT * FROM t1 WHERE c1 <= 2147483648 ORDER BY c1 ASC;
c1
0
0
0
0
0
2147483646
2147483647
2147483648
2147483648
SELECT * FROM t1 WHERE c1 =  2147483648 ORDER BY c1 ASC;
c1
2147483648
2147483648
SELECT * FROM t1 WHERE c1 >  2147483648 ORDER BY c1 DESC;
c1
4294967295
2147483650
2147483649
SELECT * FROM t1 WHERE c1 >= 2147483648 ORDER BY c1 DESC;
c1
4294967295
2147483650
2147483649
2147483648
2147483648
SELECT * FROM t1 WHERE c1 <  2147483648 ORDER BY c1 DESC;
c1
2147483647
2147483646
0
0
0
0
0
SELECT * FROM t1 WHERE c1 <= 2147483648 ORDER BY c1 DESC;
c1
2147483648
2147483648
2147483647
2147483646
0
0
0
0
0
SELECT * FROM t1 WHERE c1 =  2147483648 ORDER BY c1 DESC;
c1
2147483648
2147483648
UPDATE t1
SET c1 = 2147483648
WHERE c1 <= 0 + 0 AND c1 >= 0 - 0
ORDER BY c1 ASC
LIMIT 2;
SELECT * FROM t1 ORDER BY c1;
c1
0
0
0
2147483646
2147483647
2147483648
2147483648
2147483648
2147483648
2147483649
2147483650
4294967295
DELETE FROM t1
WHERE c1 <= 0 + 0 AND c1 >= 0 - 0
ORDER BY c1;
SELECT * FROM t1 ORDER BY c1;
c1
2147483646
2147483647
2147483648
2147483648
2147483648
2147483648
2147483649
2147483650
4294967295
DROP TABLE t1;
CREATE TABLE t1(c1 INT UNSIGNED NULL, c2 INT UNSIGNED NULL , INDEX(c1, c2));
INSERT INTO t1 VALUES
(0, 0),
(0, 0),
(0, 0),
(0, 0),
(0, 0),
(2147483648, 2147483648 - 2),
(2147483648, 2147483648 - 1),
(2147483648, 2147483648),
(2147483648, 2147483648),
(2147483648, 2147483648 + 1),
(2147483648, 2147483648 + 2),
(4294967295, 4294967295);
SELECT * FROM t1 WHERE c1 = 2147483648 AND c2 > 2147483648 ORDER BY c2 ASC;
c1	c2
2147483648	2147483649
2147483648	2147483650
SELECT * FROM t1 WHERE c1 = 2147483648 AND c2 >= 2147483648 ORDER BY c2 ASC;
c1	c2
2147483648	2147483648
2147483648	2147483648
2147483648	2147483649
2147483648	2147483650
SELECT * FROM t1 WHERE c1 = 2147483648 AND c2 < 2147483648 ORDER BY c2 ASC;
c1	c2
2147483648	2147483646
2147483648	2147483647
SELECT * FROM t1 WHERE c1 = 2147483648 AND c2 <= 2147483648 ORDER BY c2 ASC;
c1	c2
2147483648	2147483646
2147483648	2147483647
2147483648	2147483648
2147483648	2147483648
SELECT * FROM t1 WHERE c1 = 2147483648 AND c2 > 2147483648 ORDER BY c2 DESC;
c1	c2
2147483648	2147483650
2147483648	2147483649
SELECT * FROM t1 WHERE c1 = 2147483648 AND c2 >= 2147483648 ORDER BY c2 DESC;
c1	c2
2147483648	2147483650
2147483648	2147483649
2147483648	2147483648
2147483648	2147483648
SELECT * FROM t1 WHERE c1 = 2147483648 AND c2 < 2147483648 ORDER BY c2 DESC;
c1	c2
2147483648	2147483647
2147483648	2147483646
SELECT * FROM t1 WHERE c1 = 2147483648 AND c2 <= 2147483648 ORDER BY c2 DESC;
c1	c2
2147483648	2147483648
2147483648	2147483648
2147483648	2147483647
2147483648	2147483646
DROP TABLE t1;
DROP TABLE IF EXISTS t1;
CREATE TABLE t1(c1 INT UNSIGNED NOT NULL , INDEX(c1));
INSERT INTO t1 VALUES
(0),
(0),
(0),
(0),
(0),
(2147483648 - 2),
(2147483648 - 1),
(2147483648),
(2147483648),
(2147483648 + 1),
(2147483648 + 2),
(4294967295);
SELECT * FROM t1 ORDER BY c1 ASC;
c1
0
0
0
0
0
2147483646
2147483647
2147483648
2147483648
2147483649
2147483650
4294967295
SELECT * FROM t1 ORDER BY c1 DESC;
c1
4294967295
2147483650
2147483649
2147483648
2147483648
2147483647
2147483646
0
0
0
0
0
SELECT * FROM t1 WHERE c1 >  2147483648 ORDER BY c1 ASC;
c1
2147483649
2147483650
4294967295
SELECT * FROM t1 WHERE c1 >= 2147483648 ORDER BY c1 ASC;
c1
2147483648
2147483648
2147483649
2147483650
4294967295
SELECT * FROM t1 WHERE c1 <  2147483648 ORDER BY c1 ASC;
c1
0
0
0
0
0
2147483646
2147483647
SELECT * FROM t1 WHERE c1 <= 2147483648 ORDER BY c1 ASC;
c1
0
0
0
0
0
2147483646
2147483647
2147483648
2147483648
SELECT * FROM t1 WHERE c1 =  2147483648 ORDER BY c1 ASC;
c1
2147483648
2147483648
SELECT * FROM t1 WHERE c1 >  2147483648 ORDER BY c1 DESC;
c1
4294967295
2147483650
2147483649
SELECT * FROM t1 WHERE c1 >= 2147483648 ORDER BY c1 DESC;
c1
4294967295
2147483650
2147483649
2147483648
2147483648
SELECT * FROM t1 WHERE c1 <  2147483648 ORDER BY c1 DESC;
c1
2147483647
2147483646
0
0
0
0
0
SELECT * FROM t1 WHERE c1 <= 2147483648 ORDER BY c1 DESC;
c1
2147483648
2147483648
2147483647
2147483646
0
0
0
0
0
SELECT * FROM t1 WHERE c1 =  2147483648 ORDER BY c1 DESC;
c1
2147483648
2147483648
UPDATE t1
SET c1 = 2147483648
WHERE c1 <= 0 + 0 AND c1 >= 0 - 0
ORDER BY c1 ASC
LIMIT 2;
SELECT * FROM t1 ORDER BY c1;
c1
0
0
0
2147483646
2147483647
2147483648
2147483648
2147483648
2147483648
2147483649
2147483650
4294967295
DELETE FROM t1
WHERE c1 <= 0 + 0 AND c1 >= 0 - 0
ORDER BY c1;
SELECT * FROM t1 ORDER BY c1;
c1
2147483646
2147483647
2147483648
2147483648
2147483648
2147483648
2147483649
2147483650
4294967295
DROP TABLE t1;
CREATE TABLE t1(c1 INT UNSIGNED NOT NULL, c2 INT UNSIGNED NOT NULL , INDEX(c1, c2));
INSERT INTO t1 VALUES
(0, 0),
(0, 0),
(0, 0),
(0, 0),
(0, 0),
(2147483648, 2147483648 - 2),
(2147483648, 2147483648 - 1),
(2147483648, 2147483648),
(2147483648, 2147483648),
(2147483648, 2147483648 + 1),
(2147483648, 2147483648 + 2),
(4294967295, 4294967295);
SELECT * FROM t1 WHERE c1 = 2147483648 AND c2 > 2147483648 ORDER BY c2 ASC;
c1	c2
2147483648	2147483649
2147483648	2147483650
SELECT * FROM t1 WHERE c1 = 2147483648 AND c2 >= 2147483648 ORDER BY c2 ASC;
c1	c2
2147483648	2147483648
2147483648	2147483648
2147483648	2147483649
2147483648	2147483650
SELECT * FROM t1 WHERE c1 = 2147483648 AND c2 < 2147483648 ORDER BY c2 ASC;
c1	c2
2147483648	2147483646
2147483648	2147483647
SELECT * FROM t1 WHERE c1 = 2147483648 AND c2 <= 2147483648 ORDER BY c2 ASC;
c1	c2
2147483648	2147483646
2147483648	2147483647
2147483648	2147483648
2147483648	2147483648
SELECT * FROM t1 WHERE c1 = 2147483648 AND c2 > 2147483648 ORDER BY c2 DESC;
c1	c2
2147483648	2147483650
2147483648	2147483649
SELECT * FROM t1 WHERE c1 = 2147483648 AND c2 >= 2147483648 ORDER BY c2 DESC;
c1	c2
2147483648	2147483650
2147483648	2147483649
2147483648	2147483648
2147483648	2147483648
SELECT * FROM t1 WHERE c1 = 2147483648 AND c2 < 2147483648 ORDER BY c2 DESC;
c1	c2
2147483648	2147483647
2147483648	2147483646
SELECT * FROM t1 WHERE c1 = 2147483648 AND c2 <= 2147483648 ORDER BY c2 DESC;
c1	c2
2147483648	2147483648
2147483648	2147483648
2147483648	2147483647
2147483648	2147483646
DROP TABLE t1;
DROP TABLE IF EXISTS t1;
CREATE TABLE t1(c1 INT UNSIGNED NULL);
INSERT INTO t1 VALUES
(0),
(0),
(2147483648),
(4294967295),
(NULL),
(NULL),
(NULL),
(NULL);
SELECT * FROM t1 WHERE c1 IS     NULL ORDER BY c1 ASC;
c1
NULL
NULL
NULL
NULL
SELECT * FROM t1 WHERE c1 IS NOT NULL ORDER BY c1 DESC;
c1
4294967295
2147483648
0
0
SELECT * FROM t1 WHERE c1 IS     NULL ORDER BY c1 ASC;
c1
NULL
NULL
NULL
NULL
SELECT * FROM t1 WHERE c1 IS NOT NULL ORDER BY c1 DESC;
c1
4294967295
2147483648
0
0
UPDATE t1
SET c1 = 0
WHERE c1 IS NULL;
SELECT * FROM t1 ORDER BY c1;
c1
0
0
0
0
0
0
2147483648
4294967295
UPDATE t1
SET c1 = 0
WHERE c1 IS NULL
LIMIT 2;
SELECT * FROM t1 ORDER BY c1;
c1
0
0
0
0
0
0
2147483648
4294967295
DELETE FROM t1
WHERE c1 IS NULL
ORDER BY c1;
SELECT * FROM t1 ORDER BY c1;
c1
0
0
0
0
0
0
2147483648
4294967295
DROP TABLE t1;
CREATE TABLE t1(c1 INT UNSIGNED NULL,
c2 INT UNSIGNED NULL , INDEX(c1, c2));
INSERT INTO t1 VALUES
(0, 0),
(0, 0),
(0, 0),
(0, 0),
(0, 0),
(2147483648, 2147483648 - 2),
(2147483648, 2147483648 - 1),
(2147483648, 2147483648),
(2147483648, 2147483648),
(2147483648, 2147483648 + 1),
(2147483648, 2147483648 + 2),
(2147483648, NULL),
(2147483648, NULL),
(4294967295, 4294967295);
SELECT * FROM t1 WHERE c1 = 2147483648 AND c2 > 2147483648 ORDER BY c2 ASC;
c1	c2
2147483648	2147483649
2147483648	2147483650
SELECT * FROM t1 WHERE c1 = 2147483648 AND c2 >= 2147483648 ORDER BY c2 ASC;
c1	c2
2147483648	2147483648
2147483648	2147483648
2147483648	2147483649
2147483648	2147483650
SELECT * FROM t1 WHERE c1 = 2147483648 AND c2 < 2147483648 ORDER BY c2 ASC;
c1	c2
2147483648	2147483646
2147483648	2147483647
SELECT * FROM t1 WHERE c1 = 2147483648 AND c2 <= 2147483648 ORDER BY c2 ASC;
c1	c2
2147483648	2147483646
2147483648	2147483647
2147483648	2147483648
2147483648	2147483648
SELECT * FROM t1 WHERE c1 = 2147483648 AND c2 is null ORDER BY c1 ASC;
c1	c2
2147483648	NULL
2147483648	NULL
SELECT * FROM t1 WHERE c1 = 2147483648 AND c2 is not null ORDER BY c2 ASC;
c1	c2
2147483648	2147483646
2147483648	2147483647
2147483648	2147483648
2147483648	2147483648
2147483648	2147483649
2147483648	2147483650
SELECT * FROM t1 WHERE c1 = 2147483648 AND c2 > 2147483648 ORDER BY c2 DESC;
c1	c2
2147483648	2147483650
2147483648	2147483649
SELECT * FROM t1 WHERE c1 = 2147483648 AND c2 >= 2147483648 ORDER BY c2 DESC;
c1	c2
2147483648	2147483650
2147483648	2147483649
2147483648	2147483648
2147483648	2147483648
SELECT * FROM t1 WHERE c1 = 2147483648 AND c2 < 2147483648 ORDER BY c2 DESC;
c1	c2
2147483648	2147483647
2147483648	2147483646
SELECT * FROM t1 WHERE c1 = 2147483648 AND c2 <= 2147483648 ORDER BY c2 DESC;
c1	c2
2147483648	2147483648
2147483648	2147483648
2147483648	2147483647
2147483648	2147483646
SELECT * FROM t1 WHERE c1 = 2147483648 AND c2 is null ORDER BY c1 DESC;
c1	c2
2147483648	NULL
2147483648	NULL
SELECT * FROM t1 WHERE c1 = 2147483648 AND c2 is not null ORDER BY c2 DESC;
c1	c2
2147483648	2147483650
2147483648	2147483649
2147483648	2147483648
2147483648	2147483648
2147483648	2147483647
2147483648	2147483646
DROP TABLE t1;
DROP TABLE IF EXISTS t1;
CREATE TABLE t1(c1 INT UNSIGNED NULL , INDEX(c1));
INSERT INTO t1 VALUES
(0),
(0),
(0),
(0),
(0),
(2147483648 - 2),
(2147483648 - 1),
(2147483648),
(2147483648),
(2147483648 + 1),
(2147483648 + 2),
(4294967295);
SELECT * FROM t1 ORDER BY c1 ASC;
c1
0
0
0
0
0
2147483646
2147483647
2147483648
2147483648
2147483649
2147483650
4294967295
SELECT * FROM t1 ORDER BY c1 DESC;
c1
4294967295
2147483650
2147483649
2147483648
2147483648
2147483647
2147483646
0
0
0
0
0
SELECT * FROM t1 WHERE c1 >  2147483648 ORDER BY c1 ASC;
c1
2147483649
2147483650
4294967295
SELECT * FROM t1 WHERE c1 >= 2147483648 ORDER BY c1 ASC;
c1
2147483648
2147483648
2147483649
2147483650
4294967295
SELECT * FROM t1 WHERE c1 <  2147483648 ORDER BY c1 ASC;
c1
0
0
0
0
0
2147483646
2147483647
SELECT * FROM t1 WHERE c1 <= 2147483648 ORDER BY c1 ASC;
c1
0
0
0
0
0
2147483646
2147483647
2147483648
2147483648
SELECT * FROM t1 WHERE c1 =  2147483648 ORDER BY c1 ASC;
c1
2147483648
2147483648
SELECT * FROM t1 WHERE c1 >  2147483648 ORDER BY c1 DESC;
c1
4294967295
2147483650
2147483649
SELECT * FROM t1 WHERE c1 >= 2147483648 ORDER BY c1 DESC;
c1
4294967295
2147483650
2147483649
2147483648
2147483648
SELECT * FROM t1 WHERE c1 <  2147483648 ORDER BY c1 DESC;
c1
2147483647
2147483646
0
0
0
0
0
SELECT * FROM t1 WHERE c1 <= 2147483648 ORDER BY c1 DESC;
c1
2147483648
2147483648
2147483647
2147483646
0
0
0
0
0
SELECT * FROM t1 WHERE c1 =  2147483648 ORDER BY c1 DESC;
c1
2147483648
2147483648
UPDATE t1
SET c1 = 2147483648
WHERE c1 <= 0 + 0 AND c1 >= 0 - 0
ORDER BY c1 ASC
LIMIT 2;
SELECT * FROM t1 ORDER BY c1;
c1
0
0
0
2147483646
2147483647
2147483648
2147483648
2147483648
2147483648
2147483649
2147483650
4294967295
DELETE FROM t1
WHERE c1 <= 0 + 0 AND c1 >= 0 - 0
ORDER BY c1;
SELECT * FROM t1 ORDER BY c1;
c1
2147483646
2147483647
2147483648
2147483648
2147483648
2147483648
2147483649
2147483650
4294967295
DROP TABLE t1;
CREATE TABLE t1(c1 INT UNSIGNED NULL, c2 INT UNSIGNED NULL , INDEX(c1, c2));
INSERT INTO t1 VALUES
(0, 0),
(0, 0),
(0, 0),
(0, 0),
(0, 0),
(2147483648, 2147483648 - 2),
(2147483648, 2147483648 - 1),
(2147483648, 2147483648),
(2147483648, 2147483648),
(2147483648, 2147483648 + 1),
(2147483648, 2147483648 + 2),
(4294967295, 4294967295);
SELECT * FROM t1 WHERE c1 = 2147483648 AND c2 > 2147483648 ORDER BY c2 ASC;
c1	c2
2147483648	2147483649
2147483648	2147483650
SELECT * FROM t1 WHERE c1 = 2147483648 AND c2 >= 2147483648 ORDER BY c2 ASC;
c1	c2
2147483648	2147483648
2147483648	2147483648
2147483648	2147483649
2147483648	2147483650
SELECT * FROM t1 WHERE c1 = 2147483648 AND c2 < 2147483648 ORDER BY c2 ASC;
c1	c2
2147483648	2147483646
2147483648	2147483647
SELECT * FROM t1 WHERE c1 = 2147483648 AND c2 <= 2147483648 ORDER BY c2 ASC;
c1	c2
2147483648	2147483646
2147483648	2147483647
2147483648	2147483648
2147483648	2147483648
SELECT * FROM t1 WHERE c1 = 2147483648 AND c2 > 2147483648 ORDER BY c2 DESC;
c1	c2
2147483648	2147483650
2147483648	2147483649
SELECT * FROM t1 WHERE c1 = 2147483648 AND c2 >= 2147483648 ORDER BY c2 DESC;
c1	c2
2147483648	2147483650
2147483648	2147483649
2147483648	2147483648
2147483648	2147483648
SELECT * FROM t1 WHERE c1 = 2147483648 AND c2 < 2147483648 ORDER BY c2 DESC;
c1	c2
2147483648	2147483647
2147483648	2147483646
SELECT * FROM t1 WHERE c1 = 2147483648 AND c2 <= 2147483648 ORDER BY c2 DESC;
c1	c2
2147483648	2147483648
2147483648	2147483648
2147483648	2147483647
2147483648	2147483646
DROP TABLE t1;
