DROP TABLE IF EXISTS t1;
DROP TABLE IF EXISTS t2;
CREATE TABLE t1(c1 TINYINT   NOT NULL, # [-128, 127]
c2 SMALLINT  NOT NULL, # [-32768, 32768]
c3 MEDIUMINT NOT NULL, # [-8388608, 8388607]
c4 INT       NOT NULL, # [-2147483648, 2147483647]
c5 BIGINT    NOT NULL) # [-9223372036854775808, 9223372036854775807]
ENGINE=cloud;
CREATE TABLE t2(c1 TINYINT   UNSIGNED NOT NULL, # [0, 255]
c2 SMALLINT  UNSIGNED NOT NULL, # [0, 65535]
c3 MEDIUMINT UNSIGNED NOT NULL, # [0, 16777215]
c4 INT       UNSIGNED NOT NULL, # [0, 4294967295]
c5 BIGINT    UNSIGNED NOT NULL) # [0, 18446744073709551615]
ENGINE=cloud;
INSERT INTO t1 VALUES
(-128, -32768, -8388608, -2147483648, -9223372036854775808),
( -64, -16384, -4194304, -1073741824, -4611686018427387903),
(  -1,     -1,       -1,          -1,                   -1),
(   0,      0,        0,           0,                    0),
(   1,      1,        1,           1,                    1),
(  64,  16384,  4194304,  1073741824,  4611686018427387903),
( 127,  32767,  8388607,  2147483647,  9223372036854775807);
INSERT INTO t2 VALUES
(   0,      0,        0,           0,                    0),
(   1,      1,        1,           1,                    1),
(  64,  16384,  4194304,  1073741824,  4611686018427387903),
( 127,  32768,  8388607,  2147483647,  9223372036854775807),
( 255,  65535, 16777215,  4294967295, 18446744073709551615);
INSERT INTO t1 VALUES
(-129, -32769, -8388609, -2147483649, -9223372036854775809),
( 128,  32768,  8388608,  2147483648,  9223372036854775808);
Warnings:
Warning	1264	Out of range value for column 'c1' at row 1
Warning	1264	Out of range value for column 'c2' at row 1
Warning	1264	Out of range value for column 'c3' at row 1
Warning	1264	Out of range value for column 'c4' at row 1
Warning	1264	Out of range value for column 'c5' at row 1
Warning	1264	Out of range value for column 'c1' at row 2
Warning	1264	Out of range value for column 'c2' at row 2
Warning	1264	Out of range value for column 'c3' at row 2
Warning	1264	Out of range value for column 'c4' at row 2
Warning	1264	Out of range value for column 'c5' at row 2
INSERT INTO t2 VALUES
(  -1,     -1,       -1,          -1,                   -1),
( 256,  65536, 16777216,  4294967296, 18446744073709551616);
Warnings:
Warning	1264	Out of range value for column 'c1' at row 1
Warning	1264	Out of range value for column 'c2' at row 1
Warning	1264	Out of range value for column 'c3' at row 1
Warning	1264	Out of range value for column 'c4' at row 1
Warning	1264	Out of range value for column 'c5' at row 1
Warning	1264	Out of range value for column 'c1' at row 2
Warning	1264	Out of range value for column 'c2' at row 2
Warning	1264	Out of range value for column 'c3' at row 2
Warning	1264	Out of range value for column 'c4' at row 2
Warning	1264	Out of range value for column 'c5' at row 2
INSERT INTO t1 VALUES
(NULL, 0, 0, 0, 0),
(0, NULL, 0, 0, 0),
(0, 0, NULL, 0, 0),
(0, 0, 0, NULL, 0),
(0, 0, 0, 0, NULL);
Warnings:
Warning	1048	Column 'c1' cannot be null
Warning	1048	Column 'c2' cannot be null
Warning	1048	Column 'c3' cannot be null
Warning	1048	Column 'c4' cannot be null
Warning	1048	Column 'c5' cannot be null
INSERT INTO t2 VALUES
(NULL, 0, 0, 0, 0),
(0, NULL, 0, 0, 0),
(0, 0, NULL, 0, 0),
(0, 0, 0, NULL, 0),
(0, 0, 0, 0, NULL);
Warnings:
Warning	1048	Column 'c1' cannot be null
Warning	1048	Column 'c2' cannot be null
Warning	1048	Column 'c3' cannot be null
Warning	1048	Column 'c4' cannot be null
Warning	1048	Column 'c5' cannot be null
SELECT * FROM t1 ORDER BY c1;
c1	c2	c3	c4	c5
-128	-32768	-8388608	-2147483648	-9223372036854775808
-128	-32768	-8388608	-2147483648	-9223372036854775808
-64	-16384	-4194304	-1073741824	-4611686018427387903
-1	-1	-1	-1	-1
0	0	0	0	0
0	0	0	0	0
0	0	0	0	0
0	0	0	0	0
0	0	0	0	0
0	0	0	0	0
1	1	1	1	1
64	16384	4194304	1073741824	4611686018427387903
127	32767	8388607	2147483647	9223372036854775807
127	32767	8388607	2147483647	9223372036854775807
SELECT * FROM t2 ORDER BY c1;
c1	c2	c3	c4	c5
0	0	0	0	0
0	0	0	0	0
0	0	0	0	0
0	0	0	0	0
0	0	0	0	0
0	0	0	0	0
0	0	0	0	0
1	1	1	1	1
64	16384	4194304	1073741824	4611686018427387903
127	32768	8388607	2147483647	9223372036854775807
255	65535	16777215	4294967295	18446744073709551615
255	65535	16777215	4294967295	18446744073709551615
SELECT * FROM t1 ORDER BY c1 LIMIT 3;
c1	c2	c3	c4	c5
-128	-32768	-8388608	-2147483648	-9223372036854775808
-128	-32768	-8388608	-2147483648	-9223372036854775808
-64	-16384	-4194304	-1073741824	-4611686018427387903
SELECT * FROM t2 ORDER BY c1 LIMIT 3;
c1	c2	c3	c4	c5
0	0	0	0	0
0	0	0	0	0
0	0	0	0	0
UPDATE t1
SET c1 = 1, c2 = 2, c3 = 3, c4 = 4, c5 = 5
WHERE c1 = 1;
UPDATE t2
SET c1 = 1, c2 = 2, c3 = 3, c4 = 4, c5 = 5
WHERE c1 = 1;
SELECT * FROM t1 ORDER BY c1;
c1	c2	c3	c4	c5
-128	-32768	-8388608	-2147483648	-9223372036854775808
-128	-32768	-8388608	-2147483648	-9223372036854775808
-64	-16384	-4194304	-1073741824	-4611686018427387903
-1	-1	-1	-1	-1
0	0	0	0	0
0	0	0	0	0
0	0	0	0	0
0	0	0	0	0
0	0	0	0	0
0	0	0	0	0
1	2	3	4	5
64	16384	4194304	1073741824	4611686018427387903
127	32767	8388607	2147483647	9223372036854775807
127	32767	8388607	2147483647	9223372036854775807
SELECT * FROM t2 ORDER BY c1;
c1	c2	c3	c4	c5
0	0	0	0	0
0	0	0	0	0
0	0	0	0	0
0	0	0	0	0
0	0	0	0	0
0	0	0	0	0
0	0	0	0	0
1	2	3	4	5
64	16384	4194304	1073741824	4611686018427387903
127	32768	8388607	2147483647	9223372036854775807
255	65535	16777215	4294967295	18446744073709551615
255	65535	16777215	4294967295	18446744073709551615
DELETE FROM t1
WHERE c1 > 0 AND c1 < 100
ORDER BY c1;
DELETE FROM t2
WHERE c1 > 0 AND c1 < 100
ORDER BY c1;
SELECT * FROM t1 ORDER BY c1;
c1	c2	c3	c4	c5
-128	-32768	-8388608	-2147483648	-9223372036854775808
-128	-32768	-8388608	-2147483648	-9223372036854775808
-64	-16384	-4194304	-1073741824	-4611686018427387903
-1	-1	-1	-1	-1
0	0	0	0	0
0	0	0	0	0
0	0	0	0	0
0	0	0	0	0
0	0	0	0	0
0	0	0	0	0
127	32767	8388607	2147483647	9223372036854775807
127	32767	8388607	2147483647	9223372036854775807
SELECT * FROM t2 ORDER BY c1;
c1	c2	c3	c4	c5
0	0	0	0	0
0	0	0	0	0
0	0	0	0	0
0	0	0	0	0
0	0	0	0	0
0	0	0	0	0
0	0	0	0	0
127	32768	8388607	2147483647	9223372036854775807
255	65535	16777215	4294967295	18446744073709551615
255	65535	16777215	4294967295	18446744073709551615
DROP TABLE IF EXISTS t1;
DROP TABLE IF EXISTS t2;
