DROP TABLE IF EXISTS t1;
CREATE TABLE t1(c1 BIGINT SIGNED NOT NULL )
ENGINE=cloud;
INSERT INTO t1 VALUES
(-9223372036854775808),
(0),
(0),
(0),
(0),
(4611686018427387903 - 2),
(4611686018427387903 - 1),
(4611686018427387903),
(4611686018427387903),
(4611686018427387903 + 1),
(4611686018427387903 + 2),
(9223372036854775807);
SELECT * FROM t1 ORDER BY c1 ASC;
c1
-9223372036854775808
0
0
0
0
4611686018427387901
4611686018427387902
4611686018427387903
4611686018427387903
4611686018427387904
4611686018427387905
9223372036854775807
SELECT * FROM t1 ORDER BY c1 DESC;
c1
9223372036854775807
4611686018427387905
4611686018427387904
4611686018427387903
4611686018427387903
4611686018427387902
4611686018427387901
0
0
0
0
-9223372036854775808
SELECT * FROM t1 WHERE c1 >  4611686018427387903 ORDER BY c1 ASC;
c1
4611686018427387904
4611686018427387905
9223372036854775807
SELECT * FROM t1 WHERE c1 >= 4611686018427387903 ORDER BY c1 ASC;
c1
4611686018427387903
4611686018427387903
4611686018427387904
4611686018427387905
9223372036854775807
SELECT * FROM t1 WHERE c1 <  4611686018427387903 ORDER BY c1 ASC;
c1
-9223372036854775808
0
0
0
0
4611686018427387901
4611686018427387902
SELECT * FROM t1 WHERE c1 >= 4611686018427387903 ORDER BY c1 ASC;
c1
4611686018427387903
4611686018427387903
4611686018427387904
4611686018427387905
9223372036854775807
SELECT * FROM t1 WHERE c1 =  4611686018427387903 ORDER BY c1 ASC;
c1
4611686018427387903
4611686018427387903
SELECT * FROM t1 WHERE c1 >  4611686018427387903 ORDER BY c1 DESC;
c1
9223372036854775807
4611686018427387905
4611686018427387904
SELECT * FROM t1 WHERE c1 >= 4611686018427387903 ORDER BY c1 DESC;
c1
9223372036854775807
4611686018427387905
4611686018427387904
4611686018427387903
4611686018427387903
SELECT * FROM t1 WHERE c1 <  4611686018427387903 ORDER BY c1 DESC;
c1
4611686018427387902
4611686018427387901
0
0
0
0
-9223372036854775808
SELECT * FROM t1 WHERE c1 >= 4611686018427387903 ORDER BY c1 DESC;
c1
9223372036854775807
4611686018427387905
4611686018427387904
4611686018427387903
4611686018427387903
SELECT * FROM t1 WHERE c1 =  4611686018427387903 ORDER BY c1 DESC;
c1
4611686018427387903
4611686018427387903
UPDATE t1
SET c1 = 4611686018427387903
WHERE c1 <= 0 + 0 AND c1 >= 0 - 0
LIMIT 2;
SELECT * FROM t1 ORDER BY c1;
c1
-9223372036854775808
0
0
4611686018427387901
4611686018427387902
4611686018427387903
4611686018427387903
4611686018427387903
4611686018427387903
4611686018427387904
4611686018427387905
9223372036854775807
DELETE FROM t1
WHERE c1 <= 0 + 0 AND c1 >= 0 - 0
ORDER BY c1;
SELECT * FROM t1 ORDER BY c1;
c1
-9223372036854775808
4611686018427387901
4611686018427387902
4611686018427387903
4611686018427387903
4611686018427387903
4611686018427387903
4611686018427387904
4611686018427387905
9223372036854775807
DROP TABLE t1;
DROP TABLE IF EXISTS t1;
CREATE TABLE t1(c1 BIGINT SIGNED )
ENGINE=cloud;
INSERT INTO t1 VALUES
(-9223372036854775808),
(0),
(4611686018427387903),
(9223372036854775807),
(NULL),
(NULL);
SELECT * FROM t1 WHERE c1 IS     NULL ORDER BY c1 ASC;
c1
NULL
NULL
SELECT * FROM t1 WHERE c1 IS NOT NULL ORDER BY c1 DESC;
c1
9223372036854775807
4611686018427387903
0
-9223372036854775808
SELECT * FROM t1 WHERE c1 IS     NULL ORDER BY c1 ASC;
c1
NULL
NULL
SELECT * FROM t1 WHERE c1 IS NOT NULL ORDER BY c1 DESC;
c1
9223372036854775807
4611686018427387903
0
-9223372036854775808
UPDATE t1
SET c1 = 0
WHERE c1 IS NULL;
SELECT * FROM t1 ORDER BY c1;
c1
-9223372036854775808
0
0
0
4611686018427387903
9223372036854775807
UPDATE t1
SET c1 = 0
WHERE c1 IS NULL;
SELECT * FROM t1 ORDER BY c1;
c1
-9223372036854775808
0
0
0
4611686018427387903
9223372036854775807
DELETE FROM t1
WHERE c1 IS NULL
ORDER BY c1;
SELECT * FROM t1 ORDER BY c1;
c1
-9223372036854775808
0
0
0
4611686018427387903
9223372036854775807
DROP TABLE t1;
DROP TABLE IF EXISTS t1;
CREATE TABLE t1(c1 BIGINT SIGNED  )
ENGINE=cloud;
INSERT INTO t1 VALUES
(-9223372036854775808),
(0),
(0),
(0),
(0),
(4611686018427387903 - 2),
(4611686018427387903 - 1),
(4611686018427387903),
(4611686018427387903),
(4611686018427387903 + 1),
(4611686018427387903 + 2),
(9223372036854775807);
SELECT * FROM t1 ORDER BY c1 ASC;
c1
-9223372036854775808
0
0
0
0
4611686018427387901
4611686018427387902
4611686018427387903
4611686018427387903
4611686018427387904
4611686018427387905
9223372036854775807
SELECT * FROM t1 ORDER BY c1 DESC;
c1
9223372036854775807
4611686018427387905
4611686018427387904
4611686018427387903
4611686018427387903
4611686018427387902
4611686018427387901
0
0
0
0
-9223372036854775808
SELECT * FROM t1 WHERE c1 >  4611686018427387903 ORDER BY c1 ASC;
c1
4611686018427387904
4611686018427387905
9223372036854775807
SELECT * FROM t1 WHERE c1 >= 4611686018427387903 ORDER BY c1 ASC;
c1
4611686018427387903
4611686018427387903
4611686018427387904
4611686018427387905
9223372036854775807
SELECT * FROM t1 WHERE c1 <  4611686018427387903 ORDER BY c1 ASC;
c1
-9223372036854775808
0
0
0
0
4611686018427387901
4611686018427387902
SELECT * FROM t1 WHERE c1 >= 4611686018427387903 ORDER BY c1 ASC;
c1
4611686018427387903
4611686018427387903
4611686018427387904
4611686018427387905
9223372036854775807
SELECT * FROM t1 WHERE c1 =  4611686018427387903 ORDER BY c1 ASC;
c1
4611686018427387903
4611686018427387903
SELECT * FROM t1 WHERE c1 >  4611686018427387903 ORDER BY c1 DESC;
c1
9223372036854775807
4611686018427387905
4611686018427387904
SELECT * FROM t1 WHERE c1 >= 4611686018427387903 ORDER BY c1 DESC;
c1
9223372036854775807
4611686018427387905
4611686018427387904
4611686018427387903
4611686018427387903
SELECT * FROM t1 WHERE c1 <  4611686018427387903 ORDER BY c1 DESC;
c1
4611686018427387902
4611686018427387901
0
0
0
0
-9223372036854775808
SELECT * FROM t1 WHERE c1 >= 4611686018427387903 ORDER BY c1 DESC;
c1
9223372036854775807
4611686018427387905
4611686018427387904
4611686018427387903
4611686018427387903
SELECT * FROM t1 WHERE c1 =  4611686018427387903 ORDER BY c1 DESC;
c1
4611686018427387903
4611686018427387903
UPDATE t1
SET c1 = 4611686018427387903
WHERE c1 <= 0 + 0 AND c1 >= 0 - 0
LIMIT 2;
SELECT * FROM t1 ORDER BY c1;
c1
-9223372036854775808
0
0
4611686018427387901
4611686018427387902
4611686018427387903
4611686018427387903
4611686018427387903
4611686018427387903
4611686018427387904
4611686018427387905
9223372036854775807
DELETE FROM t1
WHERE c1 <= 0 + 0 AND c1 >= 0 - 0
ORDER BY c1;
SELECT * FROM t1 ORDER BY c1;
c1
-9223372036854775808
4611686018427387901
4611686018427387902
4611686018427387903
4611686018427387903
4611686018427387903
4611686018427387903
4611686018427387904
4611686018427387905
9223372036854775807
DROP TABLE t1;
DROP TABLE IF EXISTS t1;
CREATE TABLE t1(c1 BIGINT SIGNED NOT NULL , INDEX(c1))
ENGINE=cloud;
INSERT INTO t1 VALUES
(-9223372036854775808),
(0),
(0),
(0),
(0),
(4611686018427387903 - 2),
(4611686018427387903 - 1),
(4611686018427387903),
(4611686018427387903),
(4611686018427387903 + 1),
(4611686018427387903 + 2),
(9223372036854775807);
SELECT * FROM t1 ORDER BY c1 ASC;
c1
-9223372036854775808
0
0
0
0
4611686018427387901
4611686018427387902
4611686018427387903
4611686018427387903
4611686018427387904
4611686018427387905
9223372036854775807
SELECT * FROM t1 ORDER BY c1 DESC;
c1
9223372036854775807
4611686018427387905
4611686018427387904
4611686018427387903
4611686018427387903
4611686018427387902
4611686018427387901
0
0
0
0
-9223372036854775808
SELECT * FROM t1 WHERE c1 >  4611686018427387903 ORDER BY c1 ASC;
c1
4611686018427387904
4611686018427387905
9223372036854775807
SELECT * FROM t1 WHERE c1 >= 4611686018427387903 ORDER BY c1 ASC;
c1
4611686018427387903
4611686018427387903
4611686018427387904
4611686018427387905
9223372036854775807
SELECT * FROM t1 WHERE c1 <  4611686018427387903 ORDER BY c1 ASC;
c1
-9223372036854775808
0
0
0
0
4611686018427387901
4611686018427387902
SELECT * FROM t1 WHERE c1 >= 4611686018427387903 ORDER BY c1 ASC;
c1
4611686018427387903
4611686018427387903
4611686018427387904
4611686018427387905
9223372036854775807
SELECT * FROM t1 WHERE c1 =  4611686018427387903 ORDER BY c1 ASC;
c1
4611686018427387903
4611686018427387903
SELECT * FROM t1 WHERE c1 >  4611686018427387903 ORDER BY c1 DESC;
c1
9223372036854775807
4611686018427387905
4611686018427387904
SELECT * FROM t1 WHERE c1 >= 4611686018427387903 ORDER BY c1 DESC;
c1
9223372036854775807
4611686018427387905
4611686018427387904
4611686018427387903
4611686018427387903
SELECT * FROM t1 WHERE c1 <  4611686018427387903 ORDER BY c1 DESC;
c1
4611686018427387902
4611686018427387901
0
0
0
0
-9223372036854775808
SELECT * FROM t1 WHERE c1 >= 4611686018427387903 ORDER BY c1 DESC;
c1
9223372036854775807
4611686018427387905
4611686018427387904
4611686018427387903
4611686018427387903
SELECT * FROM t1 WHERE c1 =  4611686018427387903 ORDER BY c1 DESC;
c1
4611686018427387903
4611686018427387903
UPDATE t1
SET c1 = 4611686018427387903
WHERE c1 <= 0 + 0 AND c1 >= 0 - 0
LIMIT 2;
SELECT * FROM t1 ORDER BY c1;
c1
-9223372036854775808
0
0
4611686018427387901
4611686018427387902
4611686018427387903
4611686018427387903
4611686018427387903
4611686018427387903
4611686018427387904
4611686018427387905
9223372036854775807
DELETE FROM t1
WHERE c1 <= 0 + 0 AND c1 >= 0 - 0
ORDER BY c1;
SELECT * FROM t1 ORDER BY c1;
c1
-9223372036854775808
4611686018427387901
4611686018427387902
4611686018427387903
4611686018427387903
4611686018427387903
4611686018427387903
4611686018427387904
4611686018427387905
9223372036854775807
DROP TABLE t1;
DROP TABLE IF EXISTS t1;
CREATE TABLE t1(c1 BIGINT SIGNED )
ENGINE=cloud;
INSERT INTO t1 VALUES
(-9223372036854775808),
(0),
(4611686018427387903),
(9223372036854775807),
(NULL),
(NULL);
SELECT * FROM t1 WHERE c1 IS     NULL ORDER BY c1 ASC;
c1
NULL
NULL
SELECT * FROM t1 WHERE c1 IS NOT NULL ORDER BY c1 DESC;
c1
9223372036854775807
4611686018427387903
0
-9223372036854775808
SELECT * FROM t1 WHERE c1 IS     NULL ORDER BY c1 ASC;
c1
NULL
NULL
SELECT * FROM t1 WHERE c1 IS NOT NULL ORDER BY c1 DESC;
c1
9223372036854775807
4611686018427387903
0
-9223372036854775808
UPDATE t1
SET c1 = 0
WHERE c1 IS NULL;
SELECT * FROM t1 ORDER BY c1;
c1
-9223372036854775808
0
0
0
4611686018427387903
9223372036854775807
UPDATE t1
SET c1 = 0
WHERE c1 IS NULL;
SELECT * FROM t1 ORDER BY c1;
c1
-9223372036854775808
0
0
0
4611686018427387903
9223372036854775807
DELETE FROM t1
WHERE c1 IS NULL
ORDER BY c1;
SELECT * FROM t1 ORDER BY c1;
c1
-9223372036854775808
0
0
0
4611686018427387903
9223372036854775807
DROP TABLE t1;
DROP TABLE IF EXISTS t1;
CREATE TABLE t1(c1 BIGINT SIGNED  , INDEX(c1))
ENGINE=cloud;
INSERT INTO t1 VALUES
(-9223372036854775808),
(0),
(0),
(0),
(0),
(4611686018427387903 - 2),
(4611686018427387903 - 1),
(4611686018427387903),
(4611686018427387903),
(4611686018427387903 + 1),
(4611686018427387903 + 2),
(9223372036854775807);
SELECT * FROM t1 ORDER BY c1 ASC;
c1
-9223372036854775808
0
0
0
0
4611686018427387901
4611686018427387902
4611686018427387903
4611686018427387903
4611686018427387904
4611686018427387905
9223372036854775807
SELECT * FROM t1 ORDER BY c1 DESC;
c1
9223372036854775807
4611686018427387905
4611686018427387904
4611686018427387903
4611686018427387903
4611686018427387902
4611686018427387901
0
0
0
0
-9223372036854775808
SELECT * FROM t1 WHERE c1 >  4611686018427387903 ORDER BY c1 ASC;
c1
4611686018427387904
4611686018427387905
9223372036854775807
SELECT * FROM t1 WHERE c1 >= 4611686018427387903 ORDER BY c1 ASC;
c1
4611686018427387903
4611686018427387903
4611686018427387904
4611686018427387905
9223372036854775807
SELECT * FROM t1 WHERE c1 <  4611686018427387903 ORDER BY c1 ASC;
c1
-9223372036854775808
0
0
0
0
4611686018427387901
4611686018427387902
SELECT * FROM t1 WHERE c1 >= 4611686018427387903 ORDER BY c1 ASC;
c1
4611686018427387903
4611686018427387903
4611686018427387904
4611686018427387905
9223372036854775807
SELECT * FROM t1 WHERE c1 =  4611686018427387903 ORDER BY c1 ASC;
c1
4611686018427387903
4611686018427387903
SELECT * FROM t1 WHERE c1 >  4611686018427387903 ORDER BY c1 DESC;
c1
9223372036854775807
4611686018427387905
4611686018427387904
SELECT * FROM t1 WHERE c1 >= 4611686018427387903 ORDER BY c1 DESC;
c1
9223372036854775807
4611686018427387905
4611686018427387904
4611686018427387903
4611686018427387903
SELECT * FROM t1 WHERE c1 <  4611686018427387903 ORDER BY c1 DESC;
c1
4611686018427387902
4611686018427387901
0
0
0
0
-9223372036854775808
SELECT * FROM t1 WHERE c1 >= 4611686018427387903 ORDER BY c1 DESC;
c1
9223372036854775807
4611686018427387905
4611686018427387904
4611686018427387903
4611686018427387903
SELECT * FROM t1 WHERE c1 =  4611686018427387903 ORDER BY c1 DESC;
c1
4611686018427387903
4611686018427387903
UPDATE t1
SET c1 = 4611686018427387903
WHERE c1 <= 0 + 0 AND c1 >= 0 - 0
LIMIT 2;
SELECT * FROM t1 ORDER BY c1;
c1
-9223372036854775808
0
0
4611686018427387901
4611686018427387902
4611686018427387903
4611686018427387903
4611686018427387903
4611686018427387903
4611686018427387904
4611686018427387905
9223372036854775807
DELETE FROM t1
WHERE c1 <= 0 + 0 AND c1 >= 0 - 0
ORDER BY c1;
SELECT * FROM t1 ORDER BY c1;
c1
-9223372036854775808
4611686018427387901
4611686018427387902
4611686018427387903
4611686018427387903
4611686018427387903
4611686018427387903
4611686018427387904
4611686018427387905
9223372036854775807
DROP TABLE t1;
DROP TABLE IF EXISTS t1;
CREATE TABLE t1(c1 BIGINT UNSIGNED NOT NULL )
ENGINE=cloud;
INSERT INTO t1 VALUES
(0),
(0),
(0),
(0),
(0),
(4611686018427387903 - 2),
(4611686018427387903 - 1),
(4611686018427387903),
(4611686018427387903),
(4611686018427387903 + 1),
(4611686018427387903 + 2),
(9223372036854775807);
SELECT * FROM t1 ORDER BY c1 ASC;
c1
0
0
0
0
0
4611686018427387901
4611686018427387902
4611686018427387903
4611686018427387903
4611686018427387904
4611686018427387905
9223372036854775807
SELECT * FROM t1 ORDER BY c1 DESC;
c1
9223372036854775807
4611686018427387905
4611686018427387904
4611686018427387903
4611686018427387903
4611686018427387902
4611686018427387901
0
0
0
0
0
SELECT * FROM t1 WHERE c1 >  4611686018427387903 ORDER BY c1 ASC;
c1
4611686018427387904
4611686018427387905
9223372036854775807
SELECT * FROM t1 WHERE c1 >= 4611686018427387903 ORDER BY c1 ASC;
c1
4611686018427387903
4611686018427387903
4611686018427387904
4611686018427387905
9223372036854775807
SELECT * FROM t1 WHERE c1 <  4611686018427387903 ORDER BY c1 ASC;
c1
0
0
0
0
0
4611686018427387901
4611686018427387902
SELECT * FROM t1 WHERE c1 >= 4611686018427387903 ORDER BY c1 ASC;
c1
4611686018427387903
4611686018427387903
4611686018427387904
4611686018427387905
9223372036854775807
SELECT * FROM t1 WHERE c1 =  4611686018427387903 ORDER BY c1 ASC;
c1
4611686018427387903
4611686018427387903
SELECT * FROM t1 WHERE c1 >  4611686018427387903 ORDER BY c1 DESC;
c1
9223372036854775807
4611686018427387905
4611686018427387904
SELECT * FROM t1 WHERE c1 >= 4611686018427387903 ORDER BY c1 DESC;
c1
9223372036854775807
4611686018427387905
4611686018427387904
4611686018427387903
4611686018427387903
SELECT * FROM t1 WHERE c1 <  4611686018427387903 ORDER BY c1 DESC;
c1
4611686018427387902
4611686018427387901
0
0
0
0
0
SELECT * FROM t1 WHERE c1 >= 4611686018427387903 ORDER BY c1 DESC;
c1
9223372036854775807
4611686018427387905
4611686018427387904
4611686018427387903
4611686018427387903
SELECT * FROM t1 WHERE c1 =  4611686018427387903 ORDER BY c1 DESC;
c1
4611686018427387903
4611686018427387903
UPDATE t1
SET c1 = 4611686018427387903
WHERE c1 <= 0 + 0 AND c1 >= 0 - 0
LIMIT 2;
SELECT * FROM t1 ORDER BY c1;
c1
0
0
0
4611686018427387901
4611686018427387902
4611686018427387903
4611686018427387903
4611686018427387903
4611686018427387903
4611686018427387904
4611686018427387905
9223372036854775807
DELETE FROM t1
WHERE c1 <= 0 + 0 AND c1 >= 0 - 0
ORDER BY c1;
SELECT * FROM t1 ORDER BY c1;
c1
4611686018427387901
4611686018427387902
4611686018427387903
4611686018427387903
4611686018427387903
4611686018427387903
4611686018427387904
4611686018427387905
9223372036854775807
DROP TABLE t1;
DROP TABLE IF EXISTS t1;
CREATE TABLE t1(c1 BIGINT UNSIGNED )
ENGINE=cloud;
INSERT INTO t1 VALUES
(0),
(0),
(4611686018427387903),
(9223372036854775807),
(NULL),
(NULL);
SELECT * FROM t1 WHERE c1 IS     NULL ORDER BY c1 ASC;
c1
NULL
NULL
SELECT * FROM t1 WHERE c1 IS NOT NULL ORDER BY c1 DESC;
c1
9223372036854775807
4611686018427387903
0
0
SELECT * FROM t1 WHERE c1 IS     NULL ORDER BY c1 ASC;
c1
NULL
NULL
SELECT * FROM t1 WHERE c1 IS NOT NULL ORDER BY c1 DESC;
c1
9223372036854775807
4611686018427387903
0
0
UPDATE t1
SET c1 = 0
WHERE c1 IS NULL;
SELECT * FROM t1 ORDER BY c1;
c1
0
0
0
0
4611686018427387903
9223372036854775807
UPDATE t1
SET c1 = 0
WHERE c1 IS NULL;
SELECT * FROM t1 ORDER BY c1;
c1
0
0
0
0
4611686018427387903
9223372036854775807
DELETE FROM t1
WHERE c1 IS NULL
ORDER BY c1;
SELECT * FROM t1 ORDER BY c1;
c1
0
0
0
0
4611686018427387903
9223372036854775807
DROP TABLE t1;
DROP TABLE IF EXISTS t1;
CREATE TABLE t1(c1 BIGINT UNSIGNED  )
ENGINE=cloud;
INSERT INTO t1 VALUES
(0),
(0),
(0),
(0),
(0),
(4611686018427387903 - 2),
(4611686018427387903 - 1),
(4611686018427387903),
(4611686018427387903),
(4611686018427387903 + 1),
(4611686018427387903 + 2),
(9223372036854775807);
SELECT * FROM t1 ORDER BY c1 ASC;
c1
0
0
0
0
0
4611686018427387901
4611686018427387902
4611686018427387903
4611686018427387903
4611686018427387904
4611686018427387905
9223372036854775807
SELECT * FROM t1 ORDER BY c1 DESC;
c1
9223372036854775807
4611686018427387905
4611686018427387904
4611686018427387903
4611686018427387903
4611686018427387902
4611686018427387901
0
0
0
0
0
SELECT * FROM t1 WHERE c1 >  4611686018427387903 ORDER BY c1 ASC;
c1
4611686018427387904
4611686018427387905
9223372036854775807
SELECT * FROM t1 WHERE c1 >= 4611686018427387903 ORDER BY c1 ASC;
c1
4611686018427387903
4611686018427387903
4611686018427387904
4611686018427387905
9223372036854775807
SELECT * FROM t1 WHERE c1 <  4611686018427387903 ORDER BY c1 ASC;
c1
0
0
0
0
0
4611686018427387901
4611686018427387902
SELECT * FROM t1 WHERE c1 >= 4611686018427387903 ORDER BY c1 ASC;
c1
4611686018427387903
4611686018427387903
4611686018427387904
4611686018427387905
9223372036854775807
SELECT * FROM t1 WHERE c1 =  4611686018427387903 ORDER BY c1 ASC;
c1
4611686018427387903
4611686018427387903
SELECT * FROM t1 WHERE c1 >  4611686018427387903 ORDER BY c1 DESC;
c1
9223372036854775807
4611686018427387905
4611686018427387904
SELECT * FROM t1 WHERE c1 >= 4611686018427387903 ORDER BY c1 DESC;
c1
9223372036854775807
4611686018427387905
4611686018427387904
4611686018427387903
4611686018427387903
SELECT * FROM t1 WHERE c1 <  4611686018427387903 ORDER BY c1 DESC;
c1
4611686018427387902
4611686018427387901
0
0
0
0
0
SELECT * FROM t1 WHERE c1 >= 4611686018427387903 ORDER BY c1 DESC;
c1
9223372036854775807
4611686018427387905
4611686018427387904
4611686018427387903
4611686018427387903
SELECT * FROM t1 WHERE c1 =  4611686018427387903 ORDER BY c1 DESC;
c1
4611686018427387903
4611686018427387903
UPDATE t1
SET c1 = 4611686018427387903
WHERE c1 <= 0 + 0 AND c1 >= 0 - 0
LIMIT 2;
SELECT * FROM t1 ORDER BY c1;
c1
0
0
0
4611686018427387901
4611686018427387902
4611686018427387903
4611686018427387903
4611686018427387903
4611686018427387903
4611686018427387904
4611686018427387905
9223372036854775807
DELETE FROM t1
WHERE c1 <= 0 + 0 AND c1 >= 0 - 0
ORDER BY c1;
SELECT * FROM t1 ORDER BY c1;
c1
4611686018427387901
4611686018427387902
4611686018427387903
4611686018427387903
4611686018427387903
4611686018427387903
4611686018427387904
4611686018427387905
9223372036854775807
DROP TABLE t1;
DROP TABLE IF EXISTS t1;
CREATE TABLE t1(c1 BIGINT UNSIGNED NOT NULL , INDEX(c1))
ENGINE=cloud;
INSERT INTO t1 VALUES
(0),
(0),
(0),
(0),
(0),
(4611686018427387903 - 2),
(4611686018427387903 - 1),
(4611686018427387903),
(4611686018427387903),
(4611686018427387903 + 1),
(4611686018427387903 + 2),
(9223372036854775807);
SELECT * FROM t1 ORDER BY c1 ASC;
c1
0
0
0
0
0
4611686018427387901
4611686018427387902
4611686018427387903
4611686018427387903
4611686018427387904
4611686018427387905
9223372036854775807
SELECT * FROM t1 ORDER BY c1 DESC;
c1
9223372036854775807
4611686018427387905
4611686018427387904
4611686018427387903
4611686018427387903
4611686018427387902
4611686018427387901
0
0
0
0
0
SELECT * FROM t1 WHERE c1 >  4611686018427387903 ORDER BY c1 ASC;
c1
4611686018427387904
4611686018427387905
9223372036854775807
SELECT * FROM t1 WHERE c1 >= 4611686018427387903 ORDER BY c1 ASC;
c1
4611686018427387903
4611686018427387903
4611686018427387904
4611686018427387905
9223372036854775807
SELECT * FROM t1 WHERE c1 <  4611686018427387903 ORDER BY c1 ASC;
c1
0
0
0
0
0
4611686018427387901
4611686018427387902
SELECT * FROM t1 WHERE c1 >= 4611686018427387903 ORDER BY c1 ASC;
c1
4611686018427387903
4611686018427387903
4611686018427387904
4611686018427387905
9223372036854775807
SELECT * FROM t1 WHERE c1 =  4611686018427387903 ORDER BY c1 ASC;
c1
4611686018427387903
4611686018427387903
SELECT * FROM t1 WHERE c1 >  4611686018427387903 ORDER BY c1 DESC;
c1
9223372036854775807
4611686018427387905
4611686018427387904
SELECT * FROM t1 WHERE c1 >= 4611686018427387903 ORDER BY c1 DESC;
c1
9223372036854775807
4611686018427387905
4611686018427387904
4611686018427387903
4611686018427387903
SELECT * FROM t1 WHERE c1 <  4611686018427387903 ORDER BY c1 DESC;
c1
4611686018427387902
4611686018427387901
0
0
0
0
0
SELECT * FROM t1 WHERE c1 >= 4611686018427387903 ORDER BY c1 DESC;
c1
9223372036854775807
4611686018427387905
4611686018427387904
4611686018427387903
4611686018427387903
SELECT * FROM t1 WHERE c1 =  4611686018427387903 ORDER BY c1 DESC;
c1
4611686018427387903
4611686018427387903
UPDATE t1
SET c1 = 4611686018427387903
WHERE c1 <= 0 + 0 AND c1 >= 0 - 0
LIMIT 2;
SELECT * FROM t1 ORDER BY c1;
c1
0
0
0
4611686018427387901
4611686018427387902
4611686018427387903
4611686018427387903
4611686018427387903
4611686018427387903
4611686018427387904
4611686018427387905
9223372036854775807
DELETE FROM t1
WHERE c1 <= 0 + 0 AND c1 >= 0 - 0
ORDER BY c1;
SELECT * FROM t1 ORDER BY c1;
c1
4611686018427387901
4611686018427387902
4611686018427387903
4611686018427387903
4611686018427387903
4611686018427387903
4611686018427387904
4611686018427387905
9223372036854775807
DROP TABLE t1;
DROP TABLE IF EXISTS t1;
CREATE TABLE t1(c1 BIGINT UNSIGNED )
ENGINE=cloud;
INSERT INTO t1 VALUES
(0),
(0),
(4611686018427387903),
(9223372036854775807),
(NULL),
(NULL);
SELECT * FROM t1 WHERE c1 IS     NULL ORDER BY c1 ASC;
c1
NULL
NULL
SELECT * FROM t1 WHERE c1 IS NOT NULL ORDER BY c1 DESC;
c1
9223372036854775807
4611686018427387903
0
0
SELECT * FROM t1 WHERE c1 IS     NULL ORDER BY c1 ASC;
c1
NULL
NULL
SELECT * FROM t1 WHERE c1 IS NOT NULL ORDER BY c1 DESC;
c1
9223372036854775807
4611686018427387903
0
0
UPDATE t1
SET c1 = 0
WHERE c1 IS NULL;
SELECT * FROM t1 ORDER BY c1;
c1
0
0
0
0
4611686018427387903
9223372036854775807
UPDATE t1
SET c1 = 0
WHERE c1 IS NULL;
SELECT * FROM t1 ORDER BY c1;
c1
0
0
0
0
4611686018427387903
9223372036854775807
DELETE FROM t1
WHERE c1 IS NULL
ORDER BY c1;
SELECT * FROM t1 ORDER BY c1;
c1
0
0
0
0
4611686018427387903
9223372036854775807
DROP TABLE t1;
DROP TABLE IF EXISTS t1;
CREATE TABLE t1(c1 BIGINT UNSIGNED  , INDEX(c1))
ENGINE=cloud;
INSERT INTO t1 VALUES
(0),
(0),
(0),
(0),
(0),
(4611686018427387903 - 2),
(4611686018427387903 - 1),
(4611686018427387903),
(4611686018427387903),
(4611686018427387903 + 1),
(4611686018427387903 + 2),
(9223372036854775807);
SELECT * FROM t1 ORDER BY c1 ASC;
c1
0
0
0
0
0
4611686018427387901
4611686018427387902
4611686018427387903
4611686018427387903
4611686018427387904
4611686018427387905
9223372036854775807
SELECT * FROM t1 ORDER BY c1 DESC;
c1
9223372036854775807
4611686018427387905
4611686018427387904
4611686018427387903
4611686018427387903
4611686018427387902
4611686018427387901
0
0
0
0
0
SELECT * FROM t1 WHERE c1 >  4611686018427387903 ORDER BY c1 ASC;
c1
4611686018427387904
4611686018427387905
9223372036854775807
SELECT * FROM t1 WHERE c1 >= 4611686018427387903 ORDER BY c1 ASC;
c1
4611686018427387903
4611686018427387903
4611686018427387904
4611686018427387905
9223372036854775807
SELECT * FROM t1 WHERE c1 <  4611686018427387903 ORDER BY c1 ASC;
c1
0
0
0
0
0
4611686018427387901
4611686018427387902
SELECT * FROM t1 WHERE c1 >= 4611686018427387903 ORDER BY c1 ASC;
c1
4611686018427387903
4611686018427387903
4611686018427387904
4611686018427387905
9223372036854775807
SELECT * FROM t1 WHERE c1 =  4611686018427387903 ORDER BY c1 ASC;
c1
4611686018427387903
4611686018427387903
SELECT * FROM t1 WHERE c1 >  4611686018427387903 ORDER BY c1 DESC;
c1
9223372036854775807
4611686018427387905
4611686018427387904
SELECT * FROM t1 WHERE c1 >= 4611686018427387903 ORDER BY c1 DESC;
c1
9223372036854775807
4611686018427387905
4611686018427387904
4611686018427387903
4611686018427387903
SELECT * FROM t1 WHERE c1 <  4611686018427387903 ORDER BY c1 DESC;
c1
4611686018427387902
4611686018427387901
0
0
0
0
0
SELECT * FROM t1 WHERE c1 >= 4611686018427387903 ORDER BY c1 DESC;
c1
9223372036854775807
4611686018427387905
4611686018427387904
4611686018427387903
4611686018427387903
SELECT * FROM t1 WHERE c1 =  4611686018427387903 ORDER BY c1 DESC;
c1
4611686018427387903
4611686018427387903
UPDATE t1
SET c1 = 4611686018427387903
WHERE c1 <= 0 + 0 AND c1 >= 0 - 0
LIMIT 2;
SELECT * FROM t1 ORDER BY c1;
c1
0
0
0
4611686018427387901
4611686018427387902
4611686018427387903
4611686018427387903
4611686018427387903
4611686018427387903
4611686018427387904
4611686018427387905
9223372036854775807
DELETE FROM t1
WHERE c1 <= 0 + 0 AND c1 >= 0 - 0
ORDER BY c1;
SELECT * FROM t1 ORDER BY c1;
c1
4611686018427387901
4611686018427387902
4611686018427387903
4611686018427387903
4611686018427387903
4611686018427387903
4611686018427387904
4611686018427387905
9223372036854775807
DROP TABLE t1;
