DROP TABLE IF EXISTS t1;
CREATE TABLE t1(c1 DATE NOT NULL )
ENGINE=cloud;
INSERT INTO t1 VALUES
('2000-06-15'),
('2001-06-15'),
('2002-06-15'),
('2003-06-25'),
('2004-06-15'),
('2005-06-15'),
('2006-06-15'),
('2003-05-15'),
('2003-07-15'),
('2003-06-14'),
('2003-06-16'),
('1000-01-01'),
('9999-12-31'),
('2003-06-15'),
('2003-06-15'),
('2003-06-15'),
('2003-06-15');
SELECT * FROM t1 ORDER BY c1 ASC;
c1
1000-01-01
2000-06-15
2001-06-15
2002-06-15
2003-05-15
2003-06-14
2003-06-15
2003-06-15
2003-06-15
2003-06-15
2003-06-16
2003-06-25
2003-07-15
2004-06-15
2005-06-15
2006-06-15
9999-12-31
SELECT * FROM t1 ORDER BY c1 DESC;
c1
9999-12-31
2006-06-15
2005-06-15
2004-06-15
2003-07-15
2003-06-25
2003-06-16
2003-06-15
2003-06-15
2003-06-15
2003-06-15
2003-06-14
2003-05-15
2002-06-15
2001-06-15
2000-06-15
1000-01-01
SELECT * FROM t1 WHERE c1 >  '2003-06-15' ORDER BY c1 ASC;
c1
2003-06-16
2003-06-25
2003-07-15
2004-06-15
2005-06-15
2006-06-15
9999-12-31
SELECT * FROM t1 WHERE c1 >= '2003-06-15' ORDER BY c1 ASC;
c1
2003-06-15
2003-06-15
2003-06-15
2003-06-15
2003-06-16
2003-06-25
2003-07-15
2004-06-15
2005-06-15
2006-06-15
9999-12-31
SELECT * FROM t1 WHERE c1 <  '2003-06-15' ORDER BY c1 ASC;
c1
1000-01-01
2000-06-15
2001-06-15
2002-06-15
2003-05-15
2003-06-14
SELECT * FROM t1 WHERE c1 >= '2003-06-15' ORDER BY c1 ASC;
c1
2003-06-15
2003-06-15
2003-06-15
2003-06-15
2003-06-16
2003-06-25
2003-07-15
2004-06-15
2005-06-15
2006-06-15
9999-12-31
SELECT * FROM t1 WHERE c1 =  '2003-06-15' ORDER BY c1 ASC;
c1
2003-06-15
2003-06-15
2003-06-15
2003-06-15
SELECT * FROM t1 WHERE c1 >  '2003-06-15' ORDER BY c1 DESC;
c1
9999-12-31
2006-06-15
2005-06-15
2004-06-15
2003-07-15
2003-06-25
2003-06-16
SELECT * FROM t1 WHERE c1 >= '2003-06-15' ORDER BY c1 DESC;
c1
9999-12-31
2006-06-15
2005-06-15
2004-06-15
2003-07-15
2003-06-25
2003-06-16
2003-06-15
2003-06-15
2003-06-15
2003-06-15
SELECT * FROM t1 WHERE c1 <  '2003-06-15' ORDER BY c1 DESC;
c1
2003-06-14
2003-05-15
2002-06-15
2001-06-15
2000-06-15
1000-01-01
SELECT * FROM t1 WHERE c1 >= '2003-06-15' ORDER BY c1 DESC;
c1
9999-12-31
2006-06-15
2005-06-15
2004-06-15
2003-07-15
2003-06-25
2003-06-16
2003-06-15
2003-06-15
2003-06-15
2003-06-15
SELECT * FROM t1 WHERE c1 =  '2003-06-15' ORDER BY c1 DESC;
c1
2003-06-15
2003-06-15
2003-06-15
2003-06-15
UPDATE t1
SET c1 = '2006-06-15'
WHERE c1 = '2003-06-15'
LIMIT 2;
SELECT * FROM t1 ORDER BY c1;
c1
1000-01-01
2000-06-15
2001-06-15
2002-06-15
2003-05-15
2003-06-14
2003-06-15
2003-06-15
2003-06-16
2003-06-25
2003-07-15
2004-06-15
2005-06-15
2006-06-15
2006-06-15
2006-06-15
9999-12-31
DELETE FROM t1
WHERE c1 = '2003-06-15'
ORDER BY c1;
SELECT * FROM t1 ORDER BY c1;
c1
1000-01-01
2000-06-15
2001-06-15
2002-06-15
2003-05-15
2003-06-14
2003-06-16
2003-06-25
2003-07-15
2004-06-15
2005-06-15
2006-06-15
2006-06-15
2006-06-15
9999-12-31
DROP TABLE IF EXISTS t1;
CREATE TABLE t1(c1 DATE  )
ENGINE=cloud;
INSERT INTO t1 VALUES
('2000-06-15'),
('2001-06-15'),
('2002-06-15'),
('2003-06-25'),
('2004-06-15'),
('2005-06-15'),
('2006-06-15'),
('2003-05-15'),
('2003-07-15'),
('2003-06-14'),
('2003-06-16'),
('1000-01-01'),
('9999-12-31'),
('2003-06-15'),
(NULL),
(NULL),
(NULL),
(NULL);
SELECT * FROM t1 WHERE c1 IS     NULL ORDER BY c1 ASC;
c1
NULL
NULL
NULL
NULL
SELECT * FROM t1 WHERE c1 IS NOT NULL ORDER BY c1 DESC;
c1
9999-12-31
2006-06-15
2005-06-15
2004-06-15
2003-07-15
2003-06-25
2003-06-16
2003-06-15
2003-06-14
2003-05-15
2002-06-15
2001-06-15
2000-06-15
1000-01-01
SELECT * FROM t1 WHERE c1 IS     NULL ORDER BY c1 ASC;
c1
NULL
NULL
NULL
NULL
SELECT * FROM t1 WHERE c1 IS NOT NULL ORDER BY c1 DESC;
c1
9999-12-31
2006-06-15
2005-06-15
2004-06-15
2003-07-15
2003-06-25
2003-06-16
2003-06-15
2003-06-14
2003-05-15
2002-06-15
2001-06-15
2000-06-15
1000-01-01
UPDATE t1
SET c1 = '2003-06-15'
WHERE c1 IS NULL
LIMIT 2;
SELECT * FROM t1 ORDER BY c1;
c1
NULL
NULL
1000-01-01
2000-06-15
2001-06-15
2002-06-15
2003-05-15
2003-06-14
2003-06-15
2003-06-15
2003-06-15
2003-06-16
2003-06-25
2003-07-15
2004-06-15
2005-06-15
2006-06-15
9999-12-31
DELETE FROM t1
WHERE c1 IS NULL
ORDER BY c1;
SELECT * FROM t1 ORDER BY c1;
c1
1000-01-01
2000-06-15
2001-06-15
2002-06-15
2003-05-15
2003-06-14
2003-06-15
2003-06-15
2003-06-15
2003-06-16
2003-06-25
2003-07-15
2004-06-15
2005-06-15
2006-06-15
9999-12-31
DROP TABLE IF EXISTS t1;
CREATE TABLE t1(c1 DATE  )
ENGINE=cloud;
INSERT INTO t1 VALUES
('2000-06-15'),
('2001-06-15'),
('2002-06-15'),
('2003-06-25'),
('2004-06-15'),
('2005-06-15'),
('2006-06-15'),
('2003-05-15'),
('2003-07-15'),
('2003-06-14'),
('2003-06-16'),
('1000-01-01'),
('9999-12-31'),
('2003-06-15'),
('2003-06-15'),
('2003-06-15'),
('2003-06-15');
SELECT * FROM t1 ORDER BY c1 ASC;
c1
1000-01-01
2000-06-15
2001-06-15
2002-06-15
2003-05-15
2003-06-14
2003-06-15
2003-06-15
2003-06-15
2003-06-15
2003-06-16
2003-06-25
2003-07-15
2004-06-15
2005-06-15
2006-06-15
9999-12-31
SELECT * FROM t1 ORDER BY c1 DESC;
c1
9999-12-31
2006-06-15
2005-06-15
2004-06-15
2003-07-15
2003-06-25
2003-06-16
2003-06-15
2003-06-15
2003-06-15
2003-06-15
2003-06-14
2003-05-15
2002-06-15
2001-06-15
2000-06-15
1000-01-01
SELECT * FROM t1 WHERE c1 >  '2003-06-15' ORDER BY c1 ASC;
c1
2003-06-16
2003-06-25
2003-07-15
2004-06-15
2005-06-15
2006-06-15
9999-12-31
SELECT * FROM t1 WHERE c1 >= '2003-06-15' ORDER BY c1 ASC;
c1
2003-06-15
2003-06-15
2003-06-15
2003-06-15
2003-06-16
2003-06-25
2003-07-15
2004-06-15
2005-06-15
2006-06-15
9999-12-31
SELECT * FROM t1 WHERE c1 <  '2003-06-15' ORDER BY c1 ASC;
c1
1000-01-01
2000-06-15
2001-06-15
2002-06-15
2003-05-15
2003-06-14
SELECT * FROM t1 WHERE c1 >= '2003-06-15' ORDER BY c1 ASC;
c1
2003-06-15
2003-06-15
2003-06-15
2003-06-15
2003-06-16
2003-06-25
2003-07-15
2004-06-15
2005-06-15
2006-06-15
9999-12-31
SELECT * FROM t1 WHERE c1 =  '2003-06-15' ORDER BY c1 ASC;
c1
2003-06-15
2003-06-15
2003-06-15
2003-06-15
SELECT * FROM t1 WHERE c1 >  '2003-06-15' ORDER BY c1 DESC;
c1
9999-12-31
2006-06-15
2005-06-15
2004-06-15
2003-07-15
2003-06-25
2003-06-16
SELECT * FROM t1 WHERE c1 >= '2003-06-15' ORDER BY c1 DESC;
c1
9999-12-31
2006-06-15
2005-06-15
2004-06-15
2003-07-15
2003-06-25
2003-06-16
2003-06-15
2003-06-15
2003-06-15
2003-06-15
SELECT * FROM t1 WHERE c1 <  '2003-06-15' ORDER BY c1 DESC;
c1
2003-06-14
2003-05-15
2002-06-15
2001-06-15
2000-06-15
1000-01-01
SELECT * FROM t1 WHERE c1 >= '2003-06-15' ORDER BY c1 DESC;
c1
9999-12-31
2006-06-15
2005-06-15
2004-06-15
2003-07-15
2003-06-25
2003-06-16
2003-06-15
2003-06-15
2003-06-15
2003-06-15
SELECT * FROM t1 WHERE c1 =  '2003-06-15' ORDER BY c1 DESC;
c1
2003-06-15
2003-06-15
2003-06-15
2003-06-15
UPDATE t1
SET c1 = '2006-06-15'
WHERE c1 = '2003-06-15'
LIMIT 2;
SELECT * FROM t1 ORDER BY c1;
c1
1000-01-01
2000-06-15
2001-06-15
2002-06-15
2003-05-15
2003-06-14
2003-06-15
2003-06-15
2003-06-16
2003-06-25
2003-07-15
2004-06-15
2005-06-15
2006-06-15
2006-06-15
2006-06-15
9999-12-31
DELETE FROM t1
WHERE c1 = '2003-06-15'
ORDER BY c1;
SELECT * FROM t1 ORDER BY c1;
c1
1000-01-01
2000-06-15
2001-06-15
2002-06-15
2003-05-15
2003-06-14
2003-06-16
2003-06-25
2003-07-15
2004-06-15
2005-06-15
2006-06-15
2006-06-15
2006-06-15
9999-12-31
DROP TABLE IF EXISTS t1;
CREATE TABLE t1(c1 DATE NOT NULL , INDEX(c1))
ENGINE=cloud;
INSERT INTO t1 VALUES
('2000-06-15'),
('2001-06-15'),
('2002-06-15'),
('2003-06-25'),
('2004-06-15'),
('2005-06-15'),
('2006-06-15'),
('2003-05-15'),
('2003-07-15'),
('2003-06-14'),
('2003-06-16'),
('1000-01-01'),
('9999-12-31'),
('2003-06-15'),
('2003-06-15'),
('2003-06-15'),
('2003-06-15');
SELECT * FROM t1 ORDER BY c1 ASC;
c1
1000-01-01
2000-06-15
2001-06-15
2002-06-15
2003-05-15
2003-06-14
2003-06-15
2003-06-15
2003-06-15
2003-06-15
2003-06-16
2003-06-25
2003-07-15
2004-06-15
2005-06-15
2006-06-15
9999-12-31
SELECT * FROM t1 ORDER BY c1 DESC;
c1
9999-12-31
2006-06-15
2005-06-15
2004-06-15
2003-07-15
2003-06-25
2003-06-16
2003-06-15
2003-06-15
2003-06-15
2003-06-15
2003-06-14
2003-05-15
2002-06-15
2001-06-15
2000-06-15
1000-01-01
SELECT * FROM t1 WHERE c1 >  '2003-06-15' ORDER BY c1 ASC;
c1
2003-06-16
2003-06-25
2003-07-15
2004-06-15
2005-06-15
2006-06-15
9999-12-31
SELECT * FROM t1 WHERE c1 >= '2003-06-15' ORDER BY c1 ASC;
c1
2003-06-15
2003-06-15
2003-06-15
2003-06-15
2003-06-16
2003-06-25
2003-07-15
2004-06-15
2005-06-15
2006-06-15
9999-12-31
SELECT * FROM t1 WHERE c1 <  '2003-06-15' ORDER BY c1 ASC;
c1
1000-01-01
2000-06-15
2001-06-15
2002-06-15
2003-05-15
2003-06-14
SELECT * FROM t1 WHERE c1 >= '2003-06-15' ORDER BY c1 ASC;
c1
2003-06-15
2003-06-15
2003-06-15
2003-06-15
2003-06-16
2003-06-25
2003-07-15
2004-06-15
2005-06-15
2006-06-15
9999-12-31
SELECT * FROM t1 WHERE c1 =  '2003-06-15' ORDER BY c1 ASC;
c1
2003-06-15
2003-06-15
2003-06-15
2003-06-15
SELECT * FROM t1 WHERE c1 >  '2003-06-15' ORDER BY c1 DESC;
c1
9999-12-31
2006-06-15
2005-06-15
2004-06-15
2003-07-15
2003-06-25
2003-06-16
SELECT * FROM t1 WHERE c1 >= '2003-06-15' ORDER BY c1 DESC;
c1
9999-12-31
2006-06-15
2005-06-15
2004-06-15
2003-07-15
2003-06-25
2003-06-16
2003-06-15
2003-06-15
2003-06-15
2003-06-15
SELECT * FROM t1 WHERE c1 <  '2003-06-15' ORDER BY c1 DESC;
c1
2003-06-14
2003-05-15
2002-06-15
2001-06-15
2000-06-15
1000-01-01
SELECT * FROM t1 WHERE c1 >= '2003-06-15' ORDER BY c1 DESC;
c1
9999-12-31
2006-06-15
2005-06-15
2004-06-15
2003-07-15
2003-06-25
2003-06-16
2003-06-15
2003-06-15
2003-06-15
2003-06-15
SELECT * FROM t1 WHERE c1 =  '2003-06-15' ORDER BY c1 DESC;
c1
2003-06-15
2003-06-15
2003-06-15
2003-06-15
UPDATE t1
SET c1 = '2006-06-15'
WHERE c1 = '2003-06-15'
LIMIT 2;
SELECT * FROM t1 ORDER BY c1;
c1
1000-01-01
2000-06-15
2001-06-15
2002-06-15
2003-05-15
2003-06-14
2003-06-15
2003-06-15
2003-06-16
2003-06-25
2003-07-15
2004-06-15
2005-06-15
2006-06-15
2006-06-15
2006-06-15
9999-12-31
DELETE FROM t1
WHERE c1 = '2003-06-15'
ORDER BY c1;
SELECT * FROM t1 ORDER BY c1;
c1
1000-01-01
2000-06-15
2001-06-15
2002-06-15
2003-05-15
2003-06-14
2003-06-16
2003-06-25
2003-07-15
2004-06-15
2005-06-15
2006-06-15
2006-06-15
2006-06-15
9999-12-31
DROP TABLE IF EXISTS t1;
CREATE TABLE t1(c1 DATE  , INDEX(c1))
ENGINE=cloud;
INSERT INTO t1 VALUES
('2000-06-15'),
('2001-06-15'),
('2002-06-15'),
('2003-06-25'),
('2004-06-15'),
('2005-06-15'),
('2006-06-15'),
('2003-05-15'),
('2003-07-15'),
('2003-06-14'),
('2003-06-16'),
('1000-01-01'),
('9999-12-31'),
('2003-06-15'),
(NULL),
(NULL),
(NULL),
(NULL);
SELECT * FROM t1 WHERE c1 IS     NULL ORDER BY c1 ASC;
c1
NULL
NULL
NULL
NULL
SELECT * FROM t1 WHERE c1 IS NOT NULL ORDER BY c1 DESC;
c1
9999-12-31
2006-06-15
2005-06-15
2004-06-15
2003-07-15
2003-06-25
2003-06-16
2003-06-15
2003-06-14
2003-05-15
2002-06-15
2001-06-15
2000-06-15
1000-01-01
SELECT * FROM t1 WHERE c1 IS     NULL ORDER BY c1 ASC;
c1
NULL
NULL
NULL
NULL
SELECT * FROM t1 WHERE c1 IS NOT NULL ORDER BY c1 DESC;
c1
9999-12-31
2006-06-15
2005-06-15
2004-06-15
2003-07-15
2003-06-25
2003-06-16
2003-06-15
2003-06-14
2003-05-15
2002-06-15
2001-06-15
2000-06-15
1000-01-01
UPDATE t1
SET c1 = '2003-06-15'
WHERE c1 IS NULL
LIMIT 2;
SELECT * FROM t1 ORDER BY c1;
c1
NULL
NULL
1000-01-01
2000-06-15
2001-06-15
2002-06-15
2003-05-15
2003-06-14
2003-06-15
2003-06-15
2003-06-15
2003-06-16
2003-06-25
2003-07-15
2004-06-15
2005-06-15
2006-06-15
9999-12-31
DELETE FROM t1
WHERE c1 IS NULL
ORDER BY c1;
SELECT * FROM t1 ORDER BY c1;
c1
1000-01-01
2000-06-15
2001-06-15
2002-06-15
2003-05-15
2003-06-14
2003-06-15
2003-06-15
2003-06-15
2003-06-16
2003-06-25
2003-07-15
2004-06-15
2005-06-15
2006-06-15
9999-12-31
DROP TABLE IF EXISTS t1;
CREATE TABLE t1(c1 DATE  , INDEX(c1))
ENGINE=cloud;
INSERT INTO t1 VALUES
('2000-06-15'),
('2001-06-15'),
('2002-06-15'),
('2003-06-25'),
('2004-06-15'),
('2005-06-15'),
('2006-06-15'),
('2003-05-15'),
('2003-07-15'),
('2003-06-14'),
('2003-06-16'),
('1000-01-01'),
('9999-12-31'),
('2003-06-15'),
('2003-06-15'),
('2003-06-15'),
('2003-06-15');
SELECT * FROM t1 ORDER BY c1 ASC;
c1
1000-01-01
2000-06-15
2001-06-15
2002-06-15
2003-05-15
2003-06-14
2003-06-15
2003-06-15
2003-06-15
2003-06-15
2003-06-16
2003-06-25
2003-07-15
2004-06-15
2005-06-15
2006-06-15
9999-12-31
SELECT * FROM t1 ORDER BY c1 DESC;
c1
9999-12-31
2006-06-15
2005-06-15
2004-06-15
2003-07-15
2003-06-25
2003-06-16
2003-06-15
2003-06-15
2003-06-15
2003-06-15
2003-06-14
2003-05-15
2002-06-15
2001-06-15
2000-06-15
1000-01-01
SELECT * FROM t1 WHERE c1 >  '2003-06-15' ORDER BY c1 ASC;
c1
2003-06-16
2003-06-25
2003-07-15
2004-06-15
2005-06-15
2006-06-15
9999-12-31
SELECT * FROM t1 WHERE c1 >= '2003-06-15' ORDER BY c1 ASC;
c1
2003-06-15
2003-06-15
2003-06-15
2003-06-15
2003-06-16
2003-06-25
2003-07-15
2004-06-15
2005-06-15
2006-06-15
9999-12-31
SELECT * FROM t1 WHERE c1 <  '2003-06-15' ORDER BY c1 ASC;
c1
1000-01-01
2000-06-15
2001-06-15
2002-06-15
2003-05-15
2003-06-14
SELECT * FROM t1 WHERE c1 >= '2003-06-15' ORDER BY c1 ASC;
c1
2003-06-15
2003-06-15
2003-06-15
2003-06-15
2003-06-16
2003-06-25
2003-07-15
2004-06-15
2005-06-15
2006-06-15
9999-12-31
SELECT * FROM t1 WHERE c1 =  '2003-06-15' ORDER BY c1 ASC;
c1
2003-06-15
2003-06-15
2003-06-15
2003-06-15
SELECT * FROM t1 WHERE c1 >  '2003-06-15' ORDER BY c1 DESC;
c1
9999-12-31
2006-06-15
2005-06-15
2004-06-15
2003-07-15
2003-06-25
2003-06-16
SELECT * FROM t1 WHERE c1 >= '2003-06-15' ORDER BY c1 DESC;
c1
9999-12-31
2006-06-15
2005-06-15
2004-06-15
2003-07-15
2003-06-25
2003-06-16
2003-06-15
2003-06-15
2003-06-15
2003-06-15
SELECT * FROM t1 WHERE c1 <  '2003-06-15' ORDER BY c1 DESC;
c1
2003-06-14
2003-05-15
2002-06-15
2001-06-15
2000-06-15
1000-01-01
SELECT * FROM t1 WHERE c1 >= '2003-06-15' ORDER BY c1 DESC;
c1
9999-12-31
2006-06-15
2005-06-15
2004-06-15
2003-07-15
2003-06-25
2003-06-16
2003-06-15
2003-06-15
2003-06-15
2003-06-15
SELECT * FROM t1 WHERE c1 =  '2003-06-15' ORDER BY c1 DESC;
c1
2003-06-15
2003-06-15
2003-06-15
2003-06-15
UPDATE t1
SET c1 = '2006-06-15'
WHERE c1 = '2003-06-15'
LIMIT 2;
SELECT * FROM t1 ORDER BY c1;
c1
1000-01-01
2000-06-15
2001-06-15
2002-06-15
2003-05-15
2003-06-14
2003-06-15
2003-06-15
2003-06-16
2003-06-25
2003-07-15
2004-06-15
2005-06-15
2006-06-15
2006-06-15
2006-06-15
9999-12-31
DELETE FROM t1
WHERE c1 = '2003-06-15'
ORDER BY c1;
SELECT * FROM t1 ORDER BY c1;
c1
1000-01-01
2000-06-15
2001-06-15
2002-06-15
2003-05-15
2003-06-14
2003-06-16
2003-06-25
2003-07-15
2004-06-15
2005-06-15
2006-06-15
2006-06-15
2006-06-15
9999-12-31
DROP TABLE IF EXISTS t1;
CREATE TABLE t1(c1 DATE NOT NULL )
ENGINE=cloud;
INSERT INTO t1 VALUES
('2000-06-15'),
('2001-06-15'),
('2002-06-15'),
('2003-06-25'),
('2004-06-15'),
('2005-06-15'),
('2006-06-15'),
('2003-05-15'),
('2003-07-15'),
('2003-06-14'),
('2003-06-16'),
('1000-01-01'),
('9999-12-31'),
('2003-06-15'),
('2003-06-15'),
('2003-06-15'),
('2003-06-15');
SELECT * FROM t1 ORDER BY c1 ASC;
c1
1000-01-01
2000-06-15
2001-06-15
2002-06-15
2003-05-15
2003-06-14
2003-06-15
2003-06-15
2003-06-15
2003-06-15
2003-06-16
2003-06-25
2003-07-15
2004-06-15
2005-06-15
2006-06-15
9999-12-31
SELECT * FROM t1 ORDER BY c1 DESC;
c1
9999-12-31
2006-06-15
2005-06-15
2004-06-15
2003-07-15
2003-06-25
2003-06-16
2003-06-15
2003-06-15
2003-06-15
2003-06-15
2003-06-14
2003-05-15
2002-06-15
2001-06-15
2000-06-15
1000-01-01
SELECT * FROM t1 WHERE c1 >  '2003-06-15' ORDER BY c1 ASC;
c1
2003-06-16
2003-06-25
2003-07-15
2004-06-15
2005-06-15
2006-06-15
9999-12-31
SELECT * FROM t1 WHERE c1 >= '2003-06-15' ORDER BY c1 ASC;
c1
2003-06-15
2003-06-15
2003-06-15
2003-06-15
2003-06-16
2003-06-25
2003-07-15
2004-06-15
2005-06-15
2006-06-15
9999-12-31
SELECT * FROM t1 WHERE c1 <  '2003-06-15' ORDER BY c1 ASC;
c1
1000-01-01
2000-06-15
2001-06-15
2002-06-15
2003-05-15
2003-06-14
SELECT * FROM t1 WHERE c1 >= '2003-06-15' ORDER BY c1 ASC;
c1
2003-06-15
2003-06-15
2003-06-15
2003-06-15
2003-06-16
2003-06-25
2003-07-15
2004-06-15
2005-06-15
2006-06-15
9999-12-31
SELECT * FROM t1 WHERE c1 =  '2003-06-15' ORDER BY c1 ASC;
c1
2003-06-15
2003-06-15
2003-06-15
2003-06-15
SELECT * FROM t1 WHERE c1 >  '2003-06-15' ORDER BY c1 DESC;
c1
9999-12-31
2006-06-15
2005-06-15
2004-06-15
2003-07-15
2003-06-25
2003-06-16
SELECT * FROM t1 WHERE c1 >= '2003-06-15' ORDER BY c1 DESC;
c1
9999-12-31
2006-06-15
2005-06-15
2004-06-15
2003-07-15
2003-06-25
2003-06-16
2003-06-15
2003-06-15
2003-06-15
2003-06-15
SELECT * FROM t1 WHERE c1 <  '2003-06-15' ORDER BY c1 DESC;
c1
2003-06-14
2003-05-15
2002-06-15
2001-06-15
2000-06-15
1000-01-01
SELECT * FROM t1 WHERE c1 >= '2003-06-15' ORDER BY c1 DESC;
c1
9999-12-31
2006-06-15
2005-06-15
2004-06-15
2003-07-15
2003-06-25
2003-06-16
2003-06-15
2003-06-15
2003-06-15
2003-06-15
SELECT * FROM t1 WHERE c1 =  '2003-06-15' ORDER BY c1 DESC;
c1
2003-06-15
2003-06-15
2003-06-15
2003-06-15
UPDATE t1
SET c1 = '2006-06-15'
WHERE c1 = '2003-06-15'
LIMIT 2;
SELECT * FROM t1 ORDER BY c1;
c1
1000-01-01
2000-06-15
2001-06-15
2002-06-15
2003-05-15
2003-06-14
2003-06-15
2003-06-15
2003-06-16
2003-06-25
2003-07-15
2004-06-15
2005-06-15
2006-06-15
2006-06-15
2006-06-15
9999-12-31
DELETE FROM t1
WHERE c1 = '2003-06-15'
ORDER BY c1;
SELECT * FROM t1 ORDER BY c1;
c1
1000-01-01
2000-06-15
2001-06-15
2002-06-15
2003-05-15
2003-06-14
2003-06-16
2003-06-25
2003-07-15
2004-06-15
2005-06-15
2006-06-15
2006-06-15
2006-06-15
9999-12-31
DROP TABLE IF EXISTS t1;
CREATE TABLE t1(c1 DATE  )
ENGINE=cloud;
INSERT INTO t1 VALUES
('2000-06-15'),
('2001-06-15'),
('2002-06-15'),
('2003-06-25'),
('2004-06-15'),
('2005-06-15'),
('2006-06-15'),
('2003-05-15'),
('2003-07-15'),
('2003-06-14'),
('2003-06-16'),
('1000-01-01'),
('9999-12-31'),
('2003-06-15'),
(NULL),
(NULL),
(NULL),
(NULL);
SELECT * FROM t1 WHERE c1 IS     NULL ORDER BY c1 ASC;
c1
NULL
NULL
NULL
NULL
SELECT * FROM t1 WHERE c1 IS NOT NULL ORDER BY c1 DESC;
c1
9999-12-31
2006-06-15
2005-06-15
2004-06-15
2003-07-15
2003-06-25
2003-06-16
2003-06-15
2003-06-14
2003-05-15
2002-06-15
2001-06-15
2000-06-15
1000-01-01
SELECT * FROM t1 WHERE c1 IS     NULL ORDER BY c1 ASC;
c1
NULL
NULL
NULL
NULL
SELECT * FROM t1 WHERE c1 IS NOT NULL ORDER BY c1 DESC;
c1
9999-12-31
2006-06-15
2005-06-15
2004-06-15
2003-07-15
2003-06-25
2003-06-16
2003-06-15
2003-06-14
2003-05-15
2002-06-15
2001-06-15
2000-06-15
1000-01-01
UPDATE t1
SET c1 = '2003-06-15'
WHERE c1 IS NULL
LIMIT 2;
SELECT * FROM t1 ORDER BY c1;
c1
NULL
NULL
1000-01-01
2000-06-15
2001-06-15
2002-06-15
2003-05-15
2003-06-14
2003-06-15
2003-06-15
2003-06-15
2003-06-16
2003-06-25
2003-07-15
2004-06-15
2005-06-15
2006-06-15
9999-12-31
DELETE FROM t1
WHERE c1 IS NULL
ORDER BY c1;
SELECT * FROM t1 ORDER BY c1;
c1
1000-01-01
2000-06-15
2001-06-15
2002-06-15
2003-05-15
2003-06-14
2003-06-15
2003-06-15
2003-06-15
2003-06-16
2003-06-25
2003-07-15
2004-06-15
2005-06-15
2006-06-15
9999-12-31
DROP TABLE IF EXISTS t1;
CREATE TABLE t1(c1 DATE  )
ENGINE=cloud;
INSERT INTO t1 VALUES
('2000-06-15'),
('2001-06-15'),
('2002-06-15'),
('2003-06-25'),
('2004-06-15'),
('2005-06-15'),
('2006-06-15'),
('2003-05-15'),
('2003-07-15'),
('2003-06-14'),
('2003-06-16'),
('1000-01-01'),
('9999-12-31'),
('2003-06-15'),
('2003-06-15'),
('2003-06-15'),
('2003-06-15');
SELECT * FROM t1 ORDER BY c1 ASC;
c1
1000-01-01
2000-06-15
2001-06-15
2002-06-15
2003-05-15
2003-06-14
2003-06-15
2003-06-15
2003-06-15
2003-06-15
2003-06-16
2003-06-25
2003-07-15
2004-06-15
2005-06-15
2006-06-15
9999-12-31
SELECT * FROM t1 ORDER BY c1 DESC;
c1
9999-12-31
2006-06-15
2005-06-15
2004-06-15
2003-07-15
2003-06-25
2003-06-16
2003-06-15
2003-06-15
2003-06-15
2003-06-15
2003-06-14
2003-05-15
2002-06-15
2001-06-15
2000-06-15
1000-01-01
SELECT * FROM t1 WHERE c1 >  '2003-06-15' ORDER BY c1 ASC;
c1
2003-06-16
2003-06-25
2003-07-15
2004-06-15
2005-06-15
2006-06-15
9999-12-31
SELECT * FROM t1 WHERE c1 >= '2003-06-15' ORDER BY c1 ASC;
c1
2003-06-15
2003-06-15
2003-06-15
2003-06-15
2003-06-16
2003-06-25
2003-07-15
2004-06-15
2005-06-15
2006-06-15
9999-12-31
SELECT * FROM t1 WHERE c1 <  '2003-06-15' ORDER BY c1 ASC;
c1
1000-01-01
2000-06-15
2001-06-15
2002-06-15
2003-05-15
2003-06-14
SELECT * FROM t1 WHERE c1 >= '2003-06-15' ORDER BY c1 ASC;
c1
2003-06-15
2003-06-15
2003-06-15
2003-06-15
2003-06-16
2003-06-25
2003-07-15
2004-06-15
2005-06-15
2006-06-15
9999-12-31
SELECT * FROM t1 WHERE c1 =  '2003-06-15' ORDER BY c1 ASC;
c1
2003-06-15
2003-06-15
2003-06-15
2003-06-15
SELECT * FROM t1 WHERE c1 >  '2003-06-15' ORDER BY c1 DESC;
c1
9999-12-31
2006-06-15
2005-06-15
2004-06-15
2003-07-15
2003-06-25
2003-06-16
SELECT * FROM t1 WHERE c1 >= '2003-06-15' ORDER BY c1 DESC;
c1
9999-12-31
2006-06-15
2005-06-15
2004-06-15
2003-07-15
2003-06-25
2003-06-16
2003-06-15
2003-06-15
2003-06-15
2003-06-15
SELECT * FROM t1 WHERE c1 <  '2003-06-15' ORDER BY c1 DESC;
c1
2003-06-14
2003-05-15
2002-06-15
2001-06-15
2000-06-15
1000-01-01
SELECT * FROM t1 WHERE c1 >= '2003-06-15' ORDER BY c1 DESC;
c1
9999-12-31
2006-06-15
2005-06-15
2004-06-15
2003-07-15
2003-06-25
2003-06-16
2003-06-15
2003-06-15
2003-06-15
2003-06-15
SELECT * FROM t1 WHERE c1 =  '2003-06-15' ORDER BY c1 DESC;
c1
2003-06-15
2003-06-15
2003-06-15
2003-06-15
UPDATE t1
SET c1 = '2006-06-15'
WHERE c1 = '2003-06-15'
LIMIT 2;
SELECT * FROM t1 ORDER BY c1;
c1
1000-01-01
2000-06-15
2001-06-15
2002-06-15
2003-05-15
2003-06-14
2003-06-15
2003-06-15
2003-06-16
2003-06-25
2003-07-15
2004-06-15
2005-06-15
2006-06-15
2006-06-15
2006-06-15
9999-12-31
DELETE FROM t1
WHERE c1 = '2003-06-15'
ORDER BY c1;
SELECT * FROM t1 ORDER BY c1;
c1
1000-01-01
2000-06-15
2001-06-15
2002-06-15
2003-05-15
2003-06-14
2003-06-16
2003-06-25
2003-07-15
2004-06-15
2005-06-15
2006-06-15
2006-06-15
2006-06-15
9999-12-31
DROP TABLE IF EXISTS t1;
CREATE TABLE t1(c1 DATE NOT NULL , INDEX(c1))
ENGINE=cloud;
INSERT INTO t1 VALUES
('2000-06-15'),
('2001-06-15'),
('2002-06-15'),
('2003-06-25'),
('2004-06-15'),
('2005-06-15'),
('2006-06-15'),
('2003-05-15'),
('2003-07-15'),
('2003-06-14'),
('2003-06-16'),
('1000-01-01'),
('9999-12-31'),
('2003-06-15'),
('2003-06-15'),
('2003-06-15'),
('2003-06-15');
SELECT * FROM t1 ORDER BY c1 ASC;
c1
1000-01-01
2000-06-15
2001-06-15
2002-06-15
2003-05-15
2003-06-14
2003-06-15
2003-06-15
2003-06-15
2003-06-15
2003-06-16
2003-06-25
2003-07-15
2004-06-15
2005-06-15
2006-06-15
9999-12-31
SELECT * FROM t1 ORDER BY c1 DESC;
c1
9999-12-31
2006-06-15
2005-06-15
2004-06-15
2003-07-15
2003-06-25
2003-06-16
2003-06-15
2003-06-15
2003-06-15
2003-06-15
2003-06-14
2003-05-15
2002-06-15
2001-06-15
2000-06-15
1000-01-01
SELECT * FROM t1 WHERE c1 >  '2003-06-15' ORDER BY c1 ASC;
c1
2003-06-16
2003-06-25
2003-07-15
2004-06-15
2005-06-15
2006-06-15
9999-12-31
SELECT * FROM t1 WHERE c1 >= '2003-06-15' ORDER BY c1 ASC;
c1
2003-06-15
2003-06-15
2003-06-15
2003-06-15
2003-06-16
2003-06-25
2003-07-15
2004-06-15
2005-06-15
2006-06-15
9999-12-31
SELECT * FROM t1 WHERE c1 <  '2003-06-15' ORDER BY c1 ASC;
c1
1000-01-01
2000-06-15
2001-06-15
2002-06-15
2003-05-15
2003-06-14
SELECT * FROM t1 WHERE c1 >= '2003-06-15' ORDER BY c1 ASC;
c1
2003-06-15
2003-06-15
2003-06-15
2003-06-15
2003-06-16
2003-06-25
2003-07-15
2004-06-15
2005-06-15
2006-06-15
9999-12-31
SELECT * FROM t1 WHERE c1 =  '2003-06-15' ORDER BY c1 ASC;
c1
2003-06-15
2003-06-15
2003-06-15
2003-06-15
SELECT * FROM t1 WHERE c1 >  '2003-06-15' ORDER BY c1 DESC;
c1
9999-12-31
2006-06-15
2005-06-15
2004-06-15
2003-07-15
2003-06-25
2003-06-16
SELECT * FROM t1 WHERE c1 >= '2003-06-15' ORDER BY c1 DESC;
c1
9999-12-31
2006-06-15
2005-06-15
2004-06-15
2003-07-15
2003-06-25
2003-06-16
2003-06-15
2003-06-15
2003-06-15
2003-06-15
SELECT * FROM t1 WHERE c1 <  '2003-06-15' ORDER BY c1 DESC;
c1
2003-06-14
2003-05-15
2002-06-15
2001-06-15
2000-06-15
1000-01-01
SELECT * FROM t1 WHERE c1 >= '2003-06-15' ORDER BY c1 DESC;
c1
9999-12-31
2006-06-15
2005-06-15
2004-06-15
2003-07-15
2003-06-25
2003-06-16
2003-06-15
2003-06-15
2003-06-15
2003-06-15
SELECT * FROM t1 WHERE c1 =  '2003-06-15' ORDER BY c1 DESC;
c1
2003-06-15
2003-06-15
2003-06-15
2003-06-15
UPDATE t1
SET c1 = '2006-06-15'
WHERE c1 = '2003-06-15'
LIMIT 2;
SELECT * FROM t1 ORDER BY c1;
c1
1000-01-01
2000-06-15
2001-06-15
2002-06-15
2003-05-15
2003-06-14
2003-06-15
2003-06-15
2003-06-16
2003-06-25
2003-07-15
2004-06-15
2005-06-15
2006-06-15
2006-06-15
2006-06-15
9999-12-31
DELETE FROM t1
WHERE c1 = '2003-06-15'
ORDER BY c1;
SELECT * FROM t1 ORDER BY c1;
c1
1000-01-01
2000-06-15
2001-06-15
2002-06-15
2003-05-15
2003-06-14
2003-06-16
2003-06-25
2003-07-15
2004-06-15
2005-06-15
2006-06-15
2006-06-15
2006-06-15
9999-12-31
DROP TABLE IF EXISTS t1;
CREATE TABLE t1(c1 DATE  , INDEX(c1))
ENGINE=cloud;
INSERT INTO t1 VALUES
('2000-06-15'),
('2001-06-15'),
('2002-06-15'),
('2003-06-25'),
('2004-06-15'),
('2005-06-15'),
('2006-06-15'),
('2003-05-15'),
('2003-07-15'),
('2003-06-14'),
('2003-06-16'),
('1000-01-01'),
('9999-12-31'),
('2003-06-15'),
(NULL),
(NULL),
(NULL),
(NULL);
SELECT * FROM t1 WHERE c1 IS     NULL ORDER BY c1 ASC;
c1
NULL
NULL
NULL
NULL
SELECT * FROM t1 WHERE c1 IS NOT NULL ORDER BY c1 DESC;
c1
9999-12-31
2006-06-15
2005-06-15
2004-06-15
2003-07-15
2003-06-25
2003-06-16
2003-06-15
2003-06-14
2003-05-15
2002-06-15
2001-06-15
2000-06-15
1000-01-01
SELECT * FROM t1 WHERE c1 IS     NULL ORDER BY c1 ASC;
c1
NULL
NULL
NULL
NULL
SELECT * FROM t1 WHERE c1 IS NOT NULL ORDER BY c1 DESC;
c1
9999-12-31
2006-06-15
2005-06-15
2004-06-15
2003-07-15
2003-06-25
2003-06-16
2003-06-15
2003-06-14
2003-05-15
2002-06-15
2001-06-15
2000-06-15
1000-01-01
UPDATE t1
SET c1 = '2003-06-15'
WHERE c1 IS NULL
LIMIT 2;
SELECT * FROM t1 ORDER BY c1;
c1
NULL
NULL
1000-01-01
2000-06-15
2001-06-15
2002-06-15
2003-05-15
2003-06-14
2003-06-15
2003-06-15
2003-06-15
2003-06-16
2003-06-25
2003-07-15
2004-06-15
2005-06-15
2006-06-15
9999-12-31
DELETE FROM t1
WHERE c1 IS NULL
ORDER BY c1;
SELECT * FROM t1 ORDER BY c1;
c1
1000-01-01
2000-06-15
2001-06-15
2002-06-15
2003-05-15
2003-06-14
2003-06-15
2003-06-15
2003-06-15
2003-06-16
2003-06-25
2003-07-15
2004-06-15
2005-06-15
2006-06-15
9999-12-31
DROP TABLE IF EXISTS t1;
CREATE TABLE t1(c1 DATE  , INDEX(c1))
ENGINE=cloud;
INSERT INTO t1 VALUES
('2000-06-15'),
('2001-06-15'),
('2002-06-15'),
('2003-06-25'),
('2004-06-15'),
('2005-06-15'),
('2006-06-15'),
('2003-05-15'),
('2003-07-15'),
('2003-06-14'),
('2003-06-16'),
('1000-01-01'),
('9999-12-31'),
('2003-06-15'),
('2003-06-15'),
('2003-06-15'),
('2003-06-15');
SELECT * FROM t1 ORDER BY c1 ASC;
c1
1000-01-01
2000-06-15
2001-06-15
2002-06-15
2003-05-15
2003-06-14
2003-06-15
2003-06-15
2003-06-15
2003-06-15
2003-06-16
2003-06-25
2003-07-15
2004-06-15
2005-06-15
2006-06-15
9999-12-31
SELECT * FROM t1 ORDER BY c1 DESC;
c1
9999-12-31
2006-06-15
2005-06-15
2004-06-15
2003-07-15
2003-06-25
2003-06-16
2003-06-15
2003-06-15
2003-06-15
2003-06-15
2003-06-14
2003-05-15
2002-06-15
2001-06-15
2000-06-15
1000-01-01
SELECT * FROM t1 WHERE c1 >  '2003-06-15' ORDER BY c1 ASC;
c1
2003-06-16
2003-06-25
2003-07-15
2004-06-15
2005-06-15
2006-06-15
9999-12-31
SELECT * FROM t1 WHERE c1 >= '2003-06-15' ORDER BY c1 ASC;
c1
2003-06-15
2003-06-15
2003-06-15
2003-06-15
2003-06-16
2003-06-25
2003-07-15
2004-06-15
2005-06-15
2006-06-15
9999-12-31
SELECT * FROM t1 WHERE c1 <  '2003-06-15' ORDER BY c1 ASC;
c1
1000-01-01
2000-06-15
2001-06-15
2002-06-15
2003-05-15
2003-06-14
SELECT * FROM t1 WHERE c1 >= '2003-06-15' ORDER BY c1 ASC;
c1
2003-06-15
2003-06-15
2003-06-15
2003-06-15
2003-06-16
2003-06-25
2003-07-15
2004-06-15
2005-06-15
2006-06-15
9999-12-31
SELECT * FROM t1 WHERE c1 =  '2003-06-15' ORDER BY c1 ASC;
c1
2003-06-15
2003-06-15
2003-06-15
2003-06-15
SELECT * FROM t1 WHERE c1 >  '2003-06-15' ORDER BY c1 DESC;
c1
9999-12-31
2006-06-15
2005-06-15
2004-06-15
2003-07-15
2003-06-25
2003-06-16
SELECT * FROM t1 WHERE c1 >= '2003-06-15' ORDER BY c1 DESC;
c1
9999-12-31
2006-06-15
2005-06-15
2004-06-15
2003-07-15
2003-06-25
2003-06-16
2003-06-15
2003-06-15
2003-06-15
2003-06-15
SELECT * FROM t1 WHERE c1 <  '2003-06-15' ORDER BY c1 DESC;
c1
2003-06-14
2003-05-15
2002-06-15
2001-06-15
2000-06-15
1000-01-01
SELECT * FROM t1 WHERE c1 >= '2003-06-15' ORDER BY c1 DESC;
c1
9999-12-31
2006-06-15
2005-06-15
2004-06-15
2003-07-15
2003-06-25
2003-06-16
2003-06-15
2003-06-15
2003-06-15
2003-06-15
SELECT * FROM t1 WHERE c1 =  '2003-06-15' ORDER BY c1 DESC;
c1
2003-06-15
2003-06-15
2003-06-15
2003-06-15
UPDATE t1
SET c1 = '2006-06-15'
WHERE c1 = '2003-06-15'
LIMIT 2;
SELECT * FROM t1 ORDER BY c1;
c1
1000-01-01
2000-06-15
2001-06-15
2002-06-15
2003-05-15
2003-06-14
2003-06-15
2003-06-15
2003-06-16
2003-06-25
2003-07-15
2004-06-15
2005-06-15
2006-06-15
2006-06-15
2006-06-15
9999-12-31
DELETE FROM t1
WHERE c1 = '2003-06-15'
ORDER BY c1;
SELECT * FROM t1 ORDER BY c1;
c1
1000-01-01
2000-06-15
2001-06-15
2002-06-15
2003-05-15
2003-06-14
2003-06-16
2003-06-25
2003-07-15
2004-06-15
2005-06-15
2006-06-15
2006-06-15
2006-06-15
9999-12-31
