DROP TABLE IF EXISTS t1;
CREATE TABLE t1(c1 DATETIME NOT NULL )
ENGINE=cloud;
INSERT INTO t1 VALUES
('2000-06-15 01:02:03'),
('2001-06-15 01:02:03'),
('2002-06-15 01:02:03'),
('2003-06-25 01:02:03'),
('2004-06-15 01:02:03'),
('2005-06-15 01:02:03'),
('2006-06-15 01:02:03'),
('2003-06-15 00:00:00'),
('2003-06-15 01:02:02'),
('2003-06-15 01:02:04'),
('2003-06-15 23:59:59'),
('1000-01-01 00:00:00'),
('9999-12-31 12:59:59'),
('2003-06-15 01:02:03'),
('2003-06-15 01:02:03'),
('2003-06-15 01:02:03'),
('2003-06-15 01:02:03');
SELECT * FROM t1 ORDER BY c1 ASC;
c1
1000-01-01 00:00:00
2000-06-15 01:02:03
2001-06-15 01:02:03
2002-06-15 01:02:03
2003-06-15 00:00:00
2003-06-15 01:02:02
2003-06-15 01:02:03
2003-06-15 01:02:03
2003-06-15 01:02:03
2003-06-15 01:02:03
2003-06-15 01:02:04
2003-06-15 23:59:59
2003-06-25 01:02:03
2004-06-15 01:02:03
2005-06-15 01:02:03
2006-06-15 01:02:03
9999-12-31 12:59:59
SELECT * FROM t1 ORDER BY c1 DESC;
c1
9999-12-31 12:59:59
2006-06-15 01:02:03
2005-06-15 01:02:03
2004-06-15 01:02:03
2003-06-25 01:02:03
2003-06-15 23:59:59
2003-06-15 01:02:04
2003-06-15 01:02:03
2003-06-15 01:02:03
2003-06-15 01:02:03
2003-06-15 01:02:03
2003-06-15 01:02:02
2003-06-15 00:00:00
2002-06-15 01:02:03
2001-06-15 01:02:03
2000-06-15 01:02:03
1000-01-01 00:00:00
SELECT * FROM t1 WHERE c1 >  '2003-06-15 01:02:03' ORDER BY c1 ASC;
c1
2003-06-15 01:02:04
2003-06-15 23:59:59
2003-06-25 01:02:03
2004-06-15 01:02:03
2005-06-15 01:02:03
2006-06-15 01:02:03
9999-12-31 12:59:59
SELECT * FROM t1 WHERE c1 >= '2003-06-15 01:02:03' ORDER BY c1 ASC;
c1
2003-06-15 01:02:03
2003-06-15 01:02:03
2003-06-15 01:02:03
2003-06-15 01:02:03
2003-06-15 01:02:04
2003-06-15 23:59:59
2003-06-25 01:02:03
2004-06-15 01:02:03
2005-06-15 01:02:03
2006-06-15 01:02:03
9999-12-31 12:59:59
SELECT * FROM t1 WHERE c1 <  '2003-06-15 01:02:03' ORDER BY c1 ASC;
c1
1000-01-01 00:00:00
2000-06-15 01:02:03
2001-06-15 01:02:03
2002-06-15 01:02:03
2003-06-15 00:00:00
2003-06-15 01:02:02
SELECT * FROM t1 WHERE c1 <= '2003-06-15 01:02:03' ORDER BY c1 ASC;
c1
1000-01-01 00:00:00
2000-06-15 01:02:03
2001-06-15 01:02:03
2002-06-15 01:02:03
2003-06-15 00:00:00
2003-06-15 01:02:02
2003-06-15 01:02:03
2003-06-15 01:02:03
2003-06-15 01:02:03
2003-06-15 01:02:03
SELECT * FROM t1 WHERE c1 =  '2003-06-15 01:02:03' ORDER BY c1 ASC;
c1
2003-06-15 01:02:03
2003-06-15 01:02:03
2003-06-15 01:02:03
2003-06-15 01:02:03
SELECT * FROM t1 WHERE c1 >  '2003-06-15 01:02:03' ORDER BY c1 DESC;
c1
9999-12-31 12:59:59
2006-06-15 01:02:03
2005-06-15 01:02:03
2004-06-15 01:02:03
2003-06-25 01:02:03
2003-06-15 23:59:59
2003-06-15 01:02:04
SELECT * FROM t1 WHERE c1 >= '2003-06-15 01:02:03' ORDER BY c1 DESC;
c1
9999-12-31 12:59:59
2006-06-15 01:02:03
2005-06-15 01:02:03
2004-06-15 01:02:03
2003-06-25 01:02:03
2003-06-15 23:59:59
2003-06-15 01:02:04
2003-06-15 01:02:03
2003-06-15 01:02:03
2003-06-15 01:02:03
2003-06-15 01:02:03
SELECT * FROM t1 WHERE c1 <  '2003-06-15 01:02:03' ORDER BY c1 DESC;
c1
2003-06-15 01:02:02
2003-06-15 00:00:00
2002-06-15 01:02:03
2001-06-15 01:02:03
2000-06-15 01:02:03
1000-01-01 00:00:00
SELECT * FROM t1 WHERE c1 <= '2003-06-15 01:02:03' ORDER BY c1 DESC;
c1
2003-06-15 01:02:03
2003-06-15 01:02:03
2003-06-15 01:02:03
2003-06-15 01:02:03
2003-06-15 01:02:02
2003-06-15 00:00:00
2002-06-15 01:02:03
2001-06-15 01:02:03
2000-06-15 01:02:03
1000-01-01 00:00:00
SELECT * FROM t1 WHERE c1 =  '2003-06-15 01:02:03' ORDER BY c1 DESC;
c1
2003-06-15 01:02:03
2003-06-15 01:02:03
2003-06-15 01:02:03
2003-06-15 01:02:03
UPDATE t1
SET c1 = '2006-06-15 01:02:03'
WHERE c1 = '2003-06-15 01:02:03'
LIMIT 2;
SELECT * FROM t1 ORDER BY c1;
c1
1000-01-01 00:00:00
2000-06-15 01:02:03
2001-06-15 01:02:03
2002-06-15 01:02:03
2003-06-15 00:00:00
2003-06-15 01:02:02
2003-06-15 01:02:03
2003-06-15 01:02:03
2003-06-15 01:02:04
2003-06-15 23:59:59
2003-06-25 01:02:03
2004-06-15 01:02:03
2005-06-15 01:02:03
2006-06-15 01:02:03
2006-06-15 01:02:03
2006-06-15 01:02:03
9999-12-31 12:59:59
DELETE FROM t1
WHERE c1 = '2003-06-15 01:02:03'
ORDER BY c1;
SELECT * FROM t1 ORDER BY c1;
c1
1000-01-01 00:00:00
2000-06-15 01:02:03
2001-06-15 01:02:03
2002-06-15 01:02:03
2003-06-15 00:00:00
2003-06-15 01:02:02
2003-06-15 01:02:04
2003-06-15 23:59:59
2003-06-25 01:02:03
2004-06-15 01:02:03
2005-06-15 01:02:03
2006-06-15 01:02:03
2006-06-15 01:02:03
2006-06-15 01:02:03
9999-12-31 12:59:59
DROP TABLE IF EXISTS t1;
CREATE TABLE t1(c1 DATETIME NULL )
ENGINE=cloud;
INSERT INTO t1 VALUES
('2000-06-15 01:02:03'),
('2001-06-15 01:02:03'),
('2002-06-15 01:02:03'),
('2003-06-25 01:02:03'),
('2004-06-15 01:02:03'),
('2005-06-15 01:02:03'),
('2006-06-15 01:02:03'),
('2003-06-15 00:00:00'),
('2003-06-15 01:02:02'),
('2003-06-15 01:02:04'),
('2003-06-15 23:59:59'),
('1000-01-01 00:00:00'),
('9999-12-31 12:59:59'),
('2003-06-15 01:02:03'),
(NULL),
(NULL),
(NULL),
(NULL);
SELECT * FROM t1 WHERE c1 IS     NULL ORDER BY c1 ASC;
c1
NULL
NULL
NULL
NULL
SELECT * FROM t1 WHERE c1 IS NOT NULL ORDER BY c1 DESC;
c1
9999-12-31 12:59:59
2006-06-15 01:02:03
2005-06-15 01:02:03
2004-06-15 01:02:03
2003-06-25 01:02:03
2003-06-15 23:59:59
2003-06-15 01:02:04
2003-06-15 01:02:03
2003-06-15 01:02:02
2003-06-15 00:00:00
2002-06-15 01:02:03
2001-06-15 01:02:03
2000-06-15 01:02:03
1000-01-01 00:00:00
SELECT * FROM t1 WHERE c1 IS     NULL ORDER BY c1 ASC;
c1
NULL
NULL
NULL
NULL
SELECT * FROM t1 WHERE c1 IS NOT NULL ORDER BY c1 DESC;
c1
9999-12-31 12:59:59
2006-06-15 01:02:03
2005-06-15 01:02:03
2004-06-15 01:02:03
2003-06-25 01:02:03
2003-06-15 23:59:59
2003-06-15 01:02:04
2003-06-15 01:02:03
2003-06-15 01:02:02
2003-06-15 00:00:00
2002-06-15 01:02:03
2001-06-15 01:02:03
2000-06-15 01:02:03
1000-01-01 00:00:00
UPDATE t1
SET c1 = '2003-06-15 01:02:03'
WHERE c1 IS NULL
LIMIT 2;
SELECT * FROM t1 ORDER BY c1;
c1
NULL
NULL
1000-01-01 00:00:00
2000-06-15 01:02:03
2001-06-15 01:02:03
2002-06-15 01:02:03
2003-06-15 00:00:00
2003-06-15 01:02:02
2003-06-15 01:02:03
2003-06-15 01:02:03
2003-06-15 01:02:03
2003-06-15 01:02:04
2003-06-15 23:59:59
2003-06-25 01:02:03
2004-06-15 01:02:03
2005-06-15 01:02:03
2006-06-15 01:02:03
9999-12-31 12:59:59
DELETE FROM t1
WHERE c1 IS NULL
ORDER BY c1;
SELECT * FROM t1 ORDER BY c1;
c1
1000-01-01 00:00:00
2000-06-15 01:02:03
2001-06-15 01:02:03
2002-06-15 01:02:03
2003-06-15 00:00:00
2003-06-15 01:02:02
2003-06-15 01:02:03
2003-06-15 01:02:03
2003-06-15 01:02:03
2003-06-15 01:02:04
2003-06-15 23:59:59
2003-06-25 01:02:03
2004-06-15 01:02:03
2005-06-15 01:02:03
2006-06-15 01:02:03
9999-12-31 12:59:59
DROP TABLE IF EXISTS t1;
CREATE TABLE t1(c1 DATETIME NULL )
ENGINE=cloud;
INSERT INTO t1 VALUES
('2000-06-15 01:02:03'),
('2001-06-15 01:02:03'),
('2002-06-15 01:02:03'),
('2003-06-25 01:02:03'),
('2004-06-15 01:02:03'),
('2005-06-15 01:02:03'),
('2006-06-15 01:02:03'),
('2003-06-15 00:00:00'),
('2003-06-15 01:02:02'),
('2003-06-15 01:02:04'),
('2003-06-15 23:59:59'),
('1000-01-01 00:00:00'),
('9999-12-31 12:59:59'),
('2003-06-15 01:02:03'),
('2003-06-15 01:02:03'),
('2003-06-15 01:02:03'),
('2003-06-15 01:02:03');
SELECT * FROM t1 ORDER BY c1 ASC;
c1
1000-01-01 00:00:00
2000-06-15 01:02:03
2001-06-15 01:02:03
2002-06-15 01:02:03
2003-06-15 00:00:00
2003-06-15 01:02:02
2003-06-15 01:02:03
2003-06-15 01:02:03
2003-06-15 01:02:03
2003-06-15 01:02:03
2003-06-15 01:02:04
2003-06-15 23:59:59
2003-06-25 01:02:03
2004-06-15 01:02:03
2005-06-15 01:02:03
2006-06-15 01:02:03
9999-12-31 12:59:59
SELECT * FROM t1 ORDER BY c1 DESC;
c1
9999-12-31 12:59:59
2006-06-15 01:02:03
2005-06-15 01:02:03
2004-06-15 01:02:03
2003-06-25 01:02:03
2003-06-15 23:59:59
2003-06-15 01:02:04
2003-06-15 01:02:03
2003-06-15 01:02:03
2003-06-15 01:02:03
2003-06-15 01:02:03
2003-06-15 01:02:02
2003-06-15 00:00:00
2002-06-15 01:02:03
2001-06-15 01:02:03
2000-06-15 01:02:03
1000-01-01 00:00:00
SELECT * FROM t1 WHERE c1 >  '2003-06-15 01:02:03' ORDER BY c1 ASC;
c1
2003-06-15 01:02:04
2003-06-15 23:59:59
2003-06-25 01:02:03
2004-06-15 01:02:03
2005-06-15 01:02:03
2006-06-15 01:02:03
9999-12-31 12:59:59
SELECT * FROM t1 WHERE c1 >= '2003-06-15 01:02:03' ORDER BY c1 ASC;
c1
2003-06-15 01:02:03
2003-06-15 01:02:03
2003-06-15 01:02:03
2003-06-15 01:02:03
2003-06-15 01:02:04
2003-06-15 23:59:59
2003-06-25 01:02:03
2004-06-15 01:02:03
2005-06-15 01:02:03
2006-06-15 01:02:03
9999-12-31 12:59:59
SELECT * FROM t1 WHERE c1 <  '2003-06-15 01:02:03' ORDER BY c1 ASC;
c1
1000-01-01 00:00:00
2000-06-15 01:02:03
2001-06-15 01:02:03
2002-06-15 01:02:03
2003-06-15 00:00:00
2003-06-15 01:02:02
SELECT * FROM t1 WHERE c1 <= '2003-06-15 01:02:03' ORDER BY c1 ASC;
c1
1000-01-01 00:00:00
2000-06-15 01:02:03
2001-06-15 01:02:03
2002-06-15 01:02:03
2003-06-15 00:00:00
2003-06-15 01:02:02
2003-06-15 01:02:03
2003-06-15 01:02:03
2003-06-15 01:02:03
2003-06-15 01:02:03
SELECT * FROM t1 WHERE c1 =  '2003-06-15 01:02:03' ORDER BY c1 ASC;
c1
2003-06-15 01:02:03
2003-06-15 01:02:03
2003-06-15 01:02:03
2003-06-15 01:02:03
SELECT * FROM t1 WHERE c1 >  '2003-06-15 01:02:03' ORDER BY c1 DESC;
c1
9999-12-31 12:59:59
2006-06-15 01:02:03
2005-06-15 01:02:03
2004-06-15 01:02:03
2003-06-25 01:02:03
2003-06-15 23:59:59
2003-06-15 01:02:04
SELECT * FROM t1 WHERE c1 >= '2003-06-15 01:02:03' ORDER BY c1 DESC;
c1
9999-12-31 12:59:59
2006-06-15 01:02:03
2005-06-15 01:02:03
2004-06-15 01:02:03
2003-06-25 01:02:03
2003-06-15 23:59:59
2003-06-15 01:02:04
2003-06-15 01:02:03
2003-06-15 01:02:03
2003-06-15 01:02:03
2003-06-15 01:02:03
SELECT * FROM t1 WHERE c1 <  '2003-06-15 01:02:03' ORDER BY c1 DESC;
c1
2003-06-15 01:02:02
2003-06-15 00:00:00
2002-06-15 01:02:03
2001-06-15 01:02:03
2000-06-15 01:02:03
1000-01-01 00:00:00
SELECT * FROM t1 WHERE c1 <= '2003-06-15 01:02:03' ORDER BY c1 DESC;
c1
2003-06-15 01:02:03
2003-06-15 01:02:03
2003-06-15 01:02:03
2003-06-15 01:02:03
2003-06-15 01:02:02
2003-06-15 00:00:00
2002-06-15 01:02:03
2001-06-15 01:02:03
2000-06-15 01:02:03
1000-01-01 00:00:00
SELECT * FROM t1 WHERE c1 =  '2003-06-15 01:02:03' ORDER BY c1 DESC;
c1
2003-06-15 01:02:03
2003-06-15 01:02:03
2003-06-15 01:02:03
2003-06-15 01:02:03
UPDATE t1
SET c1 = '2006-06-15 01:02:03'
WHERE c1 = '2003-06-15 01:02:03'
LIMIT 2;
SELECT * FROM t1 ORDER BY c1;
c1
1000-01-01 00:00:00
2000-06-15 01:02:03
2001-06-15 01:02:03
2002-06-15 01:02:03
2003-06-15 00:00:00
2003-06-15 01:02:02
2003-06-15 01:02:03
2003-06-15 01:02:03
2003-06-15 01:02:04
2003-06-15 23:59:59
2003-06-25 01:02:03
2004-06-15 01:02:03
2005-06-15 01:02:03
2006-06-15 01:02:03
2006-06-15 01:02:03
2006-06-15 01:02:03
9999-12-31 12:59:59
DELETE FROM t1
WHERE c1 = '2003-06-15 01:02:03'
ORDER BY c1;
SELECT * FROM t1 ORDER BY c1;
c1
1000-01-01 00:00:00
2000-06-15 01:02:03
2001-06-15 01:02:03
2002-06-15 01:02:03
2003-06-15 00:00:00
2003-06-15 01:02:02
2003-06-15 01:02:04
2003-06-15 23:59:59
2003-06-25 01:02:03
2004-06-15 01:02:03
2005-06-15 01:02:03
2006-06-15 01:02:03
2006-06-15 01:02:03
2006-06-15 01:02:03
9999-12-31 12:59:59
DROP TABLE IF EXISTS t1;
CREATE TABLE t1(c1 DATETIME NOT NULL , INDEX(c1))
ENGINE=cloud;
INSERT INTO t1 VALUES
('2000-06-15 01:02:03'),
('2001-06-15 01:02:03'),
('2002-06-15 01:02:03'),
('2003-06-25 01:02:03'),
('2004-06-15 01:02:03'),
('2005-06-15 01:02:03'),
('2006-06-15 01:02:03'),
('2003-06-15 00:00:00'),
('2003-06-15 01:02:02'),
('2003-06-15 01:02:04'),
('2003-06-15 23:59:59'),
('1000-01-01 00:00:00'),
('9999-12-31 12:59:59'),
('2003-06-15 01:02:03'),
('2003-06-15 01:02:03'),
('2003-06-15 01:02:03'),
('2003-06-15 01:02:03');
SELECT * FROM t1 ORDER BY c1 ASC;
c1
1000-01-01 00:00:00
2000-06-15 01:02:03
2001-06-15 01:02:03
2002-06-15 01:02:03
2003-06-15 00:00:00
2003-06-15 01:02:02
2003-06-15 01:02:03
2003-06-15 01:02:03
2003-06-15 01:02:03
2003-06-15 01:02:03
2003-06-15 01:02:04
2003-06-15 23:59:59
2003-06-25 01:02:03
2004-06-15 01:02:03
2005-06-15 01:02:03
2006-06-15 01:02:03
9999-12-31 12:59:59
SELECT * FROM t1 ORDER BY c1 DESC;
c1
9999-12-31 12:59:59
2006-06-15 01:02:03
2005-06-15 01:02:03
2004-06-15 01:02:03
2003-06-25 01:02:03
2003-06-15 23:59:59
2003-06-15 01:02:04
2003-06-15 01:02:03
2003-06-15 01:02:03
2003-06-15 01:02:03
2003-06-15 01:02:03
2003-06-15 01:02:02
2003-06-15 00:00:00
2002-06-15 01:02:03
2001-06-15 01:02:03
2000-06-15 01:02:03
1000-01-01 00:00:00
SELECT * FROM t1 WHERE c1 >  '2003-06-15 01:02:03' ORDER BY c1 ASC;
c1
2003-06-15 01:02:04
2003-06-15 23:59:59
2003-06-25 01:02:03
2004-06-15 01:02:03
2005-06-15 01:02:03
2006-06-15 01:02:03
9999-12-31 12:59:59
SELECT * FROM t1 WHERE c1 >= '2003-06-15 01:02:03' ORDER BY c1 ASC;
c1
2003-06-15 01:02:03
2003-06-15 01:02:03
2003-06-15 01:02:03
2003-06-15 01:02:03
2003-06-15 01:02:04
2003-06-15 23:59:59
2003-06-25 01:02:03
2004-06-15 01:02:03
2005-06-15 01:02:03
2006-06-15 01:02:03
9999-12-31 12:59:59
SELECT * FROM t1 WHERE c1 <  '2003-06-15 01:02:03' ORDER BY c1 ASC;
c1
1000-01-01 00:00:00
2000-06-15 01:02:03
2001-06-15 01:02:03
2002-06-15 01:02:03
2003-06-15 00:00:00
2003-06-15 01:02:02
SELECT * FROM t1 WHERE c1 <= '2003-06-15 01:02:03' ORDER BY c1 ASC;
c1
1000-01-01 00:00:00
2000-06-15 01:02:03
2001-06-15 01:02:03
2002-06-15 01:02:03
2003-06-15 00:00:00
2003-06-15 01:02:02
2003-06-15 01:02:03
2003-06-15 01:02:03
2003-06-15 01:02:03
2003-06-15 01:02:03
SELECT * FROM t1 WHERE c1 =  '2003-06-15 01:02:03' ORDER BY c1 ASC;
c1
2003-06-15 01:02:03
2003-06-15 01:02:03
2003-06-15 01:02:03
2003-06-15 01:02:03
SELECT * FROM t1 WHERE c1 >  '2003-06-15 01:02:03' ORDER BY c1 DESC;
c1
9999-12-31 12:59:59
2006-06-15 01:02:03
2005-06-15 01:02:03
2004-06-15 01:02:03
2003-06-25 01:02:03
2003-06-15 23:59:59
2003-06-15 01:02:04
SELECT * FROM t1 WHERE c1 >= '2003-06-15 01:02:03' ORDER BY c1 DESC;
c1
9999-12-31 12:59:59
2006-06-15 01:02:03
2005-06-15 01:02:03
2004-06-15 01:02:03
2003-06-25 01:02:03
2003-06-15 23:59:59
2003-06-15 01:02:04
2003-06-15 01:02:03
2003-06-15 01:02:03
2003-06-15 01:02:03
2003-06-15 01:02:03
SELECT * FROM t1 WHERE c1 <  '2003-06-15 01:02:03' ORDER BY c1 DESC;
c1
2003-06-15 01:02:02
2003-06-15 00:00:00
2002-06-15 01:02:03
2001-06-15 01:02:03
2000-06-15 01:02:03
1000-01-01 00:00:00
SELECT * FROM t1 WHERE c1 <= '2003-06-15 01:02:03' ORDER BY c1 DESC;
c1
2003-06-15 01:02:03
2003-06-15 01:02:03
2003-06-15 01:02:03
2003-06-15 01:02:03
2003-06-15 01:02:02
2003-06-15 00:00:00
2002-06-15 01:02:03
2001-06-15 01:02:03
2000-06-15 01:02:03
1000-01-01 00:00:00
SELECT * FROM t1 WHERE c1 =  '2003-06-15 01:02:03' ORDER BY c1 DESC;
c1
2003-06-15 01:02:03
2003-06-15 01:02:03
2003-06-15 01:02:03
2003-06-15 01:02:03
UPDATE t1
SET c1 = '2006-06-15 01:02:03'
WHERE c1 = '2003-06-15 01:02:03'
LIMIT 2;
SELECT * FROM t1 ORDER BY c1;
c1
1000-01-01 00:00:00
2000-06-15 01:02:03
2001-06-15 01:02:03
2002-06-15 01:02:03
2003-06-15 00:00:00
2003-06-15 01:02:02
2003-06-15 01:02:03
2003-06-15 01:02:03
2003-06-15 01:02:04
2003-06-15 23:59:59
2003-06-25 01:02:03
2004-06-15 01:02:03
2005-06-15 01:02:03
2006-06-15 01:02:03
2006-06-15 01:02:03
2006-06-15 01:02:03
9999-12-31 12:59:59
DELETE FROM t1
WHERE c1 = '2003-06-15 01:02:03'
ORDER BY c1;
SELECT * FROM t1 ORDER BY c1;
c1
1000-01-01 00:00:00
2000-06-15 01:02:03
2001-06-15 01:02:03
2002-06-15 01:02:03
2003-06-15 00:00:00
2003-06-15 01:02:02
2003-06-15 01:02:04
2003-06-15 23:59:59
2003-06-25 01:02:03
2004-06-15 01:02:03
2005-06-15 01:02:03
2006-06-15 01:02:03
2006-06-15 01:02:03
2006-06-15 01:02:03
9999-12-31 12:59:59
DROP TABLE IF EXISTS t1;
CREATE TABLE t1(c1 DATETIME NULL , INDEX(c1))
ENGINE=cloud;
INSERT INTO t1 VALUES
('2000-06-15 01:02:03'),
('2001-06-15 01:02:03'),
('2002-06-15 01:02:03'),
('2003-06-25 01:02:03'),
('2004-06-15 01:02:03'),
('2005-06-15 01:02:03'),
('2006-06-15 01:02:03'),
('2003-06-15 00:00:00'),
('2003-06-15 01:02:02'),
('2003-06-15 01:02:04'),
('2003-06-15 23:59:59'),
('1000-01-01 00:00:00'),
('9999-12-31 12:59:59'),
('2003-06-15 01:02:03'),
(NULL),
(NULL),
(NULL),
(NULL);
SELECT * FROM t1 WHERE c1 IS     NULL ORDER BY c1 ASC;
c1
NULL
NULL
NULL
NULL
SELECT * FROM t1 WHERE c1 IS NOT NULL ORDER BY c1 DESC;
c1
9999-12-31 12:59:59
2006-06-15 01:02:03
2005-06-15 01:02:03
2004-06-15 01:02:03
2003-06-25 01:02:03
2003-06-15 23:59:59
2003-06-15 01:02:04
2003-06-15 01:02:03
2003-06-15 01:02:02
2003-06-15 00:00:00
2002-06-15 01:02:03
2001-06-15 01:02:03
2000-06-15 01:02:03
1000-01-01 00:00:00
SELECT * FROM t1 WHERE c1 IS     NULL ORDER BY c1 ASC;
c1
NULL
NULL
NULL
NULL
SELECT * FROM t1 WHERE c1 IS NOT NULL ORDER BY c1 DESC;
c1
9999-12-31 12:59:59
2006-06-15 01:02:03
2005-06-15 01:02:03
2004-06-15 01:02:03
2003-06-25 01:02:03
2003-06-15 23:59:59
2003-06-15 01:02:04
2003-06-15 01:02:03
2003-06-15 01:02:02
2003-06-15 00:00:00
2002-06-15 01:02:03
2001-06-15 01:02:03
2000-06-15 01:02:03
1000-01-01 00:00:00
UPDATE t1
SET c1 = '2003-06-15 01:02:03'
WHERE c1 IS NULL
LIMIT 2;
SELECT * FROM t1 ORDER BY c1;
c1
NULL
NULL
1000-01-01 00:00:00
2000-06-15 01:02:03
2001-06-15 01:02:03
2002-06-15 01:02:03
2003-06-15 00:00:00
2003-06-15 01:02:02
2003-06-15 01:02:03
2003-06-15 01:02:03
2003-06-15 01:02:03
2003-06-15 01:02:04
2003-06-15 23:59:59
2003-06-25 01:02:03
2004-06-15 01:02:03
2005-06-15 01:02:03
2006-06-15 01:02:03
9999-12-31 12:59:59
DELETE FROM t1
WHERE c1 IS NULL
ORDER BY c1;
SELECT * FROM t1 ORDER BY c1;
c1
1000-01-01 00:00:00
2000-06-15 01:02:03
2001-06-15 01:02:03
2002-06-15 01:02:03
2003-06-15 00:00:00
2003-06-15 01:02:02
2003-06-15 01:02:03
2003-06-15 01:02:03
2003-06-15 01:02:03
2003-06-15 01:02:04
2003-06-15 23:59:59
2003-06-25 01:02:03
2004-06-15 01:02:03
2005-06-15 01:02:03
2006-06-15 01:02:03
9999-12-31 12:59:59
DROP TABLE IF EXISTS t1;
CREATE TABLE t1(c1 DATETIME NULL , INDEX(c1))
ENGINE=cloud;
INSERT INTO t1 VALUES
('2000-06-15 01:02:03'),
('2001-06-15 01:02:03'),
('2002-06-15 01:02:03'),
('2003-06-25 01:02:03'),
('2004-06-15 01:02:03'),
('2005-06-15 01:02:03'),
('2006-06-15 01:02:03'),
('2003-06-15 00:00:00'),
('2003-06-15 01:02:02'),
('2003-06-15 01:02:04'),
('2003-06-15 23:59:59'),
('1000-01-01 00:00:00'),
('9999-12-31 12:59:59'),
('2003-06-15 01:02:03'),
('2003-06-15 01:02:03'),
('2003-06-15 01:02:03'),
('2003-06-15 01:02:03');
SELECT * FROM t1 ORDER BY c1 ASC;
c1
1000-01-01 00:00:00
2000-06-15 01:02:03
2001-06-15 01:02:03
2002-06-15 01:02:03
2003-06-15 00:00:00
2003-06-15 01:02:02
2003-06-15 01:02:03
2003-06-15 01:02:03
2003-06-15 01:02:03
2003-06-15 01:02:03
2003-06-15 01:02:04
2003-06-15 23:59:59
2003-06-25 01:02:03
2004-06-15 01:02:03
2005-06-15 01:02:03
2006-06-15 01:02:03
9999-12-31 12:59:59
SELECT * FROM t1 ORDER BY c1 DESC;
c1
9999-12-31 12:59:59
2006-06-15 01:02:03
2005-06-15 01:02:03
2004-06-15 01:02:03
2003-06-25 01:02:03
2003-06-15 23:59:59
2003-06-15 01:02:04
2003-06-15 01:02:03
2003-06-15 01:02:03
2003-06-15 01:02:03
2003-06-15 01:02:03
2003-06-15 01:02:02
2003-06-15 00:00:00
2002-06-15 01:02:03
2001-06-15 01:02:03
2000-06-15 01:02:03
1000-01-01 00:00:00
SELECT * FROM t1 WHERE c1 >  '2003-06-15 01:02:03' ORDER BY c1 ASC;
c1
2003-06-15 01:02:04
2003-06-15 23:59:59
2003-06-25 01:02:03
2004-06-15 01:02:03
2005-06-15 01:02:03
2006-06-15 01:02:03
9999-12-31 12:59:59
SELECT * FROM t1 WHERE c1 >= '2003-06-15 01:02:03' ORDER BY c1 ASC;
c1
2003-06-15 01:02:03
2003-06-15 01:02:03
2003-06-15 01:02:03
2003-06-15 01:02:03
2003-06-15 01:02:04
2003-06-15 23:59:59
2003-06-25 01:02:03
2004-06-15 01:02:03
2005-06-15 01:02:03
2006-06-15 01:02:03
9999-12-31 12:59:59
SELECT * FROM t1 WHERE c1 <  '2003-06-15 01:02:03' ORDER BY c1 ASC;
c1
1000-01-01 00:00:00
2000-06-15 01:02:03
2001-06-15 01:02:03
2002-06-15 01:02:03
2003-06-15 00:00:00
2003-06-15 01:02:02
SELECT * FROM t1 WHERE c1 <= '2003-06-15 01:02:03' ORDER BY c1 ASC;
c1
1000-01-01 00:00:00
2000-06-15 01:02:03
2001-06-15 01:02:03
2002-06-15 01:02:03
2003-06-15 00:00:00
2003-06-15 01:02:02
2003-06-15 01:02:03
2003-06-15 01:02:03
2003-06-15 01:02:03
2003-06-15 01:02:03
SELECT * FROM t1 WHERE c1 =  '2003-06-15 01:02:03' ORDER BY c1 ASC;
c1
2003-06-15 01:02:03
2003-06-15 01:02:03
2003-06-15 01:02:03
2003-06-15 01:02:03
SELECT * FROM t1 WHERE c1 >  '2003-06-15 01:02:03' ORDER BY c1 DESC;
c1
9999-12-31 12:59:59
2006-06-15 01:02:03
2005-06-15 01:02:03
2004-06-15 01:02:03
2003-06-25 01:02:03
2003-06-15 23:59:59
2003-06-15 01:02:04
SELECT * FROM t1 WHERE c1 >= '2003-06-15 01:02:03' ORDER BY c1 DESC;
c1
9999-12-31 12:59:59
2006-06-15 01:02:03
2005-06-15 01:02:03
2004-06-15 01:02:03
2003-06-25 01:02:03
2003-06-15 23:59:59
2003-06-15 01:02:04
2003-06-15 01:02:03
2003-06-15 01:02:03
2003-06-15 01:02:03
2003-06-15 01:02:03
SELECT * FROM t1 WHERE c1 <  '2003-06-15 01:02:03' ORDER BY c1 DESC;
c1
2003-06-15 01:02:02
2003-06-15 00:00:00
2002-06-15 01:02:03
2001-06-15 01:02:03
2000-06-15 01:02:03
1000-01-01 00:00:00
SELECT * FROM t1 WHERE c1 <= '2003-06-15 01:02:03' ORDER BY c1 DESC;
c1
2003-06-15 01:02:03
2003-06-15 01:02:03
2003-06-15 01:02:03
2003-06-15 01:02:03
2003-06-15 01:02:02
2003-06-15 00:00:00
2002-06-15 01:02:03
2001-06-15 01:02:03
2000-06-15 01:02:03
1000-01-01 00:00:00
SELECT * FROM t1 WHERE c1 =  '2003-06-15 01:02:03' ORDER BY c1 DESC;
c1
2003-06-15 01:02:03
2003-06-15 01:02:03
2003-06-15 01:02:03
2003-06-15 01:02:03
UPDATE t1
SET c1 = '2006-06-15 01:02:03'
WHERE c1 = '2003-06-15 01:02:03'
LIMIT 2;
SELECT * FROM t1 ORDER BY c1;
c1
1000-01-01 00:00:00
2000-06-15 01:02:03
2001-06-15 01:02:03
2002-06-15 01:02:03
2003-06-15 00:00:00
2003-06-15 01:02:02
2003-06-15 01:02:03
2003-06-15 01:02:03
2003-06-15 01:02:04
2003-06-15 23:59:59
2003-06-25 01:02:03
2004-06-15 01:02:03
2005-06-15 01:02:03
2006-06-15 01:02:03
2006-06-15 01:02:03
2006-06-15 01:02:03
9999-12-31 12:59:59
DELETE FROM t1
WHERE c1 = '2003-06-15 01:02:03'
ORDER BY c1;
SELECT * FROM t1 ORDER BY c1;
c1
1000-01-01 00:00:00
2000-06-15 01:02:03
2001-06-15 01:02:03
2002-06-15 01:02:03
2003-06-15 00:00:00
2003-06-15 01:02:02
2003-06-15 01:02:04
2003-06-15 23:59:59
2003-06-25 01:02:03
2004-06-15 01:02:03
2005-06-15 01:02:03
2006-06-15 01:02:03
2006-06-15 01:02:03
2006-06-15 01:02:03
9999-12-31 12:59:59
DROP TABLE IF EXISTS t1;
CREATE TABLE t1(c1 DATETIME NOT NULL )
ENGINE=cloud;
INSERT INTO t1 VALUES
('2000-06-15 01:02:03'),
('2001-06-15 01:02:03'),
('2002-06-15 01:02:03'),
('2003-06-25 01:02:03'),
('2004-06-15 01:02:03'),
('2005-06-15 01:02:03'),
('2006-06-15 01:02:03'),
('2003-06-15 00:00:00'),
('2003-06-15 01:02:02'),
('2003-06-15 01:02:04'),
('2003-06-15 23:59:59'),
('1000-01-01 00:00:00'),
('9999-12-31 12:59:59'),
('2003-06-15 01:02:03'),
('2003-06-15 01:02:03'),
('2003-06-15 01:02:03'),
('2003-06-15 01:02:03');
SELECT * FROM t1 ORDER BY c1 ASC;
c1
1000-01-01 00:00:00
2000-06-15 01:02:03
2001-06-15 01:02:03
2002-06-15 01:02:03
2003-06-15 00:00:00
2003-06-15 01:02:02
2003-06-15 01:02:03
2003-06-15 01:02:03
2003-06-15 01:02:03
2003-06-15 01:02:03
2003-06-15 01:02:04
2003-06-15 23:59:59
2003-06-25 01:02:03
2004-06-15 01:02:03
2005-06-15 01:02:03
2006-06-15 01:02:03
9999-12-31 12:59:59
SELECT * FROM t1 ORDER BY c1 DESC;
c1
9999-12-31 12:59:59
2006-06-15 01:02:03
2005-06-15 01:02:03
2004-06-15 01:02:03
2003-06-25 01:02:03
2003-06-15 23:59:59
2003-06-15 01:02:04
2003-06-15 01:02:03
2003-06-15 01:02:03
2003-06-15 01:02:03
2003-06-15 01:02:03
2003-06-15 01:02:02
2003-06-15 00:00:00
2002-06-15 01:02:03
2001-06-15 01:02:03
2000-06-15 01:02:03
1000-01-01 00:00:00
SELECT * FROM t1 WHERE c1 >  '2003-06-15 01:02:03' ORDER BY c1 ASC;
c1
2003-06-15 01:02:04
2003-06-15 23:59:59
2003-06-25 01:02:03
2004-06-15 01:02:03
2005-06-15 01:02:03
2006-06-15 01:02:03
9999-12-31 12:59:59
SELECT * FROM t1 WHERE c1 >= '2003-06-15 01:02:03' ORDER BY c1 ASC;
c1
2003-06-15 01:02:03
2003-06-15 01:02:03
2003-06-15 01:02:03
2003-06-15 01:02:03
2003-06-15 01:02:04
2003-06-15 23:59:59
2003-06-25 01:02:03
2004-06-15 01:02:03
2005-06-15 01:02:03
2006-06-15 01:02:03
9999-12-31 12:59:59
SELECT * FROM t1 WHERE c1 <  '2003-06-15 01:02:03' ORDER BY c1 ASC;
c1
1000-01-01 00:00:00
2000-06-15 01:02:03
2001-06-15 01:02:03
2002-06-15 01:02:03
2003-06-15 00:00:00
2003-06-15 01:02:02
SELECT * FROM t1 WHERE c1 <= '2003-06-15 01:02:03' ORDER BY c1 ASC;
c1
1000-01-01 00:00:00
2000-06-15 01:02:03
2001-06-15 01:02:03
2002-06-15 01:02:03
2003-06-15 00:00:00
2003-06-15 01:02:02
2003-06-15 01:02:03
2003-06-15 01:02:03
2003-06-15 01:02:03
2003-06-15 01:02:03
SELECT * FROM t1 WHERE c1 =  '2003-06-15 01:02:03' ORDER BY c1 ASC;
c1
2003-06-15 01:02:03
2003-06-15 01:02:03
2003-06-15 01:02:03
2003-06-15 01:02:03
SELECT * FROM t1 WHERE c1 >  '2003-06-15 01:02:03' ORDER BY c1 DESC;
c1
9999-12-31 12:59:59
2006-06-15 01:02:03
2005-06-15 01:02:03
2004-06-15 01:02:03
2003-06-25 01:02:03
2003-06-15 23:59:59
2003-06-15 01:02:04
SELECT * FROM t1 WHERE c1 >= '2003-06-15 01:02:03' ORDER BY c1 DESC;
c1
9999-12-31 12:59:59
2006-06-15 01:02:03
2005-06-15 01:02:03
2004-06-15 01:02:03
2003-06-25 01:02:03
2003-06-15 23:59:59
2003-06-15 01:02:04
2003-06-15 01:02:03
2003-06-15 01:02:03
2003-06-15 01:02:03
2003-06-15 01:02:03
SELECT * FROM t1 WHERE c1 <  '2003-06-15 01:02:03' ORDER BY c1 DESC;
c1
2003-06-15 01:02:02
2003-06-15 00:00:00
2002-06-15 01:02:03
2001-06-15 01:02:03
2000-06-15 01:02:03
1000-01-01 00:00:00
SELECT * FROM t1 WHERE c1 <= '2003-06-15 01:02:03' ORDER BY c1 DESC;
c1
2003-06-15 01:02:03
2003-06-15 01:02:03
2003-06-15 01:02:03
2003-06-15 01:02:03
2003-06-15 01:02:02
2003-06-15 00:00:00
2002-06-15 01:02:03
2001-06-15 01:02:03
2000-06-15 01:02:03
1000-01-01 00:00:00
SELECT * FROM t1 WHERE c1 =  '2003-06-15 01:02:03' ORDER BY c1 DESC;
c1
2003-06-15 01:02:03
2003-06-15 01:02:03
2003-06-15 01:02:03
2003-06-15 01:02:03
UPDATE t1
SET c1 = '2006-06-15 01:02:03'
WHERE c1 = '2003-06-15 01:02:03'
LIMIT 2;
SELECT * FROM t1 ORDER BY c1;
c1
1000-01-01 00:00:00
2000-06-15 01:02:03
2001-06-15 01:02:03
2002-06-15 01:02:03
2003-06-15 00:00:00
2003-06-15 01:02:02
2003-06-15 01:02:03
2003-06-15 01:02:03
2003-06-15 01:02:04
2003-06-15 23:59:59
2003-06-25 01:02:03
2004-06-15 01:02:03
2005-06-15 01:02:03
2006-06-15 01:02:03
2006-06-15 01:02:03
2006-06-15 01:02:03
9999-12-31 12:59:59
DELETE FROM t1
WHERE c1 = '2003-06-15 01:02:03'
ORDER BY c1;
SELECT * FROM t1 ORDER BY c1;
c1
1000-01-01 00:00:00
2000-06-15 01:02:03
2001-06-15 01:02:03
2002-06-15 01:02:03
2003-06-15 00:00:00
2003-06-15 01:02:02
2003-06-15 01:02:04
2003-06-15 23:59:59
2003-06-25 01:02:03
2004-06-15 01:02:03
2005-06-15 01:02:03
2006-06-15 01:02:03
2006-06-15 01:02:03
2006-06-15 01:02:03
9999-12-31 12:59:59
DROP TABLE IF EXISTS t1;
CREATE TABLE t1(c1 DATETIME NULL )
ENGINE=cloud;
INSERT INTO t1 VALUES
('2000-06-15 01:02:03'),
('2001-06-15 01:02:03'),
('2002-06-15 01:02:03'),
('2003-06-25 01:02:03'),
('2004-06-15 01:02:03'),
('2005-06-15 01:02:03'),
('2006-06-15 01:02:03'),
('2003-06-15 00:00:00'),
('2003-06-15 01:02:02'),
('2003-06-15 01:02:04'),
('2003-06-15 23:59:59'),
('1000-01-01 00:00:00'),
('9999-12-31 12:59:59'),
('2003-06-15 01:02:03'),
(NULL),
(NULL),
(NULL),
(NULL);
SELECT * FROM t1 WHERE c1 IS     NULL ORDER BY c1 ASC;
c1
NULL
NULL
NULL
NULL
SELECT * FROM t1 WHERE c1 IS NOT NULL ORDER BY c1 DESC;
c1
9999-12-31 12:59:59
2006-06-15 01:02:03
2005-06-15 01:02:03
2004-06-15 01:02:03
2003-06-25 01:02:03
2003-06-15 23:59:59
2003-06-15 01:02:04
2003-06-15 01:02:03
2003-06-15 01:02:02
2003-06-15 00:00:00
2002-06-15 01:02:03
2001-06-15 01:02:03
2000-06-15 01:02:03
1000-01-01 00:00:00
SELECT * FROM t1 WHERE c1 IS     NULL ORDER BY c1 ASC;
c1
NULL
NULL
NULL
NULL
SELECT * FROM t1 WHERE c1 IS NOT NULL ORDER BY c1 DESC;
c1
9999-12-31 12:59:59
2006-06-15 01:02:03
2005-06-15 01:02:03
2004-06-15 01:02:03
2003-06-25 01:02:03
2003-06-15 23:59:59
2003-06-15 01:02:04
2003-06-15 01:02:03
2003-06-15 01:02:02
2003-06-15 00:00:00
2002-06-15 01:02:03
2001-06-15 01:02:03
2000-06-15 01:02:03
1000-01-01 00:00:00
UPDATE t1
SET c1 = '2003-06-15 01:02:03'
WHERE c1 IS NULL
LIMIT 2;
SELECT * FROM t1 ORDER BY c1;
c1
NULL
NULL
1000-01-01 00:00:00
2000-06-15 01:02:03
2001-06-15 01:02:03
2002-06-15 01:02:03
2003-06-15 00:00:00
2003-06-15 01:02:02
2003-06-15 01:02:03
2003-06-15 01:02:03
2003-06-15 01:02:03
2003-06-15 01:02:04
2003-06-15 23:59:59
2003-06-25 01:02:03
2004-06-15 01:02:03
2005-06-15 01:02:03
2006-06-15 01:02:03
9999-12-31 12:59:59
DELETE FROM t1
WHERE c1 IS NULL
ORDER BY c1;
SELECT * FROM t1 ORDER BY c1;
c1
1000-01-01 00:00:00
2000-06-15 01:02:03
2001-06-15 01:02:03
2002-06-15 01:02:03
2003-06-15 00:00:00
2003-06-15 01:02:02
2003-06-15 01:02:03
2003-06-15 01:02:03
2003-06-15 01:02:03
2003-06-15 01:02:04
2003-06-15 23:59:59
2003-06-25 01:02:03
2004-06-15 01:02:03
2005-06-15 01:02:03
2006-06-15 01:02:03
9999-12-31 12:59:59
DROP TABLE IF EXISTS t1;
CREATE TABLE t1(c1 DATETIME NULL )
ENGINE=cloud;
INSERT INTO t1 VALUES
('2000-06-15 01:02:03'),
('2001-06-15 01:02:03'),
('2002-06-15 01:02:03'),
('2003-06-25 01:02:03'),
('2004-06-15 01:02:03'),
('2005-06-15 01:02:03'),
('2006-06-15 01:02:03'),
('2003-06-15 00:00:00'),
('2003-06-15 01:02:02'),
('2003-06-15 01:02:04'),
('2003-06-15 23:59:59'),
('1000-01-01 00:00:00'),
('9999-12-31 12:59:59'),
('2003-06-15 01:02:03'),
('2003-06-15 01:02:03'),
('2003-06-15 01:02:03'),
('2003-06-15 01:02:03');
SELECT * FROM t1 ORDER BY c1 ASC;
c1
1000-01-01 00:00:00
2000-06-15 01:02:03
2001-06-15 01:02:03
2002-06-15 01:02:03
2003-06-15 00:00:00
2003-06-15 01:02:02
2003-06-15 01:02:03
2003-06-15 01:02:03
2003-06-15 01:02:03
2003-06-15 01:02:03
2003-06-15 01:02:04
2003-06-15 23:59:59
2003-06-25 01:02:03
2004-06-15 01:02:03
2005-06-15 01:02:03
2006-06-15 01:02:03
9999-12-31 12:59:59
SELECT * FROM t1 ORDER BY c1 DESC;
c1
9999-12-31 12:59:59
2006-06-15 01:02:03
2005-06-15 01:02:03
2004-06-15 01:02:03
2003-06-25 01:02:03
2003-06-15 23:59:59
2003-06-15 01:02:04
2003-06-15 01:02:03
2003-06-15 01:02:03
2003-06-15 01:02:03
2003-06-15 01:02:03
2003-06-15 01:02:02
2003-06-15 00:00:00
2002-06-15 01:02:03
2001-06-15 01:02:03
2000-06-15 01:02:03
1000-01-01 00:00:00
SELECT * FROM t1 WHERE c1 >  '2003-06-15 01:02:03' ORDER BY c1 ASC;
c1
2003-06-15 01:02:04
2003-06-15 23:59:59
2003-06-25 01:02:03
2004-06-15 01:02:03
2005-06-15 01:02:03
2006-06-15 01:02:03
9999-12-31 12:59:59
SELECT * FROM t1 WHERE c1 >= '2003-06-15 01:02:03' ORDER BY c1 ASC;
c1
2003-06-15 01:02:03
2003-06-15 01:02:03
2003-06-15 01:02:03
2003-06-15 01:02:03
2003-06-15 01:02:04
2003-06-15 23:59:59
2003-06-25 01:02:03
2004-06-15 01:02:03
2005-06-15 01:02:03
2006-06-15 01:02:03
9999-12-31 12:59:59
SELECT * FROM t1 WHERE c1 <  '2003-06-15 01:02:03' ORDER BY c1 ASC;
c1
1000-01-01 00:00:00
2000-06-15 01:02:03
2001-06-15 01:02:03
2002-06-15 01:02:03
2003-06-15 00:00:00
2003-06-15 01:02:02
SELECT * FROM t1 WHERE c1 <= '2003-06-15 01:02:03' ORDER BY c1 ASC;
c1
1000-01-01 00:00:00
2000-06-15 01:02:03
2001-06-15 01:02:03
2002-06-15 01:02:03
2003-06-15 00:00:00
2003-06-15 01:02:02
2003-06-15 01:02:03
2003-06-15 01:02:03
2003-06-15 01:02:03
2003-06-15 01:02:03
SELECT * FROM t1 WHERE c1 =  '2003-06-15 01:02:03' ORDER BY c1 ASC;
c1
2003-06-15 01:02:03
2003-06-15 01:02:03
2003-06-15 01:02:03
2003-06-15 01:02:03
SELECT * FROM t1 WHERE c1 >  '2003-06-15 01:02:03' ORDER BY c1 DESC;
c1
9999-12-31 12:59:59
2006-06-15 01:02:03
2005-06-15 01:02:03
2004-06-15 01:02:03
2003-06-25 01:02:03
2003-06-15 23:59:59
2003-06-15 01:02:04
SELECT * FROM t1 WHERE c1 >= '2003-06-15 01:02:03' ORDER BY c1 DESC;
c1
9999-12-31 12:59:59
2006-06-15 01:02:03
2005-06-15 01:02:03
2004-06-15 01:02:03
2003-06-25 01:02:03
2003-06-15 23:59:59
2003-06-15 01:02:04
2003-06-15 01:02:03
2003-06-15 01:02:03
2003-06-15 01:02:03
2003-06-15 01:02:03
SELECT * FROM t1 WHERE c1 <  '2003-06-15 01:02:03' ORDER BY c1 DESC;
c1
2003-06-15 01:02:02
2003-06-15 00:00:00
2002-06-15 01:02:03
2001-06-15 01:02:03
2000-06-15 01:02:03
1000-01-01 00:00:00
SELECT * FROM t1 WHERE c1 <= '2003-06-15 01:02:03' ORDER BY c1 DESC;
c1
2003-06-15 01:02:03
2003-06-15 01:02:03
2003-06-15 01:02:03
2003-06-15 01:02:03
2003-06-15 01:02:02
2003-06-15 00:00:00
2002-06-15 01:02:03
2001-06-15 01:02:03
2000-06-15 01:02:03
1000-01-01 00:00:00
SELECT * FROM t1 WHERE c1 =  '2003-06-15 01:02:03' ORDER BY c1 DESC;
c1
2003-06-15 01:02:03
2003-06-15 01:02:03
2003-06-15 01:02:03
2003-06-15 01:02:03
UPDATE t1
SET c1 = '2006-06-15 01:02:03'
WHERE c1 = '2003-06-15 01:02:03'
LIMIT 2;
SELECT * FROM t1 ORDER BY c1;
c1
1000-01-01 00:00:00
2000-06-15 01:02:03
2001-06-15 01:02:03
2002-06-15 01:02:03
2003-06-15 00:00:00
2003-06-15 01:02:02
2003-06-15 01:02:03
2003-06-15 01:02:03
2003-06-15 01:02:04
2003-06-15 23:59:59
2003-06-25 01:02:03
2004-06-15 01:02:03
2005-06-15 01:02:03
2006-06-15 01:02:03
2006-06-15 01:02:03
2006-06-15 01:02:03
9999-12-31 12:59:59
DELETE FROM t1
WHERE c1 = '2003-06-15 01:02:03'
ORDER BY c1;
SELECT * FROM t1 ORDER BY c1;
c1
1000-01-01 00:00:00
2000-06-15 01:02:03
2001-06-15 01:02:03
2002-06-15 01:02:03
2003-06-15 00:00:00
2003-06-15 01:02:02
2003-06-15 01:02:04
2003-06-15 23:59:59
2003-06-25 01:02:03
2004-06-15 01:02:03
2005-06-15 01:02:03
2006-06-15 01:02:03
2006-06-15 01:02:03
2006-06-15 01:02:03
9999-12-31 12:59:59
DROP TABLE IF EXISTS t1;
CREATE TABLE t1(c1 DATETIME NOT NULL , INDEX(c1))
ENGINE=cloud;
INSERT INTO t1 VALUES
('2000-06-15 01:02:03'),
('2001-06-15 01:02:03'),
('2002-06-15 01:02:03'),
('2003-06-25 01:02:03'),
('2004-06-15 01:02:03'),
('2005-06-15 01:02:03'),
('2006-06-15 01:02:03'),
('2003-06-15 00:00:00'),
('2003-06-15 01:02:02'),
('2003-06-15 01:02:04'),
('2003-06-15 23:59:59'),
('1000-01-01 00:00:00'),
('9999-12-31 12:59:59'),
('2003-06-15 01:02:03'),
('2003-06-15 01:02:03'),
('2003-06-15 01:02:03'),
('2003-06-15 01:02:03');
SELECT * FROM t1 ORDER BY c1 ASC;
c1
1000-01-01 00:00:00
2000-06-15 01:02:03
2001-06-15 01:02:03
2002-06-15 01:02:03
2003-06-15 00:00:00
2003-06-15 01:02:02
2003-06-15 01:02:03
2003-06-15 01:02:03
2003-06-15 01:02:03
2003-06-15 01:02:03
2003-06-15 01:02:04
2003-06-15 23:59:59
2003-06-25 01:02:03
2004-06-15 01:02:03
2005-06-15 01:02:03
2006-06-15 01:02:03
9999-12-31 12:59:59
SELECT * FROM t1 ORDER BY c1 DESC;
c1
9999-12-31 12:59:59
2006-06-15 01:02:03
2005-06-15 01:02:03
2004-06-15 01:02:03
2003-06-25 01:02:03
2003-06-15 23:59:59
2003-06-15 01:02:04
2003-06-15 01:02:03
2003-06-15 01:02:03
2003-06-15 01:02:03
2003-06-15 01:02:03
2003-06-15 01:02:02
2003-06-15 00:00:00
2002-06-15 01:02:03
2001-06-15 01:02:03
2000-06-15 01:02:03
1000-01-01 00:00:00
SELECT * FROM t1 WHERE c1 >  '2003-06-15 01:02:03' ORDER BY c1 ASC;
c1
2003-06-15 01:02:04
2003-06-15 23:59:59
2003-06-25 01:02:03
2004-06-15 01:02:03
2005-06-15 01:02:03
2006-06-15 01:02:03
9999-12-31 12:59:59
SELECT * FROM t1 WHERE c1 >= '2003-06-15 01:02:03' ORDER BY c1 ASC;
c1
2003-06-15 01:02:03
2003-06-15 01:02:03
2003-06-15 01:02:03
2003-06-15 01:02:03
2003-06-15 01:02:04
2003-06-15 23:59:59
2003-06-25 01:02:03
2004-06-15 01:02:03
2005-06-15 01:02:03
2006-06-15 01:02:03
9999-12-31 12:59:59
SELECT * FROM t1 WHERE c1 <  '2003-06-15 01:02:03' ORDER BY c1 ASC;
c1
1000-01-01 00:00:00
2000-06-15 01:02:03
2001-06-15 01:02:03
2002-06-15 01:02:03
2003-06-15 00:00:00
2003-06-15 01:02:02
SELECT * FROM t1 WHERE c1 <= '2003-06-15 01:02:03' ORDER BY c1 ASC;
c1
1000-01-01 00:00:00
2000-06-15 01:02:03
2001-06-15 01:02:03
2002-06-15 01:02:03
2003-06-15 00:00:00
2003-06-15 01:02:02
2003-06-15 01:02:03
2003-06-15 01:02:03
2003-06-15 01:02:03
2003-06-15 01:02:03
SELECT * FROM t1 WHERE c1 =  '2003-06-15 01:02:03' ORDER BY c1 ASC;
c1
2003-06-15 01:02:03
2003-06-15 01:02:03
2003-06-15 01:02:03
2003-06-15 01:02:03
SELECT * FROM t1 WHERE c1 >  '2003-06-15 01:02:03' ORDER BY c1 DESC;
c1
9999-12-31 12:59:59
2006-06-15 01:02:03
2005-06-15 01:02:03
2004-06-15 01:02:03
2003-06-25 01:02:03
2003-06-15 23:59:59
2003-06-15 01:02:04
SELECT * FROM t1 WHERE c1 >= '2003-06-15 01:02:03' ORDER BY c1 DESC;
c1
9999-12-31 12:59:59
2006-06-15 01:02:03
2005-06-15 01:02:03
2004-06-15 01:02:03
2003-06-25 01:02:03
2003-06-15 23:59:59
2003-06-15 01:02:04
2003-06-15 01:02:03
2003-06-15 01:02:03
2003-06-15 01:02:03
2003-06-15 01:02:03
SELECT * FROM t1 WHERE c1 <  '2003-06-15 01:02:03' ORDER BY c1 DESC;
c1
2003-06-15 01:02:02
2003-06-15 00:00:00
2002-06-15 01:02:03
2001-06-15 01:02:03
2000-06-15 01:02:03
1000-01-01 00:00:00
SELECT * FROM t1 WHERE c1 <= '2003-06-15 01:02:03' ORDER BY c1 DESC;
c1
2003-06-15 01:02:03
2003-06-15 01:02:03
2003-06-15 01:02:03
2003-06-15 01:02:03
2003-06-15 01:02:02
2003-06-15 00:00:00
2002-06-15 01:02:03
2001-06-15 01:02:03
2000-06-15 01:02:03
1000-01-01 00:00:00
SELECT * FROM t1 WHERE c1 =  '2003-06-15 01:02:03' ORDER BY c1 DESC;
c1
2003-06-15 01:02:03
2003-06-15 01:02:03
2003-06-15 01:02:03
2003-06-15 01:02:03
UPDATE t1
SET c1 = '2006-06-15 01:02:03'
WHERE c1 = '2003-06-15 01:02:03'
LIMIT 2;
SELECT * FROM t1 ORDER BY c1;
c1
1000-01-01 00:00:00
2000-06-15 01:02:03
2001-06-15 01:02:03
2002-06-15 01:02:03
2003-06-15 00:00:00
2003-06-15 01:02:02
2003-06-15 01:02:03
2003-06-15 01:02:03
2003-06-15 01:02:04
2003-06-15 23:59:59
2003-06-25 01:02:03
2004-06-15 01:02:03
2005-06-15 01:02:03
2006-06-15 01:02:03
2006-06-15 01:02:03
2006-06-15 01:02:03
9999-12-31 12:59:59
DELETE FROM t1
WHERE c1 = '2003-06-15 01:02:03'
ORDER BY c1;
SELECT * FROM t1 ORDER BY c1;
c1
1000-01-01 00:00:00
2000-06-15 01:02:03
2001-06-15 01:02:03
2002-06-15 01:02:03
2003-06-15 00:00:00
2003-06-15 01:02:02
2003-06-15 01:02:04
2003-06-15 23:59:59
2003-06-25 01:02:03
2004-06-15 01:02:03
2005-06-15 01:02:03
2006-06-15 01:02:03
2006-06-15 01:02:03
2006-06-15 01:02:03
9999-12-31 12:59:59
DROP TABLE IF EXISTS t1;
CREATE TABLE t1(c1 DATETIME NULL , INDEX(c1))
ENGINE=cloud;
INSERT INTO t1 VALUES
('2000-06-15 01:02:03'),
('2001-06-15 01:02:03'),
('2002-06-15 01:02:03'),
('2003-06-25 01:02:03'),
('2004-06-15 01:02:03'),
('2005-06-15 01:02:03'),
('2006-06-15 01:02:03'),
('2003-06-15 00:00:00'),
('2003-06-15 01:02:02'),
('2003-06-15 01:02:04'),
('2003-06-15 23:59:59'),
('1000-01-01 00:00:00'),
('9999-12-31 12:59:59'),
('2003-06-15 01:02:03'),
(NULL),
(NULL),
(NULL),
(NULL);
SELECT * FROM t1 WHERE c1 IS     NULL ORDER BY c1 ASC;
c1
NULL
NULL
NULL
NULL
SELECT * FROM t1 WHERE c1 IS NOT NULL ORDER BY c1 DESC;
c1
9999-12-31 12:59:59
2006-06-15 01:02:03
2005-06-15 01:02:03
2004-06-15 01:02:03
2003-06-25 01:02:03
2003-06-15 23:59:59
2003-06-15 01:02:04
2003-06-15 01:02:03
2003-06-15 01:02:02
2003-06-15 00:00:00
2002-06-15 01:02:03
2001-06-15 01:02:03
2000-06-15 01:02:03
1000-01-01 00:00:00
SELECT * FROM t1 WHERE c1 IS     NULL ORDER BY c1 ASC;
c1
NULL
NULL
NULL
NULL
SELECT * FROM t1 WHERE c1 IS NOT NULL ORDER BY c1 DESC;
c1
9999-12-31 12:59:59
2006-06-15 01:02:03
2005-06-15 01:02:03
2004-06-15 01:02:03
2003-06-25 01:02:03
2003-06-15 23:59:59
2003-06-15 01:02:04
2003-06-15 01:02:03
2003-06-15 01:02:02
2003-06-15 00:00:00
2002-06-15 01:02:03
2001-06-15 01:02:03
2000-06-15 01:02:03
1000-01-01 00:00:00
UPDATE t1
SET c1 = '2003-06-15 01:02:03'
WHERE c1 IS NULL
LIMIT 2;
SELECT * FROM t1 ORDER BY c1;
c1
NULL
NULL
1000-01-01 00:00:00
2000-06-15 01:02:03
2001-06-15 01:02:03
2002-06-15 01:02:03
2003-06-15 00:00:00
2003-06-15 01:02:02
2003-06-15 01:02:03
2003-06-15 01:02:03
2003-06-15 01:02:03
2003-06-15 01:02:04
2003-06-15 23:59:59
2003-06-25 01:02:03
2004-06-15 01:02:03
2005-06-15 01:02:03
2006-06-15 01:02:03
9999-12-31 12:59:59
DELETE FROM t1
WHERE c1 IS NULL
ORDER BY c1;
SELECT * FROM t1 ORDER BY c1;
c1
1000-01-01 00:00:00
2000-06-15 01:02:03
2001-06-15 01:02:03
2002-06-15 01:02:03
2003-06-15 00:00:00
2003-06-15 01:02:02
2003-06-15 01:02:03
2003-06-15 01:02:03
2003-06-15 01:02:03
2003-06-15 01:02:04
2003-06-15 23:59:59
2003-06-25 01:02:03
2004-06-15 01:02:03
2005-06-15 01:02:03
2006-06-15 01:02:03
9999-12-31 12:59:59
DROP TABLE IF EXISTS t1;
CREATE TABLE t1(c1 DATETIME NULL , INDEX(c1))
ENGINE=cloud;
INSERT INTO t1 VALUES
('2000-06-15 01:02:03'),
('2001-06-15 01:02:03'),
('2002-06-15 01:02:03'),
('2003-06-25 01:02:03'),
('2004-06-15 01:02:03'),
('2005-06-15 01:02:03'),
('2006-06-15 01:02:03'),
('2003-06-15 00:00:00'),
('2003-06-15 01:02:02'),
('2003-06-15 01:02:04'),
('2003-06-15 23:59:59'),
('1000-01-01 00:00:00'),
('9999-12-31 12:59:59'),
('2003-06-15 01:02:03'),
('2003-06-15 01:02:03'),
('2003-06-15 01:02:03'),
('2003-06-15 01:02:03');
SELECT * FROM t1 ORDER BY c1 ASC;
c1
1000-01-01 00:00:00
2000-06-15 01:02:03
2001-06-15 01:02:03
2002-06-15 01:02:03
2003-06-15 00:00:00
2003-06-15 01:02:02
2003-06-15 01:02:03
2003-06-15 01:02:03
2003-06-15 01:02:03
2003-06-15 01:02:03
2003-06-15 01:02:04
2003-06-15 23:59:59
2003-06-25 01:02:03
2004-06-15 01:02:03
2005-06-15 01:02:03
2006-06-15 01:02:03
9999-12-31 12:59:59
SELECT * FROM t1 ORDER BY c1 DESC;
c1
9999-12-31 12:59:59
2006-06-15 01:02:03
2005-06-15 01:02:03
2004-06-15 01:02:03
2003-06-25 01:02:03
2003-06-15 23:59:59
2003-06-15 01:02:04
2003-06-15 01:02:03
2003-06-15 01:02:03
2003-06-15 01:02:03
2003-06-15 01:02:03
2003-06-15 01:02:02
2003-06-15 00:00:00
2002-06-15 01:02:03
2001-06-15 01:02:03
2000-06-15 01:02:03
1000-01-01 00:00:00
SELECT * FROM t1 WHERE c1 >  '2003-06-15 01:02:03' ORDER BY c1 ASC;
c1
2003-06-15 01:02:04
2003-06-15 23:59:59
2003-06-25 01:02:03
2004-06-15 01:02:03
2005-06-15 01:02:03
2006-06-15 01:02:03
9999-12-31 12:59:59
SELECT * FROM t1 WHERE c1 >= '2003-06-15 01:02:03' ORDER BY c1 ASC;
c1
2003-06-15 01:02:03
2003-06-15 01:02:03
2003-06-15 01:02:03
2003-06-15 01:02:03
2003-06-15 01:02:04
2003-06-15 23:59:59
2003-06-25 01:02:03
2004-06-15 01:02:03
2005-06-15 01:02:03
2006-06-15 01:02:03
9999-12-31 12:59:59
SELECT * FROM t1 WHERE c1 <  '2003-06-15 01:02:03' ORDER BY c1 ASC;
c1
1000-01-01 00:00:00
2000-06-15 01:02:03
2001-06-15 01:02:03
2002-06-15 01:02:03
2003-06-15 00:00:00
2003-06-15 01:02:02
SELECT * FROM t1 WHERE c1 <= '2003-06-15 01:02:03' ORDER BY c1 ASC;
c1
1000-01-01 00:00:00
2000-06-15 01:02:03
2001-06-15 01:02:03
2002-06-15 01:02:03
2003-06-15 00:00:00
2003-06-15 01:02:02
2003-06-15 01:02:03
2003-06-15 01:02:03
2003-06-15 01:02:03
2003-06-15 01:02:03
SELECT * FROM t1 WHERE c1 =  '2003-06-15 01:02:03' ORDER BY c1 ASC;
c1
2003-06-15 01:02:03
2003-06-15 01:02:03
2003-06-15 01:02:03
2003-06-15 01:02:03
SELECT * FROM t1 WHERE c1 >  '2003-06-15 01:02:03' ORDER BY c1 DESC;
c1
9999-12-31 12:59:59
2006-06-15 01:02:03
2005-06-15 01:02:03
2004-06-15 01:02:03
2003-06-25 01:02:03
2003-06-15 23:59:59
2003-06-15 01:02:04
SELECT * FROM t1 WHERE c1 >= '2003-06-15 01:02:03' ORDER BY c1 DESC;
c1
9999-12-31 12:59:59
2006-06-15 01:02:03
2005-06-15 01:02:03
2004-06-15 01:02:03
2003-06-25 01:02:03
2003-06-15 23:59:59
2003-06-15 01:02:04
2003-06-15 01:02:03
2003-06-15 01:02:03
2003-06-15 01:02:03
2003-06-15 01:02:03
SELECT * FROM t1 WHERE c1 <  '2003-06-15 01:02:03' ORDER BY c1 DESC;
c1
2003-06-15 01:02:02
2003-06-15 00:00:00
2002-06-15 01:02:03
2001-06-15 01:02:03
2000-06-15 01:02:03
1000-01-01 00:00:00
SELECT * FROM t1 WHERE c1 <= '2003-06-15 01:02:03' ORDER BY c1 DESC;
c1
2003-06-15 01:02:03
2003-06-15 01:02:03
2003-06-15 01:02:03
2003-06-15 01:02:03
2003-06-15 01:02:02
2003-06-15 00:00:00
2002-06-15 01:02:03
2001-06-15 01:02:03
2000-06-15 01:02:03
1000-01-01 00:00:00
SELECT * FROM t1 WHERE c1 =  '2003-06-15 01:02:03' ORDER BY c1 DESC;
c1
2003-06-15 01:02:03
2003-06-15 01:02:03
2003-06-15 01:02:03
2003-06-15 01:02:03
UPDATE t1
SET c1 = '2006-06-15 01:02:03'
WHERE c1 = '2003-06-15 01:02:03'
LIMIT 2;
SELECT * FROM t1 ORDER BY c1;
c1
1000-01-01 00:00:00
2000-06-15 01:02:03
2001-06-15 01:02:03
2002-06-15 01:02:03
2003-06-15 00:00:00
2003-06-15 01:02:02
2003-06-15 01:02:03
2003-06-15 01:02:03
2003-06-15 01:02:04
2003-06-15 23:59:59
2003-06-25 01:02:03
2004-06-15 01:02:03
2005-06-15 01:02:03
2006-06-15 01:02:03
2006-06-15 01:02:03
2006-06-15 01:02:03
9999-12-31 12:59:59
DELETE FROM t1
WHERE c1 = '2003-06-15 01:02:03'
ORDER BY c1;
SELECT * FROM t1 ORDER BY c1;
c1
1000-01-01 00:00:00
2000-06-15 01:02:03
2001-06-15 01:02:03
2002-06-15 01:02:03
2003-06-15 00:00:00
2003-06-15 01:02:02
2003-06-15 01:02:04
2003-06-15 23:59:59
2003-06-25 01:02:03
2004-06-15 01:02:03
2005-06-15 01:02:03
2006-06-15 01:02:03
2006-06-15 01:02:03
2006-06-15 01:02:03
9999-12-31 12:59:59
