DROP TABLE IF EXISTS t1;
CREATE TABLE t1(c1 DECIMAL(5,2) SIGNED NOT NULL )
ENGINE=cloud;
INSERT INTO t1 VALUES
(-999.99),
(0),
(0),
(0),
(0),
(-500.50 - 2),
(-500.50 - 1),
(-500.50),
(-500.50),
(-500.50 + 1),
(-500.50 + 2),
(999.99);
SELECT * FROM t1 ORDER BY c1 ASC;
c1
-999.99
-502.50
-501.50
-500.50
-500.50
-499.50
-498.50
0.00
0.00
0.00
0.00
999.99
SELECT * FROM t1 ORDER BY c1 DESC;
c1
999.99
0.00
0.00
0.00
0.00
-498.50
-499.50
-500.50
-500.50
-501.50
-502.50
-999.99
SELECT * FROM t1 WHERE c1 >  -500.50 ORDER BY c1 ASC;
c1
-499.50
-498.50
0.00
0.00
0.00
0.00
999.99
SELECT * FROM t1 WHERE c1 >= -500.50 ORDER BY c1 ASC;
c1
-500.50
-500.50
-499.50
-498.50
0.00
0.00
0.00
0.00
999.99
SELECT * FROM t1 WHERE c1 <  -500.50 ORDER BY c1 ASC;
c1
-999.99
-502.50
-501.50
SELECT * FROM t1 WHERE c1 <= -500.50 ORDER BY c1 ASC;
c1
-999.99
-502.50
-501.50
-500.50
-500.50
SELECT * FROM t1 WHERE c1 =  -500.50 ORDER BY c1 ASC;
c1
-500.50
-500.50
SELECT * FROM t1 WHERE c1 >  -500.50 ORDER BY c1 DESC;
c1
999.99
0.00
0.00
0.00
0.00
-498.50
-499.50
SELECT * FROM t1 WHERE c1 >= -500.50 ORDER BY c1 DESC;
c1
999.99
0.00
0.00
0.00
0.00
-498.50
-499.50
-500.50
-500.50
SELECT * FROM t1 WHERE c1 <  -500.50 ORDER BY c1 DESC;
c1
-501.50
-502.50
-999.99
SELECT * FROM t1 WHERE c1 <= -500.50 ORDER BY c1 DESC;
c1
-500.50
-500.50
-501.50
-502.50
-999.99
SELECT * FROM t1 WHERE c1 =  -500.50 ORDER BY c1 DESC;
c1
-500.50
-500.50
UPDATE t1
SET c1 = -500.50
WHERE c1 <= 0 + 0 AND c1 >= 0 - 0
ORDER BY c1 ASC
LIMIT 2;
SELECT * FROM t1 ORDER BY c1;
c1
-999.99
-502.50
-501.50
-500.50
-500.50
-500.50
-500.50
-499.50
-498.50
0.00
0.00
999.99
DELETE FROM t1
WHERE c1 <= 0 + 0 AND c1 >= 0 - 0
ORDER BY c1;
SELECT * FROM t1 ORDER BY c1;
c1
-999.99
-502.50
-501.50
-500.50
-500.50
-500.50
-500.50
-499.50
-498.50
999.99
DROP TABLE t1;
DROP TABLE IF EXISTS t1;
CREATE TABLE t1(c1 DECIMAL(5,2) SIGNED NULL)
ENGINE=cloud;
INSERT INTO t1 VALUES
(-999.99),
(0),
(-500.50),
(999.99),
(NULL),
(NULL),
(NULL),
(NULL);
SELECT * FROM t1 WHERE c1 IS     NULL ORDER BY c1 ASC;
c1
NULL
NULL
NULL
NULL
SELECT * FROM t1 WHERE c1 IS NOT NULL ORDER BY c1 DESC;
c1
999.99
0.00
-500.50
-999.99
SELECT * FROM t1 WHERE c1 IS     NULL ORDER BY c1 ASC;
c1
NULL
NULL
NULL
NULL
SELECT * FROM t1 WHERE c1 IS NOT NULL ORDER BY c1 DESC;
c1
999.99
0.00
-500.50
-999.99
UPDATE t1
SET c1 = 0
WHERE c1 IS NULL;
SELECT * FROM t1 ORDER BY c1;
c1
-999.99
-500.50
0.00
0.00
0.00
0.00
0.00
999.99
UPDATE t1
SET c1 = 0
WHERE c1 IS NULL
LIMIT 2;
SELECT * FROM t1 ORDER BY c1;
c1
-999.99
-500.50
0.00
0.00
0.00
0.00
0.00
999.99
DELETE FROM t1
WHERE c1 IS NULL
ORDER BY c1;
SELECT * FROM t1 ORDER BY c1;
c1
-999.99
-500.50
0.00
0.00
0.00
0.00
0.00
999.99
DROP TABLE t1;
DROP TABLE IF EXISTS t1;
CREATE TABLE t1(c1 DECIMAL(5,2) SIGNED NULL )
ENGINE=cloud;
INSERT INTO t1 VALUES
(-999.99),
(0),
(0),
(0),
(0),
(-500.50 - 2),
(-500.50 - 1),
(-500.50),
(-500.50),
(-500.50 + 1),
(-500.50 + 2),
(999.99);
SELECT * FROM t1 ORDER BY c1 ASC;
c1
-999.99
-502.50
-501.50
-500.50
-500.50
-499.50
-498.50
0.00
0.00
0.00
0.00
999.99
SELECT * FROM t1 ORDER BY c1 DESC;
c1
999.99
0.00
0.00
0.00
0.00
-498.50
-499.50
-500.50
-500.50
-501.50
-502.50
-999.99
SELECT * FROM t1 WHERE c1 >  -500.50 ORDER BY c1 ASC;
c1
-499.50
-498.50
0.00
0.00
0.00
0.00
999.99
SELECT * FROM t1 WHERE c1 >= -500.50 ORDER BY c1 ASC;
c1
-500.50
-500.50
-499.50
-498.50
0.00
0.00
0.00
0.00
999.99
SELECT * FROM t1 WHERE c1 <  -500.50 ORDER BY c1 ASC;
c1
-999.99
-502.50
-501.50
SELECT * FROM t1 WHERE c1 <= -500.50 ORDER BY c1 ASC;
c1
-999.99
-502.50
-501.50
-500.50
-500.50
SELECT * FROM t1 WHERE c1 =  -500.50 ORDER BY c1 ASC;
c1
-500.50
-500.50
SELECT * FROM t1 WHERE c1 >  -500.50 ORDER BY c1 DESC;
c1
999.99
0.00
0.00
0.00
0.00
-498.50
-499.50
SELECT * FROM t1 WHERE c1 >= -500.50 ORDER BY c1 DESC;
c1
999.99
0.00
0.00
0.00
0.00
-498.50
-499.50
-500.50
-500.50
SELECT * FROM t1 WHERE c1 <  -500.50 ORDER BY c1 DESC;
c1
-501.50
-502.50
-999.99
SELECT * FROM t1 WHERE c1 <= -500.50 ORDER BY c1 DESC;
c1
-500.50
-500.50
-501.50
-502.50
-999.99
SELECT * FROM t1 WHERE c1 =  -500.50 ORDER BY c1 DESC;
c1
-500.50
-500.50
UPDATE t1
SET c1 = -500.50
WHERE c1 <= 0 + 0 AND c1 >= 0 - 0
ORDER BY c1 ASC
LIMIT 2;
SELECT * FROM t1 ORDER BY c1;
c1
-999.99
-502.50
-501.50
-500.50
-500.50
-500.50
-500.50
-499.50
-498.50
0.00
0.00
999.99
DELETE FROM t1
WHERE c1 <= 0 + 0 AND c1 >= 0 - 0
ORDER BY c1;
SELECT * FROM t1 ORDER BY c1;
c1
-999.99
-502.50
-501.50
-500.50
-500.50
-500.50
-500.50
-499.50
-498.50
999.99
DROP TABLE t1;
DROP TABLE IF EXISTS t1;
CREATE TABLE t1(c1 DECIMAL(5,2) SIGNED NOT NULL , INDEX(c1))
ENGINE=cloud;
INSERT INTO t1 VALUES
(-999.99),
(0),
(0),
(0),
(0),
(-500.50 - 2),
(-500.50 - 1),
(-500.50),
(-500.50),
(-500.50 + 1),
(-500.50 + 2),
(999.99);
SELECT * FROM t1 ORDER BY c1 ASC;
c1
-999.99
-502.50
-501.50
-500.50
-500.50
-499.50
-498.50
0.00
0.00
0.00
0.00
999.99
SELECT * FROM t1 ORDER BY c1 DESC;
c1
999.99
0.00
0.00
0.00
0.00
-498.50
-499.50
-500.50
-500.50
-501.50
-502.50
-999.99
SELECT * FROM t1 WHERE c1 >  -500.50 ORDER BY c1 ASC;
c1
-499.50
-498.50
0.00
0.00
0.00
0.00
999.99
SELECT * FROM t1 WHERE c1 >= -500.50 ORDER BY c1 ASC;
c1
-500.50
-500.50
-499.50
-498.50
0.00
0.00
0.00
0.00
999.99
SELECT * FROM t1 WHERE c1 <  -500.50 ORDER BY c1 ASC;
c1
-999.99
-502.50
-501.50
SELECT * FROM t1 WHERE c1 <= -500.50 ORDER BY c1 ASC;
c1
-999.99
-502.50
-501.50
-500.50
-500.50
SELECT * FROM t1 WHERE c1 =  -500.50 ORDER BY c1 ASC;
c1
-500.50
-500.50
SELECT * FROM t1 WHERE c1 >  -500.50 ORDER BY c1 DESC;
c1
999.99
0.00
0.00
0.00
0.00
-498.50
-499.50
SELECT * FROM t1 WHERE c1 >= -500.50 ORDER BY c1 DESC;
c1
999.99
0.00
0.00
0.00
0.00
-498.50
-499.50
-500.50
-500.50
SELECT * FROM t1 WHERE c1 <  -500.50 ORDER BY c1 DESC;
c1
-501.50
-502.50
-999.99
SELECT * FROM t1 WHERE c1 <= -500.50 ORDER BY c1 DESC;
c1
-500.50
-500.50
-501.50
-502.50
-999.99
SELECT * FROM t1 WHERE c1 =  -500.50 ORDER BY c1 DESC;
c1
-500.50
-500.50
UPDATE t1
SET c1 = -500.50
WHERE c1 <= 0 + 0 AND c1 >= 0 - 0
ORDER BY c1 ASC
LIMIT 2;
SELECT * FROM t1 ORDER BY c1;
c1
-999.99
-502.50
-501.50
-500.50
-500.50
-500.50
-500.50
-499.50
-498.50
0.00
0.00
999.99
DELETE FROM t1
WHERE c1 <= 0 + 0 AND c1 >= 0 - 0
ORDER BY c1;
SELECT * FROM t1 ORDER BY c1;
c1
-999.99
-502.50
-501.50
-500.50
-500.50
-500.50
-500.50
-499.50
-498.50
999.99
DROP TABLE t1;
DROP TABLE IF EXISTS t1;
CREATE TABLE t1(c1 DECIMAL(5,2) SIGNED NULL)
ENGINE=cloud;
INSERT INTO t1 VALUES
(-999.99),
(0),
(-500.50),
(999.99),
(NULL),
(NULL),
(NULL),
(NULL);
SELECT * FROM t1 WHERE c1 IS     NULL ORDER BY c1 ASC;
c1
NULL
NULL
NULL
NULL
SELECT * FROM t1 WHERE c1 IS NOT NULL ORDER BY c1 DESC;
c1
999.99
0.00
-500.50
-999.99
SELECT * FROM t1 WHERE c1 IS     NULL ORDER BY c1 ASC;
c1
NULL
NULL
NULL
NULL
SELECT * FROM t1 WHERE c1 IS NOT NULL ORDER BY c1 DESC;
c1
999.99
0.00
-500.50
-999.99
UPDATE t1
SET c1 = 0
WHERE c1 IS NULL;
SELECT * FROM t1 ORDER BY c1;
c1
-999.99
-500.50
0.00
0.00
0.00
0.00
0.00
999.99
UPDATE t1
SET c1 = 0
WHERE c1 IS NULL
LIMIT 2;
SELECT * FROM t1 ORDER BY c1;
c1
-999.99
-500.50
0.00
0.00
0.00
0.00
0.00
999.99
DELETE FROM t1
WHERE c1 IS NULL
ORDER BY c1;
SELECT * FROM t1 ORDER BY c1;
c1
-999.99
-500.50
0.00
0.00
0.00
0.00
0.00
999.99
DROP TABLE t1;
DROP TABLE IF EXISTS t1;
CREATE TABLE t1(c1 DECIMAL(5,2) SIGNED NULL , INDEX(c1))
ENGINE=cloud;
INSERT INTO t1 VALUES
(-999.99),
(0),
(0),
(0),
(0),
(-500.50 - 2),
(-500.50 - 1),
(-500.50),
(-500.50),
(-500.50 + 1),
(-500.50 + 2),
(999.99);
SELECT * FROM t1 ORDER BY c1 ASC;
c1
-999.99
-502.50
-501.50
-500.50
-500.50
-499.50
-498.50
0.00
0.00
0.00
0.00
999.99
SELECT * FROM t1 ORDER BY c1 DESC;
c1
999.99
0.00
0.00
0.00
0.00
-498.50
-499.50
-500.50
-500.50
-501.50
-502.50
-999.99
SELECT * FROM t1 WHERE c1 >  -500.50 ORDER BY c1 ASC;
c1
-499.50
-498.50
0.00
0.00
0.00
0.00
999.99
SELECT * FROM t1 WHERE c1 >= -500.50 ORDER BY c1 ASC;
c1
-500.50
-500.50
-499.50
-498.50
0.00
0.00
0.00
0.00
999.99
SELECT * FROM t1 WHERE c1 <  -500.50 ORDER BY c1 ASC;
c1
-999.99
-502.50
-501.50
SELECT * FROM t1 WHERE c1 <= -500.50 ORDER BY c1 ASC;
c1
-999.99
-502.50
-501.50
-500.50
-500.50
SELECT * FROM t1 WHERE c1 =  -500.50 ORDER BY c1 ASC;
c1
-500.50
-500.50
SELECT * FROM t1 WHERE c1 >  -500.50 ORDER BY c1 DESC;
c1
999.99
0.00
0.00
0.00
0.00
-498.50
-499.50
SELECT * FROM t1 WHERE c1 >= -500.50 ORDER BY c1 DESC;
c1
999.99
0.00
0.00
0.00
0.00
-498.50
-499.50
-500.50
-500.50
SELECT * FROM t1 WHERE c1 <  -500.50 ORDER BY c1 DESC;
c1
-501.50
-502.50
-999.99
SELECT * FROM t1 WHERE c1 <= -500.50 ORDER BY c1 DESC;
c1
-500.50
-500.50
-501.50
-502.50
-999.99
SELECT * FROM t1 WHERE c1 =  -500.50 ORDER BY c1 DESC;
c1
-500.50
-500.50
UPDATE t1
SET c1 = -500.50
WHERE c1 <= 0 + 0 AND c1 >= 0 - 0
ORDER BY c1 ASC
LIMIT 2;
SELECT * FROM t1 ORDER BY c1;
c1
-999.99
-502.50
-501.50
-500.50
-500.50
-500.50
-500.50
-499.50
-498.50
0.00
0.00
999.99
DELETE FROM t1
WHERE c1 <= 0 + 0 AND c1 >= 0 - 0
ORDER BY c1;
SELECT * FROM t1 ORDER BY c1;
c1
-999.99
-502.50
-501.50
-500.50
-500.50
-500.50
-500.50
-499.50
-498.50
999.99
DROP TABLE t1;
DROP TABLE IF EXISTS t1;
CREATE TABLE t1(c1 DECIMAL(5,2) UNSIGNED NOT NULL )
ENGINE=cloud;
INSERT INTO t1 VALUES
(0),
(0),
(0),
(0),
(0),
(500.50 - 2),
(500.50 - 1),
(500.50),
(500.50),
(500.50 + 1),
(500.50 + 2),
(999.99);
SELECT * FROM t1 ORDER BY c1 ASC;
c1
0.00
0.00
0.00
0.00
0.00
498.50
499.50
500.50
500.50
501.50
502.50
999.99
SELECT * FROM t1 ORDER BY c1 DESC;
c1
999.99
502.50
501.50
500.50
500.50
499.50
498.50
0.00
0.00
0.00
0.00
0.00
SELECT * FROM t1 WHERE c1 >  500.50 ORDER BY c1 ASC;
c1
501.50
502.50
999.99
SELECT * FROM t1 WHERE c1 >= 500.50 ORDER BY c1 ASC;
c1
500.50
500.50
501.50
502.50
999.99
SELECT * FROM t1 WHERE c1 <  500.50 ORDER BY c1 ASC;
c1
0.00
0.00
0.00
0.00
0.00
498.50
499.50
SELECT * FROM t1 WHERE c1 <= 500.50 ORDER BY c1 ASC;
c1
0.00
0.00
0.00
0.00
0.00
498.50
499.50
500.50
500.50
SELECT * FROM t1 WHERE c1 =  500.50 ORDER BY c1 ASC;
c1
500.50
500.50
SELECT * FROM t1 WHERE c1 >  500.50 ORDER BY c1 DESC;
c1
999.99
502.50
501.50
SELECT * FROM t1 WHERE c1 >= 500.50 ORDER BY c1 DESC;
c1
999.99
502.50
501.50
500.50
500.50
SELECT * FROM t1 WHERE c1 <  500.50 ORDER BY c1 DESC;
c1
499.50
498.50
0.00
0.00
0.00
0.00
0.00
SELECT * FROM t1 WHERE c1 <= 500.50 ORDER BY c1 DESC;
c1
500.50
500.50
499.50
498.50
0.00
0.00
0.00
0.00
0.00
SELECT * FROM t1 WHERE c1 =  500.50 ORDER BY c1 DESC;
c1
500.50
500.50
UPDATE t1
SET c1 = 500.50
WHERE c1 <= 0 + 0 AND c1 >= 0 - 0
ORDER BY c1 ASC
LIMIT 2;
SELECT * FROM t1 ORDER BY c1;
c1
0.00
0.00
0.00
498.50
499.50
500.50
500.50
500.50
500.50
501.50
502.50
999.99
DELETE FROM t1
WHERE c1 <= 0 + 0 AND c1 >= 0 - 0
ORDER BY c1;
SELECT * FROM t1 ORDER BY c1;
c1
498.50
499.50
500.50
500.50
500.50
500.50
501.50
502.50
999.99
DROP TABLE t1;
DROP TABLE IF EXISTS t1;
CREATE TABLE t1(c1 DECIMAL(5,2) UNSIGNED NULL)
ENGINE=cloud;
INSERT INTO t1 VALUES
(0),
(0),
(500.50),
(999.99),
(NULL),
(NULL),
(NULL),
(NULL);
SELECT * FROM t1 WHERE c1 IS     NULL ORDER BY c1 ASC;
c1
NULL
NULL
NULL
NULL
SELECT * FROM t1 WHERE c1 IS NOT NULL ORDER BY c1 DESC;
c1
999.99
500.50
0.00
0.00
SELECT * FROM t1 WHERE c1 IS     NULL ORDER BY c1 ASC;
c1
NULL
NULL
NULL
NULL
SELECT * FROM t1 WHERE c1 IS NOT NULL ORDER BY c1 DESC;
c1
999.99
500.50
0.00
0.00
UPDATE t1
SET c1 = 0
WHERE c1 IS NULL;
SELECT * FROM t1 ORDER BY c1;
c1
0.00
0.00
0.00
0.00
0.00
0.00
500.50
999.99
UPDATE t1
SET c1 = 0
WHERE c1 IS NULL
LIMIT 2;
SELECT * FROM t1 ORDER BY c1;
c1
0.00
0.00
0.00
0.00
0.00
0.00
500.50
999.99
DELETE FROM t1
WHERE c1 IS NULL
ORDER BY c1;
SELECT * FROM t1 ORDER BY c1;
c1
0.00
0.00
0.00
0.00
0.00
0.00
500.50
999.99
DROP TABLE t1;
DROP TABLE IF EXISTS t1;
CREATE TABLE t1(c1 DECIMAL(5,2) UNSIGNED NULL )
ENGINE=cloud;
INSERT INTO t1 VALUES
(0),
(0),
(0),
(0),
(0),
(500.50 - 2),
(500.50 - 1),
(500.50),
(500.50),
(500.50 + 1),
(500.50 + 2),
(999.99);
SELECT * FROM t1 ORDER BY c1 ASC;
c1
0.00
0.00
0.00
0.00
0.00
498.50
499.50
500.50
500.50
501.50
502.50
999.99
SELECT * FROM t1 ORDER BY c1 DESC;
c1
999.99
502.50
501.50
500.50
500.50
499.50
498.50
0.00
0.00
0.00
0.00
0.00
SELECT * FROM t1 WHERE c1 >  500.50 ORDER BY c1 ASC;
c1
501.50
502.50
999.99
SELECT * FROM t1 WHERE c1 >= 500.50 ORDER BY c1 ASC;
c1
500.50
500.50
501.50
502.50
999.99
SELECT * FROM t1 WHERE c1 <  500.50 ORDER BY c1 ASC;
c1
0.00
0.00
0.00
0.00
0.00
498.50
499.50
SELECT * FROM t1 WHERE c1 <= 500.50 ORDER BY c1 ASC;
c1
0.00
0.00
0.00
0.00
0.00
498.50
499.50
500.50
500.50
SELECT * FROM t1 WHERE c1 =  500.50 ORDER BY c1 ASC;
c1
500.50
500.50
SELECT * FROM t1 WHERE c1 >  500.50 ORDER BY c1 DESC;
c1
999.99
502.50
501.50
SELECT * FROM t1 WHERE c1 >= 500.50 ORDER BY c1 DESC;
c1
999.99
502.50
501.50
500.50
500.50
SELECT * FROM t1 WHERE c1 <  500.50 ORDER BY c1 DESC;
c1
499.50
498.50
0.00
0.00
0.00
0.00
0.00
SELECT * FROM t1 WHERE c1 <= 500.50 ORDER BY c1 DESC;
c1
500.50
500.50
499.50
498.50
0.00
0.00
0.00
0.00
0.00
SELECT * FROM t1 WHERE c1 =  500.50 ORDER BY c1 DESC;
c1
500.50
500.50
UPDATE t1
SET c1 = 500.50
WHERE c1 <= 0 + 0 AND c1 >= 0 - 0
ORDER BY c1 ASC
LIMIT 2;
SELECT * FROM t1 ORDER BY c1;
c1
0.00
0.00
0.00
498.50
499.50
500.50
500.50
500.50
500.50
501.50
502.50
999.99
DELETE FROM t1
WHERE c1 <= 0 + 0 AND c1 >= 0 - 0
ORDER BY c1;
SELECT * FROM t1 ORDER BY c1;
c1
498.50
499.50
500.50
500.50
500.50
500.50
501.50
502.50
999.99
DROP TABLE t1;
DROP TABLE IF EXISTS t1;
CREATE TABLE t1(c1 DECIMAL(5,2) UNSIGNED NOT NULL , INDEX(c1))
ENGINE=cloud;
INSERT INTO t1 VALUES
(0),
(0),
(0),
(0),
(0),
(500.50 - 2),
(500.50 - 1),
(500.50),
(500.50),
(500.50 + 1),
(500.50 + 2),
(999.99);
SELECT * FROM t1 ORDER BY c1 ASC;
c1
0.00
0.00
0.00
0.00
0.00
498.50
499.50
500.50
500.50
501.50
502.50
999.99
SELECT * FROM t1 ORDER BY c1 DESC;
c1
999.99
502.50
501.50
500.50
500.50
499.50
498.50
0.00
0.00
0.00
0.00
0.00
SELECT * FROM t1 WHERE c1 >  500.50 ORDER BY c1 ASC;
c1
501.50
502.50
999.99
SELECT * FROM t1 WHERE c1 >= 500.50 ORDER BY c1 ASC;
c1
500.50
500.50
501.50
502.50
999.99
SELECT * FROM t1 WHERE c1 <  500.50 ORDER BY c1 ASC;
c1
0.00
0.00
0.00
0.00
0.00
498.50
499.50
SELECT * FROM t1 WHERE c1 <= 500.50 ORDER BY c1 ASC;
c1
0.00
0.00
0.00
0.00
0.00
498.50
499.50
500.50
500.50
SELECT * FROM t1 WHERE c1 =  500.50 ORDER BY c1 ASC;
c1
500.50
500.50
SELECT * FROM t1 WHERE c1 >  500.50 ORDER BY c1 DESC;
c1
999.99
502.50
501.50
SELECT * FROM t1 WHERE c1 >= 500.50 ORDER BY c1 DESC;
c1
999.99
502.50
501.50
500.50
500.50
SELECT * FROM t1 WHERE c1 <  500.50 ORDER BY c1 DESC;
c1
499.50
498.50
0.00
0.00
0.00
0.00
0.00
SELECT * FROM t1 WHERE c1 <= 500.50 ORDER BY c1 DESC;
c1
500.50
500.50
499.50
498.50
0.00
0.00
0.00
0.00
0.00
SELECT * FROM t1 WHERE c1 =  500.50 ORDER BY c1 DESC;
c1
500.50
500.50
UPDATE t1
SET c1 = 500.50
WHERE c1 <= 0 + 0 AND c1 >= 0 - 0
ORDER BY c1 ASC
LIMIT 2;
SELECT * FROM t1 ORDER BY c1;
c1
0.00
0.00
0.00
498.50
499.50
500.50
500.50
500.50
500.50
501.50
502.50
999.99
DELETE FROM t1
WHERE c1 <= 0 + 0 AND c1 >= 0 - 0
ORDER BY c1;
SELECT * FROM t1 ORDER BY c1;
c1
498.50
499.50
500.50
500.50
500.50
500.50
501.50
502.50
999.99
DROP TABLE t1;
DROP TABLE IF EXISTS t1;
CREATE TABLE t1(c1 DECIMAL(5,2) UNSIGNED NULL)
ENGINE=cloud;
INSERT INTO t1 VALUES
(0),
(0),
(500.50),
(999.99),
(NULL),
(NULL),
(NULL),
(NULL);
SELECT * FROM t1 WHERE c1 IS     NULL ORDER BY c1 ASC;
c1
NULL
NULL
NULL
NULL
SELECT * FROM t1 WHERE c1 IS NOT NULL ORDER BY c1 DESC;
c1
999.99
500.50
0.00
0.00
SELECT * FROM t1 WHERE c1 IS     NULL ORDER BY c1 ASC;
c1
NULL
NULL
NULL
NULL
SELECT * FROM t1 WHERE c1 IS NOT NULL ORDER BY c1 DESC;
c1
999.99
500.50
0.00
0.00
UPDATE t1
SET c1 = 0
WHERE c1 IS NULL;
SELECT * FROM t1 ORDER BY c1;
c1
0.00
0.00
0.00
0.00
0.00
0.00
500.50
999.99
UPDATE t1
SET c1 = 0
WHERE c1 IS NULL
LIMIT 2;
SELECT * FROM t1 ORDER BY c1;
c1
0.00
0.00
0.00
0.00
0.00
0.00
500.50
999.99
DELETE FROM t1
WHERE c1 IS NULL
ORDER BY c1;
SELECT * FROM t1 ORDER BY c1;
c1
0.00
0.00
0.00
0.00
0.00
0.00
500.50
999.99
DROP TABLE t1;
DROP TABLE IF EXISTS t1;
CREATE TABLE t1(c1 DECIMAL(5,2) UNSIGNED NULL , INDEX(c1))
ENGINE=cloud;
INSERT INTO t1 VALUES
(0),
(0),
(0),
(0),
(0),
(500.50 - 2),
(500.50 - 1),
(500.50),
(500.50),
(500.50 + 1),
(500.50 + 2),
(999.99);
SELECT * FROM t1 ORDER BY c1 ASC;
c1
0.00
0.00
0.00
0.00
0.00
498.50
499.50
500.50
500.50
501.50
502.50
999.99
SELECT * FROM t1 ORDER BY c1 DESC;
c1
999.99
502.50
501.50
500.50
500.50
499.50
498.50
0.00
0.00
0.00
0.00
0.00
SELECT * FROM t1 WHERE c1 >  500.50 ORDER BY c1 ASC;
c1
501.50
502.50
999.99
SELECT * FROM t1 WHERE c1 >= 500.50 ORDER BY c1 ASC;
c1
500.50
500.50
501.50
502.50
999.99
SELECT * FROM t1 WHERE c1 <  500.50 ORDER BY c1 ASC;
c1
0.00
0.00
0.00
0.00
0.00
498.50
499.50
SELECT * FROM t1 WHERE c1 <= 500.50 ORDER BY c1 ASC;
c1
0.00
0.00
0.00
0.00
0.00
498.50
499.50
500.50
500.50
SELECT * FROM t1 WHERE c1 =  500.50 ORDER BY c1 ASC;
c1
500.50
500.50
SELECT * FROM t1 WHERE c1 >  500.50 ORDER BY c1 DESC;
c1
999.99
502.50
501.50
SELECT * FROM t1 WHERE c1 >= 500.50 ORDER BY c1 DESC;
c1
999.99
502.50
501.50
500.50
500.50
SELECT * FROM t1 WHERE c1 <  500.50 ORDER BY c1 DESC;
c1
499.50
498.50
0.00
0.00
0.00
0.00
0.00
SELECT * FROM t1 WHERE c1 <= 500.50 ORDER BY c1 DESC;
c1
500.50
500.50
499.50
498.50
0.00
0.00
0.00
0.00
0.00
SELECT * FROM t1 WHERE c1 =  500.50 ORDER BY c1 DESC;
c1
500.50
500.50
UPDATE t1
SET c1 = 500.50
WHERE c1 <= 0 + 0 AND c1 >= 0 - 0
ORDER BY c1 ASC
LIMIT 2;
SELECT * FROM t1 ORDER BY c1;
c1
0.00
0.00
0.00
498.50
499.50
500.50
500.50
500.50
500.50
501.50
502.50
999.99
DELETE FROM t1
WHERE c1 <= 0 + 0 AND c1 >= 0 - 0
ORDER BY c1;
SELECT * FROM t1 ORDER BY c1;
c1
498.50
499.50
500.50
500.50
500.50
500.50
501.50
502.50
999.99
DROP TABLE t1;
