DROP TABLE IF EXISTS t1;
CREATE TABLE t1(c1 DOUBLE SIGNED NOT NULL )
ENGINE=cloud;
INSERT INTO t1 VALUES
(-1.7976931348623157E+308),
(0),
(0),
(0),
(0),
(-1.2345e+200 - 2),
(-1.2345e+200 - 1),
(-1.2345e+200),
(-1.2345e+200),
(-1.2345e+200 + 1),
(-1.2345e+200 + 2),
(1.7976931348623157E+308);
SELECT * FROM t1 ORDER BY c1 ASC;
c1
-1.7976931348623157e308
-1.2345e200
-1.2345e200
-1.2345e200
-1.2345e200
-1.2345e200
-1.2345e200
0
0
0
0
1.7976931348623157e308
SELECT * FROM t1 ORDER BY c1 DESC;
c1
1.7976931348623157e308
0
0
0
0
-1.2345e200
-1.2345e200
-1.2345e200
-1.2345e200
-1.2345e200
-1.2345e200
-1.7976931348623157e308
SELECT * FROM t1 WHERE c1 >  -1.2345e+200 ORDER BY c1 ASC;
c1
0
0
0
0
1.7976931348623157e308
SELECT * FROM t1 WHERE c1 >= -1.2345e+200 ORDER BY c1 ASC;
c1
-1.2345e200
-1.2345e200
-1.2345e200
-1.2345e200
-1.2345e200
-1.2345e200
0
0
0
0
1.7976931348623157e308
SELECT * FROM t1 WHERE c1 <  -1.2345e+200 ORDER BY c1 ASC;
c1
-1.7976931348623157e308
SELECT * FROM t1 WHERE c1 <= -1.2345e+200 ORDER BY c1 ASC;
c1
-1.7976931348623157e308
-1.2345e200
-1.2345e200
-1.2345e200
-1.2345e200
-1.2345e200
-1.2345e200
SELECT * FROM t1 WHERE c1 =  -1.2345e+200 ORDER BY c1 ASC;
c1
-1.2345e200
-1.2345e200
-1.2345e200
-1.2345e200
-1.2345e200
-1.2345e200
SELECT * FROM t1 WHERE c1 >  -1.2345e+200 ORDER BY c1 DESC;
c1
1.7976931348623157e308
0
0
0
0
SELECT * FROM t1 WHERE c1 >= -1.2345e+200 ORDER BY c1 DESC;
c1
1.7976931348623157e308
0
0
0
0
-1.2345e200
-1.2345e200
-1.2345e200
-1.2345e200
-1.2345e200
-1.2345e200
SELECT * FROM t1 WHERE c1 <  -1.2345e+200 ORDER BY c1 DESC;
c1
-1.7976931348623157e308
SELECT * FROM t1 WHERE c1 <= -1.2345e+200 ORDER BY c1 DESC;
c1
-1.2345e200
-1.2345e200
-1.2345e200
-1.2345e200
-1.2345e200
-1.2345e200
-1.7976931348623157e308
SELECT * FROM t1 WHERE c1 =  -1.2345e+200 ORDER BY c1 DESC;
c1
-1.2345e200
-1.2345e200
-1.2345e200
-1.2345e200
-1.2345e200
-1.2345e200
UPDATE t1
SET c1 = -1.2345e+200
WHERE c1 <= 0 + 1000 AND c1 >= 0 - 1000
LIMIT 2;
SELECT * FROM t1 ORDER BY c1;
c1
-1.7976931348623157e308
-1.2345e200
-1.2345e200
-1.2345e200
-1.2345e200
-1.2345e200
-1.2345e200
-1.2345e200
-1.2345e200
0
0
1.7976931348623157e308
DELETE FROM t1
WHERE c1 <= 0 + 1000 AND c1 >= 0 - 1000
ORDER BY c1;
SELECT * FROM t1 ORDER BY c1;
c1
-1.7976931348623157e308
-1.2345e200
-1.2345e200
-1.2345e200
-1.2345e200
-1.2345e200
-1.2345e200
-1.2345e200
-1.2345e200
1.7976931348623157e308
DROP TABLE t1;
DROP TABLE IF EXISTS t1;
CREATE TABLE t1(c1 DOUBLE SIGNED NULL)
ENGINE=cloud;
INSERT INTO t1 VALUES
(-1.7976931348623157E+308),
(0),
(-1.2345e+200),
(1.7976931348623157E+308),
(NULL),
(NULL),
(NULL),
(NULL);
SELECT * FROM t1 WHERE c1 IS     NULL ORDER BY c1 ASC;
c1
NULL
NULL
NULL
NULL
SELECT * FROM t1 WHERE c1 IS NOT NULL ORDER BY c1 DESC;
c1
1.7976931348623157e308
0
-1.2345e200
-1.7976931348623157e308
SELECT * FROM t1 WHERE c1 IS     NULL ORDER BY c1 ASC;
c1
NULL
NULL
NULL
NULL
SELECT * FROM t1 WHERE c1 IS NOT NULL ORDER BY c1 DESC;
c1
1.7976931348623157e308
0
-1.2345e200
-1.7976931348623157e308
UPDATE t1
SET c1 = 0
WHERE c1 IS NULL;
SELECT * FROM t1 ORDER BY c1;
c1
-1.7976931348623157e308
-1.2345e200
0
0
0
0
0
1.7976931348623157e308
UPDATE t1
SET c1 = 0
WHERE c1 IS NULL
LIMIT 2;
SELECT * FROM t1 ORDER BY c1;
c1
-1.7976931348623157e308
-1.2345e200
0
0
0
0
0
1.7976931348623157e308
DELETE FROM t1
WHERE c1 IS NULL
ORDER BY c1;
SELECT * FROM t1 ORDER BY c1;
c1
-1.7976931348623157e308
-1.2345e200
0
0
0
0
0
1.7976931348623157e308
DROP TABLE t1;
DROP TABLE IF EXISTS t1;
CREATE TABLE t1(c1 DOUBLE SIGNED NULL )
ENGINE=cloud;
INSERT INTO t1 VALUES
(-1.7976931348623157E+308),
(0),
(0),
(0),
(0),
(-1.2345e+200 - 2),
(-1.2345e+200 - 1),
(-1.2345e+200),
(-1.2345e+200),
(-1.2345e+200 + 1),
(-1.2345e+200 + 2),
(1.7976931348623157E+308);
SELECT * FROM t1 ORDER BY c1 ASC;
c1
-1.7976931348623157e308
-1.2345e200
-1.2345e200
-1.2345e200
-1.2345e200
-1.2345e200
-1.2345e200
0
0
0
0
1.7976931348623157e308
SELECT * FROM t1 ORDER BY c1 DESC;
c1
1.7976931348623157e308
0
0
0
0
-1.2345e200
-1.2345e200
-1.2345e200
-1.2345e200
-1.2345e200
-1.2345e200
-1.7976931348623157e308
SELECT * FROM t1 WHERE c1 >  -1.2345e+200 ORDER BY c1 ASC;
c1
0
0
0
0
1.7976931348623157e308
SELECT * FROM t1 WHERE c1 >= -1.2345e+200 ORDER BY c1 ASC;
c1
-1.2345e200
-1.2345e200
-1.2345e200
-1.2345e200
-1.2345e200
-1.2345e200
0
0
0
0
1.7976931348623157e308
SELECT * FROM t1 WHERE c1 <  -1.2345e+200 ORDER BY c1 ASC;
c1
-1.7976931348623157e308
SELECT * FROM t1 WHERE c1 <= -1.2345e+200 ORDER BY c1 ASC;
c1
-1.7976931348623157e308
-1.2345e200
-1.2345e200
-1.2345e200
-1.2345e200
-1.2345e200
-1.2345e200
SELECT * FROM t1 WHERE c1 =  -1.2345e+200 ORDER BY c1 ASC;
c1
-1.2345e200
-1.2345e200
-1.2345e200
-1.2345e200
-1.2345e200
-1.2345e200
SELECT * FROM t1 WHERE c1 >  -1.2345e+200 ORDER BY c1 DESC;
c1
1.7976931348623157e308
0
0
0
0
SELECT * FROM t1 WHERE c1 >= -1.2345e+200 ORDER BY c1 DESC;
c1
1.7976931348623157e308
0
0
0
0
-1.2345e200
-1.2345e200
-1.2345e200
-1.2345e200
-1.2345e200
-1.2345e200
SELECT * FROM t1 WHERE c1 <  -1.2345e+200 ORDER BY c1 DESC;
c1
-1.7976931348623157e308
SELECT * FROM t1 WHERE c1 <= -1.2345e+200 ORDER BY c1 DESC;
c1
-1.2345e200
-1.2345e200
-1.2345e200
-1.2345e200
-1.2345e200
-1.2345e200
-1.7976931348623157e308
SELECT * FROM t1 WHERE c1 =  -1.2345e+200 ORDER BY c1 DESC;
c1
-1.2345e200
-1.2345e200
-1.2345e200
-1.2345e200
-1.2345e200
-1.2345e200
UPDATE t1
SET c1 = -1.2345e+200
WHERE c1 <= 0 + 1000 AND c1 >= 0 - 1000
LIMIT 2;
SELECT * FROM t1 ORDER BY c1;
c1
-1.7976931348623157e308
-1.2345e200
-1.2345e200
-1.2345e200
-1.2345e200
-1.2345e200
-1.2345e200
-1.2345e200
-1.2345e200
0
0
1.7976931348623157e308
DELETE FROM t1
WHERE c1 <= 0 + 1000 AND c1 >= 0 - 1000
ORDER BY c1;
SELECT * FROM t1 ORDER BY c1;
c1
-1.7976931348623157e308
-1.2345e200
-1.2345e200
-1.2345e200
-1.2345e200
-1.2345e200
-1.2345e200
-1.2345e200
-1.2345e200
1.7976931348623157e308
DROP TABLE t1;
DROP TABLE IF EXISTS t1;
CREATE TABLE t1(c1 DOUBLE SIGNED NOT NULL , INDEX(c1))
ENGINE=cloud;
INSERT INTO t1 VALUES
(-1.7976931348623157E+308),
(0),
(0),
(0),
(0),
(-1.2345e+200 - 2),
(-1.2345e+200 - 1),
(-1.2345e+200),
(-1.2345e+200),
(-1.2345e+200 + 1),
(-1.2345e+200 + 2),
(1.7976931348623157E+308);
SELECT * FROM t1 ORDER BY c1 ASC;
c1
-1.7976931348623157e308
-1.2345e200
-1.2345e200
-1.2345e200
-1.2345e200
-1.2345e200
-1.2345e200
0
0
0
0
1.7976931348623157e308
SELECT * FROM t1 ORDER BY c1 DESC;
c1
1.7976931348623157e308
0
0
0
0
-1.2345e200
-1.2345e200
-1.2345e200
-1.2345e200
-1.2345e200
-1.2345e200
-1.7976931348623157e308
SELECT * FROM t1 WHERE c1 >  -1.2345e+200 ORDER BY c1 ASC;
c1
0
0
0
0
1.7976931348623157e308
SELECT * FROM t1 WHERE c1 >= -1.2345e+200 ORDER BY c1 ASC;
c1
-1.2345e200
-1.2345e200
-1.2345e200
-1.2345e200
-1.2345e200
-1.2345e200
0
0
0
0
1.7976931348623157e308
SELECT * FROM t1 WHERE c1 <  -1.2345e+200 ORDER BY c1 ASC;
c1
-1.7976931348623157e308
SELECT * FROM t1 WHERE c1 <= -1.2345e+200 ORDER BY c1 ASC;
c1
-1.7976931348623157e308
-1.2345e200
-1.2345e200
-1.2345e200
-1.2345e200
-1.2345e200
-1.2345e200
SELECT * FROM t1 WHERE c1 =  -1.2345e+200 ORDER BY c1 ASC;
c1
-1.2345e200
-1.2345e200
-1.2345e200
-1.2345e200
-1.2345e200
-1.2345e200
SELECT * FROM t1 WHERE c1 >  -1.2345e+200 ORDER BY c1 DESC;
c1
1.7976931348623157e308
0
0
0
0
SELECT * FROM t1 WHERE c1 >= -1.2345e+200 ORDER BY c1 DESC;
c1
1.7976931348623157e308
0
0
0
0
-1.2345e200
-1.2345e200
-1.2345e200
-1.2345e200
-1.2345e200
-1.2345e200
SELECT * FROM t1 WHERE c1 <  -1.2345e+200 ORDER BY c1 DESC;
c1
-1.7976931348623157e308
SELECT * FROM t1 WHERE c1 <= -1.2345e+200 ORDER BY c1 DESC;
c1
-1.2345e200
-1.2345e200
-1.2345e200
-1.2345e200
-1.2345e200
-1.2345e200
-1.7976931348623157e308
SELECT * FROM t1 WHERE c1 =  -1.2345e+200 ORDER BY c1 DESC;
c1
-1.2345e200
-1.2345e200
-1.2345e200
-1.2345e200
-1.2345e200
-1.2345e200
UPDATE t1
SET c1 = -1.2345e+200
WHERE c1 <= 0 + 1000 AND c1 >= 0 - 1000
LIMIT 2;
SELECT * FROM t1 ORDER BY c1;
c1
-1.7976931348623157e308
-1.2345e200
-1.2345e200
-1.2345e200
-1.2345e200
-1.2345e200
-1.2345e200
-1.2345e200
-1.2345e200
0
0
1.7976931348623157e308
DELETE FROM t1
WHERE c1 <= 0 + 1000 AND c1 >= 0 - 1000
ORDER BY c1;
SELECT * FROM t1 ORDER BY c1;
c1
-1.7976931348623157e308
-1.2345e200
-1.2345e200
-1.2345e200
-1.2345e200
-1.2345e200
-1.2345e200
-1.2345e200
-1.2345e200
1.7976931348623157e308
DROP TABLE t1;
DROP TABLE IF EXISTS t1;
CREATE TABLE t1(c1 DOUBLE SIGNED NULL)
ENGINE=cloud;
INSERT INTO t1 VALUES
(-1.7976931348623157E+308),
(0),
(-1.2345e+200),
(1.7976931348623157E+308),
(NULL),
(NULL),
(NULL),
(NULL);
SELECT * FROM t1 WHERE c1 IS     NULL ORDER BY c1 ASC;
c1
NULL
NULL
NULL
NULL
SELECT * FROM t1 WHERE c1 IS NOT NULL ORDER BY c1 DESC;
c1
1.7976931348623157e308
0
-1.2345e200
-1.7976931348623157e308
SELECT * FROM t1 WHERE c1 IS     NULL ORDER BY c1 ASC;
c1
NULL
NULL
NULL
NULL
SELECT * FROM t1 WHERE c1 IS NOT NULL ORDER BY c1 DESC;
c1
1.7976931348623157e308
0
-1.2345e200
-1.7976931348623157e308
UPDATE t1
SET c1 = 0
WHERE c1 IS NULL;
SELECT * FROM t1 ORDER BY c1;
c1
-1.7976931348623157e308
-1.2345e200
0
0
0
0
0
1.7976931348623157e308
UPDATE t1
SET c1 = 0
WHERE c1 IS NULL
LIMIT 2;
SELECT * FROM t1 ORDER BY c1;
c1
-1.7976931348623157e308
-1.2345e200
0
0
0
0
0
1.7976931348623157e308
DELETE FROM t1
WHERE c1 IS NULL
ORDER BY c1;
SELECT * FROM t1 ORDER BY c1;
c1
-1.7976931348623157e308
-1.2345e200
0
0
0
0
0
1.7976931348623157e308
DROP TABLE t1;
DROP TABLE IF EXISTS t1;
CREATE TABLE t1(c1 DOUBLE SIGNED NULL , INDEX(c1))
ENGINE=cloud;
INSERT INTO t1 VALUES
(-1.7976931348623157E+308),
(0),
(0),
(0),
(0),
(-1.2345e+200 - 2),
(-1.2345e+200 - 1),
(-1.2345e+200),
(-1.2345e+200),
(-1.2345e+200 + 1),
(-1.2345e+200 + 2),
(1.7976931348623157E+308);
SELECT * FROM t1 ORDER BY c1 ASC;
c1
-1.7976931348623157e308
-1.2345e200
-1.2345e200
-1.2345e200
-1.2345e200
-1.2345e200
-1.2345e200
0
0
0
0
1.7976931348623157e308
SELECT * FROM t1 ORDER BY c1 DESC;
c1
1.7976931348623157e308
0
0
0
0
-1.2345e200
-1.2345e200
-1.2345e200
-1.2345e200
-1.2345e200
-1.2345e200
-1.7976931348623157e308
SELECT * FROM t1 WHERE c1 >  -1.2345e+200 ORDER BY c1 ASC;
c1
0
0
0
0
1.7976931348623157e308
SELECT * FROM t1 WHERE c1 >= -1.2345e+200 ORDER BY c1 ASC;
c1
-1.2345e200
-1.2345e200
-1.2345e200
-1.2345e200
-1.2345e200
-1.2345e200
0
0
0
0
1.7976931348623157e308
SELECT * FROM t1 WHERE c1 <  -1.2345e+200 ORDER BY c1 ASC;
c1
-1.7976931348623157e308
SELECT * FROM t1 WHERE c1 <= -1.2345e+200 ORDER BY c1 ASC;
c1
-1.7976931348623157e308
-1.2345e200
-1.2345e200
-1.2345e200
-1.2345e200
-1.2345e200
-1.2345e200
SELECT * FROM t1 WHERE c1 =  -1.2345e+200 ORDER BY c1 ASC;
c1
-1.2345e200
-1.2345e200
-1.2345e200
-1.2345e200
-1.2345e200
-1.2345e200
SELECT * FROM t1 WHERE c1 >  -1.2345e+200 ORDER BY c1 DESC;
c1
1.7976931348623157e308
0
0
0
0
SELECT * FROM t1 WHERE c1 >= -1.2345e+200 ORDER BY c1 DESC;
c1
1.7976931348623157e308
0
0
0
0
-1.2345e200
-1.2345e200
-1.2345e200
-1.2345e200
-1.2345e200
-1.2345e200
SELECT * FROM t1 WHERE c1 <  -1.2345e+200 ORDER BY c1 DESC;
c1
-1.7976931348623157e308
SELECT * FROM t1 WHERE c1 <= -1.2345e+200 ORDER BY c1 DESC;
c1
-1.2345e200
-1.2345e200
-1.2345e200
-1.2345e200
-1.2345e200
-1.2345e200
-1.7976931348623157e308
SELECT * FROM t1 WHERE c1 =  -1.2345e+200 ORDER BY c1 DESC;
c1
-1.2345e200
-1.2345e200
-1.2345e200
-1.2345e200
-1.2345e200
-1.2345e200
UPDATE t1
SET c1 = -1.2345e+200
WHERE c1 <= 0 + 1000 AND c1 >= 0 - 1000
LIMIT 2;
SELECT * FROM t1 ORDER BY c1;
c1
-1.7976931348623157e308
-1.2345e200
-1.2345e200
-1.2345e200
-1.2345e200
-1.2345e200
-1.2345e200
-1.2345e200
-1.2345e200
0
0
1.7976931348623157e308
DELETE FROM t1
WHERE c1 <= 0 + 1000 AND c1 >= 0 - 1000
ORDER BY c1;
SELECT * FROM t1 ORDER BY c1;
c1
-1.7976931348623157e308
-1.2345e200
-1.2345e200
-1.2345e200
-1.2345e200
-1.2345e200
-1.2345e200
-1.2345e200
-1.2345e200
1.7976931348623157e308
DROP TABLE t1;
DROP TABLE IF EXISTS t1;
CREATE TABLE t1(c1 DOUBLE UNSIGNED NOT NULL )
ENGINE=cloud;
INSERT INTO t1 VALUES
(0.0),
(0),
(0),
(0),
(0),
(1.234567e+200 - 2),
(1.234567e+200 - 1),
(1.234567e+200),
(1.234567e+200),
(1.234567e+200 + 1),
(1.234567e+200 + 2),
(1.7976931348623157E+308);
SELECT * FROM t1 ORDER BY c1 ASC;
c1
0
0
0
0
0
1.234567e200
1.234567e200
1.234567e200
1.234567e200
1.234567e200
1.234567e200
1.7976931348623157e308
SELECT * FROM t1 ORDER BY c1 DESC;
c1
1.7976931348623157e308
1.234567e200
1.234567e200
1.234567e200
1.234567e200
1.234567e200
1.234567e200
0
0
0
0
0
SELECT * FROM t1 WHERE c1 >  1.234567e+200 ORDER BY c1 ASC;
c1
1.7976931348623157e308
SELECT * FROM t1 WHERE c1 >= 1.234567e+200 ORDER BY c1 ASC;
c1
1.234567e200
1.234567e200
1.234567e200
1.234567e200
1.234567e200
1.234567e200
1.7976931348623157e308
SELECT * FROM t1 WHERE c1 <  1.234567e+200 ORDER BY c1 ASC;
c1
0
0
0
0
0
SELECT * FROM t1 WHERE c1 <= 1.234567e+200 ORDER BY c1 ASC;
c1
0
0
0
0
0
1.234567e200
1.234567e200
1.234567e200
1.234567e200
1.234567e200
1.234567e200
SELECT * FROM t1 WHERE c1 =  1.234567e+200 ORDER BY c1 ASC;
c1
1.234567e200
1.234567e200
1.234567e200
1.234567e200
1.234567e200
1.234567e200
SELECT * FROM t1 WHERE c1 >  1.234567e+200 ORDER BY c1 DESC;
c1
1.7976931348623157e308
SELECT * FROM t1 WHERE c1 >= 1.234567e+200 ORDER BY c1 DESC;
c1
1.7976931348623157e308
1.234567e200
1.234567e200
1.234567e200
1.234567e200
1.234567e200
1.234567e200
SELECT * FROM t1 WHERE c1 <  1.234567e+200 ORDER BY c1 DESC;
c1
0
0
0
0
0
SELECT * FROM t1 WHERE c1 <= 1.234567e+200 ORDER BY c1 DESC;
c1
1.234567e200
1.234567e200
1.234567e200
1.234567e200
1.234567e200
1.234567e200
0
0
0
0
0
SELECT * FROM t1 WHERE c1 =  1.234567e+200 ORDER BY c1 DESC;
c1
1.234567e200
1.234567e200
1.234567e200
1.234567e200
1.234567e200
1.234567e200
UPDATE t1
SET c1 = 1.234567e+200
WHERE c1 <= 0 + 1000 AND c1 >= 0 - 1000
LIMIT 2;
SELECT * FROM t1 ORDER BY c1;
c1
0
0
0
1.234567e200
1.234567e200
1.234567e200
1.234567e200
1.234567e200
1.234567e200
1.234567e200
1.234567e200
1.7976931348623157e308
DELETE FROM t1
WHERE c1 <= 0 + 1000 AND c1 >= 0 - 1000
ORDER BY c1;
SELECT * FROM t1 ORDER BY c1;
c1
1.234567e200
1.234567e200
1.234567e200
1.234567e200
1.234567e200
1.234567e200
1.234567e200
1.234567e200
1.7976931348623157e308
DROP TABLE t1;
DROP TABLE IF EXISTS t1;
CREATE TABLE t1(c1 DOUBLE UNSIGNED NULL)
ENGINE=cloud;
INSERT INTO t1 VALUES
(0.0),
(0),
(1.234567e+200),
(1.7976931348623157E+308),
(NULL),
(NULL),
(NULL),
(NULL);
SELECT * FROM t1 WHERE c1 IS     NULL ORDER BY c1 ASC;
c1
NULL
NULL
NULL
NULL
SELECT * FROM t1 WHERE c1 IS NOT NULL ORDER BY c1 DESC;
c1
1.7976931348623157e308
1.234567e200
0
0
SELECT * FROM t1 WHERE c1 IS     NULL ORDER BY c1 ASC;
c1
NULL
NULL
NULL
NULL
SELECT * FROM t1 WHERE c1 IS NOT NULL ORDER BY c1 DESC;
c1
1.7976931348623157e308
1.234567e200
0
0
UPDATE t1
SET c1 = 0
WHERE c1 IS NULL;
SELECT * FROM t1 ORDER BY c1;
c1
0
0
0
0
0
0
1.234567e200
1.7976931348623157e308
UPDATE t1
SET c1 = 0
WHERE c1 IS NULL
LIMIT 2;
SELECT * FROM t1 ORDER BY c1;
c1
0
0
0
0
0
0
1.234567e200
1.7976931348623157e308
DELETE FROM t1
WHERE c1 IS NULL
ORDER BY c1;
SELECT * FROM t1 ORDER BY c1;
c1
0
0
0
0
0
0
1.234567e200
1.7976931348623157e308
DROP TABLE t1;
DROP TABLE IF EXISTS t1;
CREATE TABLE t1(c1 DOUBLE UNSIGNED NULL )
ENGINE=cloud;
INSERT INTO t1 VALUES
(0.0),
(0),
(0),
(0),
(0),
(1.234567e+200 - 2),
(1.234567e+200 - 1),
(1.234567e+200),
(1.234567e+200),
(1.234567e+200 + 1),
(1.234567e+200 + 2),
(1.7976931348623157E+308);
SELECT * FROM t1 ORDER BY c1 ASC;
c1
0
0
0
0
0
1.234567e200
1.234567e200
1.234567e200
1.234567e200
1.234567e200
1.234567e200
1.7976931348623157e308
SELECT * FROM t1 ORDER BY c1 DESC;
c1
1.7976931348623157e308
1.234567e200
1.234567e200
1.234567e200
1.234567e200
1.234567e200
1.234567e200
0
0
0
0
0
SELECT * FROM t1 WHERE c1 >  1.234567e+200 ORDER BY c1 ASC;
c1
1.7976931348623157e308
SELECT * FROM t1 WHERE c1 >= 1.234567e+200 ORDER BY c1 ASC;
c1
1.234567e200
1.234567e200
1.234567e200
1.234567e200
1.234567e200
1.234567e200
1.7976931348623157e308
SELECT * FROM t1 WHERE c1 <  1.234567e+200 ORDER BY c1 ASC;
c1
0
0
0
0
0
SELECT * FROM t1 WHERE c1 <= 1.234567e+200 ORDER BY c1 ASC;
c1
0
0
0
0
0
1.234567e200
1.234567e200
1.234567e200
1.234567e200
1.234567e200
1.234567e200
SELECT * FROM t1 WHERE c1 =  1.234567e+200 ORDER BY c1 ASC;
c1
1.234567e200
1.234567e200
1.234567e200
1.234567e200
1.234567e200
1.234567e200
SELECT * FROM t1 WHERE c1 >  1.234567e+200 ORDER BY c1 DESC;
c1
1.7976931348623157e308
SELECT * FROM t1 WHERE c1 >= 1.234567e+200 ORDER BY c1 DESC;
c1
1.7976931348623157e308
1.234567e200
1.234567e200
1.234567e200
1.234567e200
1.234567e200
1.234567e200
SELECT * FROM t1 WHERE c1 <  1.234567e+200 ORDER BY c1 DESC;
c1
0
0
0
0
0
SELECT * FROM t1 WHERE c1 <= 1.234567e+200 ORDER BY c1 DESC;
c1
1.234567e200
1.234567e200
1.234567e200
1.234567e200
1.234567e200
1.234567e200
0
0
0
0
0
SELECT * FROM t1 WHERE c1 =  1.234567e+200 ORDER BY c1 DESC;
c1
1.234567e200
1.234567e200
1.234567e200
1.234567e200
1.234567e200
1.234567e200
UPDATE t1
SET c1 = 1.234567e+200
WHERE c1 <= 0 + 1000 AND c1 >= 0 - 1000
LIMIT 2;
SELECT * FROM t1 ORDER BY c1;
c1
0
0
0
1.234567e200
1.234567e200
1.234567e200
1.234567e200
1.234567e200
1.234567e200
1.234567e200
1.234567e200
1.7976931348623157e308
DELETE FROM t1
WHERE c1 <= 0 + 1000 AND c1 >= 0 - 1000
ORDER BY c1;
SELECT * FROM t1 ORDER BY c1;
c1
1.234567e200
1.234567e200
1.234567e200
1.234567e200
1.234567e200
1.234567e200
1.234567e200
1.234567e200
1.7976931348623157e308
DROP TABLE t1;
DROP TABLE IF EXISTS t1;
CREATE TABLE t1(c1 DOUBLE UNSIGNED NOT NULL , INDEX(c1))
ENGINE=cloud;
INSERT INTO t1 VALUES
(0.0),
(0),
(0),
(0),
(0),
(1.234567e+200 - 2),
(1.234567e+200 - 1),
(1.234567e+200),
(1.234567e+200),
(1.234567e+200 + 1),
(1.234567e+200 + 2),
(1.7976931348623157E+308);
SELECT * FROM t1 ORDER BY c1 ASC;
c1
0
0
0
0
0
1.234567e200
1.234567e200
1.234567e200
1.234567e200
1.234567e200
1.234567e200
1.7976931348623157e308
SELECT * FROM t1 ORDER BY c1 DESC;
c1
1.7976931348623157e308
1.234567e200
1.234567e200
1.234567e200
1.234567e200
1.234567e200
1.234567e200
0
0
0
0
0
SELECT * FROM t1 WHERE c1 >  1.234567e+200 ORDER BY c1 ASC;
c1
1.7976931348623157e308
SELECT * FROM t1 WHERE c1 >= 1.234567e+200 ORDER BY c1 ASC;
c1
1.234567e200
1.234567e200
1.234567e200
1.234567e200
1.234567e200
1.234567e200
1.7976931348623157e308
SELECT * FROM t1 WHERE c1 <  1.234567e+200 ORDER BY c1 ASC;
c1
0
0
0
0
0
SELECT * FROM t1 WHERE c1 <= 1.234567e+200 ORDER BY c1 ASC;
c1
0
0
0
0
0
1.234567e200
1.234567e200
1.234567e200
1.234567e200
1.234567e200
1.234567e200
SELECT * FROM t1 WHERE c1 =  1.234567e+200 ORDER BY c1 ASC;
c1
1.234567e200
1.234567e200
1.234567e200
1.234567e200
1.234567e200
1.234567e200
SELECT * FROM t1 WHERE c1 >  1.234567e+200 ORDER BY c1 DESC;
c1
1.7976931348623157e308
SELECT * FROM t1 WHERE c1 >= 1.234567e+200 ORDER BY c1 DESC;
c1
1.7976931348623157e308
1.234567e200
1.234567e200
1.234567e200
1.234567e200
1.234567e200
1.234567e200
SELECT * FROM t1 WHERE c1 <  1.234567e+200 ORDER BY c1 DESC;
c1
0
0
0
0
0
SELECT * FROM t1 WHERE c1 <= 1.234567e+200 ORDER BY c1 DESC;
c1
1.234567e200
1.234567e200
1.234567e200
1.234567e200
1.234567e200
1.234567e200
0
0
0
0
0
SELECT * FROM t1 WHERE c1 =  1.234567e+200 ORDER BY c1 DESC;
c1
1.234567e200
1.234567e200
1.234567e200
1.234567e200
1.234567e200
1.234567e200
UPDATE t1
SET c1 = 1.234567e+200
WHERE c1 <= 0 + 1000 AND c1 >= 0 - 1000
LIMIT 2;
SELECT * FROM t1 ORDER BY c1;
c1
0
0
0
1.234567e200
1.234567e200
1.234567e200
1.234567e200
1.234567e200
1.234567e200
1.234567e200
1.234567e200
1.7976931348623157e308
DELETE FROM t1
WHERE c1 <= 0 + 1000 AND c1 >= 0 - 1000
ORDER BY c1;
SELECT * FROM t1 ORDER BY c1;
c1
1.234567e200
1.234567e200
1.234567e200
1.234567e200
1.234567e200
1.234567e200
1.234567e200
1.234567e200
1.7976931348623157e308
DROP TABLE t1;
DROP TABLE IF EXISTS t1;
CREATE TABLE t1(c1 DOUBLE UNSIGNED NULL)
ENGINE=cloud;
INSERT INTO t1 VALUES
(0.0),
(0),
(1.234567e+200),
(1.7976931348623157E+308),
(NULL),
(NULL),
(NULL),
(NULL);
SELECT * FROM t1 WHERE c1 IS     NULL ORDER BY c1 ASC;
c1
NULL
NULL
NULL
NULL
SELECT * FROM t1 WHERE c1 IS NOT NULL ORDER BY c1 DESC;
c1
1.7976931348623157e308
1.234567e200
0
0
SELECT * FROM t1 WHERE c1 IS     NULL ORDER BY c1 ASC;
c1
NULL
NULL
NULL
NULL
SELECT * FROM t1 WHERE c1 IS NOT NULL ORDER BY c1 DESC;
c1
1.7976931348623157e308
1.234567e200
0
0
UPDATE t1
SET c1 = 0
WHERE c1 IS NULL;
SELECT * FROM t1 ORDER BY c1;
c1
0
0
0
0
0
0
1.234567e200
1.7976931348623157e308
UPDATE t1
SET c1 = 0
WHERE c1 IS NULL
LIMIT 2;
SELECT * FROM t1 ORDER BY c1;
c1
0
0
0
0
0
0
1.234567e200
1.7976931348623157e308
DELETE FROM t1
WHERE c1 IS NULL
ORDER BY c1;
SELECT * FROM t1 ORDER BY c1;
c1
0
0
0
0
0
0
1.234567e200
1.7976931348623157e308
DROP TABLE t1;
DROP TABLE IF EXISTS t1;
CREATE TABLE t1(c1 DOUBLE UNSIGNED NULL , INDEX(c1))
ENGINE=cloud;
INSERT INTO t1 VALUES
(0.0),
(0),
(0),
(0),
(0),
(1.234567e+200 - 2),
(1.234567e+200 - 1),
(1.234567e+200),
(1.234567e+200),
(1.234567e+200 + 1),
(1.234567e+200 + 2),
(1.7976931348623157E+308);
SELECT * FROM t1 ORDER BY c1 ASC;
c1
0
0
0
0
0
1.234567e200
1.234567e200
1.234567e200
1.234567e200
1.234567e200
1.234567e200
1.7976931348623157e308
SELECT * FROM t1 ORDER BY c1 DESC;
c1
1.7976931348623157e308
1.234567e200
1.234567e200
1.234567e200
1.234567e200
1.234567e200
1.234567e200
0
0
0
0
0
SELECT * FROM t1 WHERE c1 >  1.234567e+200 ORDER BY c1 ASC;
c1
1.7976931348623157e308
SELECT * FROM t1 WHERE c1 >= 1.234567e+200 ORDER BY c1 ASC;
c1
1.234567e200
1.234567e200
1.234567e200
1.234567e200
1.234567e200
1.234567e200
1.7976931348623157e308
SELECT * FROM t1 WHERE c1 <  1.234567e+200 ORDER BY c1 ASC;
c1
0
0
0
0
0
SELECT * FROM t1 WHERE c1 <= 1.234567e+200 ORDER BY c1 ASC;
c1
0
0
0
0
0
1.234567e200
1.234567e200
1.234567e200
1.234567e200
1.234567e200
1.234567e200
SELECT * FROM t1 WHERE c1 =  1.234567e+200 ORDER BY c1 ASC;
c1
1.234567e200
1.234567e200
1.234567e200
1.234567e200
1.234567e200
1.234567e200
SELECT * FROM t1 WHERE c1 >  1.234567e+200 ORDER BY c1 DESC;
c1
1.7976931348623157e308
SELECT * FROM t1 WHERE c1 >= 1.234567e+200 ORDER BY c1 DESC;
c1
1.7976931348623157e308
1.234567e200
1.234567e200
1.234567e200
1.234567e200
1.234567e200
1.234567e200
SELECT * FROM t1 WHERE c1 <  1.234567e+200 ORDER BY c1 DESC;
c1
0
0
0
0
0
SELECT * FROM t1 WHERE c1 <= 1.234567e+200 ORDER BY c1 DESC;
c1
1.234567e200
1.234567e200
1.234567e200
1.234567e200
1.234567e200
1.234567e200
0
0
0
0
0
SELECT * FROM t1 WHERE c1 =  1.234567e+200 ORDER BY c1 DESC;
c1
1.234567e200
1.234567e200
1.234567e200
1.234567e200
1.234567e200
1.234567e200
UPDATE t1
SET c1 = 1.234567e+200
WHERE c1 <= 0 + 1000 AND c1 >= 0 - 1000
LIMIT 2;
SELECT * FROM t1 ORDER BY c1;
c1
0
0
0
1.234567e200
1.234567e200
1.234567e200
1.234567e200
1.234567e200
1.234567e200
1.234567e200
1.234567e200
1.7976931348623157e308
DELETE FROM t1
WHERE c1 <= 0 + 1000 AND c1 >= 0 - 1000
ORDER BY c1;
SELECT * FROM t1 ORDER BY c1;
c1
1.234567e200
1.234567e200
1.234567e200
1.234567e200
1.234567e200
1.234567e200
1.234567e200
1.234567e200
1.7976931348623157e308
DROP TABLE t1;
