DROP TABLE IF EXISTS t1;
CREATE TABLE t1(c1 FLOAT SIGNED NOT NULL )
ENGINE=cloud;
INSERT INTO t1 VALUES
(-3.402823466E+38),
(0),
(0),
(0),
(0),
(-1.1234E+20 - 2),
(-1.1234E+20 - 1),
(-1.1234E+20),
(-1.1234E+20),
(-1.1234E+20 + 1),
(-1.1234E+20 + 2),
(3.402823466E+38);
SELECT * FROM t1 ORDER BY c1 ASC;
c1
-3.40282e38
-1.1234e20
-1.1234e20
-1.1234e20
-1.1234e20
-1.1234e20
-1.1234e20
0
0
0
0
3.40282e38
SELECT * FROM t1 ORDER BY c1 DESC;
c1
3.40282e38
0
0
0
0
-1.1234e20
-1.1234e20
-1.1234e20
-1.1234e20
-1.1234e20
-1.1234e20
-3.40282e38
SELECT * FROM t1 WHERE c1 >  -1.1234E+20 ORDER BY c1 ASC;
c1
-1.1234e20
-1.1234e20
-1.1234e20
-1.1234e20
-1.1234e20
-1.1234e20
0
0
0
0
3.40282e38
SELECT * FROM t1 WHERE c1 >= -1.1234E+20 ORDER BY c1 ASC;
c1
-1.1234e20
-1.1234e20
-1.1234e20
-1.1234e20
-1.1234e20
-1.1234e20
0
0
0
0
3.40282e38
SELECT * FROM t1 WHERE c1 <  -1.1234E+20 ORDER BY c1 ASC;
c1
-3.40282e38
SELECT * FROM t1 WHERE c1 >= -1.1234E+20 ORDER BY c1 ASC;
c1
-1.1234e20
-1.1234e20
-1.1234e20
-1.1234e20
-1.1234e20
-1.1234e20
0
0
0
0
3.40282e38
SELECT * FROM t1 WHERE c1 =  -1.1234E+20 ORDER BY c1 ASC;
c1
SELECT * FROM t1 WHERE c1 >  -1.1234E+20 ORDER BY c1 DESC;
c1
3.40282e38
0
0
0
0
-1.1234e20
-1.1234e20
-1.1234e20
-1.1234e20
-1.1234e20
-1.1234e20
SELECT * FROM t1 WHERE c1 >= -1.1234E+20 ORDER BY c1 DESC;
c1
3.40282e38
0
0
0
0
-1.1234e20
-1.1234e20
-1.1234e20
-1.1234e20
-1.1234e20
-1.1234e20
SELECT * FROM t1 WHERE c1 <  -1.1234E+20 ORDER BY c1 DESC;
c1
-3.40282e38
SELECT * FROM t1 WHERE c1 >= -1.1234E+20 ORDER BY c1 DESC;
c1
3.40282e38
0
0
0
0
-1.1234e20
-1.1234e20
-1.1234e20
-1.1234e20
-1.1234e20
-1.1234e20
SELECT * FROM t1 WHERE c1 =  -1.1234E+20 ORDER BY c1 DESC;
c1
UPDATE t1
SET c1 = -1.1234E+20
WHERE c1 <= 0 + 1000.00 AND c1 >= 0 - 1000.00
LIMIT 2;
SELECT * FROM t1 ORDER BY c1;
c1
-3.40282e38
-1.1234e20
-1.1234e20
-1.1234e20
-1.1234e20
-1.1234e20
-1.1234e20
-1.1234e20
-1.1234e20
0
0
3.40282e38
DELETE FROM t1
WHERE c1 <= 0 + 1000.00 AND c1 >= 0 - 1000.00
ORDER BY c1;
SELECT * FROM t1 ORDER BY c1;
c1
-3.40282e38
-1.1234e20
-1.1234e20
-1.1234e20
-1.1234e20
-1.1234e20
-1.1234e20
-1.1234e20
-1.1234e20
3.40282e38
DROP TABLE t1;
DROP TABLE IF EXISTS t1;
CREATE TABLE t1(c1 FLOAT SIGNED )
ENGINE=cloud;
INSERT INTO t1 VALUES
(-3.402823466E+38),
(0),
(-1.1234E+20),
(3.402823466E+38),
(NULL),
(NULL);
SELECT * FROM t1 WHERE c1 IS     NULL ORDER BY c1 ASC;
c1
NULL
NULL
SELECT * FROM t1 WHERE c1 IS NOT NULL ORDER BY c1 DESC;
c1
3.40282e38
0
-1.1234e20
-3.40282e38
SELECT * FROM t1 WHERE c1 IS     NULL ORDER BY c1 ASC;
c1
NULL
NULL
SELECT * FROM t1 WHERE c1 IS NOT NULL ORDER BY c1 DESC;
c1
3.40282e38
0
-1.1234e20
-3.40282e38
UPDATE t1
SET c1 = 0
WHERE c1 IS NULL;
SELECT * FROM t1 ORDER BY c1;
c1
-3.40282e38
-1.1234e20
0
0
0
3.40282e38
UPDATE t1
SET c1 = 0
WHERE c1 IS NULL;
SELECT * FROM t1 ORDER BY c1;
c1
-3.40282e38
-1.1234e20
0
0
0
3.40282e38
DELETE FROM t1
WHERE c1 IS NULL
ORDER BY c1;
SELECT * FROM t1 ORDER BY c1;
c1
-3.40282e38
-1.1234e20
0
0
0
3.40282e38
DROP TABLE t1;
DROP TABLE IF EXISTS t1;
CREATE TABLE t1(c1 FLOAT SIGNED  )
ENGINE=cloud;
INSERT INTO t1 VALUES
(-3.402823466E+38),
(0),
(0),
(0),
(0),
(-1.1234E+20 - 2),
(-1.1234E+20 - 1),
(-1.1234E+20),
(-1.1234E+20),
(-1.1234E+20 + 1),
(-1.1234E+20 + 2),
(3.402823466E+38);
SELECT * FROM t1 ORDER BY c1 ASC;
c1
-3.40282e38
-1.1234e20
-1.1234e20
-1.1234e20
-1.1234e20
-1.1234e20
-1.1234e20
0
0
0
0
3.40282e38
SELECT * FROM t1 ORDER BY c1 DESC;
c1
3.40282e38
0
0
0
0
-1.1234e20
-1.1234e20
-1.1234e20
-1.1234e20
-1.1234e20
-1.1234e20
-3.40282e38
SELECT * FROM t1 WHERE c1 >  -1.1234E+20 ORDER BY c1 ASC;
c1
-1.1234e20
-1.1234e20
-1.1234e20
-1.1234e20
-1.1234e20
-1.1234e20
0
0
0
0
3.40282e38
SELECT * FROM t1 WHERE c1 >= -1.1234E+20 ORDER BY c1 ASC;
c1
-1.1234e20
-1.1234e20
-1.1234e20
-1.1234e20
-1.1234e20
-1.1234e20
0
0
0
0
3.40282e38
SELECT * FROM t1 WHERE c1 <  -1.1234E+20 ORDER BY c1 ASC;
c1
-3.40282e38
SELECT * FROM t1 WHERE c1 >= -1.1234E+20 ORDER BY c1 ASC;
c1
-1.1234e20
-1.1234e20
-1.1234e20
-1.1234e20
-1.1234e20
-1.1234e20
0
0
0
0
3.40282e38
SELECT * FROM t1 WHERE c1 =  -1.1234E+20 ORDER BY c1 ASC;
c1
SELECT * FROM t1 WHERE c1 >  -1.1234E+20 ORDER BY c1 DESC;
c1
3.40282e38
0
0
0
0
-1.1234e20
-1.1234e20
-1.1234e20
-1.1234e20
-1.1234e20
-1.1234e20
SELECT * FROM t1 WHERE c1 >= -1.1234E+20 ORDER BY c1 DESC;
c1
3.40282e38
0
0
0
0
-1.1234e20
-1.1234e20
-1.1234e20
-1.1234e20
-1.1234e20
-1.1234e20
SELECT * FROM t1 WHERE c1 <  -1.1234E+20 ORDER BY c1 DESC;
c1
-3.40282e38
SELECT * FROM t1 WHERE c1 >= -1.1234E+20 ORDER BY c1 DESC;
c1
3.40282e38
0
0
0
0
-1.1234e20
-1.1234e20
-1.1234e20
-1.1234e20
-1.1234e20
-1.1234e20
SELECT * FROM t1 WHERE c1 =  -1.1234E+20 ORDER BY c1 DESC;
c1
UPDATE t1
SET c1 = -1.1234E+20
WHERE c1 <= 0 + 1000.00 AND c1 >= 0 - 1000.00
LIMIT 2;
SELECT * FROM t1 ORDER BY c1;
c1
-3.40282e38
-1.1234e20
-1.1234e20
-1.1234e20
-1.1234e20
-1.1234e20
-1.1234e20
-1.1234e20
-1.1234e20
0
0
3.40282e38
DELETE FROM t1
WHERE c1 <= 0 + 1000.00 AND c1 >= 0 - 1000.00
ORDER BY c1;
SELECT * FROM t1 ORDER BY c1;
c1
-3.40282e38
-1.1234e20
-1.1234e20
-1.1234e20
-1.1234e20
-1.1234e20
-1.1234e20
-1.1234e20
-1.1234e20
3.40282e38
DROP TABLE t1;
DROP TABLE IF EXISTS t1;
CREATE TABLE t1(c1 FLOAT SIGNED NOT NULL , INDEX(c1))
ENGINE=cloud;
INSERT INTO t1 VALUES
(-3.402823466E+38),
(0),
(0),
(0),
(0),
(-1.1234E+20 - 2),
(-1.1234E+20 - 1),
(-1.1234E+20),
(-1.1234E+20),
(-1.1234E+20 + 1),
(-1.1234E+20 + 2),
(3.402823466E+38);
SELECT * FROM t1 ORDER BY c1 ASC;
c1
-3.40282e38
-1.1234e20
-1.1234e20
-1.1234e20
-1.1234e20
-1.1234e20
-1.1234e20
0
0
0
0
3.40282e38
SELECT * FROM t1 ORDER BY c1 DESC;
c1
3.40282e38
0
0
0
0
-1.1234e20
-1.1234e20
-1.1234e20
-1.1234e20
-1.1234e20
-1.1234e20
-3.40282e38
SELECT * FROM t1 WHERE c1 >  -1.1234E+20 ORDER BY c1 ASC;
c1
-1.1234e20
-1.1234e20
-1.1234e20
-1.1234e20
-1.1234e20
-1.1234e20
0
0
0
0
3.40282e38
SELECT * FROM t1 WHERE c1 >= -1.1234E+20 ORDER BY c1 ASC;
c1
-1.1234e20
-1.1234e20
-1.1234e20
-1.1234e20
-1.1234e20
-1.1234e20
0
0
0
0
3.40282e38
SELECT * FROM t1 WHERE c1 <  -1.1234E+20 ORDER BY c1 ASC;
c1
-3.40282e38
SELECT * FROM t1 WHERE c1 >= -1.1234E+20 ORDER BY c1 ASC;
c1
-1.1234e20
-1.1234e20
-1.1234e20
-1.1234e20
-1.1234e20
-1.1234e20
0
0
0
0
3.40282e38
SELECT * FROM t1 WHERE c1 =  -1.1234E+20 ORDER BY c1 ASC;
c1
SELECT * FROM t1 WHERE c1 >  -1.1234E+20 ORDER BY c1 DESC;
c1
3.40282e38
0
0
0
0
-1.1234e20
-1.1234e20
-1.1234e20
-1.1234e20
-1.1234e20
-1.1234e20
SELECT * FROM t1 WHERE c1 >= -1.1234E+20 ORDER BY c1 DESC;
c1
3.40282e38
0
0
0
0
-1.1234e20
-1.1234e20
-1.1234e20
-1.1234e20
-1.1234e20
-1.1234e20
SELECT * FROM t1 WHERE c1 <  -1.1234E+20 ORDER BY c1 DESC;
c1
-3.40282e38
SELECT * FROM t1 WHERE c1 >= -1.1234E+20 ORDER BY c1 DESC;
c1
3.40282e38
0
0
0
0
-1.1234e20
-1.1234e20
-1.1234e20
-1.1234e20
-1.1234e20
-1.1234e20
SELECT * FROM t1 WHERE c1 =  -1.1234E+20 ORDER BY c1 DESC;
c1
UPDATE t1
SET c1 = -1.1234E+20
WHERE c1 <= 0 + 1000.00 AND c1 >= 0 - 1000.00
LIMIT 2;
SELECT * FROM t1 ORDER BY c1;
c1
-3.40282e38
-1.1234e20
-1.1234e20
-1.1234e20
-1.1234e20
-1.1234e20
-1.1234e20
-1.1234e20
-1.1234e20
0
0
3.40282e38
DELETE FROM t1
WHERE c1 <= 0 + 1000.00 AND c1 >= 0 - 1000.00
ORDER BY c1;
SELECT * FROM t1 ORDER BY c1;
c1
-3.40282e38
-1.1234e20
-1.1234e20
-1.1234e20
-1.1234e20
-1.1234e20
-1.1234e20
-1.1234e20
-1.1234e20
3.40282e38
DROP TABLE t1;
DROP TABLE IF EXISTS t1;
CREATE TABLE t1(c1 FLOAT SIGNED )
ENGINE=cloud;
INSERT INTO t1 VALUES
(-3.402823466E+38),
(0),
(-1.1234E+20),
(3.402823466E+38),
(NULL),
(NULL);
SELECT * FROM t1 WHERE c1 IS     NULL ORDER BY c1 ASC;
c1
NULL
NULL
SELECT * FROM t1 WHERE c1 IS NOT NULL ORDER BY c1 DESC;
c1
3.40282e38
0
-1.1234e20
-3.40282e38
SELECT * FROM t1 WHERE c1 IS     NULL ORDER BY c1 ASC;
c1
NULL
NULL
SELECT * FROM t1 WHERE c1 IS NOT NULL ORDER BY c1 DESC;
c1
3.40282e38
0
-1.1234e20
-3.40282e38
UPDATE t1
SET c1 = 0
WHERE c1 IS NULL;
SELECT * FROM t1 ORDER BY c1;
c1
-3.40282e38
-1.1234e20
0
0
0
3.40282e38
UPDATE t1
SET c1 = 0
WHERE c1 IS NULL;
SELECT * FROM t1 ORDER BY c1;
c1
-3.40282e38
-1.1234e20
0
0
0
3.40282e38
DELETE FROM t1
WHERE c1 IS NULL
ORDER BY c1;
SELECT * FROM t1 ORDER BY c1;
c1
-3.40282e38
-1.1234e20
0
0
0
3.40282e38
DROP TABLE t1;
DROP TABLE IF EXISTS t1;
CREATE TABLE t1(c1 FLOAT SIGNED  , INDEX(c1))
ENGINE=cloud;
INSERT INTO t1 VALUES
(-3.402823466E+38),
(0),
(0),
(0),
(0),
(-1.1234E+20 - 2),
(-1.1234E+20 - 1),
(-1.1234E+20),
(-1.1234E+20),
(-1.1234E+20 + 1),
(-1.1234E+20 + 2),
(3.402823466E+38);
SELECT * FROM t1 ORDER BY c1 ASC;
c1
-3.40282e38
-1.1234e20
-1.1234e20
-1.1234e20
-1.1234e20
-1.1234e20
-1.1234e20
0
0
0
0
3.40282e38
SELECT * FROM t1 ORDER BY c1 DESC;
c1
3.40282e38
0
0
0
0
-1.1234e20
-1.1234e20
-1.1234e20
-1.1234e20
-1.1234e20
-1.1234e20
-3.40282e38
SELECT * FROM t1 WHERE c1 >  -1.1234E+20 ORDER BY c1 ASC;
c1
-1.1234e20
-1.1234e20
-1.1234e20
-1.1234e20
-1.1234e20
-1.1234e20
0
0
0
0
3.40282e38
SELECT * FROM t1 WHERE c1 >= -1.1234E+20 ORDER BY c1 ASC;
c1
-1.1234e20
-1.1234e20
-1.1234e20
-1.1234e20
-1.1234e20
-1.1234e20
0
0
0
0
3.40282e38
SELECT * FROM t1 WHERE c1 <  -1.1234E+20 ORDER BY c1 ASC;
c1
-3.40282e38
SELECT * FROM t1 WHERE c1 >= -1.1234E+20 ORDER BY c1 ASC;
c1
-1.1234e20
-1.1234e20
-1.1234e20
-1.1234e20
-1.1234e20
-1.1234e20
0
0
0
0
3.40282e38
SELECT * FROM t1 WHERE c1 =  -1.1234E+20 ORDER BY c1 ASC;
c1
SELECT * FROM t1 WHERE c1 >  -1.1234E+20 ORDER BY c1 DESC;
c1
3.40282e38
0
0
0
0
-1.1234e20
-1.1234e20
-1.1234e20
-1.1234e20
-1.1234e20
-1.1234e20
SELECT * FROM t1 WHERE c1 >= -1.1234E+20 ORDER BY c1 DESC;
c1
3.40282e38
0
0
0
0
-1.1234e20
-1.1234e20
-1.1234e20
-1.1234e20
-1.1234e20
-1.1234e20
SELECT * FROM t1 WHERE c1 <  -1.1234E+20 ORDER BY c1 DESC;
c1
-3.40282e38
SELECT * FROM t1 WHERE c1 >= -1.1234E+20 ORDER BY c1 DESC;
c1
3.40282e38
0
0
0
0
-1.1234e20
-1.1234e20
-1.1234e20
-1.1234e20
-1.1234e20
-1.1234e20
SELECT * FROM t1 WHERE c1 =  -1.1234E+20 ORDER BY c1 DESC;
c1
UPDATE t1
SET c1 = -1.1234E+20
WHERE c1 <= 0 + 1000.00 AND c1 >= 0 - 1000.00
LIMIT 2;
SELECT * FROM t1 ORDER BY c1;
c1
-3.40282e38
-1.1234e20
-1.1234e20
-1.1234e20
-1.1234e20
-1.1234e20
-1.1234e20
-1.1234e20
-1.1234e20
0
0
3.40282e38
DELETE FROM t1
WHERE c1 <= 0 + 1000.00 AND c1 >= 0 - 1000.00
ORDER BY c1;
SELECT * FROM t1 ORDER BY c1;
c1
-3.40282e38
-1.1234e20
-1.1234e20
-1.1234e20
-1.1234e20
-1.1234e20
-1.1234e20
-1.1234e20
-1.1234e20
3.40282e38
DROP TABLE t1;
DROP TABLE IF EXISTS t1;
CREATE TABLE t1(c1 FLOAT UNSIGNED NOT NULL )
ENGINE=cloud;
INSERT INTO t1 VALUES
(0),
(0),
(0),
(0),
(0),
(1.123456E+20 - 2),
(1.123456E+20 - 1),
(1.123456E+20),
(1.123456E+20),
(1.123456E+20 + 1),
(1.123456E+20 + 2),
(3.402823466E+38);
SELECT * FROM t1 ORDER BY c1 ASC;
c1
0
0
0
0
0
1.12346e20
1.12346e20
1.12346e20
1.12346e20
1.12346e20
1.12346e20
3.40282e38
SELECT * FROM t1 ORDER BY c1 DESC;
c1
3.40282e38
1.12346e20
1.12346e20
1.12346e20
1.12346e20
1.12346e20
1.12346e20
0
0
0
0
0
SELECT * FROM t1 WHERE c1 >  1.123456E+20 ORDER BY c1 ASC;
c1
1.12346e20
1.12346e20
1.12346e20
1.12346e20
1.12346e20
1.12346e20
3.40282e38
SELECT * FROM t1 WHERE c1 >= 1.123456E+20 ORDER BY c1 ASC;
c1
1.12346e20
1.12346e20
1.12346e20
1.12346e20
1.12346e20
1.12346e20
3.40282e38
SELECT * FROM t1 WHERE c1 <  1.123456E+20 ORDER BY c1 ASC;
c1
0
0
0
0
0
SELECT * FROM t1 WHERE c1 >= 1.123456E+20 ORDER BY c1 ASC;
c1
1.12346e20
1.12346e20
1.12346e20
1.12346e20
1.12346e20
1.12346e20
3.40282e38
SELECT * FROM t1 WHERE c1 =  1.123456E+20 ORDER BY c1 ASC;
c1
SELECT * FROM t1 WHERE c1 >  1.123456E+20 ORDER BY c1 DESC;
c1
3.40282e38
1.12346e20
1.12346e20
1.12346e20
1.12346e20
1.12346e20
1.12346e20
SELECT * FROM t1 WHERE c1 >= 1.123456E+20 ORDER BY c1 DESC;
c1
3.40282e38
1.12346e20
1.12346e20
1.12346e20
1.12346e20
1.12346e20
1.12346e20
SELECT * FROM t1 WHERE c1 <  1.123456E+20 ORDER BY c1 DESC;
c1
0
0
0
0
0
SELECT * FROM t1 WHERE c1 >= 1.123456E+20 ORDER BY c1 DESC;
c1
3.40282e38
1.12346e20
1.12346e20
1.12346e20
1.12346e20
1.12346e20
1.12346e20
SELECT * FROM t1 WHERE c1 =  1.123456E+20 ORDER BY c1 DESC;
c1
UPDATE t1
SET c1 = 1.123456E+20
WHERE c1 <= 0 + 1000.00 AND c1 >= 0 - 1000.00
LIMIT 2;
SELECT * FROM t1 ORDER BY c1;
c1
0
0
0
1.12346e20
1.12346e20
1.12346e20
1.12346e20
1.12346e20
1.12346e20
1.12346e20
1.12346e20
3.40282e38
DELETE FROM t1
WHERE c1 <= 0 + 1000.00 AND c1 >= 0 - 1000.00
ORDER BY c1;
SELECT * FROM t1 ORDER BY c1;
c1
1.12346e20
1.12346e20
1.12346e20
1.12346e20
1.12346e20
1.12346e20
1.12346e20
1.12346e20
3.40282e38
DROP TABLE t1;
DROP TABLE IF EXISTS t1;
CREATE TABLE t1(c1 FLOAT UNSIGNED )
ENGINE=cloud;
INSERT INTO t1 VALUES
(0),
(0),
(1.123456E+20),
(3.402823466E+38),
(NULL),
(NULL);
SELECT * FROM t1 WHERE c1 IS     NULL ORDER BY c1 ASC;
c1
NULL
NULL
SELECT * FROM t1 WHERE c1 IS NOT NULL ORDER BY c1 DESC;
c1
3.40282e38
1.12346e20
0
0
SELECT * FROM t1 WHERE c1 IS     NULL ORDER BY c1 ASC;
c1
NULL
NULL
SELECT * FROM t1 WHERE c1 IS NOT NULL ORDER BY c1 DESC;
c1
3.40282e38
1.12346e20
0
0
UPDATE t1
SET c1 = 0
WHERE c1 IS NULL;
SELECT * FROM t1 ORDER BY c1;
c1
0
0
0
0
1.12346e20
3.40282e38
UPDATE t1
SET c1 = 0
WHERE c1 IS NULL;
SELECT * FROM t1 ORDER BY c1;
c1
0
0
0
0
1.12346e20
3.40282e38
DELETE FROM t1
WHERE c1 IS NULL
ORDER BY c1;
SELECT * FROM t1 ORDER BY c1;
c1
0
0
0
0
1.12346e20
3.40282e38
DROP TABLE t1;
DROP TABLE IF EXISTS t1;
CREATE TABLE t1(c1 FLOAT UNSIGNED  )
ENGINE=cloud;
INSERT INTO t1 VALUES
(0),
(0),
(0),
(0),
(0),
(1.123456E+20 - 2),
(1.123456E+20 - 1),
(1.123456E+20),
(1.123456E+20),
(1.123456E+20 + 1),
(1.123456E+20 + 2),
(3.402823466E+38);
SELECT * FROM t1 ORDER BY c1 ASC;
c1
0
0
0
0
0
1.12346e20
1.12346e20
1.12346e20
1.12346e20
1.12346e20
1.12346e20
3.40282e38
SELECT * FROM t1 ORDER BY c1 DESC;
c1
3.40282e38
1.12346e20
1.12346e20
1.12346e20
1.12346e20
1.12346e20
1.12346e20
0
0
0
0
0
SELECT * FROM t1 WHERE c1 >  1.123456E+20 ORDER BY c1 ASC;
c1
1.12346e20
1.12346e20
1.12346e20
1.12346e20
1.12346e20
1.12346e20
3.40282e38
SELECT * FROM t1 WHERE c1 >= 1.123456E+20 ORDER BY c1 ASC;
c1
1.12346e20
1.12346e20
1.12346e20
1.12346e20
1.12346e20
1.12346e20
3.40282e38
SELECT * FROM t1 WHERE c1 <  1.123456E+20 ORDER BY c1 ASC;
c1
0
0
0
0
0
SELECT * FROM t1 WHERE c1 >= 1.123456E+20 ORDER BY c1 ASC;
c1
1.12346e20
1.12346e20
1.12346e20
1.12346e20
1.12346e20
1.12346e20
3.40282e38
SELECT * FROM t1 WHERE c1 =  1.123456E+20 ORDER BY c1 ASC;
c1
SELECT * FROM t1 WHERE c1 >  1.123456E+20 ORDER BY c1 DESC;
c1
3.40282e38
1.12346e20
1.12346e20
1.12346e20
1.12346e20
1.12346e20
1.12346e20
SELECT * FROM t1 WHERE c1 >= 1.123456E+20 ORDER BY c1 DESC;
c1
3.40282e38
1.12346e20
1.12346e20
1.12346e20
1.12346e20
1.12346e20
1.12346e20
SELECT * FROM t1 WHERE c1 <  1.123456E+20 ORDER BY c1 DESC;
c1
0
0
0
0
0
SELECT * FROM t1 WHERE c1 >= 1.123456E+20 ORDER BY c1 DESC;
c1
3.40282e38
1.12346e20
1.12346e20
1.12346e20
1.12346e20
1.12346e20
1.12346e20
SELECT * FROM t1 WHERE c1 =  1.123456E+20 ORDER BY c1 DESC;
c1
UPDATE t1
SET c1 = 1.123456E+20
WHERE c1 <= 0 + 1000.00 AND c1 >= 0 - 1000.00
LIMIT 2;
SELECT * FROM t1 ORDER BY c1;
c1
0
0
0
1.12346e20
1.12346e20
1.12346e20
1.12346e20
1.12346e20
1.12346e20
1.12346e20
1.12346e20
3.40282e38
DELETE FROM t1
WHERE c1 <= 0 + 1000.00 AND c1 >= 0 - 1000.00
ORDER BY c1;
SELECT * FROM t1 ORDER BY c1;
c1
1.12346e20
1.12346e20
1.12346e20
1.12346e20
1.12346e20
1.12346e20
1.12346e20
1.12346e20
3.40282e38
DROP TABLE t1;
DROP TABLE IF EXISTS t1;
CREATE TABLE t1(c1 FLOAT UNSIGNED NOT NULL , INDEX(c1))
ENGINE=cloud;
INSERT INTO t1 VALUES
(0),
(0),
(0),
(0),
(0),
(1.123456E+20 - 2),
(1.123456E+20 - 1),
(1.123456E+20),
(1.123456E+20),
(1.123456E+20 + 1),
(1.123456E+20 + 2),
(3.402823466E+38);
SELECT * FROM t1 ORDER BY c1 ASC;
c1
0
0
0
0
0
1.12346e20
1.12346e20
1.12346e20
1.12346e20
1.12346e20
1.12346e20
3.40282e38
SELECT * FROM t1 ORDER BY c1 DESC;
c1
3.40282e38
1.12346e20
1.12346e20
1.12346e20
1.12346e20
1.12346e20
1.12346e20
0
0
0
0
0
SELECT * FROM t1 WHERE c1 >  1.123456E+20 ORDER BY c1 ASC;
c1
1.12346e20
1.12346e20
1.12346e20
1.12346e20
1.12346e20
1.12346e20
3.40282e38
SELECT * FROM t1 WHERE c1 >= 1.123456E+20 ORDER BY c1 ASC;
c1
1.12346e20
1.12346e20
1.12346e20
1.12346e20
1.12346e20
1.12346e20
3.40282e38
SELECT * FROM t1 WHERE c1 <  1.123456E+20 ORDER BY c1 ASC;
c1
0
0
0
0
0
SELECT * FROM t1 WHERE c1 >= 1.123456E+20 ORDER BY c1 ASC;
c1
1.12346e20
1.12346e20
1.12346e20
1.12346e20
1.12346e20
1.12346e20
3.40282e38
SELECT * FROM t1 WHERE c1 =  1.123456E+20 ORDER BY c1 ASC;
c1
SELECT * FROM t1 WHERE c1 >  1.123456E+20 ORDER BY c1 DESC;
c1
3.40282e38
1.12346e20
1.12346e20
1.12346e20
1.12346e20
1.12346e20
1.12346e20
SELECT * FROM t1 WHERE c1 >= 1.123456E+20 ORDER BY c1 DESC;
c1
3.40282e38
1.12346e20
1.12346e20
1.12346e20
1.12346e20
1.12346e20
1.12346e20
SELECT * FROM t1 WHERE c1 <  1.123456E+20 ORDER BY c1 DESC;
c1
0
0
0
0
0
SELECT * FROM t1 WHERE c1 >= 1.123456E+20 ORDER BY c1 DESC;
c1
3.40282e38
1.12346e20
1.12346e20
1.12346e20
1.12346e20
1.12346e20
1.12346e20
SELECT * FROM t1 WHERE c1 =  1.123456E+20 ORDER BY c1 DESC;
c1
UPDATE t1
SET c1 = 1.123456E+20
WHERE c1 <= 0 + 1000.00 AND c1 >= 0 - 1000.00
LIMIT 2;
SELECT * FROM t1 ORDER BY c1;
c1
0
0
0
1.12346e20
1.12346e20
1.12346e20
1.12346e20
1.12346e20
1.12346e20
1.12346e20
1.12346e20
3.40282e38
DELETE FROM t1
WHERE c1 <= 0 + 1000.00 AND c1 >= 0 - 1000.00
ORDER BY c1;
SELECT * FROM t1 ORDER BY c1;
c1
1.12346e20
1.12346e20
1.12346e20
1.12346e20
1.12346e20
1.12346e20
1.12346e20
1.12346e20
3.40282e38
DROP TABLE t1;
DROP TABLE IF EXISTS t1;
CREATE TABLE t1(c1 FLOAT UNSIGNED )
ENGINE=cloud;
INSERT INTO t1 VALUES
(0),
(0),
(1.123456E+20),
(3.402823466E+38),
(NULL),
(NULL);
SELECT * FROM t1 WHERE c1 IS     NULL ORDER BY c1 ASC;
c1
NULL
NULL
SELECT * FROM t1 WHERE c1 IS NOT NULL ORDER BY c1 DESC;
c1
3.40282e38
1.12346e20
0
0
SELECT * FROM t1 WHERE c1 IS     NULL ORDER BY c1 ASC;
c1
NULL
NULL
SELECT * FROM t1 WHERE c1 IS NOT NULL ORDER BY c1 DESC;
c1
3.40282e38
1.12346e20
0
0
UPDATE t1
SET c1 = 0
WHERE c1 IS NULL;
SELECT * FROM t1 ORDER BY c1;
c1
0
0
0
0
1.12346e20
3.40282e38
UPDATE t1
SET c1 = 0
WHERE c1 IS NULL;
SELECT * FROM t1 ORDER BY c1;
c1
0
0
0
0
1.12346e20
3.40282e38
DELETE FROM t1
WHERE c1 IS NULL
ORDER BY c1;
SELECT * FROM t1 ORDER BY c1;
c1
0
0
0
0
1.12346e20
3.40282e38
DROP TABLE t1;
DROP TABLE IF EXISTS t1;
CREATE TABLE t1(c1 FLOAT UNSIGNED  , INDEX(c1))
ENGINE=cloud;
INSERT INTO t1 VALUES
(0),
(0),
(0),
(0),
(0),
(1.123456E+20 - 2),
(1.123456E+20 - 1),
(1.123456E+20),
(1.123456E+20),
(1.123456E+20 + 1),
(1.123456E+20 + 2),
(3.402823466E+38);
SELECT * FROM t1 ORDER BY c1 ASC;
c1
0
0
0
0
0
1.12346e20
1.12346e20
1.12346e20
1.12346e20
1.12346e20
1.12346e20
3.40282e38
SELECT * FROM t1 ORDER BY c1 DESC;
c1
3.40282e38
1.12346e20
1.12346e20
1.12346e20
1.12346e20
1.12346e20
1.12346e20
0
0
0
0
0
SELECT * FROM t1 WHERE c1 >  1.123456E+20 ORDER BY c1 ASC;
c1
1.12346e20
1.12346e20
1.12346e20
1.12346e20
1.12346e20
1.12346e20
3.40282e38
SELECT * FROM t1 WHERE c1 >= 1.123456E+20 ORDER BY c1 ASC;
c1
1.12346e20
1.12346e20
1.12346e20
1.12346e20
1.12346e20
1.12346e20
3.40282e38
SELECT * FROM t1 WHERE c1 <  1.123456E+20 ORDER BY c1 ASC;
c1
0
0
0
0
0
SELECT * FROM t1 WHERE c1 >= 1.123456E+20 ORDER BY c1 ASC;
c1
1.12346e20
1.12346e20
1.12346e20
1.12346e20
1.12346e20
1.12346e20
3.40282e38
SELECT * FROM t1 WHERE c1 =  1.123456E+20 ORDER BY c1 ASC;
c1
SELECT * FROM t1 WHERE c1 >  1.123456E+20 ORDER BY c1 DESC;
c1
3.40282e38
1.12346e20
1.12346e20
1.12346e20
1.12346e20
1.12346e20
1.12346e20
SELECT * FROM t1 WHERE c1 >= 1.123456E+20 ORDER BY c1 DESC;
c1
3.40282e38
1.12346e20
1.12346e20
1.12346e20
1.12346e20
1.12346e20
1.12346e20
SELECT * FROM t1 WHERE c1 <  1.123456E+20 ORDER BY c1 DESC;
c1
0
0
0
0
0
SELECT * FROM t1 WHERE c1 >= 1.123456E+20 ORDER BY c1 DESC;
c1
3.40282e38
1.12346e20
1.12346e20
1.12346e20
1.12346e20
1.12346e20
1.12346e20
SELECT * FROM t1 WHERE c1 =  1.123456E+20 ORDER BY c1 DESC;
c1
UPDATE t1
SET c1 = 1.123456E+20
WHERE c1 <= 0 + 1000.00 AND c1 >= 0 - 1000.00
LIMIT 2;
SELECT * FROM t1 ORDER BY c1;
c1
0
0
0
1.12346e20
1.12346e20
1.12346e20
1.12346e20
1.12346e20
1.12346e20
1.12346e20
1.12346e20
3.40282e38
DELETE FROM t1
WHERE c1 <= 0 + 1000.00 AND c1 >= 0 - 1000.00
ORDER BY c1;
SELECT * FROM t1 ORDER BY c1;
c1
1.12346e20
1.12346e20
1.12346e20
1.12346e20
1.12346e20
1.12346e20
1.12346e20
1.12346e20
3.40282e38
DROP TABLE t1;
