DROP TABLE IF EXISTS t1;
CREATE TABLE t1(c1 INT SIGNED NOT NULL )
ENGINE=cloud;
INSERT INTO t1 VALUES
(-2147483648),
(0),
(0),
(0),
(0),
(1073741824 - 2),
(1073741824 - 1),
(1073741824),
(1073741824),
(1073741824 + 1),
(1073741824 + 2),
(2147483647);
SELECT * FROM t1 ORDER BY c1 ASC;
c1
-2147483648
0
0
0
0
1073741822
1073741823
1073741824
1073741824
1073741825
1073741826
2147483647
SELECT * FROM t1 ORDER BY c1 DESC;
c1
2147483647
1073741826
1073741825
1073741824
1073741824
1073741823
1073741822
0
0
0
0
-2147483648
SELECT * FROM t1 WHERE c1 >  1073741824 ORDER BY c1 ASC;
c1
1073741825
1073741826
2147483647
SELECT * FROM t1 WHERE c1 >= 1073741824 ORDER BY c1 ASC;
c1
1073741824
1073741824
1073741825
1073741826
2147483647
SELECT * FROM t1 WHERE c1 <  1073741824 ORDER BY c1 ASC;
c1
-2147483648
0
0
0
0
1073741822
1073741823
SELECT * FROM t1 WHERE c1 >= 1073741824 ORDER BY c1 ASC;
c1
1073741824
1073741824
1073741825
1073741826
2147483647
SELECT * FROM t1 WHERE c1 =  1073741824 ORDER BY c1 ASC;
c1
1073741824
1073741824
SELECT * FROM t1 WHERE c1 >  1073741824 ORDER BY c1 DESC;
c1
2147483647
1073741826
1073741825
SELECT * FROM t1 WHERE c1 >= 1073741824 ORDER BY c1 DESC;
c1
2147483647
1073741826
1073741825
1073741824
1073741824
SELECT * FROM t1 WHERE c1 <  1073741824 ORDER BY c1 DESC;
c1
1073741823
1073741822
0
0
0
0
-2147483648
SELECT * FROM t1 WHERE c1 >= 1073741824 ORDER BY c1 DESC;
c1
2147483647
1073741826
1073741825
1073741824
1073741824
SELECT * FROM t1 WHERE c1 =  1073741824 ORDER BY c1 DESC;
c1
1073741824
1073741824
UPDATE t1
SET c1 = 1073741824
WHERE c1 <= 0 + 0 AND c1 >= 0 - 0
LIMIT 2;
SELECT * FROM t1 ORDER BY c1;
c1
-2147483648
0
0
1073741822
1073741823
1073741824
1073741824
1073741824
1073741824
1073741825
1073741826
2147483647
DELETE FROM t1
WHERE c1 <= 0 + 0 AND c1 >= 0 - 0
ORDER BY c1;
SELECT * FROM t1 ORDER BY c1;
c1
-2147483648
1073741822
1073741823
1073741824
1073741824
1073741824
1073741824
1073741825
1073741826
2147483647
DROP TABLE t1;
DROP TABLE IF EXISTS t1;
CREATE TABLE t1(c1 INT SIGNED )
ENGINE=cloud;
INSERT INTO t1 VALUES
(-2147483648),
(0),
(1073741824),
(2147483647),
(NULL),
(NULL);
SELECT * FROM t1 WHERE c1 IS     NULL ORDER BY c1 ASC;
c1
NULL
NULL
SELECT * FROM t1 WHERE c1 IS NOT NULL ORDER BY c1 DESC;
c1
2147483647
1073741824
0
-2147483648
SELECT * FROM t1 WHERE c1 IS     NULL ORDER BY c1 ASC;
c1
NULL
NULL
SELECT * FROM t1 WHERE c1 IS NOT NULL ORDER BY c1 DESC;
c1
2147483647
1073741824
0
-2147483648
UPDATE t1
SET c1 = 0
WHERE c1 IS NULL;
SELECT * FROM t1 ORDER BY c1;
c1
-2147483648
0
0
0
1073741824
2147483647
UPDATE t1
SET c1 = 0
WHERE c1 IS NULL;
SELECT * FROM t1 ORDER BY c1;
c1
-2147483648
0
0
0
1073741824
2147483647
DELETE FROM t1
WHERE c1 IS NULL
ORDER BY c1;
SELECT * FROM t1 ORDER BY c1;
c1
-2147483648
0
0
0
1073741824
2147483647
DROP TABLE t1;
DROP TABLE IF EXISTS t1;
CREATE TABLE t1(c1 INT SIGNED  )
ENGINE=cloud;
INSERT INTO t1 VALUES
(-2147483648),
(0),
(0),
(0),
(0),
(1073741824 - 2),
(1073741824 - 1),
(1073741824),
(1073741824),
(1073741824 + 1),
(1073741824 + 2),
(2147483647);
SELECT * FROM t1 ORDER BY c1 ASC;
c1
-2147483648
0
0
0
0
1073741822
1073741823
1073741824
1073741824
1073741825
1073741826
2147483647
SELECT * FROM t1 ORDER BY c1 DESC;
c1
2147483647
1073741826
1073741825
1073741824
1073741824
1073741823
1073741822
0
0
0
0
-2147483648
SELECT * FROM t1 WHERE c1 >  1073741824 ORDER BY c1 ASC;
c1
1073741825
1073741826
2147483647
SELECT * FROM t1 WHERE c1 >= 1073741824 ORDER BY c1 ASC;
c1
1073741824
1073741824
1073741825
1073741826
2147483647
SELECT * FROM t1 WHERE c1 <  1073741824 ORDER BY c1 ASC;
c1
-2147483648
0
0
0
0
1073741822
1073741823
SELECT * FROM t1 WHERE c1 >= 1073741824 ORDER BY c1 ASC;
c1
1073741824
1073741824
1073741825
1073741826
2147483647
SELECT * FROM t1 WHERE c1 =  1073741824 ORDER BY c1 ASC;
c1
1073741824
1073741824
SELECT * FROM t1 WHERE c1 >  1073741824 ORDER BY c1 DESC;
c1
2147483647
1073741826
1073741825
SELECT * FROM t1 WHERE c1 >= 1073741824 ORDER BY c1 DESC;
c1
2147483647
1073741826
1073741825
1073741824
1073741824
SELECT * FROM t1 WHERE c1 <  1073741824 ORDER BY c1 DESC;
c1
1073741823
1073741822
0
0
0
0
-2147483648
SELECT * FROM t1 WHERE c1 >= 1073741824 ORDER BY c1 DESC;
c1
2147483647
1073741826
1073741825
1073741824
1073741824
SELECT * FROM t1 WHERE c1 =  1073741824 ORDER BY c1 DESC;
c1
1073741824
1073741824
UPDATE t1
SET c1 = 1073741824
WHERE c1 <= 0 + 0 AND c1 >= 0 - 0
LIMIT 2;
SELECT * FROM t1 ORDER BY c1;
c1
-2147483648
0
0
1073741822
1073741823
1073741824
1073741824
1073741824
1073741824
1073741825
1073741826
2147483647
DELETE FROM t1
WHERE c1 <= 0 + 0 AND c1 >= 0 - 0
ORDER BY c1;
SELECT * FROM t1 ORDER BY c1;
c1
-2147483648
1073741822
1073741823
1073741824
1073741824
1073741824
1073741824
1073741825
1073741826
2147483647
DROP TABLE t1;
DROP TABLE IF EXISTS t1;
CREATE TABLE t1(c1 INT SIGNED NOT NULL , INDEX(c1))
ENGINE=cloud;
INSERT INTO t1 VALUES
(-2147483648),
(0),
(0),
(0),
(0),
(1073741824 - 2),
(1073741824 - 1),
(1073741824),
(1073741824),
(1073741824 + 1),
(1073741824 + 2),
(2147483647);
SELECT * FROM t1 ORDER BY c1 ASC;
c1
-2147483648
0
0
0
0
1073741822
1073741823
1073741824
1073741824
1073741825
1073741826
2147483647
SELECT * FROM t1 ORDER BY c1 DESC;
c1
2147483647
1073741826
1073741825
1073741824
1073741824
1073741823
1073741822
0
0
0
0
-2147483648
SELECT * FROM t1 WHERE c1 >  1073741824 ORDER BY c1 ASC;
c1
1073741825
1073741826
2147483647
SELECT * FROM t1 WHERE c1 >= 1073741824 ORDER BY c1 ASC;
c1
1073741824
1073741824
1073741825
1073741826
2147483647
SELECT * FROM t1 WHERE c1 <  1073741824 ORDER BY c1 ASC;
c1
-2147483648
0
0
0
0
1073741822
1073741823
SELECT * FROM t1 WHERE c1 >= 1073741824 ORDER BY c1 ASC;
c1
1073741824
1073741824
1073741825
1073741826
2147483647
SELECT * FROM t1 WHERE c1 =  1073741824 ORDER BY c1 ASC;
c1
1073741824
1073741824
SELECT * FROM t1 WHERE c1 >  1073741824 ORDER BY c1 DESC;
c1
2147483647
1073741826
1073741825
SELECT * FROM t1 WHERE c1 >= 1073741824 ORDER BY c1 DESC;
c1
2147483647
1073741826
1073741825
1073741824
1073741824
SELECT * FROM t1 WHERE c1 <  1073741824 ORDER BY c1 DESC;
c1
1073741823
1073741822
0
0
0
0
-2147483648
SELECT * FROM t1 WHERE c1 >= 1073741824 ORDER BY c1 DESC;
c1
2147483647
1073741826
1073741825
1073741824
1073741824
SELECT * FROM t1 WHERE c1 =  1073741824 ORDER BY c1 DESC;
c1
1073741824
1073741824
UPDATE t1
SET c1 = 1073741824
WHERE c1 <= 0 + 0 AND c1 >= 0 - 0
LIMIT 2;
SELECT * FROM t1 ORDER BY c1;
c1
-2147483648
0
0
1073741822
1073741823
1073741824
1073741824
1073741824
1073741824
1073741825
1073741826
2147483647
DELETE FROM t1
WHERE c1 <= 0 + 0 AND c1 >= 0 - 0
ORDER BY c1;
SELECT * FROM t1 ORDER BY c1;
c1
-2147483648
1073741822
1073741823
1073741824
1073741824
1073741824
1073741824
1073741825
1073741826
2147483647
DROP TABLE t1;
DROP TABLE IF EXISTS t1;
CREATE TABLE t1(c1 INT SIGNED )
ENGINE=cloud;
INSERT INTO t1 VALUES
(-2147483648),
(0),
(1073741824),
(2147483647),
(NULL),
(NULL);
SELECT * FROM t1 WHERE c1 IS     NULL ORDER BY c1 ASC;
c1
NULL
NULL
SELECT * FROM t1 WHERE c1 IS NOT NULL ORDER BY c1 DESC;
c1
2147483647
1073741824
0
-2147483648
SELECT * FROM t1 WHERE c1 IS     NULL ORDER BY c1 ASC;
c1
NULL
NULL
SELECT * FROM t1 WHERE c1 IS NOT NULL ORDER BY c1 DESC;
c1
2147483647
1073741824
0
-2147483648
UPDATE t1
SET c1 = 0
WHERE c1 IS NULL;
SELECT * FROM t1 ORDER BY c1;
c1
-2147483648
0
0
0
1073741824
2147483647
UPDATE t1
SET c1 = 0
WHERE c1 IS NULL;
SELECT * FROM t1 ORDER BY c1;
c1
-2147483648
0
0
0
1073741824
2147483647
DELETE FROM t1
WHERE c1 IS NULL
ORDER BY c1;
SELECT * FROM t1 ORDER BY c1;
c1
-2147483648
0
0
0
1073741824
2147483647
DROP TABLE t1;
DROP TABLE IF EXISTS t1;
CREATE TABLE t1(c1 INT SIGNED  , INDEX(c1))
ENGINE=cloud;
INSERT INTO t1 VALUES
(-2147483648),
(0),
(0),
(0),
(0),
(1073741824 - 2),
(1073741824 - 1),
(1073741824),
(1073741824),
(1073741824 + 1),
(1073741824 + 2),
(2147483647);
SELECT * FROM t1 ORDER BY c1 ASC;
c1
-2147483648
0
0
0
0
1073741822
1073741823
1073741824
1073741824
1073741825
1073741826
2147483647
SELECT * FROM t1 ORDER BY c1 DESC;
c1
2147483647
1073741826
1073741825
1073741824
1073741824
1073741823
1073741822
0
0
0
0
-2147483648
SELECT * FROM t1 WHERE c1 >  1073741824 ORDER BY c1 ASC;
c1
1073741825
1073741826
2147483647
SELECT * FROM t1 WHERE c1 >= 1073741824 ORDER BY c1 ASC;
c1
1073741824
1073741824
1073741825
1073741826
2147483647
SELECT * FROM t1 WHERE c1 <  1073741824 ORDER BY c1 ASC;
c1
-2147483648
0
0
0
0
1073741822
1073741823
SELECT * FROM t1 WHERE c1 >= 1073741824 ORDER BY c1 ASC;
c1
1073741824
1073741824
1073741825
1073741826
2147483647
SELECT * FROM t1 WHERE c1 =  1073741824 ORDER BY c1 ASC;
c1
1073741824
1073741824
SELECT * FROM t1 WHERE c1 >  1073741824 ORDER BY c1 DESC;
c1
2147483647
1073741826
1073741825
SELECT * FROM t1 WHERE c1 >= 1073741824 ORDER BY c1 DESC;
c1
2147483647
1073741826
1073741825
1073741824
1073741824
SELECT * FROM t1 WHERE c1 <  1073741824 ORDER BY c1 DESC;
c1
1073741823
1073741822
0
0
0
0
-2147483648
SELECT * FROM t1 WHERE c1 >= 1073741824 ORDER BY c1 DESC;
c1
2147483647
1073741826
1073741825
1073741824
1073741824
SELECT * FROM t1 WHERE c1 =  1073741824 ORDER BY c1 DESC;
c1
1073741824
1073741824
UPDATE t1
SET c1 = 1073741824
WHERE c1 <= 0 + 0 AND c1 >= 0 - 0
LIMIT 2;
SELECT * FROM t1 ORDER BY c1;
c1
-2147483648
0
0
1073741822
1073741823
1073741824
1073741824
1073741824
1073741824
1073741825
1073741826
2147483647
DELETE FROM t1
WHERE c1 <= 0 + 0 AND c1 >= 0 - 0
ORDER BY c1;
SELECT * FROM t1 ORDER BY c1;
c1
-2147483648
1073741822
1073741823
1073741824
1073741824
1073741824
1073741824
1073741825
1073741826
2147483647
DROP TABLE t1;
DROP TABLE IF EXISTS t1;
CREATE TABLE t1(c1 INT UNSIGNED NOT NULL )
ENGINE=cloud;
INSERT INTO t1 VALUES
(0),
(0),
(0),
(0),
(0),
(2147483648 - 2),
(2147483648 - 1),
(2147483648),
(2147483648),
(2147483648 + 1),
(2147483648 + 2),
(4294967295);
SELECT * FROM t1 ORDER BY c1 ASC;
c1
0
0
0
0
0
2147483646
2147483647
2147483648
2147483648
2147483649
2147483650
4294967295
SELECT * FROM t1 ORDER BY c1 DESC;
c1
4294967295
2147483650
2147483649
2147483648
2147483648
2147483647
2147483646
0
0
0
0
0
SELECT * FROM t1 WHERE c1 >  2147483648 ORDER BY c1 ASC;
c1
2147483649
2147483650
4294967295
SELECT * FROM t1 WHERE c1 >= 2147483648 ORDER BY c1 ASC;
c1
2147483648
2147483648
2147483649
2147483650
4294967295
SELECT * FROM t1 WHERE c1 <  2147483648 ORDER BY c1 ASC;
c1
0
0
0
0
0
2147483646
2147483647
SELECT * FROM t1 WHERE c1 >= 2147483648 ORDER BY c1 ASC;
c1
2147483648
2147483648
2147483649
2147483650
4294967295
SELECT * FROM t1 WHERE c1 =  2147483648 ORDER BY c1 ASC;
c1
2147483648
2147483648
SELECT * FROM t1 WHERE c1 >  2147483648 ORDER BY c1 DESC;
c1
4294967295
2147483650
2147483649
SELECT * FROM t1 WHERE c1 >= 2147483648 ORDER BY c1 DESC;
c1
4294967295
2147483650
2147483649
2147483648
2147483648
SELECT * FROM t1 WHERE c1 <  2147483648 ORDER BY c1 DESC;
c1
2147483647
2147483646
0
0
0
0
0
SELECT * FROM t1 WHERE c1 >= 2147483648 ORDER BY c1 DESC;
c1
4294967295
2147483650
2147483649
2147483648
2147483648
SELECT * FROM t1 WHERE c1 =  2147483648 ORDER BY c1 DESC;
c1
2147483648
2147483648
UPDATE t1
SET c1 = 2147483648
WHERE c1 <= 0 + 0 AND c1 >= 0 - 0
LIMIT 2;
SELECT * FROM t1 ORDER BY c1;
c1
0
0
0
2147483646
2147483647
2147483648
2147483648
2147483648
2147483648
2147483649
2147483650
4294967295
DELETE FROM t1
WHERE c1 <= 0 + 0 AND c1 >= 0 - 0
ORDER BY c1;
SELECT * FROM t1 ORDER BY c1;
c1
2147483646
2147483647
2147483648
2147483648
2147483648
2147483648
2147483649
2147483650
4294967295
DROP TABLE t1;
DROP TABLE IF EXISTS t1;
CREATE TABLE t1(c1 INT UNSIGNED )
ENGINE=cloud;
INSERT INTO t1 VALUES
(0),
(0),
(2147483648),
(4294967295),
(NULL),
(NULL);
SELECT * FROM t1 WHERE c1 IS     NULL ORDER BY c1 ASC;
c1
NULL
NULL
SELECT * FROM t1 WHERE c1 IS NOT NULL ORDER BY c1 DESC;
c1
4294967295
2147483648
0
0
SELECT * FROM t1 WHERE c1 IS     NULL ORDER BY c1 ASC;
c1
NULL
NULL
SELECT * FROM t1 WHERE c1 IS NOT NULL ORDER BY c1 DESC;
c1
4294967295
2147483648
0
0
UPDATE t1
SET c1 = 0
WHERE c1 IS NULL;
SELECT * FROM t1 ORDER BY c1;
c1
0
0
0
0
2147483648
4294967295
UPDATE t1
SET c1 = 0
WHERE c1 IS NULL;
SELECT * FROM t1 ORDER BY c1;
c1
0
0
0
0
2147483648
4294967295
DELETE FROM t1
WHERE c1 IS NULL
ORDER BY c1;
SELECT * FROM t1 ORDER BY c1;
c1
0
0
0
0
2147483648
4294967295
DROP TABLE t1;
DROP TABLE IF EXISTS t1;
CREATE TABLE t1(c1 INT UNSIGNED  )
ENGINE=cloud;
INSERT INTO t1 VALUES
(0),
(0),
(0),
(0),
(0),
(2147483648 - 2),
(2147483648 - 1),
(2147483648),
(2147483648),
(2147483648 + 1),
(2147483648 + 2),
(4294967295);
SELECT * FROM t1 ORDER BY c1 ASC;
c1
0
0
0
0
0
2147483646
2147483647
2147483648
2147483648
2147483649
2147483650
4294967295
SELECT * FROM t1 ORDER BY c1 DESC;
c1
4294967295
2147483650
2147483649
2147483648
2147483648
2147483647
2147483646
0
0
0
0
0
SELECT * FROM t1 WHERE c1 >  2147483648 ORDER BY c1 ASC;
c1
2147483649
2147483650
4294967295
SELECT * FROM t1 WHERE c1 >= 2147483648 ORDER BY c1 ASC;
c1
2147483648
2147483648
2147483649
2147483650
4294967295
SELECT * FROM t1 WHERE c1 <  2147483648 ORDER BY c1 ASC;
c1
0
0
0
0
0
2147483646
2147483647
SELECT * FROM t1 WHERE c1 >= 2147483648 ORDER BY c1 ASC;
c1
2147483648
2147483648
2147483649
2147483650
4294967295
SELECT * FROM t1 WHERE c1 =  2147483648 ORDER BY c1 ASC;
c1
2147483648
2147483648
SELECT * FROM t1 WHERE c1 >  2147483648 ORDER BY c1 DESC;
c1
4294967295
2147483650
2147483649
SELECT * FROM t1 WHERE c1 >= 2147483648 ORDER BY c1 DESC;
c1
4294967295
2147483650
2147483649
2147483648
2147483648
SELECT * FROM t1 WHERE c1 <  2147483648 ORDER BY c1 DESC;
c1
2147483647
2147483646
0
0
0
0
0
SELECT * FROM t1 WHERE c1 >= 2147483648 ORDER BY c1 DESC;
c1
4294967295
2147483650
2147483649
2147483648
2147483648
SELECT * FROM t1 WHERE c1 =  2147483648 ORDER BY c1 DESC;
c1
2147483648
2147483648
UPDATE t1
SET c1 = 2147483648
WHERE c1 <= 0 + 0 AND c1 >= 0 - 0
LIMIT 2;
SELECT * FROM t1 ORDER BY c1;
c1
0
0
0
2147483646
2147483647
2147483648
2147483648
2147483648
2147483648
2147483649
2147483650
4294967295
DELETE FROM t1
WHERE c1 <= 0 + 0 AND c1 >= 0 - 0
ORDER BY c1;
SELECT * FROM t1 ORDER BY c1;
c1
2147483646
2147483647
2147483648
2147483648
2147483648
2147483648
2147483649
2147483650
4294967295
DROP TABLE t1;
DROP TABLE IF EXISTS t1;
CREATE TABLE t1(c1 INT UNSIGNED NOT NULL , INDEX(c1))
ENGINE=cloud;
INSERT INTO t1 VALUES
(0),
(0),
(0),
(0),
(0),
(2147483648 - 2),
(2147483648 - 1),
(2147483648),
(2147483648),
(2147483648 + 1),
(2147483648 + 2),
(4294967295);
SELECT * FROM t1 ORDER BY c1 ASC;
c1
0
0
0
0
0
2147483646
2147483647
2147483648
2147483648
2147483649
2147483650
4294967295
SELECT * FROM t1 ORDER BY c1 DESC;
c1
4294967295
2147483650
2147483649
2147483648
2147483648
2147483647
2147483646
0
0
0
0
0
SELECT * FROM t1 WHERE c1 >  2147483648 ORDER BY c1 ASC;
c1
2147483649
2147483650
4294967295
SELECT * FROM t1 WHERE c1 >= 2147483648 ORDER BY c1 ASC;
c1
2147483648
2147483648
2147483649
2147483650
4294967295
SELECT * FROM t1 WHERE c1 <  2147483648 ORDER BY c1 ASC;
c1
0
0
0
0
0
2147483646
2147483647
SELECT * FROM t1 WHERE c1 >= 2147483648 ORDER BY c1 ASC;
c1
2147483648
2147483648
2147483649
2147483650
4294967295
SELECT * FROM t1 WHERE c1 =  2147483648 ORDER BY c1 ASC;
c1
2147483648
2147483648
SELECT * FROM t1 WHERE c1 >  2147483648 ORDER BY c1 DESC;
c1
4294967295
2147483650
2147483649
SELECT * FROM t1 WHERE c1 >= 2147483648 ORDER BY c1 DESC;
c1
4294967295
2147483650
2147483649
2147483648
2147483648
SELECT * FROM t1 WHERE c1 <  2147483648 ORDER BY c1 DESC;
c1
2147483647
2147483646
0
0
0
0
0
SELECT * FROM t1 WHERE c1 >= 2147483648 ORDER BY c1 DESC;
c1
4294967295
2147483650
2147483649
2147483648
2147483648
SELECT * FROM t1 WHERE c1 =  2147483648 ORDER BY c1 DESC;
c1
2147483648
2147483648
UPDATE t1
SET c1 = 2147483648
WHERE c1 <= 0 + 0 AND c1 >= 0 - 0
LIMIT 2;
SELECT * FROM t1 ORDER BY c1;
c1
0
0
0
2147483646
2147483647
2147483648
2147483648
2147483648
2147483648
2147483649
2147483650
4294967295
DELETE FROM t1
WHERE c1 <= 0 + 0 AND c1 >= 0 - 0
ORDER BY c1;
SELECT * FROM t1 ORDER BY c1;
c1
2147483646
2147483647
2147483648
2147483648
2147483648
2147483648
2147483649
2147483650
4294967295
DROP TABLE t1;
DROP TABLE IF EXISTS t1;
CREATE TABLE t1(c1 INT UNSIGNED )
ENGINE=cloud;
INSERT INTO t1 VALUES
(0),
(0),
(2147483648),
(4294967295),
(NULL),
(NULL);
SELECT * FROM t1 WHERE c1 IS     NULL ORDER BY c1 ASC;
c1
NULL
NULL
SELECT * FROM t1 WHERE c1 IS NOT NULL ORDER BY c1 DESC;
c1
4294967295
2147483648
0
0
SELECT * FROM t1 WHERE c1 IS     NULL ORDER BY c1 ASC;
c1
NULL
NULL
SELECT * FROM t1 WHERE c1 IS NOT NULL ORDER BY c1 DESC;
c1
4294967295
2147483648
0
0
UPDATE t1
SET c1 = 0
WHERE c1 IS NULL;
SELECT * FROM t1 ORDER BY c1;
c1
0
0
0
0
2147483648
4294967295
UPDATE t1
SET c1 = 0
WHERE c1 IS NULL;
SELECT * FROM t1 ORDER BY c1;
c1
0
0
0
0
2147483648
4294967295
DELETE FROM t1
WHERE c1 IS NULL
ORDER BY c1;
SELECT * FROM t1 ORDER BY c1;
c1
0
0
0
0
2147483648
4294967295
DROP TABLE t1;
DROP TABLE IF EXISTS t1;
CREATE TABLE t1(c1 INT UNSIGNED  , INDEX(c1))
ENGINE=cloud;
INSERT INTO t1 VALUES
(0),
(0),
(0),
(0),
(0),
(2147483648 - 2),
(2147483648 - 1),
(2147483648),
(2147483648),
(2147483648 + 1),
(2147483648 + 2),
(4294967295);
SELECT * FROM t1 ORDER BY c1 ASC;
c1
0
0
0
0
0
2147483646
2147483647
2147483648
2147483648
2147483649
2147483650
4294967295
SELECT * FROM t1 ORDER BY c1 DESC;
c1
4294967295
2147483650
2147483649
2147483648
2147483648
2147483647
2147483646
0
0
0
0
0
SELECT * FROM t1 WHERE c1 >  2147483648 ORDER BY c1 ASC;
c1
2147483649
2147483650
4294967295
SELECT * FROM t1 WHERE c1 >= 2147483648 ORDER BY c1 ASC;
c1
2147483648
2147483648
2147483649
2147483650
4294967295
SELECT * FROM t1 WHERE c1 <  2147483648 ORDER BY c1 ASC;
c1
0
0
0
0
0
2147483646
2147483647
SELECT * FROM t1 WHERE c1 >= 2147483648 ORDER BY c1 ASC;
c1
2147483648
2147483648
2147483649
2147483650
4294967295
SELECT * FROM t1 WHERE c1 =  2147483648 ORDER BY c1 ASC;
c1
2147483648
2147483648
SELECT * FROM t1 WHERE c1 >  2147483648 ORDER BY c1 DESC;
c1
4294967295
2147483650
2147483649
SELECT * FROM t1 WHERE c1 >= 2147483648 ORDER BY c1 DESC;
c1
4294967295
2147483650
2147483649
2147483648
2147483648
SELECT * FROM t1 WHERE c1 <  2147483648 ORDER BY c1 DESC;
c1
2147483647
2147483646
0
0
0
0
0
SELECT * FROM t1 WHERE c1 >= 2147483648 ORDER BY c1 DESC;
c1
4294967295
2147483650
2147483649
2147483648
2147483648
SELECT * FROM t1 WHERE c1 =  2147483648 ORDER BY c1 DESC;
c1
2147483648
2147483648
UPDATE t1
SET c1 = 2147483648
WHERE c1 <= 0 + 0 AND c1 >= 0 - 0
LIMIT 2;
SELECT * FROM t1 ORDER BY c1;
c1
0
0
0
2147483646
2147483647
2147483648
2147483648
2147483648
2147483648
2147483649
2147483650
4294967295
DELETE FROM t1
WHERE c1 <= 0 + 0 AND c1 >= 0 - 0
ORDER BY c1;
SELECT * FROM t1 ORDER BY c1;
c1
2147483646
2147483647
2147483648
2147483648
2147483648
2147483648
2147483649
2147483650
4294967295
DROP TABLE t1;
