DROP TABLE IF EXISTS t1;
CREATE TABLE t1(c1 MEDIUMINT SIGNED NOT NULL )
ENGINE=cloud;
INSERT INTO t1 VALUES
(-8388608),
(0),
(0),
(0),
(0),
(4194304 - 2),
(4194304 - 1),
(4194304),
(4194304),
(4194304 + 1),
(4194304 + 2),
(8388607);
SELECT * FROM t1 ORDER BY c1 ASC;
c1
-8388608
0
0
0
0
4194302
4194303
4194304
4194304
4194305
4194306
8388607
SELECT * FROM t1 ORDER BY c1 DESC;
c1
8388607
4194306
4194305
4194304
4194304
4194303
4194302
0
0
0
0
-8388608
SELECT * FROM t1 WHERE c1 >  4194304 ORDER BY c1 ASC;
c1
4194305
4194306
8388607
SELECT * FROM t1 WHERE c1 >= 4194304 ORDER BY c1 ASC;
c1
4194304
4194304
4194305
4194306
8388607
SELECT * FROM t1 WHERE c1 <  4194304 ORDER BY c1 ASC;
c1
-8388608
0
0
0
0
4194302
4194303
SELECT * FROM t1 WHERE c1 <= 4194304 ORDER BY c1 ASC;
c1
-8388608
0
0
0
0
4194302
4194303
4194304
4194304
SELECT * FROM t1 WHERE c1 =  4194304 ORDER BY c1 ASC;
c1
4194304
4194304
SELECT * FROM t1 WHERE c1 >  4194304 ORDER BY c1 DESC;
c1
8388607
4194306
4194305
SELECT * FROM t1 WHERE c1 >= 4194304 ORDER BY c1 DESC;
c1
8388607
4194306
4194305
4194304
4194304
SELECT * FROM t1 WHERE c1 <  4194304 ORDER BY c1 DESC;
c1
4194303
4194302
0
0
0
0
-8388608
SELECT * FROM t1 WHERE c1 <= 4194304 ORDER BY c1 DESC;
c1
4194304
4194304
4194303
4194302
0
0
0
0
-8388608
SELECT * FROM t1 WHERE c1 =  4194304 ORDER BY c1 DESC;
c1
4194304
4194304
UPDATE t1
SET c1 = 4194304
WHERE c1 <= 0 + 0 AND c1 >= 0 - 0
ORDER BY c1 ASC
LIMIT 2;
SELECT * FROM t1 ORDER BY c1;
c1
-8388608
0
0
4194302
4194303
4194304
4194304
4194304
4194304
4194305
4194306
8388607
DELETE FROM t1
WHERE c1 <= 0 + 0 AND c1 >= 0 - 0
ORDER BY c1;
SELECT * FROM t1 ORDER BY c1;
c1
-8388608
4194302
4194303
4194304
4194304
4194304
4194304
4194305
4194306
8388607
DROP TABLE t1;
CREATE TABLE t1(c1 MEDIUMINT SIGNED NOT NULL, c2 MEDIUMINT SIGNED NOT NULL )
engine = cloud;
INSERT INTO t1 VALUES
(-8388608, -8388608),
(0, 0),
(0, 0),
(0, 0),
(0, 0),
(4194304, 4194304 - 2),
(4194304, 4194304 - 1),
(4194304, 4194304),
(4194304, 4194304),
(4194304, 4194304 + 1),
(4194304, 4194304 + 2),
(8388607, 8388607);
SELECT * FROM t1 WHERE c1 = 4194304 AND c2 > 4194304 ORDER BY c2 ASC;
c1	c2
4194304	4194305
4194304	4194306
SELECT * FROM t1 WHERE c1 = 4194304 AND c2 >= 4194304 ORDER BY c2 ASC;
c1	c2
4194304	4194304
4194304	4194304
4194304	4194305
4194304	4194306
SELECT * FROM t1 WHERE c1 = 4194304 AND c2 < 4194304 ORDER BY c2 ASC;
c1	c2
4194304	4194302
4194304	4194303
SELECT * FROM t1 WHERE c1 = 4194304 AND c2 <= 4194304 ORDER BY c2 ASC;
c1	c2
4194304	4194302
4194304	4194303
4194304	4194304
4194304	4194304
SELECT * FROM t1 WHERE c1 = 4194304 AND c2 > 4194304 ORDER BY c2 DESC;
c1	c2
4194304	4194306
4194304	4194305
SELECT * FROM t1 WHERE c1 = 4194304 AND c2 >= 4194304 ORDER BY c2 DESC;
c1	c2
4194304	4194306
4194304	4194305
4194304	4194304
4194304	4194304
SELECT * FROM t1 WHERE c1 = 4194304 AND c2 < 4194304 ORDER BY c2 DESC;
c1	c2
4194304	4194303
4194304	4194302
SELECT * FROM t1 WHERE c1 = 4194304 AND c2 <= 4194304 ORDER BY c2 DESC;
c1	c2
4194304	4194304
4194304	4194304
4194304	4194303
4194304	4194302
DROP TABLE t1;
DROP TABLE IF EXISTS t1;
CREATE TABLE t1(c1 MEDIUMINT SIGNED NULL)
ENGINE=cloud;
INSERT INTO t1 VALUES
(-8388608),
(0),
(4194304),
(8388607),
(NULL),
(NULL),
(NULL),
(NULL);
SELECT * FROM t1 WHERE c1 IS     NULL ORDER BY c1 ASC;
c1
NULL
NULL
NULL
NULL
SELECT * FROM t1 WHERE c1 IS NOT NULL ORDER BY c1 DESC;
c1
8388607
4194304
0
-8388608
SELECT * FROM t1 WHERE c1 IS     NULL ORDER BY c1 ASC;
c1
NULL
NULL
NULL
NULL
SELECT * FROM t1 WHERE c1 IS NOT NULL ORDER BY c1 DESC;
c1
8388607
4194304
0
-8388608
UPDATE t1
SET c1 = 0
WHERE c1 IS NULL;
SELECT * FROM t1 ORDER BY c1;
c1
-8388608
0
0
0
0
0
4194304
8388607
UPDATE t1
SET c1 = 0
WHERE c1 IS NULL
LIMIT 2;
SELECT * FROM t1 ORDER BY c1;
c1
-8388608
0
0
0
0
0
4194304
8388607
DELETE FROM t1
WHERE c1 IS NULL
ORDER BY c1;
SELECT * FROM t1 ORDER BY c1;
c1
-8388608
0
0
0
0
0
4194304
8388607
DROP TABLE t1;
CREATE TABLE t1(c1 MEDIUMINT SIGNED NULL, c2 MEDIUMINT SIGNED NULL )
engine = cloud;
INSERT INTO t1 VALUES
(-8388608, -8388608),
(0, 0),
(0, 0),
(0, 0),
(0, 0),
(4194304, 4194304 - 2),
(4194304, 4194304 - 1),
(4194304, 4194304),
(4194304, 4194304),
(4194304, 4194304 + 1),
(4194304, 4194304 + 2),
(4194304, NULL),
(4194304, NULL),
(8388607, 8388607);
SELECT * FROM t1 WHERE c1 = 4194304 AND c2 > 4194304 ORDER BY c2 ASC;
c1	c2
4194304	4194305
4194304	4194306
SELECT * FROM t1 WHERE c1 = 4194304 AND c2 >= 4194304 ORDER BY c2 ASC;
c1	c2
4194304	4194304
4194304	4194304
4194304	4194305
4194304	4194306
SELECT * FROM t1 WHERE c1 = 4194304 AND c2 < 4194304 ORDER BY c2 ASC;
c1	c2
4194304	4194302
4194304	4194303
SELECT * FROM t1 WHERE c1 = 4194304 AND c2 <= 4194304 ORDER BY c2 ASC;
c1	c2
4194304	4194302
4194304	4194303
4194304	4194304
4194304	4194304
SELECT * FROM t1 WHERE c1 = 4194304 AND c2 is null ORDER BY c1 ASC;
c1	c2
4194304	NULL
4194304	NULL
SELECT * FROM t1 WHERE c1 = 4194304 AND c2 is not null ORDER BY c2 ASC;
c1	c2
4194304	4194302
4194304	4194303
4194304	4194304
4194304	4194304
4194304	4194305
4194304	4194306
SELECT * FROM t1 WHERE c1 = 4194304 AND c2 > 4194304 ORDER BY c2 DESC;
c1	c2
4194304	4194306
4194304	4194305
SELECT * FROM t1 WHERE c1 = 4194304 AND c2 >= 4194304 ORDER BY c2 DESC;
c1	c2
4194304	4194306
4194304	4194305
4194304	4194304
4194304	4194304
SELECT * FROM t1 WHERE c1 = 4194304 AND c2 < 4194304 ORDER BY c2 DESC;
c1	c2
4194304	4194303
4194304	4194302
SELECT * FROM t1 WHERE c1 = 4194304 AND c2 <= 4194304 ORDER BY c2 DESC;
c1	c2
4194304	4194304
4194304	4194304
4194304	4194303
4194304	4194302
SELECT * FROM t1 WHERE c1 = 4194304 AND c2 is null ORDER BY c1 DESC;
c1	c2
4194304	NULL
4194304	NULL
SELECT * FROM t1 WHERE c1 = 4194304 AND c2 is not null ORDER BY c2 DESC;
c1	c2
4194304	4194306
4194304	4194305
4194304	4194304
4194304	4194304
4194304	4194303
4194304	4194302
DROP TABLE t1;
DROP TABLE IF EXISTS t1;
CREATE TABLE t1(c1 MEDIUMINT SIGNED NULL )
ENGINE=cloud;
INSERT INTO t1 VALUES
(-8388608),
(0),
(0),
(0),
(0),
(4194304 - 2),
(4194304 - 1),
(4194304),
(4194304),
(4194304 + 1),
(4194304 + 2),
(8388607);
SELECT * FROM t1 ORDER BY c1 ASC;
c1
-8388608
0
0
0
0
4194302
4194303
4194304
4194304
4194305
4194306
8388607
SELECT * FROM t1 ORDER BY c1 DESC;
c1
8388607
4194306
4194305
4194304
4194304
4194303
4194302
0
0
0
0
-8388608
SELECT * FROM t1 WHERE c1 >  4194304 ORDER BY c1 ASC;
c1
4194305
4194306
8388607
SELECT * FROM t1 WHERE c1 >= 4194304 ORDER BY c1 ASC;
c1
4194304
4194304
4194305
4194306
8388607
SELECT * FROM t1 WHERE c1 <  4194304 ORDER BY c1 ASC;
c1
-8388608
0
0
0
0
4194302
4194303
SELECT * FROM t1 WHERE c1 <= 4194304 ORDER BY c1 ASC;
c1
-8388608
0
0
0
0
4194302
4194303
4194304
4194304
SELECT * FROM t1 WHERE c1 =  4194304 ORDER BY c1 ASC;
c1
4194304
4194304
SELECT * FROM t1 WHERE c1 >  4194304 ORDER BY c1 DESC;
c1
8388607
4194306
4194305
SELECT * FROM t1 WHERE c1 >= 4194304 ORDER BY c1 DESC;
c1
8388607
4194306
4194305
4194304
4194304
SELECT * FROM t1 WHERE c1 <  4194304 ORDER BY c1 DESC;
c1
4194303
4194302
0
0
0
0
-8388608
SELECT * FROM t1 WHERE c1 <= 4194304 ORDER BY c1 DESC;
c1
4194304
4194304
4194303
4194302
0
0
0
0
-8388608
SELECT * FROM t1 WHERE c1 =  4194304 ORDER BY c1 DESC;
c1
4194304
4194304
UPDATE t1
SET c1 = 4194304
WHERE c1 <= 0 + 0 AND c1 >= 0 - 0
ORDER BY c1 ASC
LIMIT 2;
SELECT * FROM t1 ORDER BY c1;
c1
-8388608
0
0
4194302
4194303
4194304
4194304
4194304
4194304
4194305
4194306
8388607
DELETE FROM t1
WHERE c1 <= 0 + 0 AND c1 >= 0 - 0
ORDER BY c1;
SELECT * FROM t1 ORDER BY c1;
c1
-8388608
4194302
4194303
4194304
4194304
4194304
4194304
4194305
4194306
8388607
DROP TABLE t1;
CREATE TABLE t1(c1 MEDIUMINT SIGNED NULL, c2 MEDIUMINT SIGNED NULL )
engine = cloud;
INSERT INTO t1 VALUES
(-8388608, -8388608),
(0, 0),
(0, 0),
(0, 0),
(0, 0),
(4194304, 4194304 - 2),
(4194304, 4194304 - 1),
(4194304, 4194304),
(4194304, 4194304),
(4194304, 4194304 + 1),
(4194304, 4194304 + 2),
(8388607, 8388607);
SELECT * FROM t1 WHERE c1 = 4194304 AND c2 > 4194304 ORDER BY c2 ASC;
c1	c2
4194304	4194305
4194304	4194306
SELECT * FROM t1 WHERE c1 = 4194304 AND c2 >= 4194304 ORDER BY c2 ASC;
c1	c2
4194304	4194304
4194304	4194304
4194304	4194305
4194304	4194306
SELECT * FROM t1 WHERE c1 = 4194304 AND c2 < 4194304 ORDER BY c2 ASC;
c1	c2
4194304	4194302
4194304	4194303
SELECT * FROM t1 WHERE c1 = 4194304 AND c2 <= 4194304 ORDER BY c2 ASC;
c1	c2
4194304	4194302
4194304	4194303
4194304	4194304
4194304	4194304
SELECT * FROM t1 WHERE c1 = 4194304 AND c2 > 4194304 ORDER BY c2 DESC;
c1	c2
4194304	4194306
4194304	4194305
SELECT * FROM t1 WHERE c1 = 4194304 AND c2 >= 4194304 ORDER BY c2 DESC;
c1	c2
4194304	4194306
4194304	4194305
4194304	4194304
4194304	4194304
SELECT * FROM t1 WHERE c1 = 4194304 AND c2 < 4194304 ORDER BY c2 DESC;
c1	c2
4194304	4194303
4194304	4194302
SELECT * FROM t1 WHERE c1 = 4194304 AND c2 <= 4194304 ORDER BY c2 DESC;
c1	c2
4194304	4194304
4194304	4194304
4194304	4194303
4194304	4194302
DROP TABLE t1;
DROP TABLE IF EXISTS t1;
CREATE TABLE t1(c1 MEDIUMINT SIGNED NOT NULL , INDEX(c1))
ENGINE=cloud;
INSERT INTO t1 VALUES
(-8388608),
(0),
(0),
(0),
(0),
(4194304 - 2),
(4194304 - 1),
(4194304),
(4194304),
(4194304 + 1),
(4194304 + 2),
(8388607);
SELECT * FROM t1 ORDER BY c1 ASC;
c1
-8388608
0
0
0
0
4194302
4194303
4194304
4194304
4194305
4194306
8388607
SELECT * FROM t1 ORDER BY c1 DESC;
c1
8388607
4194306
4194305
4194304
4194304
4194303
4194302
0
0
0
0
-8388608
SELECT * FROM t1 WHERE c1 >  4194304 ORDER BY c1 ASC;
c1
4194305
4194306
8388607
SELECT * FROM t1 WHERE c1 >= 4194304 ORDER BY c1 ASC;
c1
4194304
4194304
4194305
4194306
8388607
SELECT * FROM t1 WHERE c1 <  4194304 ORDER BY c1 ASC;
c1
-8388608
0
0
0
0
4194302
4194303
SELECT * FROM t1 WHERE c1 <= 4194304 ORDER BY c1 ASC;
c1
-8388608
0
0
0
0
4194302
4194303
4194304
4194304
SELECT * FROM t1 WHERE c1 =  4194304 ORDER BY c1 ASC;
c1
4194304
4194304
SELECT * FROM t1 WHERE c1 >  4194304 ORDER BY c1 DESC;
c1
8388607
4194306
4194305
SELECT * FROM t1 WHERE c1 >= 4194304 ORDER BY c1 DESC;
c1
8388607
4194306
4194305
4194304
4194304
SELECT * FROM t1 WHERE c1 <  4194304 ORDER BY c1 DESC;
c1
4194303
4194302
0
0
0
0
-8388608
SELECT * FROM t1 WHERE c1 <= 4194304 ORDER BY c1 DESC;
c1
4194304
4194304
4194303
4194302
0
0
0
0
-8388608
SELECT * FROM t1 WHERE c1 =  4194304 ORDER BY c1 DESC;
c1
4194304
4194304
UPDATE t1
SET c1 = 4194304
WHERE c1 <= 0 + 0 AND c1 >= 0 - 0
ORDER BY c1 ASC
LIMIT 2;
SELECT * FROM t1 ORDER BY c1;
c1
-8388608
0
0
4194302
4194303
4194304
4194304
4194304
4194304
4194305
4194306
8388607
DELETE FROM t1
WHERE c1 <= 0 + 0 AND c1 >= 0 - 0
ORDER BY c1;
SELECT * FROM t1 ORDER BY c1;
c1
-8388608
4194302
4194303
4194304
4194304
4194304
4194304
4194305
4194306
8388607
DROP TABLE t1;
CREATE TABLE t1(c1 MEDIUMINT SIGNED NOT NULL, c2 MEDIUMINT SIGNED NOT NULL , INDEX(c1, c2))
engine = cloud;
INSERT INTO t1 VALUES
(-8388608, -8388608),
(0, 0),
(0, 0),
(0, 0),
(0, 0),
(4194304, 4194304 - 2),
(4194304, 4194304 - 1),
(4194304, 4194304),
(4194304, 4194304),
(4194304, 4194304 + 1),
(4194304, 4194304 + 2),
(8388607, 8388607);
SELECT * FROM t1 WHERE c1 = 4194304 AND c2 > 4194304 ORDER BY c2 ASC;
c1	c2
4194304	4194305
4194304	4194306
SELECT * FROM t1 WHERE c1 = 4194304 AND c2 >= 4194304 ORDER BY c2 ASC;
c1	c2
4194304	4194304
4194304	4194304
4194304	4194305
4194304	4194306
SELECT * FROM t1 WHERE c1 = 4194304 AND c2 < 4194304 ORDER BY c2 ASC;
c1	c2
4194304	4194302
4194304	4194303
SELECT * FROM t1 WHERE c1 = 4194304 AND c2 <= 4194304 ORDER BY c2 ASC;
c1	c2
4194304	4194302
4194304	4194303
4194304	4194304
4194304	4194304
SELECT * FROM t1 WHERE c1 = 4194304 AND c2 > 4194304 ORDER BY c2 DESC;
c1	c2
4194304	4194306
4194304	4194305
SELECT * FROM t1 WHERE c1 = 4194304 AND c2 >= 4194304 ORDER BY c2 DESC;
c1	c2
4194304	4194306
4194304	4194305
4194304	4194304
4194304	4194304
SELECT * FROM t1 WHERE c1 = 4194304 AND c2 < 4194304 ORDER BY c2 DESC;
c1	c2
4194304	4194303
4194304	4194302
SELECT * FROM t1 WHERE c1 = 4194304 AND c2 <= 4194304 ORDER BY c2 DESC;
c1	c2
4194304	4194304
4194304	4194304
4194304	4194303
4194304	4194302
DROP TABLE t1;
DROP TABLE IF EXISTS t1;
CREATE TABLE t1(c1 MEDIUMINT SIGNED NULL)
ENGINE=cloud;
INSERT INTO t1 VALUES
(-8388608),
(0),
(4194304),
(8388607),
(NULL),
(NULL),
(NULL),
(NULL);
SELECT * FROM t1 WHERE c1 IS     NULL ORDER BY c1 ASC;
c1
NULL
NULL
NULL
NULL
SELECT * FROM t1 WHERE c1 IS NOT NULL ORDER BY c1 DESC;
c1
8388607
4194304
0
-8388608
SELECT * FROM t1 WHERE c1 IS     NULL ORDER BY c1 ASC;
c1
NULL
NULL
NULL
NULL
SELECT * FROM t1 WHERE c1 IS NOT NULL ORDER BY c1 DESC;
c1
8388607
4194304
0
-8388608
UPDATE t1
SET c1 = 0
WHERE c1 IS NULL;
SELECT * FROM t1 ORDER BY c1;
c1
-8388608
0
0
0
0
0
4194304
8388607
UPDATE t1
SET c1 = 0
WHERE c1 IS NULL
LIMIT 2;
SELECT * FROM t1 ORDER BY c1;
c1
-8388608
0
0
0
0
0
4194304
8388607
DELETE FROM t1
WHERE c1 IS NULL
ORDER BY c1;
SELECT * FROM t1 ORDER BY c1;
c1
-8388608
0
0
0
0
0
4194304
8388607
DROP TABLE t1;
CREATE TABLE t1(c1 MEDIUMINT SIGNED NULL, c2 MEDIUMINT SIGNED NULL , INDEX(c1, c2))
engine = cloud;
INSERT INTO t1 VALUES
(-8388608, -8388608),
(0, 0),
(0, 0),
(0, 0),
(0, 0),
(4194304, 4194304 - 2),
(4194304, 4194304 - 1),
(4194304, 4194304),
(4194304, 4194304),
(4194304, 4194304 + 1),
(4194304, 4194304 + 2),
(4194304, NULL),
(4194304, NULL),
(8388607, 8388607);
SELECT * FROM t1 WHERE c1 = 4194304 AND c2 > 4194304 ORDER BY c2 ASC;
c1	c2
4194304	4194305
4194304	4194306
SELECT * FROM t1 WHERE c1 = 4194304 AND c2 >= 4194304 ORDER BY c2 ASC;
c1	c2
4194304	4194304
4194304	4194304
4194304	4194305
4194304	4194306
SELECT * FROM t1 WHERE c1 = 4194304 AND c2 < 4194304 ORDER BY c2 ASC;
c1	c2
4194304	4194302
4194304	4194303
SELECT * FROM t1 WHERE c1 = 4194304 AND c2 <= 4194304 ORDER BY c2 ASC;
c1	c2
4194304	4194302
4194304	4194303
4194304	4194304
4194304	4194304
SELECT * FROM t1 WHERE c1 = 4194304 AND c2 is null ORDER BY c1 ASC;
c1	c2
4194304	NULL
4194304	NULL
SELECT * FROM t1 WHERE c1 = 4194304 AND c2 is not null ORDER BY c2 ASC;
c1	c2
4194304	4194302
4194304	4194303
4194304	4194304
4194304	4194304
4194304	4194305
4194304	4194306
SELECT * FROM t1 WHERE c1 = 4194304 AND c2 > 4194304 ORDER BY c2 DESC;
c1	c2
4194304	4194306
4194304	4194305
SELECT * FROM t1 WHERE c1 = 4194304 AND c2 >= 4194304 ORDER BY c2 DESC;
c1	c2
4194304	4194306
4194304	4194305
4194304	4194304
4194304	4194304
SELECT * FROM t1 WHERE c1 = 4194304 AND c2 < 4194304 ORDER BY c2 DESC;
c1	c2
4194304	4194303
4194304	4194302
SELECT * FROM t1 WHERE c1 = 4194304 AND c2 <= 4194304 ORDER BY c2 DESC;
c1	c2
4194304	4194304
4194304	4194304
4194304	4194303
4194304	4194302
SELECT * FROM t1 WHERE c1 = 4194304 AND c2 is null ORDER BY c1 DESC;
c1	c2
4194304	NULL
4194304	NULL
SELECT * FROM t1 WHERE c1 = 4194304 AND c2 is not null ORDER BY c2 DESC;
c1	c2
4194304	4194306
4194304	4194305
4194304	4194304
4194304	4194304
4194304	4194303
4194304	4194302
DROP TABLE t1;
DROP TABLE IF EXISTS t1;
CREATE TABLE t1(c1 MEDIUMINT SIGNED NULL , INDEX(c1))
ENGINE=cloud;
INSERT INTO t1 VALUES
(-8388608),
(0),
(0),
(0),
(0),
(4194304 - 2),
(4194304 - 1),
(4194304),
(4194304),
(4194304 + 1),
(4194304 + 2),
(8388607);
SELECT * FROM t1 ORDER BY c1 ASC;
c1
-8388608
0
0
0
0
4194302
4194303
4194304
4194304
4194305
4194306
8388607
SELECT * FROM t1 ORDER BY c1 DESC;
c1
8388607
4194306
4194305
4194304
4194304
4194303
4194302
0
0
0
0
-8388608
SELECT * FROM t1 WHERE c1 >  4194304 ORDER BY c1 ASC;
c1
4194305
4194306
8388607
SELECT * FROM t1 WHERE c1 >= 4194304 ORDER BY c1 ASC;
c1
4194304
4194304
4194305
4194306
8388607
SELECT * FROM t1 WHERE c1 <  4194304 ORDER BY c1 ASC;
c1
-8388608
0
0
0
0
4194302
4194303
SELECT * FROM t1 WHERE c1 <= 4194304 ORDER BY c1 ASC;
c1
-8388608
0
0
0
0
4194302
4194303
4194304
4194304
SELECT * FROM t1 WHERE c1 =  4194304 ORDER BY c1 ASC;
c1
4194304
4194304
SELECT * FROM t1 WHERE c1 >  4194304 ORDER BY c1 DESC;
c1
8388607
4194306
4194305
SELECT * FROM t1 WHERE c1 >= 4194304 ORDER BY c1 DESC;
c1
8388607
4194306
4194305
4194304
4194304
SELECT * FROM t1 WHERE c1 <  4194304 ORDER BY c1 DESC;
c1
4194303
4194302
0
0
0
0
-8388608
SELECT * FROM t1 WHERE c1 <= 4194304 ORDER BY c1 DESC;
c1
4194304
4194304
4194303
4194302
0
0
0
0
-8388608
SELECT * FROM t1 WHERE c1 =  4194304 ORDER BY c1 DESC;
c1
4194304
4194304
UPDATE t1
SET c1 = 4194304
WHERE c1 <= 0 + 0 AND c1 >= 0 - 0
ORDER BY c1 ASC
LIMIT 2;
SELECT * FROM t1 ORDER BY c1;
c1
-8388608
0
0
4194302
4194303
4194304
4194304
4194304
4194304
4194305
4194306
8388607
DELETE FROM t1
WHERE c1 <= 0 + 0 AND c1 >= 0 - 0
ORDER BY c1;
SELECT * FROM t1 ORDER BY c1;
c1
-8388608
4194302
4194303
4194304
4194304
4194304
4194304
4194305
4194306
8388607
DROP TABLE t1;
CREATE TABLE t1(c1 MEDIUMINT SIGNED NULL, c2 MEDIUMINT SIGNED NULL , INDEX(c1, c2))
engine = cloud;
INSERT INTO t1 VALUES
(-8388608, -8388608),
(0, 0),
(0, 0),
(0, 0),
(0, 0),
(4194304, 4194304 - 2),
(4194304, 4194304 - 1),
(4194304, 4194304),
(4194304, 4194304),
(4194304, 4194304 + 1),
(4194304, 4194304 + 2),
(8388607, 8388607);
SELECT * FROM t1 WHERE c1 = 4194304 AND c2 > 4194304 ORDER BY c2 ASC;
c1	c2
4194304	4194305
4194304	4194306
SELECT * FROM t1 WHERE c1 = 4194304 AND c2 >= 4194304 ORDER BY c2 ASC;
c1	c2
4194304	4194304
4194304	4194304
4194304	4194305
4194304	4194306
SELECT * FROM t1 WHERE c1 = 4194304 AND c2 < 4194304 ORDER BY c2 ASC;
c1	c2
4194304	4194302
4194304	4194303
SELECT * FROM t1 WHERE c1 = 4194304 AND c2 <= 4194304 ORDER BY c2 ASC;
c1	c2
4194304	4194302
4194304	4194303
4194304	4194304
4194304	4194304
SELECT * FROM t1 WHERE c1 = 4194304 AND c2 > 4194304 ORDER BY c2 DESC;
c1	c2
4194304	4194306
4194304	4194305
SELECT * FROM t1 WHERE c1 = 4194304 AND c2 >= 4194304 ORDER BY c2 DESC;
c1	c2
4194304	4194306
4194304	4194305
4194304	4194304
4194304	4194304
SELECT * FROM t1 WHERE c1 = 4194304 AND c2 < 4194304 ORDER BY c2 DESC;
c1	c2
4194304	4194303
4194304	4194302
SELECT * FROM t1 WHERE c1 = 4194304 AND c2 <= 4194304 ORDER BY c2 DESC;
c1	c2
4194304	4194304
4194304	4194304
4194304	4194303
4194304	4194302
DROP TABLE t1;
DROP TABLE IF EXISTS t1;
CREATE TABLE t1(c1 MEDIUMINT UNSIGNED NOT NULL )
ENGINE=cloud;
INSERT INTO t1 VALUES
(0),
(0),
(0),
(0),
(0),
(8388608 - 2),
(8388608 - 1),
(8388608),
(8388608),
(8388608 + 1),
(8388608 + 2),
(16777215);
SELECT * FROM t1 ORDER BY c1 ASC;
c1
0
0
0
0
0
8388606
8388607
8388608
8388608
8388609
8388610
16777215
SELECT * FROM t1 ORDER BY c1 DESC;
c1
16777215
8388610
8388609
8388608
8388608
8388607
8388606
0
0
0
0
0
SELECT * FROM t1 WHERE c1 >  8388608 ORDER BY c1 ASC;
c1
8388609
8388610
16777215
SELECT * FROM t1 WHERE c1 >= 8388608 ORDER BY c1 ASC;
c1
8388608
8388608
8388609
8388610
16777215
SELECT * FROM t1 WHERE c1 <  8388608 ORDER BY c1 ASC;
c1
0
0
0
0
0
8388606
8388607
SELECT * FROM t1 WHERE c1 <= 8388608 ORDER BY c1 ASC;
c1
0
0
0
0
0
8388606
8388607
8388608
8388608
SELECT * FROM t1 WHERE c1 =  8388608 ORDER BY c1 ASC;
c1
8388608
8388608
SELECT * FROM t1 WHERE c1 >  8388608 ORDER BY c1 DESC;
c1
16777215
8388610
8388609
SELECT * FROM t1 WHERE c1 >= 8388608 ORDER BY c1 DESC;
c1
16777215
8388610
8388609
8388608
8388608
SELECT * FROM t1 WHERE c1 <  8388608 ORDER BY c1 DESC;
c1
8388607
8388606
0
0
0
0
0
SELECT * FROM t1 WHERE c1 <= 8388608 ORDER BY c1 DESC;
c1
8388608
8388608
8388607
8388606
0
0
0
0
0
SELECT * FROM t1 WHERE c1 =  8388608 ORDER BY c1 DESC;
c1
8388608
8388608
UPDATE t1
SET c1 = 8388608
WHERE c1 <= 0 + 0 AND c1 >= 0 - 0
ORDER BY c1 ASC
LIMIT 2;
SELECT * FROM t1 ORDER BY c1;
c1
0
0
0
8388606
8388607
8388608
8388608
8388608
8388608
8388609
8388610
16777215
DELETE FROM t1
WHERE c1 <= 0 + 0 AND c1 >= 0 - 0
ORDER BY c1;
SELECT * FROM t1 ORDER BY c1;
c1
8388606
8388607
8388608
8388608
8388608
8388608
8388609
8388610
16777215
DROP TABLE t1;
CREATE TABLE t1(c1 MEDIUMINT UNSIGNED NOT NULL, c2 MEDIUMINT UNSIGNED NOT NULL , INDEX(c1, c2))
engine = cloud;
INSERT INTO t1 VALUES
(0, 0),
(0, 0),
(0, 0),
(0, 0),
(0, 0),
(8388608, 8388608 - 2),
(8388608, 8388608 - 1),
(8388608, 8388608),
(8388608, 8388608),
(8388608, 8388608 + 1),
(8388608, 8388608 + 2),
(16777215, 16777215);
SELECT * FROM t1 WHERE c1 = 8388608 AND c2 > 8388608 ORDER BY c2 ASC;
c1	c2
8388608	8388609
8388608	8388610
SELECT * FROM t1 WHERE c1 = 8388608 AND c2 >= 8388608 ORDER BY c2 ASC;
c1	c2
8388608	8388608
8388608	8388608
8388608	8388609
8388608	8388610
SELECT * FROM t1 WHERE c1 = 8388608 AND c2 < 8388608 ORDER BY c2 ASC;
c1	c2
8388608	8388606
8388608	8388607
SELECT * FROM t1 WHERE c1 = 8388608 AND c2 <= 8388608 ORDER BY c2 ASC;
c1	c2
8388608	8388606
8388608	8388607
8388608	8388608
8388608	8388608
SELECT * FROM t1 WHERE c1 = 8388608 AND c2 > 8388608 ORDER BY c2 DESC;
c1	c2
8388608	8388610
8388608	8388609
SELECT * FROM t1 WHERE c1 = 8388608 AND c2 >= 8388608 ORDER BY c2 DESC;
c1	c2
8388608	8388610
8388608	8388609
8388608	8388608
8388608	8388608
SELECT * FROM t1 WHERE c1 = 8388608 AND c2 < 8388608 ORDER BY c2 DESC;
c1	c2
8388608	8388607
8388608	8388606
SELECT * FROM t1 WHERE c1 = 8388608 AND c2 <= 8388608 ORDER BY c2 DESC;
c1	c2
8388608	8388608
8388608	8388608
8388608	8388607
8388608	8388606
DROP TABLE t1;
DROP TABLE IF EXISTS t1;
CREATE TABLE t1(c1 MEDIUMINT UNSIGNED NULL)
ENGINE=cloud;
INSERT INTO t1 VALUES
(0),
(0),
(8388608),
(16777215),
(NULL),
(NULL),
(NULL),
(NULL);
SELECT * FROM t1 WHERE c1 IS     NULL ORDER BY c1 ASC;
c1
NULL
NULL
NULL
NULL
SELECT * FROM t1 WHERE c1 IS NOT NULL ORDER BY c1 DESC;
c1
16777215
8388608
0
0
SELECT * FROM t1 WHERE c1 IS     NULL ORDER BY c1 ASC;
c1
NULL
NULL
NULL
NULL
SELECT * FROM t1 WHERE c1 IS NOT NULL ORDER BY c1 DESC;
c1
16777215
8388608
0
0
UPDATE t1
SET c1 = 0
WHERE c1 IS NULL;
SELECT * FROM t1 ORDER BY c1;
c1
0
0
0
0
0
0
8388608
16777215
UPDATE t1
SET c1 = 0
WHERE c1 IS NULL
LIMIT 2;
SELECT * FROM t1 ORDER BY c1;
c1
0
0
0
0
0
0
8388608
16777215
DELETE FROM t1
WHERE c1 IS NULL
ORDER BY c1;
SELECT * FROM t1 ORDER BY c1;
c1
0
0
0
0
0
0
8388608
16777215
DROP TABLE t1;
CREATE TABLE t1(c1 MEDIUMINT UNSIGNED NULL, c2 MEDIUMINT UNSIGNED NULL , INDEX(c1, c2))
engine = cloud;
INSERT INTO t1 VALUES
(0, 0),
(0, 0),
(0, 0),
(0, 0),
(0, 0),
(8388608, 8388608 - 2),
(8388608, 8388608 - 1),
(8388608, 8388608),
(8388608, 8388608),
(8388608, 8388608 + 1),
(8388608, 8388608 + 2),
(8388608, NULL),
(8388608, NULL),
(16777215, 16777215);
SELECT * FROM t1 WHERE c1 = 8388608 AND c2 > 8388608 ORDER BY c2 ASC;
c1	c2
8388608	8388609
8388608	8388610
SELECT * FROM t1 WHERE c1 = 8388608 AND c2 >= 8388608 ORDER BY c2 ASC;
c1	c2
8388608	8388608
8388608	8388608
8388608	8388609
8388608	8388610
SELECT * FROM t1 WHERE c1 = 8388608 AND c2 < 8388608 ORDER BY c2 ASC;
c1	c2
8388608	8388606
8388608	8388607
SELECT * FROM t1 WHERE c1 = 8388608 AND c2 <= 8388608 ORDER BY c2 ASC;
c1	c2
8388608	8388606
8388608	8388607
8388608	8388608
8388608	8388608
SELECT * FROM t1 WHERE c1 = 8388608 AND c2 is null ORDER BY c1 ASC;
c1	c2
8388608	NULL
8388608	NULL
SELECT * FROM t1 WHERE c1 = 8388608 AND c2 is not null ORDER BY c2 ASC;
c1	c2
8388608	8388606
8388608	8388607
8388608	8388608
8388608	8388608
8388608	8388609
8388608	8388610
SELECT * FROM t1 WHERE c1 = 8388608 AND c2 > 8388608 ORDER BY c2 DESC;
c1	c2
8388608	8388610
8388608	8388609
SELECT * FROM t1 WHERE c1 = 8388608 AND c2 >= 8388608 ORDER BY c2 DESC;
c1	c2
8388608	8388610
8388608	8388609
8388608	8388608
8388608	8388608
SELECT * FROM t1 WHERE c1 = 8388608 AND c2 < 8388608 ORDER BY c2 DESC;
c1	c2
8388608	8388607
8388608	8388606
SELECT * FROM t1 WHERE c1 = 8388608 AND c2 <= 8388608 ORDER BY c2 DESC;
c1	c2
8388608	8388608
8388608	8388608
8388608	8388607
8388608	8388606
SELECT * FROM t1 WHERE c1 = 8388608 AND c2 is null ORDER BY c1 DESC;
c1	c2
8388608	NULL
8388608	NULL
SELECT * FROM t1 WHERE c1 = 8388608 AND c2 is not null ORDER BY c2 DESC;
c1	c2
8388608	8388610
8388608	8388609
8388608	8388608
8388608	8388608
8388608	8388607
8388608	8388606
DROP TABLE t1;
DROP TABLE IF EXISTS t1;
CREATE TABLE t1(c1 MEDIUMINT UNSIGNED NULL )
ENGINE=cloud;
INSERT INTO t1 VALUES
(0),
(0),
(0),
(0),
(0),
(8388608 - 2),
(8388608 - 1),
(8388608),
(8388608),
(8388608 + 1),
(8388608 + 2),
(16777215);
SELECT * FROM t1 ORDER BY c1 ASC;
c1
0
0
0
0
0
8388606
8388607
8388608
8388608
8388609
8388610
16777215
SELECT * FROM t1 ORDER BY c1 DESC;
c1
16777215
8388610
8388609
8388608
8388608
8388607
8388606
0
0
0
0
0
SELECT * FROM t1 WHERE c1 >  8388608 ORDER BY c1 ASC;
c1
8388609
8388610
16777215
SELECT * FROM t1 WHERE c1 >= 8388608 ORDER BY c1 ASC;
c1
8388608
8388608
8388609
8388610
16777215
SELECT * FROM t1 WHERE c1 <  8388608 ORDER BY c1 ASC;
c1
0
0
0
0
0
8388606
8388607
SELECT * FROM t1 WHERE c1 <= 8388608 ORDER BY c1 ASC;
c1
0
0
0
0
0
8388606
8388607
8388608
8388608
SELECT * FROM t1 WHERE c1 =  8388608 ORDER BY c1 ASC;
c1
8388608
8388608
SELECT * FROM t1 WHERE c1 >  8388608 ORDER BY c1 DESC;
c1
16777215
8388610
8388609
SELECT * FROM t1 WHERE c1 >= 8388608 ORDER BY c1 DESC;
c1
16777215
8388610
8388609
8388608
8388608
SELECT * FROM t1 WHERE c1 <  8388608 ORDER BY c1 DESC;
c1
8388607
8388606
0
0
0
0
0
SELECT * FROM t1 WHERE c1 <= 8388608 ORDER BY c1 DESC;
c1
8388608
8388608
8388607
8388606
0
0
0
0
0
SELECT * FROM t1 WHERE c1 =  8388608 ORDER BY c1 DESC;
c1
8388608
8388608
UPDATE t1
SET c1 = 8388608
WHERE c1 <= 0 + 0 AND c1 >= 0 - 0
ORDER BY c1 ASC
LIMIT 2;
SELECT * FROM t1 ORDER BY c1;
c1
0
0
0
8388606
8388607
8388608
8388608
8388608
8388608
8388609
8388610
16777215
DELETE FROM t1
WHERE c1 <= 0 + 0 AND c1 >= 0 - 0
ORDER BY c1;
SELECT * FROM t1 ORDER BY c1;
c1
8388606
8388607
8388608
8388608
8388608
8388608
8388609
8388610
16777215
DROP TABLE t1;
CREATE TABLE t1(c1 MEDIUMINT UNSIGNED NULL, c2 MEDIUMINT UNSIGNED NULL , INDEX(c1, c2))
engine = cloud;
INSERT INTO t1 VALUES
(0, 0),
(0, 0),
(0, 0),
(0, 0),
(0, 0),
(8388608, 8388608 - 2),
(8388608, 8388608 - 1),
(8388608, 8388608),
(8388608, 8388608),
(8388608, 8388608 + 1),
(8388608, 8388608 + 2),
(16777215, 16777215);
SELECT * FROM t1 WHERE c1 = 8388608 AND c2 > 8388608 ORDER BY c2 ASC;
c1	c2
8388608	8388609
8388608	8388610
SELECT * FROM t1 WHERE c1 = 8388608 AND c2 >= 8388608 ORDER BY c2 ASC;
c1	c2
8388608	8388608
8388608	8388608
8388608	8388609
8388608	8388610
SELECT * FROM t1 WHERE c1 = 8388608 AND c2 < 8388608 ORDER BY c2 ASC;
c1	c2
8388608	8388606
8388608	8388607
SELECT * FROM t1 WHERE c1 = 8388608 AND c2 <= 8388608 ORDER BY c2 ASC;
c1	c2
8388608	8388606
8388608	8388607
8388608	8388608
8388608	8388608
SELECT * FROM t1 WHERE c1 = 8388608 AND c2 > 8388608 ORDER BY c2 DESC;
c1	c2
8388608	8388610
8388608	8388609
SELECT * FROM t1 WHERE c1 = 8388608 AND c2 >= 8388608 ORDER BY c2 DESC;
c1	c2
8388608	8388610
8388608	8388609
8388608	8388608
8388608	8388608
SELECT * FROM t1 WHERE c1 = 8388608 AND c2 < 8388608 ORDER BY c2 DESC;
c1	c2
8388608	8388607
8388608	8388606
SELECT * FROM t1 WHERE c1 = 8388608 AND c2 <= 8388608 ORDER BY c2 DESC;
c1	c2
8388608	8388608
8388608	8388608
8388608	8388607
8388608	8388606
DROP TABLE t1;
DROP TABLE IF EXISTS t1;
CREATE TABLE t1(c1 MEDIUMINT UNSIGNED NOT NULL , INDEX(c1))
ENGINE=cloud;
INSERT INTO t1 VALUES
(0),
(0),
(0),
(0),
(0),
(8388608 - 2),
(8388608 - 1),
(8388608),
(8388608),
(8388608 + 1),
(8388608 + 2),
(16777215);
SELECT * FROM t1 ORDER BY c1 ASC;
c1
0
0
0
0
0
8388606
8388607
8388608
8388608
8388609
8388610
16777215
SELECT * FROM t1 ORDER BY c1 DESC;
c1
16777215
8388610
8388609
8388608
8388608
8388607
8388606
0
0
0
0
0
SELECT * FROM t1 WHERE c1 >  8388608 ORDER BY c1 ASC;
c1
8388609
8388610
16777215
SELECT * FROM t1 WHERE c1 >= 8388608 ORDER BY c1 ASC;
c1
8388608
8388608
8388609
8388610
16777215
SELECT * FROM t1 WHERE c1 <  8388608 ORDER BY c1 ASC;
c1
0
0
0
0
0
8388606
8388607
SELECT * FROM t1 WHERE c1 <= 8388608 ORDER BY c1 ASC;
c1
0
0
0
0
0
8388606
8388607
8388608
8388608
SELECT * FROM t1 WHERE c1 =  8388608 ORDER BY c1 ASC;
c1
8388608
8388608
SELECT * FROM t1 WHERE c1 >  8388608 ORDER BY c1 DESC;
c1
16777215
8388610
8388609
SELECT * FROM t1 WHERE c1 >= 8388608 ORDER BY c1 DESC;
c1
16777215
8388610
8388609
8388608
8388608
SELECT * FROM t1 WHERE c1 <  8388608 ORDER BY c1 DESC;
c1
8388607
8388606
0
0
0
0
0
SELECT * FROM t1 WHERE c1 <= 8388608 ORDER BY c1 DESC;
c1
8388608
8388608
8388607
8388606
0
0
0
0
0
SELECT * FROM t1 WHERE c1 =  8388608 ORDER BY c1 DESC;
c1
8388608
8388608
UPDATE t1
SET c1 = 8388608
WHERE c1 <= 0 + 0 AND c1 >= 0 - 0
ORDER BY c1 ASC
LIMIT 2;
SELECT * FROM t1 ORDER BY c1;
c1
0
0
0
8388606
8388607
8388608
8388608
8388608
8388608
8388609
8388610
16777215
DELETE FROM t1
WHERE c1 <= 0 + 0 AND c1 >= 0 - 0
ORDER BY c1;
SELECT * FROM t1 ORDER BY c1;
c1
8388606
8388607
8388608
8388608
8388608
8388608
8388609
8388610
16777215
DROP TABLE t1;
CREATE TABLE t1(c1 MEDIUMINT UNSIGNED NOT NULL, c2 MEDIUMINT UNSIGNED NOT NULL , INDEX(c1, c2))
engine = cloud;
INSERT INTO t1 VALUES
(0, 0),
(0, 0),
(0, 0),
(0, 0),
(0, 0),
(8388608, 8388608 - 2),
(8388608, 8388608 - 1),
(8388608, 8388608),
(8388608, 8388608),
(8388608, 8388608 + 1),
(8388608, 8388608 + 2),
(16777215, 16777215);
SELECT * FROM t1 WHERE c1 = 8388608 AND c2 > 8388608 ORDER BY c2 ASC;
c1	c2
8388608	8388609
8388608	8388610
SELECT * FROM t1 WHERE c1 = 8388608 AND c2 >= 8388608 ORDER BY c2 ASC;
c1	c2
8388608	8388608
8388608	8388608
8388608	8388609
8388608	8388610
SELECT * FROM t1 WHERE c1 = 8388608 AND c2 < 8388608 ORDER BY c2 ASC;
c1	c2
8388608	8388606
8388608	8388607
SELECT * FROM t1 WHERE c1 = 8388608 AND c2 <= 8388608 ORDER BY c2 ASC;
c1	c2
8388608	8388606
8388608	8388607
8388608	8388608
8388608	8388608
SELECT * FROM t1 WHERE c1 = 8388608 AND c2 > 8388608 ORDER BY c2 DESC;
c1	c2
8388608	8388610
8388608	8388609
SELECT * FROM t1 WHERE c1 = 8388608 AND c2 >= 8388608 ORDER BY c2 DESC;
c1	c2
8388608	8388610
8388608	8388609
8388608	8388608
8388608	8388608
SELECT * FROM t1 WHERE c1 = 8388608 AND c2 < 8388608 ORDER BY c2 DESC;
c1	c2
8388608	8388607
8388608	8388606
SELECT * FROM t1 WHERE c1 = 8388608 AND c2 <= 8388608 ORDER BY c2 DESC;
c1	c2
8388608	8388608
8388608	8388608
8388608	8388607
8388608	8388606
DROP TABLE t1;
DROP TABLE IF EXISTS t1;
CREATE TABLE t1(c1 MEDIUMINT UNSIGNED NULL)
ENGINE=cloud;
INSERT INTO t1 VALUES
(0),
(0),
(8388608),
(16777215),
(NULL),
(NULL),
(NULL),
(NULL);
SELECT * FROM t1 WHERE c1 IS     NULL ORDER BY c1 ASC;
c1
NULL
NULL
NULL
NULL
SELECT * FROM t1 WHERE c1 IS NOT NULL ORDER BY c1 DESC;
c1
16777215
8388608
0
0
SELECT * FROM t1 WHERE c1 IS     NULL ORDER BY c1 ASC;
c1
NULL
NULL
NULL
NULL
SELECT * FROM t1 WHERE c1 IS NOT NULL ORDER BY c1 DESC;
c1
16777215
8388608
0
0
UPDATE t1
SET c1 = 0
WHERE c1 IS NULL;
SELECT * FROM t1 ORDER BY c1;
c1
0
0
0
0
0
0
8388608
16777215
UPDATE t1
SET c1 = 0
WHERE c1 IS NULL
LIMIT 2;
SELECT * FROM t1 ORDER BY c1;
c1
0
0
0
0
0
0
8388608
16777215
DELETE FROM t1
WHERE c1 IS NULL
ORDER BY c1;
SELECT * FROM t1 ORDER BY c1;
c1
0
0
0
0
0
0
8388608
16777215
DROP TABLE t1;
CREATE TABLE t1(c1 MEDIUMINT UNSIGNED NULL, c2 MEDIUMINT UNSIGNED NULL , INDEX(c1, c2))
engine = cloud;
INSERT INTO t1 VALUES
(0, 0),
(0, 0),
(0, 0),
(0, 0),
(0, 0),
(8388608, 8388608 - 2),
(8388608, 8388608 - 1),
(8388608, 8388608),
(8388608, 8388608),
(8388608, 8388608 + 1),
(8388608, 8388608 + 2),
(8388608, NULL),
(8388608, NULL),
(16777215, 16777215);
SELECT * FROM t1 WHERE c1 = 8388608 AND c2 > 8388608 ORDER BY c2 ASC;
c1	c2
8388608	8388609
8388608	8388610
SELECT * FROM t1 WHERE c1 = 8388608 AND c2 >= 8388608 ORDER BY c2 ASC;
c1	c2
8388608	8388608
8388608	8388608
8388608	8388609
8388608	8388610
SELECT * FROM t1 WHERE c1 = 8388608 AND c2 < 8388608 ORDER BY c2 ASC;
c1	c2
8388608	8388606
8388608	8388607
SELECT * FROM t1 WHERE c1 = 8388608 AND c2 <= 8388608 ORDER BY c2 ASC;
c1	c2
8388608	8388606
8388608	8388607
8388608	8388608
8388608	8388608
SELECT * FROM t1 WHERE c1 = 8388608 AND c2 is null ORDER BY c1 ASC;
c1	c2
8388608	NULL
8388608	NULL
SELECT * FROM t1 WHERE c1 = 8388608 AND c2 is not null ORDER BY c2 ASC;
c1	c2
8388608	8388606
8388608	8388607
8388608	8388608
8388608	8388608
8388608	8388609
8388608	8388610
SELECT * FROM t1 WHERE c1 = 8388608 AND c2 > 8388608 ORDER BY c2 DESC;
c1	c2
8388608	8388610
8388608	8388609
SELECT * FROM t1 WHERE c1 = 8388608 AND c2 >= 8388608 ORDER BY c2 DESC;
c1	c2
8388608	8388610
8388608	8388609
8388608	8388608
8388608	8388608
SELECT * FROM t1 WHERE c1 = 8388608 AND c2 < 8388608 ORDER BY c2 DESC;
c1	c2
8388608	8388607
8388608	8388606
SELECT * FROM t1 WHERE c1 = 8388608 AND c2 <= 8388608 ORDER BY c2 DESC;
c1	c2
8388608	8388608
8388608	8388608
8388608	8388607
8388608	8388606
SELECT * FROM t1 WHERE c1 = 8388608 AND c2 is null ORDER BY c1 DESC;
c1	c2
8388608	NULL
8388608	NULL
SELECT * FROM t1 WHERE c1 = 8388608 AND c2 is not null ORDER BY c2 DESC;
c1	c2
8388608	8388610
8388608	8388609
8388608	8388608
8388608	8388608
8388608	8388607
8388608	8388606
DROP TABLE t1;
DROP TABLE IF EXISTS t1;
CREATE TABLE t1(c1 MEDIUMINT UNSIGNED NULL , INDEX(c1))
ENGINE=cloud;
INSERT INTO t1 VALUES
(0),
(0),
(0),
(0),
(0),
(8388608 - 2),
(8388608 - 1),
(8388608),
(8388608),
(8388608 + 1),
(8388608 + 2),
(16777215);
SELECT * FROM t1 ORDER BY c1 ASC;
c1
0
0
0
0
0
8388606
8388607
8388608
8388608
8388609
8388610
16777215
SELECT * FROM t1 ORDER BY c1 DESC;
c1
16777215
8388610
8388609
8388608
8388608
8388607
8388606
0
0
0
0
0
SELECT * FROM t1 WHERE c1 >  8388608 ORDER BY c1 ASC;
c1
8388609
8388610
16777215
SELECT * FROM t1 WHERE c1 >= 8388608 ORDER BY c1 ASC;
c1
8388608
8388608
8388609
8388610
16777215
SELECT * FROM t1 WHERE c1 <  8388608 ORDER BY c1 ASC;
c1
0
0
0
0
0
8388606
8388607
SELECT * FROM t1 WHERE c1 <= 8388608 ORDER BY c1 ASC;
c1
0
0
0
0
0
8388606
8388607
8388608
8388608
SELECT * FROM t1 WHERE c1 =  8388608 ORDER BY c1 ASC;
c1
8388608
8388608
SELECT * FROM t1 WHERE c1 >  8388608 ORDER BY c1 DESC;
c1
16777215
8388610
8388609
SELECT * FROM t1 WHERE c1 >= 8388608 ORDER BY c1 DESC;
c1
16777215
8388610
8388609
8388608
8388608
SELECT * FROM t1 WHERE c1 <  8388608 ORDER BY c1 DESC;
c1
8388607
8388606
0
0
0
0
0
SELECT * FROM t1 WHERE c1 <= 8388608 ORDER BY c1 DESC;
c1
8388608
8388608
8388607
8388606
0
0
0
0
0
SELECT * FROM t1 WHERE c1 =  8388608 ORDER BY c1 DESC;
c1
8388608
8388608
UPDATE t1
SET c1 = 8388608
WHERE c1 <= 0 + 0 AND c1 >= 0 - 0
ORDER BY c1 ASC
LIMIT 2;
SELECT * FROM t1 ORDER BY c1;
c1
0
0
0
8388606
8388607
8388608
8388608
8388608
8388608
8388609
8388610
16777215
DELETE FROM t1
WHERE c1 <= 0 + 0 AND c1 >= 0 - 0
ORDER BY c1;
SELECT * FROM t1 ORDER BY c1;
c1
8388606
8388607
8388608
8388608
8388608
8388608
8388609
8388610
16777215
DROP TABLE t1;
CREATE TABLE t1(c1 MEDIUMINT UNSIGNED NULL, c2 MEDIUMINT UNSIGNED NULL , INDEX(c1, c2))
engine = cloud;
INSERT INTO t1 VALUES
(0, 0),
(0, 0),
(0, 0),
(0, 0),
(0, 0),
(8388608, 8388608 - 2),
(8388608, 8388608 - 1),
(8388608, 8388608),
(8388608, 8388608),
(8388608, 8388608 + 1),
(8388608, 8388608 + 2),
(16777215, 16777215);
SELECT * FROM t1 WHERE c1 = 8388608 AND c2 > 8388608 ORDER BY c2 ASC;
c1	c2
8388608	8388609
8388608	8388610
SELECT * FROM t1 WHERE c1 = 8388608 AND c2 >= 8388608 ORDER BY c2 ASC;
c1	c2
8388608	8388608
8388608	8388608
8388608	8388609
8388608	8388610
SELECT * FROM t1 WHERE c1 = 8388608 AND c2 < 8388608 ORDER BY c2 ASC;
c1	c2
8388608	8388606
8388608	8388607
SELECT * FROM t1 WHERE c1 = 8388608 AND c2 <= 8388608 ORDER BY c2 ASC;
c1	c2
8388608	8388606
8388608	8388607
8388608	8388608
8388608	8388608
SELECT * FROM t1 WHERE c1 = 8388608 AND c2 > 8388608 ORDER BY c2 DESC;
c1	c2
8388608	8388610
8388608	8388609
SELECT * FROM t1 WHERE c1 = 8388608 AND c2 >= 8388608 ORDER BY c2 DESC;
c1	c2
8388608	8388610
8388608	8388609
8388608	8388608
8388608	8388608
SELECT * FROM t1 WHERE c1 = 8388608 AND c2 < 8388608 ORDER BY c2 DESC;
c1	c2
8388608	8388607
8388608	8388606
SELECT * FROM t1 WHERE c1 = 8388608 AND c2 <= 8388608 ORDER BY c2 DESC;
c1	c2
8388608	8388608
8388608	8388608
8388608	8388607
8388608	8388606
DROP TABLE t1;
