DROP TABLE IF EXISTS t1;
CREATE TABLE t1(c1 SMALLINT  NOT NULL )
ENGINE=cloud;
INSERT INTO t1 VALUES
(-32768),
(0),
(0),
(16384 - 2),
(16384 - 1),
(16384),
(16384),
(16384 + 1),
(16384 + 2),
(32767);
SELECT * FROM t1 ORDER BY c1 ASC;
c1
-32768
0
0
16382
16383
16384
16384
16385
16386
32767
SELECT * FROM t1 ORDER BY c1 DESC;
c1
32767
16386
16385
16384
16384
16383
16382
0
0
-32768
SELECT * FROM t1 WHERE c1 >  16384 ORDER BY c1 ASC;
c1
16385
16386
32767
SELECT * FROM t1 WHERE c1 >= 16384 ORDER BY c1 ASC;
c1
16384
16384
16385
16386
32767
SELECT * FROM t1 WHERE c1 <  16384 ORDER BY c1 ASC;
c1
-32768
0
0
16382
16383
SELECT * FROM t1 WHERE c1 >= 16384 ORDER BY c1 ASC;
c1
16384
16384
16385
16386
32767
SELECT * FROM t1 WHERE c1 =  16384 ORDER BY c1 ASC;
c1
16384
16384
SELECT * FROM t1 WHERE c1 >  16384 ORDER BY c1 DESC;
c1
32767
16386
16385
SELECT * FROM t1 WHERE c1 >= 16384 ORDER BY c1 DESC;
c1
32767
16386
16385
16384
16384
SELECT * FROM t1 WHERE c1 <  16384 ORDER BY c1 DESC;
c1
16383
16382
0
0
-32768
SELECT * FROM t1 WHERE c1 >= 16384 ORDER BY c1 DESC;
c1
32767
16386
16385
16384
16384
SELECT * FROM t1 WHERE c1 =  16384 ORDER BY c1 DESC;
c1
16384
16384
UPDATE t1
SET c1 = 16384
WHERE c1 = 0;
SELECT * FROM t1 ORDER BY c1;
c1
-32768
16382
16383
16384
16384
16384
16384
16385
16386
32767
DELETE FROM t1
WHERE c1 = 16384
ORDER BY c1;
SELECT * FROM t1 ORDER BY c1;
c1
-32768
16382
16383
16385
16386
32767
DROP TABLE t1;
DROP TABLE IF EXISTS t1;
CREATE TABLE t1(c1 SMALLINT  )
ENGINE=cloud;
INSERT INTO t1 VALUES
(-32768),
(0),
(16384),
(32767),
(NULL),
(NULL);
SELECT * FROM t1 WHERE c1 IS     NULL ORDER BY c1 ASC;
c1
NULL
NULL
SELECT * FROM t1 WHERE c1 IS NOT NULL ORDER BY c1 DESC;
c1
32767
16384
0
-32768
SELECT * FROM t1 WHERE c1 IS     NULL ORDER BY c1 ASC;
c1
NULL
NULL
SELECT * FROM t1 WHERE c1 IS NOT NULL ORDER BY c1 DESC;
c1
32767
16384
0
-32768
UPDATE t1
SET c1 = 0
WHERE c1 IS NULL;
SELECT * FROM t1 ORDER BY c1;
c1
-32768
0
0
0
16384
32767
UPDATE t1
SET c1 = 0
WHERE c1 IS NULL;
SELECT * FROM t1 ORDER BY c1;
c1
-32768
0
0
0
16384
32767
DELETE FROM t1
WHERE c1 IS NULL
ORDER BY c1;
SELECT * FROM t1 ORDER BY c1;
c1
-32768
0
0
0
16384
32767
DROP TABLE t1;
DROP TABLE IF EXISTS t1;
CREATE TABLE t1(c1 SMALLINT   )
ENGINE=cloud;
INSERT INTO t1 VALUES
(-32768),
(0),
(0),
(16384 - 2),
(16384 - 1),
(16384),
(16384),
(16384 + 1),
(16384 + 2),
(32767);
SELECT * FROM t1 ORDER BY c1 ASC;
c1
-32768
0
0
16382
16383
16384
16384
16385
16386
32767
SELECT * FROM t1 ORDER BY c1 DESC;
c1
32767
16386
16385
16384
16384
16383
16382
0
0
-32768
SELECT * FROM t1 WHERE c1 >  16384 ORDER BY c1 ASC;
c1
16385
16386
32767
SELECT * FROM t1 WHERE c1 >= 16384 ORDER BY c1 ASC;
c1
16384
16384
16385
16386
32767
SELECT * FROM t1 WHERE c1 <  16384 ORDER BY c1 ASC;
c1
-32768
0
0
16382
16383
SELECT * FROM t1 WHERE c1 >= 16384 ORDER BY c1 ASC;
c1
16384
16384
16385
16386
32767
SELECT * FROM t1 WHERE c1 =  16384 ORDER BY c1 ASC;
c1
16384
16384
SELECT * FROM t1 WHERE c1 >  16384 ORDER BY c1 DESC;
c1
32767
16386
16385
SELECT * FROM t1 WHERE c1 >= 16384 ORDER BY c1 DESC;
c1
32767
16386
16385
16384
16384
SELECT * FROM t1 WHERE c1 <  16384 ORDER BY c1 DESC;
c1
16383
16382
0
0
-32768
SELECT * FROM t1 WHERE c1 >= 16384 ORDER BY c1 DESC;
c1
32767
16386
16385
16384
16384
SELECT * FROM t1 WHERE c1 =  16384 ORDER BY c1 DESC;
c1
16384
16384
UPDATE t1
SET c1 = 16384
WHERE c1 = 0;
SELECT * FROM t1 ORDER BY c1;
c1
-32768
16382
16383
16384
16384
16384
16384
16385
16386
32767
DELETE FROM t1
WHERE c1 = 16384
ORDER BY c1;
SELECT * FROM t1 ORDER BY c1;
c1
-32768
16382
16383
16385
16386
32767
DROP TABLE t1;
DROP TABLE IF EXISTS t1;
CREATE TABLE t1(c1 SMALLINT  NOT NULL , INDEX(c1))
ENGINE=cloud;
INSERT INTO t1 VALUES
(-32768),
(0),
(0),
(16384 - 2),
(16384 - 1),
(16384),
(16384),
(16384 + 1),
(16384 + 2),
(32767);
SELECT * FROM t1 ORDER BY c1 ASC;
c1
-32768
0
0
16382
16383
16384
16384
16385
16386
32767
SELECT * FROM t1 ORDER BY c1 DESC;
c1
32767
16386
16385
16384
16384
16383
16382
0
0
-32768
SELECT * FROM t1 WHERE c1 >  16384 ORDER BY c1 ASC;
c1
16385
16386
32767
SELECT * FROM t1 WHERE c1 >= 16384 ORDER BY c1 ASC;
c1
16384
16384
16385
16386
32767
SELECT * FROM t1 WHERE c1 <  16384 ORDER BY c1 ASC;
c1
-32768
0
0
16382
16383
SELECT * FROM t1 WHERE c1 >= 16384 ORDER BY c1 ASC;
c1
16384
16384
16385
16386
32767
SELECT * FROM t1 WHERE c1 =  16384 ORDER BY c1 ASC;
c1
16384
16384
SELECT * FROM t1 WHERE c1 >  16384 ORDER BY c1 DESC;
c1
32767
16386
16385
SELECT * FROM t1 WHERE c1 >= 16384 ORDER BY c1 DESC;
c1
32767
16386
16385
16384
16384
SELECT * FROM t1 WHERE c1 <  16384 ORDER BY c1 DESC;
c1
16383
16382
0
0
-32768
SELECT * FROM t1 WHERE c1 >= 16384 ORDER BY c1 DESC;
c1
32767
16386
16385
16384
16384
SELECT * FROM t1 WHERE c1 =  16384 ORDER BY c1 DESC;
c1
16384
16384
UPDATE t1
SET c1 = 16384
WHERE c1 = 0;
SELECT * FROM t1 ORDER BY c1;
c1
-32768
16382
16383
16384
16384
16384
16384
16385
16386
32767
DELETE FROM t1
WHERE c1 = 16384
ORDER BY c1;
SELECT * FROM t1 ORDER BY c1;
c1
-32768
16382
16383
16385
16386
32767
DROP TABLE t1;
DROP TABLE IF EXISTS t1;
CREATE TABLE t1(c1 SMALLINT  )
ENGINE=cloud;
INSERT INTO t1 VALUES
(-32768),
(0),
(16384),
(32767),
(NULL),
(NULL);
SELECT * FROM t1 WHERE c1 IS     NULL ORDER BY c1 ASC;
c1
NULL
NULL
SELECT * FROM t1 WHERE c1 IS NOT NULL ORDER BY c1 DESC;
c1
32767
16384
0
-32768
SELECT * FROM t1 WHERE c1 IS     NULL ORDER BY c1 ASC;
c1
NULL
NULL
SELECT * FROM t1 WHERE c1 IS NOT NULL ORDER BY c1 DESC;
c1
32767
16384
0
-32768
UPDATE t1
SET c1 = 0
WHERE c1 IS NULL;
SELECT * FROM t1 ORDER BY c1;
c1
-32768
0
0
0
16384
32767
UPDATE t1
SET c1 = 0
WHERE c1 IS NULL;
SELECT * FROM t1 ORDER BY c1;
c1
-32768
0
0
0
16384
32767
DELETE FROM t1
WHERE c1 IS NULL
ORDER BY c1;
SELECT * FROM t1 ORDER BY c1;
c1
-32768
0
0
0
16384
32767
DROP TABLE t1;
DROP TABLE IF EXISTS t1;
CREATE TABLE t1(c1 SMALLINT   , INDEX(c1))
ENGINE=cloud;
INSERT INTO t1 VALUES
(-32768),
(0),
(0),
(16384 - 2),
(16384 - 1),
(16384),
(16384),
(16384 + 1),
(16384 + 2),
(32767);
SELECT * FROM t1 ORDER BY c1 ASC;
c1
-32768
0
0
16382
16383
16384
16384
16385
16386
32767
SELECT * FROM t1 ORDER BY c1 DESC;
c1
32767
16386
16385
16384
16384
16383
16382
0
0
-32768
SELECT * FROM t1 WHERE c1 >  16384 ORDER BY c1 ASC;
c1
16385
16386
32767
SELECT * FROM t1 WHERE c1 >= 16384 ORDER BY c1 ASC;
c1
16384
16384
16385
16386
32767
SELECT * FROM t1 WHERE c1 <  16384 ORDER BY c1 ASC;
c1
-32768
0
0
16382
16383
SELECT * FROM t1 WHERE c1 >= 16384 ORDER BY c1 ASC;
c1
16384
16384
16385
16386
32767
SELECT * FROM t1 WHERE c1 =  16384 ORDER BY c1 ASC;
c1
16384
16384
SELECT * FROM t1 WHERE c1 >  16384 ORDER BY c1 DESC;
c1
32767
16386
16385
SELECT * FROM t1 WHERE c1 >= 16384 ORDER BY c1 DESC;
c1
32767
16386
16385
16384
16384
SELECT * FROM t1 WHERE c1 <  16384 ORDER BY c1 DESC;
c1
16383
16382
0
0
-32768
SELECT * FROM t1 WHERE c1 >= 16384 ORDER BY c1 DESC;
c1
32767
16386
16385
16384
16384
SELECT * FROM t1 WHERE c1 =  16384 ORDER BY c1 DESC;
c1
16384
16384
UPDATE t1
SET c1 = 16384
WHERE c1 = 0;
SELECT * FROM t1 ORDER BY c1;
c1
-32768
16382
16383
16384
16384
16384
16384
16385
16386
32767
DELETE FROM t1
WHERE c1 = 16384
ORDER BY c1;
SELECT * FROM t1 ORDER BY c1;
c1
-32768
16382
16383
16385
16386
32767
DROP TABLE t1;
DROP TABLE IF EXISTS t1;
CREATE TABLE t1(c1 SMALLINT UNSIGNED NOT NULL )
ENGINE=cloud;
INSERT INTO t1 VALUES
(0),
(0),
(0),
(32768 - 2),
(32768 - 1),
(32768),
(32768),
(32768 + 1),
(32768 + 2),
(65535);
SELECT * FROM t1 ORDER BY c1 ASC;
c1
0
0
0
32766
32767
32768
32768
32769
32770
65535
SELECT * FROM t1 ORDER BY c1 DESC;
c1
65535
32770
32769
32768
32768
32767
32766
0
0
0
SELECT * FROM t1 WHERE c1 >  32768 ORDER BY c1 ASC;
c1
32769
32770
65535
SELECT * FROM t1 WHERE c1 >= 32768 ORDER BY c1 ASC;
c1
32768
32768
32769
32770
65535
SELECT * FROM t1 WHERE c1 <  32768 ORDER BY c1 ASC;
c1
0
0
0
32766
32767
SELECT * FROM t1 WHERE c1 >= 32768 ORDER BY c1 ASC;
c1
32768
32768
32769
32770
65535
SELECT * FROM t1 WHERE c1 =  32768 ORDER BY c1 ASC;
c1
32768
32768
SELECT * FROM t1 WHERE c1 >  32768 ORDER BY c1 DESC;
c1
65535
32770
32769
SELECT * FROM t1 WHERE c1 >= 32768 ORDER BY c1 DESC;
c1
65535
32770
32769
32768
32768
SELECT * FROM t1 WHERE c1 <  32768 ORDER BY c1 DESC;
c1
32767
32766
0
0
0
SELECT * FROM t1 WHERE c1 >= 32768 ORDER BY c1 DESC;
c1
65535
32770
32769
32768
32768
SELECT * FROM t1 WHERE c1 =  32768 ORDER BY c1 DESC;
c1
32768
32768
UPDATE t1
SET c1 = 32768
WHERE c1 = 0;
SELECT * FROM t1 ORDER BY c1;
c1
32766
32767
32768
32768
32768
32768
32768
32769
32770
65535
DELETE FROM t1
WHERE c1 = 32768
ORDER BY c1;
SELECT * FROM t1 ORDER BY c1;
c1
32766
32767
32769
32770
65535
DROP TABLE t1;
DROP TABLE IF EXISTS t1;
CREATE TABLE t1(c1 SMALLINT UNSIGNED )
ENGINE=cloud;
INSERT INTO t1 VALUES
(0),
(0),
(32768),
(65535),
(NULL),
(NULL);
SELECT * FROM t1 WHERE c1 IS     NULL ORDER BY c1 ASC;
c1
NULL
NULL
SELECT * FROM t1 WHERE c1 IS NOT NULL ORDER BY c1 DESC;
c1
65535
32768
0
0
SELECT * FROM t1 WHERE c1 IS     NULL ORDER BY c1 ASC;
c1
NULL
NULL
SELECT * FROM t1 WHERE c1 IS NOT NULL ORDER BY c1 DESC;
c1
65535
32768
0
0
UPDATE t1
SET c1 = 0
WHERE c1 IS NULL;
SELECT * FROM t1 ORDER BY c1;
c1
0
0
0
0
32768
65535
UPDATE t1
SET c1 = 0
WHERE c1 IS NULL;
SELECT * FROM t1 ORDER BY c1;
c1
0
0
0
0
32768
65535
DELETE FROM t1
WHERE c1 IS NULL
ORDER BY c1;
SELECT * FROM t1 ORDER BY c1;
c1
0
0
0
0
32768
65535
DROP TABLE t1;
DROP TABLE IF EXISTS t1;
CREATE TABLE t1(c1 SMALLINT UNSIGNED  )
ENGINE=cloud;
INSERT INTO t1 VALUES
(0),
(0),
(0),
(32768 - 2),
(32768 - 1),
(32768),
(32768),
(32768 + 1),
(32768 + 2),
(65535);
SELECT * FROM t1 ORDER BY c1 ASC;
c1
0
0
0
32766
32767
32768
32768
32769
32770
65535
SELECT * FROM t1 ORDER BY c1 DESC;
c1
65535
32770
32769
32768
32768
32767
32766
0
0
0
SELECT * FROM t1 WHERE c1 >  32768 ORDER BY c1 ASC;
c1
32769
32770
65535
SELECT * FROM t1 WHERE c1 >= 32768 ORDER BY c1 ASC;
c1
32768
32768
32769
32770
65535
SELECT * FROM t1 WHERE c1 <  32768 ORDER BY c1 ASC;
c1
0
0
0
32766
32767
SELECT * FROM t1 WHERE c1 >= 32768 ORDER BY c1 ASC;
c1
32768
32768
32769
32770
65535
SELECT * FROM t1 WHERE c1 =  32768 ORDER BY c1 ASC;
c1
32768
32768
SELECT * FROM t1 WHERE c1 >  32768 ORDER BY c1 DESC;
c1
65535
32770
32769
SELECT * FROM t1 WHERE c1 >= 32768 ORDER BY c1 DESC;
c1
65535
32770
32769
32768
32768
SELECT * FROM t1 WHERE c1 <  32768 ORDER BY c1 DESC;
c1
32767
32766
0
0
0
SELECT * FROM t1 WHERE c1 >= 32768 ORDER BY c1 DESC;
c1
65535
32770
32769
32768
32768
SELECT * FROM t1 WHERE c1 =  32768 ORDER BY c1 DESC;
c1
32768
32768
UPDATE t1
SET c1 = 32768
WHERE c1 = 0;
SELECT * FROM t1 ORDER BY c1;
c1
32766
32767
32768
32768
32768
32768
32768
32769
32770
65535
DELETE FROM t1
WHERE c1 = 32768
ORDER BY c1;
SELECT * FROM t1 ORDER BY c1;
c1
32766
32767
32769
32770
65535
DROP TABLE t1;
DROP TABLE IF EXISTS t1;
CREATE TABLE t1(c1 SMALLINT UNSIGNED NOT NULL , INDEX(c1))
ENGINE=cloud;
INSERT INTO t1 VALUES
(0),
(0),
(0),
(32768 - 2),
(32768 - 1),
(32768),
(32768),
(32768 + 1),
(32768 + 2),
(65535);
SELECT * FROM t1 ORDER BY c1 ASC;
c1
0
0
0
32766
32767
32768
32768
32769
32770
65535
SELECT * FROM t1 ORDER BY c1 DESC;
c1
65535
32770
32769
32768
32768
32767
32766
0
0
0
SELECT * FROM t1 WHERE c1 >  32768 ORDER BY c1 ASC;
c1
32769
32770
65535
SELECT * FROM t1 WHERE c1 >= 32768 ORDER BY c1 ASC;
c1
32768
32768
32769
32770
65535
SELECT * FROM t1 WHERE c1 <  32768 ORDER BY c1 ASC;
c1
0
0
0
32766
32767
SELECT * FROM t1 WHERE c1 >= 32768 ORDER BY c1 ASC;
c1
32768
32768
32769
32770
65535
SELECT * FROM t1 WHERE c1 =  32768 ORDER BY c1 ASC;
c1
32768
32768
SELECT * FROM t1 WHERE c1 >  32768 ORDER BY c1 DESC;
c1
65535
32770
32769
SELECT * FROM t1 WHERE c1 >= 32768 ORDER BY c1 DESC;
c1
65535
32770
32769
32768
32768
SELECT * FROM t1 WHERE c1 <  32768 ORDER BY c1 DESC;
c1
32767
32766
0
0
0
SELECT * FROM t1 WHERE c1 >= 32768 ORDER BY c1 DESC;
c1
65535
32770
32769
32768
32768
SELECT * FROM t1 WHERE c1 =  32768 ORDER BY c1 DESC;
c1
32768
32768
UPDATE t1
SET c1 = 32768
WHERE c1 = 0;
SELECT * FROM t1 ORDER BY c1;
c1
32766
32767
32768
32768
32768
32768
32768
32769
32770
65535
DELETE FROM t1
WHERE c1 = 32768
ORDER BY c1;
SELECT * FROM t1 ORDER BY c1;
c1
32766
32767
32769
32770
65535
DROP TABLE t1;
DROP TABLE IF EXISTS t1;
CREATE TABLE t1(c1 SMALLINT UNSIGNED )
ENGINE=cloud;
INSERT INTO t1 VALUES
(0),
(0),
(32768),
(65535),
(NULL),
(NULL);
SELECT * FROM t1 WHERE c1 IS     NULL ORDER BY c1 ASC;
c1
NULL
NULL
SELECT * FROM t1 WHERE c1 IS NOT NULL ORDER BY c1 DESC;
c1
65535
32768
0
0
SELECT * FROM t1 WHERE c1 IS     NULL ORDER BY c1 ASC;
c1
NULL
NULL
SELECT * FROM t1 WHERE c1 IS NOT NULL ORDER BY c1 DESC;
c1
65535
32768
0
0
UPDATE t1
SET c1 = 0
WHERE c1 IS NULL;
SELECT * FROM t1 ORDER BY c1;
c1
0
0
0
0
32768
65535
UPDATE t1
SET c1 = 0
WHERE c1 IS NULL;
SELECT * FROM t1 ORDER BY c1;
c1
0
0
0
0
32768
65535
DELETE FROM t1
WHERE c1 IS NULL
ORDER BY c1;
SELECT * FROM t1 ORDER BY c1;
c1
0
0
0
0
32768
65535
DROP TABLE t1;
DROP TABLE IF EXISTS t1;
CREATE TABLE t1(c1 SMALLINT UNSIGNED  , INDEX(c1))
ENGINE=cloud;
INSERT INTO t1 VALUES
(0),
(0),
(0),
(32768 - 2),
(32768 - 1),
(32768),
(32768),
(32768 + 1),
(32768 + 2),
(65535);
SELECT * FROM t1 ORDER BY c1 ASC;
c1
0
0
0
32766
32767
32768
32768
32769
32770
65535
SELECT * FROM t1 ORDER BY c1 DESC;
c1
65535
32770
32769
32768
32768
32767
32766
0
0
0
SELECT * FROM t1 WHERE c1 >  32768 ORDER BY c1 ASC;
c1
32769
32770
65535
SELECT * FROM t1 WHERE c1 >= 32768 ORDER BY c1 ASC;
c1
32768
32768
32769
32770
65535
SELECT * FROM t1 WHERE c1 <  32768 ORDER BY c1 ASC;
c1
0
0
0
32766
32767
SELECT * FROM t1 WHERE c1 >= 32768 ORDER BY c1 ASC;
c1
32768
32768
32769
32770
65535
SELECT * FROM t1 WHERE c1 =  32768 ORDER BY c1 ASC;
c1
32768
32768
SELECT * FROM t1 WHERE c1 >  32768 ORDER BY c1 DESC;
c1
65535
32770
32769
SELECT * FROM t1 WHERE c1 >= 32768 ORDER BY c1 DESC;
c1
65535
32770
32769
32768
32768
SELECT * FROM t1 WHERE c1 <  32768 ORDER BY c1 DESC;
c1
32767
32766
0
0
0
SELECT * FROM t1 WHERE c1 >= 32768 ORDER BY c1 DESC;
c1
65535
32770
32769
32768
32768
SELECT * FROM t1 WHERE c1 =  32768 ORDER BY c1 DESC;
c1
32768
32768
UPDATE t1
SET c1 = 32768
WHERE c1 = 0;
SELECT * FROM t1 ORDER BY c1;
c1
32766
32767
32768
32768
32768
32768
32768
32769
32770
65535
DELETE FROM t1
WHERE c1 = 32768
ORDER BY c1;
SELECT * FROM t1 ORDER BY c1;
c1
32766
32767
32769
32770
65535
DROP TABLE t1;
