DROP TABLE IF EXISTS t1;
CREATE TABLE t1(c1 TINYINT SIGNED NOT NULL )
ENGINE=cloud;
INSERT INTO t1 VALUES
(-128),
(0),
(0),
(0),
(0),
(64 - 2),
(64 - 1),
(64),
(64),
(64 + 1),
(64 + 2),
(127);
SELECT * FROM t1 ORDER BY c1 ASC;
c1
-128
0
0
0
0
62
63
64
64
65
66
127
SELECT * FROM t1 ORDER BY c1 DESC;
c1
127
66
65
64
64
63
62
0
0
0
0
-128
SELECT * FROM t1 WHERE c1 >  64 ORDER BY c1 ASC;
c1
65
66
127
SELECT * FROM t1 WHERE c1 >= 64 ORDER BY c1 ASC;
c1
64
64
65
66
127
SELECT * FROM t1 WHERE c1 <  64 ORDER BY c1 ASC;
c1
-128
0
0
0
0
62
63
SELECT * FROM t1 WHERE c1 <= 64 ORDER BY c1 ASC;
c1
-128
0
0
0
0
62
63
64
64
SELECT * FROM t1 WHERE c1 =  64 ORDER BY c1 ASC;
c1
64
64
SELECT * FROM t1 WHERE c1 >  64 ORDER BY c1 DESC;
c1
127
66
65
SELECT * FROM t1 WHERE c1 >= 64 ORDER BY c1 DESC;
c1
127
66
65
64
64
SELECT * FROM t1 WHERE c1 <  64 ORDER BY c1 DESC;
c1
63
62
0
0
0
0
-128
SELECT * FROM t1 WHERE c1 <= 64 ORDER BY c1 DESC;
c1
64
64
63
62
0
0
0
0
-128
SELECT * FROM t1 WHERE c1 =  64 ORDER BY c1 DESC;
c1
64
64
UPDATE t1
SET c1 = 64
WHERE c1 <= 0 + 0 AND c1 >= 0 - 0
LIMIT 2;
SELECT * FROM t1 ORDER BY c1;
c1
-128
0
0
62
63
64
64
64
64
65
66
127
DELETE FROM t1
WHERE c1 <= 0 + 0 AND c1 >= 0 - 0
ORDER BY c1;
SELECT * FROM t1 ORDER BY c1;
c1
-128
62
63
64
64
64
64
65
66
127
DROP TABLE t1;
DROP TABLE IF EXISTS t1;
CREATE TABLE t1(c1 TINYINT SIGNED )
ENGINE=cloud;
INSERT INTO t1 VALUES
(-128),
(0),
(64),
(127),
(NULL),
(NULL),
(NULL),
(NULL);
SELECT * FROM t1 WHERE c1 IS     NULL ORDER BY c1 ASC;
c1
NULL
NULL
NULL
NULL
SELECT * FROM t1 WHERE c1 IS NOT NULL ORDER BY c1 DESC;
c1
127
64
0
-128
SELECT * FROM t1 WHERE c1 IS     NULL ORDER BY c1 ASC;
c1
NULL
NULL
NULL
NULL
SELECT * FROM t1 WHERE c1 IS NOT NULL ORDER BY c1 DESC;
c1
127
64
0
-128
UPDATE t1
SET c1 = 0
WHERE c1 IS NULL;
SELECT * FROM t1 ORDER BY c1;
c1
-128
0
0
0
0
0
64
127
UPDATE t1
SET c1 = 0
WHERE c1 IS NULL
LIMIT 2;
SELECT * FROM t1 ORDER BY c1;
c1
-128
0
0
0
0
0
64
127
DELETE FROM t1
WHERE c1 IS NULL
ORDER BY c1;
SELECT * FROM t1 ORDER BY c1;
c1
-128
0
0
0
0
0
64
127
DROP TABLE t1;
DROP TABLE IF EXISTS t1;
CREATE TABLE t1(c1 TINYINT SIGNED  )
ENGINE=cloud;
INSERT INTO t1 VALUES
(-128),
(0),
(0),
(0),
(0),
(64 - 2),
(64 - 1),
(64),
(64),
(64 + 1),
(64 + 2),
(127);
SELECT * FROM t1 ORDER BY c1 ASC;
c1
-128
0
0
0
0
62
63
64
64
65
66
127
SELECT * FROM t1 ORDER BY c1 DESC;
c1
127
66
65
64
64
63
62
0
0
0
0
-128
SELECT * FROM t1 WHERE c1 >  64 ORDER BY c1 ASC;
c1
65
66
127
SELECT * FROM t1 WHERE c1 >= 64 ORDER BY c1 ASC;
c1
64
64
65
66
127
SELECT * FROM t1 WHERE c1 <  64 ORDER BY c1 ASC;
c1
-128
0
0
0
0
62
63
SELECT * FROM t1 WHERE c1 <= 64 ORDER BY c1 ASC;
c1
-128
0
0
0
0
62
63
64
64
SELECT * FROM t1 WHERE c1 =  64 ORDER BY c1 ASC;
c1
64
64
SELECT * FROM t1 WHERE c1 >  64 ORDER BY c1 DESC;
c1
127
66
65
SELECT * FROM t1 WHERE c1 >= 64 ORDER BY c1 DESC;
c1
127
66
65
64
64
SELECT * FROM t1 WHERE c1 <  64 ORDER BY c1 DESC;
c1
63
62
0
0
0
0
-128
SELECT * FROM t1 WHERE c1 <= 64 ORDER BY c1 DESC;
c1
64
64
63
62
0
0
0
0
-128
SELECT * FROM t1 WHERE c1 =  64 ORDER BY c1 DESC;
c1
64
64
UPDATE t1
SET c1 = 64
WHERE c1 <= 0 + 0 AND c1 >= 0 - 0
LIMIT 2;
SELECT * FROM t1 ORDER BY c1;
c1
-128
0
0
62
63
64
64
64
64
65
66
127
DELETE FROM t1
WHERE c1 <= 0 + 0 AND c1 >= 0 - 0
ORDER BY c1;
SELECT * FROM t1 ORDER BY c1;
c1
-128
62
63
64
64
64
64
65
66
127
DROP TABLE t1;
DROP TABLE IF EXISTS t1;
CREATE TABLE t1(c1 TINYINT SIGNED NOT NULL , INDEX(c1))
ENGINE=cloud;
INSERT INTO t1 VALUES
(-128),
(0),
(0),
(0),
(0),
(64 - 2),
(64 - 1),
(64),
(64),
(64 + 1),
(64 + 2),
(127);
SELECT * FROM t1 ORDER BY c1 ASC;
c1
-128
0
0
0
0
62
63
64
64
65
66
127
SELECT * FROM t1 ORDER BY c1 DESC;
c1
127
66
65
64
64
63
62
0
0
0
0
-128
SELECT * FROM t1 WHERE c1 >  64 ORDER BY c1 ASC;
c1
65
66
127
SELECT * FROM t1 WHERE c1 >= 64 ORDER BY c1 ASC;
c1
64
64
65
66
127
SELECT * FROM t1 WHERE c1 <  64 ORDER BY c1 ASC;
c1
-128
0
0
0
0
62
63
SELECT * FROM t1 WHERE c1 <= 64 ORDER BY c1 ASC;
c1
-128
0
0
0
0
62
63
64
64
SELECT * FROM t1 WHERE c1 =  64 ORDER BY c1 ASC;
c1
64
64
SELECT * FROM t1 WHERE c1 >  64 ORDER BY c1 DESC;
c1
127
66
65
SELECT * FROM t1 WHERE c1 >= 64 ORDER BY c1 DESC;
c1
127
66
65
64
64
SELECT * FROM t1 WHERE c1 <  64 ORDER BY c1 DESC;
c1
63
62
0
0
0
0
-128
SELECT * FROM t1 WHERE c1 <= 64 ORDER BY c1 DESC;
c1
64
64
63
62
0
0
0
0
-128
SELECT * FROM t1 WHERE c1 =  64 ORDER BY c1 DESC;
c1
64
64
UPDATE t1
SET c1 = 64
WHERE c1 <= 0 + 0 AND c1 >= 0 - 0
LIMIT 2;
SELECT * FROM t1 ORDER BY c1;
c1
-128
0
0
62
63
64
64
64
64
65
66
127
DELETE FROM t1
WHERE c1 <= 0 + 0 AND c1 >= 0 - 0
ORDER BY c1;
SELECT * FROM t1 ORDER BY c1;
c1
-128
62
63
64
64
64
64
65
66
127
DROP TABLE t1;
DROP TABLE IF EXISTS t1;
CREATE TABLE t1(c1 TINYINT SIGNED )
ENGINE=cloud;
INSERT INTO t1 VALUES
(-128),
(0),
(64),
(127),
(NULL),
(NULL),
(NULL),
(NULL);
SELECT * FROM t1 WHERE c1 IS     NULL ORDER BY c1 ASC;
c1
NULL
NULL
NULL
NULL
SELECT * FROM t1 WHERE c1 IS NOT NULL ORDER BY c1 DESC;
c1
127
64
0
-128
SELECT * FROM t1 WHERE c1 IS     NULL ORDER BY c1 ASC;
c1
NULL
NULL
NULL
NULL
SELECT * FROM t1 WHERE c1 IS NOT NULL ORDER BY c1 DESC;
c1
127
64
0
-128
UPDATE t1
SET c1 = 0
WHERE c1 IS NULL;
SELECT * FROM t1 ORDER BY c1;
c1
-128
0
0
0
0
0
64
127
UPDATE t1
SET c1 = 0
WHERE c1 IS NULL
LIMIT 2;
SELECT * FROM t1 ORDER BY c1;
c1
-128
0
0
0
0
0
64
127
DELETE FROM t1
WHERE c1 IS NULL
ORDER BY c1;
SELECT * FROM t1 ORDER BY c1;
c1
-128
0
0
0
0
0
64
127
DROP TABLE t1;
DROP TABLE IF EXISTS t1;
CREATE TABLE t1(c1 TINYINT SIGNED  , INDEX(c1))
ENGINE=cloud;
INSERT INTO t1 VALUES
(-128),
(0),
(0),
(0),
(0),
(64 - 2),
(64 - 1),
(64),
(64),
(64 + 1),
(64 + 2),
(127);
SELECT * FROM t1 ORDER BY c1 ASC;
c1
-128
0
0
0
0
62
63
64
64
65
66
127
SELECT * FROM t1 ORDER BY c1 DESC;
c1
127
66
65
64
64
63
62
0
0
0
0
-128
SELECT * FROM t1 WHERE c1 >  64 ORDER BY c1 ASC;
c1
65
66
127
SELECT * FROM t1 WHERE c1 >= 64 ORDER BY c1 ASC;
c1
64
64
65
66
127
SELECT * FROM t1 WHERE c1 <  64 ORDER BY c1 ASC;
c1
-128
0
0
0
0
62
63
SELECT * FROM t1 WHERE c1 <= 64 ORDER BY c1 ASC;
c1
-128
0
0
0
0
62
63
64
64
SELECT * FROM t1 WHERE c1 =  64 ORDER BY c1 ASC;
c1
64
64
SELECT * FROM t1 WHERE c1 >  64 ORDER BY c1 DESC;
c1
127
66
65
SELECT * FROM t1 WHERE c1 >= 64 ORDER BY c1 DESC;
c1
127
66
65
64
64
SELECT * FROM t1 WHERE c1 <  64 ORDER BY c1 DESC;
c1
63
62
0
0
0
0
-128
SELECT * FROM t1 WHERE c1 <= 64 ORDER BY c1 DESC;
c1
64
64
63
62
0
0
0
0
-128
SELECT * FROM t1 WHERE c1 =  64 ORDER BY c1 DESC;
c1
64
64
UPDATE t1
SET c1 = 64
WHERE c1 <= 0 + 0 AND c1 >= 0 - 0
LIMIT 2;
SELECT * FROM t1 ORDER BY c1;
c1
-128
0
0
62
63
64
64
64
64
65
66
127
DELETE FROM t1
WHERE c1 <= 0 + 0 AND c1 >= 0 - 0
ORDER BY c1;
SELECT * FROM t1 ORDER BY c1;
c1
-128
62
63
64
64
64
64
65
66
127
DROP TABLE t1;
DROP TABLE IF EXISTS t1;
CREATE TABLE t1(c1 TINYINT UNSIGNED NOT NULL )
ENGINE=cloud;
INSERT INTO t1 VALUES
(0),
(0),
(0),
(0),
(0),
(128 - 2),
(128 - 1),
(128),
(128),
(128 + 1),
(128 + 2),
(255);
SELECT * FROM t1 ORDER BY c1 ASC;
c1
0
0
0
0
0
126
127
128
128
129
130
255
SELECT * FROM t1 ORDER BY c1 DESC;
c1
255
130
129
128
128
127
126
0
0
0
0
0
SELECT * FROM t1 WHERE c1 >  128 ORDER BY c1 ASC;
c1
129
130
255
SELECT * FROM t1 WHERE c1 >= 128 ORDER BY c1 ASC;
c1
128
128
129
130
255
SELECT * FROM t1 WHERE c1 <  128 ORDER BY c1 ASC;
c1
0
0
0
0
0
126
127
SELECT * FROM t1 WHERE c1 <= 128 ORDER BY c1 ASC;
c1
0
0
0
0
0
126
127
128
128
SELECT * FROM t1 WHERE c1 =  128 ORDER BY c1 ASC;
c1
128
128
SELECT * FROM t1 WHERE c1 >  128 ORDER BY c1 DESC;
c1
255
130
129
SELECT * FROM t1 WHERE c1 >= 128 ORDER BY c1 DESC;
c1
255
130
129
128
128
SELECT * FROM t1 WHERE c1 <  128 ORDER BY c1 DESC;
c1
127
126
0
0
0
0
0
SELECT * FROM t1 WHERE c1 <= 128 ORDER BY c1 DESC;
c1
128
128
127
126
0
0
0
0
0
SELECT * FROM t1 WHERE c1 =  128 ORDER BY c1 DESC;
c1
128
128
UPDATE t1
SET c1 = 128
WHERE c1 <= 0 + 0 AND c1 >= 0 - 0
LIMIT 2;
SELECT * FROM t1 ORDER BY c1;
c1
0
0
0
126
127
128
128
128
128
129
130
255
DELETE FROM t1
WHERE c1 <= 0 + 0 AND c1 >= 0 - 0
ORDER BY c1;
SELECT * FROM t1 ORDER BY c1;
c1
126
127
128
128
128
128
129
130
255
DROP TABLE t1;
DROP TABLE IF EXISTS t1;
CREATE TABLE t1(c1 TINYINT UNSIGNED )
ENGINE=cloud;
INSERT INTO t1 VALUES
(0),
(0),
(128),
(255),
(NULL),
(NULL),
(NULL),
(NULL);
SELECT * FROM t1 WHERE c1 IS     NULL ORDER BY c1 ASC;
c1
NULL
NULL
NULL
NULL
SELECT * FROM t1 WHERE c1 IS NOT NULL ORDER BY c1 DESC;
c1
255
128
0
0
SELECT * FROM t1 WHERE c1 IS     NULL ORDER BY c1 ASC;
c1
NULL
NULL
NULL
NULL
SELECT * FROM t1 WHERE c1 IS NOT NULL ORDER BY c1 DESC;
c1
255
128
0
0
UPDATE t1
SET c1 = 0
WHERE c1 IS NULL;
SELECT * FROM t1 ORDER BY c1;
c1
0
0
0
0
0
0
128
255
UPDATE t1
SET c1 = 0
WHERE c1 IS NULL
LIMIT 2;
SELECT * FROM t1 ORDER BY c1;
c1
0
0
0
0
0
0
128
255
DELETE FROM t1
WHERE c1 IS NULL
ORDER BY c1;
SELECT * FROM t1 ORDER BY c1;
c1
0
0
0
0
0
0
128
255
DROP TABLE t1;
DROP TABLE IF EXISTS t1;
CREATE TABLE t1(c1 TINYINT UNSIGNED  )
ENGINE=cloud;
INSERT INTO t1 VALUES
(0),
(0),
(0),
(0),
(0),
(128 - 2),
(128 - 1),
(128),
(128),
(128 + 1),
(128 + 2),
(255);
SELECT * FROM t1 ORDER BY c1 ASC;
c1
0
0
0
0
0
126
127
128
128
129
130
255
SELECT * FROM t1 ORDER BY c1 DESC;
c1
255
130
129
128
128
127
126
0
0
0
0
0
SELECT * FROM t1 WHERE c1 >  128 ORDER BY c1 ASC;
c1
129
130
255
SELECT * FROM t1 WHERE c1 >= 128 ORDER BY c1 ASC;
c1
128
128
129
130
255
SELECT * FROM t1 WHERE c1 <  128 ORDER BY c1 ASC;
c1
0
0
0
0
0
126
127
SELECT * FROM t1 WHERE c1 <= 128 ORDER BY c1 ASC;
c1
0
0
0
0
0
126
127
128
128
SELECT * FROM t1 WHERE c1 =  128 ORDER BY c1 ASC;
c1
128
128
SELECT * FROM t1 WHERE c1 >  128 ORDER BY c1 DESC;
c1
255
130
129
SELECT * FROM t1 WHERE c1 >= 128 ORDER BY c1 DESC;
c1
255
130
129
128
128
SELECT * FROM t1 WHERE c1 <  128 ORDER BY c1 DESC;
c1
127
126
0
0
0
0
0
SELECT * FROM t1 WHERE c1 <= 128 ORDER BY c1 DESC;
c1
128
128
127
126
0
0
0
0
0
SELECT * FROM t1 WHERE c1 =  128 ORDER BY c1 DESC;
c1
128
128
UPDATE t1
SET c1 = 128
WHERE c1 <= 0 + 0 AND c1 >= 0 - 0
LIMIT 2;
SELECT * FROM t1 ORDER BY c1;
c1
0
0
0
126
127
128
128
128
128
129
130
255
DELETE FROM t1
WHERE c1 <= 0 + 0 AND c1 >= 0 - 0
ORDER BY c1;
SELECT * FROM t1 ORDER BY c1;
c1
126
127
128
128
128
128
129
130
255
DROP TABLE t1;
DROP TABLE IF EXISTS t1;
CREATE TABLE t1(c1 TINYINT UNSIGNED NOT NULL , INDEX(c1))
ENGINE=cloud;
INSERT INTO t1 VALUES
(0),
(0),
(0),
(0),
(0),
(128 - 2),
(128 - 1),
(128),
(128),
(128 + 1),
(128 + 2),
(255);
SELECT * FROM t1 ORDER BY c1 ASC;
c1
0
0
0
0
0
126
127
128
128
129
130
255
SELECT * FROM t1 ORDER BY c1 DESC;
c1
255
130
129
128
128
127
126
0
0
0
0
0
SELECT * FROM t1 WHERE c1 >  128 ORDER BY c1 ASC;
c1
129
130
255
SELECT * FROM t1 WHERE c1 >= 128 ORDER BY c1 ASC;
c1
128
128
129
130
255
SELECT * FROM t1 WHERE c1 <  128 ORDER BY c1 ASC;
c1
0
0
0
0
0
126
127
SELECT * FROM t1 WHERE c1 <= 128 ORDER BY c1 ASC;
c1
0
0
0
0
0
126
127
128
128
SELECT * FROM t1 WHERE c1 =  128 ORDER BY c1 ASC;
c1
128
128
SELECT * FROM t1 WHERE c1 >  128 ORDER BY c1 DESC;
c1
255
130
129
SELECT * FROM t1 WHERE c1 >= 128 ORDER BY c1 DESC;
c1
255
130
129
128
128
SELECT * FROM t1 WHERE c1 <  128 ORDER BY c1 DESC;
c1
127
126
0
0
0
0
0
SELECT * FROM t1 WHERE c1 <= 128 ORDER BY c1 DESC;
c1
128
128
127
126
0
0
0
0
0
SELECT * FROM t1 WHERE c1 =  128 ORDER BY c1 DESC;
c1
128
128
UPDATE t1
SET c1 = 128
WHERE c1 <= 0 + 0 AND c1 >= 0 - 0
LIMIT 2;
SELECT * FROM t1 ORDER BY c1;
c1
0
0
0
126
127
128
128
128
128
129
130
255
DELETE FROM t1
WHERE c1 <= 0 + 0 AND c1 >= 0 - 0
ORDER BY c1;
SELECT * FROM t1 ORDER BY c1;
c1
126
127
128
128
128
128
129
130
255
DROP TABLE t1;
DROP TABLE IF EXISTS t1;
CREATE TABLE t1(c1 TINYINT UNSIGNED )
ENGINE=cloud;
INSERT INTO t1 VALUES
(0),
(0),
(128),
(255),
(NULL),
(NULL),
(NULL),
(NULL);
SELECT * FROM t1 WHERE c1 IS     NULL ORDER BY c1 ASC;
c1
NULL
NULL
NULL
NULL
SELECT * FROM t1 WHERE c1 IS NOT NULL ORDER BY c1 DESC;
c1
255
128
0
0
SELECT * FROM t1 WHERE c1 IS     NULL ORDER BY c1 ASC;
c1
NULL
NULL
NULL
NULL
SELECT * FROM t1 WHERE c1 IS NOT NULL ORDER BY c1 DESC;
c1
255
128
0
0
UPDATE t1
SET c1 = 0
WHERE c1 IS NULL;
SELECT * FROM t1 ORDER BY c1;
c1
0
0
0
0
0
0
128
255
UPDATE t1
SET c1 = 0
WHERE c1 IS NULL
LIMIT 2;
SELECT * FROM t1 ORDER BY c1;
c1
0
0
0
0
0
0
128
255
DELETE FROM t1
WHERE c1 IS NULL
ORDER BY c1;
SELECT * FROM t1 ORDER BY c1;
c1
0
0
0
0
0
0
128
255
DROP TABLE t1;
DROP TABLE IF EXISTS t1;
CREATE TABLE t1(c1 TINYINT UNSIGNED  , INDEX(c1))
ENGINE=cloud;
INSERT INTO t1 VALUES
(0),
(0),
(0),
(0),
(0),
(128 - 2),
(128 - 1),
(128),
(128),
(128 + 1),
(128 + 2),
(255);
SELECT * FROM t1 ORDER BY c1 ASC;
c1
0
0
0
0
0
126
127
128
128
129
130
255
SELECT * FROM t1 ORDER BY c1 DESC;
c1
255
130
129
128
128
127
126
0
0
0
0
0
SELECT * FROM t1 WHERE c1 >  128 ORDER BY c1 ASC;
c1
129
130
255
SELECT * FROM t1 WHERE c1 >= 128 ORDER BY c1 ASC;
c1
128
128
129
130
255
SELECT * FROM t1 WHERE c1 <  128 ORDER BY c1 ASC;
c1
0
0
0
0
0
126
127
SELECT * FROM t1 WHERE c1 <= 128 ORDER BY c1 ASC;
c1
0
0
0
0
0
126
127
128
128
SELECT * FROM t1 WHERE c1 =  128 ORDER BY c1 ASC;
c1
128
128
SELECT * FROM t1 WHERE c1 >  128 ORDER BY c1 DESC;
c1
255
130
129
SELECT * FROM t1 WHERE c1 >= 128 ORDER BY c1 DESC;
c1
255
130
129
128
128
SELECT * FROM t1 WHERE c1 <  128 ORDER BY c1 DESC;
c1
127
126
0
0
0
0
0
SELECT * FROM t1 WHERE c1 <= 128 ORDER BY c1 DESC;
c1
128
128
127
126
0
0
0
0
0
SELECT * FROM t1 WHERE c1 =  128 ORDER BY c1 DESC;
c1
128
128
UPDATE t1
SET c1 = 128
WHERE c1 <= 0 + 0 AND c1 >= 0 - 0
LIMIT 2;
SELECT * FROM t1 ORDER BY c1;
c1
0
0
0
126
127
128
128
128
128
129
130
255
DELETE FROM t1
WHERE c1 <= 0 + 0 AND c1 >= 0 - 0
ORDER BY c1;
SELECT * FROM t1 ORDER BY c1;
c1
126
127
128
128
128
128
129
130
255
DROP TABLE t1;
