DROP TABLE IF EXISTS t1;
CREATE TABLE t1(c1 VARCHAR(15) NOT NULL )
DEFAULT CHARACTER SET utf8 COLLATE utf8_bin
ENGINE=cloud;
INSERT INTO t1 VALUES
('AAAAAAA'),
('aaaaaaaaa'),
('BBBBBBBB'),
('bbbbbbbbb'),
('cccccccc'),
('CCCCCCCCC'),
('aAaAaAaA'),
('012345678912345'),
('BBBZxxxx '),
('!@#$%^&*()'),
('nrb0'),
(' a '),
(''),
('BBBZ'),
('BBBZ'),
('BBBZ'),
('BBBZ');
SELECT * FROM t1 ORDER BY c1 ASC;
c1

 a 
!@#$%^&*()
012345678912345
AAAAAAA
BBBBBBBB
BBBZ
BBBZ
BBBZ
BBBZ
BBBZxxxx 
CCCCCCCCC
aAaAaAaA
aaaaaaaaa
bbbbbbbbb
cccccccc
nrb0
SELECT * FROM t1 ORDER BY c1 DESC;
c1
nrb0
cccccccc
bbbbbbbbb
aaaaaaaaa
aAaAaAaA
CCCCCCCCC
BBBZxxxx 
BBBZ
BBBZ
BBBZ
BBBZ
BBBBBBBB
AAAAAAA
012345678912345
!@#$%^&*()
 a 

SELECT * FROM t1 WHERE c1 >  'BBBZ' ORDER BY c1 ASC;
c1
BBBZxxxx 
CCCCCCCCC
aAaAaAaA
aaaaaaaaa
bbbbbbbbb
cccccccc
nrb0
SELECT * FROM t1 WHERE c1 >= 'BBBZ' ORDER BY c1 ASC;
c1
BBBZ
BBBZ
BBBZ
BBBZ
BBBZxxxx 
CCCCCCCCC
aAaAaAaA
aaaaaaaaa
bbbbbbbbb
cccccccc
nrb0
SELECT * FROM t1 WHERE c1 <  'BBBZ' ORDER BY c1 ASC;
c1

 a 
!@#$%^&*()
012345678912345
AAAAAAA
BBBBBBBB
SELECT * FROM t1 WHERE c1 <= 'BBBZ' ORDER BY c1 ASC;
c1

 a 
!@#$%^&*()
012345678912345
AAAAAAA
BBBBBBBB
BBBZ
BBBZ
BBBZ
BBBZ
SELECT * FROM t1 WHERE c1 =  'BBBZ' ORDER BY c1 ASC;
c1
BBBZ
BBBZ
BBBZ
BBBZ
SELECT * FROM t1 WHERE c1 >  'BBBZ' ORDER BY c1 DESC;
c1
nrb0
cccccccc
bbbbbbbbb
aaaaaaaaa
aAaAaAaA
CCCCCCCCC
BBBZxxxx 
SELECT * FROM t1 WHERE c1 >= 'BBBZ' ORDER BY c1 DESC;
c1
nrb0
cccccccc
bbbbbbbbb
aaaaaaaaa
aAaAaAaA
CCCCCCCCC
BBBZxxxx 
BBBZ
BBBZ
BBBZ
BBBZ
SELECT * FROM t1 WHERE c1 <  'BBBZ' ORDER BY c1 DESC;
c1
BBBBBBBB
AAAAAAA
012345678912345
!@#$%^&*()
 a 

SELECT * FROM t1 WHERE c1 <= 'BBBZ' ORDER BY c1 DESC;
c1
BBBZ
BBBZ
BBBZ
BBBZ
BBBBBBBB
AAAAAAA
012345678912345
!@#$%^&*()
 a 

SELECT * FROM t1 WHERE c1 =  'BBBZ' ORDER BY c1 DESC;
c1
BBBZ
BBBZ
BBBZ
BBBZ
UPDATE t1
SET c1 = 'aAaAaAaA'
WHERE c1 = 'BBBZ'
ORDER BY c1
LIMIT 2;
SELECT * FROM t1 ORDER BY c1;
c1

 a 
!@#$%^&*()
012345678912345
AAAAAAA
BBBBBBBB
BBBZ
BBBZ
BBBZxxxx 
CCCCCCCCC
aAaAaAaA
aAaAaAaA
aAaAaAaA
aaaaaaaaa
bbbbbbbbb
cccccccc
nrb0
DELETE FROM t1
WHERE c1 = 'BBBZ'
ORDER BY c1;
SELECT * FROM t1 ORDER BY c1;
c1

 a 
!@#$%^&*()
012345678912345
AAAAAAA
BBBBBBBB
BBBZxxxx 
CCCCCCCCC
aAaAaAaA
aAaAaAaA
aAaAaAaA
aaaaaaaaa
bbbbbbbbb
cccccccc
nrb0
DROP TABLE t1;
DROP TABLE IF EXISTS t1;
CREATE TABLE t1(c1 VARCHAR(15) NULL )
DEFAULT CHARACTER SET utf8 COLLATE utf8_bin
ENGINE=cloud;
INSERT INTO t1 VALUES
('AAAAAAA'),
('aaaaaaaaa'),
('BBBBBBBB'),
('bbbbbbbbb'),
('cccccccc'),
('CCCCCCCCC'),
('aAaAaAaA'),
('012345678912345'),
('BBBZxxxx '),
('!@#$%^&*()'),
('nrb0'),
(' a '),
(''),
('BBBZ'),
(NULL),
(NULL),
(NULL),
(NULL);
SELECT * FROM t1 WHERE c1 IS     NULL ORDER BY c1 ASC;
c1
NULL
NULL
NULL
NULL
SELECT * FROM t1 WHERE c1 IS NOT NULL ORDER BY c1 DESC;
c1
nrb0
cccccccc
bbbbbbbbb
aaaaaaaaa
aAaAaAaA
CCCCCCCCC
BBBZxxxx 
BBBZ
BBBBBBBB
AAAAAAA
012345678912345
!@#$%^&*()
 a 

SELECT * FROM t1 WHERE c1 IS     NULL ORDER BY c1 ASC;
c1
NULL
NULL
NULL
NULL
SELECT * FROM t1 WHERE c1 IS NOT NULL ORDER BY c1 DESC;
c1
nrb0
cccccccc
bbbbbbbbb
aaaaaaaaa
aAaAaAaA
CCCCCCCCC
BBBZxxxx 
BBBZ
BBBBBBBB
AAAAAAA
012345678912345
!@#$%^&*()
 a 

UPDATE t1
SET c1 = 'BBBZ'
WHERE c1 IS NULL
LIMIT 2;
SELECT * FROM t1 ORDER BY c1;
c1
NULL
NULL

 a 
!@#$%^&*()
012345678912345
AAAAAAA
BBBBBBBB
BBBZ
BBBZ
BBBZ
BBBZxxxx 
CCCCCCCCC
aAaAaAaA
aaaaaaaaa
bbbbbbbbb
cccccccc
nrb0
DELETE FROM t1
WHERE c1 IS NULL
ORDER BY c1;
SELECT * FROM t1 ORDER BY c1;
c1

 a 
!@#$%^&*()
012345678912345
AAAAAAA
BBBBBBBB
BBBZ
BBBZ
BBBZ
BBBZxxxx 
CCCCCCCCC
aAaAaAaA
aaaaaaaaa
bbbbbbbbb
cccccccc
nrb0
DROP TABLE IF EXISTS t1;
CREATE TABLE t1(c1 VARCHAR(15) NULL )
DEFAULT CHARACTER SET utf8 COLLATE utf8_bin
ENGINE=cloud;
INSERT INTO t1 VALUES
('AAAAAAA'),
('aaaaaaaaa'),
('BBBBBBBB'),
('bbbbbbbbb'),
('cccccccc'),
('CCCCCCCCC'),
('aAaAaAaA'),
('012345678912345'),
('BBBZxxxx '),
('!@#$%^&*()'),
('nrb0'),
(' a '),
(''),
('BBBZ'),
('BBBZ'),
('BBBZ'),
('BBBZ');
SELECT * FROM t1 ORDER BY c1 ASC;
c1

 a 
!@#$%^&*()
012345678912345
AAAAAAA
BBBBBBBB
BBBZ
BBBZ
BBBZ
BBBZ
BBBZxxxx 
CCCCCCCCC
aAaAaAaA
aaaaaaaaa
bbbbbbbbb
cccccccc
nrb0
SELECT * FROM t1 ORDER BY c1 DESC;
c1
nrb0
cccccccc
bbbbbbbbb
aaaaaaaaa
aAaAaAaA
CCCCCCCCC
BBBZxxxx 
BBBZ
BBBZ
BBBZ
BBBZ
BBBBBBBB
AAAAAAA
012345678912345
!@#$%^&*()
 a 

SELECT * FROM t1 WHERE c1 >  'BBBZ' ORDER BY c1 ASC;
c1
BBBZxxxx 
CCCCCCCCC
aAaAaAaA
aaaaaaaaa
bbbbbbbbb
cccccccc
nrb0
SELECT * FROM t1 WHERE c1 >= 'BBBZ' ORDER BY c1 ASC;
c1
BBBZ
BBBZ
BBBZ
BBBZ
BBBZxxxx 
CCCCCCCCC
aAaAaAaA
aaaaaaaaa
bbbbbbbbb
cccccccc
nrb0
SELECT * FROM t1 WHERE c1 <  'BBBZ' ORDER BY c1 ASC;
c1

 a 
!@#$%^&*()
012345678912345
AAAAAAA
BBBBBBBB
SELECT * FROM t1 WHERE c1 <= 'BBBZ' ORDER BY c1 ASC;
c1

 a 
!@#$%^&*()
012345678912345
AAAAAAA
BBBBBBBB
BBBZ
BBBZ
BBBZ
BBBZ
SELECT * FROM t1 WHERE c1 =  'BBBZ' ORDER BY c1 ASC;
c1
BBBZ
BBBZ
BBBZ
BBBZ
SELECT * FROM t1 WHERE c1 >  'BBBZ' ORDER BY c1 DESC;
c1
nrb0
cccccccc
bbbbbbbbb
aaaaaaaaa
aAaAaAaA
CCCCCCCCC
BBBZxxxx 
SELECT * FROM t1 WHERE c1 >= 'BBBZ' ORDER BY c1 DESC;
c1
nrb0
cccccccc
bbbbbbbbb
aaaaaaaaa
aAaAaAaA
CCCCCCCCC
BBBZxxxx 
BBBZ
BBBZ
BBBZ
BBBZ
SELECT * FROM t1 WHERE c1 <  'BBBZ' ORDER BY c1 DESC;
c1
BBBBBBBB
AAAAAAA
012345678912345
!@#$%^&*()
 a 

SELECT * FROM t1 WHERE c1 <= 'BBBZ' ORDER BY c1 DESC;
c1
BBBZ
BBBZ
BBBZ
BBBZ
BBBBBBBB
AAAAAAA
012345678912345
!@#$%^&*()
 a 

SELECT * FROM t1 WHERE c1 =  'BBBZ' ORDER BY c1 DESC;
c1
BBBZ
BBBZ
BBBZ
BBBZ
UPDATE t1
SET c1 = 'aAaAaAaA'
WHERE c1 = 'BBBZ'
ORDER BY c1
LIMIT 2;
SELECT * FROM t1 ORDER BY c1;
c1

 a 
!@#$%^&*()
012345678912345
AAAAAAA
BBBBBBBB
BBBZ
BBBZ
BBBZxxxx 
CCCCCCCCC
aAaAaAaA
aAaAaAaA
aAaAaAaA
aaaaaaaaa
bbbbbbbbb
cccccccc
nrb0
DELETE FROM t1
WHERE c1 = 'BBBZ'
ORDER BY c1;
SELECT * FROM t1 ORDER BY c1;
c1

 a 
!@#$%^&*()
012345678912345
AAAAAAA
BBBBBBBB
BBBZxxxx 
CCCCCCCCC
aAaAaAaA
aAaAaAaA
aAaAaAaA
aaaaaaaaa
bbbbbbbbb
cccccccc
nrb0
DROP TABLE t1;
DROP TABLE IF EXISTS t1;
CREATE TABLE t1(c1 VARCHAR(15) NOT NULL , INDEX(c1))
DEFAULT CHARACTER SET utf8 COLLATE utf8_bin
ENGINE=cloud;
INSERT INTO t1 VALUES
('AAAAAAA'),
('aaaaaaaaa'),
('BBBBBBBB'),
('bbbbbbbbb'),
('cccccccc'),
('CCCCCCCCC'),
('aAaAaAaA'),
('012345678912345'),
('BBBZxxxx '),
('!@#$%^&*()'),
('nrb0'),
(' a '),
(''),
('BBBZ'),
('BBBZ'),
('BBBZ'),
('BBBZ');
SELECT * FROM t1 ORDER BY c1 ASC;
c1

 a 
!@#$%^&*()
012345678912345
AAAAAAA
BBBBBBBB
BBBZ
BBBZ
BBBZ
BBBZ
BBBZxxxx 
CCCCCCCCC
aAaAaAaA
aaaaaaaaa
bbbbbbbbb
cccccccc
nrb0
SELECT * FROM t1 ORDER BY c1 DESC;
c1
nrb0
cccccccc
bbbbbbbbb
aaaaaaaaa
aAaAaAaA
CCCCCCCCC
BBBZxxxx 
BBBZ
BBBZ
BBBZ
BBBZ
BBBBBBBB
AAAAAAA
012345678912345
!@#$%^&*()
 a 

SELECT * FROM t1 WHERE c1 >  'BBBZ' ORDER BY c1 ASC;
c1
BBBZxxxx 
CCCCCCCCC
aAaAaAaA
aaaaaaaaa
bbbbbbbbb
cccccccc
nrb0
SELECT * FROM t1 WHERE c1 >= 'BBBZ' ORDER BY c1 ASC;
c1
BBBZ
BBBZ
BBBZ
BBBZ
BBBZxxxx 
CCCCCCCCC
aAaAaAaA
aaaaaaaaa
bbbbbbbbb
cccccccc
nrb0
SELECT * FROM t1 WHERE c1 <  'BBBZ' ORDER BY c1 ASC;
c1

 a 
!@#$%^&*()
012345678912345
AAAAAAA
BBBBBBBB
SELECT * FROM t1 WHERE c1 <= 'BBBZ' ORDER BY c1 ASC;
c1

 a 
!@#$%^&*()
012345678912345
AAAAAAA
BBBBBBBB
BBBZ
BBBZ
BBBZ
BBBZ
SELECT * FROM t1 WHERE c1 =  'BBBZ' ORDER BY c1 ASC;
c1
BBBZ
BBBZ
BBBZ
BBBZ
SELECT * FROM t1 WHERE c1 >  'BBBZ' ORDER BY c1 DESC;
c1
nrb0
cccccccc
bbbbbbbbb
aaaaaaaaa
aAaAaAaA
CCCCCCCCC
BBBZxxxx 
SELECT * FROM t1 WHERE c1 >= 'BBBZ' ORDER BY c1 DESC;
c1
nrb0
cccccccc
bbbbbbbbb
aaaaaaaaa
aAaAaAaA
CCCCCCCCC
BBBZxxxx 
BBBZ
BBBZ
BBBZ
BBBZ
SELECT * FROM t1 WHERE c1 <  'BBBZ' ORDER BY c1 DESC;
c1
BBBBBBBB
AAAAAAA
012345678912345
!@#$%^&*()
 a 

SELECT * FROM t1 WHERE c1 <= 'BBBZ' ORDER BY c1 DESC;
c1
BBBZ
BBBZ
BBBZ
BBBZ
BBBBBBBB
AAAAAAA
012345678912345
!@#$%^&*()
 a 

SELECT * FROM t1 WHERE c1 =  'BBBZ' ORDER BY c1 DESC;
c1
BBBZ
BBBZ
BBBZ
BBBZ
UPDATE t1
SET c1 = 'aAaAaAaA'
WHERE c1 = 'BBBZ'
ORDER BY c1
LIMIT 2;
SELECT * FROM t1 ORDER BY c1;
c1

 a 
!@#$%^&*()
012345678912345
AAAAAAA
BBBBBBBB
BBBZ
BBBZ
BBBZxxxx 
CCCCCCCCC
aAaAaAaA
aAaAaAaA
aAaAaAaA
aaaaaaaaa
bbbbbbbbb
cccccccc
nrb0
DELETE FROM t1
WHERE c1 = 'BBBZ'
ORDER BY c1;
SELECT * FROM t1 ORDER BY c1;
c1

 a 
!@#$%^&*()
012345678912345
AAAAAAA
BBBBBBBB
BBBZxxxx 
CCCCCCCCC
aAaAaAaA
aAaAaAaA
aAaAaAaA
aaaaaaaaa
bbbbbbbbb
cccccccc
nrb0
DROP TABLE t1;
DROP TABLE IF EXISTS t1;
CREATE TABLE t1(c1 VARCHAR(15) NULL , INDEX(c1))
DEFAULT CHARACTER SET utf8 COLLATE utf8_bin
ENGINE=cloud;
INSERT INTO t1 VALUES
('AAAAAAA'),
('aaaaaaaaa'),
('BBBBBBBB'),
('bbbbbbbbb'),
('cccccccc'),
('CCCCCCCCC'),
('aAaAaAaA'),
('012345678912345'),
('BBBZxxxx '),
('!@#$%^&*()'),
('nrb0'),
(' a '),
(''),
('BBBZ'),
(NULL),
(NULL),
(NULL),
(NULL);
SELECT * FROM t1 WHERE c1 IS     NULL ORDER BY c1 ASC;
c1
NULL
NULL
NULL
NULL
SELECT * FROM t1 WHERE c1 IS NOT NULL ORDER BY c1 DESC;
c1
nrb0
cccccccc
bbbbbbbbb
aaaaaaaaa
aAaAaAaA
CCCCCCCCC
BBBZxxxx 
BBBZ
BBBBBBBB
AAAAAAA
012345678912345
!@#$%^&*()
 a 

SELECT * FROM t1 WHERE c1 IS     NULL ORDER BY c1 ASC;
c1
NULL
NULL
NULL
NULL
SELECT * FROM t1 WHERE c1 IS NOT NULL ORDER BY c1 DESC;
c1
nrb0
cccccccc
bbbbbbbbb
aaaaaaaaa
aAaAaAaA
CCCCCCCCC
BBBZxxxx 
BBBZ
BBBBBBBB
AAAAAAA
012345678912345
!@#$%^&*()
 a 

UPDATE t1
SET c1 = 'BBBZ'
WHERE c1 IS NULL
LIMIT 2;
SELECT * FROM t1 ORDER BY c1;
c1
NULL
NULL

 a 
!@#$%^&*()
012345678912345
AAAAAAA
BBBBBBBB
BBBZ
BBBZ
BBBZ
BBBZxxxx 
CCCCCCCCC
aAaAaAaA
aaaaaaaaa
bbbbbbbbb
cccccccc
nrb0
DELETE FROM t1
WHERE c1 IS NULL
ORDER BY c1;
SELECT * FROM t1 ORDER BY c1;
c1

 a 
!@#$%^&*()
012345678912345
AAAAAAA
BBBBBBBB
BBBZ
BBBZ
BBBZ
BBBZxxxx 
CCCCCCCCC
aAaAaAaA
aaaaaaaaa
bbbbbbbbb
cccccccc
nrb0
DROP TABLE IF EXISTS t1;
CREATE TABLE t1(c1 VARCHAR(15) NULL , INDEX(c1))
DEFAULT CHARACTER SET utf8 COLLATE utf8_bin
ENGINE=cloud;
INSERT INTO t1 VALUES
('AAAAAAA'),
('aaaaaaaaa'),
('BBBBBBBB'),
('bbbbbbbbb'),
('cccccccc'),
('CCCCCCCCC'),
('aAaAaAaA'),
('012345678912345'),
('BBBZxxxx '),
('!@#$%^&*()'),
('nrb0'),
(' a '),
(''),
('BBBZ'),
('BBBZ'),
('BBBZ'),
('BBBZ');
SELECT * FROM t1 ORDER BY c1 ASC;
c1

 a 
!@#$%^&*()
012345678912345
AAAAAAA
BBBBBBBB
BBBZ
BBBZ
BBBZ
BBBZ
BBBZxxxx 
CCCCCCCCC
aAaAaAaA
aaaaaaaaa
bbbbbbbbb
cccccccc
nrb0
SELECT * FROM t1 ORDER BY c1 DESC;
c1
nrb0
cccccccc
bbbbbbbbb
aaaaaaaaa
aAaAaAaA
CCCCCCCCC
BBBZxxxx 
BBBZ
BBBZ
BBBZ
BBBZ
BBBBBBBB
AAAAAAA
012345678912345
!@#$%^&*()
 a 

SELECT * FROM t1 WHERE c1 >  'BBBZ' ORDER BY c1 ASC;
c1
BBBZxxxx 
CCCCCCCCC
aAaAaAaA
aaaaaaaaa
bbbbbbbbb
cccccccc
nrb0
SELECT * FROM t1 WHERE c1 >= 'BBBZ' ORDER BY c1 ASC;
c1
BBBZ
BBBZ
BBBZ
BBBZ
BBBZxxxx 
CCCCCCCCC
aAaAaAaA
aaaaaaaaa
bbbbbbbbb
cccccccc
nrb0
SELECT * FROM t1 WHERE c1 <  'BBBZ' ORDER BY c1 ASC;
c1

 a 
!@#$%^&*()
012345678912345
AAAAAAA
BBBBBBBB
SELECT * FROM t1 WHERE c1 <= 'BBBZ' ORDER BY c1 ASC;
c1

 a 
!@#$%^&*()
012345678912345
AAAAAAA
BBBBBBBB
BBBZ
BBBZ
BBBZ
BBBZ
SELECT * FROM t1 WHERE c1 =  'BBBZ' ORDER BY c1 ASC;
c1
BBBZ
BBBZ
BBBZ
BBBZ
SELECT * FROM t1 WHERE c1 >  'BBBZ' ORDER BY c1 DESC;
c1
nrb0
cccccccc
bbbbbbbbb
aaaaaaaaa
aAaAaAaA
CCCCCCCCC
BBBZxxxx 
SELECT * FROM t1 WHERE c1 >= 'BBBZ' ORDER BY c1 DESC;
c1
nrb0
cccccccc
bbbbbbbbb
aaaaaaaaa
aAaAaAaA
CCCCCCCCC
BBBZxxxx 
BBBZ
BBBZ
BBBZ
BBBZ
SELECT * FROM t1 WHERE c1 <  'BBBZ' ORDER BY c1 DESC;
c1
BBBBBBBB
AAAAAAA
012345678912345
!@#$%^&*()
 a 

SELECT * FROM t1 WHERE c1 <= 'BBBZ' ORDER BY c1 DESC;
c1
BBBZ
BBBZ
BBBZ
BBBZ
BBBBBBBB
AAAAAAA
012345678912345
!@#$%^&*()
 a 

SELECT * FROM t1 WHERE c1 =  'BBBZ' ORDER BY c1 DESC;
c1
BBBZ
BBBZ
BBBZ
BBBZ
UPDATE t1
SET c1 = 'aAaAaAaA'
WHERE c1 = 'BBBZ'
ORDER BY c1
LIMIT 2;
SELECT * FROM t1 ORDER BY c1;
c1

 a 
!@#$%^&*()
012345678912345
AAAAAAA
BBBBBBBB
BBBZ
BBBZ
BBBZxxxx 
CCCCCCCCC
aAaAaAaA
aAaAaAaA
aAaAaAaA
aaaaaaaaa
bbbbbbbbb
cccccccc
nrb0
DELETE FROM t1
WHERE c1 = 'BBBZ'
ORDER BY c1;
SELECT * FROM t1 ORDER BY c1;
c1

 a 
!@#$%^&*()
012345678912345
AAAAAAA
BBBBBBBB
BBBZxxxx 
CCCCCCCCC
aAaAaAaA
aAaAaAaA
aAaAaAaA
aaaaaaaaa
bbbbbbbbb
cccccccc
nrb0
DROP TABLE t1;
DROP TABLE IF EXISTS t1;
CREATE TABLE t1(c1 VARCHAR(15) NOT NULL )
DEFAULT CHARACTER SET utf8 COLLATE utf8_bin
ENGINE=cloud;
INSERT INTO t1 VALUES
('AAAAAAA'),
('aaaaaaaaa'),
('BBBBBBBB'),
('bbbbbbbbb'),
('cccccccc'),
('CCCCCCCCC'),
('aAaAaAaA'),
('012345678912345'),
('BBBZxxxx '),
('!@#$%^&*()'),
('nrb0'),
(' a '),
(''),
('BBBZ'),
('BBBZ'),
('BBBZ'),
('BBBZ');
SELECT * FROM t1 ORDER BY c1 ASC;
c1

 a 
!@#$%^&*()
012345678912345
AAAAAAA
BBBBBBBB
BBBZ
BBBZ
BBBZ
BBBZ
BBBZxxxx 
CCCCCCCCC
aAaAaAaA
aaaaaaaaa
bbbbbbbbb
cccccccc
nrb0
SELECT * FROM t1 ORDER BY c1 DESC;
c1
nrb0
cccccccc
bbbbbbbbb
aaaaaaaaa
aAaAaAaA
CCCCCCCCC
BBBZxxxx 
BBBZ
BBBZ
BBBZ
BBBZ
BBBBBBBB
AAAAAAA
012345678912345
!@#$%^&*()
 a 

SELECT * FROM t1 WHERE c1 >  'BBBZ' ORDER BY c1 ASC;
c1
BBBZxxxx 
CCCCCCCCC
aAaAaAaA
aaaaaaaaa
bbbbbbbbb
cccccccc
nrb0
SELECT * FROM t1 WHERE c1 >= 'BBBZ' ORDER BY c1 ASC;
c1
BBBZ
BBBZ
BBBZ
BBBZ
BBBZxxxx 
CCCCCCCCC
aAaAaAaA
aaaaaaaaa
bbbbbbbbb
cccccccc
nrb0
SELECT * FROM t1 WHERE c1 <  'BBBZ' ORDER BY c1 ASC;
c1

 a 
!@#$%^&*()
012345678912345
AAAAAAA
BBBBBBBB
SELECT * FROM t1 WHERE c1 <= 'BBBZ' ORDER BY c1 ASC;
c1

 a 
!@#$%^&*()
012345678912345
AAAAAAA
BBBBBBBB
BBBZ
BBBZ
BBBZ
BBBZ
SELECT * FROM t1 WHERE c1 =  'BBBZ' ORDER BY c1 ASC;
c1
BBBZ
BBBZ
BBBZ
BBBZ
SELECT * FROM t1 WHERE c1 >  'BBBZ' ORDER BY c1 DESC;
c1
nrb0
cccccccc
bbbbbbbbb
aaaaaaaaa
aAaAaAaA
CCCCCCCCC
BBBZxxxx 
SELECT * FROM t1 WHERE c1 >= 'BBBZ' ORDER BY c1 DESC;
c1
nrb0
cccccccc
bbbbbbbbb
aaaaaaaaa
aAaAaAaA
CCCCCCCCC
BBBZxxxx 
BBBZ
BBBZ
BBBZ
BBBZ
SELECT * FROM t1 WHERE c1 <  'BBBZ' ORDER BY c1 DESC;
c1
BBBBBBBB
AAAAAAA
012345678912345
!@#$%^&*()
 a 

SELECT * FROM t1 WHERE c1 <= 'BBBZ' ORDER BY c1 DESC;
c1
BBBZ
BBBZ
BBBZ
BBBZ
BBBBBBBB
AAAAAAA
012345678912345
!@#$%^&*()
 a 

SELECT * FROM t1 WHERE c1 =  'BBBZ' ORDER BY c1 DESC;
c1
BBBZ
BBBZ
BBBZ
BBBZ
UPDATE t1
SET c1 = 'aAaAaAaA'
WHERE c1 = 'BBBZ'
ORDER BY c1
LIMIT 2;
SELECT * FROM t1 ORDER BY c1;
c1

 a 
!@#$%^&*()
012345678912345
AAAAAAA
BBBBBBBB
BBBZ
BBBZ
BBBZxxxx 
CCCCCCCCC
aAaAaAaA
aAaAaAaA
aAaAaAaA
aaaaaaaaa
bbbbbbbbb
cccccccc
nrb0
DELETE FROM t1
WHERE c1 = 'BBBZ'
ORDER BY c1;
SELECT * FROM t1 ORDER BY c1;
c1

 a 
!@#$%^&*()
012345678912345
AAAAAAA
BBBBBBBB
BBBZxxxx 
CCCCCCCCC
aAaAaAaA
aAaAaAaA
aAaAaAaA
aaaaaaaaa
bbbbbbbbb
cccccccc
nrb0
DROP TABLE t1;
DROP TABLE IF EXISTS t1;
CREATE TABLE t1(c1 VARCHAR(15) NULL )
DEFAULT CHARACTER SET utf8 COLLATE utf8_bin
ENGINE=cloud;
INSERT INTO t1 VALUES
('AAAAAAA'),
('aaaaaaaaa'),
('BBBBBBBB'),
('bbbbbbbbb'),
('cccccccc'),
('CCCCCCCCC'),
('aAaAaAaA'),
('012345678912345'),
('BBBZxxxx '),
('!@#$%^&*()'),
('nrb0'),
(' a '),
(''),
('BBBZ'),
(NULL),
(NULL),
(NULL),
(NULL);
SELECT * FROM t1 WHERE c1 IS     NULL ORDER BY c1 ASC;
c1
NULL
NULL
NULL
NULL
SELECT * FROM t1 WHERE c1 IS NOT NULL ORDER BY c1 DESC;
c1
nrb0
cccccccc
bbbbbbbbb
aaaaaaaaa
aAaAaAaA
CCCCCCCCC
BBBZxxxx 
BBBZ
BBBBBBBB
AAAAAAA
012345678912345
!@#$%^&*()
 a 

SELECT * FROM t1 WHERE c1 IS     NULL ORDER BY c1 ASC;
c1
NULL
NULL
NULL
NULL
SELECT * FROM t1 WHERE c1 IS NOT NULL ORDER BY c1 DESC;
c1
nrb0
cccccccc
bbbbbbbbb
aaaaaaaaa
aAaAaAaA
CCCCCCCCC
BBBZxxxx 
BBBZ
BBBBBBBB
AAAAAAA
012345678912345
!@#$%^&*()
 a 

UPDATE t1
SET c1 = 'BBBZ'
WHERE c1 IS NULL
LIMIT 2;
SELECT * FROM t1 ORDER BY c1;
c1
NULL
NULL

 a 
!@#$%^&*()
012345678912345
AAAAAAA
BBBBBBBB
BBBZ
BBBZ
BBBZ
BBBZxxxx 
CCCCCCCCC
aAaAaAaA
aaaaaaaaa
bbbbbbbbb
cccccccc
nrb0
DELETE FROM t1
WHERE c1 IS NULL
ORDER BY c1;
SELECT * FROM t1 ORDER BY c1;
c1

 a 
!@#$%^&*()
012345678912345
AAAAAAA
BBBBBBBB
BBBZ
BBBZ
BBBZ
BBBZxxxx 
CCCCCCCCC
aAaAaAaA
aaaaaaaaa
bbbbbbbbb
cccccccc
nrb0
DROP TABLE IF EXISTS t1;
CREATE TABLE t1(c1 VARCHAR(15) NULL )
DEFAULT CHARACTER SET utf8 COLLATE utf8_bin
ENGINE=cloud;
INSERT INTO t1 VALUES
('AAAAAAA'),
('aaaaaaaaa'),
('BBBBBBBB'),
('bbbbbbbbb'),
('cccccccc'),
('CCCCCCCCC'),
('aAaAaAaA'),
('012345678912345'),
('BBBZxxxx '),
('!@#$%^&*()'),
('nrb0'),
(' a '),
(''),
('BBBZ'),
('BBBZ'),
('BBBZ'),
('BBBZ');
SELECT * FROM t1 ORDER BY c1 ASC;
c1

 a 
!@#$%^&*()
012345678912345
AAAAAAA
BBBBBBBB
BBBZ
BBBZ
BBBZ
BBBZ
BBBZxxxx 
CCCCCCCCC
aAaAaAaA
aaaaaaaaa
bbbbbbbbb
cccccccc
nrb0
SELECT * FROM t1 ORDER BY c1 DESC;
c1
nrb0
cccccccc
bbbbbbbbb
aaaaaaaaa
aAaAaAaA
CCCCCCCCC
BBBZxxxx 
BBBZ
BBBZ
BBBZ
BBBZ
BBBBBBBB
AAAAAAA
012345678912345
!@#$%^&*()
 a 

SELECT * FROM t1 WHERE c1 >  'BBBZ' ORDER BY c1 ASC;
c1
BBBZxxxx 
CCCCCCCCC
aAaAaAaA
aaaaaaaaa
bbbbbbbbb
cccccccc
nrb0
SELECT * FROM t1 WHERE c1 >= 'BBBZ' ORDER BY c1 ASC;
c1
BBBZ
BBBZ
BBBZ
BBBZ
BBBZxxxx 
CCCCCCCCC
aAaAaAaA
aaaaaaaaa
bbbbbbbbb
cccccccc
nrb0
SELECT * FROM t1 WHERE c1 <  'BBBZ' ORDER BY c1 ASC;
c1

 a 
!@#$%^&*()
012345678912345
AAAAAAA
BBBBBBBB
SELECT * FROM t1 WHERE c1 <= 'BBBZ' ORDER BY c1 ASC;
c1

 a 
!@#$%^&*()
012345678912345
AAAAAAA
BBBBBBBB
BBBZ
BBBZ
BBBZ
BBBZ
SELECT * FROM t1 WHERE c1 =  'BBBZ' ORDER BY c1 ASC;
c1
BBBZ
BBBZ
BBBZ
BBBZ
SELECT * FROM t1 WHERE c1 >  'BBBZ' ORDER BY c1 DESC;
c1
nrb0
cccccccc
bbbbbbbbb
aaaaaaaaa
aAaAaAaA
CCCCCCCCC
BBBZxxxx 
SELECT * FROM t1 WHERE c1 >= 'BBBZ' ORDER BY c1 DESC;
c1
nrb0
cccccccc
bbbbbbbbb
aaaaaaaaa
aAaAaAaA
CCCCCCCCC
BBBZxxxx 
BBBZ
BBBZ
BBBZ
BBBZ
SELECT * FROM t1 WHERE c1 <  'BBBZ' ORDER BY c1 DESC;
c1
BBBBBBBB
AAAAAAA
012345678912345
!@#$%^&*()
 a 

SELECT * FROM t1 WHERE c1 <= 'BBBZ' ORDER BY c1 DESC;
c1
BBBZ
BBBZ
BBBZ
BBBZ
BBBBBBBB
AAAAAAA
012345678912345
!@#$%^&*()
 a 

SELECT * FROM t1 WHERE c1 =  'BBBZ' ORDER BY c1 DESC;
c1
BBBZ
BBBZ
BBBZ
BBBZ
UPDATE t1
SET c1 = 'aAaAaAaA'
WHERE c1 = 'BBBZ'
ORDER BY c1
LIMIT 2;
SELECT * FROM t1 ORDER BY c1;
c1

 a 
!@#$%^&*()
012345678912345
AAAAAAA
BBBBBBBB
BBBZ
BBBZ
BBBZxxxx 
CCCCCCCCC
aAaAaAaA
aAaAaAaA
aAaAaAaA
aaaaaaaaa
bbbbbbbbb
cccccccc
nrb0
DELETE FROM t1
WHERE c1 = 'BBBZ'
ORDER BY c1;
SELECT * FROM t1 ORDER BY c1;
c1

 a 
!@#$%^&*()
012345678912345
AAAAAAA
BBBBBBBB
BBBZxxxx 
CCCCCCCCC
aAaAaAaA
aAaAaAaA
aAaAaAaA
aaaaaaaaa
bbbbbbbbb
cccccccc
nrb0
DROP TABLE t1;
DROP TABLE IF EXISTS t1;
CREATE TABLE t1(c1 VARCHAR(15) NOT NULL , INDEX(c1))
DEFAULT CHARACTER SET utf8 COLLATE utf8_bin
ENGINE=cloud;
INSERT INTO t1 VALUES
('AAAAAAA'),
('aaaaaaaaa'),
('BBBBBBBB'),
('bbbbbbbbb'),
('cccccccc'),
('CCCCCCCCC'),
('aAaAaAaA'),
('012345678912345'),
('BBBZxxxx '),
('!@#$%^&*()'),
('nrb0'),
(' a '),
(''),
('BBBZ'),
('BBBZ'),
('BBBZ'),
('BBBZ');
SELECT * FROM t1 ORDER BY c1 ASC;
c1

 a 
!@#$%^&*()
012345678912345
AAAAAAA
BBBBBBBB
BBBZ
BBBZ
BBBZ
BBBZ
BBBZxxxx 
CCCCCCCCC
aAaAaAaA
aaaaaaaaa
bbbbbbbbb
cccccccc
nrb0
SELECT * FROM t1 ORDER BY c1 DESC;
c1
nrb0
cccccccc
bbbbbbbbb
aaaaaaaaa
aAaAaAaA
CCCCCCCCC
BBBZxxxx 
BBBZ
BBBZ
BBBZ
BBBZ
BBBBBBBB
AAAAAAA
012345678912345
!@#$%^&*()
 a 

SELECT * FROM t1 WHERE c1 >  'BBBZ' ORDER BY c1 ASC;
c1
BBBZxxxx 
CCCCCCCCC
aAaAaAaA
aaaaaaaaa
bbbbbbbbb
cccccccc
nrb0
SELECT * FROM t1 WHERE c1 >= 'BBBZ' ORDER BY c1 ASC;
c1
BBBZ
BBBZ
BBBZ
BBBZ
BBBZxxxx 
CCCCCCCCC
aAaAaAaA
aaaaaaaaa
bbbbbbbbb
cccccccc
nrb0
SELECT * FROM t1 WHERE c1 <  'BBBZ' ORDER BY c1 ASC;
c1

 a 
!@#$%^&*()
012345678912345
AAAAAAA
BBBBBBBB
SELECT * FROM t1 WHERE c1 <= 'BBBZ' ORDER BY c1 ASC;
c1

 a 
!@#$%^&*()
012345678912345
AAAAAAA
BBBBBBBB
BBBZ
BBBZ
BBBZ
BBBZ
SELECT * FROM t1 WHERE c1 =  'BBBZ' ORDER BY c1 ASC;
c1
BBBZ
BBBZ
BBBZ
BBBZ
SELECT * FROM t1 WHERE c1 >  'BBBZ' ORDER BY c1 DESC;
c1
nrb0
cccccccc
bbbbbbbbb
aaaaaaaaa
aAaAaAaA
CCCCCCCCC
BBBZxxxx 
SELECT * FROM t1 WHERE c1 >= 'BBBZ' ORDER BY c1 DESC;
c1
nrb0
cccccccc
bbbbbbbbb
aaaaaaaaa
aAaAaAaA
CCCCCCCCC
BBBZxxxx 
BBBZ
BBBZ
BBBZ
BBBZ
SELECT * FROM t1 WHERE c1 <  'BBBZ' ORDER BY c1 DESC;
c1
BBBBBBBB
AAAAAAA
012345678912345
!@#$%^&*()
 a 

SELECT * FROM t1 WHERE c1 <= 'BBBZ' ORDER BY c1 DESC;
c1
BBBZ
BBBZ
BBBZ
BBBZ
BBBBBBBB
AAAAAAA
012345678912345
!@#$%^&*()
 a 

SELECT * FROM t1 WHERE c1 =  'BBBZ' ORDER BY c1 DESC;
c1
BBBZ
BBBZ
BBBZ
BBBZ
UPDATE t1
SET c1 = 'aAaAaAaA'
WHERE c1 = 'BBBZ'
ORDER BY c1
LIMIT 2;
SELECT * FROM t1 ORDER BY c1;
c1

 a 
!@#$%^&*()
012345678912345
AAAAAAA
BBBBBBBB
BBBZ
BBBZ
BBBZxxxx 
CCCCCCCCC
aAaAaAaA
aAaAaAaA
aAaAaAaA
aaaaaaaaa
bbbbbbbbb
cccccccc
nrb0
DELETE FROM t1
WHERE c1 = 'BBBZ'
ORDER BY c1;
SELECT * FROM t1 ORDER BY c1;
c1

 a 
!@#$%^&*()
012345678912345
AAAAAAA
BBBBBBBB
BBBZxxxx 
CCCCCCCCC
aAaAaAaA
aAaAaAaA
aAaAaAaA
aaaaaaaaa
bbbbbbbbb
cccccccc
nrb0
DROP TABLE t1;
DROP TABLE IF EXISTS t1;
CREATE TABLE t1(c1 VARCHAR(15) NULL , INDEX(c1))
DEFAULT CHARACTER SET utf8 COLLATE utf8_bin
ENGINE=cloud;
INSERT INTO t1 VALUES
('AAAAAAA'),
('aaaaaaaaa'),
('BBBBBBBB'),
('bbbbbbbbb'),
('cccccccc'),
('CCCCCCCCC'),
('aAaAaAaA'),
('012345678912345'),
('BBBZxxxx '),
('!@#$%^&*()'),
('nrb0'),
(' a '),
(''),
('BBBZ'),
(NULL),
(NULL),
(NULL),
(NULL);
SELECT * FROM t1 WHERE c1 IS     NULL ORDER BY c1 ASC;
c1
NULL
NULL
NULL
NULL
SELECT * FROM t1 WHERE c1 IS NOT NULL ORDER BY c1 DESC;
c1
nrb0
cccccccc
bbbbbbbbb
aaaaaaaaa
aAaAaAaA
CCCCCCCCC
BBBZxxxx 
BBBZ
BBBBBBBB
AAAAAAA
012345678912345
!@#$%^&*()
 a 

SELECT * FROM t1 WHERE c1 IS     NULL ORDER BY c1 ASC;
c1
NULL
NULL
NULL
NULL
SELECT * FROM t1 WHERE c1 IS NOT NULL ORDER BY c1 DESC;
c1
nrb0
cccccccc
bbbbbbbbb
aaaaaaaaa
aAaAaAaA
CCCCCCCCC
BBBZxxxx 
BBBZ
BBBBBBBB
AAAAAAA
012345678912345
!@#$%^&*()
 a 

UPDATE t1
SET c1 = 'BBBZ'
WHERE c1 IS NULL
LIMIT 2;
SELECT * FROM t1 ORDER BY c1;
c1
NULL
NULL

 a 
!@#$%^&*()
012345678912345
AAAAAAA
BBBBBBBB
BBBZ
BBBZ
BBBZ
BBBZxxxx 
CCCCCCCCC
aAaAaAaA
aaaaaaaaa
bbbbbbbbb
cccccccc
nrb0
DELETE FROM t1
WHERE c1 IS NULL
ORDER BY c1;
SELECT * FROM t1 ORDER BY c1;
c1

 a 
!@#$%^&*()
012345678912345
AAAAAAA
BBBBBBBB
BBBZ
BBBZ
BBBZ
BBBZxxxx 
CCCCCCCCC
aAaAaAaA
aaaaaaaaa
bbbbbbbbb
cccccccc
nrb0
DROP TABLE IF EXISTS t1;
CREATE TABLE t1(c1 VARCHAR(15) NULL , INDEX(c1))
DEFAULT CHARACTER SET utf8 COLLATE utf8_bin
ENGINE=cloud;
INSERT INTO t1 VALUES
('AAAAAAA'),
('aaaaaaaaa'),
('BBBBBBBB'),
('bbbbbbbbb'),
('cccccccc'),
('CCCCCCCCC'),
('aAaAaAaA'),
('012345678912345'),
('BBBZxxxx '),
('!@#$%^&*()'),
('nrb0'),
(' a '),
(''),
('BBBZ'),
('BBBZ'),
('BBBZ'),
('BBBZ');
SELECT * FROM t1 ORDER BY c1 ASC;
c1

 a 
!@#$%^&*()
012345678912345
AAAAAAA
BBBBBBBB
BBBZ
BBBZ
BBBZ
BBBZ
BBBZxxxx 
CCCCCCCCC
aAaAaAaA
aaaaaaaaa
bbbbbbbbb
cccccccc
nrb0
SELECT * FROM t1 ORDER BY c1 DESC;
c1
nrb0
cccccccc
bbbbbbbbb
aaaaaaaaa
aAaAaAaA
CCCCCCCCC
BBBZxxxx 
BBBZ
BBBZ
BBBZ
BBBZ
BBBBBBBB
AAAAAAA
012345678912345
!@#$%^&*()
 a 

SELECT * FROM t1 WHERE c1 >  'BBBZ' ORDER BY c1 ASC;
c1
BBBZxxxx 
CCCCCCCCC
aAaAaAaA
aaaaaaaaa
bbbbbbbbb
cccccccc
nrb0
SELECT * FROM t1 WHERE c1 >= 'BBBZ' ORDER BY c1 ASC;
c1
BBBZ
BBBZ
BBBZ
BBBZ
BBBZxxxx 
CCCCCCCCC
aAaAaAaA
aaaaaaaaa
bbbbbbbbb
cccccccc
nrb0
SELECT * FROM t1 WHERE c1 <  'BBBZ' ORDER BY c1 ASC;
c1

 a 
!@#$%^&*()
012345678912345
AAAAAAA
BBBBBBBB
SELECT * FROM t1 WHERE c1 <= 'BBBZ' ORDER BY c1 ASC;
c1

 a 
!@#$%^&*()
012345678912345
AAAAAAA
BBBBBBBB
BBBZ
BBBZ
BBBZ
BBBZ
SELECT * FROM t1 WHERE c1 =  'BBBZ' ORDER BY c1 ASC;
c1
BBBZ
BBBZ
BBBZ
BBBZ
SELECT * FROM t1 WHERE c1 >  'BBBZ' ORDER BY c1 DESC;
c1
nrb0
cccccccc
bbbbbbbbb
aaaaaaaaa
aAaAaAaA
CCCCCCCCC
BBBZxxxx 
SELECT * FROM t1 WHERE c1 >= 'BBBZ' ORDER BY c1 DESC;
c1
nrb0
cccccccc
bbbbbbbbb
aaaaaaaaa
aAaAaAaA
CCCCCCCCC
BBBZxxxx 
BBBZ
BBBZ
BBBZ
BBBZ
SELECT * FROM t1 WHERE c1 <  'BBBZ' ORDER BY c1 DESC;
c1
BBBBBBBB
AAAAAAA
012345678912345
!@#$%^&*()
 a 

SELECT * FROM t1 WHERE c1 <= 'BBBZ' ORDER BY c1 DESC;
c1
BBBZ
BBBZ
BBBZ
BBBZ
BBBBBBBB
AAAAAAA
012345678912345
!@#$%^&*()
 a 

SELECT * FROM t1 WHERE c1 =  'BBBZ' ORDER BY c1 DESC;
c1
BBBZ
BBBZ
BBBZ
BBBZ
UPDATE t1
SET c1 = 'aAaAaAaA'
WHERE c1 = 'BBBZ'
ORDER BY c1
LIMIT 2;
SELECT * FROM t1 ORDER BY c1;
c1

 a 
!@#$%^&*()
012345678912345
AAAAAAA
BBBBBBBB
BBBZ
BBBZ
BBBZxxxx 
CCCCCCCCC
aAaAaAaA
aAaAaAaA
aAaAaAaA
aaaaaaaaa
bbbbbbbbb
cccccccc
nrb0
DELETE FROM t1
WHERE c1 = 'BBBZ'
ORDER BY c1;
SELECT * FROM t1 ORDER BY c1;
c1

 a 
!@#$%^&*()
012345678912345
AAAAAAA
BBBBBBBB
BBBZxxxx 
CCCCCCCCC
aAaAaAaA
aAaAaAaA
aAaAaAaA
aaaaaaaaa
bbbbbbbbb
cccccccc
nrb0
DROP TABLE t1;
