DROP TABLE IF EXISTS t1;
CREATE TABLE t1(c1 YEAR NOT NULL )
ENGINE=cloud;
INSERT INTO t1 VALUES
('1955'),
('1956'),
('1957'),
('1959'),
('1961'),
('1962'),
('2012'),
('1901'),
('2155'),
('0'),
('69'),
('70'),
('2121'),
('1958'),
('1958'),
('1958'),
('1958');
SELECT * FROM t1 ORDER BY c1 ASC;
c1
1901
1955
1956
1957
1958
1958
1958
1958
1959
1961
1962
1970
2000
2012
2069
2121
2155
SELECT * FROM t1 ORDER BY c1 DESC;
c1
2155
2121
2069
2012
2000
1970
1962
1961
1959
1958
1958
1958
1958
1957
1956
1955
1901
SELECT * FROM t1 WHERE c1 >  '1958' ORDER BY c1 ASC;
c1
1959
1961
1962
1970
2000
2012
2069
2121
2155
SELECT * FROM t1 WHERE c1 >= '1958' ORDER BY c1 ASC;
c1
1958
1958
1958
1958
1959
1961
1962
1970
2000
2012
2069
2121
2155
SELECT * FROM t1 WHERE c1 <  '1958' ORDER BY c1 ASC;
c1
1901
1955
1956
1957
SELECT * FROM t1 WHERE c1 <= '1958' ORDER BY c1 ASC;
c1
1901
1955
1956
1957
1958
1958
1958
1958
SELECT * FROM t1 WHERE c1 =  '1958' ORDER BY c1 ASC;
c1
1958
1958
1958
1958
SELECT * FROM t1 WHERE c1 >  '1958' ORDER BY c1 DESC;
c1
2155
2121
2069
2012
2000
1970
1962
1961
1959
SELECT * FROM t1 WHERE c1 >= '1958' ORDER BY c1 DESC;
c1
2155
2121
2069
2012
2000
1970
1962
1961
1959
1958
1958
1958
1958
SELECT * FROM t1 WHERE c1 <  '1958' ORDER BY c1 DESC;
c1
1957
1956
1955
1901
SELECT * FROM t1 WHERE c1 <= '1958' ORDER BY c1 DESC;
c1
1958
1958
1958
1958
1957
1956
1955
1901
SELECT * FROM t1 WHERE c1 =  '1958' ORDER BY c1 DESC;
c1
1958
1958
1958
1958
UPDATE t1
SET c1 = '2012'
WHERE c1 = '1958'
ORDER BY c1
LIMIT 2;
SELECT * FROM t1 ORDER BY c1;
c1
1901
1955
1956
1957
1958
1958
1959
1961
1962
1970
2000
2012
2012
2012
2069
2121
2155
DELETE FROM t1
WHERE c1 = '1958'
ORDER BY c1;
SELECT * FROM t1 ORDER BY c1;
c1
1901
1955
1956
1957
1959
1961
1962
1970
2000
2012
2012
2012
2069
2121
2155
DROP TABLE t1;
CREATE TABLE t1(c1 YEAR NOT NULL, c2 YEAR NOT NULL )
ENGINE=cloud;
INSERT INTO t1 VALUES
('1958', '1955'),
('1958', '1956'),
('1958', '1957'),
('1958', '1959'),
('1958', '1961'),
('1958', '1962'),
('1958', '2012'),
('1958', '1901'),
('1958', '2155'),
('1958', '0'),
('1958', '69'),
('1958', '70'),
('1958', '2121'),
('1958', '1958'),
('1958', '1958'),
('1958', '1958'),
('1958', '1958');
SELECT * FROM t1 WHERE c1 = '1958' AND c2 > '1958' ORDER BY c2 ASC;
c1	c2
1958	1959
1958	1961
1958	1962
1958	1970
1958	2000
1958	2012
1958	2069
1958	2121
1958	2155
SELECT * FROM t1 WHERE c1 = '1958' AND c2 >= '1958' ORDER BY c2 ASC;
c1	c2
1958	1958
1958	1958
1958	1958
1958	1958
1958	1959
1958	1961
1958	1962
1958	1970
1958	2000
1958	2012
1958	2069
1958	2121
1958	2155
SELECT * FROM t1 WHERE c1 = '1958' AND c2 < '1958' ORDER BY c2 ASC;
c1	c2
1958	1901
1958	1955
1958	1956
1958	1957
SELECT * FROM t1 WHERE c1 = '1958' AND c2 <= '1958' ORDER BY c2 ASC;
c1	c2
1958	1901
1958	1955
1958	1956
1958	1957
1958	1958
1958	1958
1958	1958
1958	1958
SELECT * FROM t1 WHERE c1 = '1958' AND c2 > '1958' ORDER BY c2 DESC;
c1	c2
1958	2155
1958	2121
1958	2069
1958	2012
1958	2000
1958	1970
1958	1962
1958	1961
1958	1959
SELECT * FROM t1 WHERE c1 = '1958' AND c2 >= '1958' ORDER BY c2 DESC;
c1	c2
1958	2155
1958	2121
1958	2069
1958	2012
1958	2000
1958	1970
1958	1962
1958	1961
1958	1959
1958	1958
1958	1958
1958	1958
1958	1958
SELECT * FROM t1 WHERE c1 = '1958' AND c2 < '1958' ORDER BY c2 DESC;
c1	c2
1958	1957
1958	1956
1958	1955
1958	1901
SELECT * FROM t1 WHERE c1 = '1958' AND c2 <= '1958' ORDER BY c2 DESC;
c1	c2
1958	1958
1958	1958
1958	1958
1958	1958
1958	1957
1958	1956
1958	1955
1958	1901
DROP TABLE t1;
DROP TABLE IF EXISTS t1;
CREATE TABLE t1(c1 YEAR NULL )
ENGINE=cloud;
INSERT INTO t1 VALUES
('1955'),
('1956'),
('1957'),
('1959'),
('1961'),
('1962'),
('2012'),
('1901'),
('2155'),
('0'),
('69'),
('70'),
('2121'),
('1958'),
(NULL),
(NULL),
(NULL),
(NULL);
SELECT * FROM t1 WHERE c1 IS     NULL ORDER BY c1 ASC;
c1
NULL
NULL
NULL
NULL
SELECT * FROM t1 WHERE c1 IS NOT NULL ORDER BY c1 DESC;
c1
2155
2121
2069
2012
2000
1970
1962
1961
1959
1958
1957
1956
1955
1901
SELECT * FROM t1 WHERE c1 IS     NULL ORDER BY c1 ASC;
c1
NULL
NULL
NULL
NULL
SELECT * FROM t1 WHERE c1 IS NOT NULL ORDER BY c1 DESC;
c1
2155
2121
2069
2012
2000
1970
1962
1961
1959
1958
1957
1956
1955
1901
UPDATE t1
SET c1 = '1958'
WHERE c1 IS NULL
LIMIT 2;
SELECT * FROM t1 ORDER BY c1;
c1
NULL
NULL
1901
1955
1956
1957
1958
1958
1958
1959
1961
1962
1970
2000
2012
2069
2121
2155
DELETE FROM t1
WHERE c1 IS NULL
ORDER BY c1;
SELECT * FROM t1 ORDER BY c1;
c1
1901
1955
1956
1957
1958
1958
1958
1959
1961
1962
1970
2000
2012
2069
2121
2155
DROP TABLE t1;
CREATE TABLE t1(c1 YEAR NULL, c2 YEAR NULL )
ENGINE=cloud;
INSERT INTO t1 VALUES
('1958', '1955'),
('1958', '1956'),
('1958', '1957'),
('1958', '1959'),
('1958', '1961'),
('1958', '1962'),
('1958', '2012'),
('1958', '1901'),
('1958', '2155'),
('1958', '0'),
('1958', '69'),
('1958', '70'),
('1958', '2121'),
('1958', NULL),
('1958', NULL),
('1958', NULL),
('1958', NULL),
('1958', '1958'),
('1958', '1958'),
('1958', '1958'),
('1958', '1958');
SELECT * FROM t1 WHERE c1 = '1958' AND c2 > '1958' ORDER BY c2 ASC;
c1	c2
1958	1959
1958	1961
1958	1962
1958	1970
1958	2000
1958	2012
1958	2069
1958	2121
1958	2155
SELECT * FROM t1 WHERE c1 = '1958' AND c2 >= '1958' ORDER BY c2 ASC;
c1	c2
1958	1958
1958	1958
1958	1958
1958	1958
1958	1959
1958	1961
1958	1962
1958	1970
1958	2000
1958	2012
1958	2069
1958	2121
1958	2155
SELECT * FROM t1 WHERE c1 = '1958' AND c2 < '1958' ORDER BY c2 ASC;
c1	c2
1958	1901
1958	1955
1958	1956
1958	1957
SELECT * FROM t1 WHERE c1 = '1958' AND c2 <= '1958' ORDER BY c2 ASC;
c1	c2
1958	1901
1958	1955
1958	1956
1958	1957
1958	1958
1958	1958
1958	1958
1958	1958
SELECT * FROM t1 WHERE c1 = '1958' AND c2 is null ORDER BY c1 ASC;
c1	c2
1958	NULL
1958	NULL
1958	NULL
1958	NULL
SELECT * FROM t1 WHERE c1 = '1958' AND c2 is not null ORDER BY c2 ASC;
c1	c2
1958	1901
1958	1955
1958	1956
1958	1957
1958	1958
1958	1958
1958	1958
1958	1958
1958	1959
1958	1961
1958	1962
1958	1970
1958	2000
1958	2012
1958	2069
1958	2121
1958	2155
SELECT * FROM t1 WHERE c1 = '1958' AND c2 > '1958' ORDER BY c2 DESC;
c1	c2
1958	2155
1958	2121
1958	2069
1958	2012
1958	2000
1958	1970
1958	1962
1958	1961
1958	1959
SELECT * FROM t1 WHERE c1 = '1958' AND c2 >= '1958' ORDER BY c2 DESC;
c1	c2
1958	2155
1958	2121
1958	2069
1958	2012
1958	2000
1958	1970
1958	1962
1958	1961
1958	1959
1958	1958
1958	1958
1958	1958
1958	1958
SELECT * FROM t1 WHERE c1 = '1958' AND c2 < '1958' ORDER BY c2 DESC;
c1	c2
1958	1957
1958	1956
1958	1955
1958	1901
SELECT * FROM t1 WHERE c1 = '1958' AND c2 <= '1958' ORDER BY c2 DESC;
c1	c2
1958	1958
1958	1958
1958	1958
1958	1958
1958	1957
1958	1956
1958	1955
1958	1901
SELECT * FROM t1 WHERE c1 = '1958' AND c2 is null ORDER BY c1 DESC;
c1	c2
1958	NULL
1958	NULL
1958	NULL
1958	NULL
SELECT * FROM t1 WHERE c1 = '1958' AND c2 is not null ORDER BY c2 DESC;
c1	c2
1958	2155
1958	2121
1958	2069
1958	2012
1958	2000
1958	1970
1958	1962
1958	1961
1958	1959
1958	1958
1958	1958
1958	1958
1958	1958
1958	1957
1958	1956
1958	1955
1958	1901
DROP TABLE t1;
DROP TABLE IF EXISTS t1;
CREATE TABLE t1(c1 YEAR NULL )
ENGINE=cloud;
INSERT INTO t1 VALUES
('1955'),
('1956'),
('1957'),
('1959'),
('1961'),
('1962'),
('2012'),
('1901'),
('2155'),
('0'),
('69'),
('70'),
('2121'),
('1958'),
('1958'),
('1958'),
('1958');
SELECT * FROM t1 ORDER BY c1 ASC;
c1
1901
1955
1956
1957
1958
1958
1958
1958
1959
1961
1962
1970
2000
2012
2069
2121
2155
SELECT * FROM t1 ORDER BY c1 DESC;
c1
2155
2121
2069
2012
2000
1970
1962
1961
1959
1958
1958
1958
1958
1957
1956
1955
1901
SELECT * FROM t1 WHERE c1 >  '1958' ORDER BY c1 ASC;
c1
1959
1961
1962
1970
2000
2012
2069
2121
2155
SELECT * FROM t1 WHERE c1 >= '1958' ORDER BY c1 ASC;
c1
1958
1958
1958
1958
1959
1961
1962
1970
2000
2012
2069
2121
2155
SELECT * FROM t1 WHERE c1 <  '1958' ORDER BY c1 ASC;
c1
1901
1955
1956
1957
SELECT * FROM t1 WHERE c1 <= '1958' ORDER BY c1 ASC;
c1
1901
1955
1956
1957
1958
1958
1958
1958
SELECT * FROM t1 WHERE c1 =  '1958' ORDER BY c1 ASC;
c1
1958
1958
1958
1958
SELECT * FROM t1 WHERE c1 >  '1958' ORDER BY c1 DESC;
c1
2155
2121
2069
2012
2000
1970
1962
1961
1959
SELECT * FROM t1 WHERE c1 >= '1958' ORDER BY c1 DESC;
c1
2155
2121
2069
2012
2000
1970
1962
1961
1959
1958
1958
1958
1958
SELECT * FROM t1 WHERE c1 <  '1958' ORDER BY c1 DESC;
c1
1957
1956
1955
1901
SELECT * FROM t1 WHERE c1 <= '1958' ORDER BY c1 DESC;
c1
1958
1958
1958
1958
1957
1956
1955
1901
SELECT * FROM t1 WHERE c1 =  '1958' ORDER BY c1 DESC;
c1
1958
1958
1958
1958
UPDATE t1
SET c1 = '2012'
WHERE c1 = '1958'
ORDER BY c1
LIMIT 2;
SELECT * FROM t1 ORDER BY c1;
c1
1901
1955
1956
1957
1958
1958
1959
1961
1962
1970
2000
2012
2012
2012
2069
2121
2155
DELETE FROM t1
WHERE c1 = '1958'
ORDER BY c1;
SELECT * FROM t1 ORDER BY c1;
c1
1901
1955
1956
1957
1959
1961
1962
1970
2000
2012
2012
2012
2069
2121
2155
DROP TABLE t1;
CREATE TABLE t1(c1 YEAR NULL, c2 YEAR NULL )
ENGINE=cloud;
INSERT INTO t1 VALUES
('1958', '1955'),
('1958', '1956'),
('1958', '1957'),
('1958', '1959'),
('1958', '1961'),
('1958', '1962'),
('1958', '2012'),
('1958', '1901'),
('1958', '2155'),
('1958', '0'),
('1958', '69'),
('1958', '70'),
('1958', '2121'),
('1958', '1958'),
('1958', '1958'),
('1958', '1958'),
('1958', '1958');
SELECT * FROM t1 WHERE c1 = '1958' AND c2 > '1958' ORDER BY c2 ASC;
c1	c2
1958	1959
1958	1961
1958	1962
1958	1970
1958	2000
1958	2012
1958	2069
1958	2121
1958	2155
SELECT * FROM t1 WHERE c1 = '1958' AND c2 >= '1958' ORDER BY c2 ASC;
c1	c2
1958	1958
1958	1958
1958	1958
1958	1958
1958	1959
1958	1961
1958	1962
1958	1970
1958	2000
1958	2012
1958	2069
1958	2121
1958	2155
SELECT * FROM t1 WHERE c1 = '1958' AND c2 < '1958' ORDER BY c2 ASC;
c1	c2
1958	1901
1958	1955
1958	1956
1958	1957
SELECT * FROM t1 WHERE c1 = '1958' AND c2 <= '1958' ORDER BY c2 ASC;
c1	c2
1958	1901
1958	1955
1958	1956
1958	1957
1958	1958
1958	1958
1958	1958
1958	1958
SELECT * FROM t1 WHERE c1 = '1958' AND c2 > '1958' ORDER BY c2 DESC;
c1	c2
1958	2155
1958	2121
1958	2069
1958	2012
1958	2000
1958	1970
1958	1962
1958	1961
1958	1959
SELECT * FROM t1 WHERE c1 = '1958' AND c2 >= '1958' ORDER BY c2 DESC;
c1	c2
1958	2155
1958	2121
1958	2069
1958	2012
1958	2000
1958	1970
1958	1962
1958	1961
1958	1959
1958	1958
1958	1958
1958	1958
1958	1958
SELECT * FROM t1 WHERE c1 = '1958' AND c2 < '1958' ORDER BY c2 DESC;
c1	c2
1958	1957
1958	1956
1958	1955
1958	1901
SELECT * FROM t1 WHERE c1 = '1958' AND c2 <= '1958' ORDER BY c2 DESC;
c1	c2
1958	1958
1958	1958
1958	1958
1958	1958
1958	1957
1958	1956
1958	1955
1958	1901
DROP TABLE t1;
DROP TABLE IF EXISTS t1;
CREATE TABLE t1(c1 YEAR NOT NULL , INDEX(c1))
ENGINE=cloud;
INSERT INTO t1 VALUES
('1955'),
('1956'),
('1957'),
('1959'),
('1961'),
('1962'),
('2012'),
('1901'),
('2155'),
('0'),
('69'),
('70'),
('2121'),
('1958'),
('1958'),
('1958'),
('1958');
SELECT * FROM t1 ORDER BY c1 ASC;
c1
1901
1955
1956
1957
1958
1958
1958
1958
1959
1961
1962
1970
2000
2012
2069
2121
2155
SELECT * FROM t1 ORDER BY c1 DESC;
c1
2155
2121
2069
2012
2000
1970
1962
1961
1959
1958
1958
1958
1958
1957
1956
1955
1901
SELECT * FROM t1 WHERE c1 >  '1958' ORDER BY c1 ASC;
c1
1959
1961
1962
1970
2000
2012
2069
2121
2155
SELECT * FROM t1 WHERE c1 >= '1958' ORDER BY c1 ASC;
c1
1958
1958
1958
1958
1959
1961
1962
1970
2000
2012
2069
2121
2155
SELECT * FROM t1 WHERE c1 <  '1958' ORDER BY c1 ASC;
c1
1901
1955
1956
1957
SELECT * FROM t1 WHERE c1 <= '1958' ORDER BY c1 ASC;
c1
1901
1955
1956
1957
1958
1958
1958
1958
SELECT * FROM t1 WHERE c1 =  '1958' ORDER BY c1 ASC;
c1
1958
1958
1958
1958
SELECT * FROM t1 WHERE c1 >  '1958' ORDER BY c1 DESC;
c1
2155
2121
2069
2012
2000
1970
1962
1961
1959
SELECT * FROM t1 WHERE c1 >= '1958' ORDER BY c1 DESC;
c1
2155
2121
2069
2012
2000
1970
1962
1961
1959
1958
1958
1958
1958
SELECT * FROM t1 WHERE c1 <  '1958' ORDER BY c1 DESC;
c1
1957
1956
1955
1901
SELECT * FROM t1 WHERE c1 <= '1958' ORDER BY c1 DESC;
c1
1958
1958
1958
1958
1957
1956
1955
1901
SELECT * FROM t1 WHERE c1 =  '1958' ORDER BY c1 DESC;
c1
1958
1958
1958
1958
UPDATE t1
SET c1 = '2012'
WHERE c1 = '1958'
ORDER BY c1
LIMIT 2;
SELECT * FROM t1 ORDER BY c1;
c1
1901
1955
1956
1957
1958
1958
1959
1961
1962
1970
2000
2012
2012
2012
2069
2121
2155
DELETE FROM t1
WHERE c1 = '1958'
ORDER BY c1;
SELECT * FROM t1 ORDER BY c1;
c1
1901
1955
1956
1957
1959
1961
1962
1970
2000
2012
2012
2012
2069
2121
2155
DROP TABLE t1;
CREATE TABLE t1(c1 YEAR NOT NULL, c2 YEAR NOT NULL , INDEX(c1, c2))
ENGINE=cloud;
INSERT INTO t1 VALUES
('1958', '1955'),
('1958', '1956'),
('1958', '1957'),
('1958', '1959'),
('1958', '1961'),
('1958', '1962'),
('1958', '2012'),
('1958', '1901'),
('1958', '2155'),
('1958', '0'),
('1958', '69'),
('1958', '70'),
('1958', '2121'),
('1958', '1958'),
('1958', '1958'),
('1958', '1958'),
('1958', '1958');
SELECT * FROM t1 WHERE c1 = '1958' AND c2 > '1958' ORDER BY c2 ASC;
c1	c2
1958	1959
1958	1961
1958	1962
1958	1970
1958	2000
1958	2012
1958	2069
1958	2121
1958	2155
SELECT * FROM t1 WHERE c1 = '1958' AND c2 >= '1958' ORDER BY c2 ASC;
c1	c2
1958	1958
1958	1958
1958	1958
1958	1958
1958	1959
1958	1961
1958	1962
1958	1970
1958	2000
1958	2012
1958	2069
1958	2121
1958	2155
SELECT * FROM t1 WHERE c1 = '1958' AND c2 < '1958' ORDER BY c2 ASC;
c1	c2
1958	1901
1958	1955
1958	1956
1958	1957
SELECT * FROM t1 WHERE c1 = '1958' AND c2 <= '1958' ORDER BY c2 ASC;
c1	c2
1958	1901
1958	1955
1958	1956
1958	1957
1958	1958
1958	1958
1958	1958
1958	1958
SELECT * FROM t1 WHERE c1 = '1958' AND c2 > '1958' ORDER BY c2 DESC;
c1	c2
1958	2155
1958	2121
1958	2069
1958	2012
1958	2000
1958	1970
1958	1962
1958	1961
1958	1959
SELECT * FROM t1 WHERE c1 = '1958' AND c2 >= '1958' ORDER BY c2 DESC;
c1	c2
1958	2155
1958	2121
1958	2069
1958	2012
1958	2000
1958	1970
1958	1962
1958	1961
1958	1959
1958	1958
1958	1958
1958	1958
1958	1958
SELECT * FROM t1 WHERE c1 = '1958' AND c2 < '1958' ORDER BY c2 DESC;
c1	c2
1958	1957
1958	1956
1958	1955
1958	1901
SELECT * FROM t1 WHERE c1 = '1958' AND c2 <= '1958' ORDER BY c2 DESC;
c1	c2
1958	1958
1958	1958
1958	1958
1958	1958
1958	1957
1958	1956
1958	1955
1958	1901
DROP TABLE t1;
DROP TABLE IF EXISTS t1;
CREATE TABLE t1(c1 YEAR NULL , INDEX(c1))
ENGINE=cloud;
INSERT INTO t1 VALUES
('1955'),
('1956'),
('1957'),
('1959'),
('1961'),
('1962'),
('2012'),
('1901'),
('2155'),
('0'),
('69'),
('70'),
('2121'),
('1958'),
(NULL),
(NULL),
(NULL),
(NULL);
SELECT * FROM t1 WHERE c1 IS     NULL ORDER BY c1 ASC;
c1
NULL
NULL
NULL
NULL
SELECT * FROM t1 WHERE c1 IS NOT NULL ORDER BY c1 DESC;
c1
2155
2121
2069
2012
2000
1970
1962
1961
1959
1958
1957
1956
1955
1901
SELECT * FROM t1 WHERE c1 IS     NULL ORDER BY c1 ASC;
c1
NULL
NULL
NULL
NULL
SELECT * FROM t1 WHERE c1 IS NOT NULL ORDER BY c1 DESC;
c1
2155
2121
2069
2012
2000
1970
1962
1961
1959
1958
1957
1956
1955
1901
UPDATE t1
SET c1 = '1958'
WHERE c1 IS NULL
LIMIT 2;
SELECT * FROM t1 ORDER BY c1;
c1
NULL
NULL
1901
1955
1956
1957
1958
1958
1958
1959
1961
1962
1970
2000
2012
2069
2121
2155
DELETE FROM t1
WHERE c1 IS NULL
ORDER BY c1;
SELECT * FROM t1 ORDER BY c1;
c1
1901
1955
1956
1957
1958
1958
1958
1959
1961
1962
1970
2000
2012
2069
2121
2155
DROP TABLE t1;
CREATE TABLE t1(c1 YEAR NULL, c2 YEAR NULL , INDEX(c1, c2))
ENGINE=cloud;
INSERT INTO t1 VALUES
('1958', '1955'),
('1958', '1956'),
('1958', '1957'),
('1958', '1959'),
('1958', '1961'),
('1958', '1962'),
('1958', '2012'),
('1958', '1901'),
('1958', '2155'),
('1958', '0'),
('1958', '69'),
('1958', '70'),
('1958', '2121'),
('1958', NULL),
('1958', NULL),
('1958', NULL),
('1958', NULL),
('1958', '1958'),
('1958', '1958'),
('1958', '1958'),
('1958', '1958');
SELECT * FROM t1 WHERE c1 = '1958' AND c2 > '1958' ORDER BY c2 ASC;
c1	c2
1958	1959
1958	1961
1958	1962
1958	1970
1958	2000
1958	2012
1958	2069
1958	2121
1958	2155
SELECT * FROM t1 WHERE c1 = '1958' AND c2 >= '1958' ORDER BY c2 ASC;
c1	c2
1958	1958
1958	1958
1958	1958
1958	1958
1958	1959
1958	1961
1958	1962
1958	1970
1958	2000
1958	2012
1958	2069
1958	2121
1958	2155
SELECT * FROM t1 WHERE c1 = '1958' AND c2 < '1958' ORDER BY c2 ASC;
c1	c2
1958	1901
1958	1955
1958	1956
1958	1957
SELECT * FROM t1 WHERE c1 = '1958' AND c2 <= '1958' ORDER BY c2 ASC;
c1	c2
1958	1901
1958	1955
1958	1956
1958	1957
1958	1958
1958	1958
1958	1958
1958	1958
SELECT * FROM t1 WHERE c1 = '1958' AND c2 is null ORDER BY c1 ASC;
c1	c2
1958	NULL
1958	NULL
1958	NULL
1958	NULL
SELECT * FROM t1 WHERE c1 = '1958' AND c2 is not null ORDER BY c2 ASC;
c1	c2
1958	1901
1958	1955
1958	1956
1958	1957
1958	1958
1958	1958
1958	1958
1958	1958
1958	1959
1958	1961
1958	1962
1958	1970
1958	2000
1958	2012
1958	2069
1958	2121
1958	2155
SELECT * FROM t1 WHERE c1 = '1958' AND c2 > '1958' ORDER BY c2 DESC;
c1	c2
1958	2155
1958	2121
1958	2069
1958	2012
1958	2000
1958	1970
1958	1962
1958	1961
1958	1959
SELECT * FROM t1 WHERE c1 = '1958' AND c2 >= '1958' ORDER BY c2 DESC;
c1	c2
1958	2155
1958	2121
1958	2069
1958	2012
1958	2000
1958	1970
1958	1962
1958	1961
1958	1959
1958	1958
1958	1958
1958	1958
1958	1958
SELECT * FROM t1 WHERE c1 = '1958' AND c2 < '1958' ORDER BY c2 DESC;
c1	c2
1958	1957
1958	1956
1958	1955
1958	1901
SELECT * FROM t1 WHERE c1 = '1958' AND c2 <= '1958' ORDER BY c2 DESC;
c1	c2
1958	1958
1958	1958
1958	1958
1958	1958
1958	1957
1958	1956
1958	1955
1958	1901
SELECT * FROM t1 WHERE c1 = '1958' AND c2 is null ORDER BY c1 DESC;
c1	c2
1958	NULL
1958	NULL
1958	NULL
1958	NULL
SELECT * FROM t1 WHERE c1 = '1958' AND c2 is not null ORDER BY c2 DESC;
c1	c2
1958	2155
1958	2121
1958	2069
1958	2012
1958	2000
1958	1970
1958	1962
1958	1961
1958	1959
1958	1958
1958	1958
1958	1958
1958	1958
1958	1957
1958	1956
1958	1955
1958	1901
DROP TABLE t1;
DROP TABLE IF EXISTS t1;
CREATE TABLE t1(c1 YEAR NULL , INDEX(c1))
ENGINE=cloud;
INSERT INTO t1 VALUES
('1955'),
('1956'),
('1957'),
('1959'),
('1961'),
('1962'),
('2012'),
('1901'),
('2155'),
('0'),
('69'),
('70'),
('2121'),
('1958'),
('1958'),
('1958'),
('1958');
SELECT * FROM t1 ORDER BY c1 ASC;
c1
1901
1955
1956
1957
1958
1958
1958
1958
1959
1961
1962
1970
2000
2012
2069
2121
2155
SELECT * FROM t1 ORDER BY c1 DESC;
c1
2155
2121
2069
2012
2000
1970
1962
1961
1959
1958
1958
1958
1958
1957
1956
1955
1901
SELECT * FROM t1 WHERE c1 >  '1958' ORDER BY c1 ASC;
c1
1959
1961
1962
1970
2000
2012
2069
2121
2155
SELECT * FROM t1 WHERE c1 >= '1958' ORDER BY c1 ASC;
c1
1958
1958
1958
1958
1959
1961
1962
1970
2000
2012
2069
2121
2155
SELECT * FROM t1 WHERE c1 <  '1958' ORDER BY c1 ASC;
c1
1901
1955
1956
1957
SELECT * FROM t1 WHERE c1 <= '1958' ORDER BY c1 ASC;
c1
1901
1955
1956
1957
1958
1958
1958
1958
SELECT * FROM t1 WHERE c1 =  '1958' ORDER BY c1 ASC;
c1
1958
1958
1958
1958
SELECT * FROM t1 WHERE c1 >  '1958' ORDER BY c1 DESC;
c1
2155
2121
2069
2012
2000
1970
1962
1961
1959
SELECT * FROM t1 WHERE c1 >= '1958' ORDER BY c1 DESC;
c1
2155
2121
2069
2012
2000
1970
1962
1961
1959
1958
1958
1958
1958
SELECT * FROM t1 WHERE c1 <  '1958' ORDER BY c1 DESC;
c1
1957
1956
1955
1901
SELECT * FROM t1 WHERE c1 <= '1958' ORDER BY c1 DESC;
c1
1958
1958
1958
1958
1957
1956
1955
1901
SELECT * FROM t1 WHERE c1 =  '1958' ORDER BY c1 DESC;
c1
1958
1958
1958
1958
UPDATE t1
SET c1 = '2012'
WHERE c1 = '1958'
ORDER BY c1
LIMIT 2;
SELECT * FROM t1 ORDER BY c1;
c1
1901
1955
1956
1957
1958
1958
1959
1961
1962
1970
2000
2012
2012
2012
2069
2121
2155
DELETE FROM t1
WHERE c1 = '1958'
ORDER BY c1;
SELECT * FROM t1 ORDER BY c1;
c1
1901
1955
1956
1957
1959
1961
1962
1970
2000
2012
2012
2012
2069
2121
2155
DROP TABLE t1;
CREATE TABLE t1(c1 YEAR NULL, c2 YEAR NULL , INDEX(c1, c2))
ENGINE=cloud;
INSERT INTO t1 VALUES
('1958', '1955'),
('1958', '1956'),
('1958', '1957'),
('1958', '1959'),
('1958', '1961'),
('1958', '1962'),
('1958', '2012'),
('1958', '1901'),
('1958', '2155'),
('1958', '0'),
('1958', '69'),
('1958', '70'),
('1958', '2121'),
('1958', '1958'),
('1958', '1958'),
('1958', '1958'),
('1958', '1958');
SELECT * FROM t1 WHERE c1 = '1958' AND c2 > '1958' ORDER BY c2 ASC;
c1	c2
1958	1959
1958	1961
1958	1962
1958	1970
1958	2000
1958	2012
1958	2069
1958	2121
1958	2155
SELECT * FROM t1 WHERE c1 = '1958' AND c2 >= '1958' ORDER BY c2 ASC;
c1	c2
1958	1958
1958	1958
1958	1958
1958	1958
1958	1959
1958	1961
1958	1962
1958	1970
1958	2000
1958	2012
1958	2069
1958	2121
1958	2155
SELECT * FROM t1 WHERE c1 = '1958' AND c2 < '1958' ORDER BY c2 ASC;
c1	c2
1958	1901
1958	1955
1958	1956
1958	1957
SELECT * FROM t1 WHERE c1 = '1958' AND c2 <= '1958' ORDER BY c2 ASC;
c1	c2
1958	1901
1958	1955
1958	1956
1958	1957
1958	1958
1958	1958
1958	1958
1958	1958
SELECT * FROM t1 WHERE c1 = '1958' AND c2 > '1958' ORDER BY c2 DESC;
c1	c2
1958	2155
1958	2121
1958	2069
1958	2012
1958	2000
1958	1970
1958	1962
1958	1961
1958	1959
SELECT * FROM t1 WHERE c1 = '1958' AND c2 >= '1958' ORDER BY c2 DESC;
c1	c2
1958	2155
1958	2121
1958	2069
1958	2012
1958	2000
1958	1970
1958	1962
1958	1961
1958	1959
1958	1958
1958	1958
1958	1958
1958	1958
SELECT * FROM t1 WHERE c1 = '1958' AND c2 < '1958' ORDER BY c2 DESC;
c1	c2
1958	1957
1958	1956
1958	1955
1958	1901
SELECT * FROM t1 WHERE c1 = '1958' AND c2 <= '1958' ORDER BY c2 DESC;
c1	c2
1958	1958
1958	1958
1958	1958
1958	1958
1958	1957
1958	1956
1958	1955
1958	1901
DROP TABLE t1;
DROP TABLE IF EXISTS t1;
CREATE TABLE t1(c1 YEAR NOT NULL )
ENGINE=cloud;
INSERT INTO t1 VALUES
('1955'),
('1956'),
('1957'),
('1959'),
('1961'),
('1962'),
('2012'),
('1901'),
('2155'),
('0'),
('69'),
('70'),
('2121'),
('1958'),
('1958'),
('1958'),
('1958');
SELECT * FROM t1 ORDER BY c1 ASC;
c1
1901
1955
1956
1957
1958
1958
1958
1958
1959
1961
1962
1970
2000
2012
2069
2121
2155
SELECT * FROM t1 ORDER BY c1 DESC;
c1
2155
2121
2069
2012
2000
1970
1962
1961
1959
1958
1958
1958
1958
1957
1956
1955
1901
SELECT * FROM t1 WHERE c1 >  '1958' ORDER BY c1 ASC;
c1
1959
1961
1962
1970
2000
2012
2069
2121
2155
SELECT * FROM t1 WHERE c1 >= '1958' ORDER BY c1 ASC;
c1
1958
1958
1958
1958
1959
1961
1962
1970
2000
2012
2069
2121
2155
SELECT * FROM t1 WHERE c1 <  '1958' ORDER BY c1 ASC;
c1
1901
1955
1956
1957
SELECT * FROM t1 WHERE c1 <= '1958' ORDER BY c1 ASC;
c1
1901
1955
1956
1957
1958
1958
1958
1958
SELECT * FROM t1 WHERE c1 =  '1958' ORDER BY c1 ASC;
c1
1958
1958
1958
1958
SELECT * FROM t1 WHERE c1 >  '1958' ORDER BY c1 DESC;
c1
2155
2121
2069
2012
2000
1970
1962
1961
1959
SELECT * FROM t1 WHERE c1 >= '1958' ORDER BY c1 DESC;
c1
2155
2121
2069
2012
2000
1970
1962
1961
1959
1958
1958
1958
1958
SELECT * FROM t1 WHERE c1 <  '1958' ORDER BY c1 DESC;
c1
1957
1956
1955
1901
SELECT * FROM t1 WHERE c1 <= '1958' ORDER BY c1 DESC;
c1
1958
1958
1958
1958
1957
1956
1955
1901
SELECT * FROM t1 WHERE c1 =  '1958' ORDER BY c1 DESC;
c1
1958
1958
1958
1958
UPDATE t1
SET c1 = '2012'
WHERE c1 = '1958'
ORDER BY c1
LIMIT 2;
SELECT * FROM t1 ORDER BY c1;
c1
1901
1955
1956
1957
1958
1958
1959
1961
1962
1970
2000
2012
2012
2012
2069
2121
2155
DELETE FROM t1
WHERE c1 = '1958'
ORDER BY c1;
SELECT * FROM t1 ORDER BY c1;
c1
1901
1955
1956
1957
1959
1961
1962
1970
2000
2012
2012
2012
2069
2121
2155
DROP TABLE t1;
CREATE TABLE t1(c1 YEAR NOT NULL, c2 YEAR NOT NULL , INDEX(c1, c2))
ENGINE=cloud;
INSERT INTO t1 VALUES
('1958', '1955'),
('1958', '1956'),
('1958', '1957'),
('1958', '1959'),
('1958', '1961'),
('1958', '1962'),
('1958', '2012'),
('1958', '1901'),
('1958', '2155'),
('1958', '0'),
('1958', '69'),
('1958', '70'),
('1958', '2121'),
('1958', '1958'),
('1958', '1958'),
('1958', '1958'),
('1958', '1958');
SELECT * FROM t1 WHERE c1 = '1958' AND c2 > '1958' ORDER BY c2 ASC;
c1	c2
1958	1959
1958	1961
1958	1962
1958	1970
1958	2000
1958	2012
1958	2069
1958	2121
1958	2155
SELECT * FROM t1 WHERE c1 = '1958' AND c2 >= '1958' ORDER BY c2 ASC;
c1	c2
1958	1958
1958	1958
1958	1958
1958	1958
1958	1959
1958	1961
1958	1962
1958	1970
1958	2000
1958	2012
1958	2069
1958	2121
1958	2155
SELECT * FROM t1 WHERE c1 = '1958' AND c2 < '1958' ORDER BY c2 ASC;
c1	c2
1958	1901
1958	1955
1958	1956
1958	1957
SELECT * FROM t1 WHERE c1 = '1958' AND c2 <= '1958' ORDER BY c2 ASC;
c1	c2
1958	1901
1958	1955
1958	1956
1958	1957
1958	1958
1958	1958
1958	1958
1958	1958
SELECT * FROM t1 WHERE c1 = '1958' AND c2 > '1958' ORDER BY c2 DESC;
c1	c2
1958	2155
1958	2121
1958	2069
1958	2012
1958	2000
1958	1970
1958	1962
1958	1961
1958	1959
SELECT * FROM t1 WHERE c1 = '1958' AND c2 >= '1958' ORDER BY c2 DESC;
c1	c2
1958	2155
1958	2121
1958	2069
1958	2012
1958	2000
1958	1970
1958	1962
1958	1961
1958	1959
1958	1958
1958	1958
1958	1958
1958	1958
SELECT * FROM t1 WHERE c1 = '1958' AND c2 < '1958' ORDER BY c2 DESC;
c1	c2
1958	1957
1958	1956
1958	1955
1958	1901
SELECT * FROM t1 WHERE c1 = '1958' AND c2 <= '1958' ORDER BY c2 DESC;
c1	c2
1958	1958
1958	1958
1958	1958
1958	1958
1958	1957
1958	1956
1958	1955
1958	1901
DROP TABLE t1;
DROP TABLE IF EXISTS t1;
CREATE TABLE t1(c1 YEAR NULL )
ENGINE=cloud;
INSERT INTO t1 VALUES
('1955'),
('1956'),
('1957'),
('1959'),
('1961'),
('1962'),
('2012'),
('1901'),
('2155'),
('0'),
('69'),
('70'),
('2121'),
('1958'),
(NULL),
(NULL),
(NULL),
(NULL);
SELECT * FROM t1 WHERE c1 IS     NULL ORDER BY c1 ASC;
c1
NULL
NULL
NULL
NULL
SELECT * FROM t1 WHERE c1 IS NOT NULL ORDER BY c1 DESC;
c1
2155
2121
2069
2012
2000
1970
1962
1961
1959
1958
1957
1956
1955
1901
SELECT * FROM t1 WHERE c1 IS     NULL ORDER BY c1 ASC;
c1
NULL
NULL
NULL
NULL
SELECT * FROM t1 WHERE c1 IS NOT NULL ORDER BY c1 DESC;
c1
2155
2121
2069
2012
2000
1970
1962
1961
1959
1958
1957
1956
1955
1901
UPDATE t1
SET c1 = '1958'
WHERE c1 IS NULL
LIMIT 2;
SELECT * FROM t1 ORDER BY c1;
c1
NULL
NULL
1901
1955
1956
1957
1958
1958
1958
1959
1961
1962
1970
2000
2012
2069
2121
2155
DELETE FROM t1
WHERE c1 IS NULL
ORDER BY c1;
SELECT * FROM t1 ORDER BY c1;
c1
1901
1955
1956
1957
1958
1958
1958
1959
1961
1962
1970
2000
2012
2069
2121
2155
DROP TABLE t1;
CREATE TABLE t1(c1 YEAR NULL, c2 YEAR NULL , INDEX(c1, c2))
ENGINE=cloud;
INSERT INTO t1 VALUES
('1958', '1955'),
('1958', '1956'),
('1958', '1957'),
('1958', '1959'),
('1958', '1961'),
('1958', '1962'),
('1958', '2012'),
('1958', '1901'),
('1958', '2155'),
('1958', '0'),
('1958', '69'),
('1958', '70'),
('1958', '2121'),
('1958', NULL),
('1958', NULL),
('1958', NULL),
('1958', NULL),
('1958', '1958'),
('1958', '1958'),
('1958', '1958'),
('1958', '1958');
SELECT * FROM t1 WHERE c1 = '1958' AND c2 > '1958' ORDER BY c2 ASC;
c1	c2
1958	1959
1958	1961
1958	1962
1958	1970
1958	2000
1958	2012
1958	2069
1958	2121
1958	2155
SELECT * FROM t1 WHERE c1 = '1958' AND c2 >= '1958' ORDER BY c2 ASC;
c1	c2
1958	1958
1958	1958
1958	1958
1958	1958
1958	1959
1958	1961
1958	1962
1958	1970
1958	2000
1958	2012
1958	2069
1958	2121
1958	2155
SELECT * FROM t1 WHERE c1 = '1958' AND c2 < '1958' ORDER BY c2 ASC;
c1	c2
1958	1901
1958	1955
1958	1956
1958	1957
SELECT * FROM t1 WHERE c1 = '1958' AND c2 <= '1958' ORDER BY c2 ASC;
c1	c2
1958	1901
1958	1955
1958	1956
1958	1957
1958	1958
1958	1958
1958	1958
1958	1958
SELECT * FROM t1 WHERE c1 = '1958' AND c2 is null ORDER BY c1 ASC;
c1	c2
1958	NULL
1958	NULL
1958	NULL
1958	NULL
SELECT * FROM t1 WHERE c1 = '1958' AND c2 is not null ORDER BY c2 ASC;
c1	c2
1958	1901
1958	1955
1958	1956
1958	1957
1958	1958
1958	1958
1958	1958
1958	1958
1958	1959
1958	1961
1958	1962
1958	1970
1958	2000
1958	2012
1958	2069
1958	2121
1958	2155
SELECT * FROM t1 WHERE c1 = '1958' AND c2 > '1958' ORDER BY c2 DESC;
c1	c2
1958	2155
1958	2121
1958	2069
1958	2012
1958	2000
1958	1970
1958	1962
1958	1961
1958	1959
SELECT * FROM t1 WHERE c1 = '1958' AND c2 >= '1958' ORDER BY c2 DESC;
c1	c2
1958	2155
1958	2121
1958	2069
1958	2012
1958	2000
1958	1970
1958	1962
1958	1961
1958	1959
1958	1958
1958	1958
1958	1958
1958	1958
SELECT * FROM t1 WHERE c1 = '1958' AND c2 < '1958' ORDER BY c2 DESC;
c1	c2
1958	1957
1958	1956
1958	1955
1958	1901
SELECT * FROM t1 WHERE c1 = '1958' AND c2 <= '1958' ORDER BY c2 DESC;
c1	c2
1958	1958
1958	1958
1958	1958
1958	1958
1958	1957
1958	1956
1958	1955
1958	1901
SELECT * FROM t1 WHERE c1 = '1958' AND c2 is null ORDER BY c1 DESC;
c1	c2
1958	NULL
1958	NULL
1958	NULL
1958	NULL
SELECT * FROM t1 WHERE c1 = '1958' AND c2 is not null ORDER BY c2 DESC;
c1	c2
1958	2155
1958	2121
1958	2069
1958	2012
1958	2000
1958	1970
1958	1962
1958	1961
1958	1959
1958	1958
1958	1958
1958	1958
1958	1958
1958	1957
1958	1956
1958	1955
1958	1901
DROP TABLE t1;
DROP TABLE IF EXISTS t1;
CREATE TABLE t1(c1 YEAR NULL )
ENGINE=cloud;
INSERT INTO t1 VALUES
('1955'),
('1956'),
('1957'),
('1959'),
('1961'),
('1962'),
('2012'),
('1901'),
('2155'),
('0'),
('69'),
('70'),
('2121'),
('1958'),
('1958'),
('1958'),
('1958');
SELECT * FROM t1 ORDER BY c1 ASC;
c1
1901
1955
1956
1957
1958
1958
1958
1958
1959
1961
1962
1970
2000
2012
2069
2121
2155
SELECT * FROM t1 ORDER BY c1 DESC;
c1
2155
2121
2069
2012
2000
1970
1962
1961
1959
1958
1958
1958
1958
1957
1956
1955
1901
SELECT * FROM t1 WHERE c1 >  '1958' ORDER BY c1 ASC;
c1
1959
1961
1962
1970
2000
2012
2069
2121
2155
SELECT * FROM t1 WHERE c1 >= '1958' ORDER BY c1 ASC;
c1
1958
1958
1958
1958
1959
1961
1962
1970
2000
2012
2069
2121
2155
SELECT * FROM t1 WHERE c1 <  '1958' ORDER BY c1 ASC;
c1
1901
1955
1956
1957
SELECT * FROM t1 WHERE c1 <= '1958' ORDER BY c1 ASC;
c1
1901
1955
1956
1957
1958
1958
1958
1958
SELECT * FROM t1 WHERE c1 =  '1958' ORDER BY c1 ASC;
c1
1958
1958
1958
1958
SELECT * FROM t1 WHERE c1 >  '1958' ORDER BY c1 DESC;
c1
2155
2121
2069
2012
2000
1970
1962
1961
1959
SELECT * FROM t1 WHERE c1 >= '1958' ORDER BY c1 DESC;
c1
2155
2121
2069
2012
2000
1970
1962
1961
1959
1958
1958
1958
1958
SELECT * FROM t1 WHERE c1 <  '1958' ORDER BY c1 DESC;
c1
1957
1956
1955
1901
SELECT * FROM t1 WHERE c1 <= '1958' ORDER BY c1 DESC;
c1
1958
1958
1958
1958
1957
1956
1955
1901
SELECT * FROM t1 WHERE c1 =  '1958' ORDER BY c1 DESC;
c1
1958
1958
1958
1958
UPDATE t1
SET c1 = '2012'
WHERE c1 = '1958'
ORDER BY c1
LIMIT 2;
SELECT * FROM t1 ORDER BY c1;
c1
1901
1955
1956
1957
1958
1958
1959
1961
1962
1970
2000
2012
2012
2012
2069
2121
2155
DELETE FROM t1
WHERE c1 = '1958'
ORDER BY c1;
SELECT * FROM t1 ORDER BY c1;
c1
1901
1955
1956
1957
1959
1961
1962
1970
2000
2012
2012
2012
2069
2121
2155
DROP TABLE t1;
CREATE TABLE t1(c1 YEAR NULL, c2 YEAR NULL , INDEX(c1, c2))
ENGINE=cloud;
INSERT INTO t1 VALUES
('1958', '1955'),
('1958', '1956'),
('1958', '1957'),
('1958', '1959'),
('1958', '1961'),
('1958', '1962'),
('1958', '2012'),
('1958', '1901'),
('1958', '2155'),
('1958', '0'),
('1958', '69'),
('1958', '70'),
('1958', '2121'),
('1958', '1958'),
('1958', '1958'),
('1958', '1958'),
('1958', '1958');
SELECT * FROM t1 WHERE c1 = '1958' AND c2 > '1958' ORDER BY c2 ASC;
c1	c2
1958	1959
1958	1961
1958	1962
1958	1970
1958	2000
1958	2012
1958	2069
1958	2121
1958	2155
SELECT * FROM t1 WHERE c1 = '1958' AND c2 >= '1958' ORDER BY c2 ASC;
c1	c2
1958	1958
1958	1958
1958	1958
1958	1958
1958	1959
1958	1961
1958	1962
1958	1970
1958	2000
1958	2012
1958	2069
1958	2121
1958	2155
SELECT * FROM t1 WHERE c1 = '1958' AND c2 < '1958' ORDER BY c2 ASC;
c1	c2
1958	1901
1958	1955
1958	1956
1958	1957
SELECT * FROM t1 WHERE c1 = '1958' AND c2 <= '1958' ORDER BY c2 ASC;
c1	c2
1958	1901
1958	1955
1958	1956
1958	1957
1958	1958
1958	1958
1958	1958
1958	1958
SELECT * FROM t1 WHERE c1 = '1958' AND c2 > '1958' ORDER BY c2 DESC;
c1	c2
1958	2155
1958	2121
1958	2069
1958	2012
1958	2000
1958	1970
1958	1962
1958	1961
1958	1959
SELECT * FROM t1 WHERE c1 = '1958' AND c2 >= '1958' ORDER BY c2 DESC;
c1	c2
1958	2155
1958	2121
1958	2069
1958	2012
1958	2000
1958	1970
1958	1962
1958	1961
1958	1959
1958	1958
1958	1958
1958	1958
1958	1958
SELECT * FROM t1 WHERE c1 = '1958' AND c2 < '1958' ORDER BY c2 DESC;
c1	c2
1958	1957
1958	1956
1958	1955
1958	1901
SELECT * FROM t1 WHERE c1 = '1958' AND c2 <= '1958' ORDER BY c2 DESC;
c1	c2
1958	1958
1958	1958
1958	1958
1958	1958
1958	1957
1958	1956
1958	1955
1958	1901
DROP TABLE t1;
DROP TABLE IF EXISTS t1;
CREATE TABLE t1(c1 YEAR NOT NULL , INDEX(c1))
ENGINE=cloud;
INSERT INTO t1 VALUES
('1955'),
('1956'),
('1957'),
('1959'),
('1961'),
('1962'),
('2012'),
('1901'),
('2155'),
('0'),
('69'),
('70'),
('2121'),
('1958'),
('1958'),
('1958'),
('1958');
SELECT * FROM t1 ORDER BY c1 ASC;
c1
1901
1955
1956
1957
1958
1958
1958
1958
1959
1961
1962
1970
2000
2012
2069
2121
2155
SELECT * FROM t1 ORDER BY c1 DESC;
c1
2155
2121
2069
2012
2000
1970
1962
1961
1959
1958
1958
1958
1958
1957
1956
1955
1901
SELECT * FROM t1 WHERE c1 >  '1958' ORDER BY c1 ASC;
c1
1959
1961
1962
1970
2000
2012
2069
2121
2155
SELECT * FROM t1 WHERE c1 >= '1958' ORDER BY c1 ASC;
c1
1958
1958
1958
1958
1959
1961
1962
1970
2000
2012
2069
2121
2155
SELECT * FROM t1 WHERE c1 <  '1958' ORDER BY c1 ASC;
c1
1901
1955
1956
1957
SELECT * FROM t1 WHERE c1 <= '1958' ORDER BY c1 ASC;
c1
1901
1955
1956
1957
1958
1958
1958
1958
SELECT * FROM t1 WHERE c1 =  '1958' ORDER BY c1 ASC;
c1
1958
1958
1958
1958
SELECT * FROM t1 WHERE c1 >  '1958' ORDER BY c1 DESC;
c1
2155
2121
2069
2012
2000
1970
1962
1961
1959
SELECT * FROM t1 WHERE c1 >= '1958' ORDER BY c1 DESC;
c1
2155
2121
2069
2012
2000
1970
1962
1961
1959
1958
1958
1958
1958
SELECT * FROM t1 WHERE c1 <  '1958' ORDER BY c1 DESC;
c1
1957
1956
1955
1901
SELECT * FROM t1 WHERE c1 <= '1958' ORDER BY c1 DESC;
c1
1958
1958
1958
1958
1957
1956
1955
1901
SELECT * FROM t1 WHERE c1 =  '1958' ORDER BY c1 DESC;
c1
1958
1958
1958
1958
UPDATE t1
SET c1 = '2012'
WHERE c1 = '1958'
ORDER BY c1
LIMIT 2;
SELECT * FROM t1 ORDER BY c1;
c1
1901
1955
1956
1957
1958
1958
1959
1961
1962
1970
2000
2012
2012
2012
2069
2121
2155
DELETE FROM t1
WHERE c1 = '1958'
ORDER BY c1;
SELECT * FROM t1 ORDER BY c1;
c1
1901
1955
1956
1957
1959
1961
1962
1970
2000
2012
2012
2012
2069
2121
2155
DROP TABLE t1;
CREATE TABLE t1(c1 YEAR NOT NULL, c2 YEAR NOT NULL , INDEX(c1, c2))
ENGINE=cloud;
INSERT INTO t1 VALUES
('1958', '1955'),
('1958', '1956'),
('1958', '1957'),
('1958', '1959'),
('1958', '1961'),
('1958', '1962'),
('1958', '2012'),
('1958', '1901'),
('1958', '2155'),
('1958', '0'),
('1958', '69'),
('1958', '70'),
('1958', '2121'),
('1958', '1958'),
('1958', '1958'),
('1958', '1958'),
('1958', '1958');
SELECT * FROM t1 WHERE c1 = '1958' AND c2 > '1958' ORDER BY c2 ASC;
c1	c2
1958	1959
1958	1961
1958	1962
1958	1970
1958	2000
1958	2012
1958	2069
1958	2121
1958	2155
SELECT * FROM t1 WHERE c1 = '1958' AND c2 >= '1958' ORDER BY c2 ASC;
c1	c2
1958	1958
1958	1958
1958	1958
1958	1958
1958	1959
1958	1961
1958	1962
1958	1970
1958	2000
1958	2012
1958	2069
1958	2121
1958	2155
SELECT * FROM t1 WHERE c1 = '1958' AND c2 < '1958' ORDER BY c2 ASC;
c1	c2
1958	1901
1958	1955
1958	1956
1958	1957
SELECT * FROM t1 WHERE c1 = '1958' AND c2 <= '1958' ORDER BY c2 ASC;
c1	c2
1958	1901
1958	1955
1958	1956
1958	1957
1958	1958
1958	1958
1958	1958
1958	1958
SELECT * FROM t1 WHERE c1 = '1958' AND c2 > '1958' ORDER BY c2 DESC;
c1	c2
1958	2155
1958	2121
1958	2069
1958	2012
1958	2000
1958	1970
1958	1962
1958	1961
1958	1959
SELECT * FROM t1 WHERE c1 = '1958' AND c2 >= '1958' ORDER BY c2 DESC;
c1	c2
1958	2155
1958	2121
1958	2069
1958	2012
1958	2000
1958	1970
1958	1962
1958	1961
1958	1959
1958	1958
1958	1958
1958	1958
1958	1958
SELECT * FROM t1 WHERE c1 = '1958' AND c2 < '1958' ORDER BY c2 DESC;
c1	c2
1958	1957
1958	1956
1958	1955
1958	1901
SELECT * FROM t1 WHERE c1 = '1958' AND c2 <= '1958' ORDER BY c2 DESC;
c1	c2
1958	1958
1958	1958
1958	1958
1958	1958
1958	1957
1958	1956
1958	1955
1958	1901
DROP TABLE t1;
DROP TABLE IF EXISTS t1;
CREATE TABLE t1(c1 YEAR NULL , INDEX(c1))
ENGINE=cloud;
INSERT INTO t1 VALUES
('1955'),
('1956'),
('1957'),
('1959'),
('1961'),
('1962'),
('2012'),
('1901'),
('2155'),
('0'),
('69'),
('70'),
('2121'),
('1958'),
(NULL),
(NULL),
(NULL),
(NULL);
SELECT * FROM t1 WHERE c1 IS     NULL ORDER BY c1 ASC;
c1
NULL
NULL
NULL
NULL
SELECT * FROM t1 WHERE c1 IS NOT NULL ORDER BY c1 DESC;
c1
2155
2121
2069
2012
2000
1970
1962
1961
1959
1958
1957
1956
1955
1901
SELECT * FROM t1 WHERE c1 IS     NULL ORDER BY c1 ASC;
c1
NULL
NULL
NULL
NULL
SELECT * FROM t1 WHERE c1 IS NOT NULL ORDER BY c1 DESC;
c1
2155
2121
2069
2012
2000
1970
1962
1961
1959
1958
1957
1956
1955
1901
UPDATE t1
SET c1 = '1958'
WHERE c1 IS NULL
LIMIT 2;
SELECT * FROM t1 ORDER BY c1;
c1
NULL
NULL
1901
1955
1956
1957
1958
1958
1958
1959
1961
1962
1970
2000
2012
2069
2121
2155
DELETE FROM t1
WHERE c1 IS NULL
ORDER BY c1;
SELECT * FROM t1 ORDER BY c1;
c1
1901
1955
1956
1957
1958
1958
1958
1959
1961
1962
1970
2000
2012
2069
2121
2155
DROP TABLE t1;
CREATE TABLE t1(c1 YEAR NULL, c2 YEAR NULL , INDEX(c1, c2))
ENGINE=cloud;
INSERT INTO t1 VALUES
('1958', '1955'),
('1958', '1956'),
('1958', '1957'),
('1958', '1959'),
('1958', '1961'),
('1958', '1962'),
('1958', '2012'),
('1958', '1901'),
('1958', '2155'),
('1958', '0'),
('1958', '69'),
('1958', '70'),
('1958', '2121'),
('1958', NULL),
('1958', NULL),
('1958', NULL),
('1958', NULL),
('1958', '1958'),
('1958', '1958'),
('1958', '1958'),
('1958', '1958');
SELECT * FROM t1 WHERE c1 = '1958' AND c2 > '1958' ORDER BY c2 ASC;
c1	c2
1958	1959
1958	1961
1958	1962
1958	1970
1958	2000
1958	2012
1958	2069
1958	2121
1958	2155
SELECT * FROM t1 WHERE c1 = '1958' AND c2 >= '1958' ORDER BY c2 ASC;
c1	c2
1958	1958
1958	1958
1958	1958
1958	1958
1958	1959
1958	1961
1958	1962
1958	1970
1958	2000
1958	2012
1958	2069
1958	2121
1958	2155
SELECT * FROM t1 WHERE c1 = '1958' AND c2 < '1958' ORDER BY c2 ASC;
c1	c2
1958	1901
1958	1955
1958	1956
1958	1957
SELECT * FROM t1 WHERE c1 = '1958' AND c2 <= '1958' ORDER BY c2 ASC;
c1	c2
1958	1901
1958	1955
1958	1956
1958	1957
1958	1958
1958	1958
1958	1958
1958	1958
SELECT * FROM t1 WHERE c1 = '1958' AND c2 is null ORDER BY c1 ASC;
c1	c2
1958	NULL
1958	NULL
1958	NULL
1958	NULL
SELECT * FROM t1 WHERE c1 = '1958' AND c2 is not null ORDER BY c2 ASC;
c1	c2
1958	1901
1958	1955
1958	1956
1958	1957
1958	1958
1958	1958
1958	1958
1958	1958
1958	1959
1958	1961
1958	1962
1958	1970
1958	2000
1958	2012
1958	2069
1958	2121
1958	2155
SELECT * FROM t1 WHERE c1 = '1958' AND c2 > '1958' ORDER BY c2 DESC;
c1	c2
1958	2155
1958	2121
1958	2069
1958	2012
1958	2000
1958	1970
1958	1962
1958	1961
1958	1959
SELECT * FROM t1 WHERE c1 = '1958' AND c2 >= '1958' ORDER BY c2 DESC;
c1	c2
1958	2155
1958	2121
1958	2069
1958	2012
1958	2000
1958	1970
1958	1962
1958	1961
1958	1959
1958	1958
1958	1958
1958	1958
1958	1958
SELECT * FROM t1 WHERE c1 = '1958' AND c2 < '1958' ORDER BY c2 DESC;
c1	c2
1958	1957
1958	1956
1958	1955
1958	1901
SELECT * FROM t1 WHERE c1 = '1958' AND c2 <= '1958' ORDER BY c2 DESC;
c1	c2
1958	1958
1958	1958
1958	1958
1958	1958
1958	1957
1958	1956
1958	1955
1958	1901
SELECT * FROM t1 WHERE c1 = '1958' AND c2 is null ORDER BY c1 DESC;
c1	c2
1958	NULL
1958	NULL
1958	NULL
1958	NULL
SELECT * FROM t1 WHERE c1 = '1958' AND c2 is not null ORDER BY c2 DESC;
c1	c2
1958	2155
1958	2121
1958	2069
1958	2012
1958	2000
1958	1970
1958	1962
1958	1961
1958	1959
1958	1958
1958	1958
1958	1958
1958	1958
1958	1957
1958	1956
1958	1955
1958	1901
DROP TABLE t1;
DROP TABLE IF EXISTS t1;
CREATE TABLE t1(c1 YEAR NULL , INDEX(c1))
ENGINE=cloud;
INSERT INTO t1 VALUES
('1955'),
('1956'),
('1957'),
('1959'),
('1961'),
('1962'),
('2012'),
('1901'),
('2155'),
('0'),
('69'),
('70'),
('2121'),
('1958'),
('1958'),
('1958'),
('1958');
SELECT * FROM t1 ORDER BY c1 ASC;
c1
1901
1955
1956
1957
1958
1958
1958
1958
1959
1961
1962
1970
2000
2012
2069
2121
2155
SELECT * FROM t1 ORDER BY c1 DESC;
c1
2155
2121
2069
2012
2000
1970
1962
1961
1959
1958
1958
1958
1958
1957
1956
1955
1901
SELECT * FROM t1 WHERE c1 >  '1958' ORDER BY c1 ASC;
c1
1959
1961
1962
1970
2000
2012
2069
2121
2155
SELECT * FROM t1 WHERE c1 >= '1958' ORDER BY c1 ASC;
c1
1958
1958
1958
1958
1959
1961
1962
1970
2000
2012
2069
2121
2155
SELECT * FROM t1 WHERE c1 <  '1958' ORDER BY c1 ASC;
c1
1901
1955
1956
1957
SELECT * FROM t1 WHERE c1 <= '1958' ORDER BY c1 ASC;
c1
1901
1955
1956
1957
1958
1958
1958
1958
SELECT * FROM t1 WHERE c1 =  '1958' ORDER BY c1 ASC;
c1
1958
1958
1958
1958
SELECT * FROM t1 WHERE c1 >  '1958' ORDER BY c1 DESC;
c1
2155
2121
2069
2012
2000
1970
1962
1961
1959
SELECT * FROM t1 WHERE c1 >= '1958' ORDER BY c1 DESC;
c1
2155
2121
2069
2012
2000
1970
1962
1961
1959
1958
1958
1958
1958
SELECT * FROM t1 WHERE c1 <  '1958' ORDER BY c1 DESC;
c1
1957
1956
1955
1901
SELECT * FROM t1 WHERE c1 <= '1958' ORDER BY c1 DESC;
c1
1958
1958
1958
1958
1957
1956
1955
1901
SELECT * FROM t1 WHERE c1 =  '1958' ORDER BY c1 DESC;
c1
1958
1958
1958
1958
UPDATE t1
SET c1 = '2012'
WHERE c1 = '1958'
ORDER BY c1
LIMIT 2;
SELECT * FROM t1 ORDER BY c1;
c1
1901
1955
1956
1957
1958
1958
1959
1961
1962
1970
2000
2012
2012
2012
2069
2121
2155
DELETE FROM t1
WHERE c1 = '1958'
ORDER BY c1;
SELECT * FROM t1 ORDER BY c1;
c1
1901
1955
1956
1957
1959
1961
1962
1970
2000
2012
2012
2012
2069
2121
2155
DROP TABLE t1;
CREATE TABLE t1(c1 YEAR NULL, c2 YEAR NULL , INDEX(c1, c2))
ENGINE=cloud;
INSERT INTO t1 VALUES
('1958', '1955'),
('1958', '1956'),
('1958', '1957'),
('1958', '1959'),
('1958', '1961'),
('1958', '1962'),
('1958', '2012'),
('1958', '1901'),
('1958', '2155'),
('1958', '0'),
('1958', '69'),
('1958', '70'),
('1958', '2121'),
('1958', '1958'),
('1958', '1958'),
('1958', '1958'),
('1958', '1958');
SELECT * FROM t1 WHERE c1 = '1958' AND c2 > '1958' ORDER BY c2 ASC;
c1	c2
1958	1959
1958	1961
1958	1962
1958	1970
1958	2000
1958	2012
1958	2069
1958	2121
1958	2155
SELECT * FROM t1 WHERE c1 = '1958' AND c2 >= '1958' ORDER BY c2 ASC;
c1	c2
1958	1958
1958	1958
1958	1958
1958	1958
1958	1959
1958	1961
1958	1962
1958	1970
1958	2000
1958	2012
1958	2069
1958	2121
1958	2155
SELECT * FROM t1 WHERE c1 = '1958' AND c2 < '1958' ORDER BY c2 ASC;
c1	c2
1958	1901
1958	1955
1958	1956
1958	1957
SELECT * FROM t1 WHERE c1 = '1958' AND c2 <= '1958' ORDER BY c2 ASC;
c1	c2
1958	1901
1958	1955
1958	1956
1958	1957
1958	1958
1958	1958
1958	1958
1958	1958
SELECT * FROM t1 WHERE c1 = '1958' AND c2 > '1958' ORDER BY c2 DESC;
c1	c2
1958	2155
1958	2121
1958	2069
1958	2012
1958	2000
1958	1970
1958	1962
1958	1961
1958	1959
SELECT * FROM t1 WHERE c1 = '1958' AND c2 >= '1958' ORDER BY c2 DESC;
c1	c2
1958	2155
1958	2121
1958	2069
1958	2012
1958	2000
1958	1970
1958	1962
1958	1961
1958	1959
1958	1958
1958	1958
1958	1958
1958	1958
SELECT * FROM t1 WHERE c1 = '1958' AND c2 < '1958' ORDER BY c2 DESC;
c1	c2
1958	1957
1958	1956
1958	1955
1958	1901
SELECT * FROM t1 WHERE c1 = '1958' AND c2 <= '1958' ORDER BY c2 DESC;
c1	c2
1958	1958
1958	1958
1958	1958
1958	1958
1958	1957
1958	1956
1958	1955
1958	1901
DROP TABLE t1;
