DROP TABLE IF EXISTS lowercase;
Warnings:
Note	1051	Unknown table 'lowercase'
DROP TABLE IF EXISTS uppercase;
Warnings:
Note	1051	Unknown table 'uppercase'
CREATE TABLE lowercase (lower int, UPPER int) engine=cloud;
INSERT INTO lowercase VALUES (1, 2);
INSERT INTO lOwErCaSe VALUES (3, 4);
INSERT INTO LoWeRcAsE VALUES (5, 6);
INSERT INTO LOWERCASE VALUES (7, 8);
SELECT lower, UPPER FROM lowercase ORDER BY lower;
lower	UPPER
1	2
3	4
5	6
7	8
SELECT LoWeR, uPpEr FROM lOweRCAse ORDER BY LoWer;
LoWeR	uPpEr
1	2
3	4
5	6
7	8
SELECT LOWER, upper FROM lowercase ORDER BY LOWER;
LOWER	upper
1	2
3	4
5	6
7	8
SELECT LOWER, upper FROM LOWERCASE ORDER BY loWeR;
LOWER	upper
1	2
3	4
5	6
7	8
CREATE TABLE UPPERCASE (lower int, UPPER int) engine=cloud;
INSERT INTO uPpErCaSe VALUES (1, 2);
INSERT INTO UpPeRcAsE VALUES (3, 4);
INSERT INTO uppercase VALUES (5, 6);
INSERT INTO uPPeRcASe VALUES (7, 8);
SELECT lower, UPPER FROM UPPERCASE ORDER BY lower;
lower	UPPER
1	2
3	4
5	6
7	8
SELECT LoWeR, uPpEr FROM uppercase ORDER BY LOWER;
LoWeR	uPpEr
1	2
3	4
5	6
7	8
SELECT LOWER, upper FROM uPpErCaSe ORDER BY lowEr;
LOWER	upper
1	2
3	4
5	6
7	8
SELECT LOWER, upper FROM UpPeRcAsE ORDER BY lower;
LOWER	upper
1	2
3	4
5	6
7	8
DELETE FROM LOWERCASE WHERE lower < 3 AND upper = 2;
DELETE FROM lowercase WHERE LOWER = 3 AND upper = 4;
DELETE FROM lOWErCasE WHERE LoWeR > 3 AND upper = 6;
SELECT * FROM LOWERCASE ORDER BY LoWeR;
lower	UPPER
7	8
CREATE TABLE LOWERCASE (lower int, UPPER int) engine=cloud;
ERROR 42S01: Table 'lowercase' already exists
CREATE TABLE uppercase (lower int, UPPER int) engine=cloud;
ERROR 42S01: Table 'uppercase' already exists
CREATE TABLE lOwERCAse (lower int, UPPER int) engine=cloud;
ERROR 42S01: Table 'lowercase' already exists
CREATE TABLE UPpeRcASe (lower int, UPPER int) engine=cloud;
ERROR 42S01: Table 'uppercase' already exists
DROP TABLE IF EXISTS lowercase;
DROP TABLE IF EXISTS uppercase;
