DROP TABLE IF EXISTS t1;
CREATE TABLE t1(c1 FLOAT SIGNED NOT NULL )
ENGINE=cloud;
INSERT INTO t1 VALUES
(-3.402823466E+38),
(0),
(0),
(0),
(0),
(-1.2345e+20 - 2),
(-1.2345e+20 - 1),
(-1.2345e+20),
(-1.2345e+20),
(-1.2345e+20 + 1),
(-1.2345e+20 + 2),
(3.402823466E+38);
SELECT * FROM t1 ORDER BY c1 ASC;
c1
-3.40282e38
-1.2345e20
-1.2345e20
-1.2345e20
-1.2345e20
-1.2345e20
-1.2345e20
0
0
0
0
3.40282e38
SELECT * FROM t1 ORDER BY c1 DESC;
c1
3.40282e38
0
0
0
0
-1.2345e20
-1.2345e20
-1.2345e20
-1.2345e20
-1.2345e20
-1.2345e20
-3.40282e38
SELECT * FROM t1 WHERE c1 >  -1.2345e+20 ORDER BY c1 ASC;
c1
-1.2345e20
-1.2345e20
-1.2345e20
-1.2345e20
-1.2345e20
-1.2345e20
0
0
0
0
3.40282e38
SELECT * FROM t1 WHERE c1 >= -1.2345e+20 ORDER BY c1 ASC;
c1
-1.2345e20
-1.2345e20
-1.2345e20
-1.2345e20
-1.2345e20
-1.2345e20
0
0
0
0
3.40282e38
SELECT * FROM t1 WHERE c1 <  -1.2345e+20 ORDER BY c1 ASC;
c1
-3.40282e38
SELECT * FROM t1 WHERE c1 <= -1.2345e+20 ORDER BY c1 ASC;
c1
-3.40282e38
SELECT * FROM t1 WHERE c1 =  -1.2345e+20 ORDER BY c1 ASC;
c1
SELECT * FROM t1 WHERE c1 >  -1.2345e+20 ORDER BY c1 DESC;
c1
3.40282e38
0
0
0
0
-1.2345e20
-1.2345e20
-1.2345e20
-1.2345e20
-1.2345e20
-1.2345e20
SELECT * FROM t1 WHERE c1 >= -1.2345e+20 ORDER BY c1 DESC;
c1
3.40282e38
0
0
0
0
-1.2345e20
-1.2345e20
-1.2345e20
-1.2345e20
-1.2345e20
-1.2345e20
SELECT * FROM t1 WHERE c1 <  -1.2345e+20 ORDER BY c1 DESC;
c1
-3.40282e38
SELECT * FROM t1 WHERE c1 <= -1.2345e+20 ORDER BY c1 DESC;
c1
-3.40282e38
SELECT * FROM t1 WHERE c1 =  -1.2345e+20 ORDER BY c1 DESC;
c1
UPDATE t1
SET c1 = -1.2345e+20
WHERE c1 <= 0 + 1000.00 AND c1 >= 0 - 1000.00
ORDER BY c1 ASC
LIMIT 2;
SELECT * FROM t1 ORDER BY c1;
c1
-3.40282e38
-1.2345e20
-1.2345e20
-1.2345e20
-1.2345e20
-1.2345e20
-1.2345e20
-1.2345e20
-1.2345e20
0
0
3.40282e38
DELETE FROM t1
WHERE c1 <= 0 + 1000.00 AND c1 >= 0 - 1000.00
ORDER BY c1;
SELECT * FROM t1 ORDER BY c1;
c1
-3.40282e38
-1.2345e20
-1.2345e20
-1.2345e20
-1.2345e20
-1.2345e20
-1.2345e20
-1.2345e20
-1.2345e20
3.40282e38
DROP TABLE t1;
CREATE TABLE t1(c1 FLOAT SIGNED NOT NULL, c2 FLOAT SIGNED NOT NULL )
engine = cloud;
INSERT INTO t1 VALUES
(-3.402823466E+38, -3.402823466E+38),
(0, 0),
(0, 0),
(0, 0),
(0, 0),
(-1.2345e+20, -1.2345e+20 - 2),
(-1.2345e+20, -1.2345e+20 - 1),
(-1.2345e+20, -1.2345e+20),
(-1.2345e+20, -1.2345e+20),
(-1.2345e+20, -1.2345e+20 + 1),
(-1.2345e+20, -1.2345e+20 + 2),
(3.402823466E+38, 3.402823466E+38);
SELECT * FROM t1 WHERE c1 = -1.2345e+20 AND c2 > -1.2345e+20 ORDER BY c2 ASC;
c1	c2
SELECT * FROM t1 WHERE c1 = -1.2345e+20 AND c2 >= -1.2345e+20 ORDER BY c2 ASC;
c1	c2
SELECT * FROM t1 WHERE c1 = -1.2345e+20 AND c2 < -1.2345e+20 ORDER BY c2 ASC;
c1	c2
SELECT * FROM t1 WHERE c1 = -1.2345e+20 AND c2 <= -1.2345e+20 ORDER BY c2 ASC;
c1	c2
SELECT * FROM t1 WHERE c1 = -1.2345e+20 AND c2 > -1.2345e+20 ORDER BY c2 DESC;
c1	c2
SELECT * FROM t1 WHERE c1 = -1.2345e+20 AND c2 >= -1.2345e+20 ORDER BY c2 DESC;
c1	c2
SELECT * FROM t1 WHERE c1 = -1.2345e+20 AND c2 < -1.2345e+20 ORDER BY c2 DESC;
c1	c2
SELECT * FROM t1 WHERE c1 = -1.2345e+20 AND c2 <= -1.2345e+20 ORDER BY c2 DESC;
c1	c2
DROP TABLE t1;
DROP TABLE IF EXISTS t1;
CREATE TABLE t1(c1 FLOAT SIGNED NULL)
ENGINE=cloud;
INSERT INTO t1 VALUES
(-3.402823466E+38),
(0),
(-1.2345e+20),
(3.402823466E+38),
(NULL),
(NULL),
(NULL),
(NULL);
SELECT * FROM t1 WHERE c1 IS     NULL ORDER BY c1 ASC;
c1
NULL
NULL
NULL
NULL
SELECT * FROM t1 WHERE c1 IS NOT NULL ORDER BY c1 DESC;
c1
3.40282e38
0
-1.2345e20
-3.40282e38
SELECT * FROM t1 WHERE c1 IS     NULL ORDER BY c1 ASC;
c1
NULL
NULL
NULL
NULL
SELECT * FROM t1 WHERE c1 IS NOT NULL ORDER BY c1 DESC;
c1
3.40282e38
0
-1.2345e20
-3.40282e38
UPDATE t1
SET c1 = 0
WHERE c1 IS NULL;
SELECT * FROM t1 ORDER BY c1;
c1
-3.40282e38
-1.2345e20
0
0
0
0
0
3.40282e38
UPDATE t1
SET c1 = 0
WHERE c1 IS NULL
LIMIT 2;
SELECT * FROM t1 ORDER BY c1;
c1
-3.40282e38
-1.2345e20
0
0
0
0
0
3.40282e38
DELETE FROM t1
WHERE c1 IS NULL
ORDER BY c1;
SELECT * FROM t1 ORDER BY c1;
c1
-3.40282e38
-1.2345e20
0
0
0
0
0
3.40282e38
DROP TABLE t1;
CREATE TABLE t1(c1 FLOAT SIGNED NULL, c2 FLOAT SIGNED NULL )
engine = cloud;
INSERT INTO t1 VALUES
(-3.402823466E+38, -3.402823466E+38),
(0, 0),
(0, 0),
(0, 0),
(0, 0),
(-1.2345e+20, -1.2345e+20 - 2),
(-1.2345e+20, -1.2345e+20 - 1),
(-1.2345e+20, -1.2345e+20),
(-1.2345e+20, -1.2345e+20),
(-1.2345e+20, -1.2345e+20 + 1),
(-1.2345e+20, -1.2345e+20 + 2),
(-1.2345e+20, NULL),
(-1.2345e+20, NULL),
(3.402823466E+38, 3.402823466E+38);
SELECT * FROM t1 WHERE c1 = -1.2345e+20 AND c2 > -1.2345e+20 ORDER BY c2 ASC;
c1	c2
SELECT * FROM t1 WHERE c1 = -1.2345e+20 AND c2 >= -1.2345e+20 ORDER BY c2 ASC;
c1	c2
SELECT * FROM t1 WHERE c1 = -1.2345e+20 AND c2 < -1.2345e+20 ORDER BY c2 ASC;
c1	c2
SELECT * FROM t1 WHERE c1 = -1.2345e+20 AND c2 <= -1.2345e+20 ORDER BY c2 ASC;
c1	c2
SELECT * FROM t1 WHERE c1 = -1.2345e+20 AND c2 is null ORDER BY c1 ASC;
c1	c2
SELECT * FROM t1 WHERE c1 = -1.2345e+20 AND c2 is not null ORDER BY c2 ASC;
c1	c2
SELECT * FROM t1 WHERE c1 = -1.2345e+20 AND c2 > -1.2345e+20 ORDER BY c2 DESC;
c1	c2
SELECT * FROM t1 WHERE c1 = -1.2345e+20 AND c2 >= -1.2345e+20 ORDER BY c2 DESC;
c1	c2
SELECT * FROM t1 WHERE c1 = -1.2345e+20 AND c2 < -1.2345e+20 ORDER BY c2 DESC;
c1	c2
SELECT * FROM t1 WHERE c1 = -1.2345e+20 AND c2 <= -1.2345e+20 ORDER BY c2 DESC;
c1	c2
SELECT * FROM t1 WHERE c1 = -1.2345e+20 AND c2 is null ORDER BY c1 DESC;
c1	c2
SELECT * FROM t1 WHERE c1 = -1.2345e+20 AND c2 is not null ORDER BY c2 DESC;
c1	c2
DROP TABLE t1;
DROP TABLE IF EXISTS t1;
CREATE TABLE t1(c1 FLOAT SIGNED NULL )
ENGINE=cloud;
INSERT INTO t1 VALUES
(-3.402823466E+38),
(0),
(0),
(0),
(0),
(-1.2345e+20 - 2),
(-1.2345e+20 - 1),
(-1.2345e+20),
(-1.2345e+20),
(-1.2345e+20 + 1),
(-1.2345e+20 + 2),
(3.402823466E+38);
SELECT * FROM t1 ORDER BY c1 ASC;
c1
-3.40282e38
-1.2345e20
-1.2345e20
-1.2345e20
-1.2345e20
-1.2345e20
-1.2345e20
0
0
0
0
3.40282e38
SELECT * FROM t1 ORDER BY c1 DESC;
c1
3.40282e38
0
0
0
0
-1.2345e20
-1.2345e20
-1.2345e20
-1.2345e20
-1.2345e20
-1.2345e20
-3.40282e38
SELECT * FROM t1 WHERE c1 >  -1.2345e+20 ORDER BY c1 ASC;
c1
-1.2345e20
-1.2345e20
-1.2345e20
-1.2345e20
-1.2345e20
-1.2345e20
0
0
0
0
3.40282e38
SELECT * FROM t1 WHERE c1 >= -1.2345e+20 ORDER BY c1 ASC;
c1
-1.2345e20
-1.2345e20
-1.2345e20
-1.2345e20
-1.2345e20
-1.2345e20
0
0
0
0
3.40282e38
SELECT * FROM t1 WHERE c1 <  -1.2345e+20 ORDER BY c1 ASC;
c1
-3.40282e38
SELECT * FROM t1 WHERE c1 <= -1.2345e+20 ORDER BY c1 ASC;
c1
-3.40282e38
SELECT * FROM t1 WHERE c1 =  -1.2345e+20 ORDER BY c1 ASC;
c1
SELECT * FROM t1 WHERE c1 >  -1.2345e+20 ORDER BY c1 DESC;
c1
3.40282e38
0
0
0
0
-1.2345e20
-1.2345e20
-1.2345e20
-1.2345e20
-1.2345e20
-1.2345e20
SELECT * FROM t1 WHERE c1 >= -1.2345e+20 ORDER BY c1 DESC;
c1
3.40282e38
0
0
0
0
-1.2345e20
-1.2345e20
-1.2345e20
-1.2345e20
-1.2345e20
-1.2345e20
SELECT * FROM t1 WHERE c1 <  -1.2345e+20 ORDER BY c1 DESC;
c1
-3.40282e38
SELECT * FROM t1 WHERE c1 <= -1.2345e+20 ORDER BY c1 DESC;
c1
-3.40282e38
SELECT * FROM t1 WHERE c1 =  -1.2345e+20 ORDER BY c1 DESC;
c1
UPDATE t1
SET c1 = -1.2345e+20
WHERE c1 <= 0 + 1000.00 AND c1 >= 0 - 1000.00
ORDER BY c1 ASC
LIMIT 2;
SELECT * FROM t1 ORDER BY c1;
c1
-3.40282e38
-1.2345e20
-1.2345e20
-1.2345e20
-1.2345e20
-1.2345e20
-1.2345e20
-1.2345e20
-1.2345e20
0
0
3.40282e38
DELETE FROM t1
WHERE c1 <= 0 + 1000.00 AND c1 >= 0 - 1000.00
ORDER BY c1;
SELECT * FROM t1 ORDER BY c1;
c1
-3.40282e38
-1.2345e20
-1.2345e20
-1.2345e20
-1.2345e20
-1.2345e20
-1.2345e20
-1.2345e20
-1.2345e20
3.40282e38
DROP TABLE t1;
CREATE TABLE t1(c1 FLOAT SIGNED NULL, c2 FLOAT SIGNED NULL )
engine = cloud;
INSERT INTO t1 VALUES
(-3.402823466E+38, -3.402823466E+38),
(0, 0),
(0, 0),
(0, 0),
(0, 0),
(-1.2345e+20, -1.2345e+20 - 2),
(-1.2345e+20, -1.2345e+20 - 1),
(-1.2345e+20, -1.2345e+20),
(-1.2345e+20, -1.2345e+20),
(-1.2345e+20, -1.2345e+20 + 1),
(-1.2345e+20, -1.2345e+20 + 2),
(3.402823466E+38, 3.402823466E+38);
SELECT * FROM t1 WHERE c1 = -1.2345e+20 AND c2 > -1.2345e+20 ORDER BY c2 ASC;
c1	c2
SELECT * FROM t1 WHERE c1 = -1.2345e+20 AND c2 >= -1.2345e+20 ORDER BY c2 ASC;
c1	c2
SELECT * FROM t1 WHERE c1 = -1.2345e+20 AND c2 < -1.2345e+20 ORDER BY c2 ASC;
c1	c2
SELECT * FROM t1 WHERE c1 = -1.2345e+20 AND c2 <= -1.2345e+20 ORDER BY c2 ASC;
c1	c2
SELECT * FROM t1 WHERE c1 = -1.2345e+20 AND c2 > -1.2345e+20 ORDER BY c2 DESC;
c1	c2
SELECT * FROM t1 WHERE c1 = -1.2345e+20 AND c2 >= -1.2345e+20 ORDER BY c2 DESC;
c1	c2
SELECT * FROM t1 WHERE c1 = -1.2345e+20 AND c2 < -1.2345e+20 ORDER BY c2 DESC;
c1	c2
SELECT * FROM t1 WHERE c1 = -1.2345e+20 AND c2 <= -1.2345e+20 ORDER BY c2 DESC;
c1	c2
DROP TABLE t1;
DROP TABLE IF EXISTS t1;
CREATE TABLE t1(c1 FLOAT SIGNED NOT NULL , INDEX(c1))
ENGINE=cloud;
INSERT INTO t1 VALUES
(-3.402823466E+38),
(0),
(0),
(0),
(0),
(-1.2345e+20 - 2),
(-1.2345e+20 - 1),
(-1.2345e+20),
(-1.2345e+20),
(-1.2345e+20 + 1),
(-1.2345e+20 + 2),
(3.402823466E+38);
SELECT * FROM t1 ORDER BY c1 ASC;
c1
-3.40282e38
-1.2345e20
-1.2345e20
-1.2345e20
-1.2345e20
-1.2345e20
-1.2345e20
0
0
0
0
3.40282e38
SELECT * FROM t1 ORDER BY c1 DESC;
c1
3.40282e38
0
0
0
0
-1.2345e20
-1.2345e20
-1.2345e20
-1.2345e20
-1.2345e20
-1.2345e20
-3.40282e38
SELECT * FROM t1 WHERE c1 >  -1.2345e+20 ORDER BY c1 ASC;
c1
-1.2345e20
-1.2345e20
-1.2345e20
-1.2345e20
-1.2345e20
-1.2345e20
0
0
0
0
3.40282e38
SELECT * FROM t1 WHERE c1 >= -1.2345e+20 ORDER BY c1 ASC;
c1
-1.2345e20
-1.2345e20
-1.2345e20
-1.2345e20
-1.2345e20
-1.2345e20
0
0
0
0
3.40282e38
SELECT * FROM t1 WHERE c1 <  -1.2345e+20 ORDER BY c1 ASC;
c1
-3.40282e38
SELECT * FROM t1 WHERE c1 <= -1.2345e+20 ORDER BY c1 ASC;
c1
-3.40282e38
SELECT * FROM t1 WHERE c1 =  -1.2345e+20 ORDER BY c1 ASC;
c1
SELECT * FROM t1 WHERE c1 >  -1.2345e+20 ORDER BY c1 DESC;
c1
3.40282e38
0
0
0
0
-1.2345e20
-1.2345e20
-1.2345e20
-1.2345e20
-1.2345e20
-1.2345e20
SELECT * FROM t1 WHERE c1 >= -1.2345e+20 ORDER BY c1 DESC;
c1
3.40282e38
0
0
0
0
-1.2345e20
-1.2345e20
-1.2345e20
-1.2345e20
-1.2345e20
-1.2345e20
SELECT * FROM t1 WHERE c1 <  -1.2345e+20 ORDER BY c1 DESC;
c1
-3.40282e38
SELECT * FROM t1 WHERE c1 <= -1.2345e+20 ORDER BY c1 DESC;
c1
-3.40282e38
SELECT * FROM t1 WHERE c1 =  -1.2345e+20 ORDER BY c1 DESC;
c1
UPDATE t1
SET c1 = -1.2345e+20
WHERE c1 <= 0 + 1000.00 AND c1 >= 0 - 1000.00
ORDER BY c1 ASC
LIMIT 2;
SELECT * FROM t1 ORDER BY c1;
c1
-3.40282e38
-1.2345e20
-1.2345e20
-1.2345e20
-1.2345e20
-1.2345e20
-1.2345e20
-1.2345e20
-1.2345e20
0
0
3.40282e38
DELETE FROM t1
WHERE c1 <= 0 + 1000.00 AND c1 >= 0 - 1000.00
ORDER BY c1;
SELECT * FROM t1 ORDER BY c1;
c1
-3.40282e38
-1.2345e20
-1.2345e20
-1.2345e20
-1.2345e20
-1.2345e20
-1.2345e20
-1.2345e20
-1.2345e20
3.40282e38
DROP TABLE t1;
CREATE TABLE t1(c1 FLOAT SIGNED NOT NULL, c2 FLOAT SIGNED NOT NULL , INDEX(c1, c2))
engine = cloud;
INSERT INTO t1 VALUES
(-3.402823466E+38, -3.402823466E+38),
(0, 0),
(0, 0),
(0, 0),
(0, 0),
(-1.2345e+20, -1.2345e+20 - 2),
(-1.2345e+20, -1.2345e+20 - 1),
(-1.2345e+20, -1.2345e+20),
(-1.2345e+20, -1.2345e+20),
(-1.2345e+20, -1.2345e+20 + 1),
(-1.2345e+20, -1.2345e+20 + 2),
(3.402823466E+38, 3.402823466E+38);
SELECT * FROM t1 WHERE c1 = -1.2345e+20 AND c2 > -1.2345e+20 ORDER BY c2 ASC;
c1	c2
SELECT * FROM t1 WHERE c1 = -1.2345e+20 AND c2 >= -1.2345e+20 ORDER BY c2 ASC;
c1	c2
SELECT * FROM t1 WHERE c1 = -1.2345e+20 AND c2 < -1.2345e+20 ORDER BY c2 ASC;
c1	c2
SELECT * FROM t1 WHERE c1 = -1.2345e+20 AND c2 <= -1.2345e+20 ORDER BY c2 ASC;
c1	c2
SELECT * FROM t1 WHERE c1 = -1.2345e+20 AND c2 > -1.2345e+20 ORDER BY c2 DESC;
c1	c2
SELECT * FROM t1 WHERE c1 = -1.2345e+20 AND c2 >= -1.2345e+20 ORDER BY c2 DESC;
c1	c2
SELECT * FROM t1 WHERE c1 = -1.2345e+20 AND c2 < -1.2345e+20 ORDER BY c2 DESC;
c1	c2
SELECT * FROM t1 WHERE c1 = -1.2345e+20 AND c2 <= -1.2345e+20 ORDER BY c2 DESC;
c1	c2
DROP TABLE t1;
DROP TABLE IF EXISTS t1;
CREATE TABLE t1(c1 FLOAT SIGNED NULL)
ENGINE=cloud;
INSERT INTO t1 VALUES
(-3.402823466E+38),
(0),
(-1.2345e+20),
(3.402823466E+38),
(NULL),
(NULL),
(NULL),
(NULL);
SELECT * FROM t1 WHERE c1 IS     NULL ORDER BY c1 ASC;
c1
NULL
NULL
NULL
NULL
SELECT * FROM t1 WHERE c1 IS NOT NULL ORDER BY c1 DESC;
c1
3.40282e38
0
-1.2345e20
-3.40282e38
SELECT * FROM t1 WHERE c1 IS     NULL ORDER BY c1 ASC;
c1
NULL
NULL
NULL
NULL
SELECT * FROM t1 WHERE c1 IS NOT NULL ORDER BY c1 DESC;
c1
3.40282e38
0
-1.2345e20
-3.40282e38
UPDATE t1
SET c1 = 0
WHERE c1 IS NULL;
SELECT * FROM t1 ORDER BY c1;
c1
-3.40282e38
-1.2345e20
0
0
0
0
0
3.40282e38
UPDATE t1
SET c1 = 0
WHERE c1 IS NULL
LIMIT 2;
SELECT * FROM t1 ORDER BY c1;
c1
-3.40282e38
-1.2345e20
0
0
0
0
0
3.40282e38
DELETE FROM t1
WHERE c1 IS NULL
ORDER BY c1;
SELECT * FROM t1 ORDER BY c1;
c1
-3.40282e38
-1.2345e20
0
0
0
0
0
3.40282e38
DROP TABLE t1;
CREATE TABLE t1(c1 FLOAT SIGNED NULL, c2 FLOAT SIGNED NULL , INDEX(c1, c2))
engine = cloud;
INSERT INTO t1 VALUES
(-3.402823466E+38, -3.402823466E+38),
(0, 0),
(0, 0),
(0, 0),
(0, 0),
(-1.2345e+20, -1.2345e+20 - 2),
(-1.2345e+20, -1.2345e+20 - 1),
(-1.2345e+20, -1.2345e+20),
(-1.2345e+20, -1.2345e+20),
(-1.2345e+20, -1.2345e+20 + 1),
(-1.2345e+20, -1.2345e+20 + 2),
(-1.2345e+20, NULL),
(-1.2345e+20, NULL),
(3.402823466E+38, 3.402823466E+38);
SELECT * FROM t1 WHERE c1 = -1.2345e+20 AND c2 > -1.2345e+20 ORDER BY c2 ASC;
c1	c2
SELECT * FROM t1 WHERE c1 = -1.2345e+20 AND c2 >= -1.2345e+20 ORDER BY c2 ASC;
c1	c2
SELECT * FROM t1 WHERE c1 = -1.2345e+20 AND c2 < -1.2345e+20 ORDER BY c2 ASC;
c1	c2
SELECT * FROM t1 WHERE c1 = -1.2345e+20 AND c2 <= -1.2345e+20 ORDER BY c2 ASC;
c1	c2
SELECT * FROM t1 WHERE c1 = -1.2345e+20 AND c2 is null ORDER BY c1 ASC;
c1	c2
SELECT * FROM t1 WHERE c1 = -1.2345e+20 AND c2 is not null ORDER BY c2 ASC;
c1	c2
SELECT * FROM t1 WHERE c1 = -1.2345e+20 AND c2 > -1.2345e+20 ORDER BY c2 DESC;
c1	c2
SELECT * FROM t1 WHERE c1 = -1.2345e+20 AND c2 >= -1.2345e+20 ORDER BY c2 DESC;
c1	c2
SELECT * FROM t1 WHERE c1 = -1.2345e+20 AND c2 < -1.2345e+20 ORDER BY c2 DESC;
c1	c2
SELECT * FROM t1 WHERE c1 = -1.2345e+20 AND c2 <= -1.2345e+20 ORDER BY c2 DESC;
c1	c2
SELECT * FROM t1 WHERE c1 = -1.2345e+20 AND c2 is null ORDER BY c1 DESC;
c1	c2
SELECT * FROM t1 WHERE c1 = -1.2345e+20 AND c2 is not null ORDER BY c2 DESC;
c1	c2
DROP TABLE t1;
DROP TABLE IF EXISTS t1;
CREATE TABLE t1(c1 FLOAT SIGNED NULL , INDEX(c1))
ENGINE=cloud;
INSERT INTO t1 VALUES
(-3.402823466E+38),
(0),
(0),
(0),
(0),
(-1.2345e+20 - 2),
(-1.2345e+20 - 1),
(-1.2345e+20),
(-1.2345e+20),
(-1.2345e+20 + 1),
(-1.2345e+20 + 2),
(3.402823466E+38);
SELECT * FROM t1 ORDER BY c1 ASC;
c1
-3.40282e38
-1.2345e20
-1.2345e20
-1.2345e20
-1.2345e20
-1.2345e20
-1.2345e20
0
0
0
0
3.40282e38
SELECT * FROM t1 ORDER BY c1 DESC;
c1
3.40282e38
0
0
0
0
-1.2345e20
-1.2345e20
-1.2345e20
-1.2345e20
-1.2345e20
-1.2345e20
-3.40282e38
SELECT * FROM t1 WHERE c1 >  -1.2345e+20 ORDER BY c1 ASC;
c1
-1.2345e20
-1.2345e20
-1.2345e20
-1.2345e20
-1.2345e20
-1.2345e20
0
0
0
0
3.40282e38
SELECT * FROM t1 WHERE c1 >= -1.2345e+20 ORDER BY c1 ASC;
c1
-1.2345e20
-1.2345e20
-1.2345e20
-1.2345e20
-1.2345e20
-1.2345e20
0
0
0
0
3.40282e38
SELECT * FROM t1 WHERE c1 <  -1.2345e+20 ORDER BY c1 ASC;
c1
-3.40282e38
SELECT * FROM t1 WHERE c1 <= -1.2345e+20 ORDER BY c1 ASC;
c1
-3.40282e38
SELECT * FROM t1 WHERE c1 =  -1.2345e+20 ORDER BY c1 ASC;
c1
SELECT * FROM t1 WHERE c1 >  -1.2345e+20 ORDER BY c1 DESC;
c1
3.40282e38
0
0
0
0
-1.2345e20
-1.2345e20
-1.2345e20
-1.2345e20
-1.2345e20
-1.2345e20
SELECT * FROM t1 WHERE c1 >= -1.2345e+20 ORDER BY c1 DESC;
c1
3.40282e38
0
0
0
0
-1.2345e20
-1.2345e20
-1.2345e20
-1.2345e20
-1.2345e20
-1.2345e20
SELECT * FROM t1 WHERE c1 <  -1.2345e+20 ORDER BY c1 DESC;
c1
-3.40282e38
SELECT * FROM t1 WHERE c1 <= -1.2345e+20 ORDER BY c1 DESC;
c1
-3.40282e38
SELECT * FROM t1 WHERE c1 =  -1.2345e+20 ORDER BY c1 DESC;
c1
UPDATE t1
SET c1 = -1.2345e+20
WHERE c1 <= 0 + 1000.00 AND c1 >= 0 - 1000.00
ORDER BY c1 ASC
LIMIT 2;
SELECT * FROM t1 ORDER BY c1;
c1
-3.40282e38
-1.2345e20
-1.2345e20
-1.2345e20
-1.2345e20
-1.2345e20
-1.2345e20
-1.2345e20
-1.2345e20
0
0
3.40282e38
DELETE FROM t1
WHERE c1 <= 0 + 1000.00 AND c1 >= 0 - 1000.00
ORDER BY c1;
SELECT * FROM t1 ORDER BY c1;
c1
-3.40282e38
-1.2345e20
-1.2345e20
-1.2345e20
-1.2345e20
-1.2345e20
-1.2345e20
-1.2345e20
-1.2345e20
3.40282e38
DROP TABLE t1;
CREATE TABLE t1(c1 FLOAT SIGNED NULL, c2 FLOAT SIGNED NULL , INDEX(c1, c2))
engine = cloud;
INSERT INTO t1 VALUES
(-3.402823466E+38, -3.402823466E+38),
(0, 0),
(0, 0),
(0, 0),
(0, 0),
(-1.2345e+20, -1.2345e+20 - 2),
(-1.2345e+20, -1.2345e+20 - 1),
(-1.2345e+20, -1.2345e+20),
(-1.2345e+20, -1.2345e+20),
(-1.2345e+20, -1.2345e+20 + 1),
(-1.2345e+20, -1.2345e+20 + 2),
(3.402823466E+38, 3.402823466E+38);
SELECT * FROM t1 WHERE c1 = -1.2345e+20 AND c2 > -1.2345e+20 ORDER BY c2 ASC;
c1	c2
SELECT * FROM t1 WHERE c1 = -1.2345e+20 AND c2 >= -1.2345e+20 ORDER BY c2 ASC;
c1	c2
SELECT * FROM t1 WHERE c1 = -1.2345e+20 AND c2 < -1.2345e+20 ORDER BY c2 ASC;
c1	c2
SELECT * FROM t1 WHERE c1 = -1.2345e+20 AND c2 <= -1.2345e+20 ORDER BY c2 ASC;
c1	c2
SELECT * FROM t1 WHERE c1 = -1.2345e+20 AND c2 > -1.2345e+20 ORDER BY c2 DESC;
c1	c2
SELECT * FROM t1 WHERE c1 = -1.2345e+20 AND c2 >= -1.2345e+20 ORDER BY c2 DESC;
c1	c2
SELECT * FROM t1 WHERE c1 = -1.2345e+20 AND c2 < -1.2345e+20 ORDER BY c2 DESC;
c1	c2
SELECT * FROM t1 WHERE c1 = -1.2345e+20 AND c2 <= -1.2345e+20 ORDER BY c2 DESC;
c1	c2
DROP TABLE t1;
DROP TABLE IF EXISTS t1;
CREATE TABLE t1(c1 FLOAT UNSIGNED NOT NULL )
ENGINE=cloud;
INSERT INTO t1 VALUES
(0),
(0),
(0),
(0),
(0),
(1.234567e+20 - 2),
(1.234567e+20 - 1),
(1.234567e+20),
(1.234567e+20),
(1.234567e+20 + 1),
(1.234567e+20 + 2),
(3.402823466E+38);
SELECT * FROM t1 ORDER BY c1 ASC;
c1
0
0
0
0
0
1.23457e20
1.23457e20
1.23457e20
1.23457e20
1.23457e20
1.23457e20
3.40282e38
SELECT * FROM t1 ORDER BY c1 DESC;
c1
3.40282e38
1.23457e20
1.23457e20
1.23457e20
1.23457e20
1.23457e20
1.23457e20
0
0
0
0
0
SELECT * FROM t1 WHERE c1 >  1.234567e+20 ORDER BY c1 ASC;
c1
1.23457e20
1.23457e20
1.23457e20
1.23457e20
1.23457e20
1.23457e20
3.40282e38
SELECT * FROM t1 WHERE c1 >= 1.234567e+20 ORDER BY c1 ASC;
c1
1.23457e20
1.23457e20
1.23457e20
1.23457e20
1.23457e20
1.23457e20
3.40282e38
SELECT * FROM t1 WHERE c1 <  1.234567e+20 ORDER BY c1 ASC;
c1
0
0
0
0
0
SELECT * FROM t1 WHERE c1 <= 1.234567e+20 ORDER BY c1 ASC;
c1
0
0
0
0
0
SELECT * FROM t1 WHERE c1 =  1.234567e+20 ORDER BY c1 ASC;
c1
SELECT * FROM t1 WHERE c1 >  1.234567e+20 ORDER BY c1 DESC;
c1
3.40282e38
1.23457e20
1.23457e20
1.23457e20
1.23457e20
1.23457e20
1.23457e20
SELECT * FROM t1 WHERE c1 >= 1.234567e+20 ORDER BY c1 DESC;
c1
3.40282e38
1.23457e20
1.23457e20
1.23457e20
1.23457e20
1.23457e20
1.23457e20
SELECT * FROM t1 WHERE c1 <  1.234567e+20 ORDER BY c1 DESC;
c1
0
0
0
0
0
SELECT * FROM t1 WHERE c1 <= 1.234567e+20 ORDER BY c1 DESC;
c1
0
0
0
0
0
SELECT * FROM t1 WHERE c1 =  1.234567e+20 ORDER BY c1 DESC;
c1
UPDATE t1
SET c1 = 1.234567e+20
WHERE c1 <= 0 + 1000.00 AND c1 >= 0 - 1000.00
ORDER BY c1 ASC
LIMIT 2;
SELECT * FROM t1 ORDER BY c1;
c1
0
0
0
1.23457e20
1.23457e20
1.23457e20
1.23457e20
1.23457e20
1.23457e20
1.23457e20
1.23457e20
3.40282e38
DELETE FROM t1
WHERE c1 <= 0 + 1000.00 AND c1 >= 0 - 1000.00
ORDER BY c1;
SELECT * FROM t1 ORDER BY c1;
c1
1.23457e20
1.23457e20
1.23457e20
1.23457e20
1.23457e20
1.23457e20
1.23457e20
1.23457e20
3.40282e38
DROP TABLE t1;
CREATE TABLE t1(c1 FLOAT UNSIGNED NOT NULL, c2 FLOAT UNSIGNED NOT NULL , INDEX(c1, c2))
engine = cloud;
INSERT INTO t1 VALUES
(0, 0),
(0, 0),
(0, 0),
(0, 0),
(0, 0),
(1.234567e+20, 1.234567e+20 - 2),
(1.234567e+20, 1.234567e+20 - 1),
(1.234567e+20, 1.234567e+20),
(1.234567e+20, 1.234567e+20),
(1.234567e+20, 1.234567e+20 + 1),
(1.234567e+20, 1.234567e+20 + 2),
(3.402823466E+38, 3.402823466E+38);
SELECT * FROM t1 WHERE c1 = 1.234567e+20 AND c2 > 1.234567e+20 ORDER BY c2 ASC;
c1	c2
SELECT * FROM t1 WHERE c1 = 1.234567e+20 AND c2 >= 1.234567e+20 ORDER BY c2 ASC;
c1	c2
SELECT * FROM t1 WHERE c1 = 1.234567e+20 AND c2 < 1.234567e+20 ORDER BY c2 ASC;
c1	c2
SELECT * FROM t1 WHERE c1 = 1.234567e+20 AND c2 <= 1.234567e+20 ORDER BY c2 ASC;
c1	c2
SELECT * FROM t1 WHERE c1 = 1.234567e+20 AND c2 > 1.234567e+20 ORDER BY c2 DESC;
c1	c2
SELECT * FROM t1 WHERE c1 = 1.234567e+20 AND c2 >= 1.234567e+20 ORDER BY c2 DESC;
c1	c2
SELECT * FROM t1 WHERE c1 = 1.234567e+20 AND c2 < 1.234567e+20 ORDER BY c2 DESC;
c1	c2
SELECT * FROM t1 WHERE c1 = 1.234567e+20 AND c2 <= 1.234567e+20 ORDER BY c2 DESC;
c1	c2
DROP TABLE t1;
DROP TABLE IF EXISTS t1;
CREATE TABLE t1(c1 FLOAT UNSIGNED NULL)
ENGINE=cloud;
INSERT INTO t1 VALUES
(0),
(0),
(1.234567e+20),
(3.402823466E+38),
(NULL),
(NULL),
(NULL),
(NULL);
SELECT * FROM t1 WHERE c1 IS     NULL ORDER BY c1 ASC;
c1
NULL
NULL
NULL
NULL
SELECT * FROM t1 WHERE c1 IS NOT NULL ORDER BY c1 DESC;
c1
3.40282e38
1.23457e20
0
0
SELECT * FROM t1 WHERE c1 IS     NULL ORDER BY c1 ASC;
c1
NULL
NULL
NULL
NULL
SELECT * FROM t1 WHERE c1 IS NOT NULL ORDER BY c1 DESC;
c1
3.40282e38
1.23457e20
0
0
UPDATE t1
SET c1 = 0
WHERE c1 IS NULL;
SELECT * FROM t1 ORDER BY c1;
c1
0
0
0
0
0
0
1.23457e20
3.40282e38
UPDATE t1
SET c1 = 0
WHERE c1 IS NULL
LIMIT 2;
SELECT * FROM t1 ORDER BY c1;
c1
0
0
0
0
0
0
1.23457e20
3.40282e38
DELETE FROM t1
WHERE c1 IS NULL
ORDER BY c1;
SELECT * FROM t1 ORDER BY c1;
c1
0
0
0
0
0
0
1.23457e20
3.40282e38
DROP TABLE t1;
CREATE TABLE t1(c1 FLOAT UNSIGNED NULL, c2 FLOAT UNSIGNED NULL , INDEX(c1, c2))
engine = cloud;
INSERT INTO t1 VALUES
(0, 0),
(0, 0),
(0, 0),
(0, 0),
(0, 0),
(1.234567e+20, 1.234567e+20 - 2),
(1.234567e+20, 1.234567e+20 - 1),
(1.234567e+20, 1.234567e+20),
(1.234567e+20, 1.234567e+20),
(1.234567e+20, 1.234567e+20 + 1),
(1.234567e+20, 1.234567e+20 + 2),
(1.234567e+20, NULL),
(1.234567e+20, NULL),
(3.402823466E+38, 3.402823466E+38);
SELECT * FROM t1 WHERE c1 = 1.234567e+20 AND c2 > 1.234567e+20 ORDER BY c2 ASC;
c1	c2
SELECT * FROM t1 WHERE c1 = 1.234567e+20 AND c2 >= 1.234567e+20 ORDER BY c2 ASC;
c1	c2
SELECT * FROM t1 WHERE c1 = 1.234567e+20 AND c2 < 1.234567e+20 ORDER BY c2 ASC;
c1	c2
SELECT * FROM t1 WHERE c1 = 1.234567e+20 AND c2 <= 1.234567e+20 ORDER BY c2 ASC;
c1	c2
SELECT * FROM t1 WHERE c1 = 1.234567e+20 AND c2 is null ORDER BY c1 ASC;
c1	c2
SELECT * FROM t1 WHERE c1 = 1.234567e+20 AND c2 is not null ORDER BY c2 ASC;
c1	c2
SELECT * FROM t1 WHERE c1 = 1.234567e+20 AND c2 > 1.234567e+20 ORDER BY c2 DESC;
c1	c2
SELECT * FROM t1 WHERE c1 = 1.234567e+20 AND c2 >= 1.234567e+20 ORDER BY c2 DESC;
c1	c2
SELECT * FROM t1 WHERE c1 = 1.234567e+20 AND c2 < 1.234567e+20 ORDER BY c2 DESC;
c1	c2
SELECT * FROM t1 WHERE c1 = 1.234567e+20 AND c2 <= 1.234567e+20 ORDER BY c2 DESC;
c1	c2
SELECT * FROM t1 WHERE c1 = 1.234567e+20 AND c2 is null ORDER BY c1 DESC;
c1	c2
SELECT * FROM t1 WHERE c1 = 1.234567e+20 AND c2 is not null ORDER BY c2 DESC;
c1	c2
DROP TABLE t1;
DROP TABLE IF EXISTS t1;
CREATE TABLE t1(c1 FLOAT UNSIGNED NULL )
ENGINE=cloud;
INSERT INTO t1 VALUES
(0),
(0),
(0),
(0),
(0),
(1.234567e+20 - 2),
(1.234567e+20 - 1),
(1.234567e+20),
(1.234567e+20),
(1.234567e+20 + 1),
(1.234567e+20 + 2),
(3.402823466E+38);
SELECT * FROM t1 ORDER BY c1 ASC;
c1
0
0
0
0
0
1.23457e20
1.23457e20
1.23457e20
1.23457e20
1.23457e20
1.23457e20
3.40282e38
SELECT * FROM t1 ORDER BY c1 DESC;
c1
3.40282e38
1.23457e20
1.23457e20
1.23457e20
1.23457e20
1.23457e20
1.23457e20
0
0
0
0
0
SELECT * FROM t1 WHERE c1 >  1.234567e+20 ORDER BY c1 ASC;
c1
1.23457e20
1.23457e20
1.23457e20
1.23457e20
1.23457e20
1.23457e20
3.40282e38
SELECT * FROM t1 WHERE c1 >= 1.234567e+20 ORDER BY c1 ASC;
c1
1.23457e20
1.23457e20
1.23457e20
1.23457e20
1.23457e20
1.23457e20
3.40282e38
SELECT * FROM t1 WHERE c1 <  1.234567e+20 ORDER BY c1 ASC;
c1
0
0
0
0
0
SELECT * FROM t1 WHERE c1 <= 1.234567e+20 ORDER BY c1 ASC;
c1
0
0
0
0
0
SELECT * FROM t1 WHERE c1 =  1.234567e+20 ORDER BY c1 ASC;
c1
SELECT * FROM t1 WHERE c1 >  1.234567e+20 ORDER BY c1 DESC;
c1
3.40282e38
1.23457e20
1.23457e20
1.23457e20
1.23457e20
1.23457e20
1.23457e20
SELECT * FROM t1 WHERE c1 >= 1.234567e+20 ORDER BY c1 DESC;
c1
3.40282e38
1.23457e20
1.23457e20
1.23457e20
1.23457e20
1.23457e20
1.23457e20
SELECT * FROM t1 WHERE c1 <  1.234567e+20 ORDER BY c1 DESC;
c1
0
0
0
0
0
SELECT * FROM t1 WHERE c1 <= 1.234567e+20 ORDER BY c1 DESC;
c1
0
0
0
0
0
SELECT * FROM t1 WHERE c1 =  1.234567e+20 ORDER BY c1 DESC;
c1
UPDATE t1
SET c1 = 1.234567e+20
WHERE c1 <= 0 + 1000.00 AND c1 >= 0 - 1000.00
ORDER BY c1 ASC
LIMIT 2;
SELECT * FROM t1 ORDER BY c1;
c1
0
0
0
1.23457e20
1.23457e20
1.23457e20
1.23457e20
1.23457e20
1.23457e20
1.23457e20
1.23457e20
3.40282e38
DELETE FROM t1
WHERE c1 <= 0 + 1000.00 AND c1 >= 0 - 1000.00
ORDER BY c1;
SELECT * FROM t1 ORDER BY c1;
c1
1.23457e20
1.23457e20
1.23457e20
1.23457e20
1.23457e20
1.23457e20
1.23457e20
1.23457e20
3.40282e38
DROP TABLE t1;
CREATE TABLE t1(c1 FLOAT UNSIGNED NULL, c2 FLOAT UNSIGNED NULL , INDEX(c1, c2))
engine = cloud;
INSERT INTO t1 VALUES
(0, 0),
(0, 0),
(0, 0),
(0, 0),
(0, 0),
(1.234567e+20, 1.234567e+20 - 2),
(1.234567e+20, 1.234567e+20 - 1),
(1.234567e+20, 1.234567e+20),
(1.234567e+20, 1.234567e+20),
(1.234567e+20, 1.234567e+20 + 1),
(1.234567e+20, 1.234567e+20 + 2),
(3.402823466E+38, 3.402823466E+38);
SELECT * FROM t1 WHERE c1 = 1.234567e+20 AND c2 > 1.234567e+20 ORDER BY c2 ASC;
c1	c2
SELECT * FROM t1 WHERE c1 = 1.234567e+20 AND c2 >= 1.234567e+20 ORDER BY c2 ASC;
c1	c2
SELECT * FROM t1 WHERE c1 = 1.234567e+20 AND c2 < 1.234567e+20 ORDER BY c2 ASC;
c1	c2
SELECT * FROM t1 WHERE c1 = 1.234567e+20 AND c2 <= 1.234567e+20 ORDER BY c2 ASC;
c1	c2
SELECT * FROM t1 WHERE c1 = 1.234567e+20 AND c2 > 1.234567e+20 ORDER BY c2 DESC;
c1	c2
SELECT * FROM t1 WHERE c1 = 1.234567e+20 AND c2 >= 1.234567e+20 ORDER BY c2 DESC;
c1	c2
SELECT * FROM t1 WHERE c1 = 1.234567e+20 AND c2 < 1.234567e+20 ORDER BY c2 DESC;
c1	c2
SELECT * FROM t1 WHERE c1 = 1.234567e+20 AND c2 <= 1.234567e+20 ORDER BY c2 DESC;
c1	c2
DROP TABLE t1;
DROP TABLE IF EXISTS t1;
CREATE TABLE t1(c1 FLOAT UNSIGNED NOT NULL , INDEX(c1))
ENGINE=cloud;
INSERT INTO t1 VALUES
(0),
(0),
(0),
(0),
(0),
(1.234567e+20 - 2),
(1.234567e+20 - 1),
(1.234567e+20),
(1.234567e+20),
(1.234567e+20 + 1),
(1.234567e+20 + 2),
(3.402823466E+38);
SELECT * FROM t1 ORDER BY c1 ASC;
c1
0
0
0
0
0
1.23457e20
1.23457e20
1.23457e20
1.23457e20
1.23457e20
1.23457e20
3.40282e38
SELECT * FROM t1 ORDER BY c1 DESC;
c1
3.40282e38
1.23457e20
1.23457e20
1.23457e20
1.23457e20
1.23457e20
1.23457e20
0
0
0
0
0
SELECT * FROM t1 WHERE c1 >  1.234567e+20 ORDER BY c1 ASC;
c1
1.23457e20
1.23457e20
1.23457e20
1.23457e20
1.23457e20
1.23457e20
3.40282e38
SELECT * FROM t1 WHERE c1 >= 1.234567e+20 ORDER BY c1 ASC;
c1
1.23457e20
1.23457e20
1.23457e20
1.23457e20
1.23457e20
1.23457e20
3.40282e38
SELECT * FROM t1 WHERE c1 <  1.234567e+20 ORDER BY c1 ASC;
c1
0
0
0
0
0
SELECT * FROM t1 WHERE c1 <= 1.234567e+20 ORDER BY c1 ASC;
c1
0
0
0
0
0
SELECT * FROM t1 WHERE c1 =  1.234567e+20 ORDER BY c1 ASC;
c1
SELECT * FROM t1 WHERE c1 >  1.234567e+20 ORDER BY c1 DESC;
c1
3.40282e38
1.23457e20
1.23457e20
1.23457e20
1.23457e20
1.23457e20
1.23457e20
SELECT * FROM t1 WHERE c1 >= 1.234567e+20 ORDER BY c1 DESC;
c1
3.40282e38
1.23457e20
1.23457e20
1.23457e20
1.23457e20
1.23457e20
1.23457e20
SELECT * FROM t1 WHERE c1 <  1.234567e+20 ORDER BY c1 DESC;
c1
0
0
0
0
0
SELECT * FROM t1 WHERE c1 <= 1.234567e+20 ORDER BY c1 DESC;
c1
0
0
0
0
0
SELECT * FROM t1 WHERE c1 =  1.234567e+20 ORDER BY c1 DESC;
c1
UPDATE t1
SET c1 = 1.234567e+20
WHERE c1 <= 0 + 1000.00 AND c1 >= 0 - 1000.00
ORDER BY c1 ASC
LIMIT 2;
SELECT * FROM t1 ORDER BY c1;
c1
0
0
0
1.23457e20
1.23457e20
1.23457e20
1.23457e20
1.23457e20
1.23457e20
1.23457e20
1.23457e20
3.40282e38
DELETE FROM t1
WHERE c1 <= 0 + 1000.00 AND c1 >= 0 - 1000.00
ORDER BY c1;
SELECT * FROM t1 ORDER BY c1;
c1
1.23457e20
1.23457e20
1.23457e20
1.23457e20
1.23457e20
1.23457e20
1.23457e20
1.23457e20
3.40282e38
DROP TABLE t1;
CREATE TABLE t1(c1 FLOAT UNSIGNED NOT NULL, c2 FLOAT UNSIGNED NOT NULL , INDEX(c1, c2))
engine = cloud;
INSERT INTO t1 VALUES
(0, 0),
(0, 0),
(0, 0),
(0, 0),
(0, 0),
(1.234567e+20, 1.234567e+20 - 2),
(1.234567e+20, 1.234567e+20 - 1),
(1.234567e+20, 1.234567e+20),
(1.234567e+20, 1.234567e+20),
(1.234567e+20, 1.234567e+20 + 1),
(1.234567e+20, 1.234567e+20 + 2),
(3.402823466E+38, 3.402823466E+38);
SELECT * FROM t1 WHERE c1 = 1.234567e+20 AND c2 > 1.234567e+20 ORDER BY c2 ASC;
c1	c2
SELECT * FROM t1 WHERE c1 = 1.234567e+20 AND c2 >= 1.234567e+20 ORDER BY c2 ASC;
c1	c2
SELECT * FROM t1 WHERE c1 = 1.234567e+20 AND c2 < 1.234567e+20 ORDER BY c2 ASC;
c1	c2
SELECT * FROM t1 WHERE c1 = 1.234567e+20 AND c2 <= 1.234567e+20 ORDER BY c2 ASC;
c1	c2
SELECT * FROM t1 WHERE c1 = 1.234567e+20 AND c2 > 1.234567e+20 ORDER BY c2 DESC;
c1	c2
SELECT * FROM t1 WHERE c1 = 1.234567e+20 AND c2 >= 1.234567e+20 ORDER BY c2 DESC;
c1	c2
SELECT * FROM t1 WHERE c1 = 1.234567e+20 AND c2 < 1.234567e+20 ORDER BY c2 DESC;
c1	c2
SELECT * FROM t1 WHERE c1 = 1.234567e+20 AND c2 <= 1.234567e+20 ORDER BY c2 DESC;
c1	c2
DROP TABLE t1;
DROP TABLE IF EXISTS t1;
CREATE TABLE t1(c1 FLOAT UNSIGNED NULL)
ENGINE=cloud;
INSERT INTO t1 VALUES
(0),
(0),
(1.234567e+20),
(3.402823466E+38),
(NULL),
(NULL),
(NULL),
(NULL);
SELECT * FROM t1 WHERE c1 IS     NULL ORDER BY c1 ASC;
c1
NULL
NULL
NULL
NULL
SELECT * FROM t1 WHERE c1 IS NOT NULL ORDER BY c1 DESC;
c1
3.40282e38
1.23457e20
0
0
SELECT * FROM t1 WHERE c1 IS     NULL ORDER BY c1 ASC;
c1
NULL
NULL
NULL
NULL
SELECT * FROM t1 WHERE c1 IS NOT NULL ORDER BY c1 DESC;
c1
3.40282e38
1.23457e20
0
0
UPDATE t1
SET c1 = 0
WHERE c1 IS NULL;
SELECT * FROM t1 ORDER BY c1;
c1
0
0
0
0
0
0
1.23457e20
3.40282e38
UPDATE t1
SET c1 = 0
WHERE c1 IS NULL
LIMIT 2;
SELECT * FROM t1 ORDER BY c1;
c1
0
0
0
0
0
0
1.23457e20
3.40282e38
DELETE FROM t1
WHERE c1 IS NULL
ORDER BY c1;
SELECT * FROM t1 ORDER BY c1;
c1
0
0
0
0
0
0
1.23457e20
3.40282e38
DROP TABLE t1;
CREATE TABLE t1(c1 FLOAT UNSIGNED NULL, c2 FLOAT UNSIGNED NULL , INDEX(c1, c2))
engine = cloud;
INSERT INTO t1 VALUES
(0, 0),
(0, 0),
(0, 0),
(0, 0),
(0, 0),
(1.234567e+20, 1.234567e+20 - 2),
(1.234567e+20, 1.234567e+20 - 1),
(1.234567e+20, 1.234567e+20),
(1.234567e+20, 1.234567e+20),
(1.234567e+20, 1.234567e+20 + 1),
(1.234567e+20, 1.234567e+20 + 2),
(1.234567e+20, NULL),
(1.234567e+20, NULL),
(3.402823466E+38, 3.402823466E+38);
SELECT * FROM t1 WHERE c1 = 1.234567e+20 AND c2 > 1.234567e+20 ORDER BY c2 ASC;
c1	c2
SELECT * FROM t1 WHERE c1 = 1.234567e+20 AND c2 >= 1.234567e+20 ORDER BY c2 ASC;
c1	c2
SELECT * FROM t1 WHERE c1 = 1.234567e+20 AND c2 < 1.234567e+20 ORDER BY c2 ASC;
c1	c2
SELECT * FROM t1 WHERE c1 = 1.234567e+20 AND c2 <= 1.234567e+20 ORDER BY c2 ASC;
c1	c2
SELECT * FROM t1 WHERE c1 = 1.234567e+20 AND c2 is null ORDER BY c1 ASC;
c1	c2
SELECT * FROM t1 WHERE c1 = 1.234567e+20 AND c2 is not null ORDER BY c2 ASC;
c1	c2
SELECT * FROM t1 WHERE c1 = 1.234567e+20 AND c2 > 1.234567e+20 ORDER BY c2 DESC;
c1	c2
SELECT * FROM t1 WHERE c1 = 1.234567e+20 AND c2 >= 1.234567e+20 ORDER BY c2 DESC;
c1	c2
SELECT * FROM t1 WHERE c1 = 1.234567e+20 AND c2 < 1.234567e+20 ORDER BY c2 DESC;
c1	c2
SELECT * FROM t1 WHERE c1 = 1.234567e+20 AND c2 <= 1.234567e+20 ORDER BY c2 DESC;
c1	c2
SELECT * FROM t1 WHERE c1 = 1.234567e+20 AND c2 is null ORDER BY c1 DESC;
c1	c2
SELECT * FROM t1 WHERE c1 = 1.234567e+20 AND c2 is not null ORDER BY c2 DESC;
c1	c2
DROP TABLE t1;
DROP TABLE IF EXISTS t1;
CREATE TABLE t1(c1 FLOAT UNSIGNED NULL , INDEX(c1))
ENGINE=cloud;
INSERT INTO t1 VALUES
(0),
(0),
(0),
(0),
(0),
(1.234567e+20 - 2),
(1.234567e+20 - 1),
(1.234567e+20),
(1.234567e+20),
(1.234567e+20 + 1),
(1.234567e+20 + 2),
(3.402823466E+38);
SELECT * FROM t1 ORDER BY c1 ASC;
c1
0
0
0
0
0
1.23457e20
1.23457e20
1.23457e20
1.23457e20
1.23457e20
1.23457e20
3.40282e38
SELECT * FROM t1 ORDER BY c1 DESC;
c1
3.40282e38
1.23457e20
1.23457e20
1.23457e20
1.23457e20
1.23457e20
1.23457e20
0
0
0
0
0
SELECT * FROM t1 WHERE c1 >  1.234567e+20 ORDER BY c1 ASC;
c1
1.23457e20
1.23457e20
1.23457e20
1.23457e20
1.23457e20
1.23457e20
3.40282e38
SELECT * FROM t1 WHERE c1 >= 1.234567e+20 ORDER BY c1 ASC;
c1
1.23457e20
1.23457e20
1.23457e20
1.23457e20
1.23457e20
1.23457e20
3.40282e38
SELECT * FROM t1 WHERE c1 <  1.234567e+20 ORDER BY c1 ASC;
c1
0
0
0
0
0
SELECT * FROM t1 WHERE c1 <= 1.234567e+20 ORDER BY c1 ASC;
c1
0
0
0
0
0
SELECT * FROM t1 WHERE c1 =  1.234567e+20 ORDER BY c1 ASC;
c1
SELECT * FROM t1 WHERE c1 >  1.234567e+20 ORDER BY c1 DESC;
c1
3.40282e38
1.23457e20
1.23457e20
1.23457e20
1.23457e20
1.23457e20
1.23457e20
SELECT * FROM t1 WHERE c1 >= 1.234567e+20 ORDER BY c1 DESC;
c1
3.40282e38
1.23457e20
1.23457e20
1.23457e20
1.23457e20
1.23457e20
1.23457e20
SELECT * FROM t1 WHERE c1 <  1.234567e+20 ORDER BY c1 DESC;
c1
0
0
0
0
0
SELECT * FROM t1 WHERE c1 <= 1.234567e+20 ORDER BY c1 DESC;
c1
0
0
0
0
0
SELECT * FROM t1 WHERE c1 =  1.234567e+20 ORDER BY c1 DESC;
c1
UPDATE t1
SET c1 = 1.234567e+20
WHERE c1 <= 0 + 1000.00 AND c1 >= 0 - 1000.00
ORDER BY c1 ASC
LIMIT 2;
SELECT * FROM t1 ORDER BY c1;
c1
0
0
0
1.23457e20
1.23457e20
1.23457e20
1.23457e20
1.23457e20
1.23457e20
1.23457e20
1.23457e20
3.40282e38
DELETE FROM t1
WHERE c1 <= 0 + 1000.00 AND c1 >= 0 - 1000.00
ORDER BY c1;
SELECT * FROM t1 ORDER BY c1;
c1
1.23457e20
1.23457e20
1.23457e20
1.23457e20
1.23457e20
1.23457e20
1.23457e20
1.23457e20
3.40282e38
DROP TABLE t1;
CREATE TABLE t1(c1 FLOAT UNSIGNED NULL, c2 FLOAT UNSIGNED NULL , INDEX(c1, c2))
engine = cloud;
INSERT INTO t1 VALUES
(0, 0),
(0, 0),
(0, 0),
(0, 0),
(0, 0),
(1.234567e+20, 1.234567e+20 - 2),
(1.234567e+20, 1.234567e+20 - 1),
(1.234567e+20, 1.234567e+20),
(1.234567e+20, 1.234567e+20),
(1.234567e+20, 1.234567e+20 + 1),
(1.234567e+20, 1.234567e+20 + 2),
(3.402823466E+38, 3.402823466E+38);
SELECT * FROM t1 WHERE c1 = 1.234567e+20 AND c2 > 1.234567e+20 ORDER BY c2 ASC;
c1	c2
SELECT * FROM t1 WHERE c1 = 1.234567e+20 AND c2 >= 1.234567e+20 ORDER BY c2 ASC;
c1	c2
SELECT * FROM t1 WHERE c1 = 1.234567e+20 AND c2 < 1.234567e+20 ORDER BY c2 ASC;
c1	c2
SELECT * FROM t1 WHERE c1 = 1.234567e+20 AND c2 <= 1.234567e+20 ORDER BY c2 ASC;
c1	c2
SELECT * FROM t1 WHERE c1 = 1.234567e+20 AND c2 > 1.234567e+20 ORDER BY c2 DESC;
c1	c2
SELECT * FROM t1 WHERE c1 = 1.234567e+20 AND c2 >= 1.234567e+20 ORDER BY c2 DESC;
c1	c2
SELECT * FROM t1 WHERE c1 = 1.234567e+20 AND c2 < 1.234567e+20 ORDER BY c2 DESC;
c1	c2
SELECT * FROM t1 WHERE c1 = 1.234567e+20 AND c2 <= 1.234567e+20 ORDER BY c2 DESC;
c1	c2
DROP TABLE t1;
