DROP TABLE IF EXISTS t1;
Warnings:
Note	1051	Unknown table 't1'
CREATE TABLE t1 (c1 INT, PRIMARY KEY(c1));
INSERT INTO t1 VALUES (1), (2), (3), (5), (8), (13), (21), (34),
(55), (89), (144), (233), (377);
SELECT * FROM t1 ORDER BY c1;
c1
1
2
3
5
8
13
21
34
55
89
144
233
377
INSERT INTO t1 VALUES (1), (2), (145);
ERROR 23000: Duplicate entry '1' for key 'PRIMARY'
INSERT INTO t1 VALUES (NULL);
ERROR 23000: Column 'c1' cannot be null
DELETE FROM t1 WHERE c1 = 1;
SELECT * FROM t1 ORDER BY c1;
c1
2
3
5
8
13
21
34
55
89
144
233
377
INSERT INTO t1 VALUES (1);
SELECT * FROM t1 ORDER BY c1;
c1
1
2
3
5
8
13
21
34
55
89
144
233
377
DROP TABLE IF EXISTS t1;
