DROP TABLE IF EXISTS t1;
CREATE TABLE t1(c1 TIMESTAMP NOT NULL )
ENGINE=cloud;
INSERT INTO t1 VALUES
('2000-06-15 01:02:03'),
('2001-06-15 01:02:03'),
('2002-06-15 01:02:03'),
('2003-06-25 01:02:03'),
('2004-06-15 01:02:03'),
('2005-06-15 01:02:03'),
('2006-06-15 01:02:03'),
('2003-06-15 00:00:00'),
('2003-06-15 01:02:02'),
('2003-06-15 01:02:04'),
('2003-06-15 23:59:59'),
('1970-01-01 00:00:01'),
('2038-01-18 03:14:07'),
('2003-06-15 01:02:03'),
('2003-06-15 01:02:03'),
('2003-06-15 01:02:03'),
('2003-06-15 01:02:03');
SELECT * FROM t1 ORDER BY c1 ASC;
c1
1970-01-01 00:00:01
2000-06-15 01:02:03
2001-06-15 01:02:03
2002-06-15 01:02:03
2003-06-15 00:00:00
2003-06-15 01:02:02
2003-06-15 01:02:03
2003-06-15 01:02:03
2003-06-15 01:02:03
2003-06-15 01:02:03
2003-06-15 01:02:04
2003-06-15 23:59:59
2003-06-25 01:02:03
2004-06-15 01:02:03
2005-06-15 01:02:03
2006-06-15 01:02:03
2038-01-18 03:14:07
SELECT * FROM t1 ORDER BY c1 DESC;
c1
2038-01-18 03:14:07
2006-06-15 01:02:03
2005-06-15 01:02:03
2004-06-15 01:02:03
2003-06-25 01:02:03
2003-06-15 23:59:59
2003-06-15 01:02:04
2003-06-15 01:02:03
2003-06-15 01:02:03
2003-06-15 01:02:03
2003-06-15 01:02:03
2003-06-15 01:02:02
2003-06-15 00:00:00
2002-06-15 01:02:03
2001-06-15 01:02:03
2000-06-15 01:02:03
1970-01-01 00:00:01
SELECT * FROM t1 WHERE c1 >  '2003-06-15 01:02:03' ORDER BY c1 ASC;
c1
2003-06-15 01:02:04
2003-06-15 23:59:59
2003-06-25 01:02:03
2004-06-15 01:02:03
2005-06-15 01:02:03
2006-06-15 01:02:03
2038-01-18 03:14:07
SELECT * FROM t1 WHERE c1 >= '2003-06-15 01:02:03' ORDER BY c1 ASC;
c1
2003-06-15 01:02:03
2003-06-15 01:02:03
2003-06-15 01:02:03
2003-06-15 01:02:03
2003-06-15 01:02:04
2003-06-15 23:59:59
2003-06-25 01:02:03
2004-06-15 01:02:03
2005-06-15 01:02:03
2006-06-15 01:02:03
2038-01-18 03:14:07
SELECT * FROM t1 WHERE c1 <  '2003-06-15 01:02:03' ORDER BY c1 ASC;
c1
1970-01-01 00:00:01
2000-06-15 01:02:03
2001-06-15 01:02:03
2002-06-15 01:02:03
2003-06-15 00:00:00
2003-06-15 01:02:02
SELECT * FROM t1 WHERE c1 <= '2003-06-15 01:02:03' ORDER BY c1 ASC;
c1
1970-01-01 00:00:01
2000-06-15 01:02:03
2001-06-15 01:02:03
2002-06-15 01:02:03
2003-06-15 00:00:00
2003-06-15 01:02:02
2003-06-15 01:02:03
2003-06-15 01:02:03
2003-06-15 01:02:03
2003-06-15 01:02:03
SELECT * FROM t1 WHERE c1 =  '2003-06-15 01:02:03' ORDER BY c1 ASC;
c1
2003-06-15 01:02:03
2003-06-15 01:02:03
2003-06-15 01:02:03
2003-06-15 01:02:03
SELECT * FROM t1 WHERE c1 >  '2003-06-15 01:02:03' ORDER BY c1 DESC;
c1
2038-01-18 03:14:07
2006-06-15 01:02:03
2005-06-15 01:02:03
2004-06-15 01:02:03
2003-06-25 01:02:03
2003-06-15 23:59:59
2003-06-15 01:02:04
SELECT * FROM t1 WHERE c1 >= '2003-06-15 01:02:03' ORDER BY c1 DESC;
c1
2038-01-18 03:14:07
2006-06-15 01:02:03
2005-06-15 01:02:03
2004-06-15 01:02:03
2003-06-25 01:02:03
2003-06-15 23:59:59
2003-06-15 01:02:04
2003-06-15 01:02:03
2003-06-15 01:02:03
2003-06-15 01:02:03
2003-06-15 01:02:03
SELECT * FROM t1 WHERE c1 <  '2003-06-15 01:02:03' ORDER BY c1 DESC;
c1
2003-06-15 01:02:02
2003-06-15 00:00:00
2002-06-15 01:02:03
2001-06-15 01:02:03
2000-06-15 01:02:03
1970-01-01 00:00:01
SELECT * FROM t1 WHERE c1 <= '2003-06-15 01:02:03' ORDER BY c1 DESC;
c1
2003-06-15 01:02:03
2003-06-15 01:02:03
2003-06-15 01:02:03
2003-06-15 01:02:03
2003-06-15 01:02:02
2003-06-15 00:00:00
2002-06-15 01:02:03
2001-06-15 01:02:03
2000-06-15 01:02:03
1970-01-01 00:00:01
SELECT * FROM t1 WHERE c1 =  '2003-06-15 01:02:03' ORDER BY c1 DESC;
c1
2003-06-15 01:02:03
2003-06-15 01:02:03
2003-06-15 01:02:03
2003-06-15 01:02:03
UPDATE t1
SET c1 = '2006-06-15 01:02:03'
WHERE c1 = '2003-06-15 01:02:03'
ORDER BY c1
LIMIT 2;
SELECT * FROM t1 ORDER BY c1;
c1
1970-01-01 00:00:01
2000-06-15 01:02:03
2001-06-15 01:02:03
2002-06-15 01:02:03
2003-06-15 00:00:00
2003-06-15 01:02:02
2003-06-15 01:02:03
2003-06-15 01:02:03
2003-06-15 01:02:04
2003-06-15 23:59:59
2003-06-25 01:02:03
2004-06-15 01:02:03
2005-06-15 01:02:03
2006-06-15 01:02:03
2006-06-15 01:02:03
2006-06-15 01:02:03
2038-01-18 03:14:07
DELETE FROM t1
WHERE c1 = '2003-06-15 01:02:03'
ORDER BY c1;
SELECT * FROM t1 ORDER BY c1;
c1
1970-01-01 00:00:01
2000-06-15 01:02:03
2001-06-15 01:02:03
2002-06-15 01:02:03
2003-06-15 00:00:00
2003-06-15 01:02:02
2003-06-15 01:02:04
2003-06-15 23:59:59
2003-06-25 01:02:03
2004-06-15 01:02:03
2005-06-15 01:02:03
2006-06-15 01:02:03
2006-06-15 01:02:03
2006-06-15 01:02:03
2038-01-18 03:14:07
DROP TABLE t1;
CREATE TABLE t1(c1 TIMESTAMP NOT NULL, c2 TIMESTAMP NOT NULL )
ENGINE=cloud;
INSERT INTO t1 VALUES
('2003-06-15 01:02:03', '2000-06-15 01:02:03'),
('2003-06-15 01:02:03', '2001-06-15 01:02:03'),
('2003-06-15 01:02:03', '2002-06-15 01:02:03'),
('2003-06-15 01:02:03', '2003-06-25 01:02:03'),
('2003-06-15 01:02:03', '2004-06-15 01:02:03'),
('2003-06-15 01:02:03', '2005-06-15 01:02:03'),
('2003-06-15 01:02:03', '2006-06-15 01:02:03'),
('2003-06-15 01:02:03', '2003-06-15 00:00:00'),
('2003-06-15 01:02:03', '2003-06-15 01:02:02'),
('2003-06-15 01:02:03', '2003-06-15 01:02:04'),
('2003-06-15 01:02:03', '2003-06-15 23:59:59'),
('2003-06-15 01:02:03', '1970-01-01 00:00:01'),
('2003-06-15 01:02:03', '2038-01-18 03:14:07'),
('2003-06-15 01:02:03', '2003-06-15 01:02:03'),
('2003-06-15 01:02:03', '2003-06-15 01:02:03'),
('2003-06-15 01:02:03', '2003-06-15 01:02:03'),
('2003-06-15 01:02:03', '2003-06-15 01:02:03');
SELECT * FROM t1 WHERE c1 = '2003-06-15 01:02:03' AND c2 > '2003-06-15 01:02:03' ORDER BY c2 ASC;
c1	c2
2003-06-15 01:02:03	2003-06-15 01:02:04
2003-06-15 01:02:03	2003-06-15 23:59:59
2003-06-15 01:02:03	2003-06-25 01:02:03
2003-06-15 01:02:03	2004-06-15 01:02:03
2003-06-15 01:02:03	2005-06-15 01:02:03
2003-06-15 01:02:03	2006-06-15 01:02:03
2003-06-15 01:02:03	2038-01-18 03:14:07
SELECT * FROM t1 WHERE c1 = '2003-06-15 01:02:03' AND c2 >= '2003-06-15 01:02:03' ORDER BY c2 ASC;
c1	c2
2003-06-15 01:02:03	2003-06-15 01:02:03
2003-06-15 01:02:03	2003-06-15 01:02:03
2003-06-15 01:02:03	2003-06-15 01:02:03
2003-06-15 01:02:03	2003-06-15 01:02:03
2003-06-15 01:02:03	2003-06-15 01:02:04
2003-06-15 01:02:03	2003-06-15 23:59:59
2003-06-15 01:02:03	2003-06-25 01:02:03
2003-06-15 01:02:03	2004-06-15 01:02:03
2003-06-15 01:02:03	2005-06-15 01:02:03
2003-06-15 01:02:03	2006-06-15 01:02:03
2003-06-15 01:02:03	2038-01-18 03:14:07
SELECT * FROM t1 WHERE c1 = '2003-06-15 01:02:03' AND c2 < '2003-06-15 01:02:03' ORDER BY c2 ASC;
c1	c2
2003-06-15 01:02:03	1970-01-01 00:00:01
2003-06-15 01:02:03	2000-06-15 01:02:03
2003-06-15 01:02:03	2001-06-15 01:02:03
2003-06-15 01:02:03	2002-06-15 01:02:03
2003-06-15 01:02:03	2003-06-15 00:00:00
2003-06-15 01:02:03	2003-06-15 01:02:02
SELECT * FROM t1 WHERE c1 = '2003-06-15 01:02:03' AND c2 <= '2003-06-15 01:02:03' ORDER BY c2 ASC;
c1	c2
2003-06-15 01:02:03	1970-01-01 00:00:01
2003-06-15 01:02:03	2000-06-15 01:02:03
2003-06-15 01:02:03	2001-06-15 01:02:03
2003-06-15 01:02:03	2002-06-15 01:02:03
2003-06-15 01:02:03	2003-06-15 00:00:00
2003-06-15 01:02:03	2003-06-15 01:02:02
2003-06-15 01:02:03	2003-06-15 01:02:03
2003-06-15 01:02:03	2003-06-15 01:02:03
2003-06-15 01:02:03	2003-06-15 01:02:03
2003-06-15 01:02:03	2003-06-15 01:02:03
SELECT * FROM t1 WHERE c1 = '2003-06-15 01:02:03' AND c2 > '2003-06-15 01:02:03' ORDER BY c2 DESC;
c1	c2
2003-06-15 01:02:03	2038-01-18 03:14:07
2003-06-15 01:02:03	2006-06-15 01:02:03
2003-06-15 01:02:03	2005-06-15 01:02:03
2003-06-15 01:02:03	2004-06-15 01:02:03
2003-06-15 01:02:03	2003-06-25 01:02:03
2003-06-15 01:02:03	2003-06-15 23:59:59
2003-06-15 01:02:03	2003-06-15 01:02:04
SELECT * FROM t1 WHERE c1 = '2003-06-15 01:02:03' AND c2 >= '2003-06-15 01:02:03' ORDER BY c2 DESC;
c1	c2
2003-06-15 01:02:03	2038-01-18 03:14:07
2003-06-15 01:02:03	2006-06-15 01:02:03
2003-06-15 01:02:03	2005-06-15 01:02:03
2003-06-15 01:02:03	2004-06-15 01:02:03
2003-06-15 01:02:03	2003-06-25 01:02:03
2003-06-15 01:02:03	2003-06-15 23:59:59
2003-06-15 01:02:03	2003-06-15 01:02:04
2003-06-15 01:02:03	2003-06-15 01:02:03
2003-06-15 01:02:03	2003-06-15 01:02:03
2003-06-15 01:02:03	2003-06-15 01:02:03
2003-06-15 01:02:03	2003-06-15 01:02:03
SELECT * FROM t1 WHERE c1 = '2003-06-15 01:02:03' AND c2 < '2003-06-15 01:02:03' ORDER BY c2 DESC;
c1	c2
2003-06-15 01:02:03	2003-06-15 01:02:02
2003-06-15 01:02:03	2003-06-15 00:00:00
2003-06-15 01:02:03	2002-06-15 01:02:03
2003-06-15 01:02:03	2001-06-15 01:02:03
2003-06-15 01:02:03	2000-06-15 01:02:03
2003-06-15 01:02:03	1970-01-01 00:00:01
SELECT * FROM t1 WHERE c1 = '2003-06-15 01:02:03' AND c2 <= '2003-06-15 01:02:03' ORDER BY c2 DESC;
c1	c2
2003-06-15 01:02:03	2003-06-15 01:02:03
2003-06-15 01:02:03	2003-06-15 01:02:03
2003-06-15 01:02:03	2003-06-15 01:02:03
2003-06-15 01:02:03	2003-06-15 01:02:03
2003-06-15 01:02:03	2003-06-15 01:02:02
2003-06-15 01:02:03	2003-06-15 00:00:00
2003-06-15 01:02:03	2002-06-15 01:02:03
2003-06-15 01:02:03	2001-06-15 01:02:03
2003-06-15 01:02:03	2000-06-15 01:02:03
2003-06-15 01:02:03	1970-01-01 00:00:01
DROP TABLE t1;
DROP TABLE IF EXISTS t1;
CREATE TABLE t1(c1 TIMESTAMP NULL )
ENGINE=cloud;
INSERT INTO t1 VALUES
('2000-06-15 01:02:03'),
('2001-06-15 01:02:03'),
('2002-06-15 01:02:03'),
('2003-06-25 01:02:03'),
('2004-06-15 01:02:03'),
('2005-06-15 01:02:03'),
('2006-06-15 01:02:03'),
('2003-06-15 00:00:00'),
('2003-06-15 01:02:02'),
('2003-06-15 01:02:04'),
('2003-06-15 23:59:59'),
('1970-01-01 00:00:01'),
('2038-01-18 03:14:07'),
('2003-06-15 01:02:03'),
(NULL),
(NULL),
(NULL),
(NULL);
SELECT * FROM t1 WHERE c1 IS     NULL ORDER BY c1 ASC;
c1
NULL
NULL
NULL
NULL
SELECT * FROM t1 WHERE c1 IS NOT NULL ORDER BY c1 DESC;
c1
2038-01-18 03:14:07
2006-06-15 01:02:03
2005-06-15 01:02:03
2004-06-15 01:02:03
2003-06-25 01:02:03
2003-06-15 23:59:59
2003-06-15 01:02:04
2003-06-15 01:02:03
2003-06-15 01:02:02
2003-06-15 00:00:00
2002-06-15 01:02:03
2001-06-15 01:02:03
2000-06-15 01:02:03
1970-01-01 00:00:01
SELECT * FROM t1 WHERE c1 IS     NULL ORDER BY c1 ASC;
c1
NULL
NULL
NULL
NULL
SELECT * FROM t1 WHERE c1 IS NOT NULL ORDER BY c1 DESC;
c1
2038-01-18 03:14:07
2006-06-15 01:02:03
2005-06-15 01:02:03
2004-06-15 01:02:03
2003-06-25 01:02:03
2003-06-15 23:59:59
2003-06-15 01:02:04
2003-06-15 01:02:03
2003-06-15 01:02:02
2003-06-15 00:00:00
2002-06-15 01:02:03
2001-06-15 01:02:03
2000-06-15 01:02:03
1970-01-01 00:00:01
UPDATE t1
SET c1 = '2003-06-15 01:02:03'
WHERE c1 IS NULL
LIMIT 2;
SELECT * FROM t1 ORDER BY c1;
c1
NULL
NULL
1970-01-01 00:00:01
2000-06-15 01:02:03
2001-06-15 01:02:03
2002-06-15 01:02:03
2003-06-15 00:00:00
2003-06-15 01:02:02
2003-06-15 01:02:03
2003-06-15 01:02:03
2003-06-15 01:02:03
2003-06-15 01:02:04
2003-06-15 23:59:59
2003-06-25 01:02:03
2004-06-15 01:02:03
2005-06-15 01:02:03
2006-06-15 01:02:03
2038-01-18 03:14:07
DELETE FROM t1
WHERE c1 IS NULL
ORDER BY c1;
SELECT * FROM t1 ORDER BY c1;
c1
1970-01-01 00:00:01
2000-06-15 01:02:03
2001-06-15 01:02:03
2002-06-15 01:02:03
2003-06-15 00:00:00
2003-06-15 01:02:02
2003-06-15 01:02:03
2003-06-15 01:02:03
2003-06-15 01:02:03
2003-06-15 01:02:04
2003-06-15 23:59:59
2003-06-25 01:02:03
2004-06-15 01:02:03
2005-06-15 01:02:03
2006-06-15 01:02:03
2038-01-18 03:14:07
DROP TABLE t1;
CREATE TABLE t1(c1 TIMESTAMP NULL, c2 TIMESTAMP NULL )
ENGINE=cloud;
INSERT INTO t1 VALUES
('2003-06-15 01:02:03', '2000-06-15 01:02:03'),
('2003-06-15 01:02:03', '2001-06-15 01:02:03'),
('2003-06-15 01:02:03', '2002-06-15 01:02:03'),
('2003-06-15 01:02:03', '2003-06-25 01:02:03'),
('2003-06-15 01:02:03', '2004-06-15 01:02:03'),
('2003-06-15 01:02:03', '2005-06-15 01:02:03'),
('2003-06-15 01:02:03', '2006-06-15 01:02:03'),
('2003-06-15 01:02:03', '2003-06-15 00:00:00'),
('2003-06-15 01:02:03', '2003-06-15 01:02:02'),
('2003-06-15 01:02:03', '2003-06-15 01:02:04'),
('2003-06-15 01:02:03', '2003-06-15 23:59:59'),
('2003-06-15 01:02:03', '1970-01-01 00:00:01'),
('2003-06-15 01:02:03', '2038-01-18 03:14:07'),
('2003-06-15 01:02:03', NULL),
('2003-06-15 01:02:03', NULL),
('2003-06-15 01:02:03', NULL),
('2003-06-15 01:02:03', NULL),
('2003-06-15 01:02:03', '2003-06-15 01:02:03'),
('2003-06-15 01:02:03', '2003-06-15 01:02:03'),
('2003-06-15 01:02:03', '2003-06-15 01:02:03'),
('2003-06-15 01:02:03', '2003-06-15 01:02:03');
SELECT * FROM t1 WHERE c1 = '2003-06-15 01:02:03' AND c2 > '2003-06-15 01:02:03' ORDER BY c2 ASC;
c1	c2
2003-06-15 01:02:03	2003-06-15 01:02:04
2003-06-15 01:02:03	2003-06-15 23:59:59
2003-06-15 01:02:03	2003-06-25 01:02:03
2003-06-15 01:02:03	2004-06-15 01:02:03
2003-06-15 01:02:03	2005-06-15 01:02:03
2003-06-15 01:02:03	2006-06-15 01:02:03
2003-06-15 01:02:03	2038-01-18 03:14:07
SELECT * FROM t1 WHERE c1 = '2003-06-15 01:02:03' AND c2 >= '2003-06-15 01:02:03' ORDER BY c2 ASC;
c1	c2
2003-06-15 01:02:03	2003-06-15 01:02:03
2003-06-15 01:02:03	2003-06-15 01:02:03
2003-06-15 01:02:03	2003-06-15 01:02:03
2003-06-15 01:02:03	2003-06-15 01:02:03
2003-06-15 01:02:03	2003-06-15 01:02:04
2003-06-15 01:02:03	2003-06-15 23:59:59
2003-06-15 01:02:03	2003-06-25 01:02:03
2003-06-15 01:02:03	2004-06-15 01:02:03
2003-06-15 01:02:03	2005-06-15 01:02:03
2003-06-15 01:02:03	2006-06-15 01:02:03
2003-06-15 01:02:03	2038-01-18 03:14:07
SELECT * FROM t1 WHERE c1 = '2003-06-15 01:02:03' AND c2 < '2003-06-15 01:02:03' ORDER BY c2 ASC;
c1	c2
2003-06-15 01:02:03	1970-01-01 00:00:01
2003-06-15 01:02:03	2000-06-15 01:02:03
2003-06-15 01:02:03	2001-06-15 01:02:03
2003-06-15 01:02:03	2002-06-15 01:02:03
2003-06-15 01:02:03	2003-06-15 00:00:00
2003-06-15 01:02:03	2003-06-15 01:02:02
SELECT * FROM t1 WHERE c1 = '2003-06-15 01:02:03' AND c2 <= '2003-06-15 01:02:03' ORDER BY c2 ASC;
c1	c2
2003-06-15 01:02:03	1970-01-01 00:00:01
2003-06-15 01:02:03	2000-06-15 01:02:03
2003-06-15 01:02:03	2001-06-15 01:02:03
2003-06-15 01:02:03	2002-06-15 01:02:03
2003-06-15 01:02:03	2003-06-15 00:00:00
2003-06-15 01:02:03	2003-06-15 01:02:02
2003-06-15 01:02:03	2003-06-15 01:02:03
2003-06-15 01:02:03	2003-06-15 01:02:03
2003-06-15 01:02:03	2003-06-15 01:02:03
2003-06-15 01:02:03	2003-06-15 01:02:03
SELECT * FROM t1 WHERE c1 = '2003-06-15 01:02:03' AND c2 is null ORDER BY c1 ASC;
c1	c2
2003-06-15 01:02:03	NULL
2003-06-15 01:02:03	NULL
2003-06-15 01:02:03	NULL
2003-06-15 01:02:03	NULL
SELECT * FROM t1 WHERE c1 = '2003-06-15 01:02:03' AND c2 is not null ORDER BY c2 ASC;
c1	c2
2003-06-15 01:02:03	1970-01-01 00:00:01
2003-06-15 01:02:03	2000-06-15 01:02:03
2003-06-15 01:02:03	2001-06-15 01:02:03
2003-06-15 01:02:03	2002-06-15 01:02:03
2003-06-15 01:02:03	2003-06-15 00:00:00
2003-06-15 01:02:03	2003-06-15 01:02:02
2003-06-15 01:02:03	2003-06-15 01:02:03
2003-06-15 01:02:03	2003-06-15 01:02:03
2003-06-15 01:02:03	2003-06-15 01:02:03
2003-06-15 01:02:03	2003-06-15 01:02:03
2003-06-15 01:02:03	2003-06-15 01:02:04
2003-06-15 01:02:03	2003-06-15 23:59:59
2003-06-15 01:02:03	2003-06-25 01:02:03
2003-06-15 01:02:03	2004-06-15 01:02:03
2003-06-15 01:02:03	2005-06-15 01:02:03
2003-06-15 01:02:03	2006-06-15 01:02:03
2003-06-15 01:02:03	2038-01-18 03:14:07
SELECT * FROM t1 WHERE c1 = '2003-06-15 01:02:03' AND c2 > '2003-06-15 01:02:03' ORDER BY c2 DESC;
c1	c2
2003-06-15 01:02:03	2038-01-18 03:14:07
2003-06-15 01:02:03	2006-06-15 01:02:03
2003-06-15 01:02:03	2005-06-15 01:02:03
2003-06-15 01:02:03	2004-06-15 01:02:03
2003-06-15 01:02:03	2003-06-25 01:02:03
2003-06-15 01:02:03	2003-06-15 23:59:59
2003-06-15 01:02:03	2003-06-15 01:02:04
SELECT * FROM t1 WHERE c1 = '2003-06-15 01:02:03' AND c2 >= '2003-06-15 01:02:03' ORDER BY c2 DESC;
c1	c2
2003-06-15 01:02:03	2038-01-18 03:14:07
2003-06-15 01:02:03	2006-06-15 01:02:03
2003-06-15 01:02:03	2005-06-15 01:02:03
2003-06-15 01:02:03	2004-06-15 01:02:03
2003-06-15 01:02:03	2003-06-25 01:02:03
2003-06-15 01:02:03	2003-06-15 23:59:59
2003-06-15 01:02:03	2003-06-15 01:02:04
2003-06-15 01:02:03	2003-06-15 01:02:03
2003-06-15 01:02:03	2003-06-15 01:02:03
2003-06-15 01:02:03	2003-06-15 01:02:03
2003-06-15 01:02:03	2003-06-15 01:02:03
SELECT * FROM t1 WHERE c1 = '2003-06-15 01:02:03' AND c2 < '2003-06-15 01:02:03' ORDER BY c2 DESC;
c1	c2
2003-06-15 01:02:03	2003-06-15 01:02:02
2003-06-15 01:02:03	2003-06-15 00:00:00
2003-06-15 01:02:03	2002-06-15 01:02:03
2003-06-15 01:02:03	2001-06-15 01:02:03
2003-06-15 01:02:03	2000-06-15 01:02:03
2003-06-15 01:02:03	1970-01-01 00:00:01
SELECT * FROM t1 WHERE c1 = '2003-06-15 01:02:03' AND c2 <= '2003-06-15 01:02:03' ORDER BY c2 DESC;
c1	c2
2003-06-15 01:02:03	2003-06-15 01:02:03
2003-06-15 01:02:03	2003-06-15 01:02:03
2003-06-15 01:02:03	2003-06-15 01:02:03
2003-06-15 01:02:03	2003-06-15 01:02:03
2003-06-15 01:02:03	2003-06-15 01:02:02
2003-06-15 01:02:03	2003-06-15 00:00:00
2003-06-15 01:02:03	2002-06-15 01:02:03
2003-06-15 01:02:03	2001-06-15 01:02:03
2003-06-15 01:02:03	2000-06-15 01:02:03
2003-06-15 01:02:03	1970-01-01 00:00:01
SELECT * FROM t1 WHERE c1 = '2003-06-15 01:02:03' AND c2 is null ORDER BY c1 DESC;
c1	c2
2003-06-15 01:02:03	NULL
2003-06-15 01:02:03	NULL
2003-06-15 01:02:03	NULL
2003-06-15 01:02:03	NULL
SELECT * FROM t1 WHERE c1 = '2003-06-15 01:02:03' AND c2 is not null ORDER BY c2 DESC;
c1	c2
2003-06-15 01:02:03	2038-01-18 03:14:07
2003-06-15 01:02:03	2006-06-15 01:02:03
2003-06-15 01:02:03	2005-06-15 01:02:03
2003-06-15 01:02:03	2004-06-15 01:02:03
2003-06-15 01:02:03	2003-06-25 01:02:03
2003-06-15 01:02:03	2003-06-15 23:59:59
2003-06-15 01:02:03	2003-06-15 01:02:04
2003-06-15 01:02:03	2003-06-15 01:02:03
2003-06-15 01:02:03	2003-06-15 01:02:03
2003-06-15 01:02:03	2003-06-15 01:02:03
2003-06-15 01:02:03	2003-06-15 01:02:03
2003-06-15 01:02:03	2003-06-15 01:02:02
2003-06-15 01:02:03	2003-06-15 00:00:00
2003-06-15 01:02:03	2002-06-15 01:02:03
2003-06-15 01:02:03	2001-06-15 01:02:03
2003-06-15 01:02:03	2000-06-15 01:02:03
2003-06-15 01:02:03	1970-01-01 00:00:01
DROP TABLE t1;
DROP TABLE IF EXISTS t1;
CREATE TABLE t1(c1 TIMESTAMP NULL )
ENGINE=cloud;
INSERT INTO t1 VALUES
('2000-06-15 01:02:03'),
('2001-06-15 01:02:03'),
('2002-06-15 01:02:03'),
('2003-06-25 01:02:03'),
('2004-06-15 01:02:03'),
('2005-06-15 01:02:03'),
('2006-06-15 01:02:03'),
('2003-06-15 00:00:00'),
('2003-06-15 01:02:02'),
('2003-06-15 01:02:04'),
('2003-06-15 23:59:59'),
('1970-01-01 00:00:01'),
('2038-01-18 03:14:07'),
('2003-06-15 01:02:03'),
('2003-06-15 01:02:03'),
('2003-06-15 01:02:03'),
('2003-06-15 01:02:03');
SELECT * FROM t1 ORDER BY c1 ASC;
c1
1970-01-01 00:00:01
2000-06-15 01:02:03
2001-06-15 01:02:03
2002-06-15 01:02:03
2003-06-15 00:00:00
2003-06-15 01:02:02
2003-06-15 01:02:03
2003-06-15 01:02:03
2003-06-15 01:02:03
2003-06-15 01:02:03
2003-06-15 01:02:04
2003-06-15 23:59:59
2003-06-25 01:02:03
2004-06-15 01:02:03
2005-06-15 01:02:03
2006-06-15 01:02:03
2038-01-18 03:14:07
SELECT * FROM t1 ORDER BY c1 DESC;
c1
2038-01-18 03:14:07
2006-06-15 01:02:03
2005-06-15 01:02:03
2004-06-15 01:02:03
2003-06-25 01:02:03
2003-06-15 23:59:59
2003-06-15 01:02:04
2003-06-15 01:02:03
2003-06-15 01:02:03
2003-06-15 01:02:03
2003-06-15 01:02:03
2003-06-15 01:02:02
2003-06-15 00:00:00
2002-06-15 01:02:03
2001-06-15 01:02:03
2000-06-15 01:02:03
1970-01-01 00:00:01
SELECT * FROM t1 WHERE c1 >  '2003-06-15 01:02:03' ORDER BY c1 ASC;
c1
2003-06-15 01:02:04
2003-06-15 23:59:59
2003-06-25 01:02:03
2004-06-15 01:02:03
2005-06-15 01:02:03
2006-06-15 01:02:03
2038-01-18 03:14:07
SELECT * FROM t1 WHERE c1 >= '2003-06-15 01:02:03' ORDER BY c1 ASC;
c1
2003-06-15 01:02:03
2003-06-15 01:02:03
2003-06-15 01:02:03
2003-06-15 01:02:03
2003-06-15 01:02:04
2003-06-15 23:59:59
2003-06-25 01:02:03
2004-06-15 01:02:03
2005-06-15 01:02:03
2006-06-15 01:02:03
2038-01-18 03:14:07
SELECT * FROM t1 WHERE c1 <  '2003-06-15 01:02:03' ORDER BY c1 ASC;
c1
1970-01-01 00:00:01
2000-06-15 01:02:03
2001-06-15 01:02:03
2002-06-15 01:02:03
2003-06-15 00:00:00
2003-06-15 01:02:02
SELECT * FROM t1 WHERE c1 <= '2003-06-15 01:02:03' ORDER BY c1 ASC;
c1
1970-01-01 00:00:01
2000-06-15 01:02:03
2001-06-15 01:02:03
2002-06-15 01:02:03
2003-06-15 00:00:00
2003-06-15 01:02:02
2003-06-15 01:02:03
2003-06-15 01:02:03
2003-06-15 01:02:03
2003-06-15 01:02:03
SELECT * FROM t1 WHERE c1 =  '2003-06-15 01:02:03' ORDER BY c1 ASC;
c1
2003-06-15 01:02:03
2003-06-15 01:02:03
2003-06-15 01:02:03
2003-06-15 01:02:03
SELECT * FROM t1 WHERE c1 >  '2003-06-15 01:02:03' ORDER BY c1 DESC;
c1
2038-01-18 03:14:07
2006-06-15 01:02:03
2005-06-15 01:02:03
2004-06-15 01:02:03
2003-06-25 01:02:03
2003-06-15 23:59:59
2003-06-15 01:02:04
SELECT * FROM t1 WHERE c1 >= '2003-06-15 01:02:03' ORDER BY c1 DESC;
c1
2038-01-18 03:14:07
2006-06-15 01:02:03
2005-06-15 01:02:03
2004-06-15 01:02:03
2003-06-25 01:02:03
2003-06-15 23:59:59
2003-06-15 01:02:04
2003-06-15 01:02:03
2003-06-15 01:02:03
2003-06-15 01:02:03
2003-06-15 01:02:03
SELECT * FROM t1 WHERE c1 <  '2003-06-15 01:02:03' ORDER BY c1 DESC;
c1
2003-06-15 01:02:02
2003-06-15 00:00:00
2002-06-15 01:02:03
2001-06-15 01:02:03
2000-06-15 01:02:03
1970-01-01 00:00:01
SELECT * FROM t1 WHERE c1 <= '2003-06-15 01:02:03' ORDER BY c1 DESC;
c1
2003-06-15 01:02:03
2003-06-15 01:02:03
2003-06-15 01:02:03
2003-06-15 01:02:03
2003-06-15 01:02:02
2003-06-15 00:00:00
2002-06-15 01:02:03
2001-06-15 01:02:03
2000-06-15 01:02:03
1970-01-01 00:00:01
SELECT * FROM t1 WHERE c1 =  '2003-06-15 01:02:03' ORDER BY c1 DESC;
c1
2003-06-15 01:02:03
2003-06-15 01:02:03
2003-06-15 01:02:03
2003-06-15 01:02:03
UPDATE t1
SET c1 = '2006-06-15 01:02:03'
WHERE c1 = '2003-06-15 01:02:03'
ORDER BY c1
LIMIT 2;
SELECT * FROM t1 ORDER BY c1;
c1
1970-01-01 00:00:01
2000-06-15 01:02:03
2001-06-15 01:02:03
2002-06-15 01:02:03
2003-06-15 00:00:00
2003-06-15 01:02:02
2003-06-15 01:02:03
2003-06-15 01:02:03
2003-06-15 01:02:04
2003-06-15 23:59:59
2003-06-25 01:02:03
2004-06-15 01:02:03
2005-06-15 01:02:03
2006-06-15 01:02:03
2006-06-15 01:02:03
2006-06-15 01:02:03
2038-01-18 03:14:07
DELETE FROM t1
WHERE c1 = '2003-06-15 01:02:03'
ORDER BY c1;
SELECT * FROM t1 ORDER BY c1;
c1
1970-01-01 00:00:01
2000-06-15 01:02:03
2001-06-15 01:02:03
2002-06-15 01:02:03
2003-06-15 00:00:00
2003-06-15 01:02:02
2003-06-15 01:02:04
2003-06-15 23:59:59
2003-06-25 01:02:03
2004-06-15 01:02:03
2005-06-15 01:02:03
2006-06-15 01:02:03
2006-06-15 01:02:03
2006-06-15 01:02:03
2038-01-18 03:14:07
DROP TABLE t1;
CREATE TABLE t1(c1 TIMESTAMP NULL, c2 TIMESTAMP NULL )
ENGINE=cloud;
INSERT INTO t1 VALUES
('2003-06-15 01:02:03', '2000-06-15 01:02:03'),
('2003-06-15 01:02:03', '2001-06-15 01:02:03'),
('2003-06-15 01:02:03', '2002-06-15 01:02:03'),
('2003-06-15 01:02:03', '2003-06-25 01:02:03'),
('2003-06-15 01:02:03', '2004-06-15 01:02:03'),
('2003-06-15 01:02:03', '2005-06-15 01:02:03'),
('2003-06-15 01:02:03', '2006-06-15 01:02:03'),
('2003-06-15 01:02:03', '2003-06-15 00:00:00'),
('2003-06-15 01:02:03', '2003-06-15 01:02:02'),
('2003-06-15 01:02:03', '2003-06-15 01:02:04'),
('2003-06-15 01:02:03', '2003-06-15 23:59:59'),
('2003-06-15 01:02:03', '1970-01-01 00:00:01'),
('2003-06-15 01:02:03', '2038-01-18 03:14:07'),
('2003-06-15 01:02:03', '2003-06-15 01:02:03'),
('2003-06-15 01:02:03', '2003-06-15 01:02:03'),
('2003-06-15 01:02:03', '2003-06-15 01:02:03'),
('2003-06-15 01:02:03', '2003-06-15 01:02:03');
SELECT * FROM t1 WHERE c1 = '2003-06-15 01:02:03' AND c2 > '2003-06-15 01:02:03' ORDER BY c2 ASC;
c1	c2
2003-06-15 01:02:03	2003-06-15 01:02:04
2003-06-15 01:02:03	2003-06-15 23:59:59
2003-06-15 01:02:03	2003-06-25 01:02:03
2003-06-15 01:02:03	2004-06-15 01:02:03
2003-06-15 01:02:03	2005-06-15 01:02:03
2003-06-15 01:02:03	2006-06-15 01:02:03
2003-06-15 01:02:03	2038-01-18 03:14:07
SELECT * FROM t1 WHERE c1 = '2003-06-15 01:02:03' AND c2 >= '2003-06-15 01:02:03' ORDER BY c2 ASC;
c1	c2
2003-06-15 01:02:03	2003-06-15 01:02:03
2003-06-15 01:02:03	2003-06-15 01:02:03
2003-06-15 01:02:03	2003-06-15 01:02:03
2003-06-15 01:02:03	2003-06-15 01:02:03
2003-06-15 01:02:03	2003-06-15 01:02:04
2003-06-15 01:02:03	2003-06-15 23:59:59
2003-06-15 01:02:03	2003-06-25 01:02:03
2003-06-15 01:02:03	2004-06-15 01:02:03
2003-06-15 01:02:03	2005-06-15 01:02:03
2003-06-15 01:02:03	2006-06-15 01:02:03
2003-06-15 01:02:03	2038-01-18 03:14:07
SELECT * FROM t1 WHERE c1 = '2003-06-15 01:02:03' AND c2 < '2003-06-15 01:02:03' ORDER BY c2 ASC;
c1	c2
2003-06-15 01:02:03	1970-01-01 00:00:01
2003-06-15 01:02:03	2000-06-15 01:02:03
2003-06-15 01:02:03	2001-06-15 01:02:03
2003-06-15 01:02:03	2002-06-15 01:02:03
2003-06-15 01:02:03	2003-06-15 00:00:00
2003-06-15 01:02:03	2003-06-15 01:02:02
SELECT * FROM t1 WHERE c1 = '2003-06-15 01:02:03' AND c2 <= '2003-06-15 01:02:03' ORDER BY c2 ASC;
c1	c2
2003-06-15 01:02:03	1970-01-01 00:00:01
2003-06-15 01:02:03	2000-06-15 01:02:03
2003-06-15 01:02:03	2001-06-15 01:02:03
2003-06-15 01:02:03	2002-06-15 01:02:03
2003-06-15 01:02:03	2003-06-15 00:00:00
2003-06-15 01:02:03	2003-06-15 01:02:02
2003-06-15 01:02:03	2003-06-15 01:02:03
2003-06-15 01:02:03	2003-06-15 01:02:03
2003-06-15 01:02:03	2003-06-15 01:02:03
2003-06-15 01:02:03	2003-06-15 01:02:03
SELECT * FROM t1 WHERE c1 = '2003-06-15 01:02:03' AND c2 > '2003-06-15 01:02:03' ORDER BY c2 DESC;
c1	c2
2003-06-15 01:02:03	2038-01-18 03:14:07
2003-06-15 01:02:03	2006-06-15 01:02:03
2003-06-15 01:02:03	2005-06-15 01:02:03
2003-06-15 01:02:03	2004-06-15 01:02:03
2003-06-15 01:02:03	2003-06-25 01:02:03
2003-06-15 01:02:03	2003-06-15 23:59:59
2003-06-15 01:02:03	2003-06-15 01:02:04
SELECT * FROM t1 WHERE c1 = '2003-06-15 01:02:03' AND c2 >= '2003-06-15 01:02:03' ORDER BY c2 DESC;
c1	c2
2003-06-15 01:02:03	2038-01-18 03:14:07
2003-06-15 01:02:03	2006-06-15 01:02:03
2003-06-15 01:02:03	2005-06-15 01:02:03
2003-06-15 01:02:03	2004-06-15 01:02:03
2003-06-15 01:02:03	2003-06-25 01:02:03
2003-06-15 01:02:03	2003-06-15 23:59:59
2003-06-15 01:02:03	2003-06-15 01:02:04
2003-06-15 01:02:03	2003-06-15 01:02:03
2003-06-15 01:02:03	2003-06-15 01:02:03
2003-06-15 01:02:03	2003-06-15 01:02:03
2003-06-15 01:02:03	2003-06-15 01:02:03
SELECT * FROM t1 WHERE c1 = '2003-06-15 01:02:03' AND c2 < '2003-06-15 01:02:03' ORDER BY c2 DESC;
c1	c2
2003-06-15 01:02:03	2003-06-15 01:02:02
2003-06-15 01:02:03	2003-06-15 00:00:00
2003-06-15 01:02:03	2002-06-15 01:02:03
2003-06-15 01:02:03	2001-06-15 01:02:03
2003-06-15 01:02:03	2000-06-15 01:02:03
2003-06-15 01:02:03	1970-01-01 00:00:01
SELECT * FROM t1 WHERE c1 = '2003-06-15 01:02:03' AND c2 <= '2003-06-15 01:02:03' ORDER BY c2 DESC;
c1	c2
2003-06-15 01:02:03	2003-06-15 01:02:03
2003-06-15 01:02:03	2003-06-15 01:02:03
2003-06-15 01:02:03	2003-06-15 01:02:03
2003-06-15 01:02:03	2003-06-15 01:02:03
2003-06-15 01:02:03	2003-06-15 01:02:02
2003-06-15 01:02:03	2003-06-15 00:00:00
2003-06-15 01:02:03	2002-06-15 01:02:03
2003-06-15 01:02:03	2001-06-15 01:02:03
2003-06-15 01:02:03	2000-06-15 01:02:03
2003-06-15 01:02:03	1970-01-01 00:00:01
DROP TABLE t1;
DROP TABLE IF EXISTS t1;
CREATE TABLE t1(c1 TIMESTAMP NOT NULL , INDEX(c1))
ENGINE=cloud;
INSERT INTO t1 VALUES
('2000-06-15 01:02:03'),
('2001-06-15 01:02:03'),
('2002-06-15 01:02:03'),
('2003-06-25 01:02:03'),
('2004-06-15 01:02:03'),
('2005-06-15 01:02:03'),
('2006-06-15 01:02:03'),
('2003-06-15 00:00:00'),
('2003-06-15 01:02:02'),
('2003-06-15 01:02:04'),
('2003-06-15 23:59:59'),
('1970-01-01 00:00:01'),
('2038-01-18 03:14:07'),
('2003-06-15 01:02:03'),
('2003-06-15 01:02:03'),
('2003-06-15 01:02:03'),
('2003-06-15 01:02:03');
SELECT * FROM t1 ORDER BY c1 ASC;
c1
1970-01-01 00:00:01
2000-06-15 01:02:03
2001-06-15 01:02:03
2002-06-15 01:02:03
2003-06-15 00:00:00
2003-06-15 01:02:02
2003-06-15 01:02:03
2003-06-15 01:02:03
2003-06-15 01:02:03
2003-06-15 01:02:03
2003-06-15 01:02:04
2003-06-15 23:59:59
2003-06-25 01:02:03
2004-06-15 01:02:03
2005-06-15 01:02:03
2006-06-15 01:02:03
2038-01-18 03:14:07
SELECT * FROM t1 ORDER BY c1 DESC;
c1
2038-01-18 03:14:07
2006-06-15 01:02:03
2005-06-15 01:02:03
2004-06-15 01:02:03
2003-06-25 01:02:03
2003-06-15 23:59:59
2003-06-15 01:02:04
2003-06-15 01:02:03
2003-06-15 01:02:03
2003-06-15 01:02:03
2003-06-15 01:02:03
2003-06-15 01:02:02
2003-06-15 00:00:00
2002-06-15 01:02:03
2001-06-15 01:02:03
2000-06-15 01:02:03
1970-01-01 00:00:01
SELECT * FROM t1 WHERE c1 >  '2003-06-15 01:02:03' ORDER BY c1 ASC;
c1
2003-06-15 01:02:04
2003-06-15 23:59:59
2003-06-25 01:02:03
2004-06-15 01:02:03
2005-06-15 01:02:03
2006-06-15 01:02:03
2038-01-18 03:14:07
SELECT * FROM t1 WHERE c1 >= '2003-06-15 01:02:03' ORDER BY c1 ASC;
c1
2003-06-15 01:02:03
2003-06-15 01:02:03
2003-06-15 01:02:03
2003-06-15 01:02:03
2003-06-15 01:02:04
2003-06-15 23:59:59
2003-06-25 01:02:03
2004-06-15 01:02:03
2005-06-15 01:02:03
2006-06-15 01:02:03
2038-01-18 03:14:07
SELECT * FROM t1 WHERE c1 <  '2003-06-15 01:02:03' ORDER BY c1 ASC;
c1
1970-01-01 00:00:01
2000-06-15 01:02:03
2001-06-15 01:02:03
2002-06-15 01:02:03
2003-06-15 00:00:00
2003-06-15 01:02:02
SELECT * FROM t1 WHERE c1 <= '2003-06-15 01:02:03' ORDER BY c1 ASC;
c1
1970-01-01 00:00:01
2000-06-15 01:02:03
2001-06-15 01:02:03
2002-06-15 01:02:03
2003-06-15 00:00:00
2003-06-15 01:02:02
2003-06-15 01:02:03
2003-06-15 01:02:03
2003-06-15 01:02:03
2003-06-15 01:02:03
SELECT * FROM t1 WHERE c1 =  '2003-06-15 01:02:03' ORDER BY c1 ASC;
c1
2003-06-15 01:02:03
2003-06-15 01:02:03
2003-06-15 01:02:03
2003-06-15 01:02:03
SELECT * FROM t1 WHERE c1 >  '2003-06-15 01:02:03' ORDER BY c1 DESC;
c1
2038-01-18 03:14:07
2006-06-15 01:02:03
2005-06-15 01:02:03
2004-06-15 01:02:03
2003-06-25 01:02:03
2003-06-15 23:59:59
2003-06-15 01:02:04
SELECT * FROM t1 WHERE c1 >= '2003-06-15 01:02:03' ORDER BY c1 DESC;
c1
2038-01-18 03:14:07
2006-06-15 01:02:03
2005-06-15 01:02:03
2004-06-15 01:02:03
2003-06-25 01:02:03
2003-06-15 23:59:59
2003-06-15 01:02:04
2003-06-15 01:02:03
2003-06-15 01:02:03
2003-06-15 01:02:03
2003-06-15 01:02:03
SELECT * FROM t1 WHERE c1 <  '2003-06-15 01:02:03' ORDER BY c1 DESC;
c1
2003-06-15 01:02:02
2003-06-15 00:00:00
2002-06-15 01:02:03
2001-06-15 01:02:03
2000-06-15 01:02:03
1970-01-01 00:00:01
SELECT * FROM t1 WHERE c1 <= '2003-06-15 01:02:03' ORDER BY c1 DESC;
c1
2003-06-15 01:02:03
2003-06-15 01:02:03
2003-06-15 01:02:03
2003-06-15 01:02:03
2003-06-15 01:02:02
2003-06-15 00:00:00
2002-06-15 01:02:03
2001-06-15 01:02:03
2000-06-15 01:02:03
1970-01-01 00:00:01
SELECT * FROM t1 WHERE c1 =  '2003-06-15 01:02:03' ORDER BY c1 DESC;
c1
2003-06-15 01:02:03
2003-06-15 01:02:03
2003-06-15 01:02:03
2003-06-15 01:02:03
UPDATE t1
SET c1 = '2006-06-15 01:02:03'
WHERE c1 = '2003-06-15 01:02:03'
ORDER BY c1
LIMIT 2;
SELECT * FROM t1 ORDER BY c1;
c1
1970-01-01 00:00:01
2000-06-15 01:02:03
2001-06-15 01:02:03
2002-06-15 01:02:03
2003-06-15 00:00:00
2003-06-15 01:02:02
2003-06-15 01:02:03
2003-06-15 01:02:03
2003-06-15 01:02:04
2003-06-15 23:59:59
2003-06-25 01:02:03
2004-06-15 01:02:03
2005-06-15 01:02:03
2006-06-15 01:02:03
2006-06-15 01:02:03
2006-06-15 01:02:03
2038-01-18 03:14:07
DELETE FROM t1
WHERE c1 = '2003-06-15 01:02:03'
ORDER BY c1;
SELECT * FROM t1 ORDER BY c1;
c1
1970-01-01 00:00:01
2000-06-15 01:02:03
2001-06-15 01:02:03
2002-06-15 01:02:03
2003-06-15 00:00:00
2003-06-15 01:02:02
2003-06-15 01:02:04
2003-06-15 23:59:59
2003-06-25 01:02:03
2004-06-15 01:02:03
2005-06-15 01:02:03
2006-06-15 01:02:03
2006-06-15 01:02:03
2006-06-15 01:02:03
2038-01-18 03:14:07
DROP TABLE t1;
CREATE TABLE t1(c1 TIMESTAMP NOT NULL, c2 TIMESTAMP NOT NULL , INDEX(c1, c2))
ENGINE=cloud;
INSERT INTO t1 VALUES
('2003-06-15 01:02:03', '2000-06-15 01:02:03'),
('2003-06-15 01:02:03', '2001-06-15 01:02:03'),
('2003-06-15 01:02:03', '2002-06-15 01:02:03'),
('2003-06-15 01:02:03', '2003-06-25 01:02:03'),
('2003-06-15 01:02:03', '2004-06-15 01:02:03'),
('2003-06-15 01:02:03', '2005-06-15 01:02:03'),
('2003-06-15 01:02:03', '2006-06-15 01:02:03'),
('2003-06-15 01:02:03', '2003-06-15 00:00:00'),
('2003-06-15 01:02:03', '2003-06-15 01:02:02'),
('2003-06-15 01:02:03', '2003-06-15 01:02:04'),
('2003-06-15 01:02:03', '2003-06-15 23:59:59'),
('2003-06-15 01:02:03', '1970-01-01 00:00:01'),
('2003-06-15 01:02:03', '2038-01-18 03:14:07'),
('2003-06-15 01:02:03', '2003-06-15 01:02:03'),
('2003-06-15 01:02:03', '2003-06-15 01:02:03'),
('2003-06-15 01:02:03', '2003-06-15 01:02:03'),
('2003-06-15 01:02:03', '2003-06-15 01:02:03');
SELECT * FROM t1 WHERE c1 = '2003-06-15 01:02:03' AND c2 > '2003-06-15 01:02:03' ORDER BY c2 ASC;
c1	c2
2003-06-15 01:02:03	2003-06-15 01:02:04
2003-06-15 01:02:03	2003-06-15 23:59:59
2003-06-15 01:02:03	2003-06-25 01:02:03
2003-06-15 01:02:03	2004-06-15 01:02:03
2003-06-15 01:02:03	2005-06-15 01:02:03
2003-06-15 01:02:03	2006-06-15 01:02:03
2003-06-15 01:02:03	2038-01-18 03:14:07
SELECT * FROM t1 WHERE c1 = '2003-06-15 01:02:03' AND c2 >= '2003-06-15 01:02:03' ORDER BY c2 ASC;
c1	c2
2003-06-15 01:02:03	2003-06-15 01:02:03
2003-06-15 01:02:03	2003-06-15 01:02:03
2003-06-15 01:02:03	2003-06-15 01:02:03
2003-06-15 01:02:03	2003-06-15 01:02:03
2003-06-15 01:02:03	2003-06-15 01:02:04
2003-06-15 01:02:03	2003-06-15 23:59:59
2003-06-15 01:02:03	2003-06-25 01:02:03
2003-06-15 01:02:03	2004-06-15 01:02:03
2003-06-15 01:02:03	2005-06-15 01:02:03
2003-06-15 01:02:03	2006-06-15 01:02:03
2003-06-15 01:02:03	2038-01-18 03:14:07
SELECT * FROM t1 WHERE c1 = '2003-06-15 01:02:03' AND c2 < '2003-06-15 01:02:03' ORDER BY c2 ASC;
c1	c2
2003-06-15 01:02:03	1970-01-01 00:00:01
2003-06-15 01:02:03	2000-06-15 01:02:03
2003-06-15 01:02:03	2001-06-15 01:02:03
2003-06-15 01:02:03	2002-06-15 01:02:03
2003-06-15 01:02:03	2003-06-15 00:00:00
2003-06-15 01:02:03	2003-06-15 01:02:02
SELECT * FROM t1 WHERE c1 = '2003-06-15 01:02:03' AND c2 <= '2003-06-15 01:02:03' ORDER BY c2 ASC;
c1	c2
2003-06-15 01:02:03	1970-01-01 00:00:01
2003-06-15 01:02:03	2000-06-15 01:02:03
2003-06-15 01:02:03	2001-06-15 01:02:03
2003-06-15 01:02:03	2002-06-15 01:02:03
2003-06-15 01:02:03	2003-06-15 00:00:00
2003-06-15 01:02:03	2003-06-15 01:02:02
2003-06-15 01:02:03	2003-06-15 01:02:03
2003-06-15 01:02:03	2003-06-15 01:02:03
2003-06-15 01:02:03	2003-06-15 01:02:03
2003-06-15 01:02:03	2003-06-15 01:02:03
SELECT * FROM t1 WHERE c1 = '2003-06-15 01:02:03' AND c2 > '2003-06-15 01:02:03' ORDER BY c2 DESC;
c1	c2
2003-06-15 01:02:03	2038-01-18 03:14:07
2003-06-15 01:02:03	2006-06-15 01:02:03
2003-06-15 01:02:03	2005-06-15 01:02:03
2003-06-15 01:02:03	2004-06-15 01:02:03
2003-06-15 01:02:03	2003-06-25 01:02:03
2003-06-15 01:02:03	2003-06-15 23:59:59
2003-06-15 01:02:03	2003-06-15 01:02:04
SELECT * FROM t1 WHERE c1 = '2003-06-15 01:02:03' AND c2 >= '2003-06-15 01:02:03' ORDER BY c2 DESC;
c1	c2
2003-06-15 01:02:03	2038-01-18 03:14:07
2003-06-15 01:02:03	2006-06-15 01:02:03
2003-06-15 01:02:03	2005-06-15 01:02:03
2003-06-15 01:02:03	2004-06-15 01:02:03
2003-06-15 01:02:03	2003-06-25 01:02:03
2003-06-15 01:02:03	2003-06-15 23:59:59
2003-06-15 01:02:03	2003-06-15 01:02:04
2003-06-15 01:02:03	2003-06-15 01:02:03
2003-06-15 01:02:03	2003-06-15 01:02:03
2003-06-15 01:02:03	2003-06-15 01:02:03
2003-06-15 01:02:03	2003-06-15 01:02:03
SELECT * FROM t1 WHERE c1 = '2003-06-15 01:02:03' AND c2 < '2003-06-15 01:02:03' ORDER BY c2 DESC;
c1	c2
2003-06-15 01:02:03	2003-06-15 01:02:02
2003-06-15 01:02:03	2003-06-15 00:00:00
2003-06-15 01:02:03	2002-06-15 01:02:03
2003-06-15 01:02:03	2001-06-15 01:02:03
2003-06-15 01:02:03	2000-06-15 01:02:03
2003-06-15 01:02:03	1970-01-01 00:00:01
SELECT * FROM t1 WHERE c1 = '2003-06-15 01:02:03' AND c2 <= '2003-06-15 01:02:03' ORDER BY c2 DESC;
c1	c2
2003-06-15 01:02:03	2003-06-15 01:02:03
2003-06-15 01:02:03	2003-06-15 01:02:03
2003-06-15 01:02:03	2003-06-15 01:02:03
2003-06-15 01:02:03	2003-06-15 01:02:03
2003-06-15 01:02:03	2003-06-15 01:02:02
2003-06-15 01:02:03	2003-06-15 00:00:00
2003-06-15 01:02:03	2002-06-15 01:02:03
2003-06-15 01:02:03	2001-06-15 01:02:03
2003-06-15 01:02:03	2000-06-15 01:02:03
2003-06-15 01:02:03	1970-01-01 00:00:01
DROP TABLE t1;
DROP TABLE IF EXISTS t1;
CREATE TABLE t1(c1 TIMESTAMP NULL , INDEX(c1))
ENGINE=cloud;
INSERT INTO t1 VALUES
('2000-06-15 01:02:03'),
('2001-06-15 01:02:03'),
('2002-06-15 01:02:03'),
('2003-06-25 01:02:03'),
('2004-06-15 01:02:03'),
('2005-06-15 01:02:03'),
('2006-06-15 01:02:03'),
('2003-06-15 00:00:00'),
('2003-06-15 01:02:02'),
('2003-06-15 01:02:04'),
('2003-06-15 23:59:59'),
('1970-01-01 00:00:01'),
('2038-01-18 03:14:07'),
('2003-06-15 01:02:03'),
(NULL),
(NULL),
(NULL),
(NULL);
SELECT * FROM t1 WHERE c1 IS     NULL ORDER BY c1 ASC;
c1
NULL
NULL
NULL
NULL
SELECT * FROM t1 WHERE c1 IS NOT NULL ORDER BY c1 DESC;
c1
2038-01-18 03:14:07
2006-06-15 01:02:03
2005-06-15 01:02:03
2004-06-15 01:02:03
2003-06-25 01:02:03
2003-06-15 23:59:59
2003-06-15 01:02:04
2003-06-15 01:02:03
2003-06-15 01:02:02
2003-06-15 00:00:00
2002-06-15 01:02:03
2001-06-15 01:02:03
2000-06-15 01:02:03
1970-01-01 00:00:01
SELECT * FROM t1 WHERE c1 IS     NULL ORDER BY c1 ASC;
c1
NULL
NULL
NULL
NULL
SELECT * FROM t1 WHERE c1 IS NOT NULL ORDER BY c1 DESC;
c1
2038-01-18 03:14:07
2006-06-15 01:02:03
2005-06-15 01:02:03
2004-06-15 01:02:03
2003-06-25 01:02:03
2003-06-15 23:59:59
2003-06-15 01:02:04
2003-06-15 01:02:03
2003-06-15 01:02:02
2003-06-15 00:00:00
2002-06-15 01:02:03
2001-06-15 01:02:03
2000-06-15 01:02:03
1970-01-01 00:00:01
UPDATE t1
SET c1 = '2003-06-15 01:02:03'
WHERE c1 IS NULL
LIMIT 2;
SELECT * FROM t1 ORDER BY c1;
c1
NULL
NULL
1970-01-01 00:00:01
2000-06-15 01:02:03
2001-06-15 01:02:03
2002-06-15 01:02:03
2003-06-15 00:00:00
2003-06-15 01:02:02
2003-06-15 01:02:03
2003-06-15 01:02:03
2003-06-15 01:02:03
2003-06-15 01:02:04
2003-06-15 23:59:59
2003-06-25 01:02:03
2004-06-15 01:02:03
2005-06-15 01:02:03
2006-06-15 01:02:03
2038-01-18 03:14:07
DELETE FROM t1
WHERE c1 IS NULL
ORDER BY c1;
SELECT * FROM t1 ORDER BY c1;
c1
1970-01-01 00:00:01
2000-06-15 01:02:03
2001-06-15 01:02:03
2002-06-15 01:02:03
2003-06-15 00:00:00
2003-06-15 01:02:02
2003-06-15 01:02:03
2003-06-15 01:02:03
2003-06-15 01:02:03
2003-06-15 01:02:04
2003-06-15 23:59:59
2003-06-25 01:02:03
2004-06-15 01:02:03
2005-06-15 01:02:03
2006-06-15 01:02:03
2038-01-18 03:14:07
DROP TABLE t1;
CREATE TABLE t1(c1 TIMESTAMP NULL, c2 TIMESTAMP NULL , INDEX(c1, c2))
ENGINE=cloud;
INSERT INTO t1 VALUES
('2003-06-15 01:02:03', '2000-06-15 01:02:03'),
('2003-06-15 01:02:03', '2001-06-15 01:02:03'),
('2003-06-15 01:02:03', '2002-06-15 01:02:03'),
('2003-06-15 01:02:03', '2003-06-25 01:02:03'),
('2003-06-15 01:02:03', '2004-06-15 01:02:03'),
('2003-06-15 01:02:03', '2005-06-15 01:02:03'),
('2003-06-15 01:02:03', '2006-06-15 01:02:03'),
('2003-06-15 01:02:03', '2003-06-15 00:00:00'),
('2003-06-15 01:02:03', '2003-06-15 01:02:02'),
('2003-06-15 01:02:03', '2003-06-15 01:02:04'),
('2003-06-15 01:02:03', '2003-06-15 23:59:59'),
('2003-06-15 01:02:03', '1970-01-01 00:00:01'),
('2003-06-15 01:02:03', '2038-01-18 03:14:07'),
('2003-06-15 01:02:03', NULL),
('2003-06-15 01:02:03', NULL),
('2003-06-15 01:02:03', NULL),
('2003-06-15 01:02:03', NULL),
('2003-06-15 01:02:03', '2003-06-15 01:02:03'),
('2003-06-15 01:02:03', '2003-06-15 01:02:03'),
('2003-06-15 01:02:03', '2003-06-15 01:02:03'),
('2003-06-15 01:02:03', '2003-06-15 01:02:03');
SELECT * FROM t1 WHERE c1 = '2003-06-15 01:02:03' AND c2 > '2003-06-15 01:02:03' ORDER BY c2 ASC;
c1	c2
2003-06-15 01:02:03	2003-06-15 01:02:04
2003-06-15 01:02:03	2003-06-15 23:59:59
2003-06-15 01:02:03	2003-06-25 01:02:03
2003-06-15 01:02:03	2004-06-15 01:02:03
2003-06-15 01:02:03	2005-06-15 01:02:03
2003-06-15 01:02:03	2006-06-15 01:02:03
2003-06-15 01:02:03	2038-01-18 03:14:07
SELECT * FROM t1 WHERE c1 = '2003-06-15 01:02:03' AND c2 >= '2003-06-15 01:02:03' ORDER BY c2 ASC;
c1	c2
2003-06-15 01:02:03	2003-06-15 01:02:03
2003-06-15 01:02:03	2003-06-15 01:02:03
2003-06-15 01:02:03	2003-06-15 01:02:03
2003-06-15 01:02:03	2003-06-15 01:02:03
2003-06-15 01:02:03	2003-06-15 01:02:04
2003-06-15 01:02:03	2003-06-15 23:59:59
2003-06-15 01:02:03	2003-06-25 01:02:03
2003-06-15 01:02:03	2004-06-15 01:02:03
2003-06-15 01:02:03	2005-06-15 01:02:03
2003-06-15 01:02:03	2006-06-15 01:02:03
2003-06-15 01:02:03	2038-01-18 03:14:07
SELECT * FROM t1 WHERE c1 = '2003-06-15 01:02:03' AND c2 < '2003-06-15 01:02:03' ORDER BY c2 ASC;
c1	c2
2003-06-15 01:02:03	1970-01-01 00:00:01
2003-06-15 01:02:03	2000-06-15 01:02:03
2003-06-15 01:02:03	2001-06-15 01:02:03
2003-06-15 01:02:03	2002-06-15 01:02:03
2003-06-15 01:02:03	2003-06-15 00:00:00
2003-06-15 01:02:03	2003-06-15 01:02:02
SELECT * FROM t1 WHERE c1 = '2003-06-15 01:02:03' AND c2 <= '2003-06-15 01:02:03' ORDER BY c2 ASC;
c1	c2
2003-06-15 01:02:03	1970-01-01 00:00:01
2003-06-15 01:02:03	2000-06-15 01:02:03
2003-06-15 01:02:03	2001-06-15 01:02:03
2003-06-15 01:02:03	2002-06-15 01:02:03
2003-06-15 01:02:03	2003-06-15 00:00:00
2003-06-15 01:02:03	2003-06-15 01:02:02
2003-06-15 01:02:03	2003-06-15 01:02:03
2003-06-15 01:02:03	2003-06-15 01:02:03
2003-06-15 01:02:03	2003-06-15 01:02:03
2003-06-15 01:02:03	2003-06-15 01:02:03
SELECT * FROM t1 WHERE c1 = '2003-06-15 01:02:03' AND c2 is null ORDER BY c1 ASC;
c1	c2
2003-06-15 01:02:03	NULL
2003-06-15 01:02:03	NULL
2003-06-15 01:02:03	NULL
2003-06-15 01:02:03	NULL
SELECT * FROM t1 WHERE c1 = '2003-06-15 01:02:03' AND c2 is not null ORDER BY c2 ASC;
c1	c2
2003-06-15 01:02:03	1970-01-01 00:00:01
2003-06-15 01:02:03	2000-06-15 01:02:03
2003-06-15 01:02:03	2001-06-15 01:02:03
2003-06-15 01:02:03	2002-06-15 01:02:03
2003-06-15 01:02:03	2003-06-15 00:00:00
2003-06-15 01:02:03	2003-06-15 01:02:02
2003-06-15 01:02:03	2003-06-15 01:02:03
2003-06-15 01:02:03	2003-06-15 01:02:03
2003-06-15 01:02:03	2003-06-15 01:02:03
2003-06-15 01:02:03	2003-06-15 01:02:03
2003-06-15 01:02:03	2003-06-15 01:02:04
2003-06-15 01:02:03	2003-06-15 23:59:59
2003-06-15 01:02:03	2003-06-25 01:02:03
2003-06-15 01:02:03	2004-06-15 01:02:03
2003-06-15 01:02:03	2005-06-15 01:02:03
2003-06-15 01:02:03	2006-06-15 01:02:03
2003-06-15 01:02:03	2038-01-18 03:14:07
SELECT * FROM t1 WHERE c1 = '2003-06-15 01:02:03' AND c2 > '2003-06-15 01:02:03' ORDER BY c2 DESC;
c1	c2
2003-06-15 01:02:03	2038-01-18 03:14:07
2003-06-15 01:02:03	2006-06-15 01:02:03
2003-06-15 01:02:03	2005-06-15 01:02:03
2003-06-15 01:02:03	2004-06-15 01:02:03
2003-06-15 01:02:03	2003-06-25 01:02:03
2003-06-15 01:02:03	2003-06-15 23:59:59
2003-06-15 01:02:03	2003-06-15 01:02:04
SELECT * FROM t1 WHERE c1 = '2003-06-15 01:02:03' AND c2 >= '2003-06-15 01:02:03' ORDER BY c2 DESC;
c1	c2
2003-06-15 01:02:03	2038-01-18 03:14:07
2003-06-15 01:02:03	2006-06-15 01:02:03
2003-06-15 01:02:03	2005-06-15 01:02:03
2003-06-15 01:02:03	2004-06-15 01:02:03
2003-06-15 01:02:03	2003-06-25 01:02:03
2003-06-15 01:02:03	2003-06-15 23:59:59
2003-06-15 01:02:03	2003-06-15 01:02:04
2003-06-15 01:02:03	2003-06-15 01:02:03
2003-06-15 01:02:03	2003-06-15 01:02:03
2003-06-15 01:02:03	2003-06-15 01:02:03
2003-06-15 01:02:03	2003-06-15 01:02:03
SELECT * FROM t1 WHERE c1 = '2003-06-15 01:02:03' AND c2 < '2003-06-15 01:02:03' ORDER BY c2 DESC;
c1	c2
2003-06-15 01:02:03	2003-06-15 01:02:02
2003-06-15 01:02:03	2003-06-15 00:00:00
2003-06-15 01:02:03	2002-06-15 01:02:03
2003-06-15 01:02:03	2001-06-15 01:02:03
2003-06-15 01:02:03	2000-06-15 01:02:03
2003-06-15 01:02:03	1970-01-01 00:00:01
SELECT * FROM t1 WHERE c1 = '2003-06-15 01:02:03' AND c2 <= '2003-06-15 01:02:03' ORDER BY c2 DESC;
c1	c2
2003-06-15 01:02:03	2003-06-15 01:02:03
2003-06-15 01:02:03	2003-06-15 01:02:03
2003-06-15 01:02:03	2003-06-15 01:02:03
2003-06-15 01:02:03	2003-06-15 01:02:03
2003-06-15 01:02:03	2003-06-15 01:02:02
2003-06-15 01:02:03	2003-06-15 00:00:00
2003-06-15 01:02:03	2002-06-15 01:02:03
2003-06-15 01:02:03	2001-06-15 01:02:03
2003-06-15 01:02:03	2000-06-15 01:02:03
2003-06-15 01:02:03	1970-01-01 00:00:01
SELECT * FROM t1 WHERE c1 = '2003-06-15 01:02:03' AND c2 is null ORDER BY c1 DESC;
c1	c2
2003-06-15 01:02:03	NULL
2003-06-15 01:02:03	NULL
2003-06-15 01:02:03	NULL
2003-06-15 01:02:03	NULL
SELECT * FROM t1 WHERE c1 = '2003-06-15 01:02:03' AND c2 is not null ORDER BY c2 DESC;
c1	c2
2003-06-15 01:02:03	2038-01-18 03:14:07
2003-06-15 01:02:03	2006-06-15 01:02:03
2003-06-15 01:02:03	2005-06-15 01:02:03
2003-06-15 01:02:03	2004-06-15 01:02:03
2003-06-15 01:02:03	2003-06-25 01:02:03
2003-06-15 01:02:03	2003-06-15 23:59:59
2003-06-15 01:02:03	2003-06-15 01:02:04
2003-06-15 01:02:03	2003-06-15 01:02:03
2003-06-15 01:02:03	2003-06-15 01:02:03
2003-06-15 01:02:03	2003-06-15 01:02:03
2003-06-15 01:02:03	2003-06-15 01:02:03
2003-06-15 01:02:03	2003-06-15 01:02:02
2003-06-15 01:02:03	2003-06-15 00:00:00
2003-06-15 01:02:03	2002-06-15 01:02:03
2003-06-15 01:02:03	2001-06-15 01:02:03
2003-06-15 01:02:03	2000-06-15 01:02:03
2003-06-15 01:02:03	1970-01-01 00:00:01
DROP TABLE t1;
DROP TABLE IF EXISTS t1;
CREATE TABLE t1(c1 TIMESTAMP NULL , INDEX(c1))
ENGINE=cloud;
INSERT INTO t1 VALUES
('2000-06-15 01:02:03'),
('2001-06-15 01:02:03'),
('2002-06-15 01:02:03'),
('2003-06-25 01:02:03'),
('2004-06-15 01:02:03'),
('2005-06-15 01:02:03'),
('2006-06-15 01:02:03'),
('2003-06-15 00:00:00'),
('2003-06-15 01:02:02'),
('2003-06-15 01:02:04'),
('2003-06-15 23:59:59'),
('1970-01-01 00:00:01'),
('2038-01-18 03:14:07'),
('2003-06-15 01:02:03'),
('2003-06-15 01:02:03'),
('2003-06-15 01:02:03'),
('2003-06-15 01:02:03');
SELECT * FROM t1 ORDER BY c1 ASC;
c1
1970-01-01 00:00:01
2000-06-15 01:02:03
2001-06-15 01:02:03
2002-06-15 01:02:03
2003-06-15 00:00:00
2003-06-15 01:02:02
2003-06-15 01:02:03
2003-06-15 01:02:03
2003-06-15 01:02:03
2003-06-15 01:02:03
2003-06-15 01:02:04
2003-06-15 23:59:59
2003-06-25 01:02:03
2004-06-15 01:02:03
2005-06-15 01:02:03
2006-06-15 01:02:03
2038-01-18 03:14:07
SELECT * FROM t1 ORDER BY c1 DESC;
c1
2038-01-18 03:14:07
2006-06-15 01:02:03
2005-06-15 01:02:03
2004-06-15 01:02:03
2003-06-25 01:02:03
2003-06-15 23:59:59
2003-06-15 01:02:04
2003-06-15 01:02:03
2003-06-15 01:02:03
2003-06-15 01:02:03
2003-06-15 01:02:03
2003-06-15 01:02:02
2003-06-15 00:00:00
2002-06-15 01:02:03
2001-06-15 01:02:03
2000-06-15 01:02:03
1970-01-01 00:00:01
SELECT * FROM t1 WHERE c1 >  '2003-06-15 01:02:03' ORDER BY c1 ASC;
c1
2003-06-15 01:02:04
2003-06-15 23:59:59
2003-06-25 01:02:03
2004-06-15 01:02:03
2005-06-15 01:02:03
2006-06-15 01:02:03
2038-01-18 03:14:07
SELECT * FROM t1 WHERE c1 >= '2003-06-15 01:02:03' ORDER BY c1 ASC;
c1
2003-06-15 01:02:03
2003-06-15 01:02:03
2003-06-15 01:02:03
2003-06-15 01:02:03
2003-06-15 01:02:04
2003-06-15 23:59:59
2003-06-25 01:02:03
2004-06-15 01:02:03
2005-06-15 01:02:03
2006-06-15 01:02:03
2038-01-18 03:14:07
SELECT * FROM t1 WHERE c1 <  '2003-06-15 01:02:03' ORDER BY c1 ASC;
c1
1970-01-01 00:00:01
2000-06-15 01:02:03
2001-06-15 01:02:03
2002-06-15 01:02:03
2003-06-15 00:00:00
2003-06-15 01:02:02
SELECT * FROM t1 WHERE c1 <= '2003-06-15 01:02:03' ORDER BY c1 ASC;
c1
1970-01-01 00:00:01
2000-06-15 01:02:03
2001-06-15 01:02:03
2002-06-15 01:02:03
2003-06-15 00:00:00
2003-06-15 01:02:02
2003-06-15 01:02:03
2003-06-15 01:02:03
2003-06-15 01:02:03
2003-06-15 01:02:03
SELECT * FROM t1 WHERE c1 =  '2003-06-15 01:02:03' ORDER BY c1 ASC;
c1
2003-06-15 01:02:03
2003-06-15 01:02:03
2003-06-15 01:02:03
2003-06-15 01:02:03
SELECT * FROM t1 WHERE c1 >  '2003-06-15 01:02:03' ORDER BY c1 DESC;
c1
2038-01-18 03:14:07
2006-06-15 01:02:03
2005-06-15 01:02:03
2004-06-15 01:02:03
2003-06-25 01:02:03
2003-06-15 23:59:59
2003-06-15 01:02:04
SELECT * FROM t1 WHERE c1 >= '2003-06-15 01:02:03' ORDER BY c1 DESC;
c1
2038-01-18 03:14:07
2006-06-15 01:02:03
2005-06-15 01:02:03
2004-06-15 01:02:03
2003-06-25 01:02:03
2003-06-15 23:59:59
2003-06-15 01:02:04
2003-06-15 01:02:03
2003-06-15 01:02:03
2003-06-15 01:02:03
2003-06-15 01:02:03
SELECT * FROM t1 WHERE c1 <  '2003-06-15 01:02:03' ORDER BY c1 DESC;
c1
2003-06-15 01:02:02
2003-06-15 00:00:00
2002-06-15 01:02:03
2001-06-15 01:02:03
2000-06-15 01:02:03
1970-01-01 00:00:01
SELECT * FROM t1 WHERE c1 <= '2003-06-15 01:02:03' ORDER BY c1 DESC;
c1
2003-06-15 01:02:03
2003-06-15 01:02:03
2003-06-15 01:02:03
2003-06-15 01:02:03
2003-06-15 01:02:02
2003-06-15 00:00:00
2002-06-15 01:02:03
2001-06-15 01:02:03
2000-06-15 01:02:03
1970-01-01 00:00:01
SELECT * FROM t1 WHERE c1 =  '2003-06-15 01:02:03' ORDER BY c1 DESC;
c1
2003-06-15 01:02:03
2003-06-15 01:02:03
2003-06-15 01:02:03
2003-06-15 01:02:03
UPDATE t1
SET c1 = '2006-06-15 01:02:03'
WHERE c1 = '2003-06-15 01:02:03'
ORDER BY c1
LIMIT 2;
SELECT * FROM t1 ORDER BY c1;
c1
1970-01-01 00:00:01
2000-06-15 01:02:03
2001-06-15 01:02:03
2002-06-15 01:02:03
2003-06-15 00:00:00
2003-06-15 01:02:02
2003-06-15 01:02:03
2003-06-15 01:02:03
2003-06-15 01:02:04
2003-06-15 23:59:59
2003-06-25 01:02:03
2004-06-15 01:02:03
2005-06-15 01:02:03
2006-06-15 01:02:03
2006-06-15 01:02:03
2006-06-15 01:02:03
2038-01-18 03:14:07
DELETE FROM t1
WHERE c1 = '2003-06-15 01:02:03'
ORDER BY c1;
SELECT * FROM t1 ORDER BY c1;
c1
1970-01-01 00:00:01
2000-06-15 01:02:03
2001-06-15 01:02:03
2002-06-15 01:02:03
2003-06-15 00:00:00
2003-06-15 01:02:02
2003-06-15 01:02:04
2003-06-15 23:59:59
2003-06-25 01:02:03
2004-06-15 01:02:03
2005-06-15 01:02:03
2006-06-15 01:02:03
2006-06-15 01:02:03
2006-06-15 01:02:03
2038-01-18 03:14:07
DROP TABLE t1;
CREATE TABLE t1(c1 TIMESTAMP NULL, c2 TIMESTAMP NULL , INDEX(c1, c2))
ENGINE=cloud;
INSERT INTO t1 VALUES
('2003-06-15 01:02:03', '2000-06-15 01:02:03'),
('2003-06-15 01:02:03', '2001-06-15 01:02:03'),
('2003-06-15 01:02:03', '2002-06-15 01:02:03'),
('2003-06-15 01:02:03', '2003-06-25 01:02:03'),
('2003-06-15 01:02:03', '2004-06-15 01:02:03'),
('2003-06-15 01:02:03', '2005-06-15 01:02:03'),
('2003-06-15 01:02:03', '2006-06-15 01:02:03'),
('2003-06-15 01:02:03', '2003-06-15 00:00:00'),
('2003-06-15 01:02:03', '2003-06-15 01:02:02'),
('2003-06-15 01:02:03', '2003-06-15 01:02:04'),
('2003-06-15 01:02:03', '2003-06-15 23:59:59'),
('2003-06-15 01:02:03', '1970-01-01 00:00:01'),
('2003-06-15 01:02:03', '2038-01-18 03:14:07'),
('2003-06-15 01:02:03', '2003-06-15 01:02:03'),
('2003-06-15 01:02:03', '2003-06-15 01:02:03'),
('2003-06-15 01:02:03', '2003-06-15 01:02:03'),
('2003-06-15 01:02:03', '2003-06-15 01:02:03');
SELECT * FROM t1 WHERE c1 = '2003-06-15 01:02:03' AND c2 > '2003-06-15 01:02:03' ORDER BY c2 ASC;
c1	c2
2003-06-15 01:02:03	2003-06-15 01:02:04
2003-06-15 01:02:03	2003-06-15 23:59:59
2003-06-15 01:02:03	2003-06-25 01:02:03
2003-06-15 01:02:03	2004-06-15 01:02:03
2003-06-15 01:02:03	2005-06-15 01:02:03
2003-06-15 01:02:03	2006-06-15 01:02:03
2003-06-15 01:02:03	2038-01-18 03:14:07
SELECT * FROM t1 WHERE c1 = '2003-06-15 01:02:03' AND c2 >= '2003-06-15 01:02:03' ORDER BY c2 ASC;
c1	c2
2003-06-15 01:02:03	2003-06-15 01:02:03
2003-06-15 01:02:03	2003-06-15 01:02:03
2003-06-15 01:02:03	2003-06-15 01:02:03
2003-06-15 01:02:03	2003-06-15 01:02:03
2003-06-15 01:02:03	2003-06-15 01:02:04
2003-06-15 01:02:03	2003-06-15 23:59:59
2003-06-15 01:02:03	2003-06-25 01:02:03
2003-06-15 01:02:03	2004-06-15 01:02:03
2003-06-15 01:02:03	2005-06-15 01:02:03
2003-06-15 01:02:03	2006-06-15 01:02:03
2003-06-15 01:02:03	2038-01-18 03:14:07
SELECT * FROM t1 WHERE c1 = '2003-06-15 01:02:03' AND c2 < '2003-06-15 01:02:03' ORDER BY c2 ASC;
c1	c2
2003-06-15 01:02:03	1970-01-01 00:00:01
2003-06-15 01:02:03	2000-06-15 01:02:03
2003-06-15 01:02:03	2001-06-15 01:02:03
2003-06-15 01:02:03	2002-06-15 01:02:03
2003-06-15 01:02:03	2003-06-15 00:00:00
2003-06-15 01:02:03	2003-06-15 01:02:02
SELECT * FROM t1 WHERE c1 = '2003-06-15 01:02:03' AND c2 <= '2003-06-15 01:02:03' ORDER BY c2 ASC;
c1	c2
2003-06-15 01:02:03	1970-01-01 00:00:01
2003-06-15 01:02:03	2000-06-15 01:02:03
2003-06-15 01:02:03	2001-06-15 01:02:03
2003-06-15 01:02:03	2002-06-15 01:02:03
2003-06-15 01:02:03	2003-06-15 00:00:00
2003-06-15 01:02:03	2003-06-15 01:02:02
2003-06-15 01:02:03	2003-06-15 01:02:03
2003-06-15 01:02:03	2003-06-15 01:02:03
2003-06-15 01:02:03	2003-06-15 01:02:03
2003-06-15 01:02:03	2003-06-15 01:02:03
SELECT * FROM t1 WHERE c1 = '2003-06-15 01:02:03' AND c2 > '2003-06-15 01:02:03' ORDER BY c2 DESC;
c1	c2
2003-06-15 01:02:03	2038-01-18 03:14:07
2003-06-15 01:02:03	2006-06-15 01:02:03
2003-06-15 01:02:03	2005-06-15 01:02:03
2003-06-15 01:02:03	2004-06-15 01:02:03
2003-06-15 01:02:03	2003-06-25 01:02:03
2003-06-15 01:02:03	2003-06-15 23:59:59
2003-06-15 01:02:03	2003-06-15 01:02:04
SELECT * FROM t1 WHERE c1 = '2003-06-15 01:02:03' AND c2 >= '2003-06-15 01:02:03' ORDER BY c2 DESC;
c1	c2
2003-06-15 01:02:03	2038-01-18 03:14:07
2003-06-15 01:02:03	2006-06-15 01:02:03
2003-06-15 01:02:03	2005-06-15 01:02:03
2003-06-15 01:02:03	2004-06-15 01:02:03
2003-06-15 01:02:03	2003-06-25 01:02:03
2003-06-15 01:02:03	2003-06-15 23:59:59
2003-06-15 01:02:03	2003-06-15 01:02:04
2003-06-15 01:02:03	2003-06-15 01:02:03
2003-06-15 01:02:03	2003-06-15 01:02:03
2003-06-15 01:02:03	2003-06-15 01:02:03
2003-06-15 01:02:03	2003-06-15 01:02:03
SELECT * FROM t1 WHERE c1 = '2003-06-15 01:02:03' AND c2 < '2003-06-15 01:02:03' ORDER BY c2 DESC;
c1	c2
2003-06-15 01:02:03	2003-06-15 01:02:02
2003-06-15 01:02:03	2003-06-15 00:00:00
2003-06-15 01:02:03	2002-06-15 01:02:03
2003-06-15 01:02:03	2001-06-15 01:02:03
2003-06-15 01:02:03	2000-06-15 01:02:03
2003-06-15 01:02:03	1970-01-01 00:00:01
SELECT * FROM t1 WHERE c1 = '2003-06-15 01:02:03' AND c2 <= '2003-06-15 01:02:03' ORDER BY c2 DESC;
c1	c2
2003-06-15 01:02:03	2003-06-15 01:02:03
2003-06-15 01:02:03	2003-06-15 01:02:03
2003-06-15 01:02:03	2003-06-15 01:02:03
2003-06-15 01:02:03	2003-06-15 01:02:03
2003-06-15 01:02:03	2003-06-15 01:02:02
2003-06-15 01:02:03	2003-06-15 00:00:00
2003-06-15 01:02:03	2002-06-15 01:02:03
2003-06-15 01:02:03	2001-06-15 01:02:03
2003-06-15 01:02:03	2000-06-15 01:02:03
2003-06-15 01:02:03	1970-01-01 00:00:01
DROP TABLE t1;
DROP TABLE IF EXISTS t1;
CREATE TABLE t1(c1 TIMESTAMP NOT NULL )
ENGINE=cloud;
INSERT INTO t1 VALUES
('2000-06-15 01:02:03'),
('2001-06-15 01:02:03'),
('2002-06-15 01:02:03'),
('2003-06-25 01:02:03'),
('2004-06-15 01:02:03'),
('2005-06-15 01:02:03'),
('2006-06-15 01:02:03'),
('2003-06-15 00:00:00'),
('2003-06-15 01:02:02'),
('2003-06-15 01:02:04'),
('2003-06-15 23:59:59'),
('1970-01-01 00:00:01'),
('2038-01-18 03:14:07'),
('2003-06-15 01:02:03'),
('2003-06-15 01:02:03'),
('2003-06-15 01:02:03'),
('2003-06-15 01:02:03');
SELECT * FROM t1 ORDER BY c1 ASC;
c1
1970-01-01 00:00:01
2000-06-15 01:02:03
2001-06-15 01:02:03
2002-06-15 01:02:03
2003-06-15 00:00:00
2003-06-15 01:02:02
2003-06-15 01:02:03
2003-06-15 01:02:03
2003-06-15 01:02:03
2003-06-15 01:02:03
2003-06-15 01:02:04
2003-06-15 23:59:59
2003-06-25 01:02:03
2004-06-15 01:02:03
2005-06-15 01:02:03
2006-06-15 01:02:03
2038-01-18 03:14:07
SELECT * FROM t1 ORDER BY c1 DESC;
c1
2038-01-18 03:14:07
2006-06-15 01:02:03
2005-06-15 01:02:03
2004-06-15 01:02:03
2003-06-25 01:02:03
2003-06-15 23:59:59
2003-06-15 01:02:04
2003-06-15 01:02:03
2003-06-15 01:02:03
2003-06-15 01:02:03
2003-06-15 01:02:03
2003-06-15 01:02:02
2003-06-15 00:00:00
2002-06-15 01:02:03
2001-06-15 01:02:03
2000-06-15 01:02:03
1970-01-01 00:00:01
SELECT * FROM t1 WHERE c1 >  '2003-06-15 01:02:03' ORDER BY c1 ASC;
c1
2003-06-15 01:02:04
2003-06-15 23:59:59
2003-06-25 01:02:03
2004-06-15 01:02:03
2005-06-15 01:02:03
2006-06-15 01:02:03
2038-01-18 03:14:07
SELECT * FROM t1 WHERE c1 >= '2003-06-15 01:02:03' ORDER BY c1 ASC;
c1
2003-06-15 01:02:03
2003-06-15 01:02:03
2003-06-15 01:02:03
2003-06-15 01:02:03
2003-06-15 01:02:04
2003-06-15 23:59:59
2003-06-25 01:02:03
2004-06-15 01:02:03
2005-06-15 01:02:03
2006-06-15 01:02:03
2038-01-18 03:14:07
SELECT * FROM t1 WHERE c1 <  '2003-06-15 01:02:03' ORDER BY c1 ASC;
c1
1970-01-01 00:00:01
2000-06-15 01:02:03
2001-06-15 01:02:03
2002-06-15 01:02:03
2003-06-15 00:00:00
2003-06-15 01:02:02
SELECT * FROM t1 WHERE c1 <= '2003-06-15 01:02:03' ORDER BY c1 ASC;
c1
1970-01-01 00:00:01
2000-06-15 01:02:03
2001-06-15 01:02:03
2002-06-15 01:02:03
2003-06-15 00:00:00
2003-06-15 01:02:02
2003-06-15 01:02:03
2003-06-15 01:02:03
2003-06-15 01:02:03
2003-06-15 01:02:03
SELECT * FROM t1 WHERE c1 =  '2003-06-15 01:02:03' ORDER BY c1 ASC;
c1
2003-06-15 01:02:03
2003-06-15 01:02:03
2003-06-15 01:02:03
2003-06-15 01:02:03
SELECT * FROM t1 WHERE c1 >  '2003-06-15 01:02:03' ORDER BY c1 DESC;
c1
2038-01-18 03:14:07
2006-06-15 01:02:03
2005-06-15 01:02:03
2004-06-15 01:02:03
2003-06-25 01:02:03
2003-06-15 23:59:59
2003-06-15 01:02:04
SELECT * FROM t1 WHERE c1 >= '2003-06-15 01:02:03' ORDER BY c1 DESC;
c1
2038-01-18 03:14:07
2006-06-15 01:02:03
2005-06-15 01:02:03
2004-06-15 01:02:03
2003-06-25 01:02:03
2003-06-15 23:59:59
2003-06-15 01:02:04
2003-06-15 01:02:03
2003-06-15 01:02:03
2003-06-15 01:02:03
2003-06-15 01:02:03
SELECT * FROM t1 WHERE c1 <  '2003-06-15 01:02:03' ORDER BY c1 DESC;
c1
2003-06-15 01:02:02
2003-06-15 00:00:00
2002-06-15 01:02:03
2001-06-15 01:02:03
2000-06-15 01:02:03
1970-01-01 00:00:01
SELECT * FROM t1 WHERE c1 <= '2003-06-15 01:02:03' ORDER BY c1 DESC;
c1
2003-06-15 01:02:03
2003-06-15 01:02:03
2003-06-15 01:02:03
2003-06-15 01:02:03
2003-06-15 01:02:02
2003-06-15 00:00:00
2002-06-15 01:02:03
2001-06-15 01:02:03
2000-06-15 01:02:03
1970-01-01 00:00:01
SELECT * FROM t1 WHERE c1 =  '2003-06-15 01:02:03' ORDER BY c1 DESC;
c1
2003-06-15 01:02:03
2003-06-15 01:02:03
2003-06-15 01:02:03
2003-06-15 01:02:03
UPDATE t1
SET c1 = '2006-06-15 01:02:03'
WHERE c1 = '2003-06-15 01:02:03'
ORDER BY c1
LIMIT 2;
SELECT * FROM t1 ORDER BY c1;
c1
1970-01-01 00:00:01
2000-06-15 01:02:03
2001-06-15 01:02:03
2002-06-15 01:02:03
2003-06-15 00:00:00
2003-06-15 01:02:02
2003-06-15 01:02:03
2003-06-15 01:02:03
2003-06-15 01:02:04
2003-06-15 23:59:59
2003-06-25 01:02:03
2004-06-15 01:02:03
2005-06-15 01:02:03
2006-06-15 01:02:03
2006-06-15 01:02:03
2006-06-15 01:02:03
2038-01-18 03:14:07
DELETE FROM t1
WHERE c1 = '2003-06-15 01:02:03'
ORDER BY c1;
SELECT * FROM t1 ORDER BY c1;
c1
1970-01-01 00:00:01
2000-06-15 01:02:03
2001-06-15 01:02:03
2002-06-15 01:02:03
2003-06-15 00:00:00
2003-06-15 01:02:02
2003-06-15 01:02:04
2003-06-15 23:59:59
2003-06-25 01:02:03
2004-06-15 01:02:03
2005-06-15 01:02:03
2006-06-15 01:02:03
2006-06-15 01:02:03
2006-06-15 01:02:03
2038-01-18 03:14:07
DROP TABLE t1;
CREATE TABLE t1(c1 TIMESTAMP NOT NULL, c2 TIMESTAMP NOT NULL , INDEX(c1, c2))
ENGINE=cloud;
INSERT INTO t1 VALUES
('2003-06-15 01:02:03', '2000-06-15 01:02:03'),
('2003-06-15 01:02:03', '2001-06-15 01:02:03'),
('2003-06-15 01:02:03', '2002-06-15 01:02:03'),
('2003-06-15 01:02:03', '2003-06-25 01:02:03'),
('2003-06-15 01:02:03', '2004-06-15 01:02:03'),
('2003-06-15 01:02:03', '2005-06-15 01:02:03'),
('2003-06-15 01:02:03', '2006-06-15 01:02:03'),
('2003-06-15 01:02:03', '2003-06-15 00:00:00'),
('2003-06-15 01:02:03', '2003-06-15 01:02:02'),
('2003-06-15 01:02:03', '2003-06-15 01:02:04'),
('2003-06-15 01:02:03', '2003-06-15 23:59:59'),
('2003-06-15 01:02:03', '1970-01-01 00:00:01'),
('2003-06-15 01:02:03', '2038-01-18 03:14:07'),
('2003-06-15 01:02:03', '2003-06-15 01:02:03'),
('2003-06-15 01:02:03', '2003-06-15 01:02:03'),
('2003-06-15 01:02:03', '2003-06-15 01:02:03'),
('2003-06-15 01:02:03', '2003-06-15 01:02:03');
SELECT * FROM t1 WHERE c1 = '2003-06-15 01:02:03' AND c2 > '2003-06-15 01:02:03' ORDER BY c2 ASC;
c1	c2
2003-06-15 01:02:03	2003-06-15 01:02:04
2003-06-15 01:02:03	2003-06-15 23:59:59
2003-06-15 01:02:03	2003-06-25 01:02:03
2003-06-15 01:02:03	2004-06-15 01:02:03
2003-06-15 01:02:03	2005-06-15 01:02:03
2003-06-15 01:02:03	2006-06-15 01:02:03
2003-06-15 01:02:03	2038-01-18 03:14:07
SELECT * FROM t1 WHERE c1 = '2003-06-15 01:02:03' AND c2 >= '2003-06-15 01:02:03' ORDER BY c2 ASC;
c1	c2
2003-06-15 01:02:03	2003-06-15 01:02:03
2003-06-15 01:02:03	2003-06-15 01:02:03
2003-06-15 01:02:03	2003-06-15 01:02:03
2003-06-15 01:02:03	2003-06-15 01:02:03
2003-06-15 01:02:03	2003-06-15 01:02:04
2003-06-15 01:02:03	2003-06-15 23:59:59
2003-06-15 01:02:03	2003-06-25 01:02:03
2003-06-15 01:02:03	2004-06-15 01:02:03
2003-06-15 01:02:03	2005-06-15 01:02:03
2003-06-15 01:02:03	2006-06-15 01:02:03
2003-06-15 01:02:03	2038-01-18 03:14:07
SELECT * FROM t1 WHERE c1 = '2003-06-15 01:02:03' AND c2 < '2003-06-15 01:02:03' ORDER BY c2 ASC;
c1	c2
2003-06-15 01:02:03	1970-01-01 00:00:01
2003-06-15 01:02:03	2000-06-15 01:02:03
2003-06-15 01:02:03	2001-06-15 01:02:03
2003-06-15 01:02:03	2002-06-15 01:02:03
2003-06-15 01:02:03	2003-06-15 00:00:00
2003-06-15 01:02:03	2003-06-15 01:02:02
SELECT * FROM t1 WHERE c1 = '2003-06-15 01:02:03' AND c2 <= '2003-06-15 01:02:03' ORDER BY c2 ASC;
c1	c2
2003-06-15 01:02:03	1970-01-01 00:00:01
2003-06-15 01:02:03	2000-06-15 01:02:03
2003-06-15 01:02:03	2001-06-15 01:02:03
2003-06-15 01:02:03	2002-06-15 01:02:03
2003-06-15 01:02:03	2003-06-15 00:00:00
2003-06-15 01:02:03	2003-06-15 01:02:02
2003-06-15 01:02:03	2003-06-15 01:02:03
2003-06-15 01:02:03	2003-06-15 01:02:03
2003-06-15 01:02:03	2003-06-15 01:02:03
2003-06-15 01:02:03	2003-06-15 01:02:03
SELECT * FROM t1 WHERE c1 = '2003-06-15 01:02:03' AND c2 > '2003-06-15 01:02:03' ORDER BY c2 DESC;
c1	c2
2003-06-15 01:02:03	2038-01-18 03:14:07
2003-06-15 01:02:03	2006-06-15 01:02:03
2003-06-15 01:02:03	2005-06-15 01:02:03
2003-06-15 01:02:03	2004-06-15 01:02:03
2003-06-15 01:02:03	2003-06-25 01:02:03
2003-06-15 01:02:03	2003-06-15 23:59:59
2003-06-15 01:02:03	2003-06-15 01:02:04
SELECT * FROM t1 WHERE c1 = '2003-06-15 01:02:03' AND c2 >= '2003-06-15 01:02:03' ORDER BY c2 DESC;
c1	c2
2003-06-15 01:02:03	2038-01-18 03:14:07
2003-06-15 01:02:03	2006-06-15 01:02:03
2003-06-15 01:02:03	2005-06-15 01:02:03
2003-06-15 01:02:03	2004-06-15 01:02:03
2003-06-15 01:02:03	2003-06-25 01:02:03
2003-06-15 01:02:03	2003-06-15 23:59:59
2003-06-15 01:02:03	2003-06-15 01:02:04
2003-06-15 01:02:03	2003-06-15 01:02:03
2003-06-15 01:02:03	2003-06-15 01:02:03
2003-06-15 01:02:03	2003-06-15 01:02:03
2003-06-15 01:02:03	2003-06-15 01:02:03
SELECT * FROM t1 WHERE c1 = '2003-06-15 01:02:03' AND c2 < '2003-06-15 01:02:03' ORDER BY c2 DESC;
c1	c2
2003-06-15 01:02:03	2003-06-15 01:02:02
2003-06-15 01:02:03	2003-06-15 00:00:00
2003-06-15 01:02:03	2002-06-15 01:02:03
2003-06-15 01:02:03	2001-06-15 01:02:03
2003-06-15 01:02:03	2000-06-15 01:02:03
2003-06-15 01:02:03	1970-01-01 00:00:01
SELECT * FROM t1 WHERE c1 = '2003-06-15 01:02:03' AND c2 <= '2003-06-15 01:02:03' ORDER BY c2 DESC;
c1	c2
2003-06-15 01:02:03	2003-06-15 01:02:03
2003-06-15 01:02:03	2003-06-15 01:02:03
2003-06-15 01:02:03	2003-06-15 01:02:03
2003-06-15 01:02:03	2003-06-15 01:02:03
2003-06-15 01:02:03	2003-06-15 01:02:02
2003-06-15 01:02:03	2003-06-15 00:00:00
2003-06-15 01:02:03	2002-06-15 01:02:03
2003-06-15 01:02:03	2001-06-15 01:02:03
2003-06-15 01:02:03	2000-06-15 01:02:03
2003-06-15 01:02:03	1970-01-01 00:00:01
DROP TABLE t1;
DROP TABLE IF EXISTS t1;
CREATE TABLE t1(c1 TIMESTAMP NULL )
ENGINE=cloud;
INSERT INTO t1 VALUES
('2000-06-15 01:02:03'),
('2001-06-15 01:02:03'),
('2002-06-15 01:02:03'),
('2003-06-25 01:02:03'),
('2004-06-15 01:02:03'),
('2005-06-15 01:02:03'),
('2006-06-15 01:02:03'),
('2003-06-15 00:00:00'),
('2003-06-15 01:02:02'),
('2003-06-15 01:02:04'),
('2003-06-15 23:59:59'),
('1970-01-01 00:00:01'),
('2038-01-18 03:14:07'),
('2003-06-15 01:02:03'),
(NULL),
(NULL),
(NULL),
(NULL);
SELECT * FROM t1 WHERE c1 IS     NULL ORDER BY c1 ASC;
c1
NULL
NULL
NULL
NULL
SELECT * FROM t1 WHERE c1 IS NOT NULL ORDER BY c1 DESC;
c1
2038-01-18 03:14:07
2006-06-15 01:02:03
2005-06-15 01:02:03
2004-06-15 01:02:03
2003-06-25 01:02:03
2003-06-15 23:59:59
2003-06-15 01:02:04
2003-06-15 01:02:03
2003-06-15 01:02:02
2003-06-15 00:00:00
2002-06-15 01:02:03
2001-06-15 01:02:03
2000-06-15 01:02:03
1970-01-01 00:00:01
SELECT * FROM t1 WHERE c1 IS     NULL ORDER BY c1 ASC;
c1
NULL
NULL
NULL
NULL
SELECT * FROM t1 WHERE c1 IS NOT NULL ORDER BY c1 DESC;
c1
2038-01-18 03:14:07
2006-06-15 01:02:03
2005-06-15 01:02:03
2004-06-15 01:02:03
2003-06-25 01:02:03
2003-06-15 23:59:59
2003-06-15 01:02:04
2003-06-15 01:02:03
2003-06-15 01:02:02
2003-06-15 00:00:00
2002-06-15 01:02:03
2001-06-15 01:02:03
2000-06-15 01:02:03
1970-01-01 00:00:01
UPDATE t1
SET c1 = '2003-06-15 01:02:03'
WHERE c1 IS NULL
LIMIT 2;
SELECT * FROM t1 ORDER BY c1;
c1
NULL
NULL
1970-01-01 00:00:01
2000-06-15 01:02:03
2001-06-15 01:02:03
2002-06-15 01:02:03
2003-06-15 00:00:00
2003-06-15 01:02:02
2003-06-15 01:02:03
2003-06-15 01:02:03
2003-06-15 01:02:03
2003-06-15 01:02:04
2003-06-15 23:59:59
2003-06-25 01:02:03
2004-06-15 01:02:03
2005-06-15 01:02:03
2006-06-15 01:02:03
2038-01-18 03:14:07
DELETE FROM t1
WHERE c1 IS NULL
ORDER BY c1;
SELECT * FROM t1 ORDER BY c1;
c1
1970-01-01 00:00:01
2000-06-15 01:02:03
2001-06-15 01:02:03
2002-06-15 01:02:03
2003-06-15 00:00:00
2003-06-15 01:02:02
2003-06-15 01:02:03
2003-06-15 01:02:03
2003-06-15 01:02:03
2003-06-15 01:02:04
2003-06-15 23:59:59
2003-06-25 01:02:03
2004-06-15 01:02:03
2005-06-15 01:02:03
2006-06-15 01:02:03
2038-01-18 03:14:07
DROP TABLE t1;
CREATE TABLE t1(c1 TIMESTAMP NULL, c2 TIMESTAMP NULL , INDEX(c1, c2))
ENGINE=cloud;
INSERT INTO t1 VALUES
('2003-06-15 01:02:03', '2000-06-15 01:02:03'),
('2003-06-15 01:02:03', '2001-06-15 01:02:03'),
('2003-06-15 01:02:03', '2002-06-15 01:02:03'),
('2003-06-15 01:02:03', '2003-06-25 01:02:03'),
('2003-06-15 01:02:03', '2004-06-15 01:02:03'),
('2003-06-15 01:02:03', '2005-06-15 01:02:03'),
('2003-06-15 01:02:03', '2006-06-15 01:02:03'),
('2003-06-15 01:02:03', '2003-06-15 00:00:00'),
('2003-06-15 01:02:03', '2003-06-15 01:02:02'),
('2003-06-15 01:02:03', '2003-06-15 01:02:04'),
('2003-06-15 01:02:03', '2003-06-15 23:59:59'),
('2003-06-15 01:02:03', '1970-01-01 00:00:01'),
('2003-06-15 01:02:03', '2038-01-18 03:14:07'),
('2003-06-15 01:02:03', NULL),
('2003-06-15 01:02:03', NULL),
('2003-06-15 01:02:03', NULL),
('2003-06-15 01:02:03', NULL),
('2003-06-15 01:02:03', '2003-06-15 01:02:03'),
('2003-06-15 01:02:03', '2003-06-15 01:02:03'),
('2003-06-15 01:02:03', '2003-06-15 01:02:03'),
('2003-06-15 01:02:03', '2003-06-15 01:02:03');
SELECT * FROM t1 WHERE c1 = '2003-06-15 01:02:03' AND c2 > '2003-06-15 01:02:03' ORDER BY c2 ASC;
c1	c2
2003-06-15 01:02:03	2003-06-15 01:02:04
2003-06-15 01:02:03	2003-06-15 23:59:59
2003-06-15 01:02:03	2003-06-25 01:02:03
2003-06-15 01:02:03	2004-06-15 01:02:03
2003-06-15 01:02:03	2005-06-15 01:02:03
2003-06-15 01:02:03	2006-06-15 01:02:03
2003-06-15 01:02:03	2038-01-18 03:14:07
SELECT * FROM t1 WHERE c1 = '2003-06-15 01:02:03' AND c2 >= '2003-06-15 01:02:03' ORDER BY c2 ASC;
c1	c2
2003-06-15 01:02:03	2003-06-15 01:02:03
2003-06-15 01:02:03	2003-06-15 01:02:03
2003-06-15 01:02:03	2003-06-15 01:02:03
2003-06-15 01:02:03	2003-06-15 01:02:03
2003-06-15 01:02:03	2003-06-15 01:02:04
2003-06-15 01:02:03	2003-06-15 23:59:59
2003-06-15 01:02:03	2003-06-25 01:02:03
2003-06-15 01:02:03	2004-06-15 01:02:03
2003-06-15 01:02:03	2005-06-15 01:02:03
2003-06-15 01:02:03	2006-06-15 01:02:03
2003-06-15 01:02:03	2038-01-18 03:14:07
SELECT * FROM t1 WHERE c1 = '2003-06-15 01:02:03' AND c2 < '2003-06-15 01:02:03' ORDER BY c2 ASC;
c1	c2
2003-06-15 01:02:03	1970-01-01 00:00:01
2003-06-15 01:02:03	2000-06-15 01:02:03
2003-06-15 01:02:03	2001-06-15 01:02:03
2003-06-15 01:02:03	2002-06-15 01:02:03
2003-06-15 01:02:03	2003-06-15 00:00:00
2003-06-15 01:02:03	2003-06-15 01:02:02
SELECT * FROM t1 WHERE c1 = '2003-06-15 01:02:03' AND c2 <= '2003-06-15 01:02:03' ORDER BY c2 ASC;
c1	c2
2003-06-15 01:02:03	1970-01-01 00:00:01
2003-06-15 01:02:03	2000-06-15 01:02:03
2003-06-15 01:02:03	2001-06-15 01:02:03
2003-06-15 01:02:03	2002-06-15 01:02:03
2003-06-15 01:02:03	2003-06-15 00:00:00
2003-06-15 01:02:03	2003-06-15 01:02:02
2003-06-15 01:02:03	2003-06-15 01:02:03
2003-06-15 01:02:03	2003-06-15 01:02:03
2003-06-15 01:02:03	2003-06-15 01:02:03
2003-06-15 01:02:03	2003-06-15 01:02:03
SELECT * FROM t1 WHERE c1 = '2003-06-15 01:02:03' AND c2 is null ORDER BY c1 ASC;
c1	c2
2003-06-15 01:02:03	NULL
2003-06-15 01:02:03	NULL
2003-06-15 01:02:03	NULL
2003-06-15 01:02:03	NULL
SELECT * FROM t1 WHERE c1 = '2003-06-15 01:02:03' AND c2 is not null ORDER BY c2 ASC;
c1	c2
2003-06-15 01:02:03	1970-01-01 00:00:01
2003-06-15 01:02:03	2000-06-15 01:02:03
2003-06-15 01:02:03	2001-06-15 01:02:03
2003-06-15 01:02:03	2002-06-15 01:02:03
2003-06-15 01:02:03	2003-06-15 00:00:00
2003-06-15 01:02:03	2003-06-15 01:02:02
2003-06-15 01:02:03	2003-06-15 01:02:03
2003-06-15 01:02:03	2003-06-15 01:02:03
2003-06-15 01:02:03	2003-06-15 01:02:03
2003-06-15 01:02:03	2003-06-15 01:02:03
2003-06-15 01:02:03	2003-06-15 01:02:04
2003-06-15 01:02:03	2003-06-15 23:59:59
2003-06-15 01:02:03	2003-06-25 01:02:03
2003-06-15 01:02:03	2004-06-15 01:02:03
2003-06-15 01:02:03	2005-06-15 01:02:03
2003-06-15 01:02:03	2006-06-15 01:02:03
2003-06-15 01:02:03	2038-01-18 03:14:07
SELECT * FROM t1 WHERE c1 = '2003-06-15 01:02:03' AND c2 > '2003-06-15 01:02:03' ORDER BY c2 DESC;
c1	c2
2003-06-15 01:02:03	2038-01-18 03:14:07
2003-06-15 01:02:03	2006-06-15 01:02:03
2003-06-15 01:02:03	2005-06-15 01:02:03
2003-06-15 01:02:03	2004-06-15 01:02:03
2003-06-15 01:02:03	2003-06-25 01:02:03
2003-06-15 01:02:03	2003-06-15 23:59:59
2003-06-15 01:02:03	2003-06-15 01:02:04
SELECT * FROM t1 WHERE c1 = '2003-06-15 01:02:03' AND c2 >= '2003-06-15 01:02:03' ORDER BY c2 DESC;
c1	c2
2003-06-15 01:02:03	2038-01-18 03:14:07
2003-06-15 01:02:03	2006-06-15 01:02:03
2003-06-15 01:02:03	2005-06-15 01:02:03
2003-06-15 01:02:03	2004-06-15 01:02:03
2003-06-15 01:02:03	2003-06-25 01:02:03
2003-06-15 01:02:03	2003-06-15 23:59:59
2003-06-15 01:02:03	2003-06-15 01:02:04
2003-06-15 01:02:03	2003-06-15 01:02:03
2003-06-15 01:02:03	2003-06-15 01:02:03
2003-06-15 01:02:03	2003-06-15 01:02:03
2003-06-15 01:02:03	2003-06-15 01:02:03
SELECT * FROM t1 WHERE c1 = '2003-06-15 01:02:03' AND c2 < '2003-06-15 01:02:03' ORDER BY c2 DESC;
c1	c2
2003-06-15 01:02:03	2003-06-15 01:02:02
2003-06-15 01:02:03	2003-06-15 00:00:00
2003-06-15 01:02:03	2002-06-15 01:02:03
2003-06-15 01:02:03	2001-06-15 01:02:03
2003-06-15 01:02:03	2000-06-15 01:02:03
2003-06-15 01:02:03	1970-01-01 00:00:01
SELECT * FROM t1 WHERE c1 = '2003-06-15 01:02:03' AND c2 <= '2003-06-15 01:02:03' ORDER BY c2 DESC;
c1	c2
2003-06-15 01:02:03	2003-06-15 01:02:03
2003-06-15 01:02:03	2003-06-15 01:02:03
2003-06-15 01:02:03	2003-06-15 01:02:03
2003-06-15 01:02:03	2003-06-15 01:02:03
2003-06-15 01:02:03	2003-06-15 01:02:02
2003-06-15 01:02:03	2003-06-15 00:00:00
2003-06-15 01:02:03	2002-06-15 01:02:03
2003-06-15 01:02:03	2001-06-15 01:02:03
2003-06-15 01:02:03	2000-06-15 01:02:03
2003-06-15 01:02:03	1970-01-01 00:00:01
SELECT * FROM t1 WHERE c1 = '2003-06-15 01:02:03' AND c2 is null ORDER BY c1 DESC;
c1	c2
2003-06-15 01:02:03	NULL
2003-06-15 01:02:03	NULL
2003-06-15 01:02:03	NULL
2003-06-15 01:02:03	NULL
SELECT * FROM t1 WHERE c1 = '2003-06-15 01:02:03' AND c2 is not null ORDER BY c2 DESC;
c1	c2
2003-06-15 01:02:03	2038-01-18 03:14:07
2003-06-15 01:02:03	2006-06-15 01:02:03
2003-06-15 01:02:03	2005-06-15 01:02:03
2003-06-15 01:02:03	2004-06-15 01:02:03
2003-06-15 01:02:03	2003-06-25 01:02:03
2003-06-15 01:02:03	2003-06-15 23:59:59
2003-06-15 01:02:03	2003-06-15 01:02:04
2003-06-15 01:02:03	2003-06-15 01:02:03
2003-06-15 01:02:03	2003-06-15 01:02:03
2003-06-15 01:02:03	2003-06-15 01:02:03
2003-06-15 01:02:03	2003-06-15 01:02:03
2003-06-15 01:02:03	2003-06-15 01:02:02
2003-06-15 01:02:03	2003-06-15 00:00:00
2003-06-15 01:02:03	2002-06-15 01:02:03
2003-06-15 01:02:03	2001-06-15 01:02:03
2003-06-15 01:02:03	2000-06-15 01:02:03
2003-06-15 01:02:03	1970-01-01 00:00:01
DROP TABLE t1;
DROP TABLE IF EXISTS t1;
CREATE TABLE t1(c1 TIMESTAMP NULL )
ENGINE=cloud;
INSERT INTO t1 VALUES
('2000-06-15 01:02:03'),
('2001-06-15 01:02:03'),
('2002-06-15 01:02:03'),
('2003-06-25 01:02:03'),
('2004-06-15 01:02:03'),
('2005-06-15 01:02:03'),
('2006-06-15 01:02:03'),
('2003-06-15 00:00:00'),
('2003-06-15 01:02:02'),
('2003-06-15 01:02:04'),
('2003-06-15 23:59:59'),
('1970-01-01 00:00:01'),
('2038-01-18 03:14:07'),
('2003-06-15 01:02:03'),
('2003-06-15 01:02:03'),
('2003-06-15 01:02:03'),
('2003-06-15 01:02:03');
SELECT * FROM t1 ORDER BY c1 ASC;
c1
1970-01-01 00:00:01
2000-06-15 01:02:03
2001-06-15 01:02:03
2002-06-15 01:02:03
2003-06-15 00:00:00
2003-06-15 01:02:02
2003-06-15 01:02:03
2003-06-15 01:02:03
2003-06-15 01:02:03
2003-06-15 01:02:03
2003-06-15 01:02:04
2003-06-15 23:59:59
2003-06-25 01:02:03
2004-06-15 01:02:03
2005-06-15 01:02:03
2006-06-15 01:02:03
2038-01-18 03:14:07
SELECT * FROM t1 ORDER BY c1 DESC;
c1
2038-01-18 03:14:07
2006-06-15 01:02:03
2005-06-15 01:02:03
2004-06-15 01:02:03
2003-06-25 01:02:03
2003-06-15 23:59:59
2003-06-15 01:02:04
2003-06-15 01:02:03
2003-06-15 01:02:03
2003-06-15 01:02:03
2003-06-15 01:02:03
2003-06-15 01:02:02
2003-06-15 00:00:00
2002-06-15 01:02:03
2001-06-15 01:02:03
2000-06-15 01:02:03
1970-01-01 00:00:01
SELECT * FROM t1 WHERE c1 >  '2003-06-15 01:02:03' ORDER BY c1 ASC;
c1
2003-06-15 01:02:04
2003-06-15 23:59:59
2003-06-25 01:02:03
2004-06-15 01:02:03
2005-06-15 01:02:03
2006-06-15 01:02:03
2038-01-18 03:14:07
SELECT * FROM t1 WHERE c1 >= '2003-06-15 01:02:03' ORDER BY c1 ASC;
c1
2003-06-15 01:02:03
2003-06-15 01:02:03
2003-06-15 01:02:03
2003-06-15 01:02:03
2003-06-15 01:02:04
2003-06-15 23:59:59
2003-06-25 01:02:03
2004-06-15 01:02:03
2005-06-15 01:02:03
2006-06-15 01:02:03
2038-01-18 03:14:07
SELECT * FROM t1 WHERE c1 <  '2003-06-15 01:02:03' ORDER BY c1 ASC;
c1
1970-01-01 00:00:01
2000-06-15 01:02:03
2001-06-15 01:02:03
2002-06-15 01:02:03
2003-06-15 00:00:00
2003-06-15 01:02:02
SELECT * FROM t1 WHERE c1 <= '2003-06-15 01:02:03' ORDER BY c1 ASC;
c1
1970-01-01 00:00:01
2000-06-15 01:02:03
2001-06-15 01:02:03
2002-06-15 01:02:03
2003-06-15 00:00:00
2003-06-15 01:02:02
2003-06-15 01:02:03
2003-06-15 01:02:03
2003-06-15 01:02:03
2003-06-15 01:02:03
SELECT * FROM t1 WHERE c1 =  '2003-06-15 01:02:03' ORDER BY c1 ASC;
c1
2003-06-15 01:02:03
2003-06-15 01:02:03
2003-06-15 01:02:03
2003-06-15 01:02:03
SELECT * FROM t1 WHERE c1 >  '2003-06-15 01:02:03' ORDER BY c1 DESC;
c1
2038-01-18 03:14:07
2006-06-15 01:02:03
2005-06-15 01:02:03
2004-06-15 01:02:03
2003-06-25 01:02:03
2003-06-15 23:59:59
2003-06-15 01:02:04
SELECT * FROM t1 WHERE c1 >= '2003-06-15 01:02:03' ORDER BY c1 DESC;
c1
2038-01-18 03:14:07
2006-06-15 01:02:03
2005-06-15 01:02:03
2004-06-15 01:02:03
2003-06-25 01:02:03
2003-06-15 23:59:59
2003-06-15 01:02:04
2003-06-15 01:02:03
2003-06-15 01:02:03
2003-06-15 01:02:03
2003-06-15 01:02:03
SELECT * FROM t1 WHERE c1 <  '2003-06-15 01:02:03' ORDER BY c1 DESC;
c1
2003-06-15 01:02:02
2003-06-15 00:00:00
2002-06-15 01:02:03
2001-06-15 01:02:03
2000-06-15 01:02:03
1970-01-01 00:00:01
SELECT * FROM t1 WHERE c1 <= '2003-06-15 01:02:03' ORDER BY c1 DESC;
c1
2003-06-15 01:02:03
2003-06-15 01:02:03
2003-06-15 01:02:03
2003-06-15 01:02:03
2003-06-15 01:02:02
2003-06-15 00:00:00
2002-06-15 01:02:03
2001-06-15 01:02:03
2000-06-15 01:02:03
1970-01-01 00:00:01
SELECT * FROM t1 WHERE c1 =  '2003-06-15 01:02:03' ORDER BY c1 DESC;
c1
2003-06-15 01:02:03
2003-06-15 01:02:03
2003-06-15 01:02:03
2003-06-15 01:02:03
UPDATE t1
SET c1 = '2006-06-15 01:02:03'
WHERE c1 = '2003-06-15 01:02:03'
ORDER BY c1
LIMIT 2;
SELECT * FROM t1 ORDER BY c1;
c1
1970-01-01 00:00:01
2000-06-15 01:02:03
2001-06-15 01:02:03
2002-06-15 01:02:03
2003-06-15 00:00:00
2003-06-15 01:02:02
2003-06-15 01:02:03
2003-06-15 01:02:03
2003-06-15 01:02:04
2003-06-15 23:59:59
2003-06-25 01:02:03
2004-06-15 01:02:03
2005-06-15 01:02:03
2006-06-15 01:02:03
2006-06-15 01:02:03
2006-06-15 01:02:03
2038-01-18 03:14:07
DELETE FROM t1
WHERE c1 = '2003-06-15 01:02:03'
ORDER BY c1;
SELECT * FROM t1 ORDER BY c1;
c1
1970-01-01 00:00:01
2000-06-15 01:02:03
2001-06-15 01:02:03
2002-06-15 01:02:03
2003-06-15 00:00:00
2003-06-15 01:02:02
2003-06-15 01:02:04
2003-06-15 23:59:59
2003-06-25 01:02:03
2004-06-15 01:02:03
2005-06-15 01:02:03
2006-06-15 01:02:03
2006-06-15 01:02:03
2006-06-15 01:02:03
2038-01-18 03:14:07
DROP TABLE t1;
CREATE TABLE t1(c1 TIMESTAMP NULL, c2 TIMESTAMP NULL , INDEX(c1, c2))
ENGINE=cloud;
INSERT INTO t1 VALUES
('2003-06-15 01:02:03', '2000-06-15 01:02:03'),
('2003-06-15 01:02:03', '2001-06-15 01:02:03'),
('2003-06-15 01:02:03', '2002-06-15 01:02:03'),
('2003-06-15 01:02:03', '2003-06-25 01:02:03'),
('2003-06-15 01:02:03', '2004-06-15 01:02:03'),
('2003-06-15 01:02:03', '2005-06-15 01:02:03'),
('2003-06-15 01:02:03', '2006-06-15 01:02:03'),
('2003-06-15 01:02:03', '2003-06-15 00:00:00'),
('2003-06-15 01:02:03', '2003-06-15 01:02:02'),
('2003-06-15 01:02:03', '2003-06-15 01:02:04'),
('2003-06-15 01:02:03', '2003-06-15 23:59:59'),
('2003-06-15 01:02:03', '1970-01-01 00:00:01'),
('2003-06-15 01:02:03', '2038-01-18 03:14:07'),
('2003-06-15 01:02:03', '2003-06-15 01:02:03'),
('2003-06-15 01:02:03', '2003-06-15 01:02:03'),
('2003-06-15 01:02:03', '2003-06-15 01:02:03'),
('2003-06-15 01:02:03', '2003-06-15 01:02:03');
SELECT * FROM t1 WHERE c1 = '2003-06-15 01:02:03' AND c2 > '2003-06-15 01:02:03' ORDER BY c2 ASC;
c1	c2
2003-06-15 01:02:03	2003-06-15 01:02:04
2003-06-15 01:02:03	2003-06-15 23:59:59
2003-06-15 01:02:03	2003-06-25 01:02:03
2003-06-15 01:02:03	2004-06-15 01:02:03
2003-06-15 01:02:03	2005-06-15 01:02:03
2003-06-15 01:02:03	2006-06-15 01:02:03
2003-06-15 01:02:03	2038-01-18 03:14:07
SELECT * FROM t1 WHERE c1 = '2003-06-15 01:02:03' AND c2 >= '2003-06-15 01:02:03' ORDER BY c2 ASC;
c1	c2
2003-06-15 01:02:03	2003-06-15 01:02:03
2003-06-15 01:02:03	2003-06-15 01:02:03
2003-06-15 01:02:03	2003-06-15 01:02:03
2003-06-15 01:02:03	2003-06-15 01:02:03
2003-06-15 01:02:03	2003-06-15 01:02:04
2003-06-15 01:02:03	2003-06-15 23:59:59
2003-06-15 01:02:03	2003-06-25 01:02:03
2003-06-15 01:02:03	2004-06-15 01:02:03
2003-06-15 01:02:03	2005-06-15 01:02:03
2003-06-15 01:02:03	2006-06-15 01:02:03
2003-06-15 01:02:03	2038-01-18 03:14:07
SELECT * FROM t1 WHERE c1 = '2003-06-15 01:02:03' AND c2 < '2003-06-15 01:02:03' ORDER BY c2 ASC;
c1	c2
2003-06-15 01:02:03	1970-01-01 00:00:01
2003-06-15 01:02:03	2000-06-15 01:02:03
2003-06-15 01:02:03	2001-06-15 01:02:03
2003-06-15 01:02:03	2002-06-15 01:02:03
2003-06-15 01:02:03	2003-06-15 00:00:00
2003-06-15 01:02:03	2003-06-15 01:02:02
SELECT * FROM t1 WHERE c1 = '2003-06-15 01:02:03' AND c2 <= '2003-06-15 01:02:03' ORDER BY c2 ASC;
c1	c2
2003-06-15 01:02:03	1970-01-01 00:00:01
2003-06-15 01:02:03	2000-06-15 01:02:03
2003-06-15 01:02:03	2001-06-15 01:02:03
2003-06-15 01:02:03	2002-06-15 01:02:03
2003-06-15 01:02:03	2003-06-15 00:00:00
2003-06-15 01:02:03	2003-06-15 01:02:02
2003-06-15 01:02:03	2003-06-15 01:02:03
2003-06-15 01:02:03	2003-06-15 01:02:03
2003-06-15 01:02:03	2003-06-15 01:02:03
2003-06-15 01:02:03	2003-06-15 01:02:03
SELECT * FROM t1 WHERE c1 = '2003-06-15 01:02:03' AND c2 > '2003-06-15 01:02:03' ORDER BY c2 DESC;
c1	c2
2003-06-15 01:02:03	2038-01-18 03:14:07
2003-06-15 01:02:03	2006-06-15 01:02:03
2003-06-15 01:02:03	2005-06-15 01:02:03
2003-06-15 01:02:03	2004-06-15 01:02:03
2003-06-15 01:02:03	2003-06-25 01:02:03
2003-06-15 01:02:03	2003-06-15 23:59:59
2003-06-15 01:02:03	2003-06-15 01:02:04
SELECT * FROM t1 WHERE c1 = '2003-06-15 01:02:03' AND c2 >= '2003-06-15 01:02:03' ORDER BY c2 DESC;
c1	c2
2003-06-15 01:02:03	2038-01-18 03:14:07
2003-06-15 01:02:03	2006-06-15 01:02:03
2003-06-15 01:02:03	2005-06-15 01:02:03
2003-06-15 01:02:03	2004-06-15 01:02:03
2003-06-15 01:02:03	2003-06-25 01:02:03
2003-06-15 01:02:03	2003-06-15 23:59:59
2003-06-15 01:02:03	2003-06-15 01:02:04
2003-06-15 01:02:03	2003-06-15 01:02:03
2003-06-15 01:02:03	2003-06-15 01:02:03
2003-06-15 01:02:03	2003-06-15 01:02:03
2003-06-15 01:02:03	2003-06-15 01:02:03
SELECT * FROM t1 WHERE c1 = '2003-06-15 01:02:03' AND c2 < '2003-06-15 01:02:03' ORDER BY c2 DESC;
c1	c2
2003-06-15 01:02:03	2003-06-15 01:02:02
2003-06-15 01:02:03	2003-06-15 00:00:00
2003-06-15 01:02:03	2002-06-15 01:02:03
2003-06-15 01:02:03	2001-06-15 01:02:03
2003-06-15 01:02:03	2000-06-15 01:02:03
2003-06-15 01:02:03	1970-01-01 00:00:01
SELECT * FROM t1 WHERE c1 = '2003-06-15 01:02:03' AND c2 <= '2003-06-15 01:02:03' ORDER BY c2 DESC;
c1	c2
2003-06-15 01:02:03	2003-06-15 01:02:03
2003-06-15 01:02:03	2003-06-15 01:02:03
2003-06-15 01:02:03	2003-06-15 01:02:03
2003-06-15 01:02:03	2003-06-15 01:02:03
2003-06-15 01:02:03	2003-06-15 01:02:02
2003-06-15 01:02:03	2003-06-15 00:00:00
2003-06-15 01:02:03	2002-06-15 01:02:03
2003-06-15 01:02:03	2001-06-15 01:02:03
2003-06-15 01:02:03	2000-06-15 01:02:03
2003-06-15 01:02:03	1970-01-01 00:00:01
DROP TABLE t1;
DROP TABLE IF EXISTS t1;
CREATE TABLE t1(c1 TIMESTAMP NOT NULL , INDEX(c1))
ENGINE=cloud;
INSERT INTO t1 VALUES
('2000-06-15 01:02:03'),
('2001-06-15 01:02:03'),
('2002-06-15 01:02:03'),
('2003-06-25 01:02:03'),
('2004-06-15 01:02:03'),
('2005-06-15 01:02:03'),
('2006-06-15 01:02:03'),
('2003-06-15 00:00:00'),
('2003-06-15 01:02:02'),
('2003-06-15 01:02:04'),
('2003-06-15 23:59:59'),
('1970-01-01 00:00:01'),
('2038-01-18 03:14:07'),
('2003-06-15 01:02:03'),
('2003-06-15 01:02:03'),
('2003-06-15 01:02:03'),
('2003-06-15 01:02:03');
SELECT * FROM t1 ORDER BY c1 ASC;
c1
1970-01-01 00:00:01
2000-06-15 01:02:03
2001-06-15 01:02:03
2002-06-15 01:02:03
2003-06-15 00:00:00
2003-06-15 01:02:02
2003-06-15 01:02:03
2003-06-15 01:02:03
2003-06-15 01:02:03
2003-06-15 01:02:03
2003-06-15 01:02:04
2003-06-15 23:59:59
2003-06-25 01:02:03
2004-06-15 01:02:03
2005-06-15 01:02:03
2006-06-15 01:02:03
2038-01-18 03:14:07
SELECT * FROM t1 ORDER BY c1 DESC;
c1
2038-01-18 03:14:07
2006-06-15 01:02:03
2005-06-15 01:02:03
2004-06-15 01:02:03
2003-06-25 01:02:03
2003-06-15 23:59:59
2003-06-15 01:02:04
2003-06-15 01:02:03
2003-06-15 01:02:03
2003-06-15 01:02:03
2003-06-15 01:02:03
2003-06-15 01:02:02
2003-06-15 00:00:00
2002-06-15 01:02:03
2001-06-15 01:02:03
2000-06-15 01:02:03
1970-01-01 00:00:01
SELECT * FROM t1 WHERE c1 >  '2003-06-15 01:02:03' ORDER BY c1 ASC;
c1
2003-06-15 01:02:04
2003-06-15 23:59:59
2003-06-25 01:02:03
2004-06-15 01:02:03
2005-06-15 01:02:03
2006-06-15 01:02:03
2038-01-18 03:14:07
SELECT * FROM t1 WHERE c1 >= '2003-06-15 01:02:03' ORDER BY c1 ASC;
c1
2003-06-15 01:02:03
2003-06-15 01:02:03
2003-06-15 01:02:03
2003-06-15 01:02:03
2003-06-15 01:02:04
2003-06-15 23:59:59
2003-06-25 01:02:03
2004-06-15 01:02:03
2005-06-15 01:02:03
2006-06-15 01:02:03
2038-01-18 03:14:07
SELECT * FROM t1 WHERE c1 <  '2003-06-15 01:02:03' ORDER BY c1 ASC;
c1
1970-01-01 00:00:01
2000-06-15 01:02:03
2001-06-15 01:02:03
2002-06-15 01:02:03
2003-06-15 00:00:00
2003-06-15 01:02:02
SELECT * FROM t1 WHERE c1 <= '2003-06-15 01:02:03' ORDER BY c1 ASC;
c1
1970-01-01 00:00:01
2000-06-15 01:02:03
2001-06-15 01:02:03
2002-06-15 01:02:03
2003-06-15 00:00:00
2003-06-15 01:02:02
2003-06-15 01:02:03
2003-06-15 01:02:03
2003-06-15 01:02:03
2003-06-15 01:02:03
SELECT * FROM t1 WHERE c1 =  '2003-06-15 01:02:03' ORDER BY c1 ASC;
c1
2003-06-15 01:02:03
2003-06-15 01:02:03
2003-06-15 01:02:03
2003-06-15 01:02:03
SELECT * FROM t1 WHERE c1 >  '2003-06-15 01:02:03' ORDER BY c1 DESC;
c1
2038-01-18 03:14:07
2006-06-15 01:02:03
2005-06-15 01:02:03
2004-06-15 01:02:03
2003-06-25 01:02:03
2003-06-15 23:59:59
2003-06-15 01:02:04
SELECT * FROM t1 WHERE c1 >= '2003-06-15 01:02:03' ORDER BY c1 DESC;
c1
2038-01-18 03:14:07
2006-06-15 01:02:03
2005-06-15 01:02:03
2004-06-15 01:02:03
2003-06-25 01:02:03
2003-06-15 23:59:59
2003-06-15 01:02:04
2003-06-15 01:02:03
2003-06-15 01:02:03
2003-06-15 01:02:03
2003-06-15 01:02:03
SELECT * FROM t1 WHERE c1 <  '2003-06-15 01:02:03' ORDER BY c1 DESC;
c1
2003-06-15 01:02:02
2003-06-15 00:00:00
2002-06-15 01:02:03
2001-06-15 01:02:03
2000-06-15 01:02:03
1970-01-01 00:00:01
SELECT * FROM t1 WHERE c1 <= '2003-06-15 01:02:03' ORDER BY c1 DESC;
c1
2003-06-15 01:02:03
2003-06-15 01:02:03
2003-06-15 01:02:03
2003-06-15 01:02:03
2003-06-15 01:02:02
2003-06-15 00:00:00
2002-06-15 01:02:03
2001-06-15 01:02:03
2000-06-15 01:02:03
1970-01-01 00:00:01
SELECT * FROM t1 WHERE c1 =  '2003-06-15 01:02:03' ORDER BY c1 DESC;
c1
2003-06-15 01:02:03
2003-06-15 01:02:03
2003-06-15 01:02:03
2003-06-15 01:02:03
UPDATE t1
SET c1 = '2006-06-15 01:02:03'
WHERE c1 = '2003-06-15 01:02:03'
ORDER BY c1
LIMIT 2;
SELECT * FROM t1 ORDER BY c1;
c1
1970-01-01 00:00:01
2000-06-15 01:02:03
2001-06-15 01:02:03
2002-06-15 01:02:03
2003-06-15 00:00:00
2003-06-15 01:02:02
2003-06-15 01:02:03
2003-06-15 01:02:03
2003-06-15 01:02:04
2003-06-15 23:59:59
2003-06-25 01:02:03
2004-06-15 01:02:03
2005-06-15 01:02:03
2006-06-15 01:02:03
2006-06-15 01:02:03
2006-06-15 01:02:03
2038-01-18 03:14:07
DELETE FROM t1
WHERE c1 = '2003-06-15 01:02:03'
ORDER BY c1;
SELECT * FROM t1 ORDER BY c1;
c1
1970-01-01 00:00:01
2000-06-15 01:02:03
2001-06-15 01:02:03
2002-06-15 01:02:03
2003-06-15 00:00:00
2003-06-15 01:02:02
2003-06-15 01:02:04
2003-06-15 23:59:59
2003-06-25 01:02:03
2004-06-15 01:02:03
2005-06-15 01:02:03
2006-06-15 01:02:03
2006-06-15 01:02:03
2006-06-15 01:02:03
2038-01-18 03:14:07
DROP TABLE t1;
CREATE TABLE t1(c1 TIMESTAMP NOT NULL, c2 TIMESTAMP NOT NULL , INDEX(c1, c2))
ENGINE=cloud;
INSERT INTO t1 VALUES
('2003-06-15 01:02:03', '2000-06-15 01:02:03'),
('2003-06-15 01:02:03', '2001-06-15 01:02:03'),
('2003-06-15 01:02:03', '2002-06-15 01:02:03'),
('2003-06-15 01:02:03', '2003-06-25 01:02:03'),
('2003-06-15 01:02:03', '2004-06-15 01:02:03'),
('2003-06-15 01:02:03', '2005-06-15 01:02:03'),
('2003-06-15 01:02:03', '2006-06-15 01:02:03'),
('2003-06-15 01:02:03', '2003-06-15 00:00:00'),
('2003-06-15 01:02:03', '2003-06-15 01:02:02'),
('2003-06-15 01:02:03', '2003-06-15 01:02:04'),
('2003-06-15 01:02:03', '2003-06-15 23:59:59'),
('2003-06-15 01:02:03', '1970-01-01 00:00:01'),
('2003-06-15 01:02:03', '2038-01-18 03:14:07'),
('2003-06-15 01:02:03', '2003-06-15 01:02:03'),
('2003-06-15 01:02:03', '2003-06-15 01:02:03'),
('2003-06-15 01:02:03', '2003-06-15 01:02:03'),
('2003-06-15 01:02:03', '2003-06-15 01:02:03');
SELECT * FROM t1 WHERE c1 = '2003-06-15 01:02:03' AND c2 > '2003-06-15 01:02:03' ORDER BY c2 ASC;
c1	c2
2003-06-15 01:02:03	2003-06-15 01:02:04
2003-06-15 01:02:03	2003-06-15 23:59:59
2003-06-15 01:02:03	2003-06-25 01:02:03
2003-06-15 01:02:03	2004-06-15 01:02:03
2003-06-15 01:02:03	2005-06-15 01:02:03
2003-06-15 01:02:03	2006-06-15 01:02:03
2003-06-15 01:02:03	2038-01-18 03:14:07
SELECT * FROM t1 WHERE c1 = '2003-06-15 01:02:03' AND c2 >= '2003-06-15 01:02:03' ORDER BY c2 ASC;
c1	c2
2003-06-15 01:02:03	2003-06-15 01:02:03
2003-06-15 01:02:03	2003-06-15 01:02:03
2003-06-15 01:02:03	2003-06-15 01:02:03
2003-06-15 01:02:03	2003-06-15 01:02:03
2003-06-15 01:02:03	2003-06-15 01:02:04
2003-06-15 01:02:03	2003-06-15 23:59:59
2003-06-15 01:02:03	2003-06-25 01:02:03
2003-06-15 01:02:03	2004-06-15 01:02:03
2003-06-15 01:02:03	2005-06-15 01:02:03
2003-06-15 01:02:03	2006-06-15 01:02:03
2003-06-15 01:02:03	2038-01-18 03:14:07
SELECT * FROM t1 WHERE c1 = '2003-06-15 01:02:03' AND c2 < '2003-06-15 01:02:03' ORDER BY c2 ASC;
c1	c2
2003-06-15 01:02:03	1970-01-01 00:00:01
2003-06-15 01:02:03	2000-06-15 01:02:03
2003-06-15 01:02:03	2001-06-15 01:02:03
2003-06-15 01:02:03	2002-06-15 01:02:03
2003-06-15 01:02:03	2003-06-15 00:00:00
2003-06-15 01:02:03	2003-06-15 01:02:02
SELECT * FROM t1 WHERE c1 = '2003-06-15 01:02:03' AND c2 <= '2003-06-15 01:02:03' ORDER BY c2 ASC;
c1	c2
2003-06-15 01:02:03	1970-01-01 00:00:01
2003-06-15 01:02:03	2000-06-15 01:02:03
2003-06-15 01:02:03	2001-06-15 01:02:03
2003-06-15 01:02:03	2002-06-15 01:02:03
2003-06-15 01:02:03	2003-06-15 00:00:00
2003-06-15 01:02:03	2003-06-15 01:02:02
2003-06-15 01:02:03	2003-06-15 01:02:03
2003-06-15 01:02:03	2003-06-15 01:02:03
2003-06-15 01:02:03	2003-06-15 01:02:03
2003-06-15 01:02:03	2003-06-15 01:02:03
SELECT * FROM t1 WHERE c1 = '2003-06-15 01:02:03' AND c2 > '2003-06-15 01:02:03' ORDER BY c2 DESC;
c1	c2
2003-06-15 01:02:03	2038-01-18 03:14:07
2003-06-15 01:02:03	2006-06-15 01:02:03
2003-06-15 01:02:03	2005-06-15 01:02:03
2003-06-15 01:02:03	2004-06-15 01:02:03
2003-06-15 01:02:03	2003-06-25 01:02:03
2003-06-15 01:02:03	2003-06-15 23:59:59
2003-06-15 01:02:03	2003-06-15 01:02:04
SELECT * FROM t1 WHERE c1 = '2003-06-15 01:02:03' AND c2 >= '2003-06-15 01:02:03' ORDER BY c2 DESC;
c1	c2
2003-06-15 01:02:03	2038-01-18 03:14:07
2003-06-15 01:02:03	2006-06-15 01:02:03
2003-06-15 01:02:03	2005-06-15 01:02:03
2003-06-15 01:02:03	2004-06-15 01:02:03
2003-06-15 01:02:03	2003-06-25 01:02:03
2003-06-15 01:02:03	2003-06-15 23:59:59
2003-06-15 01:02:03	2003-06-15 01:02:04
2003-06-15 01:02:03	2003-06-15 01:02:03
2003-06-15 01:02:03	2003-06-15 01:02:03
2003-06-15 01:02:03	2003-06-15 01:02:03
2003-06-15 01:02:03	2003-06-15 01:02:03
SELECT * FROM t1 WHERE c1 = '2003-06-15 01:02:03' AND c2 < '2003-06-15 01:02:03' ORDER BY c2 DESC;
c1	c2
2003-06-15 01:02:03	2003-06-15 01:02:02
2003-06-15 01:02:03	2003-06-15 00:00:00
2003-06-15 01:02:03	2002-06-15 01:02:03
2003-06-15 01:02:03	2001-06-15 01:02:03
2003-06-15 01:02:03	2000-06-15 01:02:03
2003-06-15 01:02:03	1970-01-01 00:00:01
SELECT * FROM t1 WHERE c1 = '2003-06-15 01:02:03' AND c2 <= '2003-06-15 01:02:03' ORDER BY c2 DESC;
c1	c2
2003-06-15 01:02:03	2003-06-15 01:02:03
2003-06-15 01:02:03	2003-06-15 01:02:03
2003-06-15 01:02:03	2003-06-15 01:02:03
2003-06-15 01:02:03	2003-06-15 01:02:03
2003-06-15 01:02:03	2003-06-15 01:02:02
2003-06-15 01:02:03	2003-06-15 00:00:00
2003-06-15 01:02:03	2002-06-15 01:02:03
2003-06-15 01:02:03	2001-06-15 01:02:03
2003-06-15 01:02:03	2000-06-15 01:02:03
2003-06-15 01:02:03	1970-01-01 00:00:01
DROP TABLE t1;
DROP TABLE IF EXISTS t1;
CREATE TABLE t1(c1 TIMESTAMP NULL , INDEX(c1))
ENGINE=cloud;
INSERT INTO t1 VALUES
('2000-06-15 01:02:03'),
('2001-06-15 01:02:03'),
('2002-06-15 01:02:03'),
('2003-06-25 01:02:03'),
('2004-06-15 01:02:03'),
('2005-06-15 01:02:03'),
('2006-06-15 01:02:03'),
('2003-06-15 00:00:00'),
('2003-06-15 01:02:02'),
('2003-06-15 01:02:04'),
('2003-06-15 23:59:59'),
('1970-01-01 00:00:01'),
('2038-01-18 03:14:07'),
('2003-06-15 01:02:03'),
(NULL),
(NULL),
(NULL),
(NULL);
SELECT * FROM t1 WHERE c1 IS     NULL ORDER BY c1 ASC;
c1
NULL
NULL
NULL
NULL
SELECT * FROM t1 WHERE c1 IS NOT NULL ORDER BY c1 DESC;
c1
2038-01-18 03:14:07
2006-06-15 01:02:03
2005-06-15 01:02:03
2004-06-15 01:02:03
2003-06-25 01:02:03
2003-06-15 23:59:59
2003-06-15 01:02:04
2003-06-15 01:02:03
2003-06-15 01:02:02
2003-06-15 00:00:00
2002-06-15 01:02:03
2001-06-15 01:02:03
2000-06-15 01:02:03
1970-01-01 00:00:01
SELECT * FROM t1 WHERE c1 IS     NULL ORDER BY c1 ASC;
c1
NULL
NULL
NULL
NULL
SELECT * FROM t1 WHERE c1 IS NOT NULL ORDER BY c1 DESC;
c1
2038-01-18 03:14:07
2006-06-15 01:02:03
2005-06-15 01:02:03
2004-06-15 01:02:03
2003-06-25 01:02:03
2003-06-15 23:59:59
2003-06-15 01:02:04
2003-06-15 01:02:03
2003-06-15 01:02:02
2003-06-15 00:00:00
2002-06-15 01:02:03
2001-06-15 01:02:03
2000-06-15 01:02:03
1970-01-01 00:00:01
UPDATE t1
SET c1 = '2003-06-15 01:02:03'
WHERE c1 IS NULL
LIMIT 2;
SELECT * FROM t1 ORDER BY c1;
c1
NULL
NULL
1970-01-01 00:00:01
2000-06-15 01:02:03
2001-06-15 01:02:03
2002-06-15 01:02:03
2003-06-15 00:00:00
2003-06-15 01:02:02
2003-06-15 01:02:03
2003-06-15 01:02:03
2003-06-15 01:02:03
2003-06-15 01:02:04
2003-06-15 23:59:59
2003-06-25 01:02:03
2004-06-15 01:02:03
2005-06-15 01:02:03
2006-06-15 01:02:03
2038-01-18 03:14:07
DELETE FROM t1
WHERE c1 IS NULL
ORDER BY c1;
SELECT * FROM t1 ORDER BY c1;
c1
1970-01-01 00:00:01
2000-06-15 01:02:03
2001-06-15 01:02:03
2002-06-15 01:02:03
2003-06-15 00:00:00
2003-06-15 01:02:02
2003-06-15 01:02:03
2003-06-15 01:02:03
2003-06-15 01:02:03
2003-06-15 01:02:04
2003-06-15 23:59:59
2003-06-25 01:02:03
2004-06-15 01:02:03
2005-06-15 01:02:03
2006-06-15 01:02:03
2038-01-18 03:14:07
DROP TABLE t1;
CREATE TABLE t1(c1 TIMESTAMP NULL, c2 TIMESTAMP NULL , INDEX(c1, c2))
ENGINE=cloud;
INSERT INTO t1 VALUES
('2003-06-15 01:02:03', '2000-06-15 01:02:03'),
('2003-06-15 01:02:03', '2001-06-15 01:02:03'),
('2003-06-15 01:02:03', '2002-06-15 01:02:03'),
('2003-06-15 01:02:03', '2003-06-25 01:02:03'),
('2003-06-15 01:02:03', '2004-06-15 01:02:03'),
('2003-06-15 01:02:03', '2005-06-15 01:02:03'),
('2003-06-15 01:02:03', '2006-06-15 01:02:03'),
('2003-06-15 01:02:03', '2003-06-15 00:00:00'),
('2003-06-15 01:02:03', '2003-06-15 01:02:02'),
('2003-06-15 01:02:03', '2003-06-15 01:02:04'),
('2003-06-15 01:02:03', '2003-06-15 23:59:59'),
('2003-06-15 01:02:03', '1970-01-01 00:00:01'),
('2003-06-15 01:02:03', '2038-01-18 03:14:07'),
('2003-06-15 01:02:03', NULL),
('2003-06-15 01:02:03', NULL),
('2003-06-15 01:02:03', NULL),
('2003-06-15 01:02:03', NULL),
('2003-06-15 01:02:03', '2003-06-15 01:02:03'),
('2003-06-15 01:02:03', '2003-06-15 01:02:03'),
('2003-06-15 01:02:03', '2003-06-15 01:02:03'),
('2003-06-15 01:02:03', '2003-06-15 01:02:03');
SELECT * FROM t1 WHERE c1 = '2003-06-15 01:02:03' AND c2 > '2003-06-15 01:02:03' ORDER BY c2 ASC;
c1	c2
2003-06-15 01:02:03	2003-06-15 01:02:04
2003-06-15 01:02:03	2003-06-15 23:59:59
2003-06-15 01:02:03	2003-06-25 01:02:03
2003-06-15 01:02:03	2004-06-15 01:02:03
2003-06-15 01:02:03	2005-06-15 01:02:03
2003-06-15 01:02:03	2006-06-15 01:02:03
2003-06-15 01:02:03	2038-01-18 03:14:07
SELECT * FROM t1 WHERE c1 = '2003-06-15 01:02:03' AND c2 >= '2003-06-15 01:02:03' ORDER BY c2 ASC;
c1	c2
2003-06-15 01:02:03	2003-06-15 01:02:03
2003-06-15 01:02:03	2003-06-15 01:02:03
2003-06-15 01:02:03	2003-06-15 01:02:03
2003-06-15 01:02:03	2003-06-15 01:02:03
2003-06-15 01:02:03	2003-06-15 01:02:04
2003-06-15 01:02:03	2003-06-15 23:59:59
2003-06-15 01:02:03	2003-06-25 01:02:03
2003-06-15 01:02:03	2004-06-15 01:02:03
2003-06-15 01:02:03	2005-06-15 01:02:03
2003-06-15 01:02:03	2006-06-15 01:02:03
2003-06-15 01:02:03	2038-01-18 03:14:07
SELECT * FROM t1 WHERE c1 = '2003-06-15 01:02:03' AND c2 < '2003-06-15 01:02:03' ORDER BY c2 ASC;
c1	c2
2003-06-15 01:02:03	1970-01-01 00:00:01
2003-06-15 01:02:03	2000-06-15 01:02:03
2003-06-15 01:02:03	2001-06-15 01:02:03
2003-06-15 01:02:03	2002-06-15 01:02:03
2003-06-15 01:02:03	2003-06-15 00:00:00
2003-06-15 01:02:03	2003-06-15 01:02:02
SELECT * FROM t1 WHERE c1 = '2003-06-15 01:02:03' AND c2 <= '2003-06-15 01:02:03' ORDER BY c2 ASC;
c1	c2
2003-06-15 01:02:03	1970-01-01 00:00:01
2003-06-15 01:02:03	2000-06-15 01:02:03
2003-06-15 01:02:03	2001-06-15 01:02:03
2003-06-15 01:02:03	2002-06-15 01:02:03
2003-06-15 01:02:03	2003-06-15 00:00:00
2003-06-15 01:02:03	2003-06-15 01:02:02
2003-06-15 01:02:03	2003-06-15 01:02:03
2003-06-15 01:02:03	2003-06-15 01:02:03
2003-06-15 01:02:03	2003-06-15 01:02:03
2003-06-15 01:02:03	2003-06-15 01:02:03
SELECT * FROM t1 WHERE c1 = '2003-06-15 01:02:03' AND c2 is null ORDER BY c1 ASC;
c1	c2
2003-06-15 01:02:03	NULL
2003-06-15 01:02:03	NULL
2003-06-15 01:02:03	NULL
2003-06-15 01:02:03	NULL
SELECT * FROM t1 WHERE c1 = '2003-06-15 01:02:03' AND c2 is not null ORDER BY c2 ASC;
c1	c2
2003-06-15 01:02:03	1970-01-01 00:00:01
2003-06-15 01:02:03	2000-06-15 01:02:03
2003-06-15 01:02:03	2001-06-15 01:02:03
2003-06-15 01:02:03	2002-06-15 01:02:03
2003-06-15 01:02:03	2003-06-15 00:00:00
2003-06-15 01:02:03	2003-06-15 01:02:02
2003-06-15 01:02:03	2003-06-15 01:02:03
2003-06-15 01:02:03	2003-06-15 01:02:03
2003-06-15 01:02:03	2003-06-15 01:02:03
2003-06-15 01:02:03	2003-06-15 01:02:03
2003-06-15 01:02:03	2003-06-15 01:02:04
2003-06-15 01:02:03	2003-06-15 23:59:59
2003-06-15 01:02:03	2003-06-25 01:02:03
2003-06-15 01:02:03	2004-06-15 01:02:03
2003-06-15 01:02:03	2005-06-15 01:02:03
2003-06-15 01:02:03	2006-06-15 01:02:03
2003-06-15 01:02:03	2038-01-18 03:14:07
SELECT * FROM t1 WHERE c1 = '2003-06-15 01:02:03' AND c2 > '2003-06-15 01:02:03' ORDER BY c2 DESC;
c1	c2
2003-06-15 01:02:03	2038-01-18 03:14:07
2003-06-15 01:02:03	2006-06-15 01:02:03
2003-06-15 01:02:03	2005-06-15 01:02:03
2003-06-15 01:02:03	2004-06-15 01:02:03
2003-06-15 01:02:03	2003-06-25 01:02:03
2003-06-15 01:02:03	2003-06-15 23:59:59
2003-06-15 01:02:03	2003-06-15 01:02:04
SELECT * FROM t1 WHERE c1 = '2003-06-15 01:02:03' AND c2 >= '2003-06-15 01:02:03' ORDER BY c2 DESC;
c1	c2
2003-06-15 01:02:03	2038-01-18 03:14:07
2003-06-15 01:02:03	2006-06-15 01:02:03
2003-06-15 01:02:03	2005-06-15 01:02:03
2003-06-15 01:02:03	2004-06-15 01:02:03
2003-06-15 01:02:03	2003-06-25 01:02:03
2003-06-15 01:02:03	2003-06-15 23:59:59
2003-06-15 01:02:03	2003-06-15 01:02:04
2003-06-15 01:02:03	2003-06-15 01:02:03
2003-06-15 01:02:03	2003-06-15 01:02:03
2003-06-15 01:02:03	2003-06-15 01:02:03
2003-06-15 01:02:03	2003-06-15 01:02:03
SELECT * FROM t1 WHERE c1 = '2003-06-15 01:02:03' AND c2 < '2003-06-15 01:02:03' ORDER BY c2 DESC;
c1	c2
2003-06-15 01:02:03	2003-06-15 01:02:02
2003-06-15 01:02:03	2003-06-15 00:00:00
2003-06-15 01:02:03	2002-06-15 01:02:03
2003-06-15 01:02:03	2001-06-15 01:02:03
2003-06-15 01:02:03	2000-06-15 01:02:03
2003-06-15 01:02:03	1970-01-01 00:00:01
SELECT * FROM t1 WHERE c1 = '2003-06-15 01:02:03' AND c2 <= '2003-06-15 01:02:03' ORDER BY c2 DESC;
c1	c2
2003-06-15 01:02:03	2003-06-15 01:02:03
2003-06-15 01:02:03	2003-06-15 01:02:03
2003-06-15 01:02:03	2003-06-15 01:02:03
2003-06-15 01:02:03	2003-06-15 01:02:03
2003-06-15 01:02:03	2003-06-15 01:02:02
2003-06-15 01:02:03	2003-06-15 00:00:00
2003-06-15 01:02:03	2002-06-15 01:02:03
2003-06-15 01:02:03	2001-06-15 01:02:03
2003-06-15 01:02:03	2000-06-15 01:02:03
2003-06-15 01:02:03	1970-01-01 00:00:01
SELECT * FROM t1 WHERE c1 = '2003-06-15 01:02:03' AND c2 is null ORDER BY c1 DESC;
c1	c2
2003-06-15 01:02:03	NULL
2003-06-15 01:02:03	NULL
2003-06-15 01:02:03	NULL
2003-06-15 01:02:03	NULL
SELECT * FROM t1 WHERE c1 = '2003-06-15 01:02:03' AND c2 is not null ORDER BY c2 DESC;
c1	c2
2003-06-15 01:02:03	2038-01-18 03:14:07
2003-06-15 01:02:03	2006-06-15 01:02:03
2003-06-15 01:02:03	2005-06-15 01:02:03
2003-06-15 01:02:03	2004-06-15 01:02:03
2003-06-15 01:02:03	2003-06-25 01:02:03
2003-06-15 01:02:03	2003-06-15 23:59:59
2003-06-15 01:02:03	2003-06-15 01:02:04
2003-06-15 01:02:03	2003-06-15 01:02:03
2003-06-15 01:02:03	2003-06-15 01:02:03
2003-06-15 01:02:03	2003-06-15 01:02:03
2003-06-15 01:02:03	2003-06-15 01:02:03
2003-06-15 01:02:03	2003-06-15 01:02:02
2003-06-15 01:02:03	2003-06-15 00:00:00
2003-06-15 01:02:03	2002-06-15 01:02:03
2003-06-15 01:02:03	2001-06-15 01:02:03
2003-06-15 01:02:03	2000-06-15 01:02:03
2003-06-15 01:02:03	1970-01-01 00:00:01
DROP TABLE t1;
DROP TABLE IF EXISTS t1;
CREATE TABLE t1(c1 TIMESTAMP NULL , INDEX(c1))
ENGINE=cloud;
INSERT INTO t1 VALUES
('2000-06-15 01:02:03'),
('2001-06-15 01:02:03'),
('2002-06-15 01:02:03'),
('2003-06-25 01:02:03'),
('2004-06-15 01:02:03'),
('2005-06-15 01:02:03'),
('2006-06-15 01:02:03'),
('2003-06-15 00:00:00'),
('2003-06-15 01:02:02'),
('2003-06-15 01:02:04'),
('2003-06-15 23:59:59'),
('1970-01-01 00:00:01'),
('2038-01-18 03:14:07'),
('2003-06-15 01:02:03'),
('2003-06-15 01:02:03'),
('2003-06-15 01:02:03'),
('2003-06-15 01:02:03');
SELECT * FROM t1 ORDER BY c1 ASC;
c1
1970-01-01 00:00:01
2000-06-15 01:02:03
2001-06-15 01:02:03
2002-06-15 01:02:03
2003-06-15 00:00:00
2003-06-15 01:02:02
2003-06-15 01:02:03
2003-06-15 01:02:03
2003-06-15 01:02:03
2003-06-15 01:02:03
2003-06-15 01:02:04
2003-06-15 23:59:59
2003-06-25 01:02:03
2004-06-15 01:02:03
2005-06-15 01:02:03
2006-06-15 01:02:03
2038-01-18 03:14:07
SELECT * FROM t1 ORDER BY c1 DESC;
c1
2038-01-18 03:14:07
2006-06-15 01:02:03
2005-06-15 01:02:03
2004-06-15 01:02:03
2003-06-25 01:02:03
2003-06-15 23:59:59
2003-06-15 01:02:04
2003-06-15 01:02:03
2003-06-15 01:02:03
2003-06-15 01:02:03
2003-06-15 01:02:03
2003-06-15 01:02:02
2003-06-15 00:00:00
2002-06-15 01:02:03
2001-06-15 01:02:03
2000-06-15 01:02:03
1970-01-01 00:00:01
SELECT * FROM t1 WHERE c1 >  '2003-06-15 01:02:03' ORDER BY c1 ASC;
c1
2003-06-15 01:02:04
2003-06-15 23:59:59
2003-06-25 01:02:03
2004-06-15 01:02:03
2005-06-15 01:02:03
2006-06-15 01:02:03
2038-01-18 03:14:07
SELECT * FROM t1 WHERE c1 >= '2003-06-15 01:02:03' ORDER BY c1 ASC;
c1
2003-06-15 01:02:03
2003-06-15 01:02:03
2003-06-15 01:02:03
2003-06-15 01:02:03
2003-06-15 01:02:04
2003-06-15 23:59:59
2003-06-25 01:02:03
2004-06-15 01:02:03
2005-06-15 01:02:03
2006-06-15 01:02:03
2038-01-18 03:14:07
SELECT * FROM t1 WHERE c1 <  '2003-06-15 01:02:03' ORDER BY c1 ASC;
c1
1970-01-01 00:00:01
2000-06-15 01:02:03
2001-06-15 01:02:03
2002-06-15 01:02:03
2003-06-15 00:00:00
2003-06-15 01:02:02
SELECT * FROM t1 WHERE c1 <= '2003-06-15 01:02:03' ORDER BY c1 ASC;
c1
1970-01-01 00:00:01
2000-06-15 01:02:03
2001-06-15 01:02:03
2002-06-15 01:02:03
2003-06-15 00:00:00
2003-06-15 01:02:02
2003-06-15 01:02:03
2003-06-15 01:02:03
2003-06-15 01:02:03
2003-06-15 01:02:03
SELECT * FROM t1 WHERE c1 =  '2003-06-15 01:02:03' ORDER BY c1 ASC;
c1
2003-06-15 01:02:03
2003-06-15 01:02:03
2003-06-15 01:02:03
2003-06-15 01:02:03
SELECT * FROM t1 WHERE c1 >  '2003-06-15 01:02:03' ORDER BY c1 DESC;
c1
2038-01-18 03:14:07
2006-06-15 01:02:03
2005-06-15 01:02:03
2004-06-15 01:02:03
2003-06-25 01:02:03
2003-06-15 23:59:59
2003-06-15 01:02:04
SELECT * FROM t1 WHERE c1 >= '2003-06-15 01:02:03' ORDER BY c1 DESC;
c1
2038-01-18 03:14:07
2006-06-15 01:02:03
2005-06-15 01:02:03
2004-06-15 01:02:03
2003-06-25 01:02:03
2003-06-15 23:59:59
2003-06-15 01:02:04
2003-06-15 01:02:03
2003-06-15 01:02:03
2003-06-15 01:02:03
2003-06-15 01:02:03
SELECT * FROM t1 WHERE c1 <  '2003-06-15 01:02:03' ORDER BY c1 DESC;
c1
2003-06-15 01:02:02
2003-06-15 00:00:00
2002-06-15 01:02:03
2001-06-15 01:02:03
2000-06-15 01:02:03
1970-01-01 00:00:01
SELECT * FROM t1 WHERE c1 <= '2003-06-15 01:02:03' ORDER BY c1 DESC;
c1
2003-06-15 01:02:03
2003-06-15 01:02:03
2003-06-15 01:02:03
2003-06-15 01:02:03
2003-06-15 01:02:02
2003-06-15 00:00:00
2002-06-15 01:02:03
2001-06-15 01:02:03
2000-06-15 01:02:03
1970-01-01 00:00:01
SELECT * FROM t1 WHERE c1 =  '2003-06-15 01:02:03' ORDER BY c1 DESC;
c1
2003-06-15 01:02:03
2003-06-15 01:02:03
2003-06-15 01:02:03
2003-06-15 01:02:03
UPDATE t1
SET c1 = '2006-06-15 01:02:03'
WHERE c1 = '2003-06-15 01:02:03'
ORDER BY c1
LIMIT 2;
SELECT * FROM t1 ORDER BY c1;
c1
1970-01-01 00:00:01
2000-06-15 01:02:03
2001-06-15 01:02:03
2002-06-15 01:02:03
2003-06-15 00:00:00
2003-06-15 01:02:02
2003-06-15 01:02:03
2003-06-15 01:02:03
2003-06-15 01:02:04
2003-06-15 23:59:59
2003-06-25 01:02:03
2004-06-15 01:02:03
2005-06-15 01:02:03
2006-06-15 01:02:03
2006-06-15 01:02:03
2006-06-15 01:02:03
2038-01-18 03:14:07
DELETE FROM t1
WHERE c1 = '2003-06-15 01:02:03'
ORDER BY c1;
SELECT * FROM t1 ORDER BY c1;
c1
1970-01-01 00:00:01
2000-06-15 01:02:03
2001-06-15 01:02:03
2002-06-15 01:02:03
2003-06-15 00:00:00
2003-06-15 01:02:02
2003-06-15 01:02:04
2003-06-15 23:59:59
2003-06-25 01:02:03
2004-06-15 01:02:03
2005-06-15 01:02:03
2006-06-15 01:02:03
2006-06-15 01:02:03
2006-06-15 01:02:03
2038-01-18 03:14:07
DROP TABLE t1;
CREATE TABLE t1(c1 TIMESTAMP NULL, c2 TIMESTAMP NULL , INDEX(c1, c2))
ENGINE=cloud;
INSERT INTO t1 VALUES
('2003-06-15 01:02:03', '2000-06-15 01:02:03'),
('2003-06-15 01:02:03', '2001-06-15 01:02:03'),
('2003-06-15 01:02:03', '2002-06-15 01:02:03'),
('2003-06-15 01:02:03', '2003-06-25 01:02:03'),
('2003-06-15 01:02:03', '2004-06-15 01:02:03'),
('2003-06-15 01:02:03', '2005-06-15 01:02:03'),
('2003-06-15 01:02:03', '2006-06-15 01:02:03'),
('2003-06-15 01:02:03', '2003-06-15 00:00:00'),
('2003-06-15 01:02:03', '2003-06-15 01:02:02'),
('2003-06-15 01:02:03', '2003-06-15 01:02:04'),
('2003-06-15 01:02:03', '2003-06-15 23:59:59'),
('2003-06-15 01:02:03', '1970-01-01 00:00:01'),
('2003-06-15 01:02:03', '2038-01-18 03:14:07'),
('2003-06-15 01:02:03', '2003-06-15 01:02:03'),
('2003-06-15 01:02:03', '2003-06-15 01:02:03'),
('2003-06-15 01:02:03', '2003-06-15 01:02:03'),
('2003-06-15 01:02:03', '2003-06-15 01:02:03');
SELECT * FROM t1 WHERE c1 = '2003-06-15 01:02:03' AND c2 > '2003-06-15 01:02:03' ORDER BY c2 ASC;
c1	c2
2003-06-15 01:02:03	2003-06-15 01:02:04
2003-06-15 01:02:03	2003-06-15 23:59:59
2003-06-15 01:02:03	2003-06-25 01:02:03
2003-06-15 01:02:03	2004-06-15 01:02:03
2003-06-15 01:02:03	2005-06-15 01:02:03
2003-06-15 01:02:03	2006-06-15 01:02:03
2003-06-15 01:02:03	2038-01-18 03:14:07
SELECT * FROM t1 WHERE c1 = '2003-06-15 01:02:03' AND c2 >= '2003-06-15 01:02:03' ORDER BY c2 ASC;
c1	c2
2003-06-15 01:02:03	2003-06-15 01:02:03
2003-06-15 01:02:03	2003-06-15 01:02:03
2003-06-15 01:02:03	2003-06-15 01:02:03
2003-06-15 01:02:03	2003-06-15 01:02:03
2003-06-15 01:02:03	2003-06-15 01:02:04
2003-06-15 01:02:03	2003-06-15 23:59:59
2003-06-15 01:02:03	2003-06-25 01:02:03
2003-06-15 01:02:03	2004-06-15 01:02:03
2003-06-15 01:02:03	2005-06-15 01:02:03
2003-06-15 01:02:03	2006-06-15 01:02:03
2003-06-15 01:02:03	2038-01-18 03:14:07
SELECT * FROM t1 WHERE c1 = '2003-06-15 01:02:03' AND c2 < '2003-06-15 01:02:03' ORDER BY c2 ASC;
c1	c2
2003-06-15 01:02:03	1970-01-01 00:00:01
2003-06-15 01:02:03	2000-06-15 01:02:03
2003-06-15 01:02:03	2001-06-15 01:02:03
2003-06-15 01:02:03	2002-06-15 01:02:03
2003-06-15 01:02:03	2003-06-15 00:00:00
2003-06-15 01:02:03	2003-06-15 01:02:02
SELECT * FROM t1 WHERE c1 = '2003-06-15 01:02:03' AND c2 <= '2003-06-15 01:02:03' ORDER BY c2 ASC;
c1	c2
2003-06-15 01:02:03	1970-01-01 00:00:01
2003-06-15 01:02:03	2000-06-15 01:02:03
2003-06-15 01:02:03	2001-06-15 01:02:03
2003-06-15 01:02:03	2002-06-15 01:02:03
2003-06-15 01:02:03	2003-06-15 00:00:00
2003-06-15 01:02:03	2003-06-15 01:02:02
2003-06-15 01:02:03	2003-06-15 01:02:03
2003-06-15 01:02:03	2003-06-15 01:02:03
2003-06-15 01:02:03	2003-06-15 01:02:03
2003-06-15 01:02:03	2003-06-15 01:02:03
SELECT * FROM t1 WHERE c1 = '2003-06-15 01:02:03' AND c2 > '2003-06-15 01:02:03' ORDER BY c2 DESC;
c1	c2
2003-06-15 01:02:03	2038-01-18 03:14:07
2003-06-15 01:02:03	2006-06-15 01:02:03
2003-06-15 01:02:03	2005-06-15 01:02:03
2003-06-15 01:02:03	2004-06-15 01:02:03
2003-06-15 01:02:03	2003-06-25 01:02:03
2003-06-15 01:02:03	2003-06-15 23:59:59
2003-06-15 01:02:03	2003-06-15 01:02:04
SELECT * FROM t1 WHERE c1 = '2003-06-15 01:02:03' AND c2 >= '2003-06-15 01:02:03' ORDER BY c2 DESC;
c1	c2
2003-06-15 01:02:03	2038-01-18 03:14:07
2003-06-15 01:02:03	2006-06-15 01:02:03
2003-06-15 01:02:03	2005-06-15 01:02:03
2003-06-15 01:02:03	2004-06-15 01:02:03
2003-06-15 01:02:03	2003-06-25 01:02:03
2003-06-15 01:02:03	2003-06-15 23:59:59
2003-06-15 01:02:03	2003-06-15 01:02:04
2003-06-15 01:02:03	2003-06-15 01:02:03
2003-06-15 01:02:03	2003-06-15 01:02:03
2003-06-15 01:02:03	2003-06-15 01:02:03
2003-06-15 01:02:03	2003-06-15 01:02:03
SELECT * FROM t1 WHERE c1 = '2003-06-15 01:02:03' AND c2 < '2003-06-15 01:02:03' ORDER BY c2 DESC;
c1	c2
2003-06-15 01:02:03	2003-06-15 01:02:02
2003-06-15 01:02:03	2003-06-15 00:00:00
2003-06-15 01:02:03	2002-06-15 01:02:03
2003-06-15 01:02:03	2001-06-15 01:02:03
2003-06-15 01:02:03	2000-06-15 01:02:03
2003-06-15 01:02:03	1970-01-01 00:00:01
SELECT * FROM t1 WHERE c1 = '2003-06-15 01:02:03' AND c2 <= '2003-06-15 01:02:03' ORDER BY c2 DESC;
c1	c2
2003-06-15 01:02:03	2003-06-15 01:02:03
2003-06-15 01:02:03	2003-06-15 01:02:03
2003-06-15 01:02:03	2003-06-15 01:02:03
2003-06-15 01:02:03	2003-06-15 01:02:03
2003-06-15 01:02:03	2003-06-15 01:02:02
2003-06-15 01:02:03	2003-06-15 00:00:00
2003-06-15 01:02:03	2002-06-15 01:02:03
2003-06-15 01:02:03	2001-06-15 01:02:03
2003-06-15 01:02:03	2000-06-15 01:02:03
2003-06-15 01:02:03	1970-01-01 00:00:01
DROP TABLE t1;
