DROP TABLE IF EXISTS t1;
CREATE TABLE t1(c1 VARCHAR(15) NOT NULL )
DEFAULT CHARACTER SET utf8 COLLATE utf8_bin
ENGINE=cloud;
INSERT INTO t1 VALUES
('AAAAAAA'),
('aaaaaaaaa'),
('BBBBBBBB'),
('bbbbbbbbb'),
('cccccccc'),
('CCCCCCCCC'),
('aAaAaAaA'),
('012345678912345'),
('BBBZxxxx '),
('!@#$%^&*()'),
('nrb0'),
(' a '),
(''),
('BBBZ'),
('BBBZ'),
('BBBZ'),
('BBBZ');
SELECT * FROM t1 ORDER BY c1 ASC;
c1

 a 
!@#$%^&*()
012345678912345
AAAAAAA
BBBBBBBB
BBBZ
BBBZ
BBBZ
BBBZ
BBBZxxxx 
CCCCCCCCC
aAaAaAaA
aaaaaaaaa
bbbbbbbbb
cccccccc
nrb0
SELECT * FROM t1 ORDER BY c1 DESC;
c1
nrb0
cccccccc
bbbbbbbbb
aaaaaaaaa
aAaAaAaA
CCCCCCCCC
BBBZxxxx 
BBBZ
BBBZ
BBBZ
BBBZ
BBBBBBBB
AAAAAAA
012345678912345
!@#$%^&*()
 a 

SELECT * FROM t1 WHERE c1 >  'BBBZ' ORDER BY c1 ASC;
c1
BBBZxxxx 
CCCCCCCCC
aAaAaAaA
aaaaaaaaa
bbbbbbbbb
cccccccc
nrb0
SELECT * FROM t1 WHERE c1 >= 'BBBZ' ORDER BY c1 ASC;
c1
BBBZ
BBBZ
BBBZ
BBBZ
BBBZxxxx 
CCCCCCCCC
aAaAaAaA
aaaaaaaaa
bbbbbbbbb
cccccccc
nrb0
SELECT * FROM t1 WHERE c1 <  'BBBZ' ORDER BY c1 ASC;
c1

 a 
!@#$%^&*()
012345678912345
AAAAAAA
BBBBBBBB
SELECT * FROM t1 WHERE c1 <= 'BBBZ' ORDER BY c1 ASC;
c1

 a 
!@#$%^&*()
012345678912345
AAAAAAA
BBBBBBBB
BBBZ
BBBZ
BBBZ
BBBZ
SELECT * FROM t1 WHERE c1 =  'BBBZ' ORDER BY c1 ASC;
c1
BBBZ
BBBZ
BBBZ
BBBZ
SELECT * FROM t1 WHERE c1 >  'BBBZ' ORDER BY c1 DESC;
c1
nrb0
cccccccc
bbbbbbbbb
aaaaaaaaa
aAaAaAaA
CCCCCCCCC
BBBZxxxx 
SELECT * FROM t1 WHERE c1 >= 'BBBZ' ORDER BY c1 DESC;
c1
nrb0
cccccccc
bbbbbbbbb
aaaaaaaaa
aAaAaAaA
CCCCCCCCC
BBBZxxxx 
BBBZ
BBBZ
BBBZ
BBBZ
SELECT * FROM t1 WHERE c1 <  'BBBZ' ORDER BY c1 DESC;
c1
BBBBBBBB
AAAAAAA
012345678912345
!@#$%^&*()
 a 

SELECT * FROM t1 WHERE c1 <= 'BBBZ' ORDER BY c1 DESC;
c1
BBBZ
BBBZ
BBBZ
BBBZ
BBBBBBBB
AAAAAAA
012345678912345
!@#$%^&*()
 a 

SELECT * FROM t1 WHERE c1 =  'BBBZ' ORDER BY c1 DESC;
c1
BBBZ
BBBZ
BBBZ
BBBZ
UPDATE t1
SET c1 = 'aAaAaAaA'
WHERE c1 = 'BBBZ'
ORDER BY c1
LIMIT 2;
SELECT * FROM t1 ORDER BY c1;
c1

 a 
!@#$%^&*()
012345678912345
AAAAAAA
BBBBBBBB
BBBZ
BBBZ
BBBZxxxx 
CCCCCCCCC
aAaAaAaA
aAaAaAaA
aAaAaAaA
aaaaaaaaa
bbbbbbbbb
cccccccc
nrb0
DELETE FROM t1
WHERE c1 = 'BBBZ'
ORDER BY c1;
SELECT * FROM t1 ORDER BY c1;
c1

 a 
!@#$%^&*()
012345678912345
AAAAAAA
BBBBBBBB
BBBZxxxx 
CCCCCCCCC
aAaAaAaA
aAaAaAaA
aAaAaAaA
aaaaaaaaa
bbbbbbbbb
cccccccc
nrb0
DROP TABLE t1;
CREATE TABLE t1(c1 VARCHAR(15) NOT NULL, c2 VARCHAR(15) NOT NULL )
DEFAULT CHARACTER SET utf8 COLLATE utf8_bin
ENGINE=cloud;
INSERT INTO t1 VALUES
('BBBZ', 'AAAAAAA'),
('BBBZ', 'aaaaaaaaa'),
('BBBZ', 'BBBBBBBB'),
('BBBZ', 'bbbbbbbbb'),
('BBBZ', 'cccccccc'),
('BBBZ', 'CCCCCCCCC'),
('BBBZ', 'aAaAaAaA'),
('BBBZ', '012345678912345'),
('BBBZ', 'BBBZxxxx '),
('BBBZ', '!@#$%^&*()'),
('BBBZ', 'nrb0'),
('BBBZ', ' a '),
('BBBZ', ''),
('BBBZ', 'BBBZ'),
('BBBZ', 'BBBZ'),
('BBBZ', 'BBBZ'),
('BBBZ', 'BBBZ');
SELECT * FROM t1 WHERE c1 = 'BBBZ' AND c2 > 'BBBZ' ORDER BY c2 ASC;
c1	c2
BBBZ	BBBZxxxx 
BBBZ	CCCCCCCCC
BBBZ	aAaAaAaA
BBBZ	aaaaaaaaa
BBBZ	bbbbbbbbb
BBBZ	cccccccc
BBBZ	nrb0
SELECT * FROM t1 WHERE c1 = 'BBBZ' AND c2 >= 'BBBZ' ORDER BY c2 ASC;
c1	c2
BBBZ	BBBZ
BBBZ	BBBZ
BBBZ	BBBZ
BBBZ	BBBZ
BBBZ	BBBZxxxx 
BBBZ	CCCCCCCCC
BBBZ	aAaAaAaA
BBBZ	aaaaaaaaa
BBBZ	bbbbbbbbb
BBBZ	cccccccc
BBBZ	nrb0
SELECT * FROM t1 WHERE c1 = 'BBBZ' AND c2 < 'BBBZ' ORDER BY c2 ASC;
c1	c2
BBBZ	
BBBZ	 a 
BBBZ	!@#$%^&*()
BBBZ	012345678912345
BBBZ	AAAAAAA
BBBZ	BBBBBBBB
SELECT * FROM t1 WHERE c1 = 'BBBZ' AND c2 <= 'BBBZ' ORDER BY c2 ASC;
c1	c2
BBBZ	
BBBZ	 a 
BBBZ	!@#$%^&*()
BBBZ	012345678912345
BBBZ	AAAAAAA
BBBZ	BBBBBBBB
BBBZ	BBBZ
BBBZ	BBBZ
BBBZ	BBBZ
BBBZ	BBBZ
SELECT * FROM t1 WHERE c1 = 'BBBZ' AND c2 > 'BBBZ' ORDER BY c2 DESC;
c1	c2
BBBZ	nrb0
BBBZ	cccccccc
BBBZ	bbbbbbbbb
BBBZ	aaaaaaaaa
BBBZ	aAaAaAaA
BBBZ	CCCCCCCCC
BBBZ	BBBZxxxx 
SELECT * FROM t1 WHERE c1 = 'BBBZ' AND c2 >= 'BBBZ' ORDER BY c2 DESC;
c1	c2
BBBZ	nrb0
BBBZ	cccccccc
BBBZ	bbbbbbbbb
BBBZ	aaaaaaaaa
BBBZ	aAaAaAaA
BBBZ	CCCCCCCCC
BBBZ	BBBZxxxx 
BBBZ	BBBZ
BBBZ	BBBZ
BBBZ	BBBZ
BBBZ	BBBZ
SELECT * FROM t1 WHERE c1 = 'BBBZ' AND c2 < 'BBBZ' ORDER BY c2 DESC;
c1	c2
BBBZ	BBBBBBBB
BBBZ	AAAAAAA
BBBZ	012345678912345
BBBZ	!@#$%^&*()
BBBZ	 a 
BBBZ	
SELECT * FROM t1 WHERE c1 = 'BBBZ' AND c2 <= 'BBBZ' ORDER BY c2 DESC;
c1	c2
BBBZ	BBBZ
BBBZ	BBBZ
BBBZ	BBBZ
BBBZ	BBBZ
BBBZ	BBBBBBBB
BBBZ	AAAAAAA
BBBZ	012345678912345
BBBZ	!@#$%^&*()
BBBZ	 a 
BBBZ	
DROP TABLE t1;
DROP TABLE IF EXISTS t1;
CREATE TABLE t1(c1 VARCHAR(15) NULL )
DEFAULT CHARACTER SET utf8 COLLATE utf8_bin
ENGINE=cloud;
INSERT INTO t1 VALUES
('AAAAAAA'),
('aaaaaaaaa'),
('BBBBBBBB'),
('bbbbbbbbb'),
('cccccccc'),
('CCCCCCCCC'),
('aAaAaAaA'),
('012345678912345'),
('BBBZxxxx '),
('!@#$%^&*()'),
('nrb0'),
(' a '),
(''),
('BBBZ'),
(NULL),
(NULL),
(NULL),
(NULL);
SELECT * FROM t1 WHERE c1 IS     NULL ORDER BY c1 ASC;
c1
NULL
NULL
NULL
NULL
SELECT * FROM t1 WHERE c1 IS NOT NULL ORDER BY c1 DESC;
c1
nrb0
cccccccc
bbbbbbbbb
aaaaaaaaa
aAaAaAaA
CCCCCCCCC
BBBZxxxx 
BBBZ
BBBBBBBB
AAAAAAA
012345678912345
!@#$%^&*()
 a 

SELECT * FROM t1 WHERE c1 IS     NULL ORDER BY c1 ASC;
c1
NULL
NULL
NULL
NULL
SELECT * FROM t1 WHERE c1 IS NOT NULL ORDER BY c1 DESC;
c1
nrb0
cccccccc
bbbbbbbbb
aaaaaaaaa
aAaAaAaA
CCCCCCCCC
BBBZxxxx 
BBBZ
BBBBBBBB
AAAAAAA
012345678912345
!@#$%^&*()
 a 

UPDATE t1
SET c1 = 'BBBZ'
WHERE c1 IS NULL
LIMIT 2;
SELECT * FROM t1 ORDER BY c1;
c1
NULL
NULL

 a 
!@#$%^&*()
012345678912345
AAAAAAA
BBBBBBBB
BBBZ
BBBZ
BBBZ
BBBZxxxx 
CCCCCCCCC
aAaAaAaA
aaaaaaaaa
bbbbbbbbb
cccccccc
nrb0
DELETE FROM t1
WHERE c1 IS NULL
ORDER BY c1;
SELECT * FROM t1 ORDER BY c1;
c1

 a 
!@#$%^&*()
012345678912345
AAAAAAA
BBBBBBBB
BBBZ
BBBZ
BBBZ
BBBZxxxx 
CCCCCCCCC
aAaAaAaA
aaaaaaaaa
bbbbbbbbb
cccccccc
nrb0
DROP TABLE t1;
CREATE TABLE t1(c1 VARCHAR(15) NULL, c2 VARCHAR(15) NULL )
DEFAULT CHARACTER SET utf8 COLLATE utf8_bin
ENGINE=cloud;
INSERT INTO t1 VALUES
('BBBZ', 'AAAAAAA'),
('BBBZ', 'aaaaaaaaa'),
('BBBZ', 'BBBBBBBB'),
('BBBZ', 'bbbbbbbbb'),
('BBBZ', 'cccccccc'),
('BBBZ', 'CCCCCCCCC'),
('BBBZ', 'aAaAaAaA'),
('BBBZ', '012345678912345'),
('BBBZ', 'BBBZxxxx '),
('BBBZ', '!@#$%^&*()'),
('BBBZ', 'nrb0'),
('BBBZ', ' a '),
('BBBZ', ''),
('BBBZ', 'BBBZ'),
('BBBZ', 'BBBZ'),
('BBBZ', 'BBBZ'),
('BBBZ', NULL),
('BBBZ', NULL),
('BBBZ', NULL),
('BBBZ', NULL),
('BBBZ', 'BBBZ');
SELECT * FROM t1 WHERE c1 = 'BBBZ' AND c2 > 'BBBZ' ORDER BY c2 ASC;
c1	c2
BBBZ	BBBZxxxx 
BBBZ	CCCCCCCCC
BBBZ	aAaAaAaA
BBBZ	aaaaaaaaa
BBBZ	bbbbbbbbb
BBBZ	cccccccc
BBBZ	nrb0
SELECT * FROM t1 WHERE c1 = 'BBBZ' AND c2 >= 'BBBZ' ORDER BY c2 ASC;
c1	c2
BBBZ	BBBZ
BBBZ	BBBZ
BBBZ	BBBZ
BBBZ	BBBZ
BBBZ	BBBZxxxx 
BBBZ	CCCCCCCCC
BBBZ	aAaAaAaA
BBBZ	aaaaaaaaa
BBBZ	bbbbbbbbb
BBBZ	cccccccc
BBBZ	nrb0
SELECT * FROM t1 WHERE c1 = 'BBBZ' AND c2 < 'BBBZ' ORDER BY c2 ASC;
c1	c2
BBBZ	
BBBZ	 a 
BBBZ	!@#$%^&*()
BBBZ	012345678912345
BBBZ	AAAAAAA
BBBZ	BBBBBBBB
SELECT * FROM t1 WHERE c1 = 'BBBZ' AND c2 <= 'BBBZ' ORDER BY c2 ASC;
c1	c2
BBBZ	
BBBZ	 a 
BBBZ	!@#$%^&*()
BBBZ	012345678912345
BBBZ	AAAAAAA
BBBZ	BBBBBBBB
BBBZ	BBBZ
BBBZ	BBBZ
BBBZ	BBBZ
BBBZ	BBBZ
SELECT * FROM t1 WHERE c1 = 'BBBZ' AND c2 is null ORDER BY c1 ASC;
c1	c2
BBBZ	NULL
BBBZ	NULL
BBBZ	NULL
BBBZ	NULL
SELECT * FROM t1 WHERE c1 = 'BBBZ' AND c2 is not null ORDER BY c2 ASC;
c1	c2
BBBZ	
BBBZ	 a 
BBBZ	!@#$%^&*()
BBBZ	012345678912345
BBBZ	AAAAAAA
BBBZ	BBBBBBBB
BBBZ	BBBZ
BBBZ	BBBZ
BBBZ	BBBZ
BBBZ	BBBZ
BBBZ	BBBZxxxx 
BBBZ	CCCCCCCCC
BBBZ	aAaAaAaA
BBBZ	aaaaaaaaa
BBBZ	bbbbbbbbb
BBBZ	cccccccc
BBBZ	nrb0
SELECT * FROM t1 WHERE c1 = 'BBBZ' AND c2 > 'BBBZ' ORDER BY c2 DESC;
c1	c2
BBBZ	nrb0
BBBZ	cccccccc
BBBZ	bbbbbbbbb
BBBZ	aaaaaaaaa
BBBZ	aAaAaAaA
BBBZ	CCCCCCCCC
BBBZ	BBBZxxxx 
SELECT * FROM t1 WHERE c1 = 'BBBZ' AND c2 >= 'BBBZ' ORDER BY c2 DESC;
c1	c2
BBBZ	nrb0
BBBZ	cccccccc
BBBZ	bbbbbbbbb
BBBZ	aaaaaaaaa
BBBZ	aAaAaAaA
BBBZ	CCCCCCCCC
BBBZ	BBBZxxxx 
BBBZ	BBBZ
BBBZ	BBBZ
BBBZ	BBBZ
BBBZ	BBBZ
SELECT * FROM t1 WHERE c1 = 'BBBZ' AND c2 < 'BBBZ' ORDER BY c2 DESC;
c1	c2
BBBZ	BBBBBBBB
BBBZ	AAAAAAA
BBBZ	012345678912345
BBBZ	!@#$%^&*()
BBBZ	 a 
BBBZ	
SELECT * FROM t1 WHERE c1 = 'BBBZ' AND c2 <= 'BBBZ' ORDER BY c2 DESC;
c1	c2
BBBZ	BBBZ
BBBZ	BBBZ
BBBZ	BBBZ
BBBZ	BBBZ
BBBZ	BBBBBBBB
BBBZ	AAAAAAA
BBBZ	012345678912345
BBBZ	!@#$%^&*()
BBBZ	 a 
BBBZ	
SELECT * FROM t1 WHERE c1 = 'BBBZ' AND c2 is null ORDER BY c1 DESC;
c1	c2
BBBZ	NULL
BBBZ	NULL
BBBZ	NULL
BBBZ	NULL
SELECT * FROM t1 WHERE c1 = 'BBBZ' AND c2 is not null ORDER BY c2 DESC;
c1	c2
BBBZ	nrb0
BBBZ	cccccccc
BBBZ	bbbbbbbbb
BBBZ	aaaaaaaaa
BBBZ	aAaAaAaA
BBBZ	CCCCCCCCC
BBBZ	BBBZxxxx 
BBBZ	BBBZ
BBBZ	BBBZ
BBBZ	BBBZ
BBBZ	BBBZ
BBBZ	BBBBBBBB
BBBZ	AAAAAAA
BBBZ	012345678912345
BBBZ	!@#$%^&*()
BBBZ	 a 
BBBZ	
DROP TABLE t1;
DROP TABLE IF EXISTS t1;
CREATE TABLE t1(c1 VARCHAR(15) NULL )
DEFAULT CHARACTER SET utf8 COLLATE utf8_bin
ENGINE=cloud;
INSERT INTO t1 VALUES
('AAAAAAA'),
('aaaaaaaaa'),
('BBBBBBBB'),
('bbbbbbbbb'),
('cccccccc'),
('CCCCCCCCC'),
('aAaAaAaA'),
('012345678912345'),
('BBBZxxxx '),
('!@#$%^&*()'),
('nrb0'),
(' a '),
(''),
('BBBZ'),
('BBBZ'),
('BBBZ'),
('BBBZ');
SELECT * FROM t1 ORDER BY c1 ASC;
c1

 a 
!@#$%^&*()
012345678912345
AAAAAAA
BBBBBBBB
BBBZ
BBBZ
BBBZ
BBBZ
BBBZxxxx 
CCCCCCCCC
aAaAaAaA
aaaaaaaaa
bbbbbbbbb
cccccccc
nrb0
SELECT * FROM t1 ORDER BY c1 DESC;
c1
nrb0
cccccccc
bbbbbbbbb
aaaaaaaaa
aAaAaAaA
CCCCCCCCC
BBBZxxxx 
BBBZ
BBBZ
BBBZ
BBBZ
BBBBBBBB
AAAAAAA
012345678912345
!@#$%^&*()
 a 

SELECT * FROM t1 WHERE c1 >  'BBBZ' ORDER BY c1 ASC;
c1
BBBZxxxx 
CCCCCCCCC
aAaAaAaA
aaaaaaaaa
bbbbbbbbb
cccccccc
nrb0
SELECT * FROM t1 WHERE c1 >= 'BBBZ' ORDER BY c1 ASC;
c1
BBBZ
BBBZ
BBBZ
BBBZ
BBBZxxxx 
CCCCCCCCC
aAaAaAaA
aaaaaaaaa
bbbbbbbbb
cccccccc
nrb0
SELECT * FROM t1 WHERE c1 <  'BBBZ' ORDER BY c1 ASC;
c1

 a 
!@#$%^&*()
012345678912345
AAAAAAA
BBBBBBBB
SELECT * FROM t1 WHERE c1 <= 'BBBZ' ORDER BY c1 ASC;
c1

 a 
!@#$%^&*()
012345678912345
AAAAAAA
BBBBBBBB
BBBZ
BBBZ
BBBZ
BBBZ
SELECT * FROM t1 WHERE c1 =  'BBBZ' ORDER BY c1 ASC;
c1
BBBZ
BBBZ
BBBZ
BBBZ
SELECT * FROM t1 WHERE c1 >  'BBBZ' ORDER BY c1 DESC;
c1
nrb0
cccccccc
bbbbbbbbb
aaaaaaaaa
aAaAaAaA
CCCCCCCCC
BBBZxxxx 
SELECT * FROM t1 WHERE c1 >= 'BBBZ' ORDER BY c1 DESC;
c1
nrb0
cccccccc
bbbbbbbbb
aaaaaaaaa
aAaAaAaA
CCCCCCCCC
BBBZxxxx 
BBBZ
BBBZ
BBBZ
BBBZ
SELECT * FROM t1 WHERE c1 <  'BBBZ' ORDER BY c1 DESC;
c1
BBBBBBBB
AAAAAAA
012345678912345
!@#$%^&*()
 a 

SELECT * FROM t1 WHERE c1 <= 'BBBZ' ORDER BY c1 DESC;
c1
BBBZ
BBBZ
BBBZ
BBBZ
BBBBBBBB
AAAAAAA
012345678912345
!@#$%^&*()
 a 

SELECT * FROM t1 WHERE c1 =  'BBBZ' ORDER BY c1 DESC;
c1
BBBZ
BBBZ
BBBZ
BBBZ
UPDATE t1
SET c1 = 'aAaAaAaA'
WHERE c1 = 'BBBZ'
ORDER BY c1
LIMIT 2;
SELECT * FROM t1 ORDER BY c1;
c1

 a 
!@#$%^&*()
012345678912345
AAAAAAA
BBBBBBBB
BBBZ
BBBZ
BBBZxxxx 
CCCCCCCCC
aAaAaAaA
aAaAaAaA
aAaAaAaA
aaaaaaaaa
bbbbbbbbb
cccccccc
nrb0
DELETE FROM t1
WHERE c1 = 'BBBZ'
ORDER BY c1;
SELECT * FROM t1 ORDER BY c1;
c1

 a 
!@#$%^&*()
012345678912345
AAAAAAA
BBBBBBBB
BBBZxxxx 
CCCCCCCCC
aAaAaAaA
aAaAaAaA
aAaAaAaA
aaaaaaaaa
bbbbbbbbb
cccccccc
nrb0
DROP TABLE t1;
CREATE TABLE t1(c1 VARCHAR(15) NULL, c2 VARCHAR(15) NULL )
DEFAULT CHARACTER SET utf8 COLLATE utf8_bin
ENGINE=cloud;
INSERT INTO t1 VALUES
('BBBZ', 'AAAAAAA'),
('BBBZ', 'aaaaaaaaa'),
('BBBZ', 'BBBBBBBB'),
('BBBZ', 'bbbbbbbbb'),
('BBBZ', 'cccccccc'),
('BBBZ', 'CCCCCCCCC'),
('BBBZ', 'aAaAaAaA'),
('BBBZ', '012345678912345'),
('BBBZ', 'BBBZxxxx '),
('BBBZ', '!@#$%^&*()'),
('BBBZ', 'nrb0'),
('BBBZ', ' a '),
('BBBZ', ''),
('BBBZ', 'BBBZ'),
('BBBZ', 'BBBZ'),
('BBBZ', 'BBBZ'),
('BBBZ', 'BBBZ');
SELECT * FROM t1 WHERE c1 = 'BBBZ' AND c2 > 'BBBZ' ORDER BY c2 ASC;
c1	c2
BBBZ	BBBZxxxx 
BBBZ	CCCCCCCCC
BBBZ	aAaAaAaA
BBBZ	aaaaaaaaa
BBBZ	bbbbbbbbb
BBBZ	cccccccc
BBBZ	nrb0
SELECT * FROM t1 WHERE c1 = 'BBBZ' AND c2 >= 'BBBZ' ORDER BY c2 ASC;
c1	c2
BBBZ	BBBZ
BBBZ	BBBZ
BBBZ	BBBZ
BBBZ	BBBZ
BBBZ	BBBZxxxx 
BBBZ	CCCCCCCCC
BBBZ	aAaAaAaA
BBBZ	aaaaaaaaa
BBBZ	bbbbbbbbb
BBBZ	cccccccc
BBBZ	nrb0
SELECT * FROM t1 WHERE c1 = 'BBBZ' AND c2 < 'BBBZ' ORDER BY c2 ASC;
c1	c2
BBBZ	
BBBZ	 a 
BBBZ	!@#$%^&*()
BBBZ	012345678912345
BBBZ	AAAAAAA
BBBZ	BBBBBBBB
SELECT * FROM t1 WHERE c1 = 'BBBZ' AND c2 <= 'BBBZ' ORDER BY c2 ASC;
c1	c2
BBBZ	
BBBZ	 a 
BBBZ	!@#$%^&*()
BBBZ	012345678912345
BBBZ	AAAAAAA
BBBZ	BBBBBBBB
BBBZ	BBBZ
BBBZ	BBBZ
BBBZ	BBBZ
BBBZ	BBBZ
SELECT * FROM t1 WHERE c1 = 'BBBZ' AND c2 > 'BBBZ' ORDER BY c2 DESC;
c1	c2
BBBZ	nrb0
BBBZ	cccccccc
BBBZ	bbbbbbbbb
BBBZ	aaaaaaaaa
BBBZ	aAaAaAaA
BBBZ	CCCCCCCCC
BBBZ	BBBZxxxx 
SELECT * FROM t1 WHERE c1 = 'BBBZ' AND c2 >= 'BBBZ' ORDER BY c2 DESC;
c1	c2
BBBZ	nrb0
BBBZ	cccccccc
BBBZ	bbbbbbbbb
BBBZ	aaaaaaaaa
BBBZ	aAaAaAaA
BBBZ	CCCCCCCCC
BBBZ	BBBZxxxx 
BBBZ	BBBZ
BBBZ	BBBZ
BBBZ	BBBZ
BBBZ	BBBZ
SELECT * FROM t1 WHERE c1 = 'BBBZ' AND c2 < 'BBBZ' ORDER BY c2 DESC;
c1	c2
BBBZ	BBBBBBBB
BBBZ	AAAAAAA
BBBZ	012345678912345
BBBZ	!@#$%^&*()
BBBZ	 a 
BBBZ	
SELECT * FROM t1 WHERE c1 = 'BBBZ' AND c2 <= 'BBBZ' ORDER BY c2 DESC;
c1	c2
BBBZ	BBBZ
BBBZ	BBBZ
BBBZ	BBBZ
BBBZ	BBBZ
BBBZ	BBBBBBBB
BBBZ	AAAAAAA
BBBZ	012345678912345
BBBZ	!@#$%^&*()
BBBZ	 a 
BBBZ	
DROP TABLE t1;
DROP TABLE IF EXISTS t1;
CREATE TABLE t1(c1 VARCHAR(15) NOT NULL , INDEX(c1))
DEFAULT CHARACTER SET utf8 COLLATE utf8_bin
ENGINE=cloud;
INSERT INTO t1 VALUES
('AAAAAAA'),
('aaaaaaaaa'),
('BBBBBBBB'),
('bbbbbbbbb'),
('cccccccc'),
('CCCCCCCCC'),
('aAaAaAaA'),
('012345678912345'),
('BBBZxxxx '),
('!@#$%^&*()'),
('nrb0'),
(' a '),
(''),
('BBBZ'),
('BBBZ'),
('BBBZ'),
('BBBZ');
SELECT * FROM t1 ORDER BY c1 ASC;
c1

 a 
!@#$%^&*()
012345678912345
AAAAAAA
BBBBBBBB
BBBZ
BBBZ
BBBZ
BBBZ
BBBZxxxx 
CCCCCCCCC
aAaAaAaA
aaaaaaaaa
bbbbbbbbb
cccccccc
nrb0
SELECT * FROM t1 ORDER BY c1 DESC;
c1
nrb0
cccccccc
bbbbbbbbb
aaaaaaaaa
aAaAaAaA
CCCCCCCCC
BBBZxxxx 
BBBZ
BBBZ
BBBZ
BBBZ
BBBBBBBB
AAAAAAA
012345678912345
!@#$%^&*()
 a 

SELECT * FROM t1 WHERE c1 >  'BBBZ' ORDER BY c1 ASC;
c1
BBBZxxxx 
CCCCCCCCC
aAaAaAaA
aaaaaaaaa
bbbbbbbbb
cccccccc
nrb0
SELECT * FROM t1 WHERE c1 >= 'BBBZ' ORDER BY c1 ASC;
c1
BBBZ
BBBZ
BBBZ
BBBZ
BBBZxxxx 
CCCCCCCCC
aAaAaAaA
aaaaaaaaa
bbbbbbbbb
cccccccc
nrb0
SELECT * FROM t1 WHERE c1 <  'BBBZ' ORDER BY c1 ASC;
c1

 a 
!@#$%^&*()
012345678912345
AAAAAAA
BBBBBBBB
SELECT * FROM t1 WHERE c1 <= 'BBBZ' ORDER BY c1 ASC;
c1

 a 
!@#$%^&*()
012345678912345
AAAAAAA
BBBBBBBB
BBBZ
BBBZ
BBBZ
BBBZ
SELECT * FROM t1 WHERE c1 =  'BBBZ' ORDER BY c1 ASC;
c1
BBBZ
BBBZ
BBBZ
BBBZ
SELECT * FROM t1 WHERE c1 >  'BBBZ' ORDER BY c1 DESC;
c1
nrb0
cccccccc
bbbbbbbbb
aaaaaaaaa
aAaAaAaA
CCCCCCCCC
BBBZxxxx 
SELECT * FROM t1 WHERE c1 >= 'BBBZ' ORDER BY c1 DESC;
c1
nrb0
cccccccc
bbbbbbbbb
aaaaaaaaa
aAaAaAaA
CCCCCCCCC
BBBZxxxx 
BBBZ
BBBZ
BBBZ
BBBZ
SELECT * FROM t1 WHERE c1 <  'BBBZ' ORDER BY c1 DESC;
c1
BBBBBBBB
AAAAAAA
012345678912345
!@#$%^&*()
 a 

SELECT * FROM t1 WHERE c1 <= 'BBBZ' ORDER BY c1 DESC;
c1
BBBZ
BBBZ
BBBZ
BBBZ
BBBBBBBB
AAAAAAA
012345678912345
!@#$%^&*()
 a 

SELECT * FROM t1 WHERE c1 =  'BBBZ' ORDER BY c1 DESC;
c1
BBBZ
BBBZ
BBBZ
BBBZ
UPDATE t1
SET c1 = 'aAaAaAaA'
WHERE c1 = 'BBBZ'
ORDER BY c1
LIMIT 2;
SELECT * FROM t1 ORDER BY c1;
c1

 a 
!@#$%^&*()
012345678912345
AAAAAAA
BBBBBBBB
BBBZ
BBBZ
BBBZxxxx 
CCCCCCCCC
aAaAaAaA
aAaAaAaA
aAaAaAaA
aaaaaaaaa
bbbbbbbbb
cccccccc
nrb0
DELETE FROM t1
WHERE c1 = 'BBBZ'
ORDER BY c1;
SELECT * FROM t1 ORDER BY c1;
c1

 a 
!@#$%^&*()
012345678912345
AAAAAAA
BBBBBBBB
BBBZxxxx 
CCCCCCCCC
aAaAaAaA
aAaAaAaA
aAaAaAaA
aaaaaaaaa
bbbbbbbbb
cccccccc
nrb0
DROP TABLE t1;
CREATE TABLE t1(c1 VARCHAR(15) NOT NULL, c2 VARCHAR(15) NOT NULL , INDEX(c1, c2))
DEFAULT CHARACTER SET utf8 COLLATE utf8_bin
ENGINE=cloud;
INSERT INTO t1 VALUES
('BBBZ', 'AAAAAAA'),
('BBBZ', 'aaaaaaaaa'),
('BBBZ', 'BBBBBBBB'),
('BBBZ', 'bbbbbbbbb'),
('BBBZ', 'cccccccc'),
('BBBZ', 'CCCCCCCCC'),
('BBBZ', 'aAaAaAaA'),
('BBBZ', '012345678912345'),
('BBBZ', 'BBBZxxxx '),
('BBBZ', '!@#$%^&*()'),
('BBBZ', 'nrb0'),
('BBBZ', ' a '),
('BBBZ', ''),
('BBBZ', 'BBBZ'),
('BBBZ', 'BBBZ'),
('BBBZ', 'BBBZ'),
('BBBZ', 'BBBZ');
SELECT * FROM t1 WHERE c1 = 'BBBZ' AND c2 > 'BBBZ' ORDER BY c2 ASC;
c1	c2
BBBZ	BBBZxxxx 
BBBZ	CCCCCCCCC
BBBZ	aAaAaAaA
BBBZ	aaaaaaaaa
BBBZ	bbbbbbbbb
BBBZ	cccccccc
BBBZ	nrb0
SELECT * FROM t1 WHERE c1 = 'BBBZ' AND c2 >= 'BBBZ' ORDER BY c2 ASC;
c1	c2
BBBZ	BBBZ
BBBZ	BBBZ
BBBZ	BBBZ
BBBZ	BBBZ
BBBZ	BBBZxxxx 
BBBZ	CCCCCCCCC
BBBZ	aAaAaAaA
BBBZ	aaaaaaaaa
BBBZ	bbbbbbbbb
BBBZ	cccccccc
BBBZ	nrb0
SELECT * FROM t1 WHERE c1 = 'BBBZ' AND c2 < 'BBBZ' ORDER BY c2 ASC;
c1	c2
BBBZ	
BBBZ	 a 
BBBZ	!@#$%^&*()
BBBZ	012345678912345
BBBZ	AAAAAAA
BBBZ	BBBBBBBB
SELECT * FROM t1 WHERE c1 = 'BBBZ' AND c2 <= 'BBBZ' ORDER BY c2 ASC;
c1	c2
BBBZ	
BBBZ	 a 
BBBZ	!@#$%^&*()
BBBZ	012345678912345
BBBZ	AAAAAAA
BBBZ	BBBBBBBB
BBBZ	BBBZ
BBBZ	BBBZ
BBBZ	BBBZ
BBBZ	BBBZ
SELECT * FROM t1 WHERE c1 = 'BBBZ' AND c2 > 'BBBZ' ORDER BY c2 DESC;
c1	c2
BBBZ	nrb0
BBBZ	cccccccc
BBBZ	bbbbbbbbb
BBBZ	aaaaaaaaa
BBBZ	aAaAaAaA
BBBZ	CCCCCCCCC
BBBZ	BBBZxxxx 
SELECT * FROM t1 WHERE c1 = 'BBBZ' AND c2 >= 'BBBZ' ORDER BY c2 DESC;
c1	c2
BBBZ	nrb0
BBBZ	cccccccc
BBBZ	bbbbbbbbb
BBBZ	aaaaaaaaa
BBBZ	aAaAaAaA
BBBZ	CCCCCCCCC
BBBZ	BBBZxxxx 
BBBZ	BBBZ
BBBZ	BBBZ
BBBZ	BBBZ
BBBZ	BBBZ
SELECT * FROM t1 WHERE c1 = 'BBBZ' AND c2 < 'BBBZ' ORDER BY c2 DESC;
c1	c2
BBBZ	BBBBBBBB
BBBZ	AAAAAAA
BBBZ	012345678912345
BBBZ	!@#$%^&*()
BBBZ	 a 
BBBZ	
SELECT * FROM t1 WHERE c1 = 'BBBZ' AND c2 <= 'BBBZ' ORDER BY c2 DESC;
c1	c2
BBBZ	BBBZ
BBBZ	BBBZ
BBBZ	BBBZ
BBBZ	BBBZ
BBBZ	BBBBBBBB
BBBZ	AAAAAAA
BBBZ	012345678912345
BBBZ	!@#$%^&*()
BBBZ	 a 
BBBZ	
DROP TABLE t1;
DROP TABLE IF EXISTS t1;
CREATE TABLE t1(c1 VARCHAR(15) NULL , INDEX(c1))
DEFAULT CHARACTER SET utf8 COLLATE utf8_bin
ENGINE=cloud;
INSERT INTO t1 VALUES
('AAAAAAA'),
('aaaaaaaaa'),
('BBBBBBBB'),
('bbbbbbbbb'),
('cccccccc'),
('CCCCCCCCC'),
('aAaAaAaA'),
('012345678912345'),
('BBBZxxxx '),
('!@#$%^&*()'),
('nrb0'),
(' a '),
(''),
('BBBZ'),
(NULL),
(NULL),
(NULL),
(NULL);
SELECT * FROM t1 WHERE c1 IS     NULL ORDER BY c1 ASC;
c1
NULL
NULL
NULL
NULL
SELECT * FROM t1 WHERE c1 IS NOT NULL ORDER BY c1 DESC;
c1
nrb0
cccccccc
bbbbbbbbb
aaaaaaaaa
aAaAaAaA
CCCCCCCCC
BBBZxxxx 
BBBZ
BBBBBBBB
AAAAAAA
012345678912345
!@#$%^&*()
 a 

SELECT * FROM t1 WHERE c1 IS     NULL ORDER BY c1 ASC;
c1
NULL
NULL
NULL
NULL
SELECT * FROM t1 WHERE c1 IS NOT NULL ORDER BY c1 DESC;
c1
nrb0
cccccccc
bbbbbbbbb
aaaaaaaaa
aAaAaAaA
CCCCCCCCC
BBBZxxxx 
BBBZ
BBBBBBBB
AAAAAAA
012345678912345
!@#$%^&*()
 a 

UPDATE t1
SET c1 = 'BBBZ'
WHERE c1 IS NULL
LIMIT 2;
SELECT * FROM t1 ORDER BY c1;
c1
NULL
NULL

 a 
!@#$%^&*()
012345678912345
AAAAAAA
BBBBBBBB
BBBZ
BBBZ
BBBZ
BBBZxxxx 
CCCCCCCCC
aAaAaAaA
aaaaaaaaa
bbbbbbbbb
cccccccc
nrb0
DELETE FROM t1
WHERE c1 IS NULL
ORDER BY c1;
SELECT * FROM t1 ORDER BY c1;
c1

 a 
!@#$%^&*()
012345678912345
AAAAAAA
BBBBBBBB
BBBZ
BBBZ
BBBZ
BBBZxxxx 
CCCCCCCCC
aAaAaAaA
aaaaaaaaa
bbbbbbbbb
cccccccc
nrb0
DROP TABLE t1;
CREATE TABLE t1(c1 VARCHAR(15) NULL, c2 VARCHAR(15) NULL , INDEX(c1, c2))
DEFAULT CHARACTER SET utf8 COLLATE utf8_bin
ENGINE=cloud;
INSERT INTO t1 VALUES
('BBBZ', 'AAAAAAA'),
('BBBZ', 'aaaaaaaaa'),
('BBBZ', 'BBBBBBBB'),
('BBBZ', 'bbbbbbbbb'),
('BBBZ', 'cccccccc'),
('BBBZ', 'CCCCCCCCC'),
('BBBZ', 'aAaAaAaA'),
('BBBZ', '012345678912345'),
('BBBZ', 'BBBZxxxx '),
('BBBZ', '!@#$%^&*()'),
('BBBZ', 'nrb0'),
('BBBZ', ' a '),
('BBBZ', ''),
('BBBZ', 'BBBZ'),
('BBBZ', 'BBBZ'),
('BBBZ', 'BBBZ'),
('BBBZ', NULL),
('BBBZ', NULL),
('BBBZ', NULL),
('BBBZ', NULL),
('BBBZ', 'BBBZ');
SELECT * FROM t1 WHERE c1 = 'BBBZ' AND c2 > 'BBBZ' ORDER BY c2 ASC;
c1	c2
BBBZ	BBBZxxxx 
BBBZ	CCCCCCCCC
BBBZ	aAaAaAaA
BBBZ	aaaaaaaaa
BBBZ	bbbbbbbbb
BBBZ	cccccccc
BBBZ	nrb0
SELECT * FROM t1 WHERE c1 = 'BBBZ' AND c2 >= 'BBBZ' ORDER BY c2 ASC;
c1	c2
BBBZ	BBBZ
BBBZ	BBBZ
BBBZ	BBBZ
BBBZ	BBBZ
BBBZ	BBBZxxxx 
BBBZ	CCCCCCCCC
BBBZ	aAaAaAaA
BBBZ	aaaaaaaaa
BBBZ	bbbbbbbbb
BBBZ	cccccccc
BBBZ	nrb0
SELECT * FROM t1 WHERE c1 = 'BBBZ' AND c2 < 'BBBZ' ORDER BY c2 ASC;
c1	c2
BBBZ	
BBBZ	 a 
BBBZ	!@#$%^&*()
BBBZ	012345678912345
BBBZ	AAAAAAA
BBBZ	BBBBBBBB
SELECT * FROM t1 WHERE c1 = 'BBBZ' AND c2 <= 'BBBZ' ORDER BY c2 ASC;
c1	c2
BBBZ	
BBBZ	 a 
BBBZ	!@#$%^&*()
BBBZ	012345678912345
BBBZ	AAAAAAA
BBBZ	BBBBBBBB
BBBZ	BBBZ
BBBZ	BBBZ
BBBZ	BBBZ
BBBZ	BBBZ
SELECT * FROM t1 WHERE c1 = 'BBBZ' AND c2 is null ORDER BY c1 ASC;
c1	c2
BBBZ	NULL
BBBZ	NULL
BBBZ	NULL
BBBZ	NULL
SELECT * FROM t1 WHERE c1 = 'BBBZ' AND c2 is not null ORDER BY c2 ASC;
c1	c2
BBBZ	
BBBZ	 a 
BBBZ	!@#$%^&*()
BBBZ	012345678912345
BBBZ	AAAAAAA
BBBZ	BBBBBBBB
BBBZ	BBBZ
BBBZ	BBBZ
BBBZ	BBBZ
BBBZ	BBBZ
BBBZ	BBBZxxxx 
BBBZ	CCCCCCCCC
BBBZ	aAaAaAaA
BBBZ	aaaaaaaaa
BBBZ	bbbbbbbbb
BBBZ	cccccccc
BBBZ	nrb0
SELECT * FROM t1 WHERE c1 = 'BBBZ' AND c2 > 'BBBZ' ORDER BY c2 DESC;
c1	c2
BBBZ	nrb0
BBBZ	cccccccc
BBBZ	bbbbbbbbb
BBBZ	aaaaaaaaa
BBBZ	aAaAaAaA
BBBZ	CCCCCCCCC
BBBZ	BBBZxxxx 
SELECT * FROM t1 WHERE c1 = 'BBBZ' AND c2 >= 'BBBZ' ORDER BY c2 DESC;
c1	c2
BBBZ	nrb0
BBBZ	cccccccc
BBBZ	bbbbbbbbb
BBBZ	aaaaaaaaa
BBBZ	aAaAaAaA
BBBZ	CCCCCCCCC
BBBZ	BBBZxxxx 
BBBZ	BBBZ
BBBZ	BBBZ
BBBZ	BBBZ
BBBZ	BBBZ
SELECT * FROM t1 WHERE c1 = 'BBBZ' AND c2 < 'BBBZ' ORDER BY c2 DESC;
c1	c2
BBBZ	BBBBBBBB
BBBZ	AAAAAAA
BBBZ	012345678912345
BBBZ	!@#$%^&*()
BBBZ	 a 
BBBZ	
SELECT * FROM t1 WHERE c1 = 'BBBZ' AND c2 <= 'BBBZ' ORDER BY c2 DESC;
c1	c2
BBBZ	BBBZ
BBBZ	BBBZ
BBBZ	BBBZ
BBBZ	BBBZ
BBBZ	BBBBBBBB
BBBZ	AAAAAAA
BBBZ	012345678912345
BBBZ	!@#$%^&*()
BBBZ	 a 
BBBZ	
SELECT * FROM t1 WHERE c1 = 'BBBZ' AND c2 is null ORDER BY c1 DESC;
c1	c2
BBBZ	NULL
BBBZ	NULL
BBBZ	NULL
BBBZ	NULL
SELECT * FROM t1 WHERE c1 = 'BBBZ' AND c2 is not null ORDER BY c2 DESC;
c1	c2
BBBZ	nrb0
BBBZ	cccccccc
BBBZ	bbbbbbbbb
BBBZ	aaaaaaaaa
BBBZ	aAaAaAaA
BBBZ	CCCCCCCCC
BBBZ	BBBZxxxx 
BBBZ	BBBZ
BBBZ	BBBZ
BBBZ	BBBZ
BBBZ	BBBZ
BBBZ	BBBBBBBB
BBBZ	AAAAAAA
BBBZ	012345678912345
BBBZ	!@#$%^&*()
BBBZ	 a 
BBBZ	
DROP TABLE t1;
DROP TABLE IF EXISTS t1;
CREATE TABLE t1(c1 VARCHAR(15) NULL , INDEX(c1))
DEFAULT CHARACTER SET utf8 COLLATE utf8_bin
ENGINE=cloud;
INSERT INTO t1 VALUES
('AAAAAAA'),
('aaaaaaaaa'),
('BBBBBBBB'),
('bbbbbbbbb'),
('cccccccc'),
('CCCCCCCCC'),
('aAaAaAaA'),
('012345678912345'),
('BBBZxxxx '),
('!@#$%^&*()'),
('nrb0'),
(' a '),
(''),
('BBBZ'),
('BBBZ'),
('BBBZ'),
('BBBZ');
SELECT * FROM t1 ORDER BY c1 ASC;
c1

 a 
!@#$%^&*()
012345678912345
AAAAAAA
BBBBBBBB
BBBZ
BBBZ
BBBZ
BBBZ
BBBZxxxx 
CCCCCCCCC
aAaAaAaA
aaaaaaaaa
bbbbbbbbb
cccccccc
nrb0
SELECT * FROM t1 ORDER BY c1 DESC;
c1
nrb0
cccccccc
bbbbbbbbb
aaaaaaaaa
aAaAaAaA
CCCCCCCCC
BBBZxxxx 
BBBZ
BBBZ
BBBZ
BBBZ
BBBBBBBB
AAAAAAA
012345678912345
!@#$%^&*()
 a 

SELECT * FROM t1 WHERE c1 >  'BBBZ' ORDER BY c1 ASC;
c1
BBBZxxxx 
CCCCCCCCC
aAaAaAaA
aaaaaaaaa
bbbbbbbbb
cccccccc
nrb0
SELECT * FROM t1 WHERE c1 >= 'BBBZ' ORDER BY c1 ASC;
c1
BBBZ
BBBZ
BBBZ
BBBZ
BBBZxxxx 
CCCCCCCCC
aAaAaAaA
aaaaaaaaa
bbbbbbbbb
cccccccc
nrb0
SELECT * FROM t1 WHERE c1 <  'BBBZ' ORDER BY c1 ASC;
c1

 a 
!@#$%^&*()
012345678912345
AAAAAAA
BBBBBBBB
SELECT * FROM t1 WHERE c1 <= 'BBBZ' ORDER BY c1 ASC;
c1

 a 
!@#$%^&*()
012345678912345
AAAAAAA
BBBBBBBB
BBBZ
BBBZ
BBBZ
BBBZ
SELECT * FROM t1 WHERE c1 =  'BBBZ' ORDER BY c1 ASC;
c1
BBBZ
BBBZ
BBBZ
BBBZ
SELECT * FROM t1 WHERE c1 >  'BBBZ' ORDER BY c1 DESC;
c1
nrb0
cccccccc
bbbbbbbbb
aaaaaaaaa
aAaAaAaA
CCCCCCCCC
BBBZxxxx 
SELECT * FROM t1 WHERE c1 >= 'BBBZ' ORDER BY c1 DESC;
c1
nrb0
cccccccc
bbbbbbbbb
aaaaaaaaa
aAaAaAaA
CCCCCCCCC
BBBZxxxx 
BBBZ
BBBZ
BBBZ
BBBZ
SELECT * FROM t1 WHERE c1 <  'BBBZ' ORDER BY c1 DESC;
c1
BBBBBBBB
AAAAAAA
012345678912345
!@#$%^&*()
 a 

SELECT * FROM t1 WHERE c1 <= 'BBBZ' ORDER BY c1 DESC;
c1
BBBZ
BBBZ
BBBZ
BBBZ
BBBBBBBB
AAAAAAA
012345678912345
!@#$%^&*()
 a 

SELECT * FROM t1 WHERE c1 =  'BBBZ' ORDER BY c1 DESC;
c1
BBBZ
BBBZ
BBBZ
BBBZ
UPDATE t1
SET c1 = 'aAaAaAaA'
WHERE c1 = 'BBBZ'
ORDER BY c1
LIMIT 2;
SELECT * FROM t1 ORDER BY c1;
c1

 a 
!@#$%^&*()
012345678912345
AAAAAAA
BBBBBBBB
BBBZ
BBBZ
BBBZxxxx 
CCCCCCCCC
aAaAaAaA
aAaAaAaA
aAaAaAaA
aaaaaaaaa
bbbbbbbbb
cccccccc
nrb0
DELETE FROM t1
WHERE c1 = 'BBBZ'
ORDER BY c1;
SELECT * FROM t1 ORDER BY c1;
c1

 a 
!@#$%^&*()
012345678912345
AAAAAAA
BBBBBBBB
BBBZxxxx 
CCCCCCCCC
aAaAaAaA
aAaAaAaA
aAaAaAaA
aaaaaaaaa
bbbbbbbbb
cccccccc
nrb0
DROP TABLE t1;
CREATE TABLE t1(c1 VARCHAR(15) NULL, c2 VARCHAR(15) NULL , INDEX(c1, c2))
DEFAULT CHARACTER SET utf8 COLLATE utf8_bin
ENGINE=cloud;
INSERT INTO t1 VALUES
('BBBZ', 'AAAAAAA'),
('BBBZ', 'aaaaaaaaa'),
('BBBZ', 'BBBBBBBB'),
('BBBZ', 'bbbbbbbbb'),
('BBBZ', 'cccccccc'),
('BBBZ', 'CCCCCCCCC'),
('BBBZ', 'aAaAaAaA'),
('BBBZ', '012345678912345'),
('BBBZ', 'BBBZxxxx '),
('BBBZ', '!@#$%^&*()'),
('BBBZ', 'nrb0'),
('BBBZ', ' a '),
('BBBZ', ''),
('BBBZ', 'BBBZ'),
('BBBZ', 'BBBZ'),
('BBBZ', 'BBBZ'),
('BBBZ', 'BBBZ');
SELECT * FROM t1 WHERE c1 = 'BBBZ' AND c2 > 'BBBZ' ORDER BY c2 ASC;
c1	c2
BBBZ	BBBZxxxx 
BBBZ	CCCCCCCCC
BBBZ	aAaAaAaA
BBBZ	aaaaaaaaa
BBBZ	bbbbbbbbb
BBBZ	cccccccc
BBBZ	nrb0
SELECT * FROM t1 WHERE c1 = 'BBBZ' AND c2 >= 'BBBZ' ORDER BY c2 ASC;
c1	c2
BBBZ	BBBZ
BBBZ	BBBZ
BBBZ	BBBZ
BBBZ	BBBZ
BBBZ	BBBZxxxx 
BBBZ	CCCCCCCCC
BBBZ	aAaAaAaA
BBBZ	aaaaaaaaa
BBBZ	bbbbbbbbb
BBBZ	cccccccc
BBBZ	nrb0
SELECT * FROM t1 WHERE c1 = 'BBBZ' AND c2 < 'BBBZ' ORDER BY c2 ASC;
c1	c2
BBBZ	
BBBZ	 a 
BBBZ	!@#$%^&*()
BBBZ	012345678912345
BBBZ	AAAAAAA
BBBZ	BBBBBBBB
SELECT * FROM t1 WHERE c1 = 'BBBZ' AND c2 <= 'BBBZ' ORDER BY c2 ASC;
c1	c2
BBBZ	
BBBZ	 a 
BBBZ	!@#$%^&*()
BBBZ	012345678912345
BBBZ	AAAAAAA
BBBZ	BBBBBBBB
BBBZ	BBBZ
BBBZ	BBBZ
BBBZ	BBBZ
BBBZ	BBBZ
SELECT * FROM t1 WHERE c1 = 'BBBZ' AND c2 > 'BBBZ' ORDER BY c2 DESC;
c1	c2
BBBZ	nrb0
BBBZ	cccccccc
BBBZ	bbbbbbbbb
BBBZ	aaaaaaaaa
BBBZ	aAaAaAaA
BBBZ	CCCCCCCCC
BBBZ	BBBZxxxx 
SELECT * FROM t1 WHERE c1 = 'BBBZ' AND c2 >= 'BBBZ' ORDER BY c2 DESC;
c1	c2
BBBZ	nrb0
BBBZ	cccccccc
BBBZ	bbbbbbbbb
BBBZ	aaaaaaaaa
BBBZ	aAaAaAaA
BBBZ	CCCCCCCCC
BBBZ	BBBZxxxx 
BBBZ	BBBZ
BBBZ	BBBZ
BBBZ	BBBZ
BBBZ	BBBZ
SELECT * FROM t1 WHERE c1 = 'BBBZ' AND c2 < 'BBBZ' ORDER BY c2 DESC;
c1	c2
BBBZ	BBBBBBBB
BBBZ	AAAAAAA
BBBZ	012345678912345
BBBZ	!@#$%^&*()
BBBZ	 a 
BBBZ	
SELECT * FROM t1 WHERE c1 = 'BBBZ' AND c2 <= 'BBBZ' ORDER BY c2 DESC;
c1	c2
BBBZ	BBBZ
BBBZ	BBBZ
BBBZ	BBBZ
BBBZ	BBBZ
BBBZ	BBBBBBBB
BBBZ	AAAAAAA
BBBZ	012345678912345
BBBZ	!@#$%^&*()
BBBZ	 a 
BBBZ	
DROP TABLE t1;
DROP TABLE IF EXISTS t1;
CREATE TABLE t1(c1 VARCHAR(15) NOT NULL )
DEFAULT CHARACTER SET utf8 COLLATE utf8_bin
ENGINE=cloud;
INSERT INTO t1 VALUES
('AAAAAAA'),
('aaaaaaaaa'),
('BBBBBBBB'),
('bbbbbbbbb'),
('cccccccc'),
('CCCCCCCCC'),
('aAaAaAaA'),
('012345678912345'),
('BBBZxxxx '),
('!@#$%^&*()'),
('nrb0'),
(' a '),
(''),
('BBBZ'),
('BBBZ'),
('BBBZ'),
('BBBZ');
SELECT * FROM t1 ORDER BY c1 ASC;
c1

 a 
!@#$%^&*()
012345678912345
AAAAAAA
BBBBBBBB
BBBZ
BBBZ
BBBZ
BBBZ
BBBZxxxx 
CCCCCCCCC
aAaAaAaA
aaaaaaaaa
bbbbbbbbb
cccccccc
nrb0
SELECT * FROM t1 ORDER BY c1 DESC;
c1
nrb0
cccccccc
bbbbbbbbb
aaaaaaaaa
aAaAaAaA
CCCCCCCCC
BBBZxxxx 
BBBZ
BBBZ
BBBZ
BBBZ
BBBBBBBB
AAAAAAA
012345678912345
!@#$%^&*()
 a 

SELECT * FROM t1 WHERE c1 >  'BBBZ' ORDER BY c1 ASC;
c1
BBBZxxxx 
CCCCCCCCC
aAaAaAaA
aaaaaaaaa
bbbbbbbbb
cccccccc
nrb0
SELECT * FROM t1 WHERE c1 >= 'BBBZ' ORDER BY c1 ASC;
c1
BBBZ
BBBZ
BBBZ
BBBZ
BBBZxxxx 
CCCCCCCCC
aAaAaAaA
aaaaaaaaa
bbbbbbbbb
cccccccc
nrb0
SELECT * FROM t1 WHERE c1 <  'BBBZ' ORDER BY c1 ASC;
c1

 a 
!@#$%^&*()
012345678912345
AAAAAAA
BBBBBBBB
SELECT * FROM t1 WHERE c1 <= 'BBBZ' ORDER BY c1 ASC;
c1

 a 
!@#$%^&*()
012345678912345
AAAAAAA
BBBBBBBB
BBBZ
BBBZ
BBBZ
BBBZ
SELECT * FROM t1 WHERE c1 =  'BBBZ' ORDER BY c1 ASC;
c1
BBBZ
BBBZ
BBBZ
BBBZ
SELECT * FROM t1 WHERE c1 >  'BBBZ' ORDER BY c1 DESC;
c1
nrb0
cccccccc
bbbbbbbbb
aaaaaaaaa
aAaAaAaA
CCCCCCCCC
BBBZxxxx 
SELECT * FROM t1 WHERE c1 >= 'BBBZ' ORDER BY c1 DESC;
c1
nrb0
cccccccc
bbbbbbbbb
aaaaaaaaa
aAaAaAaA
CCCCCCCCC
BBBZxxxx 
BBBZ
BBBZ
BBBZ
BBBZ
SELECT * FROM t1 WHERE c1 <  'BBBZ' ORDER BY c1 DESC;
c1
BBBBBBBB
AAAAAAA
012345678912345
!@#$%^&*()
 a 

SELECT * FROM t1 WHERE c1 <= 'BBBZ' ORDER BY c1 DESC;
c1
BBBZ
BBBZ
BBBZ
BBBZ
BBBBBBBB
AAAAAAA
012345678912345
!@#$%^&*()
 a 

SELECT * FROM t1 WHERE c1 =  'BBBZ' ORDER BY c1 DESC;
c1
BBBZ
BBBZ
BBBZ
BBBZ
UPDATE t1
SET c1 = 'aAaAaAaA'
WHERE c1 = 'BBBZ'
ORDER BY c1
LIMIT 2;
SELECT * FROM t1 ORDER BY c1;
c1

 a 
!@#$%^&*()
012345678912345
AAAAAAA
BBBBBBBB
BBBZ
BBBZ
BBBZxxxx 
CCCCCCCCC
aAaAaAaA
aAaAaAaA
aAaAaAaA
aaaaaaaaa
bbbbbbbbb
cccccccc
nrb0
DELETE FROM t1
WHERE c1 = 'BBBZ'
ORDER BY c1;
SELECT * FROM t1 ORDER BY c1;
c1

 a 
!@#$%^&*()
012345678912345
AAAAAAA
BBBBBBBB
BBBZxxxx 
CCCCCCCCC
aAaAaAaA
aAaAaAaA
aAaAaAaA
aaaaaaaaa
bbbbbbbbb
cccccccc
nrb0
DROP TABLE t1;
CREATE TABLE t1(c1 VARCHAR(15) NOT NULL, c2 VARCHAR(15) NOT NULL , INDEX(c1, c2))
DEFAULT CHARACTER SET utf8 COLLATE utf8_bin
ENGINE=cloud;
INSERT INTO t1 VALUES
('BBBZ', 'AAAAAAA'),
('BBBZ', 'aaaaaaaaa'),
('BBBZ', 'BBBBBBBB'),
('BBBZ', 'bbbbbbbbb'),
('BBBZ', 'cccccccc'),
('BBBZ', 'CCCCCCCCC'),
('BBBZ', 'aAaAaAaA'),
('BBBZ', '012345678912345'),
('BBBZ', 'BBBZxxxx '),
('BBBZ', '!@#$%^&*()'),
('BBBZ', 'nrb0'),
('BBBZ', ' a '),
('BBBZ', ''),
('BBBZ', 'BBBZ'),
('BBBZ', 'BBBZ'),
('BBBZ', 'BBBZ'),
('BBBZ', 'BBBZ');
SELECT * FROM t1 WHERE c1 = 'BBBZ' AND c2 > 'BBBZ' ORDER BY c2 ASC;
c1	c2
BBBZ	BBBZxxxx 
BBBZ	CCCCCCCCC
BBBZ	aAaAaAaA
BBBZ	aaaaaaaaa
BBBZ	bbbbbbbbb
BBBZ	cccccccc
BBBZ	nrb0
SELECT * FROM t1 WHERE c1 = 'BBBZ' AND c2 >= 'BBBZ' ORDER BY c2 ASC;
c1	c2
BBBZ	BBBZ
BBBZ	BBBZ
BBBZ	BBBZ
BBBZ	BBBZ
BBBZ	BBBZxxxx 
BBBZ	CCCCCCCCC
BBBZ	aAaAaAaA
BBBZ	aaaaaaaaa
BBBZ	bbbbbbbbb
BBBZ	cccccccc
BBBZ	nrb0
SELECT * FROM t1 WHERE c1 = 'BBBZ' AND c2 < 'BBBZ' ORDER BY c2 ASC;
c1	c2
BBBZ	
BBBZ	 a 
BBBZ	!@#$%^&*()
BBBZ	012345678912345
BBBZ	AAAAAAA
BBBZ	BBBBBBBB
SELECT * FROM t1 WHERE c1 = 'BBBZ' AND c2 <= 'BBBZ' ORDER BY c2 ASC;
c1	c2
BBBZ	
BBBZ	 a 
BBBZ	!@#$%^&*()
BBBZ	012345678912345
BBBZ	AAAAAAA
BBBZ	BBBBBBBB
BBBZ	BBBZ
BBBZ	BBBZ
BBBZ	BBBZ
BBBZ	BBBZ
SELECT * FROM t1 WHERE c1 = 'BBBZ' AND c2 > 'BBBZ' ORDER BY c2 DESC;
c1	c2
BBBZ	nrb0
BBBZ	cccccccc
BBBZ	bbbbbbbbb
BBBZ	aaaaaaaaa
BBBZ	aAaAaAaA
BBBZ	CCCCCCCCC
BBBZ	BBBZxxxx 
SELECT * FROM t1 WHERE c1 = 'BBBZ' AND c2 >= 'BBBZ' ORDER BY c2 DESC;
c1	c2
BBBZ	nrb0
BBBZ	cccccccc
BBBZ	bbbbbbbbb
BBBZ	aaaaaaaaa
BBBZ	aAaAaAaA
BBBZ	CCCCCCCCC
BBBZ	BBBZxxxx 
BBBZ	BBBZ
BBBZ	BBBZ
BBBZ	BBBZ
BBBZ	BBBZ
SELECT * FROM t1 WHERE c1 = 'BBBZ' AND c2 < 'BBBZ' ORDER BY c2 DESC;
c1	c2
BBBZ	BBBBBBBB
BBBZ	AAAAAAA
BBBZ	012345678912345
BBBZ	!@#$%^&*()
BBBZ	 a 
BBBZ	
SELECT * FROM t1 WHERE c1 = 'BBBZ' AND c2 <= 'BBBZ' ORDER BY c2 DESC;
c1	c2
BBBZ	BBBZ
BBBZ	BBBZ
BBBZ	BBBZ
BBBZ	BBBZ
BBBZ	BBBBBBBB
BBBZ	AAAAAAA
BBBZ	012345678912345
BBBZ	!@#$%^&*()
BBBZ	 a 
BBBZ	
DROP TABLE t1;
DROP TABLE IF EXISTS t1;
CREATE TABLE t1(c1 VARCHAR(15) NULL )
DEFAULT CHARACTER SET utf8 COLLATE utf8_bin
ENGINE=cloud;
INSERT INTO t1 VALUES
('AAAAAAA'),
('aaaaaaaaa'),
('BBBBBBBB'),
('bbbbbbbbb'),
('cccccccc'),
('CCCCCCCCC'),
('aAaAaAaA'),
('012345678912345'),
('BBBZxxxx '),
('!@#$%^&*()'),
('nrb0'),
(' a '),
(''),
('BBBZ'),
(NULL),
(NULL),
(NULL),
(NULL);
SELECT * FROM t1 WHERE c1 IS     NULL ORDER BY c1 ASC;
c1
NULL
NULL
NULL
NULL
SELECT * FROM t1 WHERE c1 IS NOT NULL ORDER BY c1 DESC;
c1
nrb0
cccccccc
bbbbbbbbb
aaaaaaaaa
aAaAaAaA
CCCCCCCCC
BBBZxxxx 
BBBZ
BBBBBBBB
AAAAAAA
012345678912345
!@#$%^&*()
 a 

SELECT * FROM t1 WHERE c1 IS     NULL ORDER BY c1 ASC;
c1
NULL
NULL
NULL
NULL
SELECT * FROM t1 WHERE c1 IS NOT NULL ORDER BY c1 DESC;
c1
nrb0
cccccccc
bbbbbbbbb
aaaaaaaaa
aAaAaAaA
CCCCCCCCC
BBBZxxxx 
BBBZ
BBBBBBBB
AAAAAAA
012345678912345
!@#$%^&*()
 a 

UPDATE t1
SET c1 = 'BBBZ'
WHERE c1 IS NULL
LIMIT 2;
SELECT * FROM t1 ORDER BY c1;
c1
NULL
NULL

 a 
!@#$%^&*()
012345678912345
AAAAAAA
BBBBBBBB
BBBZ
BBBZ
BBBZ
BBBZxxxx 
CCCCCCCCC
aAaAaAaA
aaaaaaaaa
bbbbbbbbb
cccccccc
nrb0
DELETE FROM t1
WHERE c1 IS NULL
ORDER BY c1;
SELECT * FROM t1 ORDER BY c1;
c1

 a 
!@#$%^&*()
012345678912345
AAAAAAA
BBBBBBBB
BBBZ
BBBZ
BBBZ
BBBZxxxx 
CCCCCCCCC
aAaAaAaA
aaaaaaaaa
bbbbbbbbb
cccccccc
nrb0
DROP TABLE t1;
CREATE TABLE t1(c1 VARCHAR(15) NULL, c2 VARCHAR(15) NULL , INDEX(c1, c2))
DEFAULT CHARACTER SET utf8 COLLATE utf8_bin
ENGINE=cloud;
INSERT INTO t1 VALUES
('BBBZ', 'AAAAAAA'),
('BBBZ', 'aaaaaaaaa'),
('BBBZ', 'BBBBBBBB'),
('BBBZ', 'bbbbbbbbb'),
('BBBZ', 'cccccccc'),
('BBBZ', 'CCCCCCCCC'),
('BBBZ', 'aAaAaAaA'),
('BBBZ', '012345678912345'),
('BBBZ', 'BBBZxxxx '),
('BBBZ', '!@#$%^&*()'),
('BBBZ', 'nrb0'),
('BBBZ', ' a '),
('BBBZ', ''),
('BBBZ', 'BBBZ'),
('BBBZ', 'BBBZ'),
('BBBZ', 'BBBZ'),
('BBBZ', NULL),
('BBBZ', NULL),
('BBBZ', NULL),
('BBBZ', NULL),
('BBBZ', 'BBBZ');
SELECT * FROM t1 WHERE c1 = 'BBBZ' AND c2 > 'BBBZ' ORDER BY c2 ASC;
c1	c2
BBBZ	BBBZxxxx 
BBBZ	CCCCCCCCC
BBBZ	aAaAaAaA
BBBZ	aaaaaaaaa
BBBZ	bbbbbbbbb
BBBZ	cccccccc
BBBZ	nrb0
SELECT * FROM t1 WHERE c1 = 'BBBZ' AND c2 >= 'BBBZ' ORDER BY c2 ASC;
c1	c2
BBBZ	BBBZ
BBBZ	BBBZ
BBBZ	BBBZ
BBBZ	BBBZ
BBBZ	BBBZxxxx 
BBBZ	CCCCCCCCC
BBBZ	aAaAaAaA
BBBZ	aaaaaaaaa
BBBZ	bbbbbbbbb
BBBZ	cccccccc
BBBZ	nrb0
SELECT * FROM t1 WHERE c1 = 'BBBZ' AND c2 < 'BBBZ' ORDER BY c2 ASC;
c1	c2
BBBZ	
BBBZ	 a 
BBBZ	!@#$%^&*()
BBBZ	012345678912345
BBBZ	AAAAAAA
BBBZ	BBBBBBBB
SELECT * FROM t1 WHERE c1 = 'BBBZ' AND c2 <= 'BBBZ' ORDER BY c2 ASC;
c1	c2
BBBZ	
BBBZ	 a 
BBBZ	!@#$%^&*()
BBBZ	012345678912345
BBBZ	AAAAAAA
BBBZ	BBBBBBBB
BBBZ	BBBZ
BBBZ	BBBZ
BBBZ	BBBZ
BBBZ	BBBZ
SELECT * FROM t1 WHERE c1 = 'BBBZ' AND c2 is null ORDER BY c1 ASC;
c1	c2
BBBZ	NULL
BBBZ	NULL
BBBZ	NULL
BBBZ	NULL
SELECT * FROM t1 WHERE c1 = 'BBBZ' AND c2 is not null ORDER BY c2 ASC;
c1	c2
BBBZ	
BBBZ	 a 
BBBZ	!@#$%^&*()
BBBZ	012345678912345
BBBZ	AAAAAAA
BBBZ	BBBBBBBB
BBBZ	BBBZ
BBBZ	BBBZ
BBBZ	BBBZ
BBBZ	BBBZ
BBBZ	BBBZxxxx 
BBBZ	CCCCCCCCC
BBBZ	aAaAaAaA
BBBZ	aaaaaaaaa
BBBZ	bbbbbbbbb
BBBZ	cccccccc
BBBZ	nrb0
SELECT * FROM t1 WHERE c1 = 'BBBZ' AND c2 > 'BBBZ' ORDER BY c2 DESC;
c1	c2
BBBZ	nrb0
BBBZ	cccccccc
BBBZ	bbbbbbbbb
BBBZ	aaaaaaaaa
BBBZ	aAaAaAaA
BBBZ	CCCCCCCCC
BBBZ	BBBZxxxx 
SELECT * FROM t1 WHERE c1 = 'BBBZ' AND c2 >= 'BBBZ' ORDER BY c2 DESC;
c1	c2
BBBZ	nrb0
BBBZ	cccccccc
BBBZ	bbbbbbbbb
BBBZ	aaaaaaaaa
BBBZ	aAaAaAaA
BBBZ	CCCCCCCCC
BBBZ	BBBZxxxx 
BBBZ	BBBZ
BBBZ	BBBZ
BBBZ	BBBZ
BBBZ	BBBZ
SELECT * FROM t1 WHERE c1 = 'BBBZ' AND c2 < 'BBBZ' ORDER BY c2 DESC;
c1	c2
BBBZ	BBBBBBBB
BBBZ	AAAAAAA
BBBZ	012345678912345
BBBZ	!@#$%^&*()
BBBZ	 a 
BBBZ	
SELECT * FROM t1 WHERE c1 = 'BBBZ' AND c2 <= 'BBBZ' ORDER BY c2 DESC;
c1	c2
BBBZ	BBBZ
BBBZ	BBBZ
BBBZ	BBBZ
BBBZ	BBBZ
BBBZ	BBBBBBBB
BBBZ	AAAAAAA
BBBZ	012345678912345
BBBZ	!@#$%^&*()
BBBZ	 a 
BBBZ	
SELECT * FROM t1 WHERE c1 = 'BBBZ' AND c2 is null ORDER BY c1 DESC;
c1	c2
BBBZ	NULL
BBBZ	NULL
BBBZ	NULL
BBBZ	NULL
SELECT * FROM t1 WHERE c1 = 'BBBZ' AND c2 is not null ORDER BY c2 DESC;
c1	c2
BBBZ	nrb0
BBBZ	cccccccc
BBBZ	bbbbbbbbb
BBBZ	aaaaaaaaa
BBBZ	aAaAaAaA
BBBZ	CCCCCCCCC
BBBZ	BBBZxxxx 
BBBZ	BBBZ
BBBZ	BBBZ
BBBZ	BBBZ
BBBZ	BBBZ
BBBZ	BBBBBBBB
BBBZ	AAAAAAA
BBBZ	012345678912345
BBBZ	!@#$%^&*()
BBBZ	 a 
BBBZ	
DROP TABLE t1;
DROP TABLE IF EXISTS t1;
CREATE TABLE t1(c1 VARCHAR(15) NULL )
DEFAULT CHARACTER SET utf8 COLLATE utf8_bin
ENGINE=cloud;
INSERT INTO t1 VALUES
('AAAAAAA'),
('aaaaaaaaa'),
('BBBBBBBB'),
('bbbbbbbbb'),
('cccccccc'),
('CCCCCCCCC'),
('aAaAaAaA'),
('012345678912345'),
('BBBZxxxx '),
('!@#$%^&*()'),
('nrb0'),
(' a '),
(''),
('BBBZ'),
('BBBZ'),
('BBBZ'),
('BBBZ');
SELECT * FROM t1 ORDER BY c1 ASC;
c1

 a 
!@#$%^&*()
012345678912345
AAAAAAA
BBBBBBBB
BBBZ
BBBZ
BBBZ
BBBZ
BBBZxxxx 
CCCCCCCCC
aAaAaAaA
aaaaaaaaa
bbbbbbbbb
cccccccc
nrb0
SELECT * FROM t1 ORDER BY c1 DESC;
c1
nrb0
cccccccc
bbbbbbbbb
aaaaaaaaa
aAaAaAaA
CCCCCCCCC
BBBZxxxx 
BBBZ
BBBZ
BBBZ
BBBZ
BBBBBBBB
AAAAAAA
012345678912345
!@#$%^&*()
 a 

SELECT * FROM t1 WHERE c1 >  'BBBZ' ORDER BY c1 ASC;
c1
BBBZxxxx 
CCCCCCCCC
aAaAaAaA
aaaaaaaaa
bbbbbbbbb
cccccccc
nrb0
SELECT * FROM t1 WHERE c1 >= 'BBBZ' ORDER BY c1 ASC;
c1
BBBZ
BBBZ
BBBZ
BBBZ
BBBZxxxx 
CCCCCCCCC
aAaAaAaA
aaaaaaaaa
bbbbbbbbb
cccccccc
nrb0
SELECT * FROM t1 WHERE c1 <  'BBBZ' ORDER BY c1 ASC;
c1

 a 
!@#$%^&*()
012345678912345
AAAAAAA
BBBBBBBB
SELECT * FROM t1 WHERE c1 <= 'BBBZ' ORDER BY c1 ASC;
c1

 a 
!@#$%^&*()
012345678912345
AAAAAAA
BBBBBBBB
BBBZ
BBBZ
BBBZ
BBBZ
SELECT * FROM t1 WHERE c1 =  'BBBZ' ORDER BY c1 ASC;
c1
BBBZ
BBBZ
BBBZ
BBBZ
SELECT * FROM t1 WHERE c1 >  'BBBZ' ORDER BY c1 DESC;
c1
nrb0
cccccccc
bbbbbbbbb
aaaaaaaaa
aAaAaAaA
CCCCCCCCC
BBBZxxxx 
SELECT * FROM t1 WHERE c1 >= 'BBBZ' ORDER BY c1 DESC;
c1
nrb0
cccccccc
bbbbbbbbb
aaaaaaaaa
aAaAaAaA
CCCCCCCCC
BBBZxxxx 
BBBZ
BBBZ
BBBZ
BBBZ
SELECT * FROM t1 WHERE c1 <  'BBBZ' ORDER BY c1 DESC;
c1
BBBBBBBB
AAAAAAA
012345678912345
!@#$%^&*()
 a 

SELECT * FROM t1 WHERE c1 <= 'BBBZ' ORDER BY c1 DESC;
c1
BBBZ
BBBZ
BBBZ
BBBZ
BBBBBBBB
AAAAAAA
012345678912345
!@#$%^&*()
 a 

SELECT * FROM t1 WHERE c1 =  'BBBZ' ORDER BY c1 DESC;
c1
BBBZ
BBBZ
BBBZ
BBBZ
UPDATE t1
SET c1 = 'aAaAaAaA'
WHERE c1 = 'BBBZ'
ORDER BY c1
LIMIT 2;
SELECT * FROM t1 ORDER BY c1;
c1

 a 
!@#$%^&*()
012345678912345
AAAAAAA
BBBBBBBB
BBBZ
BBBZ
BBBZxxxx 
CCCCCCCCC
aAaAaAaA
aAaAaAaA
aAaAaAaA
aaaaaaaaa
bbbbbbbbb
cccccccc
nrb0
DELETE FROM t1
WHERE c1 = 'BBBZ'
ORDER BY c1;
SELECT * FROM t1 ORDER BY c1;
c1

 a 
!@#$%^&*()
012345678912345
AAAAAAA
BBBBBBBB
BBBZxxxx 
CCCCCCCCC
aAaAaAaA
aAaAaAaA
aAaAaAaA
aaaaaaaaa
bbbbbbbbb
cccccccc
nrb0
DROP TABLE t1;
CREATE TABLE t1(c1 VARCHAR(15) NULL, c2 VARCHAR(15) NULL , INDEX(c1, c2))
DEFAULT CHARACTER SET utf8 COLLATE utf8_bin
ENGINE=cloud;
INSERT INTO t1 VALUES
('BBBZ', 'AAAAAAA'),
('BBBZ', 'aaaaaaaaa'),
('BBBZ', 'BBBBBBBB'),
('BBBZ', 'bbbbbbbbb'),
('BBBZ', 'cccccccc'),
('BBBZ', 'CCCCCCCCC'),
('BBBZ', 'aAaAaAaA'),
('BBBZ', '012345678912345'),
('BBBZ', 'BBBZxxxx '),
('BBBZ', '!@#$%^&*()'),
('BBBZ', 'nrb0'),
('BBBZ', ' a '),
('BBBZ', ''),
('BBBZ', 'BBBZ'),
('BBBZ', 'BBBZ'),
('BBBZ', 'BBBZ'),
('BBBZ', 'BBBZ');
SELECT * FROM t1 WHERE c1 = 'BBBZ' AND c2 > 'BBBZ' ORDER BY c2 ASC;
c1	c2
BBBZ	BBBZxxxx 
BBBZ	CCCCCCCCC
BBBZ	aAaAaAaA
BBBZ	aaaaaaaaa
BBBZ	bbbbbbbbb
BBBZ	cccccccc
BBBZ	nrb0
SELECT * FROM t1 WHERE c1 = 'BBBZ' AND c2 >= 'BBBZ' ORDER BY c2 ASC;
c1	c2
BBBZ	BBBZ
BBBZ	BBBZ
BBBZ	BBBZ
BBBZ	BBBZ
BBBZ	BBBZxxxx 
BBBZ	CCCCCCCCC
BBBZ	aAaAaAaA
BBBZ	aaaaaaaaa
BBBZ	bbbbbbbbb
BBBZ	cccccccc
BBBZ	nrb0
SELECT * FROM t1 WHERE c1 = 'BBBZ' AND c2 < 'BBBZ' ORDER BY c2 ASC;
c1	c2
BBBZ	
BBBZ	 a 
BBBZ	!@#$%^&*()
BBBZ	012345678912345
BBBZ	AAAAAAA
BBBZ	BBBBBBBB
SELECT * FROM t1 WHERE c1 = 'BBBZ' AND c2 <= 'BBBZ' ORDER BY c2 ASC;
c1	c2
BBBZ	
BBBZ	 a 
BBBZ	!@#$%^&*()
BBBZ	012345678912345
BBBZ	AAAAAAA
BBBZ	BBBBBBBB
BBBZ	BBBZ
BBBZ	BBBZ
BBBZ	BBBZ
BBBZ	BBBZ
SELECT * FROM t1 WHERE c1 = 'BBBZ' AND c2 > 'BBBZ' ORDER BY c2 DESC;
c1	c2
BBBZ	nrb0
BBBZ	cccccccc
BBBZ	bbbbbbbbb
BBBZ	aaaaaaaaa
BBBZ	aAaAaAaA
BBBZ	CCCCCCCCC
BBBZ	BBBZxxxx 
SELECT * FROM t1 WHERE c1 = 'BBBZ' AND c2 >= 'BBBZ' ORDER BY c2 DESC;
c1	c2
BBBZ	nrb0
BBBZ	cccccccc
BBBZ	bbbbbbbbb
BBBZ	aaaaaaaaa
BBBZ	aAaAaAaA
BBBZ	CCCCCCCCC
BBBZ	BBBZxxxx 
BBBZ	BBBZ
BBBZ	BBBZ
BBBZ	BBBZ
BBBZ	BBBZ
SELECT * FROM t1 WHERE c1 = 'BBBZ' AND c2 < 'BBBZ' ORDER BY c2 DESC;
c1	c2
BBBZ	BBBBBBBB
BBBZ	AAAAAAA
BBBZ	012345678912345
BBBZ	!@#$%^&*()
BBBZ	 a 
BBBZ	
SELECT * FROM t1 WHERE c1 = 'BBBZ' AND c2 <= 'BBBZ' ORDER BY c2 DESC;
c1	c2
BBBZ	BBBZ
BBBZ	BBBZ
BBBZ	BBBZ
BBBZ	BBBZ
BBBZ	BBBBBBBB
BBBZ	AAAAAAA
BBBZ	012345678912345
BBBZ	!@#$%^&*()
BBBZ	 a 
BBBZ	
DROP TABLE t1;
DROP TABLE IF EXISTS t1;
CREATE TABLE t1(c1 VARCHAR(15) NOT NULL , INDEX(c1))
DEFAULT CHARACTER SET utf8 COLLATE utf8_bin
ENGINE=cloud;
INSERT INTO t1 VALUES
('AAAAAAA'),
('aaaaaaaaa'),
('BBBBBBBB'),
('bbbbbbbbb'),
('cccccccc'),
('CCCCCCCCC'),
('aAaAaAaA'),
('012345678912345'),
('BBBZxxxx '),
('!@#$%^&*()'),
('nrb0'),
(' a '),
(''),
('BBBZ'),
('BBBZ'),
('BBBZ'),
('BBBZ');
SELECT * FROM t1 ORDER BY c1 ASC;
c1

 a 
!@#$%^&*()
012345678912345
AAAAAAA
BBBBBBBB
BBBZ
BBBZ
BBBZ
BBBZ
BBBZxxxx 
CCCCCCCCC
aAaAaAaA
aaaaaaaaa
bbbbbbbbb
cccccccc
nrb0
SELECT * FROM t1 ORDER BY c1 DESC;
c1
nrb0
cccccccc
bbbbbbbbb
aaaaaaaaa
aAaAaAaA
CCCCCCCCC
BBBZxxxx 
BBBZ
BBBZ
BBBZ
BBBZ
BBBBBBBB
AAAAAAA
012345678912345
!@#$%^&*()
 a 

SELECT * FROM t1 WHERE c1 >  'BBBZ' ORDER BY c1 ASC;
c1
BBBZxxxx 
CCCCCCCCC
aAaAaAaA
aaaaaaaaa
bbbbbbbbb
cccccccc
nrb0
SELECT * FROM t1 WHERE c1 >= 'BBBZ' ORDER BY c1 ASC;
c1
BBBZ
BBBZ
BBBZ
BBBZ
BBBZxxxx 
CCCCCCCCC
aAaAaAaA
aaaaaaaaa
bbbbbbbbb
cccccccc
nrb0
SELECT * FROM t1 WHERE c1 <  'BBBZ' ORDER BY c1 ASC;
c1

 a 
!@#$%^&*()
012345678912345
AAAAAAA
BBBBBBBB
SELECT * FROM t1 WHERE c1 <= 'BBBZ' ORDER BY c1 ASC;
c1

 a 
!@#$%^&*()
012345678912345
AAAAAAA
BBBBBBBB
BBBZ
BBBZ
BBBZ
BBBZ
SELECT * FROM t1 WHERE c1 =  'BBBZ' ORDER BY c1 ASC;
c1
BBBZ
BBBZ
BBBZ
BBBZ
SELECT * FROM t1 WHERE c1 >  'BBBZ' ORDER BY c1 DESC;
c1
nrb0
cccccccc
bbbbbbbbb
aaaaaaaaa
aAaAaAaA
CCCCCCCCC
BBBZxxxx 
SELECT * FROM t1 WHERE c1 >= 'BBBZ' ORDER BY c1 DESC;
c1
nrb0
cccccccc
bbbbbbbbb
aaaaaaaaa
aAaAaAaA
CCCCCCCCC
BBBZxxxx 
BBBZ
BBBZ
BBBZ
BBBZ
SELECT * FROM t1 WHERE c1 <  'BBBZ' ORDER BY c1 DESC;
c1
BBBBBBBB
AAAAAAA
012345678912345
!@#$%^&*()
 a 

SELECT * FROM t1 WHERE c1 <= 'BBBZ' ORDER BY c1 DESC;
c1
BBBZ
BBBZ
BBBZ
BBBZ
BBBBBBBB
AAAAAAA
012345678912345
!@#$%^&*()
 a 

SELECT * FROM t1 WHERE c1 =  'BBBZ' ORDER BY c1 DESC;
c1
BBBZ
BBBZ
BBBZ
BBBZ
UPDATE t1
SET c1 = 'aAaAaAaA'
WHERE c1 = 'BBBZ'
ORDER BY c1
LIMIT 2;
SELECT * FROM t1 ORDER BY c1;
c1

 a 
!@#$%^&*()
012345678912345
AAAAAAA
BBBBBBBB
BBBZ
BBBZ
BBBZxxxx 
CCCCCCCCC
aAaAaAaA
aAaAaAaA
aAaAaAaA
aaaaaaaaa
bbbbbbbbb
cccccccc
nrb0
DELETE FROM t1
WHERE c1 = 'BBBZ'
ORDER BY c1;
SELECT * FROM t1 ORDER BY c1;
c1

 a 
!@#$%^&*()
012345678912345
AAAAAAA
BBBBBBBB
BBBZxxxx 
CCCCCCCCC
aAaAaAaA
aAaAaAaA
aAaAaAaA
aaaaaaaaa
bbbbbbbbb
cccccccc
nrb0
DROP TABLE t1;
CREATE TABLE t1(c1 VARCHAR(15) NOT NULL, c2 VARCHAR(15) NOT NULL , INDEX(c1, c2))
DEFAULT CHARACTER SET utf8 COLLATE utf8_bin
ENGINE=cloud;
INSERT INTO t1 VALUES
('BBBZ', 'AAAAAAA'),
('BBBZ', 'aaaaaaaaa'),
('BBBZ', 'BBBBBBBB'),
('BBBZ', 'bbbbbbbbb'),
('BBBZ', 'cccccccc'),
('BBBZ', 'CCCCCCCCC'),
('BBBZ', 'aAaAaAaA'),
('BBBZ', '012345678912345'),
('BBBZ', 'BBBZxxxx '),
('BBBZ', '!@#$%^&*()'),
('BBBZ', 'nrb0'),
('BBBZ', ' a '),
('BBBZ', ''),
('BBBZ', 'BBBZ'),
('BBBZ', 'BBBZ'),
('BBBZ', 'BBBZ'),
('BBBZ', 'BBBZ');
SELECT * FROM t1 WHERE c1 = 'BBBZ' AND c2 > 'BBBZ' ORDER BY c2 ASC;
c1	c2
BBBZ	BBBZxxxx 
BBBZ	CCCCCCCCC
BBBZ	aAaAaAaA
BBBZ	aaaaaaaaa
BBBZ	bbbbbbbbb
BBBZ	cccccccc
BBBZ	nrb0
SELECT * FROM t1 WHERE c1 = 'BBBZ' AND c2 >= 'BBBZ' ORDER BY c2 ASC;
c1	c2
BBBZ	BBBZ
BBBZ	BBBZ
BBBZ	BBBZ
BBBZ	BBBZ
BBBZ	BBBZxxxx 
BBBZ	CCCCCCCCC
BBBZ	aAaAaAaA
BBBZ	aaaaaaaaa
BBBZ	bbbbbbbbb
BBBZ	cccccccc
BBBZ	nrb0
SELECT * FROM t1 WHERE c1 = 'BBBZ' AND c2 < 'BBBZ' ORDER BY c2 ASC;
c1	c2
BBBZ	
BBBZ	 a 
BBBZ	!@#$%^&*()
BBBZ	012345678912345
BBBZ	AAAAAAA
BBBZ	BBBBBBBB
SELECT * FROM t1 WHERE c1 = 'BBBZ' AND c2 <= 'BBBZ' ORDER BY c2 ASC;
c1	c2
BBBZ	
BBBZ	 a 
BBBZ	!@#$%^&*()
BBBZ	012345678912345
BBBZ	AAAAAAA
BBBZ	BBBBBBBB
BBBZ	BBBZ
BBBZ	BBBZ
BBBZ	BBBZ
BBBZ	BBBZ
SELECT * FROM t1 WHERE c1 = 'BBBZ' AND c2 > 'BBBZ' ORDER BY c2 DESC;
c1	c2
BBBZ	nrb0
BBBZ	cccccccc
BBBZ	bbbbbbbbb
BBBZ	aaaaaaaaa
BBBZ	aAaAaAaA
BBBZ	CCCCCCCCC
BBBZ	BBBZxxxx 
SELECT * FROM t1 WHERE c1 = 'BBBZ' AND c2 >= 'BBBZ' ORDER BY c2 DESC;
c1	c2
BBBZ	nrb0
BBBZ	cccccccc
BBBZ	bbbbbbbbb
BBBZ	aaaaaaaaa
BBBZ	aAaAaAaA
BBBZ	CCCCCCCCC
BBBZ	BBBZxxxx 
BBBZ	BBBZ
BBBZ	BBBZ
BBBZ	BBBZ
BBBZ	BBBZ
SELECT * FROM t1 WHERE c1 = 'BBBZ' AND c2 < 'BBBZ' ORDER BY c2 DESC;
c1	c2
BBBZ	BBBBBBBB
BBBZ	AAAAAAA
BBBZ	012345678912345
BBBZ	!@#$%^&*()
BBBZ	 a 
BBBZ	
SELECT * FROM t1 WHERE c1 = 'BBBZ' AND c2 <= 'BBBZ' ORDER BY c2 DESC;
c1	c2
BBBZ	BBBZ
BBBZ	BBBZ
BBBZ	BBBZ
BBBZ	BBBZ
BBBZ	BBBBBBBB
BBBZ	AAAAAAA
BBBZ	012345678912345
BBBZ	!@#$%^&*()
BBBZ	 a 
BBBZ	
DROP TABLE t1;
DROP TABLE IF EXISTS t1;
CREATE TABLE t1(c1 VARCHAR(15) NULL , INDEX(c1))
DEFAULT CHARACTER SET utf8 COLLATE utf8_bin
ENGINE=cloud;
INSERT INTO t1 VALUES
('AAAAAAA'),
('aaaaaaaaa'),
('BBBBBBBB'),
('bbbbbbbbb'),
('cccccccc'),
('CCCCCCCCC'),
('aAaAaAaA'),
('012345678912345'),
('BBBZxxxx '),
('!@#$%^&*()'),
('nrb0'),
(' a '),
(''),
('BBBZ'),
(NULL),
(NULL),
(NULL),
(NULL);
SELECT * FROM t1 WHERE c1 IS     NULL ORDER BY c1 ASC;
c1
NULL
NULL
NULL
NULL
SELECT * FROM t1 WHERE c1 IS NOT NULL ORDER BY c1 DESC;
c1
nrb0
cccccccc
bbbbbbbbb
aaaaaaaaa
aAaAaAaA
CCCCCCCCC
BBBZxxxx 
BBBZ
BBBBBBBB
AAAAAAA
012345678912345
!@#$%^&*()
 a 

SELECT * FROM t1 WHERE c1 IS     NULL ORDER BY c1 ASC;
c1
NULL
NULL
NULL
NULL
SELECT * FROM t1 WHERE c1 IS NOT NULL ORDER BY c1 DESC;
c1
nrb0
cccccccc
bbbbbbbbb
aaaaaaaaa
aAaAaAaA
CCCCCCCCC
BBBZxxxx 
BBBZ
BBBBBBBB
AAAAAAA
012345678912345
!@#$%^&*()
 a 

UPDATE t1
SET c1 = 'BBBZ'
WHERE c1 IS NULL
LIMIT 2;
SELECT * FROM t1 ORDER BY c1;
c1
NULL
NULL

 a 
!@#$%^&*()
012345678912345
AAAAAAA
BBBBBBBB
BBBZ
BBBZ
BBBZ
BBBZxxxx 
CCCCCCCCC
aAaAaAaA
aaaaaaaaa
bbbbbbbbb
cccccccc
nrb0
DELETE FROM t1
WHERE c1 IS NULL
ORDER BY c1;
SELECT * FROM t1 ORDER BY c1;
c1

 a 
!@#$%^&*()
012345678912345
AAAAAAA
BBBBBBBB
BBBZ
BBBZ
BBBZ
BBBZxxxx 
CCCCCCCCC
aAaAaAaA
aaaaaaaaa
bbbbbbbbb
cccccccc
nrb0
DROP TABLE t1;
CREATE TABLE t1(c1 VARCHAR(15) NULL, c2 VARCHAR(15) NULL , INDEX(c1, c2))
DEFAULT CHARACTER SET utf8 COLLATE utf8_bin
ENGINE=cloud;
INSERT INTO t1 VALUES
('BBBZ', 'AAAAAAA'),
('BBBZ', 'aaaaaaaaa'),
('BBBZ', 'BBBBBBBB'),
('BBBZ', 'bbbbbbbbb'),
('BBBZ', 'cccccccc'),
('BBBZ', 'CCCCCCCCC'),
('BBBZ', 'aAaAaAaA'),
('BBBZ', '012345678912345'),
('BBBZ', 'BBBZxxxx '),
('BBBZ', '!@#$%^&*()'),
('BBBZ', 'nrb0'),
('BBBZ', ' a '),
('BBBZ', ''),
('BBBZ', 'BBBZ'),
('BBBZ', 'BBBZ'),
('BBBZ', 'BBBZ'),
('BBBZ', NULL),
('BBBZ', NULL),
('BBBZ', NULL),
('BBBZ', NULL),
('BBBZ', 'BBBZ');
SELECT * FROM t1 WHERE c1 = 'BBBZ' AND c2 > 'BBBZ' ORDER BY c2 ASC;
c1	c2
BBBZ	BBBZxxxx 
BBBZ	CCCCCCCCC
BBBZ	aAaAaAaA
BBBZ	aaaaaaaaa
BBBZ	bbbbbbbbb
BBBZ	cccccccc
BBBZ	nrb0
SELECT * FROM t1 WHERE c1 = 'BBBZ' AND c2 >= 'BBBZ' ORDER BY c2 ASC;
c1	c2
BBBZ	BBBZ
BBBZ	BBBZ
BBBZ	BBBZ
BBBZ	BBBZ
BBBZ	BBBZxxxx 
BBBZ	CCCCCCCCC
BBBZ	aAaAaAaA
BBBZ	aaaaaaaaa
BBBZ	bbbbbbbbb
BBBZ	cccccccc
BBBZ	nrb0
SELECT * FROM t1 WHERE c1 = 'BBBZ' AND c2 < 'BBBZ' ORDER BY c2 ASC;
c1	c2
BBBZ	
BBBZ	 a 
BBBZ	!@#$%^&*()
BBBZ	012345678912345
BBBZ	AAAAAAA
BBBZ	BBBBBBBB
SELECT * FROM t1 WHERE c1 = 'BBBZ' AND c2 <= 'BBBZ' ORDER BY c2 ASC;
c1	c2
BBBZ	
BBBZ	 a 
BBBZ	!@#$%^&*()
BBBZ	012345678912345
BBBZ	AAAAAAA
BBBZ	BBBBBBBB
BBBZ	BBBZ
BBBZ	BBBZ
BBBZ	BBBZ
BBBZ	BBBZ
SELECT * FROM t1 WHERE c1 = 'BBBZ' AND c2 is null ORDER BY c1 ASC;
c1	c2
BBBZ	NULL
BBBZ	NULL
BBBZ	NULL
BBBZ	NULL
SELECT * FROM t1 WHERE c1 = 'BBBZ' AND c2 is not null ORDER BY c2 ASC;
c1	c2
BBBZ	
BBBZ	 a 
BBBZ	!@#$%^&*()
BBBZ	012345678912345
BBBZ	AAAAAAA
BBBZ	BBBBBBBB
BBBZ	BBBZ
BBBZ	BBBZ
BBBZ	BBBZ
BBBZ	BBBZ
BBBZ	BBBZxxxx 
BBBZ	CCCCCCCCC
BBBZ	aAaAaAaA
BBBZ	aaaaaaaaa
BBBZ	bbbbbbbbb
BBBZ	cccccccc
BBBZ	nrb0
SELECT * FROM t1 WHERE c1 = 'BBBZ' AND c2 > 'BBBZ' ORDER BY c2 DESC;
c1	c2
BBBZ	nrb0
BBBZ	cccccccc
BBBZ	bbbbbbbbb
BBBZ	aaaaaaaaa
BBBZ	aAaAaAaA
BBBZ	CCCCCCCCC
BBBZ	BBBZxxxx 
SELECT * FROM t1 WHERE c1 = 'BBBZ' AND c2 >= 'BBBZ' ORDER BY c2 DESC;
c1	c2
BBBZ	nrb0
BBBZ	cccccccc
BBBZ	bbbbbbbbb
BBBZ	aaaaaaaaa
BBBZ	aAaAaAaA
BBBZ	CCCCCCCCC
BBBZ	BBBZxxxx 
BBBZ	BBBZ
BBBZ	BBBZ
BBBZ	BBBZ
BBBZ	BBBZ
SELECT * FROM t1 WHERE c1 = 'BBBZ' AND c2 < 'BBBZ' ORDER BY c2 DESC;
c1	c2
BBBZ	BBBBBBBB
BBBZ	AAAAAAA
BBBZ	012345678912345
BBBZ	!@#$%^&*()
BBBZ	 a 
BBBZ	
SELECT * FROM t1 WHERE c1 = 'BBBZ' AND c2 <= 'BBBZ' ORDER BY c2 DESC;
c1	c2
BBBZ	BBBZ
BBBZ	BBBZ
BBBZ	BBBZ
BBBZ	BBBZ
BBBZ	BBBBBBBB
BBBZ	AAAAAAA
BBBZ	012345678912345
BBBZ	!@#$%^&*()
BBBZ	 a 
BBBZ	
SELECT * FROM t1 WHERE c1 = 'BBBZ' AND c2 is null ORDER BY c1 DESC;
c1	c2
BBBZ	NULL
BBBZ	NULL
BBBZ	NULL
BBBZ	NULL
SELECT * FROM t1 WHERE c1 = 'BBBZ' AND c2 is not null ORDER BY c2 DESC;
c1	c2
BBBZ	nrb0
BBBZ	cccccccc
BBBZ	bbbbbbbbb
BBBZ	aaaaaaaaa
BBBZ	aAaAaAaA
BBBZ	CCCCCCCCC
BBBZ	BBBZxxxx 
BBBZ	BBBZ
BBBZ	BBBZ
BBBZ	BBBZ
BBBZ	BBBZ
BBBZ	BBBBBBBB
BBBZ	AAAAAAA
BBBZ	012345678912345
BBBZ	!@#$%^&*()
BBBZ	 a 
BBBZ	
DROP TABLE t1;
DROP TABLE IF EXISTS t1;
CREATE TABLE t1(c1 VARCHAR(15) NULL , INDEX(c1))
DEFAULT CHARACTER SET utf8 COLLATE utf8_bin
ENGINE=cloud;
INSERT INTO t1 VALUES
('AAAAAAA'),
('aaaaaaaaa'),
('BBBBBBBB'),
('bbbbbbbbb'),
('cccccccc'),
('CCCCCCCCC'),
('aAaAaAaA'),
('012345678912345'),
('BBBZxxxx '),
('!@#$%^&*()'),
('nrb0'),
(' a '),
(''),
('BBBZ'),
('BBBZ'),
('BBBZ'),
('BBBZ');
SELECT * FROM t1 ORDER BY c1 ASC;
c1

 a 
!@#$%^&*()
012345678912345
AAAAAAA
BBBBBBBB
BBBZ
BBBZ
BBBZ
BBBZ
BBBZxxxx 
CCCCCCCCC
aAaAaAaA
aaaaaaaaa
bbbbbbbbb
cccccccc
nrb0
SELECT * FROM t1 ORDER BY c1 DESC;
c1
nrb0
cccccccc
bbbbbbbbb
aaaaaaaaa
aAaAaAaA
CCCCCCCCC
BBBZxxxx 
BBBZ
BBBZ
BBBZ
BBBZ
BBBBBBBB
AAAAAAA
012345678912345
!@#$%^&*()
 a 

SELECT * FROM t1 WHERE c1 >  'BBBZ' ORDER BY c1 ASC;
c1
BBBZxxxx 
CCCCCCCCC
aAaAaAaA
aaaaaaaaa
bbbbbbbbb
cccccccc
nrb0
SELECT * FROM t1 WHERE c1 >= 'BBBZ' ORDER BY c1 ASC;
c1
BBBZ
BBBZ
BBBZ
BBBZ
BBBZxxxx 
CCCCCCCCC
aAaAaAaA
aaaaaaaaa
bbbbbbbbb
cccccccc
nrb0
SELECT * FROM t1 WHERE c1 <  'BBBZ' ORDER BY c1 ASC;
c1

 a 
!@#$%^&*()
012345678912345
AAAAAAA
BBBBBBBB
SELECT * FROM t1 WHERE c1 <= 'BBBZ' ORDER BY c1 ASC;
c1

 a 
!@#$%^&*()
012345678912345
AAAAAAA
BBBBBBBB
BBBZ
BBBZ
BBBZ
BBBZ
SELECT * FROM t1 WHERE c1 =  'BBBZ' ORDER BY c1 ASC;
c1
BBBZ
BBBZ
BBBZ
BBBZ
SELECT * FROM t1 WHERE c1 >  'BBBZ' ORDER BY c1 DESC;
c1
nrb0
cccccccc
bbbbbbbbb
aaaaaaaaa
aAaAaAaA
CCCCCCCCC
BBBZxxxx 
SELECT * FROM t1 WHERE c1 >= 'BBBZ' ORDER BY c1 DESC;
c1
nrb0
cccccccc
bbbbbbbbb
aaaaaaaaa
aAaAaAaA
CCCCCCCCC
BBBZxxxx 
BBBZ
BBBZ
BBBZ
BBBZ
SELECT * FROM t1 WHERE c1 <  'BBBZ' ORDER BY c1 DESC;
c1
BBBBBBBB
AAAAAAA
012345678912345
!@#$%^&*()
 a 

SELECT * FROM t1 WHERE c1 <= 'BBBZ' ORDER BY c1 DESC;
c1
BBBZ
BBBZ
BBBZ
BBBZ
BBBBBBBB
AAAAAAA
012345678912345
!@#$%^&*()
 a 

SELECT * FROM t1 WHERE c1 =  'BBBZ' ORDER BY c1 DESC;
c1
BBBZ
BBBZ
BBBZ
BBBZ
UPDATE t1
SET c1 = 'aAaAaAaA'
WHERE c1 = 'BBBZ'
ORDER BY c1
LIMIT 2;
SELECT * FROM t1 ORDER BY c1;
c1

 a 
!@#$%^&*()
012345678912345
AAAAAAA
BBBBBBBB
BBBZ
BBBZ
BBBZxxxx 
CCCCCCCCC
aAaAaAaA
aAaAaAaA
aAaAaAaA
aaaaaaaaa
bbbbbbbbb
cccccccc
nrb0
DELETE FROM t1
WHERE c1 = 'BBBZ'
ORDER BY c1;
SELECT * FROM t1 ORDER BY c1;
c1

 a 
!@#$%^&*()
012345678912345
AAAAAAA
BBBBBBBB
BBBZxxxx 
CCCCCCCCC
aAaAaAaA
aAaAaAaA
aAaAaAaA
aaaaaaaaa
bbbbbbbbb
cccccccc
nrb0
DROP TABLE t1;
CREATE TABLE t1(c1 VARCHAR(15) NULL, c2 VARCHAR(15) NULL , INDEX(c1, c2))
DEFAULT CHARACTER SET utf8 COLLATE utf8_bin
ENGINE=cloud;
INSERT INTO t1 VALUES
('BBBZ', 'AAAAAAA'),
('BBBZ', 'aaaaaaaaa'),
('BBBZ', 'BBBBBBBB'),
('BBBZ', 'bbbbbbbbb'),
('BBBZ', 'cccccccc'),
('BBBZ', 'CCCCCCCCC'),
('BBBZ', 'aAaAaAaA'),
('BBBZ', '012345678912345'),
('BBBZ', 'BBBZxxxx '),
('BBBZ', '!@#$%^&*()'),
('BBBZ', 'nrb0'),
('BBBZ', ' a '),
('BBBZ', ''),
('BBBZ', 'BBBZ'),
('BBBZ', 'BBBZ'),
('BBBZ', 'BBBZ'),
('BBBZ', 'BBBZ');
SELECT * FROM t1 WHERE c1 = 'BBBZ' AND c2 > 'BBBZ' ORDER BY c2 ASC;
c1	c2
BBBZ	BBBZxxxx 
BBBZ	CCCCCCCCC
BBBZ	aAaAaAaA
BBBZ	aaaaaaaaa
BBBZ	bbbbbbbbb
BBBZ	cccccccc
BBBZ	nrb0
SELECT * FROM t1 WHERE c1 = 'BBBZ' AND c2 >= 'BBBZ' ORDER BY c2 ASC;
c1	c2
BBBZ	BBBZ
BBBZ	BBBZ
BBBZ	BBBZ
BBBZ	BBBZ
BBBZ	BBBZxxxx 
BBBZ	CCCCCCCCC
BBBZ	aAaAaAaA
BBBZ	aaaaaaaaa
BBBZ	bbbbbbbbb
BBBZ	cccccccc
BBBZ	nrb0
SELECT * FROM t1 WHERE c1 = 'BBBZ' AND c2 < 'BBBZ' ORDER BY c2 ASC;
c1	c2
BBBZ	
BBBZ	 a 
BBBZ	!@#$%^&*()
BBBZ	012345678912345
BBBZ	AAAAAAA
BBBZ	BBBBBBBB
SELECT * FROM t1 WHERE c1 = 'BBBZ' AND c2 <= 'BBBZ' ORDER BY c2 ASC;
c1	c2
BBBZ	
BBBZ	 a 
BBBZ	!@#$%^&*()
BBBZ	012345678912345
BBBZ	AAAAAAA
BBBZ	BBBBBBBB
BBBZ	BBBZ
BBBZ	BBBZ
BBBZ	BBBZ
BBBZ	BBBZ
SELECT * FROM t1 WHERE c1 = 'BBBZ' AND c2 > 'BBBZ' ORDER BY c2 DESC;
c1	c2
BBBZ	nrb0
BBBZ	cccccccc
BBBZ	bbbbbbbbb
BBBZ	aaaaaaaaa
BBBZ	aAaAaAaA
BBBZ	CCCCCCCCC
BBBZ	BBBZxxxx 
SELECT * FROM t1 WHERE c1 = 'BBBZ' AND c2 >= 'BBBZ' ORDER BY c2 DESC;
c1	c2
BBBZ	nrb0
BBBZ	cccccccc
BBBZ	bbbbbbbbb
BBBZ	aaaaaaaaa
BBBZ	aAaAaAaA
BBBZ	CCCCCCCCC
BBBZ	BBBZxxxx 
BBBZ	BBBZ
BBBZ	BBBZ
BBBZ	BBBZ
BBBZ	BBBZ
SELECT * FROM t1 WHERE c1 = 'BBBZ' AND c2 < 'BBBZ' ORDER BY c2 DESC;
c1	c2
BBBZ	BBBBBBBB
BBBZ	AAAAAAA
BBBZ	012345678912345
BBBZ	!@#$%^&*()
BBBZ	 a 
BBBZ	
SELECT * FROM t1 WHERE c1 = 'BBBZ' AND c2 <= 'BBBZ' ORDER BY c2 DESC;
c1	c2
BBBZ	BBBZ
BBBZ	BBBZ
BBBZ	BBBZ
BBBZ	BBBZ
BBBZ	BBBBBBBB
BBBZ	AAAAAAA
BBBZ	012345678912345
BBBZ	!@#$%^&*()
BBBZ	 a 
BBBZ	
DROP TABLE t1;
