DROP TABLE IF EXISTS t1;
CREATE TABLE t1(c1 BIGINT SIGNED NOT NULL );
INSERT INTO t1 VALUES
(-9223372036854775808),
(0),
(0),
(0),
(0),
(4611686018427387903 - 2),
(4611686018427387903 - 1),
(4611686018427387903),
(4611686018427387903),
(4611686018427387903 + 1),
(4611686018427387903 + 2),
(9223372036854775807);
SELECT * FROM t1 ORDER BY c1 ASC;
c1
-9223372036854775808
0
0
0
0
4611686018427387901
4611686018427387902
4611686018427387903
4611686018427387903
4611686018427387904
4611686018427387905
9223372036854775807
SELECT * FROM t1 ORDER BY c1 DESC;
c1
9223372036854775807
4611686018427387905
4611686018427387904
4611686018427387903
4611686018427387903
4611686018427387902
4611686018427387901
0
0
0
0
-9223372036854775808
SELECT * FROM t1 WHERE c1 >  4611686018427387903 ORDER BY c1 ASC;
c1
4611686018427387904
4611686018427387905
9223372036854775807
SELECT * FROM t1 WHERE c1 >= 4611686018427387903 ORDER BY c1 ASC;
c1
4611686018427387903
4611686018427387903
4611686018427387904
4611686018427387905
9223372036854775807
SELECT * FROM t1 WHERE c1 <  4611686018427387903 ORDER BY c1 ASC;
c1
-9223372036854775808
0
0
0
0
4611686018427387901
4611686018427387902
SELECT * FROM t1 WHERE c1 <= 4611686018427387903 ORDER BY c1 ASC;
c1
-9223372036854775808
0
0
0
0
4611686018427387901
4611686018427387902
4611686018427387903
4611686018427387903
SELECT * FROM t1 WHERE c1 =  4611686018427387903 ORDER BY c1 ASC;
c1
4611686018427387903
4611686018427387903
SELECT * FROM t1 WHERE c1 >  4611686018427387903 ORDER BY c1 DESC;
c1
9223372036854775807
4611686018427387905
4611686018427387904
SELECT * FROM t1 WHERE c1 >= 4611686018427387903 ORDER BY c1 DESC;
c1
9223372036854775807
4611686018427387905
4611686018427387904
4611686018427387903
4611686018427387903
SELECT * FROM t1 WHERE c1 <  4611686018427387903 ORDER BY c1 DESC;
c1
4611686018427387902
4611686018427387901
0
0
0
0
-9223372036854775808
SELECT * FROM t1 WHERE c1 <= 4611686018427387903 ORDER BY c1 DESC;
c1
4611686018427387903
4611686018427387903
4611686018427387902
4611686018427387901
0
0
0
0
-9223372036854775808
SELECT * FROM t1 WHERE c1 =  4611686018427387903 ORDER BY c1 DESC;
c1
4611686018427387903
4611686018427387903
UPDATE t1
SET c1 = 4611686018427387903
WHERE c1 <= 0 + 0 AND c1 >= 0 - 0
ORDER BY c1 ASC
LIMIT 2;
SELECT * FROM t1 ORDER BY c1;
c1
-9223372036854775808
0
0
4611686018427387901
4611686018427387902
4611686018427387903
4611686018427387903
4611686018427387903
4611686018427387903
4611686018427387904
4611686018427387905
9223372036854775807
DELETE FROM t1
WHERE c1 <= 0 + 0 AND c1 >= 0 - 0
ORDER BY c1;
SELECT * FROM t1 ORDER BY c1;
c1
-9223372036854775808
4611686018427387901
4611686018427387902
4611686018427387903
4611686018427387903
4611686018427387903
4611686018427387903
4611686018427387904
4611686018427387905
9223372036854775807
DROP TABLE t1;
CREATE TABLE t1(c1 BIGINT SIGNED NOT NULL, c2 BIGINT SIGNED NOT NULL );
INSERT INTO t1 VALUES
(-9223372036854775808, -9223372036854775808),
(0, 0),
(0, 0),
(0, 0),
(0, 0),
(4611686018427387903, 4611686018427387903 - 2),
(4611686018427387903, 4611686018427387903 - 1),
(4611686018427387903, 4611686018427387903),
(4611686018427387903, 4611686018427387903),
(4611686018427387903, 4611686018427387903 + 1),
(4611686018427387903, 4611686018427387903 + 2),
(9223372036854775807, 9223372036854775807);
SELECT * FROM t1 WHERE c1 = 4611686018427387903 AND c2 > 4611686018427387903 ORDER BY c2 ASC;
c1	c2
4611686018427387903	4611686018427387904
4611686018427387903	4611686018427387905
SELECT * FROM t1 WHERE c1 = 4611686018427387903 AND c2 >= 4611686018427387903 ORDER BY c2 ASC;
c1	c2
4611686018427387903	4611686018427387903
4611686018427387903	4611686018427387903
4611686018427387903	4611686018427387904
4611686018427387903	4611686018427387905
SELECT * FROM t1 WHERE c1 = 4611686018427387903 AND c2 < 4611686018427387903 ORDER BY c2 ASC;
c1	c2
4611686018427387903	4611686018427387901
4611686018427387903	4611686018427387902
SELECT * FROM t1 WHERE c1 = 4611686018427387903 AND c2 <= 4611686018427387903 ORDER BY c2 ASC;
c1	c2
4611686018427387903	4611686018427387901
4611686018427387903	4611686018427387902
4611686018427387903	4611686018427387903
4611686018427387903	4611686018427387903
SELECT * FROM t1 WHERE c1 = 4611686018427387903 AND c2 > 4611686018427387903 ORDER BY c2 DESC;
c1	c2
4611686018427387903	4611686018427387905
4611686018427387903	4611686018427387904
SELECT * FROM t1 WHERE c1 = 4611686018427387903 AND c2 >= 4611686018427387903 ORDER BY c2 DESC;
c1	c2
4611686018427387903	4611686018427387905
4611686018427387903	4611686018427387904
4611686018427387903	4611686018427387903
4611686018427387903	4611686018427387903
SELECT * FROM t1 WHERE c1 = 4611686018427387903 AND c2 < 4611686018427387903 ORDER BY c2 DESC;
c1	c2
4611686018427387903	4611686018427387902
4611686018427387903	4611686018427387901
SELECT * FROM t1 WHERE c1 = 4611686018427387903 AND c2 <= 4611686018427387903 ORDER BY c2 DESC;
c1	c2
4611686018427387903	4611686018427387903
4611686018427387903	4611686018427387903
4611686018427387903	4611686018427387902
4611686018427387903	4611686018427387901
DROP TABLE t1;
DROP TABLE IF EXISTS t1;
CREATE TABLE t1(c1 BIGINT SIGNED NULL);
INSERT INTO t1 VALUES
(-9223372036854775808),
(0),
(4611686018427387903),
(9223372036854775807),
(NULL),
(NULL),
(NULL),
(NULL);
SELECT * FROM t1 WHERE c1 IS     NULL ORDER BY c1 ASC;
c1
NULL
NULL
NULL
NULL
SELECT * FROM t1 WHERE c1 IS NOT NULL ORDER BY c1 DESC;
c1
9223372036854775807
4611686018427387903
0
-9223372036854775808
SELECT * FROM t1 WHERE c1 IS     NULL ORDER BY c1 ASC;
c1
NULL
NULL
NULL
NULL
SELECT * FROM t1 WHERE c1 IS NOT NULL ORDER BY c1 DESC;
c1
9223372036854775807
4611686018427387903
0
-9223372036854775808
UPDATE t1
SET c1 = 0
WHERE c1 IS NULL;
SELECT * FROM t1 ORDER BY c1;
c1
-9223372036854775808
0
0
0
0
0
4611686018427387903
9223372036854775807
UPDATE t1
SET c1 = 0
WHERE c1 IS NULL
LIMIT 2;
SELECT * FROM t1 ORDER BY c1;
c1
-9223372036854775808
0
0
0
0
0
4611686018427387903
9223372036854775807
DELETE FROM t1
WHERE c1 IS NULL
ORDER BY c1;
SELECT * FROM t1 ORDER BY c1;
c1
-9223372036854775808
0
0
0
0
0
4611686018427387903
9223372036854775807
DROP TABLE t1;
CREATE TABLE t1(c1 BIGINT SIGNED NULL,
c2 BIGINT SIGNED NULL );
INSERT INTO t1 VALUES
(-9223372036854775808, -9223372036854775808),
(0, 0),
(0, 0),
(0, 0),
(0, 0),
(4611686018427387903, 4611686018427387903 - 2),
(4611686018427387903, 4611686018427387903 - 1),
(4611686018427387903, 4611686018427387903),
(4611686018427387903, 4611686018427387903),
(4611686018427387903, 4611686018427387903 + 1),
(4611686018427387903, 4611686018427387903 + 2),
(4611686018427387903, NULL),
(4611686018427387903, NULL),
(9223372036854775807, 9223372036854775807);
SELECT * FROM t1 WHERE c1 = 4611686018427387903 AND c2 > 4611686018427387903 ORDER BY c2 ASC;
c1	c2
4611686018427387903	4611686018427387904
4611686018427387903	4611686018427387905
SELECT * FROM t1 WHERE c1 = 4611686018427387903 AND c2 >= 4611686018427387903 ORDER BY c2 ASC;
c1	c2
4611686018427387903	4611686018427387903
4611686018427387903	4611686018427387903
4611686018427387903	4611686018427387904
4611686018427387903	4611686018427387905
SELECT * FROM t1 WHERE c1 = 4611686018427387903 AND c2 < 4611686018427387903 ORDER BY c2 ASC;
c1	c2
4611686018427387903	4611686018427387901
4611686018427387903	4611686018427387902
SELECT * FROM t1 WHERE c1 = 4611686018427387903 AND c2 <= 4611686018427387903 ORDER BY c2 ASC;
c1	c2
4611686018427387903	4611686018427387901
4611686018427387903	4611686018427387902
4611686018427387903	4611686018427387903
4611686018427387903	4611686018427387903
SELECT * FROM t1 WHERE c1 = 4611686018427387903 AND c2 is null ORDER BY c1 ASC;
c1	c2
4611686018427387903	NULL
4611686018427387903	NULL
SELECT * FROM t1 WHERE c1 = 4611686018427387903 AND c2 is not null ORDER BY c2 ASC;
c1	c2
4611686018427387903	4611686018427387901
4611686018427387903	4611686018427387902
4611686018427387903	4611686018427387903
4611686018427387903	4611686018427387903
4611686018427387903	4611686018427387904
4611686018427387903	4611686018427387905
SELECT * FROM t1 WHERE c1 = 4611686018427387903 AND c2 > 4611686018427387903 ORDER BY c2 DESC;
c1	c2
4611686018427387903	4611686018427387905
4611686018427387903	4611686018427387904
SELECT * FROM t1 WHERE c1 = 4611686018427387903 AND c2 >= 4611686018427387903 ORDER BY c2 DESC;
c1	c2
4611686018427387903	4611686018427387905
4611686018427387903	4611686018427387904
4611686018427387903	4611686018427387903
4611686018427387903	4611686018427387903
SELECT * FROM t1 WHERE c1 = 4611686018427387903 AND c2 < 4611686018427387903 ORDER BY c2 DESC;
c1	c2
4611686018427387903	4611686018427387902
4611686018427387903	4611686018427387901
SELECT * FROM t1 WHERE c1 = 4611686018427387903 AND c2 <= 4611686018427387903 ORDER BY c2 DESC;
c1	c2
4611686018427387903	4611686018427387903
4611686018427387903	4611686018427387903
4611686018427387903	4611686018427387902
4611686018427387903	4611686018427387901
SELECT * FROM t1 WHERE c1 = 4611686018427387903 AND c2 is null ORDER BY c1 DESC;
c1	c2
4611686018427387903	NULL
4611686018427387903	NULL
SELECT * FROM t1 WHERE c1 = 4611686018427387903 AND c2 is not null ORDER BY c2 DESC;
c1	c2
4611686018427387903	4611686018427387905
4611686018427387903	4611686018427387904
4611686018427387903	4611686018427387903
4611686018427387903	4611686018427387903
4611686018427387903	4611686018427387902
4611686018427387903	4611686018427387901
DROP TABLE t1;
DROP TABLE IF EXISTS t1;
CREATE TABLE t1(c1 BIGINT SIGNED NULL );
INSERT INTO t1 VALUES
(-9223372036854775808),
(0),
(0),
(0),
(0),
(4611686018427387903 - 2),
(4611686018427387903 - 1),
(4611686018427387903),
(4611686018427387903),
(4611686018427387903 + 1),
(4611686018427387903 + 2),
(9223372036854775807);
SELECT * FROM t1 ORDER BY c1 ASC;
c1
-9223372036854775808
0
0
0
0
4611686018427387901
4611686018427387902
4611686018427387903
4611686018427387903
4611686018427387904
4611686018427387905
9223372036854775807
SELECT * FROM t1 ORDER BY c1 DESC;
c1
9223372036854775807
4611686018427387905
4611686018427387904
4611686018427387903
4611686018427387903
4611686018427387902
4611686018427387901
0
0
0
0
-9223372036854775808
SELECT * FROM t1 WHERE c1 >  4611686018427387903 ORDER BY c1 ASC;
c1
4611686018427387904
4611686018427387905
9223372036854775807
SELECT * FROM t1 WHERE c1 >= 4611686018427387903 ORDER BY c1 ASC;
c1
4611686018427387903
4611686018427387903
4611686018427387904
4611686018427387905
9223372036854775807
SELECT * FROM t1 WHERE c1 <  4611686018427387903 ORDER BY c1 ASC;
c1
-9223372036854775808
0
0
0
0
4611686018427387901
4611686018427387902
SELECT * FROM t1 WHERE c1 <= 4611686018427387903 ORDER BY c1 ASC;
c1
-9223372036854775808
0
0
0
0
4611686018427387901
4611686018427387902
4611686018427387903
4611686018427387903
SELECT * FROM t1 WHERE c1 =  4611686018427387903 ORDER BY c1 ASC;
c1
4611686018427387903
4611686018427387903
SELECT * FROM t1 WHERE c1 >  4611686018427387903 ORDER BY c1 DESC;
c1
9223372036854775807
4611686018427387905
4611686018427387904
SELECT * FROM t1 WHERE c1 >= 4611686018427387903 ORDER BY c1 DESC;
c1
9223372036854775807
4611686018427387905
4611686018427387904
4611686018427387903
4611686018427387903
SELECT * FROM t1 WHERE c1 <  4611686018427387903 ORDER BY c1 DESC;
c1
4611686018427387902
4611686018427387901
0
0
0
0
-9223372036854775808
SELECT * FROM t1 WHERE c1 <= 4611686018427387903 ORDER BY c1 DESC;
c1
4611686018427387903
4611686018427387903
4611686018427387902
4611686018427387901
0
0
0
0
-9223372036854775808
SELECT * FROM t1 WHERE c1 =  4611686018427387903 ORDER BY c1 DESC;
c1
4611686018427387903
4611686018427387903
UPDATE t1
SET c1 = 4611686018427387903
WHERE c1 <= 0 + 0 AND c1 >= 0 - 0
ORDER BY c1 ASC
LIMIT 2;
SELECT * FROM t1 ORDER BY c1;
c1
-9223372036854775808
0
0
4611686018427387901
4611686018427387902
4611686018427387903
4611686018427387903
4611686018427387903
4611686018427387903
4611686018427387904
4611686018427387905
9223372036854775807
DELETE FROM t1
WHERE c1 <= 0 + 0 AND c1 >= 0 - 0
ORDER BY c1;
SELECT * FROM t1 ORDER BY c1;
c1
-9223372036854775808
4611686018427387901
4611686018427387902
4611686018427387903
4611686018427387903
4611686018427387903
4611686018427387903
4611686018427387904
4611686018427387905
9223372036854775807
DROP TABLE t1;
CREATE TABLE t1(c1 BIGINT SIGNED NULL, c2 BIGINT SIGNED NULL );
INSERT INTO t1 VALUES
(-9223372036854775808, -9223372036854775808),
(0, 0),
(0, 0),
(0, 0),
(0, 0),
(4611686018427387903, 4611686018427387903 - 2),
(4611686018427387903, 4611686018427387903 - 1),
(4611686018427387903, 4611686018427387903),
(4611686018427387903, 4611686018427387903),
(4611686018427387903, 4611686018427387903 + 1),
(4611686018427387903, 4611686018427387903 + 2),
(9223372036854775807, 9223372036854775807);
SELECT * FROM t1 WHERE c1 = 4611686018427387903 AND c2 > 4611686018427387903 ORDER BY c2 ASC;
c1	c2
4611686018427387903	4611686018427387904
4611686018427387903	4611686018427387905
SELECT * FROM t1 WHERE c1 = 4611686018427387903 AND c2 >= 4611686018427387903 ORDER BY c2 ASC;
c1	c2
4611686018427387903	4611686018427387903
4611686018427387903	4611686018427387903
4611686018427387903	4611686018427387904
4611686018427387903	4611686018427387905
SELECT * FROM t1 WHERE c1 = 4611686018427387903 AND c2 < 4611686018427387903 ORDER BY c2 ASC;
c1	c2
4611686018427387903	4611686018427387901
4611686018427387903	4611686018427387902
SELECT * FROM t1 WHERE c1 = 4611686018427387903 AND c2 <= 4611686018427387903 ORDER BY c2 ASC;
c1	c2
4611686018427387903	4611686018427387901
4611686018427387903	4611686018427387902
4611686018427387903	4611686018427387903
4611686018427387903	4611686018427387903
SELECT * FROM t1 WHERE c1 = 4611686018427387903 AND c2 > 4611686018427387903 ORDER BY c2 DESC;
c1	c2
4611686018427387903	4611686018427387905
4611686018427387903	4611686018427387904
SELECT * FROM t1 WHERE c1 = 4611686018427387903 AND c2 >= 4611686018427387903 ORDER BY c2 DESC;
c1	c2
4611686018427387903	4611686018427387905
4611686018427387903	4611686018427387904
4611686018427387903	4611686018427387903
4611686018427387903	4611686018427387903
SELECT * FROM t1 WHERE c1 = 4611686018427387903 AND c2 < 4611686018427387903 ORDER BY c2 DESC;
c1	c2
4611686018427387903	4611686018427387902
4611686018427387903	4611686018427387901
SELECT * FROM t1 WHERE c1 = 4611686018427387903 AND c2 <= 4611686018427387903 ORDER BY c2 DESC;
c1	c2
4611686018427387903	4611686018427387903
4611686018427387903	4611686018427387903
4611686018427387903	4611686018427387902
4611686018427387903	4611686018427387901
DROP TABLE t1;
DROP TABLE IF EXISTS t1;
CREATE TABLE t1(c1 BIGINT SIGNED NOT NULL , INDEX(c1));
INSERT INTO t1 VALUES
(-9223372036854775808),
(0),
(0),
(0),
(0),
(4611686018427387903 - 2),
(4611686018427387903 - 1),
(4611686018427387903),
(4611686018427387903),
(4611686018427387903 + 1),
(4611686018427387903 + 2),
(9223372036854775807);
SELECT * FROM t1 ORDER BY c1 ASC;
c1
-9223372036854775808
0
0
0
0
4611686018427387901
4611686018427387902
4611686018427387903
4611686018427387903
4611686018427387904
4611686018427387905
9223372036854775807
SELECT * FROM t1 ORDER BY c1 DESC;
c1
9223372036854775807
4611686018427387905
4611686018427387904
4611686018427387903
4611686018427387903
4611686018427387902
4611686018427387901
0
0
0
0
-9223372036854775808
SELECT * FROM t1 WHERE c1 >  4611686018427387903 ORDER BY c1 ASC;
c1
4611686018427387904
4611686018427387905
9223372036854775807
SELECT * FROM t1 WHERE c1 >= 4611686018427387903 ORDER BY c1 ASC;
c1
4611686018427387903
4611686018427387903
4611686018427387904
4611686018427387905
9223372036854775807
SELECT * FROM t1 WHERE c1 <  4611686018427387903 ORDER BY c1 ASC;
c1
-9223372036854775808
0
0
0
0
4611686018427387901
4611686018427387902
SELECT * FROM t1 WHERE c1 <= 4611686018427387903 ORDER BY c1 ASC;
c1
-9223372036854775808
0
0
0
0
4611686018427387901
4611686018427387902
4611686018427387903
4611686018427387903
SELECT * FROM t1 WHERE c1 =  4611686018427387903 ORDER BY c1 ASC;
c1
4611686018427387903
4611686018427387903
SELECT * FROM t1 WHERE c1 >  4611686018427387903 ORDER BY c1 DESC;
c1
9223372036854775807
4611686018427387905
4611686018427387904
SELECT * FROM t1 WHERE c1 >= 4611686018427387903 ORDER BY c1 DESC;
c1
9223372036854775807
4611686018427387905
4611686018427387904
4611686018427387903
4611686018427387903
SELECT * FROM t1 WHERE c1 <  4611686018427387903 ORDER BY c1 DESC;
c1
4611686018427387902
4611686018427387901
0
0
0
0
-9223372036854775808
SELECT * FROM t1 WHERE c1 <= 4611686018427387903 ORDER BY c1 DESC;
c1
4611686018427387903
4611686018427387903
4611686018427387902
4611686018427387901
0
0
0
0
-9223372036854775808
SELECT * FROM t1 WHERE c1 =  4611686018427387903 ORDER BY c1 DESC;
c1
4611686018427387903
4611686018427387903
UPDATE t1
SET c1 = 4611686018427387903
WHERE c1 <= 0 + 0 AND c1 >= 0 - 0
ORDER BY c1 ASC
LIMIT 2;
SELECT * FROM t1 ORDER BY c1;
c1
-9223372036854775808
0
0
4611686018427387901
4611686018427387902
4611686018427387903
4611686018427387903
4611686018427387903
4611686018427387903
4611686018427387904
4611686018427387905
9223372036854775807
DELETE FROM t1
WHERE c1 <= 0 + 0 AND c1 >= 0 - 0
ORDER BY c1;
SELECT * FROM t1 ORDER BY c1;
c1
-9223372036854775808
4611686018427387901
4611686018427387902
4611686018427387903
4611686018427387903
4611686018427387903
4611686018427387903
4611686018427387904
4611686018427387905
9223372036854775807
DROP TABLE t1;
CREATE TABLE t1(c1 BIGINT SIGNED NOT NULL, c2 BIGINT SIGNED NOT NULL , INDEX(c1, c2));
INSERT INTO t1 VALUES
(-9223372036854775808, -9223372036854775808),
(0, 0),
(0, 0),
(0, 0),
(0, 0),
(4611686018427387903, 4611686018427387903 - 2),
(4611686018427387903, 4611686018427387903 - 1),
(4611686018427387903, 4611686018427387903),
(4611686018427387903, 4611686018427387903),
(4611686018427387903, 4611686018427387903 + 1),
(4611686018427387903, 4611686018427387903 + 2),
(9223372036854775807, 9223372036854775807);
SELECT * FROM t1 WHERE c1 = 4611686018427387903 AND c2 > 4611686018427387903 ORDER BY c2 ASC;
c1	c2
4611686018427387903	4611686018427387904
4611686018427387903	4611686018427387905
SELECT * FROM t1 WHERE c1 = 4611686018427387903 AND c2 >= 4611686018427387903 ORDER BY c2 ASC;
c1	c2
4611686018427387903	4611686018427387903
4611686018427387903	4611686018427387903
4611686018427387903	4611686018427387904
4611686018427387903	4611686018427387905
SELECT * FROM t1 WHERE c1 = 4611686018427387903 AND c2 < 4611686018427387903 ORDER BY c2 ASC;
c1	c2
4611686018427387903	4611686018427387901
4611686018427387903	4611686018427387902
SELECT * FROM t1 WHERE c1 = 4611686018427387903 AND c2 <= 4611686018427387903 ORDER BY c2 ASC;
c1	c2
4611686018427387903	4611686018427387901
4611686018427387903	4611686018427387902
4611686018427387903	4611686018427387903
4611686018427387903	4611686018427387903
SELECT * FROM t1 WHERE c1 = 4611686018427387903 AND c2 > 4611686018427387903 ORDER BY c2 DESC;
c1	c2
4611686018427387903	4611686018427387905
4611686018427387903	4611686018427387904
SELECT * FROM t1 WHERE c1 = 4611686018427387903 AND c2 >= 4611686018427387903 ORDER BY c2 DESC;
c1	c2
4611686018427387903	4611686018427387905
4611686018427387903	4611686018427387904
4611686018427387903	4611686018427387903
4611686018427387903	4611686018427387903
SELECT * FROM t1 WHERE c1 = 4611686018427387903 AND c2 < 4611686018427387903 ORDER BY c2 DESC;
c1	c2
4611686018427387903	4611686018427387902
4611686018427387903	4611686018427387901
SELECT * FROM t1 WHERE c1 = 4611686018427387903 AND c2 <= 4611686018427387903 ORDER BY c2 DESC;
c1	c2
4611686018427387903	4611686018427387903
4611686018427387903	4611686018427387903
4611686018427387903	4611686018427387902
4611686018427387903	4611686018427387901
DROP TABLE t1;
DROP TABLE IF EXISTS t1;
CREATE TABLE t1(c1 BIGINT SIGNED NULL);
INSERT INTO t1 VALUES
(-9223372036854775808),
(0),
(4611686018427387903),
(9223372036854775807),
(NULL),
(NULL),
(NULL),
(NULL);
SELECT * FROM t1 WHERE c1 IS     NULL ORDER BY c1 ASC;
c1
NULL
NULL
NULL
NULL
SELECT * FROM t1 WHERE c1 IS NOT NULL ORDER BY c1 DESC;
c1
9223372036854775807
4611686018427387903
0
-9223372036854775808
SELECT * FROM t1 WHERE c1 IS     NULL ORDER BY c1 ASC;
c1
NULL
NULL
NULL
NULL
SELECT * FROM t1 WHERE c1 IS NOT NULL ORDER BY c1 DESC;
c1
9223372036854775807
4611686018427387903
0
-9223372036854775808
UPDATE t1
SET c1 = 0
WHERE c1 IS NULL;
SELECT * FROM t1 ORDER BY c1;
c1
-9223372036854775808
0
0
0
0
0
4611686018427387903
9223372036854775807
UPDATE t1
SET c1 = 0
WHERE c1 IS NULL
LIMIT 2;
SELECT * FROM t1 ORDER BY c1;
c1
-9223372036854775808
0
0
0
0
0
4611686018427387903
9223372036854775807
DELETE FROM t1
WHERE c1 IS NULL
ORDER BY c1;
SELECT * FROM t1 ORDER BY c1;
c1
-9223372036854775808
0
0
0
0
0
4611686018427387903
9223372036854775807
DROP TABLE t1;
CREATE TABLE t1(c1 BIGINT SIGNED NULL,
c2 BIGINT SIGNED NULL , INDEX(c1, c2));
INSERT INTO t1 VALUES
(-9223372036854775808, -9223372036854775808),
(0, 0),
(0, 0),
(0, 0),
(0, 0),
(4611686018427387903, 4611686018427387903 - 2),
(4611686018427387903, 4611686018427387903 - 1),
(4611686018427387903, 4611686018427387903),
(4611686018427387903, 4611686018427387903),
(4611686018427387903, 4611686018427387903 + 1),
(4611686018427387903, 4611686018427387903 + 2),
(4611686018427387903, NULL),
(4611686018427387903, NULL),
(9223372036854775807, 9223372036854775807);
SELECT * FROM t1 WHERE c1 = 4611686018427387903 AND c2 > 4611686018427387903 ORDER BY c2 ASC;
c1	c2
4611686018427387903	4611686018427387904
4611686018427387903	4611686018427387905
SELECT * FROM t1 WHERE c1 = 4611686018427387903 AND c2 >= 4611686018427387903 ORDER BY c2 ASC;
c1	c2
4611686018427387903	4611686018427387903
4611686018427387903	4611686018427387903
4611686018427387903	4611686018427387904
4611686018427387903	4611686018427387905
SELECT * FROM t1 WHERE c1 = 4611686018427387903 AND c2 < 4611686018427387903 ORDER BY c2 ASC;
c1	c2
4611686018427387903	4611686018427387901
4611686018427387903	4611686018427387902
SELECT * FROM t1 WHERE c1 = 4611686018427387903 AND c2 <= 4611686018427387903 ORDER BY c2 ASC;
c1	c2
4611686018427387903	4611686018427387901
4611686018427387903	4611686018427387902
4611686018427387903	4611686018427387903
4611686018427387903	4611686018427387903
SELECT * FROM t1 WHERE c1 = 4611686018427387903 AND c2 is null ORDER BY c1 ASC;
c1	c2
4611686018427387903	NULL
4611686018427387903	NULL
SELECT * FROM t1 WHERE c1 = 4611686018427387903 AND c2 is not null ORDER BY c2 ASC;
c1	c2
4611686018427387903	4611686018427387901
4611686018427387903	4611686018427387902
4611686018427387903	4611686018427387903
4611686018427387903	4611686018427387903
4611686018427387903	4611686018427387904
4611686018427387903	4611686018427387905
SELECT * FROM t1 WHERE c1 = 4611686018427387903 AND c2 > 4611686018427387903 ORDER BY c2 DESC;
c1	c2
4611686018427387903	4611686018427387905
4611686018427387903	4611686018427387904
SELECT * FROM t1 WHERE c1 = 4611686018427387903 AND c2 >= 4611686018427387903 ORDER BY c2 DESC;
c1	c2
4611686018427387903	4611686018427387905
4611686018427387903	4611686018427387904
4611686018427387903	4611686018427387903
4611686018427387903	4611686018427387903
SELECT * FROM t1 WHERE c1 = 4611686018427387903 AND c2 < 4611686018427387903 ORDER BY c2 DESC;
c1	c2
4611686018427387903	4611686018427387902
4611686018427387903	4611686018427387901
SELECT * FROM t1 WHERE c1 = 4611686018427387903 AND c2 <= 4611686018427387903 ORDER BY c2 DESC;
c1	c2
4611686018427387903	4611686018427387903
4611686018427387903	4611686018427387903
4611686018427387903	4611686018427387902
4611686018427387903	4611686018427387901
SELECT * FROM t1 WHERE c1 = 4611686018427387903 AND c2 is null ORDER BY c1 DESC;
c1	c2
4611686018427387903	NULL
4611686018427387903	NULL
SELECT * FROM t1 WHERE c1 = 4611686018427387903 AND c2 is not null ORDER BY c2 DESC;
c1	c2
4611686018427387903	4611686018427387905
4611686018427387903	4611686018427387904
4611686018427387903	4611686018427387903
4611686018427387903	4611686018427387903
4611686018427387903	4611686018427387902
4611686018427387903	4611686018427387901
DROP TABLE t1;
DROP TABLE IF EXISTS t1;
CREATE TABLE t1(c1 BIGINT SIGNED NULL , INDEX(c1));
INSERT INTO t1 VALUES
(-9223372036854775808),
(0),
(0),
(0),
(0),
(4611686018427387903 - 2),
(4611686018427387903 - 1),
(4611686018427387903),
(4611686018427387903),
(4611686018427387903 + 1),
(4611686018427387903 + 2),
(9223372036854775807);
SELECT * FROM t1 ORDER BY c1 ASC;
c1
-9223372036854775808
0
0
0
0
4611686018427387901
4611686018427387902
4611686018427387903
4611686018427387903
4611686018427387904
4611686018427387905
9223372036854775807
SELECT * FROM t1 ORDER BY c1 DESC;
c1
9223372036854775807
4611686018427387905
4611686018427387904
4611686018427387903
4611686018427387903
4611686018427387902
4611686018427387901
0
0
0
0
-9223372036854775808
SELECT * FROM t1 WHERE c1 >  4611686018427387903 ORDER BY c1 ASC;
c1
4611686018427387904
4611686018427387905
9223372036854775807
SELECT * FROM t1 WHERE c1 >= 4611686018427387903 ORDER BY c1 ASC;
c1
4611686018427387903
4611686018427387903
4611686018427387904
4611686018427387905
9223372036854775807
SELECT * FROM t1 WHERE c1 <  4611686018427387903 ORDER BY c1 ASC;
c1
-9223372036854775808
0
0
0
0
4611686018427387901
4611686018427387902
SELECT * FROM t1 WHERE c1 <= 4611686018427387903 ORDER BY c1 ASC;
c1
-9223372036854775808
0
0
0
0
4611686018427387901
4611686018427387902
4611686018427387903
4611686018427387903
SELECT * FROM t1 WHERE c1 =  4611686018427387903 ORDER BY c1 ASC;
c1
4611686018427387903
4611686018427387903
SELECT * FROM t1 WHERE c1 >  4611686018427387903 ORDER BY c1 DESC;
c1
9223372036854775807
4611686018427387905
4611686018427387904
SELECT * FROM t1 WHERE c1 >= 4611686018427387903 ORDER BY c1 DESC;
c1
9223372036854775807
4611686018427387905
4611686018427387904
4611686018427387903
4611686018427387903
SELECT * FROM t1 WHERE c1 <  4611686018427387903 ORDER BY c1 DESC;
c1
4611686018427387902
4611686018427387901
0
0
0
0
-9223372036854775808
SELECT * FROM t1 WHERE c1 <= 4611686018427387903 ORDER BY c1 DESC;
c1
4611686018427387903
4611686018427387903
4611686018427387902
4611686018427387901
0
0
0
0
-9223372036854775808
SELECT * FROM t1 WHERE c1 =  4611686018427387903 ORDER BY c1 DESC;
c1
4611686018427387903
4611686018427387903
UPDATE t1
SET c1 = 4611686018427387903
WHERE c1 <= 0 + 0 AND c1 >= 0 - 0
ORDER BY c1 ASC
LIMIT 2;
SELECT * FROM t1 ORDER BY c1;
c1
-9223372036854775808
0
0
4611686018427387901
4611686018427387902
4611686018427387903
4611686018427387903
4611686018427387903
4611686018427387903
4611686018427387904
4611686018427387905
9223372036854775807
DELETE FROM t1
WHERE c1 <= 0 + 0 AND c1 >= 0 - 0
ORDER BY c1;
SELECT * FROM t1 ORDER BY c1;
c1
-9223372036854775808
4611686018427387901
4611686018427387902
4611686018427387903
4611686018427387903
4611686018427387903
4611686018427387903
4611686018427387904
4611686018427387905
9223372036854775807
DROP TABLE t1;
CREATE TABLE t1(c1 BIGINT SIGNED NULL, c2 BIGINT SIGNED NULL , INDEX(c1, c2));
INSERT INTO t1 VALUES
(-9223372036854775808, -9223372036854775808),
(0, 0),
(0, 0),
(0, 0),
(0, 0),
(4611686018427387903, 4611686018427387903 - 2),
(4611686018427387903, 4611686018427387903 - 1),
(4611686018427387903, 4611686018427387903),
(4611686018427387903, 4611686018427387903),
(4611686018427387903, 4611686018427387903 + 1),
(4611686018427387903, 4611686018427387903 + 2),
(9223372036854775807, 9223372036854775807);
SELECT * FROM t1 WHERE c1 = 4611686018427387903 AND c2 > 4611686018427387903 ORDER BY c2 ASC;
c1	c2
4611686018427387903	4611686018427387904
4611686018427387903	4611686018427387905
SELECT * FROM t1 WHERE c1 = 4611686018427387903 AND c2 >= 4611686018427387903 ORDER BY c2 ASC;
c1	c2
4611686018427387903	4611686018427387903
4611686018427387903	4611686018427387903
4611686018427387903	4611686018427387904
4611686018427387903	4611686018427387905
SELECT * FROM t1 WHERE c1 = 4611686018427387903 AND c2 < 4611686018427387903 ORDER BY c2 ASC;
c1	c2
4611686018427387903	4611686018427387901
4611686018427387903	4611686018427387902
SELECT * FROM t1 WHERE c1 = 4611686018427387903 AND c2 <= 4611686018427387903 ORDER BY c2 ASC;
c1	c2
4611686018427387903	4611686018427387901
4611686018427387903	4611686018427387902
4611686018427387903	4611686018427387903
4611686018427387903	4611686018427387903
SELECT * FROM t1 WHERE c1 = 4611686018427387903 AND c2 > 4611686018427387903 ORDER BY c2 DESC;
c1	c2
4611686018427387903	4611686018427387905
4611686018427387903	4611686018427387904
SELECT * FROM t1 WHERE c1 = 4611686018427387903 AND c2 >= 4611686018427387903 ORDER BY c2 DESC;
c1	c2
4611686018427387903	4611686018427387905
4611686018427387903	4611686018427387904
4611686018427387903	4611686018427387903
4611686018427387903	4611686018427387903
SELECT * FROM t1 WHERE c1 = 4611686018427387903 AND c2 < 4611686018427387903 ORDER BY c2 DESC;
c1	c2
4611686018427387903	4611686018427387902
4611686018427387903	4611686018427387901
SELECT * FROM t1 WHERE c1 = 4611686018427387903 AND c2 <= 4611686018427387903 ORDER BY c2 DESC;
c1	c2
4611686018427387903	4611686018427387903
4611686018427387903	4611686018427387903
4611686018427387903	4611686018427387902
4611686018427387903	4611686018427387901
DROP TABLE t1;
DROP TABLE IF EXISTS t1;
CREATE TABLE t1(c1 BIGINT UNSIGNED NOT NULL );
INSERT INTO t1 VALUES
(0),
(0),
(0),
(0),
(0),
(4611686018427387903 - 2),
(4611686018427387903 - 1),
(4611686018427387903),
(4611686018427387903),
(4611686018427387903 + 1),
(4611686018427387903 + 2),
(9223372036854775807);
SELECT * FROM t1 ORDER BY c1 ASC;
c1
0
0
0
0
0
4611686018427387901
4611686018427387902
4611686018427387903
4611686018427387903
4611686018427387904
4611686018427387905
9223372036854775807
SELECT * FROM t1 ORDER BY c1 DESC;
c1
9223372036854775807
4611686018427387905
4611686018427387904
4611686018427387903
4611686018427387903
4611686018427387902
4611686018427387901
0
0
0
0
0
SELECT * FROM t1 WHERE c1 >  4611686018427387903 ORDER BY c1 ASC;
c1
4611686018427387904
4611686018427387905
9223372036854775807
SELECT * FROM t1 WHERE c1 >= 4611686018427387903 ORDER BY c1 ASC;
c1
4611686018427387903
4611686018427387903
4611686018427387904
4611686018427387905
9223372036854775807
SELECT * FROM t1 WHERE c1 <  4611686018427387903 ORDER BY c1 ASC;
c1
0
0
0
0
0
4611686018427387901
4611686018427387902
SELECT * FROM t1 WHERE c1 <= 4611686018427387903 ORDER BY c1 ASC;
c1
0
0
0
0
0
4611686018427387901
4611686018427387902
4611686018427387903
4611686018427387903
SELECT * FROM t1 WHERE c1 =  4611686018427387903 ORDER BY c1 ASC;
c1
4611686018427387903
4611686018427387903
SELECT * FROM t1 WHERE c1 >  4611686018427387903 ORDER BY c1 DESC;
c1
9223372036854775807
4611686018427387905
4611686018427387904
SELECT * FROM t1 WHERE c1 >= 4611686018427387903 ORDER BY c1 DESC;
c1
9223372036854775807
4611686018427387905
4611686018427387904
4611686018427387903
4611686018427387903
SELECT * FROM t1 WHERE c1 <  4611686018427387903 ORDER BY c1 DESC;
c1
4611686018427387902
4611686018427387901
0
0
0
0
0
SELECT * FROM t1 WHERE c1 <= 4611686018427387903 ORDER BY c1 DESC;
c1
4611686018427387903
4611686018427387903
4611686018427387902
4611686018427387901
0
0
0
0
0
SELECT * FROM t1 WHERE c1 =  4611686018427387903 ORDER BY c1 DESC;
c1
4611686018427387903
4611686018427387903
UPDATE t1
SET c1 = 4611686018427387903
WHERE c1 <= 0 + 0 AND c1 >= 0 - 0
ORDER BY c1 ASC
LIMIT 2;
SELECT * FROM t1 ORDER BY c1;
c1
0
0
0
4611686018427387901
4611686018427387902
4611686018427387903
4611686018427387903
4611686018427387903
4611686018427387903
4611686018427387904
4611686018427387905
9223372036854775807
DELETE FROM t1
WHERE c1 <= 0 + 0 AND c1 >= 0 - 0
ORDER BY c1;
SELECT * FROM t1 ORDER BY c1;
c1
4611686018427387901
4611686018427387902
4611686018427387903
4611686018427387903
4611686018427387903
4611686018427387903
4611686018427387904
4611686018427387905
9223372036854775807
DROP TABLE t1;
CREATE TABLE t1(c1 BIGINT UNSIGNED NOT NULL, c2 BIGINT UNSIGNED NOT NULL , INDEX(c1, c2));
INSERT INTO t1 VALUES
(0, 0),
(0, 0),
(0, 0),
(0, 0),
(0, 0),
(4611686018427387903, 4611686018427387903 - 2),
(4611686018427387903, 4611686018427387903 - 1),
(4611686018427387903, 4611686018427387903),
(4611686018427387903, 4611686018427387903),
(4611686018427387903, 4611686018427387903 + 1),
(4611686018427387903, 4611686018427387903 + 2),
(9223372036854775807, 9223372036854775807);
SELECT * FROM t1 WHERE c1 = 4611686018427387903 AND c2 > 4611686018427387903 ORDER BY c2 ASC;
c1	c2
4611686018427387903	4611686018427387904
4611686018427387903	4611686018427387905
SELECT * FROM t1 WHERE c1 = 4611686018427387903 AND c2 >= 4611686018427387903 ORDER BY c2 ASC;
c1	c2
4611686018427387903	4611686018427387903
4611686018427387903	4611686018427387903
4611686018427387903	4611686018427387904
4611686018427387903	4611686018427387905
SELECT * FROM t1 WHERE c1 = 4611686018427387903 AND c2 < 4611686018427387903 ORDER BY c2 ASC;
c1	c2
4611686018427387903	4611686018427387901
4611686018427387903	4611686018427387902
SELECT * FROM t1 WHERE c1 = 4611686018427387903 AND c2 <= 4611686018427387903 ORDER BY c2 ASC;
c1	c2
4611686018427387903	4611686018427387901
4611686018427387903	4611686018427387902
4611686018427387903	4611686018427387903
4611686018427387903	4611686018427387903
SELECT * FROM t1 WHERE c1 = 4611686018427387903 AND c2 > 4611686018427387903 ORDER BY c2 DESC;
c1	c2
4611686018427387903	4611686018427387905
4611686018427387903	4611686018427387904
SELECT * FROM t1 WHERE c1 = 4611686018427387903 AND c2 >= 4611686018427387903 ORDER BY c2 DESC;
c1	c2
4611686018427387903	4611686018427387905
4611686018427387903	4611686018427387904
4611686018427387903	4611686018427387903
4611686018427387903	4611686018427387903
SELECT * FROM t1 WHERE c1 = 4611686018427387903 AND c2 < 4611686018427387903 ORDER BY c2 DESC;
c1	c2
4611686018427387903	4611686018427387902
4611686018427387903	4611686018427387901
SELECT * FROM t1 WHERE c1 = 4611686018427387903 AND c2 <= 4611686018427387903 ORDER BY c2 DESC;
c1	c2
4611686018427387903	4611686018427387903
4611686018427387903	4611686018427387903
4611686018427387903	4611686018427387902
4611686018427387903	4611686018427387901
DROP TABLE t1;
DROP TABLE IF EXISTS t1;
CREATE TABLE t1(c1 BIGINT UNSIGNED NULL);
INSERT INTO t1 VALUES
(0),
(0),
(4611686018427387903),
(9223372036854775807),
(NULL),
(NULL),
(NULL),
(NULL);
SELECT * FROM t1 WHERE c1 IS     NULL ORDER BY c1 ASC;
c1
NULL
NULL
NULL
NULL
SELECT * FROM t1 WHERE c1 IS NOT NULL ORDER BY c1 DESC;
c1
9223372036854775807
4611686018427387903
0
0
SELECT * FROM t1 WHERE c1 IS     NULL ORDER BY c1 ASC;
c1
NULL
NULL
NULL
NULL
SELECT * FROM t1 WHERE c1 IS NOT NULL ORDER BY c1 DESC;
c1
9223372036854775807
4611686018427387903
0
0
UPDATE t1
SET c1 = 0
WHERE c1 IS NULL;
SELECT * FROM t1 ORDER BY c1;
c1
0
0
0
0
0
0
4611686018427387903
9223372036854775807
UPDATE t1
SET c1 = 0
WHERE c1 IS NULL
LIMIT 2;
SELECT * FROM t1 ORDER BY c1;
c1
0
0
0
0
0
0
4611686018427387903
9223372036854775807
DELETE FROM t1
WHERE c1 IS NULL
ORDER BY c1;
SELECT * FROM t1 ORDER BY c1;
c1
0
0
0
0
0
0
4611686018427387903
9223372036854775807
DROP TABLE t1;
CREATE TABLE t1(c1 BIGINT UNSIGNED NULL,
c2 BIGINT UNSIGNED NULL , INDEX(c1, c2));
INSERT INTO t1 VALUES
(0, 0),
(0, 0),
(0, 0),
(0, 0),
(0, 0),
(4611686018427387903, 4611686018427387903 - 2),
(4611686018427387903, 4611686018427387903 - 1),
(4611686018427387903, 4611686018427387903),
(4611686018427387903, 4611686018427387903),
(4611686018427387903, 4611686018427387903 + 1),
(4611686018427387903, 4611686018427387903 + 2),
(4611686018427387903, NULL),
(4611686018427387903, NULL),
(9223372036854775807, 9223372036854775807);
SELECT * FROM t1 WHERE c1 = 4611686018427387903 AND c2 > 4611686018427387903 ORDER BY c2 ASC;
c1	c2
4611686018427387903	4611686018427387904
4611686018427387903	4611686018427387905
SELECT * FROM t1 WHERE c1 = 4611686018427387903 AND c2 >= 4611686018427387903 ORDER BY c2 ASC;
c1	c2
4611686018427387903	4611686018427387903
4611686018427387903	4611686018427387903
4611686018427387903	4611686018427387904
4611686018427387903	4611686018427387905
SELECT * FROM t1 WHERE c1 = 4611686018427387903 AND c2 < 4611686018427387903 ORDER BY c2 ASC;
c1	c2
4611686018427387903	4611686018427387901
4611686018427387903	4611686018427387902
SELECT * FROM t1 WHERE c1 = 4611686018427387903 AND c2 <= 4611686018427387903 ORDER BY c2 ASC;
c1	c2
4611686018427387903	4611686018427387901
4611686018427387903	4611686018427387902
4611686018427387903	4611686018427387903
4611686018427387903	4611686018427387903
SELECT * FROM t1 WHERE c1 = 4611686018427387903 AND c2 is null ORDER BY c1 ASC;
c1	c2
4611686018427387903	NULL
4611686018427387903	NULL
SELECT * FROM t1 WHERE c1 = 4611686018427387903 AND c2 is not null ORDER BY c2 ASC;
c1	c2
4611686018427387903	4611686018427387901
4611686018427387903	4611686018427387902
4611686018427387903	4611686018427387903
4611686018427387903	4611686018427387903
4611686018427387903	4611686018427387904
4611686018427387903	4611686018427387905
SELECT * FROM t1 WHERE c1 = 4611686018427387903 AND c2 > 4611686018427387903 ORDER BY c2 DESC;
c1	c2
4611686018427387903	4611686018427387905
4611686018427387903	4611686018427387904
SELECT * FROM t1 WHERE c1 = 4611686018427387903 AND c2 >= 4611686018427387903 ORDER BY c2 DESC;
c1	c2
4611686018427387903	4611686018427387905
4611686018427387903	4611686018427387904
4611686018427387903	4611686018427387903
4611686018427387903	4611686018427387903
SELECT * FROM t1 WHERE c1 = 4611686018427387903 AND c2 < 4611686018427387903 ORDER BY c2 DESC;
c1	c2
4611686018427387903	4611686018427387902
4611686018427387903	4611686018427387901
SELECT * FROM t1 WHERE c1 = 4611686018427387903 AND c2 <= 4611686018427387903 ORDER BY c2 DESC;
c1	c2
4611686018427387903	4611686018427387903
4611686018427387903	4611686018427387903
4611686018427387903	4611686018427387902
4611686018427387903	4611686018427387901
SELECT * FROM t1 WHERE c1 = 4611686018427387903 AND c2 is null ORDER BY c1 DESC;
c1	c2
4611686018427387903	NULL
4611686018427387903	NULL
SELECT * FROM t1 WHERE c1 = 4611686018427387903 AND c2 is not null ORDER BY c2 DESC;
c1	c2
4611686018427387903	4611686018427387905
4611686018427387903	4611686018427387904
4611686018427387903	4611686018427387903
4611686018427387903	4611686018427387903
4611686018427387903	4611686018427387902
4611686018427387903	4611686018427387901
DROP TABLE t1;
DROP TABLE IF EXISTS t1;
CREATE TABLE t1(c1 BIGINT UNSIGNED NULL );
INSERT INTO t1 VALUES
(0),
(0),
(0),
(0),
(0),
(4611686018427387903 - 2),
(4611686018427387903 - 1),
(4611686018427387903),
(4611686018427387903),
(4611686018427387903 + 1),
(4611686018427387903 + 2),
(9223372036854775807);
SELECT * FROM t1 ORDER BY c1 ASC;
c1
0
0
0
0
0
4611686018427387901
4611686018427387902
4611686018427387903
4611686018427387903
4611686018427387904
4611686018427387905
9223372036854775807
SELECT * FROM t1 ORDER BY c1 DESC;
c1
9223372036854775807
4611686018427387905
4611686018427387904
4611686018427387903
4611686018427387903
4611686018427387902
4611686018427387901
0
0
0
0
0
SELECT * FROM t1 WHERE c1 >  4611686018427387903 ORDER BY c1 ASC;
c1
4611686018427387904
4611686018427387905
9223372036854775807
SELECT * FROM t1 WHERE c1 >= 4611686018427387903 ORDER BY c1 ASC;
c1
4611686018427387903
4611686018427387903
4611686018427387904
4611686018427387905
9223372036854775807
SELECT * FROM t1 WHERE c1 <  4611686018427387903 ORDER BY c1 ASC;
c1
0
0
0
0
0
4611686018427387901
4611686018427387902
SELECT * FROM t1 WHERE c1 <= 4611686018427387903 ORDER BY c1 ASC;
c1
0
0
0
0
0
4611686018427387901
4611686018427387902
4611686018427387903
4611686018427387903
SELECT * FROM t1 WHERE c1 =  4611686018427387903 ORDER BY c1 ASC;
c1
4611686018427387903
4611686018427387903
SELECT * FROM t1 WHERE c1 >  4611686018427387903 ORDER BY c1 DESC;
c1
9223372036854775807
4611686018427387905
4611686018427387904
SELECT * FROM t1 WHERE c1 >= 4611686018427387903 ORDER BY c1 DESC;
c1
9223372036854775807
4611686018427387905
4611686018427387904
4611686018427387903
4611686018427387903
SELECT * FROM t1 WHERE c1 <  4611686018427387903 ORDER BY c1 DESC;
c1
4611686018427387902
4611686018427387901
0
0
0
0
0
SELECT * FROM t1 WHERE c1 <= 4611686018427387903 ORDER BY c1 DESC;
c1
4611686018427387903
4611686018427387903
4611686018427387902
4611686018427387901
0
0
0
0
0
SELECT * FROM t1 WHERE c1 =  4611686018427387903 ORDER BY c1 DESC;
c1
4611686018427387903
4611686018427387903
UPDATE t1
SET c1 = 4611686018427387903
WHERE c1 <= 0 + 0 AND c1 >= 0 - 0
ORDER BY c1 ASC
LIMIT 2;
SELECT * FROM t1 ORDER BY c1;
c1
0
0
0
4611686018427387901
4611686018427387902
4611686018427387903
4611686018427387903
4611686018427387903
4611686018427387903
4611686018427387904
4611686018427387905
9223372036854775807
DELETE FROM t1
WHERE c1 <= 0 + 0 AND c1 >= 0 - 0
ORDER BY c1;
SELECT * FROM t1 ORDER BY c1;
c1
4611686018427387901
4611686018427387902
4611686018427387903
4611686018427387903
4611686018427387903
4611686018427387903
4611686018427387904
4611686018427387905
9223372036854775807
DROP TABLE t1;
CREATE TABLE t1(c1 BIGINT UNSIGNED NULL, c2 BIGINT UNSIGNED NULL , INDEX(c1, c2));
INSERT INTO t1 VALUES
(0, 0),
(0, 0),
(0, 0),
(0, 0),
(0, 0),
(4611686018427387903, 4611686018427387903 - 2),
(4611686018427387903, 4611686018427387903 - 1),
(4611686018427387903, 4611686018427387903),
(4611686018427387903, 4611686018427387903),
(4611686018427387903, 4611686018427387903 + 1),
(4611686018427387903, 4611686018427387903 + 2),
(9223372036854775807, 9223372036854775807);
SELECT * FROM t1 WHERE c1 = 4611686018427387903 AND c2 > 4611686018427387903 ORDER BY c2 ASC;
c1	c2
4611686018427387903	4611686018427387904
4611686018427387903	4611686018427387905
SELECT * FROM t1 WHERE c1 = 4611686018427387903 AND c2 >= 4611686018427387903 ORDER BY c2 ASC;
c1	c2
4611686018427387903	4611686018427387903
4611686018427387903	4611686018427387903
4611686018427387903	4611686018427387904
4611686018427387903	4611686018427387905
SELECT * FROM t1 WHERE c1 = 4611686018427387903 AND c2 < 4611686018427387903 ORDER BY c2 ASC;
c1	c2
4611686018427387903	4611686018427387901
4611686018427387903	4611686018427387902
SELECT * FROM t1 WHERE c1 = 4611686018427387903 AND c2 <= 4611686018427387903 ORDER BY c2 ASC;
c1	c2
4611686018427387903	4611686018427387901
4611686018427387903	4611686018427387902
4611686018427387903	4611686018427387903
4611686018427387903	4611686018427387903
SELECT * FROM t1 WHERE c1 = 4611686018427387903 AND c2 > 4611686018427387903 ORDER BY c2 DESC;
c1	c2
4611686018427387903	4611686018427387905
4611686018427387903	4611686018427387904
SELECT * FROM t1 WHERE c1 = 4611686018427387903 AND c2 >= 4611686018427387903 ORDER BY c2 DESC;
c1	c2
4611686018427387903	4611686018427387905
4611686018427387903	4611686018427387904
4611686018427387903	4611686018427387903
4611686018427387903	4611686018427387903
SELECT * FROM t1 WHERE c1 = 4611686018427387903 AND c2 < 4611686018427387903 ORDER BY c2 DESC;
c1	c2
4611686018427387903	4611686018427387902
4611686018427387903	4611686018427387901
SELECT * FROM t1 WHERE c1 = 4611686018427387903 AND c2 <= 4611686018427387903 ORDER BY c2 DESC;
c1	c2
4611686018427387903	4611686018427387903
4611686018427387903	4611686018427387903
4611686018427387903	4611686018427387902
4611686018427387903	4611686018427387901
DROP TABLE t1;
DROP TABLE IF EXISTS t1;
CREATE TABLE t1(c1 BIGINT UNSIGNED NOT NULL , INDEX(c1));
INSERT INTO t1 VALUES
(0),
(0),
(0),
(0),
(0),
(4611686018427387903 - 2),
(4611686018427387903 - 1),
(4611686018427387903),
(4611686018427387903),
(4611686018427387903 + 1),
(4611686018427387903 + 2),
(9223372036854775807);
SELECT * FROM t1 ORDER BY c1 ASC;
c1
0
0
0
0
0
4611686018427387901
4611686018427387902
4611686018427387903
4611686018427387903
4611686018427387904
4611686018427387905
9223372036854775807
SELECT * FROM t1 ORDER BY c1 DESC;
c1
9223372036854775807
4611686018427387905
4611686018427387904
4611686018427387903
4611686018427387903
4611686018427387902
4611686018427387901
0
0
0
0
0
SELECT * FROM t1 WHERE c1 >  4611686018427387903 ORDER BY c1 ASC;
c1
4611686018427387904
4611686018427387905
9223372036854775807
SELECT * FROM t1 WHERE c1 >= 4611686018427387903 ORDER BY c1 ASC;
c1
4611686018427387903
4611686018427387903
4611686018427387904
4611686018427387905
9223372036854775807
SELECT * FROM t1 WHERE c1 <  4611686018427387903 ORDER BY c1 ASC;
c1
0
0
0
0
0
4611686018427387901
4611686018427387902
SELECT * FROM t1 WHERE c1 <= 4611686018427387903 ORDER BY c1 ASC;
c1
0
0
0
0
0
4611686018427387901
4611686018427387902
4611686018427387903
4611686018427387903
SELECT * FROM t1 WHERE c1 =  4611686018427387903 ORDER BY c1 ASC;
c1
4611686018427387903
4611686018427387903
SELECT * FROM t1 WHERE c1 >  4611686018427387903 ORDER BY c1 DESC;
c1
9223372036854775807
4611686018427387905
4611686018427387904
SELECT * FROM t1 WHERE c1 >= 4611686018427387903 ORDER BY c1 DESC;
c1
9223372036854775807
4611686018427387905
4611686018427387904
4611686018427387903
4611686018427387903
SELECT * FROM t1 WHERE c1 <  4611686018427387903 ORDER BY c1 DESC;
c1
4611686018427387902
4611686018427387901
0
0
0
0
0
SELECT * FROM t1 WHERE c1 <= 4611686018427387903 ORDER BY c1 DESC;
c1
4611686018427387903
4611686018427387903
4611686018427387902
4611686018427387901
0
0
0
0
0
SELECT * FROM t1 WHERE c1 =  4611686018427387903 ORDER BY c1 DESC;
c1
4611686018427387903
4611686018427387903
UPDATE t1
SET c1 = 4611686018427387903
WHERE c1 <= 0 + 0 AND c1 >= 0 - 0
ORDER BY c1 ASC
LIMIT 2;
SELECT * FROM t1 ORDER BY c1;
c1
0
0
0
4611686018427387901
4611686018427387902
4611686018427387903
4611686018427387903
4611686018427387903
4611686018427387903
4611686018427387904
4611686018427387905
9223372036854775807
DELETE FROM t1
WHERE c1 <= 0 + 0 AND c1 >= 0 - 0
ORDER BY c1;
SELECT * FROM t1 ORDER BY c1;
c1
4611686018427387901
4611686018427387902
4611686018427387903
4611686018427387903
4611686018427387903
4611686018427387903
4611686018427387904
4611686018427387905
9223372036854775807
DROP TABLE t1;
CREATE TABLE t1(c1 BIGINT UNSIGNED NOT NULL, c2 BIGINT UNSIGNED NOT NULL , INDEX(c1, c2));
INSERT INTO t1 VALUES
(0, 0),
(0, 0),
(0, 0),
(0, 0),
(0, 0),
(4611686018427387903, 4611686018427387903 - 2),
(4611686018427387903, 4611686018427387903 - 1),
(4611686018427387903, 4611686018427387903),
(4611686018427387903, 4611686018427387903),
(4611686018427387903, 4611686018427387903 + 1),
(4611686018427387903, 4611686018427387903 + 2),
(9223372036854775807, 9223372036854775807);
SELECT * FROM t1 WHERE c1 = 4611686018427387903 AND c2 > 4611686018427387903 ORDER BY c2 ASC;
c1	c2
4611686018427387903	4611686018427387904
4611686018427387903	4611686018427387905
SELECT * FROM t1 WHERE c1 = 4611686018427387903 AND c2 >= 4611686018427387903 ORDER BY c2 ASC;
c1	c2
4611686018427387903	4611686018427387903
4611686018427387903	4611686018427387903
4611686018427387903	4611686018427387904
4611686018427387903	4611686018427387905
SELECT * FROM t1 WHERE c1 = 4611686018427387903 AND c2 < 4611686018427387903 ORDER BY c2 ASC;
c1	c2
4611686018427387903	4611686018427387901
4611686018427387903	4611686018427387902
SELECT * FROM t1 WHERE c1 = 4611686018427387903 AND c2 <= 4611686018427387903 ORDER BY c2 ASC;
c1	c2
4611686018427387903	4611686018427387901
4611686018427387903	4611686018427387902
4611686018427387903	4611686018427387903
4611686018427387903	4611686018427387903
SELECT * FROM t1 WHERE c1 = 4611686018427387903 AND c2 > 4611686018427387903 ORDER BY c2 DESC;
c1	c2
4611686018427387903	4611686018427387905
4611686018427387903	4611686018427387904
SELECT * FROM t1 WHERE c1 = 4611686018427387903 AND c2 >= 4611686018427387903 ORDER BY c2 DESC;
c1	c2
4611686018427387903	4611686018427387905
4611686018427387903	4611686018427387904
4611686018427387903	4611686018427387903
4611686018427387903	4611686018427387903
SELECT * FROM t1 WHERE c1 = 4611686018427387903 AND c2 < 4611686018427387903 ORDER BY c2 DESC;
c1	c2
4611686018427387903	4611686018427387902
4611686018427387903	4611686018427387901
SELECT * FROM t1 WHERE c1 = 4611686018427387903 AND c2 <= 4611686018427387903 ORDER BY c2 DESC;
c1	c2
4611686018427387903	4611686018427387903
4611686018427387903	4611686018427387903
4611686018427387903	4611686018427387902
4611686018427387903	4611686018427387901
DROP TABLE t1;
DROP TABLE IF EXISTS t1;
CREATE TABLE t1(c1 BIGINT UNSIGNED NULL);
INSERT INTO t1 VALUES
(0),
(0),
(4611686018427387903),
(9223372036854775807),
(NULL),
(NULL),
(NULL),
(NULL);
SELECT * FROM t1 WHERE c1 IS     NULL ORDER BY c1 ASC;
c1
NULL
NULL
NULL
NULL
SELECT * FROM t1 WHERE c1 IS NOT NULL ORDER BY c1 DESC;
c1
9223372036854775807
4611686018427387903
0
0
SELECT * FROM t1 WHERE c1 IS     NULL ORDER BY c1 ASC;
c1
NULL
NULL
NULL
NULL
SELECT * FROM t1 WHERE c1 IS NOT NULL ORDER BY c1 DESC;
c1
9223372036854775807
4611686018427387903
0
0
UPDATE t1
SET c1 = 0
WHERE c1 IS NULL;
SELECT * FROM t1 ORDER BY c1;
c1
0
0
0
0
0
0
4611686018427387903
9223372036854775807
UPDATE t1
SET c1 = 0
WHERE c1 IS NULL
LIMIT 2;
SELECT * FROM t1 ORDER BY c1;
c1
0
0
0
0
0
0
4611686018427387903
9223372036854775807
DELETE FROM t1
WHERE c1 IS NULL
ORDER BY c1;
SELECT * FROM t1 ORDER BY c1;
c1
0
0
0
0
0
0
4611686018427387903
9223372036854775807
DROP TABLE t1;
CREATE TABLE t1(c1 BIGINT UNSIGNED NULL,
c2 BIGINT UNSIGNED NULL , INDEX(c1, c2));
INSERT INTO t1 VALUES
(0, 0),
(0, 0),
(0, 0),
(0, 0),
(0, 0),
(4611686018427387903, 4611686018427387903 - 2),
(4611686018427387903, 4611686018427387903 - 1),
(4611686018427387903, 4611686018427387903),
(4611686018427387903, 4611686018427387903),
(4611686018427387903, 4611686018427387903 + 1),
(4611686018427387903, 4611686018427387903 + 2),
(4611686018427387903, NULL),
(4611686018427387903, NULL),
(9223372036854775807, 9223372036854775807);
SELECT * FROM t1 WHERE c1 = 4611686018427387903 AND c2 > 4611686018427387903 ORDER BY c2 ASC;
c1	c2
4611686018427387903	4611686018427387904
4611686018427387903	4611686018427387905
SELECT * FROM t1 WHERE c1 = 4611686018427387903 AND c2 >= 4611686018427387903 ORDER BY c2 ASC;
c1	c2
4611686018427387903	4611686018427387903
4611686018427387903	4611686018427387903
4611686018427387903	4611686018427387904
4611686018427387903	4611686018427387905
SELECT * FROM t1 WHERE c1 = 4611686018427387903 AND c2 < 4611686018427387903 ORDER BY c2 ASC;
c1	c2
4611686018427387903	4611686018427387901
4611686018427387903	4611686018427387902
SELECT * FROM t1 WHERE c1 = 4611686018427387903 AND c2 <= 4611686018427387903 ORDER BY c2 ASC;
c1	c2
4611686018427387903	4611686018427387901
4611686018427387903	4611686018427387902
4611686018427387903	4611686018427387903
4611686018427387903	4611686018427387903
SELECT * FROM t1 WHERE c1 = 4611686018427387903 AND c2 is null ORDER BY c1 ASC;
c1	c2
4611686018427387903	NULL
4611686018427387903	NULL
SELECT * FROM t1 WHERE c1 = 4611686018427387903 AND c2 is not null ORDER BY c2 ASC;
c1	c2
4611686018427387903	4611686018427387901
4611686018427387903	4611686018427387902
4611686018427387903	4611686018427387903
4611686018427387903	4611686018427387903
4611686018427387903	4611686018427387904
4611686018427387903	4611686018427387905
SELECT * FROM t1 WHERE c1 = 4611686018427387903 AND c2 > 4611686018427387903 ORDER BY c2 DESC;
c1	c2
4611686018427387903	4611686018427387905
4611686018427387903	4611686018427387904
SELECT * FROM t1 WHERE c1 = 4611686018427387903 AND c2 >= 4611686018427387903 ORDER BY c2 DESC;
c1	c2
4611686018427387903	4611686018427387905
4611686018427387903	4611686018427387904
4611686018427387903	4611686018427387903
4611686018427387903	4611686018427387903
SELECT * FROM t1 WHERE c1 = 4611686018427387903 AND c2 < 4611686018427387903 ORDER BY c2 DESC;
c1	c2
4611686018427387903	4611686018427387902
4611686018427387903	4611686018427387901
SELECT * FROM t1 WHERE c1 = 4611686018427387903 AND c2 <= 4611686018427387903 ORDER BY c2 DESC;
c1	c2
4611686018427387903	4611686018427387903
4611686018427387903	4611686018427387903
4611686018427387903	4611686018427387902
4611686018427387903	4611686018427387901
SELECT * FROM t1 WHERE c1 = 4611686018427387903 AND c2 is null ORDER BY c1 DESC;
c1	c2
4611686018427387903	NULL
4611686018427387903	NULL
SELECT * FROM t1 WHERE c1 = 4611686018427387903 AND c2 is not null ORDER BY c2 DESC;
c1	c2
4611686018427387903	4611686018427387905
4611686018427387903	4611686018427387904
4611686018427387903	4611686018427387903
4611686018427387903	4611686018427387903
4611686018427387903	4611686018427387902
4611686018427387903	4611686018427387901
DROP TABLE t1;
DROP TABLE IF EXISTS t1;
CREATE TABLE t1(c1 BIGINT UNSIGNED NULL , INDEX(c1));
INSERT INTO t1 VALUES
(0),
(0),
(0),
(0),
(0),
(4611686018427387903 - 2),
(4611686018427387903 - 1),
(4611686018427387903),
(4611686018427387903),
(4611686018427387903 + 1),
(4611686018427387903 + 2),
(9223372036854775807);
SELECT * FROM t1 ORDER BY c1 ASC;
c1
0
0
0
0
0
4611686018427387901
4611686018427387902
4611686018427387903
4611686018427387903
4611686018427387904
4611686018427387905
9223372036854775807
SELECT * FROM t1 ORDER BY c1 DESC;
c1
9223372036854775807
4611686018427387905
4611686018427387904
4611686018427387903
4611686018427387903
4611686018427387902
4611686018427387901
0
0
0
0
0
SELECT * FROM t1 WHERE c1 >  4611686018427387903 ORDER BY c1 ASC;
c1
4611686018427387904
4611686018427387905
9223372036854775807
SELECT * FROM t1 WHERE c1 >= 4611686018427387903 ORDER BY c1 ASC;
c1
4611686018427387903
4611686018427387903
4611686018427387904
4611686018427387905
9223372036854775807
SELECT * FROM t1 WHERE c1 <  4611686018427387903 ORDER BY c1 ASC;
c1
0
0
0
0
0
4611686018427387901
4611686018427387902
SELECT * FROM t1 WHERE c1 <= 4611686018427387903 ORDER BY c1 ASC;
c1
0
0
0
0
0
4611686018427387901
4611686018427387902
4611686018427387903
4611686018427387903
SELECT * FROM t1 WHERE c1 =  4611686018427387903 ORDER BY c1 ASC;
c1
4611686018427387903
4611686018427387903
SELECT * FROM t1 WHERE c1 >  4611686018427387903 ORDER BY c1 DESC;
c1
9223372036854775807
4611686018427387905
4611686018427387904
SELECT * FROM t1 WHERE c1 >= 4611686018427387903 ORDER BY c1 DESC;
c1
9223372036854775807
4611686018427387905
4611686018427387904
4611686018427387903
4611686018427387903
SELECT * FROM t1 WHERE c1 <  4611686018427387903 ORDER BY c1 DESC;
c1
4611686018427387902
4611686018427387901
0
0
0
0
0
SELECT * FROM t1 WHERE c1 <= 4611686018427387903 ORDER BY c1 DESC;
c1
4611686018427387903
4611686018427387903
4611686018427387902
4611686018427387901
0
0
0
0
0
SELECT * FROM t1 WHERE c1 =  4611686018427387903 ORDER BY c1 DESC;
c1
4611686018427387903
4611686018427387903
UPDATE t1
SET c1 = 4611686018427387903
WHERE c1 <= 0 + 0 AND c1 >= 0 - 0
ORDER BY c1 ASC
LIMIT 2;
SELECT * FROM t1 ORDER BY c1;
c1
0
0
0
4611686018427387901
4611686018427387902
4611686018427387903
4611686018427387903
4611686018427387903
4611686018427387903
4611686018427387904
4611686018427387905
9223372036854775807
DELETE FROM t1
WHERE c1 <= 0 + 0 AND c1 >= 0 - 0
ORDER BY c1;
SELECT * FROM t1 ORDER BY c1;
c1
4611686018427387901
4611686018427387902
4611686018427387903
4611686018427387903
4611686018427387903
4611686018427387903
4611686018427387904
4611686018427387905
9223372036854775807
DROP TABLE t1;
CREATE TABLE t1(c1 BIGINT UNSIGNED NULL, c2 BIGINT UNSIGNED NULL , INDEX(c1, c2));
INSERT INTO t1 VALUES
(0, 0),
(0, 0),
(0, 0),
(0, 0),
(0, 0),
(4611686018427387903, 4611686018427387903 - 2),
(4611686018427387903, 4611686018427387903 - 1),
(4611686018427387903, 4611686018427387903),
(4611686018427387903, 4611686018427387903),
(4611686018427387903, 4611686018427387903 + 1),
(4611686018427387903, 4611686018427387903 + 2),
(9223372036854775807, 9223372036854775807);
SELECT * FROM t1 WHERE c1 = 4611686018427387903 AND c2 > 4611686018427387903 ORDER BY c2 ASC;
c1	c2
4611686018427387903	4611686018427387904
4611686018427387903	4611686018427387905
SELECT * FROM t1 WHERE c1 = 4611686018427387903 AND c2 >= 4611686018427387903 ORDER BY c2 ASC;
c1	c2
4611686018427387903	4611686018427387903
4611686018427387903	4611686018427387903
4611686018427387903	4611686018427387904
4611686018427387903	4611686018427387905
SELECT * FROM t1 WHERE c1 = 4611686018427387903 AND c2 < 4611686018427387903 ORDER BY c2 ASC;
c1	c2
4611686018427387903	4611686018427387901
4611686018427387903	4611686018427387902
SELECT * FROM t1 WHERE c1 = 4611686018427387903 AND c2 <= 4611686018427387903 ORDER BY c2 ASC;
c1	c2
4611686018427387903	4611686018427387901
4611686018427387903	4611686018427387902
4611686018427387903	4611686018427387903
4611686018427387903	4611686018427387903
SELECT * FROM t1 WHERE c1 = 4611686018427387903 AND c2 > 4611686018427387903 ORDER BY c2 DESC;
c1	c2
4611686018427387903	4611686018427387905
4611686018427387903	4611686018427387904
SELECT * FROM t1 WHERE c1 = 4611686018427387903 AND c2 >= 4611686018427387903 ORDER BY c2 DESC;
c1	c2
4611686018427387903	4611686018427387905
4611686018427387903	4611686018427387904
4611686018427387903	4611686018427387903
4611686018427387903	4611686018427387903
SELECT * FROM t1 WHERE c1 = 4611686018427387903 AND c2 < 4611686018427387903 ORDER BY c2 DESC;
c1	c2
4611686018427387903	4611686018427387902
4611686018427387903	4611686018427387901
SELECT * FROM t1 WHERE c1 = 4611686018427387903 AND c2 <= 4611686018427387903 ORDER BY c2 DESC;
c1	c2
4611686018427387903	4611686018427387903
4611686018427387903	4611686018427387903
4611686018427387903	4611686018427387902
4611686018427387903	4611686018427387901
DROP TABLE t1;
