DROP TABLE IF EXISTS t1;
CREATE TABLE t1(c1 TINYINT SIGNED NOT NULL );
INSERT INTO t1 VALUES
(-128),
(0),
(0),
(0),
(0),
(64 - 2),
(64 - 1),
(64),
(64),
(64 + 1),
(64 + 2),
(127);
SELECT * FROM t1 ORDER BY c1 ASC;
c1
-128
0
0
0
0
62
63
64
64
65
66
127
SELECT * FROM t1 ORDER BY c1 DESC;
c1
127
66
65
64
64
63
62
0
0
0
0
-128
SELECT * FROM t1 WHERE c1 >  64 ORDER BY c1 ASC;
c1
65
66
127
SELECT * FROM t1 WHERE c1 >= 64 ORDER BY c1 ASC;
c1
64
64
65
66
127
SELECT * FROM t1 WHERE c1 <  64 ORDER BY c1 ASC;
c1
-128
0
0
0
0
62
63
SELECT * FROM t1 WHERE c1 <= 64 ORDER BY c1 ASC;
c1
-128
0
0
0
0
62
63
64
64
SELECT * FROM t1 WHERE c1 =  64 ORDER BY c1 ASC;
c1
64
64
SELECT * FROM t1 WHERE c1 >  64 ORDER BY c1 DESC;
c1
127
66
65
SELECT * FROM t1 WHERE c1 >= 64 ORDER BY c1 DESC;
c1
127
66
65
64
64
SELECT * FROM t1 WHERE c1 <  64 ORDER BY c1 DESC;
c1
63
62
0
0
0
0
-128
SELECT * FROM t1 WHERE c1 <= 64 ORDER BY c1 DESC;
c1
64
64
63
62
0
0
0
0
-128
SELECT * FROM t1 WHERE c1 =  64 ORDER BY c1 DESC;
c1
64
64
UPDATE t1
SET c1 = 64
WHERE c1 <= 0 + 0 AND c1 >= 0 - 0
ORDER BY c1 ASC
LIMIT 2;
SELECT * FROM t1 ORDER BY c1;
c1
-128
0
0
62
63
64
64
64
64
65
66
127
DELETE FROM t1
WHERE c1 <= 0 + 0 AND c1 >= 0 - 0
ORDER BY c1;
SELECT * FROM t1 ORDER BY c1;
c1
-128
62
63
64
64
64
64
65
66
127
DROP TABLE t1;
CREATE TABLE t1(c1 TINYINT SIGNED NOT NULL, c2 TINYINT SIGNED NOT NULL );
INSERT INTO t1 VALUES
(-128, -128),
(0, 0),
(0, 0),
(0, 0),
(0, 0),
(64, 64 - 2),
(64, 64 - 1),
(64, 64),
(64, 64),
(64, 64 + 1),
(64, 64 + 2),
(127, 127);
SELECT * FROM t1 WHERE c1 = 64 AND c2 > 64 ORDER BY c2 ASC;
c1	c2
64	65
64	66
SELECT * FROM t1 WHERE c1 = 64 AND c2 >= 64 ORDER BY c2 ASC;
c1	c2
64	64
64	64
64	65
64	66
SELECT * FROM t1 WHERE c1 = 64 AND c2 < 64 ORDER BY c2 ASC;
c1	c2
64	62
64	63
SELECT * FROM t1 WHERE c1 = 64 AND c2 <= 64 ORDER BY c2 ASC;
c1	c2
64	62
64	63
64	64
64	64
SELECT * FROM t1 WHERE c1 = 64 AND c2 > 64 ORDER BY c2 DESC;
c1	c2
64	66
64	65
SELECT * FROM t1 WHERE c1 = 64 AND c2 >= 64 ORDER BY c2 DESC;
c1	c2
64	66
64	65
64	64
64	64
SELECT * FROM t1 WHERE c1 = 64 AND c2 < 64 ORDER BY c2 DESC;
c1	c2
64	63
64	62
SELECT * FROM t1 WHERE c1 = 64 AND c2 <= 64 ORDER BY c2 DESC;
c1	c2
64	64
64	64
64	63
64	62
DROP TABLE t1;
DROP TABLE IF EXISTS t1;
CREATE TABLE t1(c1 TINYINT SIGNED NULL);
INSERT INTO t1 VALUES
(-128),
(0),
(64),
(127),
(NULL),
(NULL),
(NULL),
(NULL);
SELECT * FROM t1 WHERE c1 IS     NULL ORDER BY c1 ASC;
c1
NULL
NULL
NULL
NULL
SELECT * FROM t1 WHERE c1 IS NOT NULL ORDER BY c1 DESC;
c1
127
64
0
-128
SELECT * FROM t1 WHERE c1 IS     NULL ORDER BY c1 ASC;
c1
NULL
NULL
NULL
NULL
SELECT * FROM t1 WHERE c1 IS NOT NULL ORDER BY c1 DESC;
c1
127
64
0
-128
UPDATE t1
SET c1 = 0
WHERE c1 IS NULL;
SELECT * FROM t1 ORDER BY c1;
c1
-128
0
0
0
0
0
64
127
UPDATE t1
SET c1 = 0
WHERE c1 IS NULL
LIMIT 2;
SELECT * FROM t1 ORDER BY c1;
c1
-128
0
0
0
0
0
64
127
DELETE FROM t1
WHERE c1 IS NULL
ORDER BY c1;
SELECT * FROM t1 ORDER BY c1;
c1
-128
0
0
0
0
0
64
127
DROP TABLE t1;
CREATE TABLE t1(c1 TINYINT SIGNED NULL,
c2 TINYINT SIGNED NULL );
INSERT INTO t1 VALUES
(-128, -128),
(0, 0),
(0, 0),
(0, 0),
(0, 0),
(64, 64 - 2),
(64, 64 - 1),
(64, 64),
(64, 64),
(64, 64 + 1),
(64, 64 + 2),
(64, NULL),
(64, NULL),
(127, 127);
SELECT * FROM t1 WHERE c1 = 64 AND c2 > 64 ORDER BY c2 ASC;
c1	c2
64	65
64	66
SELECT * FROM t1 WHERE c1 = 64 AND c2 >= 64 ORDER BY c2 ASC;
c1	c2
64	64
64	64
64	65
64	66
SELECT * FROM t1 WHERE c1 = 64 AND c2 < 64 ORDER BY c2 ASC;
c1	c2
64	62
64	63
SELECT * FROM t1 WHERE c1 = 64 AND c2 <= 64 ORDER BY c2 ASC;
c1	c2
64	62
64	63
64	64
64	64
SELECT * FROM t1 WHERE c1 = 64 AND c2 is null ORDER BY c1 ASC;
c1	c2
64	NULL
64	NULL
SELECT * FROM t1 WHERE c1 = 64 AND c2 is not null ORDER BY c2 ASC;
c1	c2
64	62
64	63
64	64
64	64
64	65
64	66
SELECT * FROM t1 WHERE c1 = 64 AND c2 > 64 ORDER BY c2 DESC;
c1	c2
64	66
64	65
SELECT * FROM t1 WHERE c1 = 64 AND c2 >= 64 ORDER BY c2 DESC;
c1	c2
64	66
64	65
64	64
64	64
SELECT * FROM t1 WHERE c1 = 64 AND c2 < 64 ORDER BY c2 DESC;
c1	c2
64	63
64	62
SELECT * FROM t1 WHERE c1 = 64 AND c2 <= 64 ORDER BY c2 DESC;
c1	c2
64	64
64	64
64	63
64	62
SELECT * FROM t1 WHERE c1 = 64 AND c2 is null ORDER BY c1 DESC;
c1	c2
64	NULL
64	NULL
SELECT * FROM t1 WHERE c1 = 64 AND c2 is not null ORDER BY c2 DESC;
c1	c2
64	66
64	65
64	64
64	64
64	63
64	62
DROP TABLE t1;
DROP TABLE IF EXISTS t1;
CREATE TABLE t1(c1 TINYINT SIGNED NULL );
INSERT INTO t1 VALUES
(-128),
(0),
(0),
(0),
(0),
(64 - 2),
(64 - 1),
(64),
(64),
(64 + 1),
(64 + 2),
(127);
SELECT * FROM t1 ORDER BY c1 ASC;
c1
-128
0
0
0
0
62
63
64
64
65
66
127
SELECT * FROM t1 ORDER BY c1 DESC;
c1
127
66
65
64
64
63
62
0
0
0
0
-128
SELECT * FROM t1 WHERE c1 >  64 ORDER BY c1 ASC;
c1
65
66
127
SELECT * FROM t1 WHERE c1 >= 64 ORDER BY c1 ASC;
c1
64
64
65
66
127
SELECT * FROM t1 WHERE c1 <  64 ORDER BY c1 ASC;
c1
-128
0
0
0
0
62
63
SELECT * FROM t1 WHERE c1 <= 64 ORDER BY c1 ASC;
c1
-128
0
0
0
0
62
63
64
64
SELECT * FROM t1 WHERE c1 =  64 ORDER BY c1 ASC;
c1
64
64
SELECT * FROM t1 WHERE c1 >  64 ORDER BY c1 DESC;
c1
127
66
65
SELECT * FROM t1 WHERE c1 >= 64 ORDER BY c1 DESC;
c1
127
66
65
64
64
SELECT * FROM t1 WHERE c1 <  64 ORDER BY c1 DESC;
c1
63
62
0
0
0
0
-128
SELECT * FROM t1 WHERE c1 <= 64 ORDER BY c1 DESC;
c1
64
64
63
62
0
0
0
0
-128
SELECT * FROM t1 WHERE c1 =  64 ORDER BY c1 DESC;
c1
64
64
UPDATE t1
SET c1 = 64
WHERE c1 <= 0 + 0 AND c1 >= 0 - 0
ORDER BY c1 ASC
LIMIT 2;
SELECT * FROM t1 ORDER BY c1;
c1
-128
0
0
62
63
64
64
64
64
65
66
127
DELETE FROM t1
WHERE c1 <= 0 + 0 AND c1 >= 0 - 0
ORDER BY c1;
SELECT * FROM t1 ORDER BY c1;
c1
-128
62
63
64
64
64
64
65
66
127
DROP TABLE t1;
CREATE TABLE t1(c1 TINYINT SIGNED NULL, c2 TINYINT SIGNED NULL );
INSERT INTO t1 VALUES
(-128, -128),
(0, 0),
(0, 0),
(0, 0),
(0, 0),
(64, 64 - 2),
(64, 64 - 1),
(64, 64),
(64, 64),
(64, 64 + 1),
(64, 64 + 2),
(127, 127);
SELECT * FROM t1 WHERE c1 = 64 AND c2 > 64 ORDER BY c2 ASC;
c1	c2
64	65
64	66
SELECT * FROM t1 WHERE c1 = 64 AND c2 >= 64 ORDER BY c2 ASC;
c1	c2
64	64
64	64
64	65
64	66
SELECT * FROM t1 WHERE c1 = 64 AND c2 < 64 ORDER BY c2 ASC;
c1	c2
64	62
64	63
SELECT * FROM t1 WHERE c1 = 64 AND c2 <= 64 ORDER BY c2 ASC;
c1	c2
64	62
64	63
64	64
64	64
SELECT * FROM t1 WHERE c1 = 64 AND c2 > 64 ORDER BY c2 DESC;
c1	c2
64	66
64	65
SELECT * FROM t1 WHERE c1 = 64 AND c2 >= 64 ORDER BY c2 DESC;
c1	c2
64	66
64	65
64	64
64	64
SELECT * FROM t1 WHERE c1 = 64 AND c2 < 64 ORDER BY c2 DESC;
c1	c2
64	63
64	62
SELECT * FROM t1 WHERE c1 = 64 AND c2 <= 64 ORDER BY c2 DESC;
c1	c2
64	64
64	64
64	63
64	62
DROP TABLE t1;
DROP TABLE IF EXISTS t1;
CREATE TABLE t1(c1 TINYINT SIGNED NOT NULL , INDEX(c1));
INSERT INTO t1 VALUES
(-128),
(0),
(0),
(0),
(0),
(64 - 2),
(64 - 1),
(64),
(64),
(64 + 1),
(64 + 2),
(127);
SELECT * FROM t1 ORDER BY c1 ASC;
c1
-128
0
0
0
0
62
63
64
64
65
66
127
SELECT * FROM t1 ORDER BY c1 DESC;
c1
127
66
65
64
64
63
62
0
0
0
0
-128
SELECT * FROM t1 WHERE c1 >  64 ORDER BY c1 ASC;
c1
65
66
127
SELECT * FROM t1 WHERE c1 >= 64 ORDER BY c1 ASC;
c1
64
64
65
66
127
SELECT * FROM t1 WHERE c1 <  64 ORDER BY c1 ASC;
c1
-128
0
0
0
0
62
63
SELECT * FROM t1 WHERE c1 <= 64 ORDER BY c1 ASC;
c1
-128
0
0
0
0
62
63
64
64
SELECT * FROM t1 WHERE c1 =  64 ORDER BY c1 ASC;
c1
64
64
SELECT * FROM t1 WHERE c1 >  64 ORDER BY c1 DESC;
c1
127
66
65
SELECT * FROM t1 WHERE c1 >= 64 ORDER BY c1 DESC;
c1
127
66
65
64
64
SELECT * FROM t1 WHERE c1 <  64 ORDER BY c1 DESC;
c1
63
62
0
0
0
0
-128
SELECT * FROM t1 WHERE c1 <= 64 ORDER BY c1 DESC;
c1
64
64
63
62
0
0
0
0
-128
SELECT * FROM t1 WHERE c1 =  64 ORDER BY c1 DESC;
c1
64
64
UPDATE t1
SET c1 = 64
WHERE c1 <= 0 + 0 AND c1 >= 0 - 0
ORDER BY c1 ASC
LIMIT 2;
SELECT * FROM t1 ORDER BY c1;
c1
-128
0
0
62
63
64
64
64
64
65
66
127
DELETE FROM t1
WHERE c1 <= 0 + 0 AND c1 >= 0 - 0
ORDER BY c1;
SELECT * FROM t1 ORDER BY c1;
c1
-128
62
63
64
64
64
64
65
66
127
DROP TABLE t1;
CREATE TABLE t1(c1 TINYINT SIGNED NOT NULL, c2 TINYINT SIGNED NOT NULL , INDEX(c1, c2));
INSERT INTO t1 VALUES
(-128, -128),
(0, 0),
(0, 0),
(0, 0),
(0, 0),
(64, 64 - 2),
(64, 64 - 1),
(64, 64),
(64, 64),
(64, 64 + 1),
(64, 64 + 2),
(127, 127);
SELECT * FROM t1 WHERE c1 = 64 AND c2 > 64 ORDER BY c2 ASC;
c1	c2
64	65
64	66
SELECT * FROM t1 WHERE c1 = 64 AND c2 >= 64 ORDER BY c2 ASC;
c1	c2
64	64
64	64
64	65
64	66
SELECT * FROM t1 WHERE c1 = 64 AND c2 < 64 ORDER BY c2 ASC;
c1	c2
64	62
64	63
SELECT * FROM t1 WHERE c1 = 64 AND c2 <= 64 ORDER BY c2 ASC;
c1	c2
64	62
64	63
64	64
64	64
SELECT * FROM t1 WHERE c1 = 64 AND c2 > 64 ORDER BY c2 DESC;
c1	c2
64	66
64	65
SELECT * FROM t1 WHERE c1 = 64 AND c2 >= 64 ORDER BY c2 DESC;
c1	c2
64	66
64	65
64	64
64	64
SELECT * FROM t1 WHERE c1 = 64 AND c2 < 64 ORDER BY c2 DESC;
c1	c2
64	63
64	62
SELECT * FROM t1 WHERE c1 = 64 AND c2 <= 64 ORDER BY c2 DESC;
c1	c2
64	64
64	64
64	63
64	62
DROP TABLE t1;
DROP TABLE IF EXISTS t1;
CREATE TABLE t1(c1 TINYINT SIGNED NULL);
INSERT INTO t1 VALUES
(-128),
(0),
(64),
(127),
(NULL),
(NULL),
(NULL),
(NULL);
SELECT * FROM t1 WHERE c1 IS     NULL ORDER BY c1 ASC;
c1
NULL
NULL
NULL
NULL
SELECT * FROM t1 WHERE c1 IS NOT NULL ORDER BY c1 DESC;
c1
127
64
0
-128
SELECT * FROM t1 WHERE c1 IS     NULL ORDER BY c1 ASC;
c1
NULL
NULL
NULL
NULL
SELECT * FROM t1 WHERE c1 IS NOT NULL ORDER BY c1 DESC;
c1
127
64
0
-128
UPDATE t1
SET c1 = 0
WHERE c1 IS NULL;
SELECT * FROM t1 ORDER BY c1;
c1
-128
0
0
0
0
0
64
127
UPDATE t1
SET c1 = 0
WHERE c1 IS NULL
LIMIT 2;
SELECT * FROM t1 ORDER BY c1;
c1
-128
0
0
0
0
0
64
127
DELETE FROM t1
WHERE c1 IS NULL
ORDER BY c1;
SELECT * FROM t1 ORDER BY c1;
c1
-128
0
0
0
0
0
64
127
DROP TABLE t1;
CREATE TABLE t1(c1 TINYINT SIGNED NULL,
c2 TINYINT SIGNED NULL , INDEX(c1, c2));
INSERT INTO t1 VALUES
(-128, -128),
(0, 0),
(0, 0),
(0, 0),
(0, 0),
(64, 64 - 2),
(64, 64 - 1),
(64, 64),
(64, 64),
(64, 64 + 1),
(64, 64 + 2),
(64, NULL),
(64, NULL),
(127, 127);
SELECT * FROM t1 WHERE c1 = 64 AND c2 > 64 ORDER BY c2 ASC;
c1	c2
64	65
64	66
SELECT * FROM t1 WHERE c1 = 64 AND c2 >= 64 ORDER BY c2 ASC;
c1	c2
64	64
64	64
64	65
64	66
SELECT * FROM t1 WHERE c1 = 64 AND c2 < 64 ORDER BY c2 ASC;
c1	c2
64	62
64	63
SELECT * FROM t1 WHERE c1 = 64 AND c2 <= 64 ORDER BY c2 ASC;
c1	c2
64	62
64	63
64	64
64	64
SELECT * FROM t1 WHERE c1 = 64 AND c2 is null ORDER BY c1 ASC;
c1	c2
64	NULL
64	NULL
SELECT * FROM t1 WHERE c1 = 64 AND c2 is not null ORDER BY c2 ASC;
c1	c2
64	62
64	63
64	64
64	64
64	65
64	66
SELECT * FROM t1 WHERE c1 = 64 AND c2 > 64 ORDER BY c2 DESC;
c1	c2
64	66
64	65
SELECT * FROM t1 WHERE c1 = 64 AND c2 >= 64 ORDER BY c2 DESC;
c1	c2
64	66
64	65
64	64
64	64
SELECT * FROM t1 WHERE c1 = 64 AND c2 < 64 ORDER BY c2 DESC;
c1	c2
64	63
64	62
SELECT * FROM t1 WHERE c1 = 64 AND c2 <= 64 ORDER BY c2 DESC;
c1	c2
64	64
64	64
64	63
64	62
SELECT * FROM t1 WHERE c1 = 64 AND c2 is null ORDER BY c1 DESC;
c1	c2
64	NULL
64	NULL
SELECT * FROM t1 WHERE c1 = 64 AND c2 is not null ORDER BY c2 DESC;
c1	c2
64	66
64	65
64	64
64	64
64	63
64	62
DROP TABLE t1;
DROP TABLE IF EXISTS t1;
CREATE TABLE t1(c1 TINYINT SIGNED NULL , INDEX(c1));
INSERT INTO t1 VALUES
(-128),
(0),
(0),
(0),
(0),
(64 - 2),
(64 - 1),
(64),
(64),
(64 + 1),
(64 + 2),
(127);
SELECT * FROM t1 ORDER BY c1 ASC;
c1
-128
0
0
0
0
62
63
64
64
65
66
127
SELECT * FROM t1 ORDER BY c1 DESC;
c1
127
66
65
64
64
63
62
0
0
0
0
-128
SELECT * FROM t1 WHERE c1 >  64 ORDER BY c1 ASC;
c1
65
66
127
SELECT * FROM t1 WHERE c1 >= 64 ORDER BY c1 ASC;
c1
64
64
65
66
127
SELECT * FROM t1 WHERE c1 <  64 ORDER BY c1 ASC;
c1
-128
0
0
0
0
62
63
SELECT * FROM t1 WHERE c1 <= 64 ORDER BY c1 ASC;
c1
-128
0
0
0
0
62
63
64
64
SELECT * FROM t1 WHERE c1 =  64 ORDER BY c1 ASC;
c1
64
64
SELECT * FROM t1 WHERE c1 >  64 ORDER BY c1 DESC;
c1
127
66
65
SELECT * FROM t1 WHERE c1 >= 64 ORDER BY c1 DESC;
c1
127
66
65
64
64
SELECT * FROM t1 WHERE c1 <  64 ORDER BY c1 DESC;
c1
63
62
0
0
0
0
-128
SELECT * FROM t1 WHERE c1 <= 64 ORDER BY c1 DESC;
c1
64
64
63
62
0
0
0
0
-128
SELECT * FROM t1 WHERE c1 =  64 ORDER BY c1 DESC;
c1
64
64
UPDATE t1
SET c1 = 64
WHERE c1 <= 0 + 0 AND c1 >= 0 - 0
ORDER BY c1 ASC
LIMIT 2;
SELECT * FROM t1 ORDER BY c1;
c1
-128
0
0
62
63
64
64
64
64
65
66
127
DELETE FROM t1
WHERE c1 <= 0 + 0 AND c1 >= 0 - 0
ORDER BY c1;
SELECT * FROM t1 ORDER BY c1;
c1
-128
62
63
64
64
64
64
65
66
127
DROP TABLE t1;
CREATE TABLE t1(c1 TINYINT SIGNED NULL, c2 TINYINT SIGNED NULL , INDEX(c1, c2));
INSERT INTO t1 VALUES
(-128, -128),
(0, 0),
(0, 0),
(0, 0),
(0, 0),
(64, 64 - 2),
(64, 64 - 1),
(64, 64),
(64, 64),
(64, 64 + 1),
(64, 64 + 2),
(127, 127);
SELECT * FROM t1 WHERE c1 = 64 AND c2 > 64 ORDER BY c2 ASC;
c1	c2
64	65
64	66
SELECT * FROM t1 WHERE c1 = 64 AND c2 >= 64 ORDER BY c2 ASC;
c1	c2
64	64
64	64
64	65
64	66
SELECT * FROM t1 WHERE c1 = 64 AND c2 < 64 ORDER BY c2 ASC;
c1	c2
64	62
64	63
SELECT * FROM t1 WHERE c1 = 64 AND c2 <= 64 ORDER BY c2 ASC;
c1	c2
64	62
64	63
64	64
64	64
SELECT * FROM t1 WHERE c1 = 64 AND c2 > 64 ORDER BY c2 DESC;
c1	c2
64	66
64	65
SELECT * FROM t1 WHERE c1 = 64 AND c2 >= 64 ORDER BY c2 DESC;
c1	c2
64	66
64	65
64	64
64	64
SELECT * FROM t1 WHERE c1 = 64 AND c2 < 64 ORDER BY c2 DESC;
c1	c2
64	63
64	62
SELECT * FROM t1 WHERE c1 = 64 AND c2 <= 64 ORDER BY c2 DESC;
c1	c2
64	64
64	64
64	63
64	62
DROP TABLE t1;
DROP TABLE IF EXISTS t1;
CREATE TABLE t1(c1 TINYINT UNSIGNED NOT NULL );
INSERT INTO t1 VALUES
(0),
(0),
(0),
(0),
(0),
(128 - 2),
(128 - 1),
(128),
(128),
(128 + 1),
(128 + 2),
(255);
SELECT * FROM t1 ORDER BY c1 ASC;
c1
0
0
0
0
0
126
127
128
128
129
130
255
SELECT * FROM t1 ORDER BY c1 DESC;
c1
255
130
129
128
128
127
126
0
0
0
0
0
SELECT * FROM t1 WHERE c1 >  128 ORDER BY c1 ASC;
c1
129
130
255
SELECT * FROM t1 WHERE c1 >= 128 ORDER BY c1 ASC;
c1
128
128
129
130
255
SELECT * FROM t1 WHERE c1 <  128 ORDER BY c1 ASC;
c1
0
0
0
0
0
126
127
SELECT * FROM t1 WHERE c1 <= 128 ORDER BY c1 ASC;
c1
0
0
0
0
0
126
127
128
128
SELECT * FROM t1 WHERE c1 =  128 ORDER BY c1 ASC;
c1
128
128
SELECT * FROM t1 WHERE c1 >  128 ORDER BY c1 DESC;
c1
255
130
129
SELECT * FROM t1 WHERE c1 >= 128 ORDER BY c1 DESC;
c1
255
130
129
128
128
SELECT * FROM t1 WHERE c1 <  128 ORDER BY c1 DESC;
c1
127
126
0
0
0
0
0
SELECT * FROM t1 WHERE c1 <= 128 ORDER BY c1 DESC;
c1
128
128
127
126
0
0
0
0
0
SELECT * FROM t1 WHERE c1 =  128 ORDER BY c1 DESC;
c1
128
128
UPDATE t1
SET c1 = 128
WHERE c1 <= 0 + 0 AND c1 >= 0 - 0
ORDER BY c1 ASC
LIMIT 2;
SELECT * FROM t1 ORDER BY c1;
c1
0
0
0
126
127
128
128
128
128
129
130
255
DELETE FROM t1
WHERE c1 <= 0 + 0 AND c1 >= 0 - 0
ORDER BY c1;
SELECT * FROM t1 ORDER BY c1;
c1
126
127
128
128
128
128
129
130
255
DROP TABLE t1;
CREATE TABLE t1(c1 TINYINT UNSIGNED NOT NULL, c2 TINYINT UNSIGNED NOT NULL , INDEX(c1, c2));
INSERT INTO t1 VALUES
(0, 0),
(0, 0),
(0, 0),
(0, 0),
(0, 0),
(128, 128 - 2),
(128, 128 - 1),
(128, 128),
(128, 128),
(128, 128 + 1),
(128, 128 + 2),
(255, 255);
SELECT * FROM t1 WHERE c1 = 128 AND c2 > 128 ORDER BY c2 ASC;
c1	c2
128	129
128	130
SELECT * FROM t1 WHERE c1 = 128 AND c2 >= 128 ORDER BY c2 ASC;
c1	c2
128	128
128	128
128	129
128	130
SELECT * FROM t1 WHERE c1 = 128 AND c2 < 128 ORDER BY c2 ASC;
c1	c2
128	126
128	127
SELECT * FROM t1 WHERE c1 = 128 AND c2 <= 128 ORDER BY c2 ASC;
c1	c2
128	126
128	127
128	128
128	128
SELECT * FROM t1 WHERE c1 = 128 AND c2 > 128 ORDER BY c2 DESC;
c1	c2
128	130
128	129
SELECT * FROM t1 WHERE c1 = 128 AND c2 >= 128 ORDER BY c2 DESC;
c1	c2
128	130
128	129
128	128
128	128
SELECT * FROM t1 WHERE c1 = 128 AND c2 < 128 ORDER BY c2 DESC;
c1	c2
128	127
128	126
SELECT * FROM t1 WHERE c1 = 128 AND c2 <= 128 ORDER BY c2 DESC;
c1	c2
128	128
128	128
128	127
128	126
DROP TABLE t1;
DROP TABLE IF EXISTS t1;
CREATE TABLE t1(c1 TINYINT UNSIGNED NULL);
INSERT INTO t1 VALUES
(0),
(0),
(128),
(255),
(NULL),
(NULL),
(NULL),
(NULL);
SELECT * FROM t1 WHERE c1 IS     NULL ORDER BY c1 ASC;
c1
NULL
NULL
NULL
NULL
SELECT * FROM t1 WHERE c1 IS NOT NULL ORDER BY c1 DESC;
c1
255
128
0
0
SELECT * FROM t1 WHERE c1 IS     NULL ORDER BY c1 ASC;
c1
NULL
NULL
NULL
NULL
SELECT * FROM t1 WHERE c1 IS NOT NULL ORDER BY c1 DESC;
c1
255
128
0
0
UPDATE t1
SET c1 = 0
WHERE c1 IS NULL;
SELECT * FROM t1 ORDER BY c1;
c1
0
0
0
0
0
0
128
255
UPDATE t1
SET c1 = 0
WHERE c1 IS NULL
LIMIT 2;
SELECT * FROM t1 ORDER BY c1;
c1
0
0
0
0
0
0
128
255
DELETE FROM t1
WHERE c1 IS NULL
ORDER BY c1;
SELECT * FROM t1 ORDER BY c1;
c1
0
0
0
0
0
0
128
255
DROP TABLE t1;
CREATE TABLE t1(c1 TINYINT UNSIGNED NULL,
c2 TINYINT UNSIGNED NULL , INDEX(c1, c2));
INSERT INTO t1 VALUES
(0, 0),
(0, 0),
(0, 0),
(0, 0),
(0, 0),
(128, 128 - 2),
(128, 128 - 1),
(128, 128),
(128, 128),
(128, 128 + 1),
(128, 128 + 2),
(128, NULL),
(128, NULL),
(255, 255);
SELECT * FROM t1 WHERE c1 = 128 AND c2 > 128 ORDER BY c2 ASC;
c1	c2
128	129
128	130
SELECT * FROM t1 WHERE c1 = 128 AND c2 >= 128 ORDER BY c2 ASC;
c1	c2
128	128
128	128
128	129
128	130
SELECT * FROM t1 WHERE c1 = 128 AND c2 < 128 ORDER BY c2 ASC;
c1	c2
128	126
128	127
SELECT * FROM t1 WHERE c1 = 128 AND c2 <= 128 ORDER BY c2 ASC;
c1	c2
128	126
128	127
128	128
128	128
SELECT * FROM t1 WHERE c1 = 128 AND c2 is null ORDER BY c1 ASC;
c1	c2
128	NULL
128	NULL
SELECT * FROM t1 WHERE c1 = 128 AND c2 is not null ORDER BY c2 ASC;
c1	c2
128	126
128	127
128	128
128	128
128	129
128	130
SELECT * FROM t1 WHERE c1 = 128 AND c2 > 128 ORDER BY c2 DESC;
c1	c2
128	130
128	129
SELECT * FROM t1 WHERE c1 = 128 AND c2 >= 128 ORDER BY c2 DESC;
c1	c2
128	130
128	129
128	128
128	128
SELECT * FROM t1 WHERE c1 = 128 AND c2 < 128 ORDER BY c2 DESC;
c1	c2
128	127
128	126
SELECT * FROM t1 WHERE c1 = 128 AND c2 <= 128 ORDER BY c2 DESC;
c1	c2
128	128
128	128
128	127
128	126
SELECT * FROM t1 WHERE c1 = 128 AND c2 is null ORDER BY c1 DESC;
c1	c2
128	NULL
128	NULL
SELECT * FROM t1 WHERE c1 = 128 AND c2 is not null ORDER BY c2 DESC;
c1	c2
128	130
128	129
128	128
128	128
128	127
128	126
DROP TABLE t1;
DROP TABLE IF EXISTS t1;
CREATE TABLE t1(c1 TINYINT UNSIGNED NULL );
INSERT INTO t1 VALUES
(0),
(0),
(0),
(0),
(0),
(128 - 2),
(128 - 1),
(128),
(128),
(128 + 1),
(128 + 2),
(255);
SELECT * FROM t1 ORDER BY c1 ASC;
c1
0
0
0
0
0
126
127
128
128
129
130
255
SELECT * FROM t1 ORDER BY c1 DESC;
c1
255
130
129
128
128
127
126
0
0
0
0
0
SELECT * FROM t1 WHERE c1 >  128 ORDER BY c1 ASC;
c1
129
130
255
SELECT * FROM t1 WHERE c1 >= 128 ORDER BY c1 ASC;
c1
128
128
129
130
255
SELECT * FROM t1 WHERE c1 <  128 ORDER BY c1 ASC;
c1
0
0
0
0
0
126
127
SELECT * FROM t1 WHERE c1 <= 128 ORDER BY c1 ASC;
c1
0
0
0
0
0
126
127
128
128
SELECT * FROM t1 WHERE c1 =  128 ORDER BY c1 ASC;
c1
128
128
SELECT * FROM t1 WHERE c1 >  128 ORDER BY c1 DESC;
c1
255
130
129
SELECT * FROM t1 WHERE c1 >= 128 ORDER BY c1 DESC;
c1
255
130
129
128
128
SELECT * FROM t1 WHERE c1 <  128 ORDER BY c1 DESC;
c1
127
126
0
0
0
0
0
SELECT * FROM t1 WHERE c1 <= 128 ORDER BY c1 DESC;
c1
128
128
127
126
0
0
0
0
0
SELECT * FROM t1 WHERE c1 =  128 ORDER BY c1 DESC;
c1
128
128
UPDATE t1
SET c1 = 128
WHERE c1 <= 0 + 0 AND c1 >= 0 - 0
ORDER BY c1 ASC
LIMIT 2;
SELECT * FROM t1 ORDER BY c1;
c1
0
0
0
126
127
128
128
128
128
129
130
255
DELETE FROM t1
WHERE c1 <= 0 + 0 AND c1 >= 0 - 0
ORDER BY c1;
SELECT * FROM t1 ORDER BY c1;
c1
126
127
128
128
128
128
129
130
255
DROP TABLE t1;
CREATE TABLE t1(c1 TINYINT UNSIGNED NULL, c2 TINYINT UNSIGNED NULL , INDEX(c1, c2));
INSERT INTO t1 VALUES
(0, 0),
(0, 0),
(0, 0),
(0, 0),
(0, 0),
(128, 128 - 2),
(128, 128 - 1),
(128, 128),
(128, 128),
(128, 128 + 1),
(128, 128 + 2),
(255, 255);
SELECT * FROM t1 WHERE c1 = 128 AND c2 > 128 ORDER BY c2 ASC;
c1	c2
128	129
128	130
SELECT * FROM t1 WHERE c1 = 128 AND c2 >= 128 ORDER BY c2 ASC;
c1	c2
128	128
128	128
128	129
128	130
SELECT * FROM t1 WHERE c1 = 128 AND c2 < 128 ORDER BY c2 ASC;
c1	c2
128	126
128	127
SELECT * FROM t1 WHERE c1 = 128 AND c2 <= 128 ORDER BY c2 ASC;
c1	c2
128	126
128	127
128	128
128	128
SELECT * FROM t1 WHERE c1 = 128 AND c2 > 128 ORDER BY c2 DESC;
c1	c2
128	130
128	129
SELECT * FROM t1 WHERE c1 = 128 AND c2 >= 128 ORDER BY c2 DESC;
c1	c2
128	130
128	129
128	128
128	128
SELECT * FROM t1 WHERE c1 = 128 AND c2 < 128 ORDER BY c2 DESC;
c1	c2
128	127
128	126
SELECT * FROM t1 WHERE c1 = 128 AND c2 <= 128 ORDER BY c2 DESC;
c1	c2
128	128
128	128
128	127
128	126
DROP TABLE t1;
DROP TABLE IF EXISTS t1;
CREATE TABLE t1(c1 TINYINT UNSIGNED NOT NULL , INDEX(c1));
INSERT INTO t1 VALUES
(0),
(0),
(0),
(0),
(0),
(128 - 2),
(128 - 1),
(128),
(128),
(128 + 1),
(128 + 2),
(255);
SELECT * FROM t1 ORDER BY c1 ASC;
c1
0
0
0
0
0
126
127
128
128
129
130
255
SELECT * FROM t1 ORDER BY c1 DESC;
c1
255
130
129
128
128
127
126
0
0
0
0
0
SELECT * FROM t1 WHERE c1 >  128 ORDER BY c1 ASC;
c1
129
130
255
SELECT * FROM t1 WHERE c1 >= 128 ORDER BY c1 ASC;
c1
128
128
129
130
255
SELECT * FROM t1 WHERE c1 <  128 ORDER BY c1 ASC;
c1
0
0
0
0
0
126
127
SELECT * FROM t1 WHERE c1 <= 128 ORDER BY c1 ASC;
c1
0
0
0
0
0
126
127
128
128
SELECT * FROM t1 WHERE c1 =  128 ORDER BY c1 ASC;
c1
128
128
SELECT * FROM t1 WHERE c1 >  128 ORDER BY c1 DESC;
c1
255
130
129
SELECT * FROM t1 WHERE c1 >= 128 ORDER BY c1 DESC;
c1
255
130
129
128
128
SELECT * FROM t1 WHERE c1 <  128 ORDER BY c1 DESC;
c1
127
126
0
0
0
0
0
SELECT * FROM t1 WHERE c1 <= 128 ORDER BY c1 DESC;
c1
128
128
127
126
0
0
0
0
0
SELECT * FROM t1 WHERE c1 =  128 ORDER BY c1 DESC;
c1
128
128
UPDATE t1
SET c1 = 128
WHERE c1 <= 0 + 0 AND c1 >= 0 - 0
ORDER BY c1 ASC
LIMIT 2;
SELECT * FROM t1 ORDER BY c1;
c1
0
0
0
126
127
128
128
128
128
129
130
255
DELETE FROM t1
WHERE c1 <= 0 + 0 AND c1 >= 0 - 0
ORDER BY c1;
SELECT * FROM t1 ORDER BY c1;
c1
126
127
128
128
128
128
129
130
255
DROP TABLE t1;
CREATE TABLE t1(c1 TINYINT UNSIGNED NOT NULL, c2 TINYINT UNSIGNED NOT NULL , INDEX(c1, c2));
INSERT INTO t1 VALUES
(0, 0),
(0, 0),
(0, 0),
(0, 0),
(0, 0),
(128, 128 - 2),
(128, 128 - 1),
(128, 128),
(128, 128),
(128, 128 + 1),
(128, 128 + 2),
(255, 255);
SELECT * FROM t1 WHERE c1 = 128 AND c2 > 128 ORDER BY c2 ASC;
c1	c2
128	129
128	130
SELECT * FROM t1 WHERE c1 = 128 AND c2 >= 128 ORDER BY c2 ASC;
c1	c2
128	128
128	128
128	129
128	130
SELECT * FROM t1 WHERE c1 = 128 AND c2 < 128 ORDER BY c2 ASC;
c1	c2
128	126
128	127
SELECT * FROM t1 WHERE c1 = 128 AND c2 <= 128 ORDER BY c2 ASC;
c1	c2
128	126
128	127
128	128
128	128
SELECT * FROM t1 WHERE c1 = 128 AND c2 > 128 ORDER BY c2 DESC;
c1	c2
128	130
128	129
SELECT * FROM t1 WHERE c1 = 128 AND c2 >= 128 ORDER BY c2 DESC;
c1	c2
128	130
128	129
128	128
128	128
SELECT * FROM t1 WHERE c1 = 128 AND c2 < 128 ORDER BY c2 DESC;
c1	c2
128	127
128	126
SELECT * FROM t1 WHERE c1 = 128 AND c2 <= 128 ORDER BY c2 DESC;
c1	c2
128	128
128	128
128	127
128	126
DROP TABLE t1;
DROP TABLE IF EXISTS t1;
CREATE TABLE t1(c1 TINYINT UNSIGNED NULL);
INSERT INTO t1 VALUES
(0),
(0),
(128),
(255),
(NULL),
(NULL),
(NULL),
(NULL);
SELECT * FROM t1 WHERE c1 IS     NULL ORDER BY c1 ASC;
c1
NULL
NULL
NULL
NULL
SELECT * FROM t1 WHERE c1 IS NOT NULL ORDER BY c1 DESC;
c1
255
128
0
0
SELECT * FROM t1 WHERE c1 IS     NULL ORDER BY c1 ASC;
c1
NULL
NULL
NULL
NULL
SELECT * FROM t1 WHERE c1 IS NOT NULL ORDER BY c1 DESC;
c1
255
128
0
0
UPDATE t1
SET c1 = 0
WHERE c1 IS NULL;
SELECT * FROM t1 ORDER BY c1;
c1
0
0
0
0
0
0
128
255
UPDATE t1
SET c1 = 0
WHERE c1 IS NULL
LIMIT 2;
SELECT * FROM t1 ORDER BY c1;
c1
0
0
0
0
0
0
128
255
DELETE FROM t1
WHERE c1 IS NULL
ORDER BY c1;
SELECT * FROM t1 ORDER BY c1;
c1
0
0
0
0
0
0
128
255
DROP TABLE t1;
CREATE TABLE t1(c1 TINYINT UNSIGNED NULL,
c2 TINYINT UNSIGNED NULL , INDEX(c1, c2));
INSERT INTO t1 VALUES
(0, 0),
(0, 0),
(0, 0),
(0, 0),
(0, 0),
(128, 128 - 2),
(128, 128 - 1),
(128, 128),
(128, 128),
(128, 128 + 1),
(128, 128 + 2),
(128, NULL),
(128, NULL),
(255, 255);
SELECT * FROM t1 WHERE c1 = 128 AND c2 > 128 ORDER BY c2 ASC;
c1	c2
128	129
128	130
SELECT * FROM t1 WHERE c1 = 128 AND c2 >= 128 ORDER BY c2 ASC;
c1	c2
128	128
128	128
128	129
128	130
SELECT * FROM t1 WHERE c1 = 128 AND c2 < 128 ORDER BY c2 ASC;
c1	c2
128	126
128	127
SELECT * FROM t1 WHERE c1 = 128 AND c2 <= 128 ORDER BY c2 ASC;
c1	c2
128	126
128	127
128	128
128	128
SELECT * FROM t1 WHERE c1 = 128 AND c2 is null ORDER BY c1 ASC;
c1	c2
128	NULL
128	NULL
SELECT * FROM t1 WHERE c1 = 128 AND c2 is not null ORDER BY c2 ASC;
c1	c2
128	126
128	127
128	128
128	128
128	129
128	130
SELECT * FROM t1 WHERE c1 = 128 AND c2 > 128 ORDER BY c2 DESC;
c1	c2
128	130
128	129
SELECT * FROM t1 WHERE c1 = 128 AND c2 >= 128 ORDER BY c2 DESC;
c1	c2
128	130
128	129
128	128
128	128
SELECT * FROM t1 WHERE c1 = 128 AND c2 < 128 ORDER BY c2 DESC;
c1	c2
128	127
128	126
SELECT * FROM t1 WHERE c1 = 128 AND c2 <= 128 ORDER BY c2 DESC;
c1	c2
128	128
128	128
128	127
128	126
SELECT * FROM t1 WHERE c1 = 128 AND c2 is null ORDER BY c1 DESC;
c1	c2
128	NULL
128	NULL
SELECT * FROM t1 WHERE c1 = 128 AND c2 is not null ORDER BY c2 DESC;
c1	c2
128	130
128	129
128	128
128	128
128	127
128	126
DROP TABLE t1;
DROP TABLE IF EXISTS t1;
CREATE TABLE t1(c1 TINYINT UNSIGNED NULL , INDEX(c1));
INSERT INTO t1 VALUES
(0),
(0),
(0),
(0),
(0),
(128 - 2),
(128 - 1),
(128),
(128),
(128 + 1),
(128 + 2),
(255);
SELECT * FROM t1 ORDER BY c1 ASC;
c1
0
0
0
0
0
126
127
128
128
129
130
255
SELECT * FROM t1 ORDER BY c1 DESC;
c1
255
130
129
128
128
127
126
0
0
0
0
0
SELECT * FROM t1 WHERE c1 >  128 ORDER BY c1 ASC;
c1
129
130
255
SELECT * FROM t1 WHERE c1 >= 128 ORDER BY c1 ASC;
c1
128
128
129
130
255
SELECT * FROM t1 WHERE c1 <  128 ORDER BY c1 ASC;
c1
0
0
0
0
0
126
127
SELECT * FROM t1 WHERE c1 <= 128 ORDER BY c1 ASC;
c1
0
0
0
0
0
126
127
128
128
SELECT * FROM t1 WHERE c1 =  128 ORDER BY c1 ASC;
c1
128
128
SELECT * FROM t1 WHERE c1 >  128 ORDER BY c1 DESC;
c1
255
130
129
SELECT * FROM t1 WHERE c1 >= 128 ORDER BY c1 DESC;
c1
255
130
129
128
128
SELECT * FROM t1 WHERE c1 <  128 ORDER BY c1 DESC;
c1
127
126
0
0
0
0
0
SELECT * FROM t1 WHERE c1 <= 128 ORDER BY c1 DESC;
c1
128
128
127
126
0
0
0
0
0
SELECT * FROM t1 WHERE c1 =  128 ORDER BY c1 DESC;
c1
128
128
UPDATE t1
SET c1 = 128
WHERE c1 <= 0 + 0 AND c1 >= 0 - 0
ORDER BY c1 ASC
LIMIT 2;
SELECT * FROM t1 ORDER BY c1;
c1
0
0
0
126
127
128
128
128
128
129
130
255
DELETE FROM t1
WHERE c1 <= 0 + 0 AND c1 >= 0 - 0
ORDER BY c1;
SELECT * FROM t1 ORDER BY c1;
c1
126
127
128
128
128
128
129
130
255
DROP TABLE t1;
CREATE TABLE t1(c1 TINYINT UNSIGNED NULL, c2 TINYINT UNSIGNED NULL , INDEX(c1, c2));
INSERT INTO t1 VALUES
(0, 0),
(0, 0),
(0, 0),
(0, 0),
(0, 0),
(128, 128 - 2),
(128, 128 - 1),
(128, 128),
(128, 128),
(128, 128 + 1),
(128, 128 + 2),
(255, 255);
SELECT * FROM t1 WHERE c1 = 128 AND c2 > 128 ORDER BY c2 ASC;
c1	c2
128	129
128	130
SELECT * FROM t1 WHERE c1 = 128 AND c2 >= 128 ORDER BY c2 ASC;
c1	c2
128	128
128	128
128	129
128	130
SELECT * FROM t1 WHERE c1 = 128 AND c2 < 128 ORDER BY c2 ASC;
c1	c2
128	126
128	127
SELECT * FROM t1 WHERE c1 = 128 AND c2 <= 128 ORDER BY c2 ASC;
c1	c2
128	126
128	127
128	128
128	128
SELECT * FROM t1 WHERE c1 = 128 AND c2 > 128 ORDER BY c2 DESC;
c1	c2
128	130
128	129
SELECT * FROM t1 WHERE c1 = 128 AND c2 >= 128 ORDER BY c2 DESC;
c1	c2
128	130
128	129
128	128
128	128
SELECT * FROM t1 WHERE c1 = 128 AND c2 < 128 ORDER BY c2 DESC;
c1	c2
128	127
128	126
SELECT * FROM t1 WHERE c1 = 128 AND c2 <= 128 ORDER BY c2 DESC;
c1	c2
128	128
128	128
128	127
128	126
DROP TABLE t1;
