DROP TABLE IF EXISTS t1,t2,t3,t4,t5,t6,t7,t8,t9,t10,t11,t12,t13,t14,t15,t16,t17,t18;
set names ascii;
select 'e'='`';
'e'='`'
0
select 'y'='~';
'y'='~'
0
CREATE TABLE t7(a CHAR(1));
insert into t7 (a) values (' '), ('a'), ('b'), ('c'), ('d'), ('e'), ('f'), ('g'), ('h'), ('i'), ('j'), ('k'), ('l'), ('m'), ('n'), ('o'), ('p'), ('q'), ('r'), ('s'), ('t'), ('u'), ('v'), ('w'), ('x'), ('y'), ('z'), ('A'), ('B'), ('C'), ('D'), ('E'), ('F'), ('G'), ('H'), ('I'), ('J'), ('K'), ('L'), ('M'), ('N'), ('O'), ('P'), ('Q'), ('R'), ('S'), ('T'), ('U'), ('V'), ('W'), ('X'), ('Y'), ('Z'), ('!'), ('@'), ('#'), ('$'), ('%'), ('^'), ('&'), ('*'), ('('), (')'), ('_'), ('+'), ('`'), ('~'), ('1'), ('2'), ('3'), ('4'), ('5'), ('6'), ('7'), ('8'), ('9'), ('0'), ('['), (']'), ('\\'), ('|'), ('}'), ('{'), ('"'), (':'), (''''), (';'), ('/'), ('.'), (','), ('?'), ('>'), ('<'), ('\n'), ('\t'), ('\a'), ('\f'), ('\v');
SELECT t7a.a, t7b.a FROM t7 as t7a, t7 as t7b WHERE t7a.a=t7b.a ORDER BY BINARY t7a.a, BINARY t7b.a;
a	a


	
	
			
!	!
"	"
#	#
$	$
%	%
&	&
'	'
(	(
)	)
*	*
+	+
,	,
.	.
/	/
0	0
1	1
2	2
3	3
4	4
5	5
6	6
7	7
8	8
9	9
:	:
;	;
<	<
>	>
?	?
@	@
A	A
B	B
C	C
D	D
E	E
F	F
G	G
H	H
I	I
J	J
K	K
L	L
M	M
N	N
O	O
P	P
Q	Q
R	R
S	S
T	T
U	U
V	V
W	W
X	X
Y	Y
Z	Z
[	[
\	\
]	]
^	^
_	_
`	`
a	a
a	a
a	a
a	a
b	b
c	c
d	d
e	e
f	f
f	f
f	f
f	f
g	g
h	h
i	i
j	j
k	k
l	l
m	m
n	n
o	o
p	p
q	q
r	r
s	s
t	t
u	u
v	v
v	v
v	v
v	v
w	w
x	x
y	y
z	z
{	{
|	|
}	}
~	~
UPDATE t7 SET a=CHAR(ASCII(a)+32) WHERE ASCII(a) >= 65 AND ASCII(a) <= 90;
UPDATE t7 SET a=CHAR(ASCII(a)-32) WHERE ASCII(a) >= 97 AND ASCII(a) <= 122;
SELECT a,HEX(a) FROM t7;
a	HEX(a)

	
		09
	0A
!	21
"	22
#	23
$	24
%	25
&	26
'	27
(	28
)	29
*	2A
+	2B
,	2C
.	2E
/	2F
0	30
1	31
2	32
3	33
4	34
5	35
6	36
7	37
8	38
9	39
:	3A
;	3B
<	3C
>	3E
?	3F
@	40
A	41
A	41
A	41
B	42
B	42
C	43
C	43
D	44
D	44
E	45
E	45
F	46
F	46
F	46
G	47
G	47
H	48
H	48
I	49
I	49
J	4A
J	4A
K	4B
K	4B
L	4C
L	4C
M	4D
M	4D
N	4E
N	4E
O	4F
O	4F
P	50
P	50
Q	51
Q	51
R	52
R	52
S	53
S	53
T	54
T	54
U	55
U	55
V	56
V	56
V	56
W	57
W	57
X	58
X	58
Y	59
Y	59
Z	5A
Z	5A
[	5B
\	5C
]	5D
^	5E
_	5F
`	60
{	7B
|	7C
}	7D
~	7E
CREATE TABLE t8 (a char(10) not null);
INSERT INTO t8 VALUES ('a'),('a\0'),('a\t'),('a ');
SELECT hex(a),STRCMP(a,'a'), STRCMP(a,'a ') FROM t8;
hex(a)	STRCMP(a,'a')	STRCMP(a,'a ')
61	0	0
61	0	0
6100	-1	-1
6109	-1	-1
DROP TABLE t8;
CREATE TABLE t8(a VARCHAR(255), KEY(a));
INSERT INTO t8 VALUES('uUABCDEFGHIGKLMNOPRSTUVWXYZbbbbbbbbbbbbbbbbbbbbbbbbbbbbbbbbbbbbbbbbbbbbbbbbbbbbbbbbbbbbbbbbbbbbbbbbbbbbbbbbbbbbbbbbbbbbbbbbbbbbbbbbbbbbbbbbbbbbbbbbbbbbbbbbbbbbbbbbbbbbbbbbbbbbbbbbbbbbbbbbbbbbbbbbbbbbbbbbbbbbbbbbbbbbbbbbbbbbbbbbbbbbbbbbbbbbbbbbbbbbbbbbbbb');
INSERT INTO t8 VALUES('uu');
INSERT INTO t8 VALUES('uU');
INSERT INTO t8 VALUES('uu');
INSERT INTO t8 VALUES('uuABC');
INSERT INTO t8 VALUES('UuABC');
INSERT INTO t8 VALUES('uuABC');
alter table t8 add b int;
INSERT INTO t8 VALUES('BCDEFGHIGKLMNOPRSTUVWXYZbbbbbbbbbbbbbbbbbbbbbbbbbbbbbbbbbbbbbbbbbbbbbbbbbbbbbbbbbbbbbbbbbbbbbbbbbbbbbbbbbbbbbbbbbbbbbbbbbbbbbbbbbbbbbbbbbbbbbbbbbbbbbbbbbbbbbbbbbbbbbbbbbbbbbbbbbbbbbbbbbbbbbbbbbbbbbbbbbbbbbbbbbbbbbbbbbbbbbbbbbbbbbbbbbbbbbbbbbbbbbbbbbbb',1);
INSERT INTO t8 VALUES('uuABCDEFGHIGKLMNOPRSTUVWXYZbbbbbbbbbbbbbbbbbbbbbbbbbbbbbbbbbbbbbbbbbbbbbbbbbbbbbbbbbbbbbbbbbbbbbbbbbbbbbbbbbbbbbbbbbbbbbbbbbbbbbbbbbbbbbbbbbbbbbbbbbbbbbbbbbbbbbbbbbbbbbbbbbbbbbbbbbbbbbbbbbbbbbbbbbbbbbbbbbbbbbbbbbbbbbbbbbbbbbbbbbbbbbbbbbbbbbbbbbbbbbbbbbbb',2);
delete from t8 where b=1;
INSERT INTO t8 VALUES('UUABCDEFGHIGKLMNOPRSTUVWXYZbbbbbbbbbbbbbbbbbbbbbbbbbbbbbbbbbbbbbbbbbbbbbbbbbbbbbbbbbbbbbbbbbbbbbbbbbbbbbbbbbbbbbbbbbbbbbbbbbbbbbbbbbbbbbbbbbbbbbbbbbbbbbbbbbbbbbbbbbbbbbbbbbbbbbbbbbbbbbbbbbbbbbbbbbbbbbbbbbbbbbbbbbbbbbbbbbbbbbbbbbbbbbbbbbbbbbbbbbbbbbbbbbbb',1);
INSERT INTO t8 VALUES('uuABCDEFGHIGKLMNOPRSTUVWXYZbbbbbbbbbbbbbbbbbbbbbbbbbbbbbbbbbbbbbbbbbbbbbbbbbbbbbbbbbbbbbbbbbbbbbbbbbbbbbbbbbbbbbbbbbbbbbbbbbbbbbbbbbbbbbbbbbbbbbbbbbbbbbbbbbbbbbbbbbbbbbbbbbbbbbbbbbbbbbbbbbbbbbbbbbbbbbbbbbbbbbbbbbbbbbbbbbbbbbbbbbbbbbbbbbbbbbbbbbbbbbbbbbbb',3);
INSERT INTO t8 VALUES('uuABCDEFGHIGKLMNOPRSTUVWXYZbbbbbbbbbbbbbbbbbbbbbbbbbbbbbbbbbbbbbbbbbbbbbbbbbbbbbbbbbbbbbbbbbbbbbbbbbbbbbbbbbbbbbbbbbbbbbbbbbbbbbbbbbbbbbbbbbbbbbbbbbbbbbbbbbbbbbbbbbbbbbbbbbbbbbbbbbbbbbbbbbbbbbbbbbbbbbbbbbbbbbbbbbbbbbbbbbbbbbbbbbbbbbbbbbbbbbbbbbbbbbbbbbbb',4);
delete from t8 where b=3;
INSERT INTO t8 VALUES('uUABCDEFGHIGKLMNOPRSTUVWXYZbbbbbbbbbbbbbbbbbbbbbbbbbbbbbbbbbbbbbbbbbbbbbbbbbbbbbbbbbbbbbbbbbbbbbbbbbbbbbbbbbbbbbbbbbbbbbbbbbbbbbbbbbbbbbbbbbbbbbbbbbbbbbbbbbbbbbbbbbbbbbbbbbbbbbbbbbbbbbbbbbbbbbbbbbbbbbbbbbbbbbbbbbbbbbbbbbbbbbbbbbbbbbbbbbbbbbbbbbbbbbbbbbbb',3);
UPDATE t8 SET a=REPEAT('Z',255) WHERE a LIKE 'uu%';
SELECT a,LENGTH(a) FROM t8;
a	LENGTH(a)
UUABCDEFGHIGKLMNOPRSTUVWXYZbbbbbbbbbbbbbbbbbbbbbbbbbbbbbbbbbbbbbbbbbbbbbbbbbbbbbbbbbbbbbbbbbbbbbbbbbbbbbbbbbbbbbbbbbbbbbbbbbbbbbbbbbbbbbbbbbbbbbbbbbbbbbbbbbbbbbbbbbbbbbbbbbbbbbbbbbbbbbbbbbbbbbbbbbbbbbbbbbbbbbbbbbbbbbbbbbbbbbbbbbbbbbbbbbbbbbbbbbbbbbbbbbbb	254
UuABC	5
ZZZZZZZZZZZZZZZZZZZZZZZZZZZZZZZZZZZZZZZZZZZZZZZZZZZZZZZZZZZZZZZZZZZZZZZZZZZZZZZZZZZZZZZZZZZZZZZZZZZZZZZZZZZZZZZZZZZZZZZZZZZZZZZZZZZZZZZZZZZZZZZZZZZZZZZZZZZZZZZZZZZZZZZZZZZZZZZZZZZZZZZZZZZZZZZZZZZZZZZZZZZZZZZZZZZZZZZZZZZZZZZZZZZZZZZZZZZZZZZZZZZZZZZZZZZZZZZ	255
ZZZZZZZZZZZZZZZZZZZZZZZZZZZZZZZZZZZZZZZZZZZZZZZZZZZZZZZZZZZZZZZZZZZZZZZZZZZZZZZZZZZZZZZZZZZZZZZZZZZZZZZZZZZZZZZZZZZZZZZZZZZZZZZZZZZZZZZZZZZZZZZZZZZZZZZZZZZZZZZZZZZZZZZZZZZZZZZZZZZZZZZZZZZZZZZZZZZZZZZZZZZZZZZZZZZZZZZZZZZZZZZZZZZZZZZZZZZZZZZZZZZZZZZZZZZZZZZ	255
ZZZZZZZZZZZZZZZZZZZZZZZZZZZZZZZZZZZZZZZZZZZZZZZZZZZZZZZZZZZZZZZZZZZZZZZZZZZZZZZZZZZZZZZZZZZZZZZZZZZZZZZZZZZZZZZZZZZZZZZZZZZZZZZZZZZZZZZZZZZZZZZZZZZZZZZZZZZZZZZZZZZZZZZZZZZZZZZZZZZZZZZZZZZZZZZZZZZZZZZZZZZZZZZZZZZZZZZZZZZZZZZZZZZZZZZZZZZZZZZZZZZZZZZZZZZZZZZ	255
ZZZZZZZZZZZZZZZZZZZZZZZZZZZZZZZZZZZZZZZZZZZZZZZZZZZZZZZZZZZZZZZZZZZZZZZZZZZZZZZZZZZZZZZZZZZZZZZZZZZZZZZZZZZZZZZZZZZZZZZZZZZZZZZZZZZZZZZZZZZZZZZZZZZZZZZZZZZZZZZZZZZZZZZZZZZZZZZZZZZZZZZZZZZZZZZZZZZZZZZZZZZZZZZZZZZZZZZZZZZZZZZZZZZZZZZZZZZZZZZZZZZZZZZZZZZZZZZ	255
ZZZZZZZZZZZZZZZZZZZZZZZZZZZZZZZZZZZZZZZZZZZZZZZZZZZZZZZZZZZZZZZZZZZZZZZZZZZZZZZZZZZZZZZZZZZZZZZZZZZZZZZZZZZZZZZZZZZZZZZZZZZZZZZZZZZZZZZZZZZZZZZZZZZZZZZZZZZZZZZZZZZZZZZZZZZZZZZZZZZZZZZZZZZZZZZZZZZZZZZZZZZZZZZZZZZZZZZZZZZZZZZZZZZZZZZZZZZZZZZZZZZZZZZZZZZZZZZ	255
ZZZZZZZZZZZZZZZZZZZZZZZZZZZZZZZZZZZZZZZZZZZZZZZZZZZZZZZZZZZZZZZZZZZZZZZZZZZZZZZZZZZZZZZZZZZZZZZZZZZZZZZZZZZZZZZZZZZZZZZZZZZZZZZZZZZZZZZZZZZZZZZZZZZZZZZZZZZZZZZZZZZZZZZZZZZZZZZZZZZZZZZZZZZZZZZZZZZZZZZZZZZZZZZZZZZZZZZZZZZZZZZZZZZZZZZZZZZZZZZZZZZZZZZZZZZZZZZ	255
uU	2
uUABCDEFGHIGKLMNOPRSTUVWXYZbbbbbbbbbbbbbbbbbbbbbbbbbbbbbbbbbbbbbbbbbbbbbbbbbbbbbbbbbbbbbbbbbbbbbbbbbbbbbbbbbbbbbbbbbbbbbbbbbbbbbbbbbbbbbbbbbbbbbbbbbbbbbbbbbbbbbbbbbbbbbbbbbbbbbbbbbbbbbbbbbbbbbbbbbbbbbbbbbbbbbbbbbbbbbbbbbbbbbbbbbbbbbbbbbbbbbbbbbbbbbbbbbbb	254
uUABCDEFGHIGKLMNOPRSTUVWXYZbbbbbbbbbbbbbbbbbbbbbbbbbbbbbbbbbbbbbbbbbbbbbbbbbbbbbbbbbbbbbbbbbbbbbbbbbbbbbbbbbbbbbbbbbbbbbbbbbbbbbbbbbbbbbbbbbbbbbbbbbbbbbbbbbbbbbbbbbbbbbbbbbbbbbbbbbbbbbbbbbbbbbbbbbbbbbbbbbbbbbbbbbbbbbbbbbbbbbbbbbbbbbbbbbbbbbbbbbbbbbbbbbbb	254
drop table t8;
CREATE TABLE t8 (c1 TEXT);
insert into t8 values (repeat('बांग्लादे',1200));
Warnings:
Warning	1366	Incorrect string value: '\xE0\xA4\xAC\xE0\xA4\xBE...' for column 'c1' at row 1
insert into t8 values ('রবীন্দ্রনাথ ঠাকুর');
Warnings:
Warning	1366	Incorrect string value: '\xE0\xA6\xB0\xE0\xA6\xAC...' for column 'c1' at row 1
insert into t8 values (LOAD_FILE('$MYSQLTEST_VARDIR/hindi.txt'));
ALTER TABLE t8 ADD c2 TEXT DEFAULT NULL;
INSERT INTO t8 values (repeat('রবীন্দ্রনাথ ঠাকুর',1300),'');
Warnings:
Warning	1366	Incorrect string value: '\xE0\xA6\xB0\xE0\xA6\xAC...' for column 'c1' at row 1
UPDATE t8 SET c2='यह हिन्दी में एक अलग वाक्य है. यह एक अलग कॉलम में जोड़ा जा रहा है' WHERE c2=NULL;
SELECT length(c1),c1, length(c2),c2 FROM t8;
length(c1)	c1	length(c2)	c2
32400	????????????????????????????????????????????????????????????????????????????????????????????????????????????????????????????????????????????????????????????????????????????????????????????????????????????????????????????????????????????????????????????????????????????????????????????????????????????????????????????????????????????????????????????????????????????????????????????????????????????????????????????????????????????????????????????????????????????????????????????????????????????????????????????????????????????????????????????????????????????????????????????????????????????????????????????????????????????????????????????????????????????????????????????????????????????????????????????????????????????????????????????????????????????????????????????????????????????????????????????????????????????????????????????????????????????????????????????????????????????????????????????????????????????????????????????????????????????????????????????????????????????????????????????????????????????????????????????????????????????????????????????????????????????????????????????????????????????????????????????????????????????????????????????????????????????????????????????????????????????????????????????????????????????????????????????????????????????????????????????????????????????????????????????????????????????????????????????????????????????????????????????????????????????????????????????????????????????????????????????????????????????????????????????????????????????????????????????????????????????????????????????????????????????????????????????????????????????????????????????????????????????????????????????????????????????????????????????????????????????????????????????????????????????????????????????????????????????????????????????????????????????????????????????????????????????????????????????????????????????????????????????????????????????????????????????????????????????????????????????????????????????????????????????????????????????????????????????????????????????????????????????????????????????????????????????????????????????????????????????????????????????????????????????????????????????????????????????????????????????????????????????????????????????????????????????????????????????????????????????????????????????????????????????????????????????????????????????????????????????????????????????????????????????????????????????????????????????????????????????????????????????????????????????????????????????????????????????????????????????????????????????????????????????????????????????????????????????????????????????????????????????????????????????????????????????????????????????????????????????????????????????????????????????????????????????????????????????????????????????????????????????????????????????????????????????????????????????????????????????????????????????????????????????????????????????????????????????????????????????????????????????????????????????????????????????????????????????????????????????????????????????????????????????????????????????????????????????????????????????????????????????????????????????????????????????????????????????????????????????????????????????????????????????????????????????????????????????????????????????????????????????????????????????????????????????????????????????????????????????????????????????????????????????????????????????????????????????????????????????????????????????????????????????????????????????????????????????????????????????????????????????????????????????????????????????????????????????????????????????????????????????????????????????????????????????????????????????????????????????????????????????????????????????????????????????????????????????????????????????????????????????????????????????????????????????????????????????????????????????????????????????????????????????????????????????????????????????????????????????????????????????????????????????????????????????????????????????????????????????????????????????????????????????????????????????????????????????????????????????????????????????????????????????????????????????????????????????????????????????????????????????????????????????????????????????????????????????????????????????????????????????????????????????????????????????????????????????????????????????????????????????????????????????????????????????????????????????????????????????????????????????????????????????????????????????????????????????????????????????????????????????????????????????????????????????????????????????????????????????????????????????????????????????????????????????????????????????????????????????????????????????????????????????????????????????????????????????????????????????????????????????????????????????????????????????????????????????????????????????????????????????????????????????????????????????????????????????????????????????????????????????????????????????????????????????????????????????????????????????????????????????????????????????????????????????????????????????????????????????????????????????????????????????????????????????????????????????????????????????????????????????????????????????????????????????????????????????????????????????????????????????????????????????????????????????????????????????????????????????????????????????????????????????????????????????????????????????????????????????????????????????????????????????????????????????????????????????????????????????????????????????????????????????????????????????????????????????????????????????????????????????????????????????????????????????????????????????????????????????????????????????????????????????????????????????????????????????????????????????????????????????????????????????????????????????????????????????????????????????????????????????????????????????????????????????????????????????????????????????????????????????????????????????????????????????????????????????????????????????????????????????????????????????????????????????????????????????????????????????????????????????????????????????????????????????????????????????????????????????????????????????????????????????????????????????????????????????????????????????????????????????????????????????????????????????????????????????????????????????????????????????????????????????????????????????????????????????????????????????????????????????????????????????????????????????????????????????????????????????????????????????????????????????????????????????????????????????????????????????????????????????????????????????????????????????????????????????????????????????????????????????????????????????????????????????????????????????????????????????????????????????????????????????????????????????????????????????????????????????????????????????????????????????????????????????????????????????????????????????????????????????????????????????????????????????????????????????????????????????????????????????????????????????????????????????????????????????????????????????????????????????????????????????????????????????????????????????????????????????????????????????????????????????????????????????????????????????????????????????????????????????????????????????????????????????????????????????????????????????????????????????????????????????????????????????????????????????????????????????????????????????????????????????????????????????????????????????????????????????????????????????????????????????????????????????????????????????????????????????????????????????????????????????????????????????????????????????????????????????????????????????????????????????????????????????????????????????????????????????????????????????????????????????????????????????????????????????????????????????????????????????????????????????????????????????????????????????????????????????????????????????????????????????????????????????????????????????????????????????????????????????????????????????????????????????????????????????????????????????????????????????????????????????????????????????????????????????????????????????????????????????????????????????????????????????????????????????????????????????????????????????????????????????????????????????????????????????????????????????????????????????????????????????????????????????????????????????????????????????????????????????????????????????????????????????????????????????????????????????????????????????????????????????????????????????????????????????????????????????????????????????????????????????????????????????????????????????????????????????????????????????????????????????????????????????????????????????????????????????????????????????????????????????????????????????????????????????????????????????????????????????????????????????????????????????????????????????????????????????????????????????????????????????????????????????????????????????????????????????????????????????????????????????????????????????????????????????????????????????????????????????????????????????????????????????????????????????????????????????????????????????????????????????????????????????????????????????????????????????????????????????????????????????????????????????????????????????????????????????????????????????????????????????????????????????????????????????????????????????????????????????????????????????????????????????????????????????????????????????????????????????????????????????????????????????????????????????????????????????????????????????????????????????????????????????????????????????????????????????????????????????????????????????????????????????????????????????????????????????????????????????????????????????????????????????????????????????????????????????????????????????????????????????????????????????????????????????????????????????????????????????????????????????????????????????????????????????????????????????????????????????????????????????????????????????????????????????????????????????????????????????????????????????????????????????????????????????????????????????????????????????????????????????????????????????????????????????????????????????????????????????????????????????????????????????????????????????????????????????????????????????????????????????????????????????????????????????????????????????????????????????????????????????????????????????????????????????????????????????????????????????????????????????????????????????????????????????????????????????????????????????????????????????????????????????????????????????????????????????????????????????????????????????????????????????????????????????????????????????????????????????????????????????????????????????????????????????????????????????????????????????????????????????????????????????????????????????????????????????????????????????????????????????????????????????????????????????????????????????????????????????????????????????????????????????????????????????????????????????????????????????????????????????????????????????????????????????????????????????????????????????????????????????????????????????????????????????????????????????????????????????????????????????????????????????????????????????????????????????????????????????????????????????????????????????????????????????????????????????????????????????????????????????????????????????????????????????????????????????????????????????????????????????????????????????????????????????????????????????????????????????????????????????????????????????????????????????????????????????????????????????????????????????????????????????????????????????????????????????????????????????????????????????????????????????????????????????????????????????????????????????????????????????????????????????????????????????????????????????????????????????????????????????????????????????????????????????????????????????????????????????????????????????????????????????????????????????????????????????????????????????????????????????????????????????????????????????????????????????????????????????????????????????????????????????????????????????????????????????????????????????????????????????????????????????????????????????????????????????????????????????????????????????????????????????????????????????????????????????????????????????????????????????????????????????????????????????????????????????????????????????????????????????????????????????????????????????????????????????????????????????????????????????????????????????????????????????????????????????????????????????????????????????????????????????????????????????????????????????????????????????????????????????????????????????????????????????????????????????????????????????????????????????????????????????????????????????????????????????????????????????????????????????????????????????????????????????????????????????????????????????????????????????????????????????????????????????????????????????????????????????????????????????????????????????????????????????????????????????????????????????????????????????????????????????????????????????????????????????????????????????????????????????????????????????????????????????????????????????????????????????????????????????????????????????????????????????????????????????????????????????????????????????????????????????????????????????????????????????????????????????????????????????????????????????????????????????????????????????????????????????????????????????????????????????????????????????????????????????????????????????????????????????????????????????????????????????????????????????????????????????????????????????????????????????????????????????????????????????????????????????????????????????????????????????????????????????????????????????????????????????????????????????????????????????????????????????????????????????????????????????????????????????????????????????????????????????????????????????????????????????????????????????????????????????????????????????????????????????????????????????????????????????????????????????????????????????????????????????????????????????????????????????????????????????????????????????????????????????????????????????????????????????????????????????????????????????????????????????????????????????????????????????????????????????????????????????????????????????????????????????????????????????????????????????????????????????????????????????????????????????????????????????????????????????????????????????????????????????????????????????????????????????????????????????????????????????????????????????????????????????????????????????????????????????????????????????????????????????????????????????????????????????????????????????????????????????????????????????????????????????????????????????????????????????????????????????????????????????????????????????????????????????????????????????????????????????????????????????????????????????????????????????????????????????????????????????????????????????????????????????????????????????????????????????????????????????????????????????????????????????????????????????????????????????????????????????????????????????????????????????????????????????????????????????????????????????????????????????????????????????????????????????????????????????????????????????????????????????????????????????????????????????????????????????????????????????????????????????????????????????????????????????????????????????????????????????????????????????????????????????????????????????????????????????????????????????????????????????????????????????????????????????????????????????????????????????????????????????????????????????????????????????????????????????????????????????????????????????????????????????????????????????????????????????????????????????????????????????????????????????????????????????????????????????????????????????????????????????????????????????????????????????????????????????????????????????????????????????????????????????????????????????????????????????????????????????????????????????????????????????????????????????????????????????????????????????????????????????????????????????????????????????????????????????????????????????????????????????????????????????????????????????????????????????????????????????????????????????????????????????????????????????????????????????????????????????????????????????????????????????????????????????????????????????????????????????????????????????????????????????????????????????????????????????????????????????????????????????????????????????????????????????????????????????????????????????????????????????????????????????????????????????????????????????????????????????????????????????????????????????????????????????????????????????????????????????????????????????????????????????????????????????????????????????????????????????????????????????????????????????????????????????????????????????????????????????????????????????????????????????????????????????????????????????????????????????????????????????????????????????????????????????????????????????????????????????????????????????????????????????????????????????????????????????????????????????????????????????????????????????????????????????????????????????????????????????????????????????????????????????????????????????????????????????????????????????????????????????????????????????????????????????????????????????????????????????????????????????????????????????????????????????????????????????????????????????????????????????????????????????????????????????????????????????????????????????????????????????????????????????????????????????????????????????????????????????????????????????????????????????????????????????????????????????????????????????????????????????????????????????????????????????????????????????????????????????????????????????????????????????????????????????????????????????????????????????????????????????????????????????????????????????????????????????????????????????????????????????????????????????????????????????????????????????????????????????????????????????????????????????????????????????????????????????????????????????????????????????????????????????????????????????????????????????????????????????????????????????????????????????????????????????????????????????????????????????????????????????????????????????????????????????????????????????????????????????????????????????????????????????????????????????????????????????????????????????????????????????????????????????????????????????????????????????????????????????????????????????????????????????????????????????????????????????????????????????????????????????????????????????????????????????????????????????????????????????????????????????????????????????????????????????????????????????????????????????????????????????????????????????????????????????????????????????????????????????????????????????????????????????????????????????????????????????????????????????????????????????????????????????????????????????????????????????????????????????????????????????????????????????????????????????????????????????????????????????????????????????????????????????????????????????????????????????????????????????????????????????????????????????????????????????????????????????????????????????????????????????????????????????????????????????????????????????????????????????????????????????????????????????????????????????????????????????????????????????????????????????????????????????????????????????????????????????????????????????????????????????????????????????????????????????????????????????????????????????????????????????????????????????????????????????????????????????????????????????????????????????????????????????????????????????????????????????????????????????????????????????????????????????????????????????????????????????????????????????????????????????????????????????????????????????????????????????????????????????????????????????????????????????????????????????????????????????????????????????????????????????????????????????????????????????????????????????????????????????????????????????????????????????????????????????????????????????????????????????????????????????????????????????????????????????????????????????????????????????????????????????????????????????????????????????????????????????????????????????????????????????????????????????????????????????????????????????????????????????????????????????????????????????????????????????????????????????????????????????????????????????????????????????????????????????????????????????????????????????????????????????????????????????????????????????????????????????????????????????????????????????????????????????????????????????????????????????????????????????????????????????????????????????????????????????????????????????????????????????????????????????????????????????????????????????????????????????????????????????????????????????????????????????????????????????????????????????????????????????????????????????????????????????????????????????????????????????????????????????????????????????????????????????????????????????????????????????????????????????????????????????????????????????????????????????????????????????????????????????????????????????????????????????????????????????????????????????????????????????????????????????????????????????????????????????????????????????????????????????????????????????????????????????????????????????????????????????????????????????????????????????????????????????????????????????????????????????????????????????????????????????????????????????????????????????????????????????????????????????????????????????????????????????????????????????????????????????????????????????????????????????????????????????????????????????????????????????????????????????????????????????????????????????????????????????????????????????????????????????????????????????????????????????????????????????????????????????????????????????????????????????????????????????????????????????????????????????????????????????????????????????????????????????????????????????????????????????????????????????????????????????????????????????????????????????????????????????????????????????????????????????????????????????????????????????????????????????????????????????????????????????????????????????????????????????????????????????????????????????????????????????????????????????????????????????????????????????????????????????????????????????????????????????????????????????????????????????????????????????????????????????????????????????????????????????????????????????????????????????????????????????????????????????????????????????????????????????????????????????????????????????????????????????????????????????????????????????????????????????????????????????????????????????????????????????????????????????????????????????????????????????????????????????????????????????????????????????????????????????????????????????????????????????????????????????????????????????????????????????????????????????????????????????????????????????????????????????????????????????????????????????????????????????????????????????????????????????????????????????????????????????????????????????????????????????????????????????????????????????????????????????????????????????????????????????????????????????????????????????????????????????????????????????????????????????????????????????????????????????????????????????????????????????????????????????????????????????????????????????????????????????????????????????????????????????????????????????????????????????????????????????????????????????????????????????????????????????????????????????????????????????????????????????????????????????????????????????????????????????????????????????????????????????????????????????????????????????????????????????????????????????????????????????????????????????????????????????????????????????????????????????????????????????????????????????????????????????????????????????????????????????????????????????????????????????????????????????????????????????????????????????????????????????????????????????????????????????????????????????????????????????????????????????????????????????????????????????????????????????????????????????????????????????????????????????????????????????????????????????????????????????????????????????????????????????????????????????????????????????????????????????????????????????????????????????????????????????????????????????????????????????????????????????????????????????????????????????????????????????????????????????????????????????????????????????????????????????????????????????????????????????????????????????????????????????????????????????????????????????????????????????????????????????????????????????????????????????????????????????????????????????????????????????????????????????????????????????????????????????????????????????????????????????????????????????????????????????????????????????????????????????????????????????????????????????????????????????????????????????????????????????????????????????????????????????????????????????????????????????????????????????????????????????????????????????????????????????????????????????????????????????????????????????????????????????????????????????????????????????????????????????????????????????????????????????????????????????????????????????????????????????????????????????????????????????????????????????????????????????????????????????????????????????????????????????????????????????????????????????????????????????????????????????????????????????????????????????????????????????????????????????????????????????????????????????????????????????????????????????????????????????????????????????????????????????????????????????????????????????????????????????????????????????????????????????????????????????????????????????????????????????????????????????????????????????????????????????????????????????????????????????????????????????????????????????????????????????????????????????????????????????????????????????????????????????????????????????????????????????????????????????????????????????????????????????????????????????????????????????????????????????????????????????????????????????????????????????????????????????????????????????????????????????????????????????????????????????????????????????????????????????????????????????????????????????????????????????????????????????????????????????????????????????????????????????????????????????????????????????????????????????????????????????????????????????????????????????????????????????????????????????????????????????????????????????????????????????????????????????????????????????????????????????????????????????????????????????????????????????????????????????????????????????????????????????????????????????????????????????????????????????????????????????????????????????????????????????????????????????????????????????????????????????????????????????????????????????????????????????????????????????????????????????????????????????????????????????????????????????????????????????????????????????????????????????????????????????????????????????????????????????????????????????????????????????????????????????????????????????????????????????????????????????????????????????????????????????????????????????????????????????????????????????????????????????????????????????????????????????????????????????????????????????????????????????????????????????????????????????????????????????????????????????????????????????????????????????????????????????????????????????????????????????????????????????????????????????????????????????????????????????????????????????????????????????????????????????????????????????????????????????????????????????????????????????????????????????????????????????????????????????????????????????????????????????????????????????????????????????????????????????????????????????????????????????????????????????????????????????????????????????????????????????????????????????????????????????????????????????????????????????????????????????????????????????????????????????????????????????????????????????????????????????????????????????????????????????????????????????????????????????????????????????????????????????????????????????????????????????????????????????????????????????????????????????????????????????????????????????????????????????????????????????????????????????????????????????????????????????????????????????????????????????????????????????????????????????????????????????????????????????????????????????????????????????????????????????????????????????????????????????????????????????????????????????????????????????????????????????????????????????????????????????????????????????????????????????????????????????????????????????????????????????????????????????????????????????????????????????????????????????????????????????????????????????????????????????????????????????????????????????????????????????????????????????????????????????????????????????????????????????????????????????????????????????????????????????????????????????????????????????????????????????????????????????????????????????????????????????????????????????????????????????????????????????????????????????????????????????????????????????????????????????????????????????????????????????????????????????????????????????????????????????????????????????????????????????????????????????????????????????????????????????????????????????????????????????????????????????????????????????????????????????????????????????????????????????????????????????????????????????????????????????????????????????????????????????????????????????????????????????????????????????????????????????????????????????????????????????????????????????????????????????????????????????????????????????????????????????????????????????????????????????????????????????????????????????????????????????????????????????????????????????????????????????????????????????????????????????????????????????????????????????????????????????????????????????????????????????????????????????????????????????????????????????????????????????????????????????????????????????????????????????????????????????????????????????????????????????????????????????????????????????????????????????????????????????????????????????????????????????????????????????????????????????????????????????????????????????????????????????????????????????????????????????????????????????????????????????????????????????????????????????????????????????????????????????????????????????????????????????????????????????????????????????????????????????????????????????????????????????????????????????????????????????????????????????????????????????????????????????????????????????????????????????????????????????????????????????????????????????????????????????????????????????????????????????????????????????????????????????????????????????????????????????????????????????????????????????????????????????????????????????????????????????????????????????????????????????????????????????????????????????????????????????????????????????????????????????????????????????????????????????????????????????????????????????????????????????????????????????????????????????????????????????????????????????????????????????????????????????????????????????????????????????????????????????????????????????????????????????????????????????????????????????????????????????????????????????????????????????????????????????????????????????????????????????????????????????????????????????????????????????????????????????????????????????????????????????????????????????????????????????????????????????????????????????????????????????????????????????????????????????????????????????????????????????????????????????????????????????????????????????????????????????????????????????????????????????????????????????????????????????????????????????????????????????????????????????????????????????????????????????????????????????????????????????????????????????????????????????????????????????????????????????????????????????????????????????????????????????????????????????????????????????????????????????????????????????????????????????????????????????????????????????????????????????????????????????????????????????????????????????????????????????????????????????????????????????????????????????????????????????????????????????????????????????????????????????????????????????????????????????????????????????????????????????????????????????????????????????????????????????????????????????????????????????????????????????????????????????????????????????????????????????????????????????????????????????????????????????????????????????????????????????????????????????????????????????????????????????????????????????????????????????????????????????????????????????????????????????????????????????????????????????????????????????????????????????????????????????????????????????????????????????????????????????????????????????????????????????????	NULL	NULL
49	????????????????????????????????? ???????????????	NULL	NULL
63700	????????????????????????????????? ???????????????????????????????????????????????? ???????????????????????????????????????????????? ???????????????????????????????????????????????? ???????????????????????????????????????????????? ???????????????????????????????????????????????? ???????????????????????????????????????????????? ???????????????????????????????????????????????? ???????????????????????????????????????????????? ???????????????????????????????????????????????? ???????????????????????????????????????????????? ???????????????????????????????????????????????? ???????????????????????????????????????????????? ???????????????????????????????????????????????? ???????????????????????????????????????????????? ???????????????????????????????????????????????? ???????????????????????????????????????????????? ???????????????????????????????????????????????? ???????????????????????????????????????????????? ???????????????????????????????????????????????? ???????????????????????????????????????????????? ???????????????????????????????????????????????? ???????????????????????????????????????????????? ???????????????????????????????????????????????? ???????????????????????????????????????????????? ???????????????????????????????????????????????? ???????????????????????????????????????????????? ???????????????????????????????????????????????? ???????????????????????????????????????????????? ???????????????????????????????????????????????? ???????????????????????????????????????????????? ???????????????????????????????????????????????? ???????????????????????????????????????????????? ???????????????????????????????????????????????? ???????????????????????????????????????????????? ???????????????????????????????????????????????? ???????????????????????????????????????????????? ???????????????????????????????????????????????? ???????????????????????????????????????????????? ???????????????????????????????????????????????? ???????????????????????????????????????????????? ???????????????????????????????????????????????? ???????????????????????????????????????????????? ???????????????????????????????????????????????? ???????????????????????????????????????????????? ???????????????????????????????????????????????? ???????????????????????????????????????????????? ???????????????????????????????????????????????? ???????????????????????????????????????????????? ???????????????????????????????????????????????? ???????????????????????????????????????????????? ???????????????????????????????????????????????? ???????????????????????????????????????????????? ???????????????????????????????????????????????? ???????????????????????????????????????????????? ???????????????????????????????????????????????? ???????????????????????????????????????????????? ???????????????????????????????????????????????? ???????????????????????????????????????????????? ???????????????????????????????????????????????? ???????????????????????????????????????????????? ???????????????????????????????????????????????? ???????????????????????????????????????????????? ???????????????????????????????????????????????? ???????????????????????????????????????????????? ???????????????????????????????????????????????? ???????????????????????????????????????????????? ???????????????????????????????????????????????? ???????????????????????????????????????????????? ???????????????????????????????????????????????? ???????????????????????????????????????????????? ???????????????????????????????????????????????? ???????????????????????????????????????????????? ???????????????????????????????????????????????? ???????????????????????????????????????????????? ???????????????????????????????????????????????? ???????????????????????????????????????????????? ???????????????????????????????????????????????? ???????????????????????????????????????????????? ???????????????????????????????????????????????? ???????????????????????????????????????????????? ???????????????????????????????????????????????? ???????????????????????????????????????????????? ???????????????????????????????????????????????? ???????????????????????????????????????????????? ???????????????????????????????????????????????? ???????????????????????????????????????????????? ???????????????????????????????????????????????? ???????????????????????????????????????????????? ???????????????????????????????????????????????? ???????????????????????????????????????????????? ???????????????????????????????????????????????? ???????????????????????????????????????????????? ???????????????????????????????????????????????? ???????????????????????????????????????????????? ???????????????????????????????????????????????? ???????????????????????????????????????????????? ???????????????????????????????????????????????? ???????????????????????????????????????????????? ???????????????????????????????????????????????? ???????????????????????????????????????????????? ???????????????????????????????????????????????? ???????????????????????????????????????????????? ???????????????????????????????????????????????? ???????????????????????????????????????????????? ???????????????????????????????????????????????? ???????????????????????????????????????????????? ???????????????????????????????????????????????? ???????????????????????????????????????????????? ???????????????????????????????????????????????? ???????????????????????????????????????????????? ???????????????????????????????????????????????? ???????????????????????????????????????????????? ???????????????????????????????????????????????? ???????????????????????????????????????????????? ???????????????????????????????????????????????? ???????????????????????????????????????????????? ???????????????????????????????????????????????? ???????????????????????????????????????????????? ???????????????????????????????????????????????? ???????????????????????????????????????????????? ???????????????????????????????????????????????? ???????????????????????????????????????????????? ???????????????????????????????????????????????? ???????????????????????????????????????????????? ???????????????????????????????????????????????? ???????????????????????????????????????????????? ???????????????????????????????????????????????? ???????????????????????????????????????????????? ???????????????????????????????????????????????? ???????????????????????????????????????????????? ???????????????????????????????????????????????? ???????????????????????????????????????????????? ???????????????????????????????????????????????? ???????????????????????????????????????????????? ???????????????????????????????????????????????? ???????????????????????????????????????????????? ???????????????????????????????????????????????? ???????????????????????????????????????????????? ???????????????????????????????????????????????? ???????????????????????????????????????????????? ???????????????????????????????????????????????? ???????????????????????????????????????????????? ???????????????????????????????????????????????? ???????????????????????????????????????????????? ???????????????????????????????????????????????? ???????????????????????????????????????????????? ???????????????????????????????????????????????? ???????????????????????????????????????????????? ???????????????????????????????????????????????? ???????????????????????????????????????????????? ???????????????????????????????????????????????? ???????????????????????????????????????????????? ???????????????????????????????????????????????? ???????????????????????????????????????????????? ???????????????????????????????????????????????? ???????????????????????????????????????????????? ???????????????????????????????????????????????? ???????????????????????????????????????????????? ???????????????????????????????????????????????? ???????????????????????????????????????????????? ???????????????????????????????????????????????? ???????????????????????????????????????????????? ???????????????????????????????????????????????? ???????????????????????????????????????????????? ???????????????????????????????????????????????? ???????????????????????????????????????????????? ???????????????????????????????????????????????? ???????????????????????????????????????????????? ???????????????????????????????????????????????? ???????????????????????????????????????????????? ???????????????????????????????????????????????? ???????????????????????????????????????????????? ???????????????????????????????????????????????? ???????????????????????????????????????????????? ???????????????????????????????????????????????? ???????????????????????????????????????????????? ???????????????????????????????????????????????? ???????????????????????????????????????????????? ???????????????????????????????????????????????? ???????????????????????????????????????????????? ???????????????????????????????????????????????? ???????????????????????????????????????????????? ???????????????????????????????????????????????? ???????????????????????????????????????????????? ???????????????????????????????????????????????? ???????????????????????????????????????????????? ???????????????????????????????????????????????? ???????????????????????????????????????????????? ???????????????????????????????????????????????? ???????????????????????????????????????????????? ???????????????????????????????????????????????? ???????????????????????????????????????????????? ???????????????????????????????????????????????? ???????????????????????????????????????????????? ???????????????????????????????????????????????? ???????????????????????????????????????????????? ???????????????????????????????????????????????? ???????????????????????????????????????????????? ???????????????????????????????????????????????? ???????????????????????????????????????????????? ???????????????????????????????????????????????? ???????????????????????????????????????????????? ???????????????????????????????????????????????? ???????????????????????????????????????????????? ???????????????????????????????????????????????? ???????????????????????????????????????????????? ???????????????????????????????????????????????? ???????????????????????????????????????????????? ???????????????????????????????????????????????? ???????????????????????????????????????????????? ???????????????????????????????????????????????? ???????????????????????????????????????????????? ???????????????????????????????????????????????? ???????????????????????????????????????????????? ???????????????????????????????????????????????? ???????????????????????????????????????????????? ???????????????????????????????????????????????? ???????????????????????????????????????????????? ???????????????????????????????????????????????? ???????????????????????????????????????????????? ???????????????????????????????????????????????? ???????????????????????????????????????????????? ???????????????????????????????????????????????? ???????????????????????????????????????????????? ???????????????????????????????????????????????? ???????????????????????????????????????????????? ???????????????????????????????????????????????? ???????????????????????????????????????????????? ???????????????????????????????????????????????? ???????????????????????????????????????????????? ???????????????????????????????????????????????? ???????????????????????????????????????????????? ???????????????????????????????????????????????? ???????????????????????????????????????????????? ???????????????????????????????????????????????? ???????????????????????????????????????????????? ???????????????????????????????????????????????? ???????????????????????????????????????????????? ???????????????????????????????????????????????? ???????????????????????????????????????????????? ???????????????????????????????????????????????? ???????????????????????????????????????????????? ???????????????????????????????????????????????? ???????????????????????????????????????????????? ???????????????????????????????????????????????? ???????????????????????????????????????????????? ???????????????????????????????????????????????? ???????????????????????????????????????????????? ???????????????????????????????????????????????? ???????????????????????????????????????????????? ???????????????????????????????????????????????? ???????????????????????????????????????????????? ???????????????????????????????????????????????? ???????????????????????????????????????????????? ???????????????????????????????????????????????? ???????????????????????????????????????????????? ???????????????????????????????????????????????? ???????????????????????????????????????????????? ???????????????????????????????????????????????? ???????????????????????????????????????????????? ???????????????????????????????????????????????? ???????????????????????????????????????????????? ???????????????????????????????????????????????? ???????????????????????????????????????????????? ???????????????????????????????????????????????? ???????????????????????????????????????????????? ???????????????????????????????????????????????? ???????????????????????????????????????????????? ???????????????????????????????????????????????? ???????????????????????????????????????????????? ???????????????????????????????????????????????? ???????????????????????????????????????????????? ???????????????????????????????????????????????? ???????????????????????????????????????????????? ???????????????????????????????????????????????? ???????????????????????????????????????????????? ???????????????????????????????????????????????? ???????????????????????????????????????????????? ???????????????????????????????????????????????? ???????????????????????????????????????????????? ???????????????????????????????????????????????? ???????????????????????????????????????????????? ???????????????????????????????????????????????? ???????????????????????????????????????????????? ???????????????????????????????????????????????? ???????????????????????????????????????????????? ???????????????????????????????????????????????? ???????????????????????????????????????????????? ???????????????????????????????????????????????? ???????????????????????????????????????????????? ???????????????????????????????????????????????? ???????????????????????????????????????????????? ???????????????????????????????????????????????? ???????????????????????????????????????????????? ???????????????????????????????????????????????? ???????????????????????????????????????????????? ???????????????????????????????????????????????? ???????????????????????????????????????????????? ???????????????????????????????????????????????? ???????????????????????????????????????????????? ???????????????????????????????????????????????? ???????????????????????????????????????????????? ???????????????????????????????????????????????? ???????????????????????????????????????????????? ???????????????????????????????????????????????? ???????????????????????????????????????????????? ???????????????????????????????????????????????? ???????????????????????????????????????????????? ???????????????????????????????????????????????? ???????????????????????????????????????????????? ???????????????????????????????????????????????? ???????????????????????????????????????????????? ???????????????????????????????????????????????? ???????????????????????????????????????????????? ???????????????????????????????????????????????? ???????????????????????????????????????????????? ???????????????????????????????????????????????? ???????????????????????????????????????????????? ???????????????????????????????????????????????? ???????????????????????????????????????????????? ???????????????????????????????????????????????? ???????????????????????????????????????????????? ???????????????????????????????????????????????? ???????????????????????????????????????????????? ???????????????????????????????????????????????? ???????????????????????????????????????????????? ???????????????????????????????????????????????? ???????????????????????????????????????????????? ???????????????????????????????????????????????? ???????????????????????????????????????????????? ???????????????????????????????????????????????? ???????????????????????????????????????????????? ???????????????????????????????????????????????? ???????????????????????????????????????????????? ???????????????????????????????????????????????? ???????????????????????????????????????????????? ???????????????????????????????????????????????? ???????????????????????????????????????????????? ???????????????????????????????????????????????? ???????????????????????????????????????????????? ???????????????????????????????????????????????? ???????????????????????????????????????????????? ???????????????????????????????????????????????? ???????????????????????????????????????????????? ???????????????????????????????????????????????? ???????????????????????????????????????????????? ???????????????????????????????????????????????? ???????????????????????????????????????????????? ???????????????????????????????????????????????? ???????????????????????????????????????????????? ???????????????????????????????????????????????? ???????????????????????????????????????????????? ???????????????????????????????????????????????? ???????????????????????????????????????????????? ???????????????????????????????????????????????? ???????????????????????????????????????????????? ???????????????????????????????????????????????? ???????????????????????????????????????????????? ???????????????????????????????????????????????? ???????????????????????????????????????????????? ???????????????????????????????????????????????? ???????????????????????????????????????????????? ???????????????????????????????????????????????? ???????????????????????????????????????????????? ???????????????????????????????????????????????? ???????????????????????????????????????????????? ???????????????????????????????????????????????? ???????????????????????????????????????????????? ???????????????????????????????????????????????? ???????????????????????????????????????????????? ???????????????????????????????????????????????? ???????????????????????????????????????????????? ???????????????????????????????????????????????? ???????????????????????????????????????????????? ???????????????????????????????????????????????? ???????????????????????????????????????????????? ???????????????????????????????????????????????? ???????????????????????????????????????????????? ???????????????????????????????????????????????? ???????????????????????????????????????????????? ???????????????????????????????????????????????? ???????????????????????????????????????????????? ???????????????????????????????????????????????? ???????????????????????????????????????????????? ???????????????????????????????????????????????? ???????????????????????????????????????????????? ???????????????????????????????????????????????? ???????????????????????????????????????????????? ???????????????????????????????????????????????? ???????????????????????????????????????????????? ???????????????????????????????????????????????? ???????????????????????????????????????????????? ???????????????????????????????????????????????? ???????????????????????????????????????????????? ???????????????????????????????????????????????? ???????????????????????????????????????????????? ???????????????????????????????????????????????? ???????????????????????????????????????????????? ???????????????????????????????????????????????? ???????????????????????????????????????????????? ???????????????????????????????????????????????? ???????????????????????????????????????????????? ???????????????????????????????????????????????? ???????????????????????????????????????????????? ???????????????????????????????????????????????? ???????????????????????????????????????????????? ???????????????????????????????????????????????? ???????????????????????????????????????????????? ???????????????????????????????????????????????? ???????????????????????????????????????????????? ???????????????????????????????????????????????? ???????????????????????????????????????????????? ???????????????????????????????????????????????? ???????????????????????????????????????????????? ???????????????????????????????????????????????? ???????????????????????????????????????????????? ???????????????????????????????????????????????? ???????????????????????????????????????????????? ???????????????????????????????????????????????? ???????????????????????????????????????????????? ???????????????????????????????????????????????? ???????????????????????????????????????????????? ???????????????????????????????????????????????? ???????????????????????????????????????????????? ???????????????????????????????????????????????? ???????????????????????????????????????????????? ???????????????????????????????????????????????? ???????????????????????????????????????????????? ???????????????????????????????????????????????? ???????????????????????????????????????????????? ???????????????????????????????????????????????? ???????????????????????????????????????????????? ???????????????????????????????????????????????? ???????????????????????????????????????????????? ???????????????????????????????????????????????? ???????????????????????????????????????????????? ???????????????????????????????????????????????? ???????????????????????????????????????????????? ???????????????????????????????????????????????? ???????????????????????????????????????????????? ???????????????????????????????????????????????? ???????????????????????????????????????????????? ???????????????????????????????????????????????? ???????????????????????????????????????????????? ???????????????????????????????????????????????? ???????????????????????????????????????????????? ???????????????????????????????????????????????? ???????????????????????????????????????????????? ???????????????????????????????????????????????? ???????????????????????????????????????????????? ???????????????????????????????????????????????? ???????????????????????????????????????????????? ???????????????????????????????????????????????? ???????????????????????????????????????????????? ???????????????????????????????????????????????? ???????????????????????????????????????????????? ???????????????????????????????????????????????? ???????????????????????????????????????????????? ???????????????????????????????????????????????? ???????????????????????????????????????????????? ???????????????????????????????????????????????? ???????????????????????????????????????????????? ???????????????????????????????????????????????? ???????????????????????????????????????????????? ???????????????????????????????????????????????? ???????????????????????????????????????????????? ???????????????????????????????????????????????? ???????????????????????????????????????????????? ???????????????????????????????????????????????? ???????????????????????????????????????????????? ???????????????????????????????????????????????? ???????????????????????????????????????????????? ???????????????????????????????????????????????? ???????????????????????????????????????????????? ???????????????????????????????????????????????? ???????????????????????????????????????????????? ???????????????????????????????????????????????? ???????????????????????????????????????????????? ???????????????????????????????????????????????? ???????????????????????????????????????????????? ???????????????????????????????????????????????? ???????????????????????????????????????????????? ???????????????????????????????????????????????? ???????????????????????????????????????????????? ???????????????????????????????????????????????? ???????????????????????????????????????????????? ???????????????????????????????????????????????? ???????????????????????????????????????????????? ???????????????????????????????????????????????? ???????????????????????????????????????????????? ???????????????????????????????????????????????? ???????????????????????????????????????????????? ???????????????????????????????????????????????? ???????????????????????????????????????????????? ???????????????????????????????????????????????? ???????????????????????????????????????????????? ???????????????????????????????????????????????? ???????????????????????????????????????????????? ???????????????????????????????????????????????? ???????????????????????????????????????????????? ???????????????????????????????????????????????? ???????????????????????????????????????????????? ???????????????????????????????????????????????? ???????????????????????????????????????????????? ???????????????????????????????????????????????? ???????????????????????????????????????????????? ???????????????????????????????????????????????? ???????????????????????????????????????????????? ???????????????????????????????????????????????? ???????????????????????????????????????????????? ???????????????????????????????????????????????? ???????????????????????????????????????????????? ???????????????????????????????????????????????? ???????????????????????????????????????????????? ???????????????????????????????????????????????? ???????????????????????????????????????????????? ???????????????????????????????????????????????? ???????????????????????????????????????????????? ???????????????????????????????????????????????? ???????????????????????????????????????????????? ???????????????????????????????????????????????? ???????????????????????????????????????????????? ???????????????????????????????????????????????? ???????????????????????????????????????????????? ???????????????????????????????????????????????? ???????????????????????????????????????????????? ???????????????????????????????????????????????? ???????????????????????????????????????????????? ???????????????????????????????????????????????? ???????????????????????????????????????????????? ???????????????????????????????????????????????? ???????????????????????????????????????????????? ???????????????????????????????????????????????? ???????????????????????????????????????????????? ???????????????????????????????????????????????? ???????????????????????????????????????????????? ???????????????????????????????????????????????? ???????????????????????????????????????????????? ???????????????????????????????????????????????? ???????????????????????????????????????????????? ???????????????????????????????????????????????? ???????????????????????????????????????????????? ???????????????????????????????????????????????? ???????????????????????????????????????????????? ???????????????????????????????????????????????? ???????????????????????????????????????????????? ???????????????????????????????????????????????? ???????????????????????????????????????????????? ???????????????????????????????????????????????? ???????????????????????????????????????????????? ???????????????????????????????????????????????? ???????????????????????????????????????????????? ???????????????????????????????????????????????? ???????????????????????????????????????????????? ???????????????????????????????????????????????? ???????????????????????????????????????????????? ???????????????????????????????????????????????? ???????????????????????????????????????????????? ???????????????????????????????????????????????? ???????????????????????????????????????????????? ???????????????????????????????????????????????? ???????????????????????????????????????????????? ???????????????????????????????????????????????? ???????????????????????????????????????????????? ???????????????????????????????????????????????? ???????????????????????????????????????????????? ???????????????????????????????????????????????? ???????????????????????????????????????????????? ???????????????????????????????????????????????? ???????????????????????????????????????????????? ???????????????????????????????????????????????? ???????????????????????????????????????????????? ???????????????????????????????????????????????? ???????????????????????????????????????????????? ???????????????????????????????????????????????? ???????????????????????????????????????????????? ???????????????????????????????????????????????? ???????????????????????????????????????????????? ???????????????????????????????????????????????? ???????????????????????????????????????????????? ???????????????????????????????????????????????? ???????????????????????????????????????????????? ???????????????????????????????????????????????? ???????????????????????????????????????????????? ???????????????????????????????????????????????? ???????????????????????????????????????????????? ???????????????????????????????????????????????? ???????????????????????????????????????????????? ???????????????????????????????????????????????? ???????????????????????????????????????????????? ???????????????????????????????????????????????? ???????????????????????????????????????????????? ???????????????????????????????????????????????? ???????????????????????????????????????????????? ???????????????????????????????????????????????? ???????????????????????????????????????????????? ???????????????????????????????????????????????? ???????????????????????????????????????????????? ???????????????????????????????????????????????? ???????????????????????????????????????????????? ???????????????????????????????????????????????? ???????????????????????????????????????????????? ???????????????????????????????????????????????? ???????????????????????????????????????????????? ???????????????????????????????????????????????? ???????????????????????????????????????????????? ???????????????????????????????????????????????? ???????????????????????????????????????????????? ???????????????????????????????????????????????? ???????????????????????????????????????????????? ???????????????????????????????????????????????? ???????????????????????????????????????????????? ???????????????????????????????????????????????? ???????????????????????????????????????????????? ???????????????????????????????????????????????? ???????????????????????????????????????????????? ???????????????????????????????????????????????? ???????????????????????????????????????????????? ???????????????????????????????????????????????? ???????????????????????????????????????????????? ???????????????????????????????????????????????? ???????????????????????????????????????????????? ???????????????????????????????????????????????? ???????????????????????????????????????????????? ???????????????????????????????????????????????? ???????????????????????????????????????????????? ???????????????????????????????????????????????? ???????????????????????????????????????????????? ???????????????????????????????????????????????? ???????????????????????????????????????????????? ???????????????????????????????????????????????? ???????????????????????????????????????????????? ???????????????????????????????????????????????? ???????????????????????????????????????????????? ???????????????????????????????????????????????? ???????????????????????????????????????????????? ???????????????????????????????????????????????? ???????????????????????????????????????????????? ???????????????????????????????????????????????? ???????????????????????????????????????????????? ???????????????????????????????????????????????? ???????????????????????????????????????????????? ???????????????????????????????????????????????? ???????????????????????????????????????????????? ???????????????????????????????????????????????? ???????????????????????????????????????????????? ???????????????????????????????????????????????? ???????????????????????????????????????????????? ???????????????????????????????????????????????? ???????????????????????????????????????????????? ???????????????????????????????????????????????? ???????????????????????????????????????????????? ???????????????????????????????????????????????? ???????????????????????????????????????????????? ???????????????????????????????????????????????? ???????????????????????????????????????????????? ???????????????????????????????????????????????? ???????????????????????????????????????????????? ???????????????????????????????????????????????? ???????????????????????????????????????????????? ???????????????????????????????????????????????? ???????????????????????????????????????????????? ???????????????????????????????????????????????? ???????????????????????????????????????????????? ???????????????????????????????????????????????? ???????????????????????????????????????????????? ???????????????????????????????????????????????? ???????????????????????????????????????????????? ???????????????????????????????????????????????? ???????????????????????????????????????????????? ???????????????????????????????????????????????? ???????????????????????????????????????????????? ???????????????????????????????????????????????? ???????????????????????????????????????????????? ???????????????????????????????????????????????? ???????????????????????????????????????????????? ???????????????????????????????????????????????? ???????????????????????????????????????????????? ???????????????????????????????????????????????? ???????????????????????????????????????????????? ???????????????????????????????????????????????? ???????????????????????????????????????????????? ???????????????????????????????????????????????? ???????????????????????????????????????????????? ???????????????????????????????????????????????? ???????????????????????????????????????????????? ???????????????????????????????????????????????? ???????????????????????????????????????????????? ???????????????????????????????????????????????? ???????????????????????????????????????????????? ???????????????????????????????????????????????? ???????????????????????????????????????????????? ???????????????????????????????????????????????? ???????????????????????????????????????????????? ???????????????????????????????????????????????? ???????????????????????????????????????????????? ???????????????????????????????????????????????? ???????????????????????????????????????????????? ???????????????????????????????????????????????? ???????????????????????????????????????????????? ???????????????????????????????????????????????? ???????????????????????????????????????????????? ???????????????????????????????????????????????? ???????????????????????????????????????????????? ???????????????????????????????????????????????? ???????????????????????????????????????????????? ???????????????????????????????????????????????? ???????????????????????????????????????????????? ???????????????????????????????????????????????? ???????????????????????????????????????????????? ???????????????????????????????????????????????? ???????????????????????????????????????????????? ???????????????????????????????????????????????? ???????????????????????????????????????????????? ???????????????????????????????????????????????? ???????????????????????????????????????????????? ???????????????????????????????????????????????? ???????????????????????????????????????????????? ???????????????????????????????????????????????? ???????????????????????????????????????????????? ???????????????????????????????????????????????? ???????????????????????????????????????????????? ???????????????????????????????????????????????? ???????????????????????????????????????????????? ???????????????????????????????????????????????? ???????????????????????????????????????????????? ???????????????????????????????????????????????? ???????????????????????????????????????????????? ???????????????????????????????????????????????? ???????????????????????????????????????????????? ???????????????????????????????????????????????? ???????????????????????????????????????????????? ???????????????????????????????????????????????? ???????????????????????????????????????????????? ???????????????????????????????????????????????? ???????????????????????????????????????????????? ???????????????????????????????????????????????? ???????????????????????????????????????????????? ???????????????????????????????????????????????? ???????????????????????????????????????????????? ???????????????????????????????????????????????? ???????????????????????????????????????????????? ???????????????????????????????????????????????? ???????????????????????????????????????????????? ???????????????????????????????????????????????? ???????????????????????????????????????????????? ???????????????????????????????????????????????? ???????????????????????????????????????????????? ???????????????????????????????????????????????? ???????????????????????????????????????????????? ???????????????????????????????????????????????? ???????????????????????????????????????????????? ???????????????????????????????????????????????? ???????????????????????????????????????????????? ???????????????????????????????????????????????? ???????????????????????????????????????????????? ???????????????????????????????????????????????? ???????????????????????????????????????????????? ???????????????????????????????????????????????? ???????????????????????????????????????????????? ???????????????????????????????????????????????? ???????????????????????????????????????????????? ???????????????????????????????????????????????? ???????????????????????????????????????????????? ???????????????????????????????????????????????? ???????????????????????????????????????????????? ???????????????????????????????????????????????? ???????????????????????????????????????????????? ???????????????????????????????????????????????? ???????????????????????????????????????????????? ???????????????????????????????????????????????? ???????????????????????????????????????????????? ???????????????????????????????????????????????? ???????????????????????????????????????????????? ???????????????????????????????????????????????? ???????????????????????????????????????????????? ???????????????????????????????????????????????? ???????????????????????????????????????????????? ???????????????????????????????????????????????? ???????????????????????????????????????????????? ???????????????????????????????????????????????? ???????????????????????????????????????????????? ???????????????????????????????????????????????? ???????????????????????????????????????????????? ???????????????????????????????????????????????? ???????????????????????????????????????????????? ???????????????????????????????????????????????? ???????????????????????????????????????????????? ???????????????????????????????????????????????? ???????????????????????????????????????????????? ???????????????????????????????????????????????? ???????????????????????????????????????????????? ???????????????????????????????????????????????? ???????????????????????????????????????????????? ???????????????????????????????????????????????? ???????????????????????????????????????????????? ???????????????????????????????????????????????? ???????????????????????????????????????????????? ???????????????????????????????????????????????? ???????????????????????????????????????????????? ???????????????????????????????????????????????? ???????????????????????????????????????????????? ???????????????????????????????????????????????? ???????????????????????????????????????????????? ???????????????????????????????????????????????? ???????????????????????????????????????????????? ???????????????????????????????????????????????? ???????????????????????????????????????????????? ???????????????????????????????????????????????? ???????????????????????????????????????????????? ???????????????????????????????????????????????? ???????????????????????????????????????????????? ???????????????????????????????????????????????? ???????????????????????????????????????????????? ???????????????????????????????????????????????? ???????????????????????????????????????????????? ???????????????????????????????????????????????? ???????????????????????????????????????????????? ???????????????????????????????????????????????? ???????????????????????????????????????????????? ???????????????????????????????????????????????? ???????????????????????????????????????????????? ???????????????????????????????????????????????? ???????????????????????????????????????????????? ???????????????????????????????????????????????? ???????????????????????????????????????????????? ???????????????????????????????????????????????? ???????????????????????????????????????????????? ???????????????????????????????????????????????? ???????????????????????????????????????????????? ???????????????????????????????????????????????? ???????????????????????????????????????????????? ???????????????????????????????????????????????? ???????????????????????????????????????????????? ???????????????????????????????????????????????? ???????????????????????????????????????????????? ???????????????????????????????????????????????? ???????????????????????????????????????????????? ???????????????????????????????????????????????? ???????????????????????????????????????????????? ???????????????????????????????????????????????? ???????????????????????????????????????????????? ???????????????????????????????????????????????? ???????????????????????????????????????????????? ???????????????????????????????????????????????? ???????????????????????????????????????????????? ???????????????????????????????????????????????? ???????????????????????????????????????????????? ???????????????????????????????????????????????? ???????????????????????????????????????????????? ???????????????????????????????????????????????? ???????????????????????????????????????????????? ???????????????????????????????????????????????? ???????????????????????????????????????????????? ???????????????????????????????????????????????? ???????????????????????????????????????????????? ???????????????????????????????????????????????? ???????????????????????????????????????????????? ???????????????????????????????????????????????? ???????????????????????????????????????????????? ???????????????????????????????????????????????? ???????????????????????????????????????????????? ???????????????????????????????????????????????? ???????????????????????????????????????????????? ???????????????????????????????????????????????? ???????????????????????????????????????????????? ???????????????????????????????????????????????? ???????????????????????????????????????????????? ???????????????????????????????????????????????? ???????????????????????????????????????????????? ???????????????????????????????????????????????? ???????????????????????????????????????????????? ???????????????????????????????????????????????? ???????????????????????????????????????????????? ???????????????????????????????????????????????? ???????????????????????????????????????????????? ???????????????????????????????????????????????? ???????????????????????????????????????????????? ???????????????????????????????????????????????? ???????????????????????????????????????????????? ???????????????????????????????????????????????? ???????????????????????????????????????????????? ???????????????????????????????????????????????? ???????????????????????????????????????????????? ???????????????????????????????????????????????? ???????????????????????????????????????????????? ???????????????????????????????????????????????? ???????????????????????????????????????????????? ???????????????????????????????????????????????? ???????????????????????????????????????????????? ???????????????????????????????????????????????? ???????????????????????????????????????????????? ???????????????????????????????????????????????? ???????????????????????????????????????????????? ???????????????????????????????????????????????? ???????????????????????????????????????????????? ???????????????????????????????????????????????? ???????????????????????????????????????????????? ???????????????????????????????????????????????? ???????????????????????????????????????????????? ???????????????????????????????????????????????? ???????????????????????????????????????????????? ???????????????????????????????????????????????? ???????????????????????????????????????????????? ???????????????????????????????????????????????? ???????????????????????????????????????????????? ???????????????????????????????????????????????? ???????????????????????????????????????????????? ???????????????????????????????????????????????? ???????????????????????????????????????????????? ???????????????????????????????????????????????? ???????????????????????????????????????????????? ???????????????????????????????????????????????? ???????????????????????????????????????????????? ???????????????????????????????????????????????? ???????????????????????????????????????????????? ???????????????????????????????????????????????? ???????????????????????????????????????????????? ???????????????????????????????????????????????? ???????????????????????????????????????????????? ???????????????????????????????????????????????? ???????????????????????????????????????????????? ???????????????????????????????????????????????? ???????????????????????????????????????????????? ???????????????????????????????????????????????? ???????????????????????????????????????????????? ???????????????????????????????????????????????? ???????????????????????????????????????????????? ???????????????????????????????????????????????? ???????????????????????????????????????????????? ???????????????????????????????????????????????? ???????????????????????????????????????????????? ???????????????????????????????????????????????? ???????????????????????????????????????????????? ???????????????????????????????????????????????? ???????????????????????????????????????????????? ???????????????????????????????????????????????? ???????????????????????????????????????????????? ???????????????????????????????????????????????? ???????????????????????????????????????????????? ???????????????????????????????????????????????? ???????????????????????????????????????????????? ???????????????????????????????????????????????? ???????????????????????????????????????????????? ???????????????????????????????????????????????? ???????????????????????????????????????????????? ???????????????????????????????????????????????? ???????????????????????????????????????????????? ???????????????????????????????????????????????? ???????????????????????????????????????????????? ???????????????????????????????????????????????? ???????????????????????????????????????????????? ???????????????????????????????????????????????? ???????????????????????????????????????????????? ???????????????????????????????????????????????? ???????????????????????????????????????????????? ???????????????????????????????????????????????? ???????????????????????????????????????????????? ???????????????????????????????????????????????? ???????????????????????????????????????????????? ???????????????????????????????????????????????? ???????????????????????????????????????????????? ???????????????????????????????????????????????? ???????????????????????????????????????????????? ???????????????????????????????????????????????? ???????????????????????????????????????????????? ???????????????????????????????????????????????? ???????????????????????????????????????????????? ???????????????????????????????????????????????? ???????????????????????????????????????????????? ???????????????????????????????????????????????? ???????????????????????????????????????????????? ???????????????????????????????????????????????? ???????????????????????????????????????????????? ???????????????????????????????????????????????? ???????????????????????????????????????????????? ???????????????????????????????????????????????? ???????????????????????????????????????????????? ???????????????????????????????????????????????? ???????????????????????????????????????????????? ???????????????????????????????????????????????? ???????????????????????????????????????????????? ???????????????????????????????????????????????? ???????????????????????????????????????????????? ???????????????????????????????????????????????? ???????????????????????????????????????????????? ???????????????????????????????????????????????? ???????????????????????????????????????????????? ???????????????????????????????????????????????? ???????????????????????????????????????????????? ???????????????????????????????????????????????? ???????????????????????????????????????????????? ???????????????????????????????????????????????? ???????????????????????????????????????????????? ???????????????????????????????????????????????? ???????????????????????????????????????????????? ???????????????????????????????????????????????? ???????????????????????????????????????????????? ???????????????????????????????????????????????? ???????????????????????????????????????????????? ???????????????????????????????????????????????? ???????????????????????????????????????????????? ???????????????????????????????????????????????? ???????????????????????????????????????????????? ???????????????????????????????????????????????? ???????????????????????????????????????????????? ???????????????????????????????????????????????? ???????????????????????????????????????????????? ???????????????????????????????????????????????? ???????????????????????????????????????????????? ???????????????????????????????????????????????? ???????????????????????????????????????????????? ???????????????????????????????????????????????? ???????????????????????????????????????????????? ???????????????????????????????????????????????? ???????????????????????????????????????????????? ???????????????????????????????????????????????? ???????????????????????????????????????????????? ???????????????????????????????????????????????? ???????????????????????????????????????????????? ???????????????????????????????????????????????? ???????????????????????????????????????????????? ???????????????????????????????????????????????? ???????????????????????????????????????????????? ???????????????????????????????????????????????? ???????????????????????????????????????????????? ???????????????????????????????????????????????? ???????????????????????????????????????????????? ???????????????????????????????????????????????? ???????????????????????????????????????????????? ???????????????????????????????????????????????? ???????????????????????????????????????????????? ???????????????????????????????????????????????? ???????????????????????????????????????????????? ???????????????????????????????????????????????? ???????????????????????????????????????????????? ???????????????????????????????????????????????? ???????????????????????????????????????????????? ???????????????????????????????????????????????? ???????????????????????????????????????????????? ???????????????????????????????????????????????? ???????????????????????????????????????????????? ???????????????????????????????????????????????? ???????????????????????????????????????????????? ???????????????????????????????????????????????? ???????????????????????????????????????????????? ???????????????????????????????????????????????? ???????????????????????????????????????????????? ???????????????????????????????????????????????? ???????????????????????????????????????????????? ???????????????????????????????????????????????? ???????????????????????????????????????????????? ???????????????????????????????????????????????? ???????????????????????????????????????????????? ???????????????????????????????????????????????? ???????????????????????????????????????????????? ???????????????????????????????????????????????? ???????????????????????????????????????????????? ???????????????????????????????????????????????? ???????????????????????????????????????????????? ???????????????????????????????????????????????? ???????????????????????????????????????????????? ???????????????????????????????????????????????? ???????????????????????????????????????????????? ???????????????????????????????????????????????? ???????????????????????????????????????????????? ???????????????????????????????????????????????? ???????????????????????????????????????????????? ???????????????????????????????????????????????? ???????????????????????????????????????????????? ???????????????????????????????????????????????? ???????????????????????????????????????????????? ???????????????????????????????????????????????? ???????????????????????????????????????????????? ???????????????????????????????????????????????? ???????????????????????????????????????????????? ???????????????????????????????????????????????? ???????????????????????????????????????????????? ???????????????????????????????????????????????? ???????????????????????????????????????????????? ???????????????????????????????????????????????? ???????????????????????????????????????????????? ???????????????????????????????????????????????? ???????????????????????????????????????????????? ???????????????????????????????????????????????? ???????????????????????????????????????????????? ???????????????????????????????????????????????? ???????????????????????????????????????????????? ???????????????????????????????????????????????? ???????????????????????????????????????????????? ???????????????????????????????????????????????? ???????????????????????????????????????????????? ???????????????????????????????????????????????? ???????????????????????????????????????????????? ???????????????????????????????????????????????? ???????????????????????????????????????????????? ???????????????????????????????????????????????? ???????????????????????????????????????????????? ???????????????????????????????????????????????? ???????????????????????????????????????????????? ???????????????????????????????????????????????? ???????????????????????????????????????????????? ???????????????????????????????????????????????? ???????????????????????????????????????????????? ???????????????????????????????????????????????? ???????????????????????????????????????????????? ???????????????????????????????????????????????? ???????????????????????????????????????????????? ???????????????????????????????????????????????? ???????????????????????????????????????????????? ???????????????????????????????????????????????? ???????????????????????????????????????????????? ???????????????????????????????????????????????? ???????????????????????????????????????????????? ???????????????????????????????????????????????? ???????????????????????????????????????????????? ???????????????????????????????????????????????? ???????????????????????????????????????????????? ???????????????????????????????????????????????? ???????????????????????????????????????????????? ???????????????????????????????????????????????? ???????????????????????????????????????????????? ???????????????????????????????????????????????? ???????????????????????????????????????????????? ???????????????????????????????????????????????? ???????????????????????????????????????????????? ???????????????????????????????????????????????? ???????????????????????????????????????????????? ???????????????????????????????????????????????? ???????????????????????????????????????????????? ???????????????????????????????????????????????? ???????????????????????????????????????????????? ???????????????????????????????????????????????? ???????????????????????????????????????????????? ???????????????????????????????????????????????? ???????????????????????????????????????????????? ???????????????????????????????????????????????? ???????????????????????????????????????????????? ???????????????????????????????????????????????? ???????????????????????????????????????????????? ???????????????????????????????????????????????? ???????????????????????????????????????????????? ???????????????????????????????????????????????? ???????????????????????????????????????????????? ???????????????????????????????????????????????? ???????????????????????????????????????????????? ???????????????????????????????????????????????? ???????????????????????????????????????????????? ???????????????????????????????????????????????? ???????????????????????????????????????????????? ???????????????????????????????????????????????? ???????????????????????????????????????????????? ???????????????????????????????????????????????? ???????????????????????????????????????????????? ???????????????????????????????????????????????? ???????????????????????????????????????????????? ???????????????????????????????????????????????? ???????????????????????????????????????????????? ???????????????????????????????????????????????? ???????????????????????????????????????????????? ???????????????????????????????????????????????? ???????????????????????????????????????????????? ???????????????????????????????????????????????? ???????????????????????????????????????????????? ???????????????????????????????????????????????? ???????????????????????????????????????????????? ???????????????????????????????????????????????? ???????????????????????????????????????????????? ???????????????????????????????????????????????? ???????????????????????????????????????????????? ???????????????????????????????????????????????? ???????????????????????????????????????????????? ???????????????????????????????????????????????? ???????????????????????????????????????????????? ???????????????????????????????????????????????? ???????????????????????????????????????????????? ???????????????????????????????????????????????? ???????????????????????????????????????????????? ???????????????????????????????????????????????? ???????????????????????????????????????????????? ???????????????????????????????????????????????? ???????????????????????????????????????????????? ???????????????????????????????????????????????? ???????????????????????????????????????????????? ???????????????????????????????????????????????? ???????????????????????????????????????????????? ???????????????????????????????????????????????? ???????????????????????????????????????????????? ???????????????????????????????????????????????? ???????????????????????????????????????????????? ???????????????????????????????????????????????? ???????????????????????????????????????????????? ???????????????????????????????????????????????? ???????????????????????????????????????????????? ???????????????????????????????????????????????? ???????????????????????????????????????????????? ???????????????????????????????????????????????? ???????????????????????????????????????????????? ???????????????????????????????????????????????? ???????????????????????????????????????????????? ???????????????????????????????????????????????? ???????????????????????????????????????????????? ???????????????????????????????????????????????? ???????????????????????????????????????????????? ???????????????????????????????????????????????? ???????????????????????????????????????????????? ???????????????????????????????????????????????? ???????????????????????????????????????????????? ???????????????????????????????????????????????? ???????????????????????????????????????????????? ???????????????????????????????????????????????? ???????????????????????????????????????????????? ???????????????????????????????????????????????? ???????????????????????????????????????????????? ???????????????????????????????????????????????? ???????????????????????????????????????????????? ???????????????????????????????????????????????? ???????????????????????????????????????????????? ???????????????????????????????????????????????? ???????????????????????????????????????????????? ???????????????????????????????????????????????? ???????????????????????????????????????????????? ???????????????????????????????????????????????? ???????????????????????????????????????????????? ???????????????????????????????????????????????? ???????????????????????????????????????????????? ???????????????????????????????????????????????? ???????????????????????????????????????????????? ???????????????????????????????????????????????? ???????????????????????????????????????????????? ???????????????????????????????????????????????? ???????????????????????????????????????????????? ???????????????????????????????????????????????? ???????????????????????????????????????????????? ???????????????????????????????????????????????? ???????????????????????????????????????????????? ???????????????????????????????????????????????? ???????????????????????????????????????????????? ???????????????????????????????????????????????? ???????????????????????????????????????????????? ???????????????????????????????????????????????? ???????????????????????????????????????????????? ???????????????????????????????????????????????? ???????????????????????????????????????????????? ???????????????????????????????????????????????? ???????????????????????????????????????????????? ???????????????????????????????????????????????? ???????????????????????????????????????????????? ???????????????????????????????????????????????? ???????????????????????????????????????????????? ???????????????????????????????????????????????? ???????????????????????????????????????????????? ???????????????????????????????????????????????? ???????????????????????????????????????????????? ???????????????????????????????????????????????? ???????????????????????????????????????????????? ???????????????????????????????????????????????? ???????????????????????????????????????????????? ???????????????????????????????????????????????? ???????????????????????????????????????????????? ???????????????????????????????????????????????? ???????????????????????????????????????????????? ???????????????????????????????????????????????? ???????????????????????????????????????????????? ???????????????????????????????????????????????? ???????????????????????????????????????????????? ???????????????????????????????????????????????? ???????????????????????????????????????????????? ???????????????????????????????????????????????? ???????????????????????????????????????????????? ???????????????????????????????????????????????? ???????????????????????????????????????????????? ???????????????????????????????????????????????? ???????????????????????????????????????????????? ???????????????????????????????????????????????? ???????????????????????????????????????????????? ???????????????????????????????????????????????? ???????????????????????????????????????????????? ???????????????????????????????????????????????? ???????????????????????????????????????????????? ???????????????????????????????????????????????? ???????????????????????????????????????????????? ???????????????????????????????????????????????? ???????????????????????????????????????????????? ???????????????????????????????????????????????? ???????????????????????????????????????????????? ???????????????????????????????????????????????? ???????????????????????????????????????????????? ???????????????????????????????????????????????? ???????????????????????????????????????????????? ???????????????????????????????????????????????? ???????????????????????????????????????????????? ???????????????????????????????????????????????? ???????????????????????????????????????????????? ???????????????????????????????????????????????? ???????????????????????????????????????????????? ???????????????????????????????????????????????? ???????????????????????????????????????????????? ???????????????????????????????????????????????? ???????????????	0	
NULL	NULL	NULL	NULL
SELECT length(c1),c1, length(c2),c2 FROM t8 WHERE c1 LIKE _utf8 'রবীন%' ;
length(c1)	c1	length(c2)	c2
SELECT length(c1),c1, length(c2),c2 FROM t8 WHERE c1  LIKE _utf8 'রবীন%' COLLATE utf8_bin OR c2 LIKE _utf8 'जग' COLLATE utf8_bin;
length(c1)	c1	length(c2)	c2
UPDATE t8 SET c1= REPEAT('৯',12000);
Warnings:
Warning	1366	Incorrect string value: '\xE0\xA7\xAF\xE0\xA7\xAF...' for column 'c1' at row 1
Warning	1366	Incorrect string value: '\xE0\xA7\xAF\xE0\xA7\xAF...' for column 'c1' at row 2
Warning	1366	Incorrect string value: '\xE0\xA7\xAF\xE0\xA7\xAF...' for column 'c1' at row 3
Warning	1366	Incorrect string value: '\xE0\xA7\xAF\xE0\xA7\xAF...' for column 'c1' at row 4
SELECT length(c1),length(c2) FROM t8;
length(c1)	length(c2)
36000	0
36000	NULL
36000	NULL
36000	NULL
DROP TABLE t8;
DROP TABLE IF EXISTS t1,t2,t3,t4,t5,t6,t7,t8,t9,t10,t11,t12,t13,t14,t15,t16,t17,t18;
